A1: State | B1: % In | C1: Gore | D1: Bush | E1: EV | F1: Gore | G1: Bush
A2: ALABAMA | B2: 99 | C2: 699815 | D2: 944155 | E2: 9 | F2: =ROUND(($E2*$C2)/($C2+$D2),0) -> 4 | G2: =ROUND(($E2*$D2)/($C2+$D2),0) -> 5
A3: ALASKA | B3: 87 | C3: 61203 | D3: 131664 | E3: 3 | F3: =ROUND(($E3*$C3)/($C3+$D3),0) -> 1 | G3: =ROUND(($E3*$D3)/($C3+$D3),0) -> 2
A4: ARIZONA | B4: 100 | C4: 609779 | D4: 673555 | E4: 8 | F4: =ROUND(($E4*$C4)/($C4+$D4),0) -> 4 | G4: =ROUND(($E4*$D4)/($C4+$D4),0) -> 4
A5: ARKANSAS | B5: 100 | C5: 421136 | D5: 471800 | E5: 6 | F5: =ROUND(($E5*$C5)/($C5+$D5),0) -> 3 | G5: =ROUND(($E5*$D5)/($C5+$D5),0) -> 3
A6: CALIFORNIA | B6: 100 | C6: 5255027 | D6: 4055623 | E6: 54 | F6: =ROUND(($E6*$C6)/($C6+$D6),0) -> 30 | G6: =ROUND(($E6*$D6)/($C6+$D6),0) -> 24
A7: COLORADO | B7: 99 | C7: 738718 | D7: 885147 | E7: 8 | F7: =ROUND(($E7*$C7)/($C7+$D7),0) -> 4 | G7: =ROUND(($E7*$D7)/($C7+$D7),0) -> 4
A8: CONNECTICUT | B8: 100 | C8: 807820 | D8: 578296 | E8: 8 | F8: =ROUND(($E8*$C8)/($C8+$D8),0) -> 5 | G8: =ROUND(($E8*$D8)/($C8+$D8),0) -> 3
A9: D.C. | B9: 100 | C9: 162004 | D9: 17020 | E9: 3 | F9: =ROUND(($E9*$C9)/($C9+$D9),0) -> 3 | G9: =ROUND(($E9*$D9)/($C9+$D9),0) -> 0
A10: DELAWARE | B10: 100 | C10: 180638 | D10: 137081 | E10: 3 | F10: =ROUND(($E10*$C10)/($C10+$D10),0) -> 2 | G10: =ROUND(($E10*$D10)/($C10+$D10),0) -> 1
A11: FLORIDA | B11: 100 | C11: 2909911 | D11: 2910299 | E11: 25 | F11: =ROUND(($E11*$C11)/($C11+$D11),0) -> 12 | G11: =ROUND(($E11*$D11)/($C11+$D11),0) -> 13
A12: GEORGIA | B12: 99 | C12: 1101101 | D12: 1404058 | E12: 13 | F12: =ROUND(($E12*$C12)/($C12+$D12),0) -> 6 | G12: =ROUND(($E12*$D12)/($C12+$D12),0) -> 7
A13: HAWAII | B13: 100 | C13: 205209 | D13: 137785 | E13: 4 | F13: =ROUND(($E13*$C13)/($C13+$D13),0) -> 2 | G13: =ROUND(($E13*$D13)/($C13+$D13),0) -> 2
A14: IDAHO | B14: 100 | C14: 137911 | D14: 335590 | E14: 4 | F14: =ROUND(($E14*$C14)/($C14+$D14),0) -> 1 | G14: =ROUND(($E14*$D14)/($C14+$D14),0) -> 3
A15: ILLINOIS | B15: 99 | C15: 2566489 | D15: 2012154 | E15: 22 | F15: =ROUND(($E15*$C15)/($C15+$D15),0) -> 12 | G15: =ROUND(($E15*$D15)/($C15+$D15),0) -> 10
A16: INDIANA | B16: 100 | C16: 891037 | D16: 1232310 | E16: 12 | F16: =ROUND(($E16*$C16)/($C16+$D16),0) -> 5 | G16: =ROUND(($E16*$D16)/($C16+$D16),0) -> 7
A17: IOWA | B17: 100 | C17: 635026 | D17: 630077 | E17: 7 | F17: =ROUND(($E17*$C17)/($C17+$D17),0) -> 4 | G17: =ROUND(($E17*$D17)/($C17+$D17),0) -> 3
A18: KANSAS | B18: 99 | C18: 391026 | D18: 614419 | E18: 6 | F18: =ROUND(($E18*$C18)/($C18+$D18),0) -> 2 | G18: =ROUND(($E18*$D18)/($C18+$D18),0) -> 4
A19: KENTUCKY | B19: 100 | C19: 635824 | D19: 867828 | E19: 8 | F19: =ROUND(($E19*$C19)/($C19+$D19),0) -> 3 | G19: =ROUND(($E19*$D19)/($C19+$D19),0) -> 5
A20: LOUISIANA | B20: 100 | C20: 792344 | D20: 927871 | E20: 9 | F20: =ROUND(($E20*$C20)/($C20+$D20),0) -> 4 | G20: =ROUND(($E20*$D20)/($C20+$D20),0) -> 5
A21: MAINE | B21: 99 | C21: 315466 | D21: 283988 | E21: 4 | F21: =ROUND(($E21*$C21)/($C21+$D21),0) -> 2 | G21: =ROUND(($E21*$D21)/($C21+$D21),0) -> 2
A22: MARYLAND | B22: 100 | C22: 1093344 | D22: 770904 | E22: 10 | F22: =ROUND(($E22*$C22)/($C22+$D22),0) -> 6 | G22: =ROUND(($E22*$D22)/($C22+$D22),0) -> 4
A23: MASSACHUSETTS | B23: 100 | C23: 1610175 | D23: 876106 | E23: 12 | F23: =ROUND(($E23*$C23)/($C23+$D23),0) -> 8 | G23: =ROUND(($E23*$D23)/($C23+$D23),0) -> 4
A24: MICHIGAN | B24: 99 | C24: 2158254 | D24: 1946941 | E24: 18 | F24: =ROUND(($E24*$C24)/($C24+$D24),0) -> 9 | G24: =ROUND(($E24*$D24)/($C24+$D24),0) -> 9
A25: MINNESOTA | B25: 99 | C25: 1168091 | D25: 1110192 | E25: 10 | F25: =ROUND(($E25*$C25)/($C25+$D25),0) -> 5 | G25: =ROUND(($E25*$D25)/($C25+$D25),0) -> 5
A26: MISSISSIPPI | B26: 99 | C26: 392587 | D26: 558884 | E26: 7 | F26: =ROUND(($E26*$C26)/($C26+$D26),0) -> 3 | G26: =ROUND(($E26*$D26)/($C26+$D26),0) -> 4
A27: MISSOURI | B27: 100 | C27: 1110826 | D27: 1189521 | E27: 11 | F27: =ROUND(($E27*$C27)/($C27+$D27),0) -> 5 | G27: =ROUND(($E27*$D27)/($C27+$D27),0) -> 6
A28: MONTANA | B28: 100 | C28: 135698 | D28: 238962 | E28: 3 | F28: =ROUND(($E28*$C28)/($C28+$D28),0) -> 1 | G28: =ROUND(($E28*$D28)/($C28+$D28),0) -> 2
A29: NEBRASKA | B29: 100 | C29: 215127 | D29: 407806 | E29: 5 | F29: =ROUND(($E29*$C29)/($C29+$D29),0) -> 2 | G29: =ROUND(($E29*$D29)/($C29+$D29),0) -> 3
A30: NEVADA | B30: 100 | C30: 279749 | D30: 301539 | E30: 4 | F30: =ROUND(($E30*$C30)/($C30+$D30),0) -> 2 | G30: =ROUND(($E30*$D30)/($C30+$D30),0) -> 2
A31: NEW HAMPSHIRE | B31: 100 | C31: 265853 | D31: 273135 | E31: 4 | F31: =ROUND(($E31*$C31)/($C31+$D31),0) -> 2 | G31: =ROUND(($E31*$D31)/($C31+$D31),0) -> 2
A32: NEW JERSEY | B32: 99 | C32: 1728956 | D32: 1247515 | E32: 15 | F32: =ROUND(($E32*$C32)/($C32+$D32),0) -> 9 | G32: =ROUND(($E32*$D32)/($C32+$D32),0) -> 6
A33: NEW MEXICO | B33: 100 | C33: 286389 | D33: 286015 | E33: 5 | F33: =ROUND(($E33*$C33)/($C33+$D33),0) -> 3 | G33: =ROUND(($E33*$D33)/($C33+$D33),0) -> 2
A34: NEW YORK | B34: 99 | C34: 3746839 | D34: 2222283 | E34: 33 | F34: =ROUND(($E34*$C34)/($C34+$D34),0) -> 21 | G34: =ROUND(($E34*$D34)/($C34+$D34),0) -> 12
A35: NORTH CAROLINA | B35: 100 | C35: 1203216 | D35: 1564429 | E35: 14 | F35: =ROUND(($E35*$C35)/($C35+$D35),0) -> 6 | G35: =ROUND(($E35*$D35)/($C35+$D35),0) -> 8
A36: NORTH DAKOTA | B36: 100 | C36: 95892 | D36: 175558 | E36: 3 | F36: =ROUND(($E36*$C36)/($C36+$D36),0) -> 1 | G36: =ROUND(($E36*$D36)/($C36+$D36),0) -> 2
A37: OHIO | B37: 100 | C37: 2111499 | D37: 2284205 | E37: 21 | F37: =ROUND(($E37*$C37)/($C37+$D37),0) -> 10 | G37: =ROUND(($E37*$D37)/($C37+$D37),0) -> 11
A38: OKLAHOMA | B38: 100 | C38: 474326 | D38: 744335 | E38: 8 | F38: =ROUND(($E38*$C38)/($C38+$D38),0) -> 3 | G38: =ROUND(($E38*$D38)/($C38+$D38),0) -> 5
A39: OREGON | B39: 100 | C39: 706163 | D39: 701398 | E39: 7 | F39: =ROUND(($E39*$C39)/($C39+$D39),0) -> 4 | G39: =ROUND(($E39*$D39)/($C39+$D39),0) -> 3
A40: PENNSYLVANIA | B40: 99 | C40: 2460738 | D40: 2260159 | E40: 23 | F40: =ROUND(($E40*$C40)/($C40+$D40),0) -> 12 | G40: =ROUND(($E40*$D40)/($C40+$D40),0) -> 11
A41: RHODE ISLAND | B41: 100 | C41: 252844 | D41: 132212 | E41: 4 | F41: =ROUND(($E41*$C41)/($C41+$D41),0) -> 3 | G41: =ROUND(($E41*$D41)/($C41+$D41),0) -> 1
A42: SOUTH CAROLINA | B42: 100 | C42: 576802 | D42: 805653 | E42: 8 | F42: =ROUND(($E42*$C42)/($C42+$D42),0) -> 3 | G42: =ROUND(($E42*$D42)/($C42+$D42),0) -> 5
A43: SOUTH DAKOTA | B43: 100 | C43: 118750 | D43: 190515 | E43: 3 | F43: =ROUND(($E43*$C43)/($C43+$D43),0) -> 1 | G43: =ROUND(($E43*$D43)/($C43+$D43),0) -> 2
A44: TENNESSEE | B44: 100 | C44: 980353 | D44: 1059842 | E44: 11 | F44: =ROUND(($E44*$C44)/($C44+$D44),0) -> 5 | G44: =ROUND(($E44*$D44)/($C44+$D44),0) -> 6
A45: TEXAS | B45: 100 | C45: 2428187 | D45: 3795262 | E45: 32 | F45: =ROUND(($E45*$C45)/($C45+$D45),0) -> 12 | G45: =ROUND(($E45*$D45)/($C45+$D45),0) -> 20
A46: UTAH | B46: 100 | C46: 201732 | D46: 512161 | E46: 5 | F46: =ROUND(($E46*$C46)/($C46+$D46),0) -> 1 | G46: =ROUND(($E46*$D46)/($C46+$D46),0) -> 4
A47: VERMONT | B47: 100 | C47: 148166 | D47: 119273 | E47: 3 | F47: =ROUND(($E47*$C47)/($C47+$D47),0) -> 2 | G47: =ROUND(($E47*$D47)/($C47+$D47),0) -> 1
A48: VIRGINIA | B48: 99 | C48: 1200538 | D48: 1409358 | E48: 13 | F48: =ROUND(($E48*$C48)/($C48+$D48),0) -> 6 | G48: =ROUND(($E48*$D48)/($C48+$D48),0) -> 7
A49: WASHINGTON | B49: 99 | C49: 1046846 | D49: 944623 | E49: 11 | F49: =ROUND(($E49*$C49)/($C49+$D49),0) -> 6 | G49: =ROUND(($E49*$D49)/($C49+$D49),0) -> 5
A50: WEST VIRGINIA | B50: 100 | C50: 291204 | D50: 331871 | E50: 5 | F50: =ROUND(($E50*$C50)/($C50+$D50),0) -> 2 | G50: =ROUND(($E50*$D50)/($C50+$D50),0) -> 3
A51: WISCONSIN | B51: 100 | C51: 1240266 | D51: 1234167 | E51: 11 | F51: =ROUND(($E51*$C51)/($C51+$D51),0) -> 6 | G51: =ROUND(($E51*$D51)/($C51+$D51),0) -> 5
A52: WYOMING | B52: 100 | C52: 60421 | D52: 147674 | E52: 3 | F52: =ROUND(($E52*$C52)/($C52+$D52),0) -> 1 | G52: =ROUND(($E52*$D52)/($C52+$D52),0) -> 2
F54: Gore | G54: Bush
C55: Totals: | E55: =SUM(E2:E52) -> 538 | F55: =SUM(F2:F52) -> 269 | G55: =SUM(G2:G52) -> 269