A1: P/R | B1: 00.01 | C1: =B1+0.01 -> 00.02 | D1: =C1+0.01 -> 00.03 | E1: =D1+0.01 -> 00.04 | F1: =E1+0.01 -> 00.05 | G1: =F1+0.01 -> 00.06 | H1: =G1+0.01 -> 00.07 | I1: =H1+0.01 -> 00.08 | J1: =I1+0.01 -> 00.09 | K1: =J1+0.01 -> 00.1 | L1: =K1+0.01 -> 00.11 | M1: =L1+0.01 -> 00.12 | N1: =M1+0.01 -> 00.13 | O1: =N1+0.01 -> 00.14 | P1: =O1+0.01 -> 00.15 | Q1: =P1+0.01 -> 00.16 | R1: =Q1+0.01 -> 00.17 | S1: =R1+0.01 -> 00.18 | T1: =S1+0.01 -> 00.19 | U1: =T1+0.01 -> 00.2 | V1: =U1+0.01 -> 00.21 | W1: =V1+0.01 -> 00.22 | X1: =W1+0.01 -> 00.23 | Y1: =X1+0.01 -> 00.24 | Z1: =Y1+0.01 -> 00.25 | AA1: =Z1+0.01 -> 00.26 | AB1: =AA1+0.01 -> 00.27 | AC1: =AB1+0.01 -> 00.28 | AD1: =AC1+0.01 -> 00.29 | AE1: =AD1+0.01 -> 00.3 | AF1: =AE1+0.01 -> 00.31 | AG1: =AF1+0.01 -> 00.32 | AH1: =AG1+0.01 -> 00.33 | AI1: =AH1+0.01 -> 00.34 | AJ1: =AI1+0.01 -> 00.35 | AK1: =AJ1+0.01 -> 00.36 | AL1: =AK1+0.01 -> 00.37 | AM1: =AL1+0.01 -> 00.38 | AN1: =AM1+0.01 -> 00.39 | AO1: =AN1+0.01 -> 00.4 | AP1: =AO1+0.01 -> 00.41 | AQ1: =AP1+0.01 -> 00.42 | AR1: =AQ1+0.01 -> 00.43 | AS1: =AR1+0.01 -> 00.44 | AT1: =AS1+0.01 -> 00.45 | AU1: =AT1+0.01 -> 00.46 | AV1: =AU1+0.01 -> 00.47 | AW1: =AV1+0.01 -> 00.48 | AX1: =AW1+0.01 -> 00.49 | AY1: =AX1+0.01 -> 00.5 | AZ1: =AY1+0.01 -> 00.51 | BA1: =AZ1+0.01 -> 00.52 | BB1: =BA1+0.01 -> 00.53 | BC1: =BB1+0.01 -> 00.54 | BD1: =BC1+0.01 -> 00.55 | BE1: =BD1+0.01 -> 00.56 | BF1: =BE1+0.01 -> 00.57 | BG1: =BF1+0.01 -> 00.58 | BH1: =BG1+0.01 -> 00.59 | BI1: =BH1+0.01 -> 00.6 | BJ1: =BI1+0.01 -> 00.61 | BK1: =BJ1+0.01 -> 00.62 | BL1: =BK1+0.01 -> 00.63 | BM1: =BL1+0.01 -> 00.64 | BN1: =BM1+0.01 -> 00.65 | BO1: =BN1+0.01 -> 00.66 | BP1: =BO1+0.01 -> 00.67 | BQ1: =BP1+0.01 -> 00.68 | BR1: =BQ1+0.01 -> 00.69 | BS1: =BR1+0.01 -> 00.7 | BT1: =BS1+0.01 -> 00.71 | BU1: =BT1+0.01 -> 00.72 | BV1: =BU1+0.01 -> 00.73 | BW1: =BV1+0.01 -> 00.74 | BX1: =BW1+0.01 -> 00.75 | BY1: =BX1+0.01 -> 00.76 | BZ1: =BY1+0.01 -> 00.77 | CA1: =BZ1+0.01 -> 00.78 | CB1: =CA1+0.01 -> 00.79 | CC1: =CB1+0.01 -> 00.8 | CD1: =CC1+0.01 -> 0.8100000000000005 | CE1: =CD1+0.01 -> 0.82000000000000051 | CF1: =CE1+0.01 -> 0.83000000000000052 | CG1: =CF1+0.01 -> 0.84000000000000052 | CH1: =CG1+0.01 -> 0.85000000000000053 | CI1: =CH1+0.01 -> 0.86000000000000054 | CJ1: =CI1+0.01 -> 0.87000000000000055 | CK1: =CJ1+0.01 -> 0.88000000000000056 | CL1: =CK1+0.01 -> 0.89000000000000057 | CM1: =CL1+0.01 -> 0.90000000000000058 | CN1: =CM1+0.01 -> 0.91000000000000059 | CO1: =CN1+0.01 -> 0.9200000000000006 | CP1: =CO1+0.01 -> 0.9300000000000006 | CQ1: =CP1+0.01 -> 0.94000000000000061 | CR1: =CQ1+0.01 -> 0.95000000000000062 | CS1: =CR1+0.01 -> 0.96000000000000063 | CT1: =CS1+0.01 -> 0.97000000000000064 | CU1: =CT1+0.01 -> 0.98000000000000065 | CV1: =CU1+0.01 -> 0.99000000000000066
A2: 00.01 | B2: =1-(LN(1-B$1))/$A2 -> 2.0050335853501453 | C2: =1-(LN(1-C$1))/$A2 -> 3.0202707317519466 | D2: =1-(LN(1-D$1))/$A2 -> 4.0459207484708575 | E2: =1-(LN(1-E$1))/$A2 -> 5.0821994520255167 | F2: =1-(LN(1-F$1))/$A2 -> 6.1293294387550574 | G2: =1-(LN(1-G$1))/$A2 -> 7.1875403718087529 | H2: =1-(LN(1-H$1))/$A2 -> 8.2570692834835491 | I2: =1-(LN(1-I$1))/$A2 -> 9.3381608939051013 | J2: =1-(LN(1-J$1))/$A2 -> 10.431067947124129 | K2: =1-(LN(1-K$1))/$A2 -> 11.536051565782628 | L2: =1-(LN(1-L$1))/$A2 -> 12.65338162559515 | M2: =1-(LN(1-M$1))/$A2 -> 13.783337150988489 | N2: =1-(LN(1-N$1))/$A2 -> 14.926206733350766 | O2: =1-(LN(1-O$1))/$A2 -> 16.082288973458368 | P2: =1-(LN(1-P$1))/$A2 -> 17.251892949777492 | Q2: =1-(LN(1-Q$1))/$A2 -> 18.43533871447778 | R2: =1-(LN(1-R$1))/$A2 -> 19.632957819149347 | S2: =1-(LN(1-S$1))/$A2 -> 20.845093872383831 | T2: =1-(LN(1-T$1))/$A2 -> 22.072103131565267 | U2: =1-(LN(1-U$1))/$A2 -> 23.314355131420985 | V2: =1-(LN(1-V$1))/$A2 -> 24.572233352106995 | W2: =1-(LN(1-W$1))/$A2 -> 25.846135929849975 | X2: =1-(LN(1-X$1))/$A2 -> 27.136476413440761 | Y2: =1-(LN(1-Y$1))/$A2 -> 28.443684570176039 | Z2: =1-(LN(1-Z$1))/$A2 -> 29.76820724517809 | AA2: =1-(LN(1-AA$1))/$A2 -> 31.110509278392161 | AB2: =1-(LN(1-AB$1))/$A2 -> 32.471074483970028 | AC2: =1-(LN(1-AC$1))/$A2 -> 33.85040669720361 | AD2: =1-(LN(1-AD$1))/$A2 -> 35.249030894677603 | AE2: =1-(LN(1-AE$1))/$A2 -> 36.667494393873241 | AF2: =1-(LN(1-AF$1))/$A2 -> 38.106368139083209 | AG2: =1-(LN(1-AG$1))/$A2 -> 39.566248081198481 | AH2: =1-(LN(1-AH$1))/$A2 -> 41.04775665971254 | AI2: =1-(LN(1-AI$1))/$A2 -> 42.551544396166598 | AJ2: =1-(LN(1-AJ$1))/$A2 -> 44.07829160924544 | AK2: =1-(LN(1-AK$1))/$A2 -> 45.628710262841963 | AL2: =1-(LN(1-AL$1))/$A2 -> 47.203545959655884 | AM2: =1-(LN(1-AM$1))/$A2 -> 48.803580094300003 | AN2: =1-(LN(1-AN$1))/$A2 -> 50.429632181478034 | AO2: =1-(LN(1-AO$1))/$A2 -> 52.082562376599093 | AP2: =1-(LN(1-AP$1))/$A2 -> 53.76327420823722 | AQ2: =1-(LN(1-AQ$1))/$A2 -> 55.472717544167224 | AR2: =1-(LN(1-AR$1))/$A2 -> 57.21189181535415 | AS2: =1-(LN(1-AS$1))/$A2 -> 58.981849525294251 | AT2: =1-(LN(1-AT$1))/$A2 -> 60.783700075562074 | AU2: =1-(LN(1-AU$1))/$A2 -> 62.618613942381728 | AV2: =1-(LN(1-AV$1))/$A2 -> 64.487827243596996 | AW2: =1-(LN(1-AW$1))/$A2 -> 66.392646740666436 | AX2: =1-(LN(1-AX$1))/$A2 -> 68.334455326376599 | AY2: =1-(LN(1-AY$1))/$A2 -> 70.314718055994575 | AZ2: =1-(LN(1-AZ$1))/$A2 -> 72.334988787746525 | BA2: =1-(LN(1-BA$1))/$A2 -> 74.396917508020096 | BB2: =1-(LN(1-BB$1))/$A2 -> 76.502258427803326 | BC2: =1-(LN(1-BC$1))/$A2 -> 78.652878949899687 | BD2: =1-(LN(1-BD$1))/$A2 -> 80.850769621777218 | BE2: =1-(LN(1-BE$1))/$A2 -> 83.098055206983076 | BF2: =1-(LN(1-BF$1))/$A2 -> 85.397007029452965 | BG2: =1-(LN(1-BG$1))/$A2 -> 87.750056770472369 | BH2: =1-(LN(1-BH$1))/$A2 -> 90.159811928378431 | BI2: =1-(LN(1-BI$1))/$A2 -> 92.629073187415585 | BJ2: =1-(LN(1-BJ$1))/$A2 -> 95.160853985844568 | BK2: =1-(LN(1-BK$1))/$A2 -> 97.75840262617065 | BL2: =1-(LN(1-BL$1))/$A2 -> 100.42522733438678 | BM2: =1-(LN(1-BM$1))/$A2 -> 103.16512475319823 | BN2: =1-(LN(1-BN$1))/$A2 -> 105.98221244986787 | BO2: =1-(LN(1-BO$1))/$A2 -> 108.88096613719311 | BP2: =1-(LN(1-BP$1))/$A2 -> 111.86626245216122 | BQ2: =1-(LN(1-BQ$1))/$A2 -> 114.9434283188366 | BR2: =1-(LN(1-BR$1))/$A2 -> 118.11829815029463 | BS2: =1-(LN(1-BS$1))/$A2 -> 121.39728043259372 | BT2: =1-(LN(1-BT$1))/$A2 -> 124.78743560016187 | BU2: =1-(LN(1-BU$1))/$A2 -> 128.29656758128888 | BV2: =1-(LN(1-BV$1))/$A2 -> 131.93333199837639 | BW2: =1-(LN(1-BW$1))/$A2 -> 135.7073647966611 | BX2: =1-(LN(1-BX$1))/$A2 -> 139.62943611198924 | BY2: =1-(LN(1-BY$1))/$A2 -> 143.71163556401476 | BZ2: =1-(LN(1-BZ$1))/$A2 -> 147.96759700589436 | CA2: =1-(LN(1-CA$1))/$A2 -> 152.41277326297777 | CB2: =1-(LN(1-CB$1))/$A2 -> 157.06477482646704 | CC2: =1-(LN(1-CC$1))/$A2 -> 161.94379124341026 | CD2: =1-(LN(1-CD$1))/$A2 -> 167.07312068216535 | CE2: =1-(LN(1-CE$1))/$A2 -> 172.47984280919295 | CF2: =1-(LN(1-CF$1))/$A2 -> 178.19568419318782 | CG2: =1-(LN(1-CG$1))/$A2 -> 184.25814637483134 | CH2: =1-(LN(1-CH$1))/$A2 -> 190.71199848858848 | CI2: =1-(LN(1-CI$1))/$A2 -> 197.61128563728366 | CJ2: =1-(LN(1-CJ$1))/$A2 -> 205.0220828526559 | CK2: =1-(LN(1-CK$1))/$A2 -> 213.02635362000959 | CL2: =1-(LN(1-CL$1))/$A2 -> 221.7274913189726 | CM2: =1-(LN(1-CM$1))/$A2 -> 231.25850929940518 | CN2: =1-(LN(1-CN$1))/$A2 -> 241.79456086518783 | CO2: =1-(LN(1-CO$1))/$A2 -> 253.57286443082626 | CP2: =1-(LN(1-CP$1))/$A2 -> 266.92600369327869 | CQ2: =1-(LN(1-CQ$1))/$A2 -> 282.34107167600467 | CR2: =1-(LN(1-CR$1))/$A2 -> 300.57322735540032 | CS2: =1-(LN(1-CS$1))/$A2 -> 322.88758248682166 | CT2: =1-(LN(1-CT$1))/$A2 -> 351.6557897320003 | CU2: =1-(LN(1-CU$1))/$A2 -> 392.20230054281785 | CV2: =1-(LN(1-CV$1))/$A2 -> 461.51701859881575
A3: =A2+0.01 -> 00.02 | B3: =1-(LN(1-B$1))/$A3 -> 1.5025167926750727 | C3: =1-(LN(1-C$1))/$A3 -> 2.0101353658759731 | D3: =1-(LN(1-D$1))/$A3 -> 2.5229603742354287 | E3: =1-(LN(1-E$1))/$A3 -> 3.0410997260127584 | F3: =1-(LN(1-F$1))/$A3 -> 3.5646647193775287 | G3: =1-(LN(1-G$1))/$A3 -> 4.0937701859043765 | H3: =1-(LN(1-H$1))/$A3 -> 4.6285346417417745 | I3: =1-(LN(1-I$1))/$A3 -> 5.1690804469525506 | J3: =1-(LN(1-J$1))/$A3 -> 5.7155339735620645 | K3: =1-(LN(1-K$1))/$A3 -> 6.2680257828913142 | L3: =1-(LN(1-L$1))/$A3 -> 6.8266908127975752 | M3: =1-(LN(1-M$1))/$A3 -> 7.3916685754942444 | N3: =1-(LN(1-N$1))/$A3 -> 7.9631033666753828 | O3: =1-(LN(1-O$1))/$A3 -> 8.5411444867291841 | P3: =1-(LN(1-P$1))/$A3 -> 9.125946474888746 | Q3: =1-(LN(1-Q$1))/$A3 -> 9.7176693572388899 | R3: =1-(LN(1-R$1))/$A3 -> 10.316478909574673 | S3: =1-(LN(1-S$1))/$A3 -> 10.922546936191916 | T3: =1-(LN(1-T$1))/$A3 -> 11.536051565782634 | U3: =1-(LN(1-U$1))/$A3 -> 12.157177565710493 | V3: =1-(LN(1-V$1))/$A3 -> 12.786116676053497 | W3: =1-(LN(1-W$1))/$A3 -> 13.423067964924988 | X3: =1-(LN(1-X$1))/$A3 -> 14.06823820672038 | Y3: =1-(LN(1-Y$1))/$A3 -> 14.72184228508802 | Z3: =1-(LN(1-Z$1))/$A3 -> 15.384103622589045 | AA3: =1-(LN(1-AA$1))/$A3 -> 16.055254639196079 | AB3: =1-(LN(1-AB$1))/$A3 -> 16.735537241985014 | AC3: =1-(LN(1-AC$1))/$A3 -> 17.425203348601805 | AD3: =1-(LN(1-AD$1))/$A3 -> 18.124515447338801 | AE3: =1-(LN(1-AE$1))/$A3 -> 18.833747196936621 | AF3: =1-(LN(1-AF$1))/$A3 -> 19.553184069541604 | AG3: =1-(LN(1-AG$1))/$A3 -> 20.28312404059924 | AH3: =1-(LN(1-AH$1))/$A3 -> 21.02387832985627 | AI3: =1-(LN(1-AI$1))/$A3 -> 21.775772198083299 | AJ3: =1-(LN(1-AJ$1))/$A3 -> 22.53914580462272 | AK3: =1-(LN(1-AK$1))/$A3 -> 23.314355131420982 | AL3: =1-(LN(1-AL$1))/$A3 -> 24.101772979827942 | AM3: =1-(LN(1-AM$1))/$A3 -> 24.901790047150001 | AN3: =1-(LN(1-AN$1))/$A3 -> 25.714816090739017 | AO3: =1-(LN(1-AO$1))/$A3 -> 26.541281188299546 | AP3: =1-(LN(1-AP$1))/$A3 -> 27.38163710411861 | AQ3: =1-(LN(1-AQ$1))/$A3 -> 28.236358772083612 | AR3: =1-(LN(1-AR$1))/$A3 -> 29.105945907677075 | AS3: =1-(LN(1-AS$1))/$A3 -> 29.990924762647126 | AT3: =1-(LN(1-AT$1))/$A3 -> 30.891850037781037 | AU3: =1-(LN(1-AU$1))/$A3 -> 31.809306971190864 | AV3: =1-(LN(1-AV$1))/$A3 -> 32.743913621798498 | AW3: =1-(LN(1-AW$1))/$A3 -> 33.696323370333218 | AX3: =1-(LN(1-AX$1))/$A3 -> 34.667227663188299 | AY3: =1-(LN(1-AY$1))/$A3 -> 35.657359027997288 | AZ3: =1-(LN(1-AZ$1))/$A3 -> 36.667494393873262 | BA3: =1-(LN(1-BA$1))/$A3 -> 37.698458754010048 | BB3: =1-(LN(1-BB$1))/$A3 -> 38.751129213901663 | BC3: =1-(LN(1-BC$1))/$A3 -> 39.826439474949844 | BD3: =1-(LN(1-BD$1))/$A3 -> 40.925384810888609 | BE3: =1-(LN(1-BE$1))/$A3 -> 42.049027603491538 | BF3: =1-(LN(1-BF$1))/$A3 -> 43.198503514726482 | BG3: =1-(LN(1-BG$1))/$A3 -> 44.375028385236185 | BH3: =1-(LN(1-BH$1))/$A3 -> 45.579905964189216 | BI3: =1-(LN(1-BI$1))/$A3 -> 46.814536593707793 | BJ3: =1-(LN(1-BJ$1))/$A3 -> 48.080426992922284 | BK3: =1-(LN(1-BK$1))/$A3 -> 49.379201313085325 | BL3: =1-(LN(1-BL$1))/$A3 -> 50.712613667193388 | BM3: =1-(LN(1-BM$1))/$A3 -> 52.082562376599114 | BN3: =1-(LN(1-BN$1))/$A3 -> 53.491106224933937 | BO3: =1-(LN(1-BO$1))/$A3 -> 54.940483068596556 | BP3: =1-(LN(1-BP$1))/$A3 -> 56.433131226080611 | BQ3: =1-(LN(1-BQ$1))/$A3 -> 57.971714159418298 | BR3: =1-(LN(1-BR$1))/$A3 -> 59.559149075147317 | BS3: =1-(LN(1-BS$1))/$A3 -> 61.198640216296859 | BT3: =1-(LN(1-BT$1))/$A3 -> 62.893717800080935 | BU3: =1-(LN(1-BU$1))/$A3 -> 64.648283790644442 | BV3: =1-(LN(1-BV$1))/$A3 -> 66.466665999188194 | BW3: =1-(LN(1-BW$1))/$A3 -> 68.353682398330548 | BX3: =1-(LN(1-BX$1))/$A3 -> 70.314718055994618 | BY3: =1-(LN(1-BY$1))/$A3 -> 72.355817782007378 | BZ3: =1-(LN(1-BZ$1))/$A3 -> 74.483798502947181 | CA3: =1-(LN(1-CA$1))/$A3 -> 76.706386631488883 | CB3: =1-(LN(1-CB$1))/$A3 -> 79.032387413233522 | CC3: =1-(LN(1-CC$1))/$A3 -> 81.47189562170513 | CD3: =1-(LN(1-CD$1))/$A3 -> 84.036560341082676 | CE3: =1-(LN(1-CE$1))/$A3 -> 86.739921404596473 | CF3: =1-(LN(1-CF$1))/$A3 -> 89.597842096593908 | CG3: =1-(LN(1-CG$1))/$A3 -> 92.629073187415671 | CH3: =1-(LN(1-CH$1))/$A3 -> 95.855999244294239 | CI3: =1-(LN(1-CI$1))/$A3 -> 99.305642818641829 | CJ3: =1-(LN(1-CJ$1))/$A3 -> 103.01104142632795 | CK3: =1-(LN(1-CK$1))/$A3 -> 107.01317681000479 | CL3: =1-(LN(1-CL$1))/$A3 -> 111.3637456594863 | CM3: =1-(LN(1-CM$1))/$A3 -> 116.12925464970259 | CN3: =1-(LN(1-CN$1))/$A3 -> 121.39728043259392 | CO3: =1-(LN(1-CO$1))/$A3 -> 127.28643221541313 | CP3: =1-(LN(1-CP$1))/$A3 -> 133.96300184663934 | CQ3: =1-(LN(1-CQ$1))/$A3 -> 141.67053583800234 | CR3: =1-(LN(1-CR$1))/$A3 -> 150.78661367770016 | CS3: =1-(LN(1-CS$1))/$A3 -> 161.94379124341083 | CT3: =1-(LN(1-CT$1))/$A3 -> 176.32789486600015 | CU3: =1-(LN(1-CU$1))/$A3 -> 196.60115027140893 | CV3: =1-(LN(1-CV$1))/$A3 -> 231.25850929940788
A4: =A3+0.01 -> 00.03 | B4: =1-(LN(1-B$1))/$A4 -> 1.335011195116715 | C4: =1-(LN(1-C$1))/$A4 -> 1.6734235772506489 | D4: =1-(LN(1-D$1))/$A4 -> 2.0153069161569528 | E4: =1-(LN(1-E$1))/$A4 -> 2.3607331506751725 | F4: =1-(LN(1-F$1))/$A4 -> 2.7097764795850194 | G4: =1-(LN(1-G$1))/$A4 -> 3.0625134572695845 | H4: =1-(LN(1-H$1))/$A4 -> 3.4190230944945168 | I4: =1-(LN(1-I$1))/$A4 -> 3.7793869646350338 | J4: =1-(LN(1-J$1))/$A4 -> 4.143689315708043 | K4: =1-(LN(1-K$1))/$A4 -> 4.5120171885942089 | L4: =1-(LN(1-L$1))/$A4 -> 4.8844605418650504 | M4: =1-(LN(1-M$1))/$A4 -> 5.2611123836628293 | N4: =1-(LN(1-N$1))/$A4 -> 5.6420689111169224 | O4: =1-(LN(1-O$1))/$A4 -> 6.0274296578194555 | P4: =1-(LN(1-P$1))/$A4 -> 6.4172976499258318 | Q4: =1-(LN(1-Q$1))/$A4 -> 6.8117795714925933 | R4: =1-(LN(1-R$1))/$A4 -> 7.2109859397164495 | S4: =1-(LN(1-S$1))/$A4 -> 7.6150312907946107 | T4: =1-(LN(1-T$1))/$A4 -> 8.0240343771884231 | U4: =1-(LN(1-U$1))/$A4 -> 8.438118377140329 | V4: =1-(LN(1-V$1))/$A4 -> 8.8574111173689989 | W4: =1-(LN(1-W$1))/$A4 -> 9.2820453099499911 | X4: =1-(LN(1-X$1))/$A4 -> 9.7121588044802536 | Y4: =1-(LN(1-Y$1))/$A4 -> 10.147894856725348 | Z4: =1-(LN(1-Z$1))/$A4 -> 10.589402415059364 | AA4: =1-(LN(1-AA$1))/$A4 -> 11.036836426130721 | AB4: =1-(LN(1-AB$1))/$A4 -> 11.490358161323341 | AC4: =1-(LN(1-AC$1))/$A4 -> 11.950135565734538 | AD4: =1-(LN(1-AD$1))/$A4 -> 12.416343631559201 | AE4: =1-(LN(1-AE$1))/$A4 -> 12.889164797957749 | AF4: =1-(LN(1-AF$1))/$A4 -> 13.368789379694404 | AG4: =1-(LN(1-AG$1))/$A4 -> 13.855416027066161 | AH4: =1-(LN(1-AH$1))/$A4 -> 14.34925221990418 | AI4: =1-(LN(1-AI$1))/$A4 -> 14.850514798722198 | AJ4: =1-(LN(1-AJ$1))/$A4 -> 15.359430536415147 | AK4: =1-(LN(1-AK$1))/$A4 -> 15.876236754280654 | AL4: =1-(LN(1-AL$1))/$A4 -> 16.401181986551961 | AM4: =1-(LN(1-AM$1))/$A4 -> 16.934526698100001 | AN4: =1-(LN(1-AN$1))/$A4 -> 17.476544060492678 | AO4: =1-(LN(1-AO$1))/$A4 -> 18.027520792199699 | AP4: =1-(LN(1-AP$1))/$A4 -> 18.587758069412409 | AQ4: =1-(LN(1-AQ$1))/$A4 -> 19.157572514722411 | AR4: =1-(LN(1-AR$1))/$A4 -> 19.737297271784719 | AS4: =1-(LN(1-AS$1))/$A4 -> 20.327283175098085 | AT4: =1-(LN(1-AT$1))/$A4 -> 20.927900025187359 | AU4: =1-(LN(1-AU$1))/$A4 -> 21.539537980793909 | AV4: =1-(LN(1-AV$1))/$A4 -> 22.162609081198998 | AW4: =1-(LN(1-AW$1))/$A4 -> 22.797548913555481 | AX4: =1-(LN(1-AX$1))/$A4 -> 23.444818442125534 | AY4: =1-(LN(1-AY$1))/$A4 -> 24.10490601866486 | AZ4: =1-(LN(1-AZ$1))/$A4 -> 24.778329595915508 | BA4: =1-(LN(1-BA$1))/$A4 -> 25.465639169340033 | BB4: =1-(LN(1-BB$1))/$A4 -> 26.167419475934445 | BC4: =1-(LN(1-BC$1))/$A4 -> 26.8842929832999 | BD4: =1-(LN(1-BD$1))/$A4 -> 27.616923207259074 | BE4: =1-(LN(1-BE$1))/$A4 -> 28.366018402327693 | BF4: =1-(LN(1-BF$1))/$A4 -> 29.132335676484324 | BG4: =1-(LN(1-BG$1))/$A4 -> 29.91668559015746 | BH4: =1-(LN(1-BH$1))/$A4 -> 30.719937309459478 | BI4: =1-(LN(1-BI$1))/$A4 -> 31.543024395805197 | BJ4: =1-(LN(1-BJ$1))/$A4 -> 32.386951328614856 | BK4: =1-(LN(1-BK$1))/$A4 -> 33.252800875390214 | BL4: =1-(LN(1-BL$1))/$A4 -> 34.141742444795597 | BM4: =1-(LN(1-BM$1))/$A4 -> 35.055041584399412 | BN4: =1-(LN(1-BN$1))/$A4 -> 35.994070816622624 | BO4: =1-(LN(1-BO$1))/$A4 -> 36.96032204573104 | BP4: =1-(LN(1-BP$1))/$A4 -> 37.955420817387079 | BQ4: =1-(LN(1-BQ$1))/$A4 -> 38.981142772945532 | BR4: =1-(LN(1-BR$1))/$A4 -> 40.039432716764885 | BS4: =1-(LN(1-BS$1))/$A4 -> 41.132426810864573 | BT4: =1-(LN(1-BT$1))/$A4 -> 42.262478533387295 | BU4: =1-(LN(1-BU$1))/$A4 -> 43.432189193762966 | BV4: =1-(LN(1-BV$1))/$A4 -> 44.644443999458794 | BW4: =1-(LN(1-BW$1))/$A4 -> 45.902454932220365 | BX4: =1-(LN(1-BX$1))/$A4 -> 47.209812037329748 | BY4: =1-(LN(1-BY$1))/$A4 -> 48.570545188004921 | BZ4: =1-(LN(1-BZ$1))/$A4 -> 49.989199001964792 | CA4: =1-(LN(1-CA$1))/$A4 -> 51.470924420992596 | CB4: =1-(LN(1-CB$1))/$A4 -> 53.021591608822355 | CC4: =1-(LN(1-CC$1))/$A4 -> 54.647930414470096 | CD4: =1-(LN(1-CD$1))/$A4 -> 56.35770689405512 | CE4: =1-(LN(1-CE$1))/$A4 -> 58.159947603064317 | CF4: =1-(LN(1-CF$1))/$A4 -> 60.065228064395946 | CG4: =1-(LN(1-CG$1))/$A4 -> 62.086048791610445 | CH4: =1-(LN(1-CH$1))/$A4 -> 64.237332829529493 | CI4: =1-(LN(1-CI$1))/$A4 -> 66.5370952124279 | CJ4: =1-(LN(1-CJ$1))/$A4 -> 69.0073609508853 | CK4: =1-(LN(1-CK$1))/$A4 -> 71.675451206669862 | CL4: =1-(LN(1-CL$1))/$A4 -> 74.575830439657537 | CM4: =1-(LN(1-CM$1))/$A4 -> 77.752836433135059 | CN4: =1-(LN(1-CN$1))/$A4 -> 81.264853621729287 | CO4: =1-(LN(1-CO$1))/$A4 -> 85.190954810275429 | CP4: =1-(LN(1-CP$1))/$A4 -> 89.642001231092891 | CQ4: =1-(LN(1-CQ$1))/$A4 -> 94.780357225334896 | CR4: =1-(LN(1-CR$1))/$A4 -> 100.85774245180011 | CS4: =1-(LN(1-CS$1))/$A4 -> 108.29586082894056 | CT4: =1-(LN(1-CT$1))/$A4 -> 117.88526324400011 | CU4: =1-(LN(1-CU$1))/$A4 -> 131.40076684760595 | CV4: =1-(LN(1-CV$1))/$A4 -> 154.50567286627194
A5: =A4+0.01 -> 00.04 | B5: =1-(LN(1-B$1))/$A5 -> 1.2512583963375363 | C5: =1-(LN(1-C$1))/$A5 -> 1.5050676829379865 | D5: =1-(LN(1-D$1))/$A5 -> 1.7614801871177144 | E5: =1-(LN(1-E$1))/$A5 -> 2.0205498630063792 | F5: =1-(LN(1-F$1))/$A5 -> 2.2823323596887644 | G5: =1-(LN(1-G$1))/$A5 -> 2.5468850929521882 | H5: =1-(LN(1-H$1))/$A5 -> 2.8142673208708873 | I5: =1-(LN(1-I$1))/$A5 -> 3.0845402234762753 | J5: =1-(LN(1-J$1))/$A5 -> 3.3577669867810322 | K5: =1-(LN(1-K$1))/$A5 -> 3.6340128914456571 | L5: =1-(LN(1-L$1))/$A5 -> 3.9133454063987876 | M5: =1-(LN(1-M$1))/$A5 -> 4.1958342877471217 | N5: =1-(LN(1-N$1))/$A5 -> 4.4815516833376918 | O5: =1-(LN(1-O$1))/$A5 -> 4.7705722433645921 | P5: =1-(LN(1-P$1))/$A5 -> 5.062973237444373 | Q5: =1-(LN(1-Q$1))/$A5 -> 5.358834678619445 | R5: =1-(LN(1-R$1))/$A5 -> 5.6582394547873367 | S5: =1-(LN(1-S$1))/$A5 -> 5.9612734680959578 | T5: =1-(LN(1-T$1))/$A5 -> 6.2680257828913168 | U5: =1-(LN(1-U$1))/$A5 -> 6.5785887828552463 | V5: =1-(LN(1-V$1))/$A5 -> 6.8930583380267487 | W5: =1-(LN(1-W$1))/$A5 -> 7.2115339824624938 | X5: =1-(LN(1-X$1))/$A5 -> 7.5341191033601902 | Y5: =1-(LN(1-Y$1))/$A5 -> 7.8609211425440098 | Z5: =1-(LN(1-Z$1))/$A5 -> 8.1920518112945224 | AA5: =1-(LN(1-AA$1))/$A5 -> 8.5276273195980394 | AB5: =1-(LN(1-AB$1))/$A5 -> 8.8677686209925071 | AC5: =1-(LN(1-AC$1))/$A5 -> 9.2126016743009025 | AD5: =1-(LN(1-AD$1))/$A5 -> 9.5622577236694006 | AE5: =1-(LN(1-AE$1))/$A5 -> 9.9168735984683103 | AF5: =1-(LN(1-AF$1))/$A5 -> 10.276592034770802 | AG5: =1-(LN(1-AG$1))/$A5 -> 10.64156202029962 | AH5: =1-(LN(1-AH$1))/$A5 -> 11.011939164928135 | AI5: =1-(LN(1-AI$1))/$A5 -> 11.38788609904165 | AJ5: =1-(LN(1-AJ$1))/$A5 -> 11.76957290231136 | AK5: =1-(LN(1-AK$1))/$A5 -> 12.157177565710491 | AL5: =1-(LN(1-AL$1))/$A5 -> 12.550886489913971 | AM5: =1-(LN(1-AM$1))/$A5 -> 12.950895023575001 | AN5: =1-(LN(1-AN$1))/$A5 -> 13.357408045369509 | AO5: =1-(LN(1-AO$1))/$A5 -> 13.770640594149773 | AP5: =1-(LN(1-AP$1))/$A5 -> 14.190818552059305 | AQ5: =1-(LN(1-AQ$1))/$A5 -> 14.618179386041806 | AR5: =1-(LN(1-AR$1))/$A5 -> 15.052972953838538 | AS5: =1-(LN(1-AS$1))/$A5 -> 15.495462381323563 | AT5: =1-(LN(1-AT$1))/$A5 -> 15.945925018890518 | AU5: =1-(LN(1-AU$1))/$A5 -> 16.404653485595432 | AV5: =1-(LN(1-AV$1))/$A5 -> 16.871956810899249 | AW5: =1-(LN(1-AW$1))/$A5 -> 17.348161685166609 | AX5: =1-(LN(1-AX$1))/$A5 -> 17.83361383159415 | AY5: =1-(LN(1-AY$1))/$A5 -> 18.328679513998644 | AZ5: =1-(LN(1-AZ$1))/$A5 -> 18.833747196936631 | BA5: =1-(LN(1-BA$1))/$A5 -> 19.349229377005024 | BB5: =1-(LN(1-BB$1))/$A5 -> 19.875564606950832 | BC5: =1-(LN(1-BC$1))/$A5 -> 20.413219737474922 | BD5: =1-(LN(1-BD$1))/$A5 -> 20.962692405444304 | BE5: =1-(LN(1-BE$1))/$A5 -> 21.524513801745769 | BF5: =1-(LN(1-BF$1))/$A5 -> 22.099251757363241 | BG5: =1-(LN(1-BG$1))/$A5 -> 22.687514192618092 | BH5: =1-(LN(1-BH$1))/$A5 -> 23.289952982094608 | BI5: =1-(LN(1-BI$1))/$A5 -> 23.907268296853896 | BJ5: =1-(LN(1-BJ$1))/$A5 -> 24.540213496461142 | BK5: =1-(LN(1-BK$1))/$A5 -> 25.189600656542662 | BL5: =1-(LN(1-BL$1))/$A5 -> 25.856306833596694 | BM5: =1-(LN(1-BM$1))/$A5 -> 26.541281188299557 | BN5: =1-(LN(1-BN$1))/$A5 -> 27.245553112466968 | BO5: =1-(LN(1-BO$1))/$A5 -> 27.970241534298278 | BP5: =1-(LN(1-BP$1))/$A5 -> 28.716565613040306 | BQ5: =1-(LN(1-BQ$1))/$A5 -> 29.485857079709149 | BR5: =1-(LN(1-BR$1))/$A5 -> 30.279574537573659 | BS5: =1-(LN(1-BS$1))/$A5 -> 31.099320108148429 | BT5: =1-(LN(1-BT$1))/$A5 -> 31.946858900040468 | BU5: =1-(LN(1-BU$1))/$A5 -> 32.824141895322221 | BV5: =1-(LN(1-BV$1))/$A5 -> 33.733332999594097 | BW5: =1-(LN(1-BW$1))/$A5 -> 34.676841199165274 | BX5: =1-(LN(1-BX$1))/$A5 -> 35.657359027997309 | BY5: =1-(LN(1-BY$1))/$A5 -> 36.677908891003689 | BZ5: =1-(LN(1-BZ$1))/$A5 -> 37.74189925147359 | CA5: =1-(LN(1-CA$1))/$A5 -> 38.853193315744441 | CB5: =1-(LN(1-CB$1))/$A5 -> 40.016193706616761 | CC5: =1-(LN(1-CC$1))/$A5 -> 41.235947810852565 | CD5: =1-(LN(1-CD$1))/$A5 -> 42.518280170541338 | CE5: =1-(LN(1-CE$1))/$A5 -> 43.869960702298236 | CF5: =1-(LN(1-CF$1))/$A5 -> 45.298921048296954 | CG5: =1-(LN(1-CG$1))/$A5 -> 46.814536593707835 | CH5: =1-(LN(1-CH$1))/$A5 -> 48.427999622147119 | CI5: =1-(LN(1-CI$1))/$A5 -> 50.152821409320914 | CJ5: =1-(LN(1-CJ$1))/$A5 -> 52.005520713163975 | CK5: =1-(LN(1-CK$1))/$A5 -> 54.006588405002397 | CL5: =1-(LN(1-CL$1))/$A5 -> 56.181872829743149 | CM5: =1-(LN(1-CM$1))/$A5 -> 58.564627324851294 | CN5: =1-(LN(1-CN$1))/$A5 -> 61.198640216296958 | CO5: =1-(LN(1-CO$1))/$A5 -> 64.143216107706564 | CP5: =1-(LN(1-CP$1))/$A5 -> 67.481500923319672 | CQ5: =1-(LN(1-CQ$1))/$A5 -> 71.335267919001168 | CR5: =1-(LN(1-CR$1))/$A5 -> 75.89330683885008 | CS5: =1-(LN(1-CS$1))/$A5 -> 81.471895621705414 | CT5: =1-(LN(1-CT$1))/$A5 -> 88.663947433000075 | CU5: =1-(LN(1-CU$1))/$A5 -> 98.800575135704463 | CV5: =1-(LN(1-CV$1))/$A5 -> 116.12925464970394
A6: =A5+0.01 -> 00.05 | B6: =1-(LN(1-B$1))/$A6 -> 1.2010067170700289 | C6: =1-(LN(1-C$1))/$A6 -> 1.4040541463503893 | D6: =1-(LN(1-D$1))/$A6 -> 1.6091841496941715 | E6: =1-(LN(1-E$1))/$A6 -> 1.8164398904051033 | F6: =1-(LN(1-F$1))/$A6 -> 2.0258658877510114 | G6: =1-(LN(1-G$1))/$A6 -> 2.2375080743617506 | H6: =1-(LN(1-H$1))/$A6 -> 2.4514138566967096 | I6: =1-(LN(1-I$1))/$A6 -> 2.6676321787810204 | J6: =1-(LN(1-J$1))/$A6 -> 2.886213589424826 | K6: =1-(LN(1-K$1))/$A6 -> 3.1072103131565254 | L6: =1-(LN(1-L$1))/$A6 -> 3.3306763251190299 | M6: =1-(LN(1-M$1))/$A6 -> 3.5566674301976975 | N6: =1-(LN(1-N$1))/$A6 -> 3.7852413466701531 | O6: =1-(LN(1-O$1))/$A6 -> 4.0164577946916733 | P6: =1-(LN(1-P$1))/$A6 -> 4.2503785899554991 | Q6: =1-(LN(1-Q$1))/$A6 -> 4.4870677428955563 | R6: =1-(LN(1-R$1))/$A6 -> 4.726591563829869 | S6: =1-(LN(1-S$1))/$A6 -> 4.9690187744767655 | T6: =1-(LN(1-T$1))/$A6 -> 5.2144206263130535 | U6: =1-(LN(1-U$1))/$A6 -> 5.4628710262841969 | V6: =1-(LN(1-V$1))/$A6 -> 5.714446670421399 | W6: =1-(LN(1-W$1))/$A6 -> 5.969227185969995 | X6: =1-(LN(1-X$1))/$A6 -> 6.2272952826881518 | Y6: =1-(LN(1-Y$1))/$A6 -> 6.4887369140352078 | Z6: =1-(LN(1-Z$1))/$A6 -> 6.7536414490356176 | AA6: =1-(LN(1-AA$1))/$A6 -> 7.0221018556784323 | AB6: =1-(LN(1-AB$1))/$A6 -> 7.2942148967940046 | AC6: =1-(LN(1-AC$1))/$A6 -> 7.5700813394407218 | AD6: =1-(LN(1-AD$1))/$A6 -> 7.8498061789355198 | AE6: =1-(LN(1-AE$1))/$A6 -> 8.1334988787746489 | AF6: =1-(LN(1-AF$1))/$A6 -> 8.4212736278166407 | AG6: =1-(LN(1-AG$1))/$A6 -> 8.7132496162396951 | AH6: =1-(LN(1-AH$1))/$A6 -> 9.0095513319425073 | AI6: =1-(LN(1-AI$1))/$A6 -> 9.3103088792333182 | AJ6: =1-(LN(1-AJ$1))/$A6 -> 9.6156583218490876 | AK6: =1-(LN(1-AK$1))/$A6 -> 9.9257420525683919 | AL6: =1-(LN(1-AL$1))/$A6 -> 10.240709191931176 | AM6: =1-(LN(1-AM$1))/$A6 -> 10.560716018859999 | AN6: =1-(LN(1-AN$1))/$A6 -> 10.885926436295605 | AO6: =1-(LN(1-AO$1))/$A6 -> 11.216512475319819 | AP6: =1-(LN(1-AP$1))/$A6 -> 11.552654841647444 | AQ6: =1-(LN(1-AQ$1))/$A6 -> 11.894543508833445 | AR6: =1-(LN(1-AR$1))/$A6 -> 12.242378363070831 | AS6: =1-(LN(1-AS$1))/$A6 -> 12.596369905058848 | AT6: =1-(LN(1-AT$1))/$A6 -> 12.956740015112414 | AU6: =1-(LN(1-AU$1))/$A6 -> 13.323722788476346 | AV6: =1-(LN(1-AV$1))/$A6 -> 13.697565448719399 | AW6: =1-(LN(1-AW$1))/$A6 -> 14.078529348133287 | AX6: =1-(LN(1-AX$1))/$A6 -> 14.466891065275318 | AY6: =1-(LN(1-AY$1))/$A6 -> 14.862943611198913 | AZ6: =1-(LN(1-AZ$1))/$A6 -> 15.266997757549303 | BA6: =1-(LN(1-BA$1))/$A6 -> 15.679383501604018 | BB6: =1-(LN(1-BB$1))/$A6 -> 16.100451685560664 | BC6: =1-(LN(1-BC$1))/$A6 -> 16.530575789979938 | BD6: =1-(LN(1-BD$1))/$A6 -> 16.970153924355444 | BE6: =1-(LN(1-BE$1))/$A6 -> 17.419611041396614 | BF6: =1-(LN(1-BF$1))/$A6 -> 17.87940140589059 | BG6: =1-(LN(1-BG$1))/$A6 -> 18.350011354094473 | BH6: =1-(LN(1-BH$1))/$A6 -> 18.831962385675684 | BI6: =1-(LN(1-BI$1))/$A6 -> 19.325814637483116 | BJ6: =1-(LN(1-BJ$1))/$A6 -> 19.832170797168914 | BK6: =1-(LN(1-BK$1))/$A6 -> 20.35168052523413 | BL6: =1-(LN(1-BL$1))/$A6 -> 20.885045466877354 | BM6: =1-(LN(1-BM$1))/$A6 -> 21.433024950639645 | BN6: =1-(LN(1-BN$1))/$A6 -> 21.996442489973575 | BO6: =1-(LN(1-BO$1))/$A6 -> 22.576193227438623 | BP6: =1-(LN(1-BP$1))/$A6 -> 23.173252490432244 | BQ6: =1-(LN(1-BQ$1))/$A6 -> 23.788685663767318 | BR6: =1-(LN(1-BR$1))/$A6 -> 24.423659630058928 | BS6: =1-(LN(1-BS$1))/$A6 -> 25.079456086518743 | BT6: =1-(LN(1-BT$1))/$A6 -> 25.757487120032373 | BU6: =1-(LN(1-BU$1))/$A6 -> 26.459313516257776 | BV6: =1-(LN(1-BV$1))/$A6 -> 27.186666399675275 | BW6: =1-(LN(1-BW$1))/$A6 -> 27.94147295933222 | BX6: =1-(LN(1-BX$1))/$A6 -> 28.725887222397844 | BY6: =1-(LN(1-BY$1))/$A6 -> 29.542327112802951 | BZ6: =1-(LN(1-BZ$1))/$A6 -> 30.393519401178871 | CA6: =1-(LN(1-CA$1))/$A6 -> 31.282554652595554 | CB6: =1-(LN(1-CB$1))/$A6 -> 32.212954965293406 | CC6: =1-(LN(1-CC$1))/$A6 -> 33.188758248682049 | CD6: =1-(LN(1-CD$1))/$A6 -> 34.214624136433066 | CE6: =1-(LN(1-CE$1))/$A6 -> 35.295968561838585 | CF6: =1-(LN(1-CF$1))/$A6 -> 36.439136838637566 | CG6: =1-(LN(1-CG$1))/$A6 -> 37.651629274966261 | CH6: =1-(LN(1-CH$1))/$A6 -> 38.942399697717697 | CI6: =1-(LN(1-CI$1))/$A6 -> 40.32225712745673 | CJ6: =1-(LN(1-CJ$1))/$A6 -> 41.804416570531181 | CK6: =1-(LN(1-CK$1))/$A6 -> 43.405270724001916 | CL6: =1-(LN(1-CL$1))/$A6 -> 45.145498263794515 | CM6: =1-(LN(1-CM$1))/$A6 -> 47.051701859881028 | CN6: =1-(LN(1-CN$1))/$A6 -> 49.158912173037564 | CO6: =1-(LN(1-CO$1))/$A6 -> 51.514572886165254 | CP6: =1-(LN(1-CP$1))/$A6 -> 54.18520073865573 | CQ6: =1-(LN(1-CQ$1))/$A6 -> 57.268214335200931 | CR6: =1-(LN(1-CR$1))/$A6 -> 60.914645471080064 | CS6: =1-(LN(1-CS$1))/$A6 -> 65.377516497364326 | CT6: =1-(LN(1-CT$1))/$A6 -> 71.131157946400052 | CU6: =1-(LN(1-CU$1))/$A6 -> 79.240460108563568 | CV6: =1-(LN(1-CV$1))/$A6 -> 93.103403719763151
A7: =A6+0.01 -> 00.06 | B7: =1-(LN(1-B$1))/$A7 -> 1.1675055975583575 | C7: =1-(LN(1-C$1))/$A7 -> 1.3367117886253244 | D7: =1-(LN(1-D$1))/$A7 -> 1.5076534580784762 | E7: =1-(LN(1-E$1))/$A7 -> 1.680366575337586 | F7: =1-(LN(1-F$1))/$A7 -> 1.8548882397925097 | G7: =1-(LN(1-G$1))/$A7 -> 2.031256728634792 | H7: =1-(LN(1-H$1))/$A7 -> 2.2095115472472582 | I7: =1-(LN(1-I$1))/$A7 -> 2.3896934823175169 | J7: =1-(LN(1-J$1))/$A7 -> 2.5718446578540215 | K7: =1-(LN(1-K$1))/$A7 -> 2.7560085942971044 | L7: =1-(LN(1-L$1))/$A7 -> 2.9422302709325248 | M7: =1-(LN(1-M$1))/$A7 -> 3.1305561918314146 | N7: =1-(LN(1-N$1))/$A7 -> 3.3210344555584608 | O7: =1-(LN(1-O$1))/$A7 -> 3.5137148289097273 | P7: =1-(LN(1-P$1))/$A7 -> 3.7086488249629155 | Q7: =1-(LN(1-Q$1))/$A7 -> 3.9058897857462966 | R7: =1-(LN(1-R$1))/$A7 -> 4.1054929698582239 | S7: =1-(LN(1-S$1))/$A7 -> 4.3075156453973049 | T7: =1-(LN(1-T$1))/$A7 -> 4.5120171885942106 | U7: =1-(LN(1-U$1))/$A7 -> 4.7190591885701636 | V7: =1-(LN(1-V$1))/$A7 -> 4.9287055586844986 | W7: =1-(LN(1-W$1))/$A7 -> 5.1410226549749956 | X7: =1-(LN(1-X$1))/$A7 -> 5.3560794022401268 | Y7: =1-(LN(1-Y$1))/$A7 -> 5.5739474283626729 | Z7: =1-(LN(1-Z$1))/$A7 -> 5.7947012075296813 | AA7: =1-(LN(1-AA$1))/$A7 -> 6.0184182130653596 | AB7: =1-(LN(1-AB$1))/$A7 -> 6.2451790806616705 | AC7: =1-(LN(1-AC$1))/$A7 -> 6.475067782867268 | AD7: =1-(LN(1-AD$1))/$A7 -> 6.7081718157795995 | AE7: =1-(LN(1-AE$1))/$A7 -> 6.9445823989788735 | AF7: =1-(LN(1-AF$1))/$A7 -> 7.1843946898472009 | AG7: =1-(LN(1-AG$1))/$A7 -> 7.4277080135330795 | AH7: =1-(LN(1-AH$1))/$A7 -> 7.67462610995209 | AI7: =1-(LN(1-AI$1))/$A7 -> 7.9252573993610991 | AJ7: =1-(LN(1-AJ$1))/$A7 -> 8.1797152682075733 | AK7: =1-(LN(1-AK$1))/$A7 -> 8.4381183771403272 | AL7: =1-(LN(1-AL$1))/$A7 -> 8.7005909932759806 | AM7: =1-(LN(1-AM$1))/$A7 -> 8.9672633490500004 | AN7: =1-(LN(1-AN$1))/$A7 -> 9.238272030246339 | AO7: =1-(LN(1-AO$1))/$A7 -> 9.5137603960998476 | AP7: =1-(LN(1-AP$1))/$A7 -> 9.7938790347062028 | AQ7: =1-(LN(1-AQ$1))/$A7 -> 10.078786257361203 | AR7: =1-(LN(1-AR$1))/$A7 -> 10.368648635892358 | AS7: =1-(LN(1-AS$1))/$A7 -> 10.663641587549041 | AT7: =1-(LN(1-AT$1))/$A7 -> 10.963950012593678 | AU7: =1-(LN(1-AU$1))/$A7 -> 11.269768990396955 | AV7: =1-(LN(1-AV$1))/$A7 -> 11.581304540599499 | AW7: =1-(LN(1-AW$1))/$A7 -> 11.898774456777739 | AX7: =1-(LN(1-AX$1))/$A7 -> 12.222409221062765 | AY7: =1-(LN(1-AY$1))/$A7 -> 12.552453009332428 | AZ7: =1-(LN(1-AZ$1))/$A7 -> 12.889164797957752 | BA7: =1-(LN(1-BA$1))/$A7 -> 13.232819584670015 | BB7: =1-(LN(1-BB$1))/$A7 -> 13.58370973796722 | BC7: =1-(LN(1-BC$1))/$A7 -> 13.942146491649948 | BD7: =1-(LN(1-BD$1))/$A7 -> 14.308461603629535 | BE7: =1-(LN(1-BE$1))/$A7 -> 14.683009201163845 | BF7: =1-(LN(1-BF$1))/$A7 -> 15.06616783824216 | BG7: =1-(LN(1-BG$1))/$A7 -> 15.458342795078728 | BH7: =1-(LN(1-BH$1))/$A7 -> 15.859968654729737 | BI7: =1-(LN(1-BI$1))/$A7 -> 16.271512197902595 | BJ7: =1-(LN(1-BJ$1))/$A7 -> 16.693475664307428 | BK7: =1-(LN(1-BK$1))/$A7 -> 17.126400437695107 | BL7: =1-(LN(1-BL$1))/$A7 -> 17.570871222397795 | BM7: =1-(LN(1-BM$1))/$A7 -> 18.027520792199706 | BN7: =1-(LN(1-BN$1))/$A7 -> 18.497035408311312 | BO7: =1-(LN(1-BO$1))/$A7 -> 18.980161022865516 | BP7: =1-(LN(1-BP$1))/$A7 -> 19.477710408693536 | BQ7: =1-(LN(1-BQ$1))/$A7 -> 19.990571386472762 | BR7: =1-(LN(1-BR$1))/$A7 -> 20.519716358382439 | BS7: =1-(LN(1-BS$1))/$A7 -> 21.066213405432286 | BT7: =1-(LN(1-BT$1))/$A7 -> 21.631239266693644 | BU7: =1-(LN(1-BU$1))/$A7 -> 22.216094596881479 | BV7: =1-(LN(1-BV$1))/$A7 -> 22.822221999729393 | BW7: =1-(LN(1-BW$1))/$A7 -> 23.451227466110183 | BX7: =1-(LN(1-BX$1))/$A7 -> 24.10490601866487 | BY7: =1-(LN(1-BY$1))/$A7 -> 24.785272594002457 | BZ7: =1-(LN(1-BZ$1))/$A7 -> 25.494599500982392 | CA7: =1-(LN(1-CA$1))/$A7 -> 26.235462210496294 | CB7: =1-(LN(1-CB$1))/$A7 -> 27.010795804411174 | CC7: =1-(LN(1-CC$1))/$A7 -> 27.823965207235045 | CD7: =1-(LN(1-CD$1))/$A7 -> 28.678853447027556 | CE7: =1-(LN(1-CE$1))/$A7 -> 29.579973801532155 | CF7: =1-(LN(1-CF$1))/$A7 -> 30.532614032197969 | CG7: =1-(LN(1-CG$1))/$A7 -> 31.543024395805219 | CH7: =1-(LN(1-CH$1))/$A7 -> 32.618666414764746 | CI7: =1-(LN(1-CI$1))/$A7 -> 33.768547606213943 | CJ7: =1-(LN(1-CJ$1))/$A7 -> 35.00368047544265 | CK7: =1-(LN(1-CK$1))/$A7 -> 36.337725603334931 | CL7: =1-(LN(1-CL$1))/$A7 -> 37.787915219828761 | CM7: =1-(LN(1-CM$1))/$A7 -> 39.376418216567522 | CN7: =1-(LN(1-CN$1))/$A7 -> 41.132426810864636 | CO7: =1-(LN(1-CO$1))/$A7 -> 43.095477405137707 | CP7: =1-(LN(1-CP$1))/$A7 -> 45.321000615546446 | CQ7: =1-(LN(1-CQ$1))/$A7 -> 47.890178612667441 | CR7: =1-(LN(1-CR$1))/$A7 -> 50.928871225900053 | CS7: =1-(LN(1-CS$1))/$A7 -> 54.647930414470274 | CT7: =1-(LN(1-CT$1))/$A7 -> 59.44263162200005 | CU7: =1-(LN(1-CU$1))/$A7 -> 66.200383423802961 | CV7: =1-(LN(1-CV$1))/$A7 -> 77.752836433135954
A8: =A7+0.01 -> 00.07 | B8: =1-(LN(1-B$1))/$A8 -> 1.1435762264785923 | C8: =1-(LN(1-C$1))/$A8 -> 1.2886101045359923 | D8: =1-(LN(1-D$1))/$A8 -> 1.4351315354958367 | E8: =1-(LN(1-E$1))/$A8 -> 1.5831713502893594 | F8: =1-(LN(1-F$1))/$A8 -> 1.7327613483935798 | G8: =1-(LN(1-G$1))/$A8 -> 1.8839343388298218 | H8: =1-(LN(1-H$1))/$A8 -> 2.0367241833547927 | I8: =1-(LN(1-I$1))/$A8 -> 2.191165841986443 | J8: =1-(LN(1-J$1))/$A8 -> 2.3472954210177326 | K8: =1-(LN(1-K$1))/$A8 -> 2.5051502236832324 | L8: =1-(LN(1-L$1))/$A8 -> 2.6647688036564499 | M8: =1-(LN(1-M$1))/$A8 -> 2.8261910215697839 | N8: =1-(LN(1-N$1))/$A8 -> 2.9894581047643949 | O8: =1-(LN(1-O$1))/$A8 -> 3.1546127104940522 | P8: =1-(LN(1-P$1))/$A8 -> 3.3216989928253562 | Q8: =1-(LN(1-Q$1))/$A8 -> 3.4907626734968256 | R8: =1-(LN(1-R$1))/$A8 -> 3.6618511170213353 | S8: =1-(LN(1-S$1))/$A8 -> 3.8350134103405469 | T8: =1-(LN(1-T$1))/$A8 -> 4.0103004473664665 | U8: =1-(LN(1-U$1))/$A8 -> 4.1877650187744262 | V8: =1-(LN(1-V$1))/$A8 -> 4.3674619074438565 | W8: =1-(LN(1-W$1))/$A8 -> 4.5494479899785674 | X8: =1-(LN(1-X$1))/$A8 -> 4.7337823447772518 | Y8: =1-(LN(1-Y$1))/$A8 -> 4.9205263671680051 | Z8: =1-(LN(1-Z$1))/$A8 -> 5.1097438921682983 | AA8: =1-(LN(1-AA$1))/$A8 -> 5.301501325484594 | AB8: =1-(LN(1-AB$1))/$A8 -> 5.4958677834242886 | AC8: =1-(LN(1-AC$1))/$A8 -> 5.6929152424576586 | AD8: =1-(LN(1-AD$1))/$A8 -> 5.8927186992396567 | AE8: =1-(LN(1-AE$1))/$A8 -> 6.0953563419818915 | AF8: =1-(LN(1-AF$1))/$A8 -> 6.3009097341547431 | AG8: =1-(LN(1-AG$1))/$A8 -> 6.5094640115997819 | AH8: =1-(LN(1-AH$1))/$A8 -> 6.7211080942446486 | AI8: =1-(LN(1-AI$1))/$A8 -> 6.9359349137380848 | AJ8: =1-(LN(1-AJ$1))/$A8 -> 7.1540416584636333 | AK8: =1-(LN(1-AK$1))/$A8 -> 7.3755300375488515 | AL8: =1-(LN(1-AL$1))/$A8 -> 7.6005065656651256 | AM8: =1-(LN(1-AM$1))/$A8 -> 7.8290828706142852 | AN8: =1-(LN(1-AN$1))/$A8 -> 8.0613760259254335 | AO8: =1-(LN(1-AO$1))/$A8 -> 8.297508910942728 | AP8: =1-(LN(1-AP$1))/$A8 -> 8.5376106011767448 | AQ8: =1-(LN(1-AQ$1))/$A8 -> 8.7818167920238892 | AR8: =1-(LN(1-AR$1))/$A8 -> 9.0302702593363069 | AS8: =1-(LN(1-AS$1))/$A8 -> 9.2831213607563203 | AT8: =1-(LN(1-AT$1))/$A8 -> 9.5405285822231534 | AU8: =1-(LN(1-AU$1))/$A8 -> 9.8026591346259604 | AV8: =1-(LN(1-AV$1))/$A8 -> 10.069689606228142 | AW8: =1-(LN(1-AW$1))/$A8 -> 10.341806677238061 | AX8: =1-(LN(1-AX$1))/$A8 -> 10.619207903768084 | AY8: =1-(LN(1-AY$1))/$A8 -> 10.902102579427796 | AZ8: =1-(LN(1-AZ$1))/$A8 -> 11.190712683963788 | BA8: =1-(LN(1-BA$1))/$A8 -> 11.485273929717156 | BB8: =1-(LN(1-BB$1))/$A8 -> 11.786036918257617 | BC8: =1-(LN(1-BC$1))/$A8 -> 12.093268421414241 | BD8: =1-(LN(1-BD$1))/$A8 -> 12.40725280311103 | BE8: =1-(LN(1-BE$1))/$A8 -> 12.728293600997581 | BF8: =1-(LN(1-BF$1))/$A8 -> 13.056715289921851 | BG8: =1-(LN(1-BG$1))/$A8 -> 13.392865252924624 | BH8: =1-(LN(1-BH$1))/$A8 -> 13.737115989768347 | BI8: =1-(LN(1-BI$1))/$A8 -> 14.089867598202225 | BJ8: =1-(LN(1-BJ$1))/$A8 -> 14.451550569406367 | BK8: =1-(LN(1-BK$1))/$A8 -> 14.822628946595806 | BL8: =1-(LN(1-BL$1))/$A8 -> 15.203603904912395 | BM8: =1-(LN(1-BM$1))/$A8 -> 15.595017821885461 | BN8: =1-(LN(1-BN$1))/$A8 -> 15.997458921409695 | BO8: =1-(LN(1-BO$1))/$A8 -> 16.411566591027587 | BP8: =1-(LN(1-BP$1))/$A8 -> 16.838037493165888 | BQ8: =1-(LN(1-BQ$1))/$A8 -> 17.277632616976653 | BR8: =1-(LN(1-BR$1))/$A8 -> 17.731185450042091 | BS8: =1-(LN(1-BS$1))/$A8 -> 18.199611490370529 | BT8: =1-(LN(1-BT$1))/$A8 -> 18.683919371451694 | BU8: =1-(LN(1-BU$1))/$A8 -> 19.185223940184127 | BV8: =1-(LN(1-BV$1))/$A8 -> 19.704761714053767 | BW8: =1-(LN(1-BW$1))/$A8 -> 20.243909256665869 | BX8: =1-(LN(1-BX$1))/$A8 -> 20.804205158855602 | BY8: =1-(LN(1-BY$1))/$A8 -> 21.387376509144964 | BZ8: =1-(LN(1-BZ$1))/$A8 -> 21.995371000842052 | CA8: =1-(LN(1-CA$1))/$A8 -> 22.630396180425393 | CB8: =1-(LN(1-CB$1))/$A8 -> 23.294967832352434 | CC8: =1-(LN(1-CC$1))/$A8 -> 23.991970177630037 | CD8: =1-(LN(1-CD$1))/$A8 -> 24.724731526023621 | CE8: =1-(LN(1-CE$1))/$A8 -> 25.497120401313275 | CF8: =1-(LN(1-CF$1))/$A8 -> 26.313669170455402 | CG8: =1-(LN(1-CG$1))/$A8 -> 27.179735196404472 | CH8: =1-(LN(1-CH$1))/$A8 -> 28.101714069798351 | CI8: =1-(LN(1-CI$1))/$A8 -> 29.087326519611949 | CJ8: =1-(LN(1-CJ$1))/$A8 -> 30.146011836093699 | CK8: =1-(LN(1-CK$1))/$A8 -> 31.289479088572797 | CL8: =1-(LN(1-CL$1))/$A8 -> 32.532498759853226 | CM8: =1-(LN(1-CM$1))/$A8 -> 33.894072757057877 | CN8: =1-(LN(1-CN$1))/$A8 -> 35.399222980741115 | CO8: =1-(LN(1-CO$1))/$A8 -> 37.081837775832319 | CP8: =1-(LN(1-CP$1))/$A8 -> 38.98942909903981 | CQ8: =1-(LN(1-CQ$1))/$A8 -> 41.191581668000659 | CR8: =1-(LN(1-CR$1))/$A8 -> 43.79617533648576 | CS8: =1-(LN(1-CS$1))/$A8 -> 46.983940355260231 | CT8: =1-(LN(1-CT$1))/$A8 -> 51.093684247428612 | CU8: =1-(LN(1-CU$1))/$A8 -> 56.886042934688255 | CV8: =1-(LN(1-CV$1))/$A8 -> 66.788145514116536
A9: =A8+0.01 -> 00.08 | B9: =1-(LN(1-B$1))/$A9 -> 1.1256291981687681 | C9: =1-(LN(1-C$1))/$A9 -> 1.2525338414689933 | D9: =1-(LN(1-D$1))/$A9 -> 1.3807400935588572 | E9: =1-(LN(1-E$1))/$A9 -> 1.5102749315031896 | F9: =1-(LN(1-F$1))/$A9 -> 1.6411661798443822 | G9: =1-(LN(1-G$1))/$A9 -> 1.7734425464760941 | H9: =1-(LN(1-H$1))/$A9 -> 1.9071336604354436 | I9: =1-(LN(1-I$1))/$A9 -> 2.0422701117381377 | J9: =1-(LN(1-J$1))/$A9 -> 2.1788834933905159 | K9: =1-(LN(1-K$1))/$A9 -> 2.3170064457228285 | L9: =1-(LN(1-L$1))/$A9 -> 2.456672703199394 | M9: =1-(LN(1-M$1))/$A9 -> 2.5979171438735609 | N9: =1-(LN(1-N$1))/$A9 -> 2.7407758416688459 | O9: =1-(LN(1-O$1))/$A9 -> 2.885286121682296 | P9: =1-(LN(1-P$1))/$A9 -> 3.0314866187221865 | Q9: =1-(LN(1-Q$1))/$A9 -> 3.1794173393097225 | R9: =1-(LN(1-R$1))/$A9 -> 3.3291197273936683 | S9: =1-(LN(1-S$1))/$A9 -> 3.4806367340479789 | T9: =1-(LN(1-T$1))/$A9 -> 3.6340128914456584 | U9: =1-(LN(1-U$1))/$A9 -> 3.7892943914276231 | V9: =1-(LN(1-V$1))/$A9 -> 3.9465291690133744 | W9: =1-(LN(1-W$1))/$A9 -> 4.1057669912312473 | X9: =1-(LN(1-X$1))/$A9 -> 4.2670595516800951 | Y9: =1-(LN(1-Y$1))/$A9 -> 4.4304605712720049 | Z9: =1-(LN(1-Z$1))/$A9 -> 4.5960259056472612 | AA9: =1-(LN(1-AA$1))/$A9 -> 4.7638136597990197 | AB9: =1-(LN(1-AB$1))/$A9 -> 4.9338843104962535 | AC9: =1-(LN(1-AC$1))/$A9 -> 5.1063008371504512 | AD9: =1-(LN(1-AD$1))/$A9 -> 5.2811288618347003 | AE9: =1-(LN(1-AE$1))/$A9 -> 5.4584367992341551 | AF9: =1-(LN(1-AF$1))/$A9 -> 5.6382960173854011 | AG9: =1-(LN(1-AG$1))/$A9 -> 5.8207810101498101 | AH9: =1-(LN(1-AH$1))/$A9 -> 6.0059695824640675 | AI9: =1-(LN(1-AI$1))/$A9 -> 6.1939430495208248 | AJ9: =1-(LN(1-AJ$1))/$A9 -> 6.38478645115568 | AK9: =1-(LN(1-AK$1))/$A9 -> 6.5785887828552454 | AL9: =1-(LN(1-AL$1))/$A9 -> 6.7754432449569855 | AM9: =1-(LN(1-AM$1))/$A9 -> 6.9754475117875003 | AN9: =1-(LN(1-AN$1))/$A9 -> 7.1787040226847543 | AO9: =1-(LN(1-AO$1))/$A9 -> 7.3853202970748866 | AP9: =1-(LN(1-AP$1))/$A9 -> 7.5954092760296525 | AQ9: =1-(LN(1-AQ$1))/$A9 -> 7.8090896930209031 | AR9: =1-(LN(1-AR$1))/$A9 -> 8.0264864769192688 | AS9: =1-(LN(1-AS$1))/$A9 -> 8.2477311906617814 | AT9: =1-(LN(1-AT$1))/$A9 -> 8.4729625094452601 | AU9: =1-(LN(1-AU$1))/$A9 -> 8.702326742797716 | AV9: =1-(LN(1-AV$1))/$A9 -> 8.9359784054496245 | AW9: =1-(LN(1-AW$1))/$A9 -> 9.1740808425833045 | AX9: =1-(LN(1-AX$1))/$A9 -> 9.4168069157970749 | AY9: =1-(LN(1-AY$1))/$A9 -> 9.6643397569993219 | AZ9: =1-(LN(1-AZ$1))/$A9 -> 9.9168735984683156 | BA9: =1-(LN(1-BA$1))/$A9 -> 10.174614688502512 | BB9: =1-(LN(1-BB$1))/$A9 -> 10.437782303475416 | BC9: =1-(LN(1-BC$1))/$A9 -> 10.706609868737461 | BD9: =1-(LN(1-BD$1))/$A9 -> 10.981346202722152 | BE9: =1-(LN(1-BE$1))/$A9 -> 11.262256900872885 | BF9: =1-(LN(1-BF$1))/$A9 -> 11.549625878681621 | BG9: =1-(LN(1-BG$1))/$A9 -> 11.843757096309046 | BH9: =1-(LN(1-BH$1))/$A9 -> 12.144976491047304 | BI9: =1-(LN(1-BI$1))/$A9 -> 12.453634148426948 | BJ9: =1-(LN(1-BJ$1))/$A9 -> 12.770106748230571 | BK9: =1-(LN(1-BK$1))/$A9 -> 13.094800328271331 | BL9: =1-(LN(1-BL$1))/$A9 -> 13.428153416798347 | BM9: =1-(LN(1-BM$1))/$A9 -> 13.770640594149778 | BN9: =1-(LN(1-BN$1))/$A9 -> 14.122776556233484 | BO9: =1-(LN(1-BO$1))/$A9 -> 14.485120767149139 | BP9: =1-(LN(1-BP$1))/$A9 -> 14.858282806520153 | BQ9: =1-(LN(1-BQ$1))/$A9 -> 15.242928539854574 | BR9: =1-(LN(1-BR$1))/$A9 -> 15.639787268786829 | BS9: =1-(LN(1-BS$1))/$A9 -> 16.049660054074216 | BT9: =1-(LN(1-BT$1))/$A9 -> 16.473429450020234 | BU9: =1-(LN(1-BU$1))/$A9 -> 16.91207094766111 | BV9: =1-(LN(1-BV$1))/$A9 -> 17.366666499797049 | BW9: =1-(LN(1-BW$1))/$A9 -> 17.838420599582637 | BX9: =1-(LN(1-BX$1))/$A9 -> 18.328679513998654 | BY9: =1-(LN(1-BY$1))/$A9 -> 18.838954445501845 | BZ9: =1-(LN(1-BZ$1))/$A9 -> 19.370949625736795 | CA9: =1-(LN(1-CA$1))/$A9 -> 19.926596657872221 | CB9: =1-(LN(1-CB$1))/$A9 -> 20.508096853308381 | CC9: =1-(LN(1-CC$1))/$A9 -> 21.117973905426282 | CD9: =1-(LN(1-CD$1))/$A9 -> 21.759140085270669 | CE9: =1-(LN(1-CE$1))/$A9 -> 22.434980351149118 | CF9: =1-(LN(1-CF$1))/$A9 -> 23.149460524148477 | CG9: =1-(LN(1-CG$1))/$A9 -> 23.907268296853918 | CH9: =1-(LN(1-CH$1))/$A9 -> 24.71399981107356 | CI9: =1-(LN(1-CI$1))/$A9 -> 25.576410704660457 | CJ9: =1-(LN(1-CJ$1))/$A9 -> 26.502760356581987 | CK9: =1-(LN(1-CK$1))/$A9 -> 27.503294202501198 | CL9: =1-(LN(1-CL$1))/$A9 -> 28.590936414871575 | CM9: =1-(LN(1-CM$1))/$A9 -> 29.782313662425647 | CN9: =1-(LN(1-CN$1))/$A9 -> 31.099320108148479 | CO9: =1-(LN(1-CO$1))/$A9 -> 32.571608053853282 | CP9: =1-(LN(1-CP$1))/$A9 -> 34.240750461659836 | CQ9: =1-(LN(1-CQ$1))/$A9 -> 36.167633959500584 | CR9: =1-(LN(1-CR$1))/$A9 -> 38.44665341942504 | CS9: =1-(LN(1-CS$1))/$A9 -> 41.235947810852707 | CT9: =1-(LN(1-CT$1))/$A9 -> 44.831973716500038 | CU9: =1-(LN(1-CU$1))/$A9 -> 49.900287567852232 | CV9: =1-(LN(1-CV$1))/$A9 -> 58.564627324851969
A10: =A9+0.01 -> 00.09 | B10: =1-(LN(1-B$1))/$A10 -> 1.1116703983722382 | C10: =1-(LN(1-C$1))/$A10 -> 1.2244745257502163 | D10: =1-(LN(1-D$1))/$A10 -> 1.3384356387189842 | E10: =1-(LN(1-E$1))/$A10 -> 1.4535777168917241 | F10: =1-(LN(1-F$1))/$A10 -> 1.5699254931950064 | G10: =1-(LN(1-G$1))/$A10 -> 1.687504485756528 | H10: =1-(LN(1-H$1))/$A10 -> 1.8063410314981723 | I10: =1-(LN(1-I$1))/$A10 -> 1.9264623215450114 | J10: =1-(LN(1-J$1))/$A10 -> 2.0478964385693477 | K10: =1-(LN(1-K$1))/$A10 -> 2.1706723961980696 | L10: =1-(LN(1-L$1))/$A10 -> 2.2948201806216835 | M10: =1-(LN(1-M$1))/$A10 -> 2.4203707945542767 | N10: =1-(LN(1-N$1))/$A10 -> 2.5473563037056408 | O10: =1-(LN(1-O$1))/$A10 -> 2.6758098859398185 | P10: =1-(LN(1-P$1))/$A10 -> 2.8057658833086103 | Q10: =1-(LN(1-Q$1))/$A10 -> 2.9372598571641979 | R10: =1-(LN(1-R$1))/$A10 -> 3.07032864657215 | S10: =1-(LN(1-S$1))/$A10 -> 3.2050104302648701 | T10: =1-(LN(1-T$1))/$A10 -> 3.341344792396141 | U10: =1-(LN(1-U$1))/$A10 -> 3.4793727923801097 | V10: =1-(LN(1-V$1))/$A10 -> 3.6191370391229998 | W10: =1-(LN(1-W$1))/$A10 -> 3.7606817699833308 | X10: =1-(LN(1-X$1))/$A10 -> 3.9040529348267516 | Y10: =1-(LN(1-Y$1))/$A10 -> 4.0492982855751158 | Z10: =1-(LN(1-Z$1))/$A10 -> 4.1964674716864545 | AA10: =1-(LN(1-AA$1))/$A10 -> 4.3456121420435743 | AB10: =1-(LN(1-AB$1))/$A10 -> 4.4967860537744473 | AC10: =1-(LN(1-AC$1))/$A10 -> 4.6500451885781793 | AD10: =1-(LN(1-AD$1))/$A10 -> 4.8054478771864009 | AE10: =1-(LN(1-AE$1))/$A10 -> 4.9630549326525824 | AF10: =1-(LN(1-AF$1))/$A10 -> 5.1229297932314672 | AG10: =1-(LN(1-AG$1))/$A10 -> 5.28513867568872 | AH10: =1-(LN(1-AH$1))/$A10 -> 5.44975073996806 | AI10: =1-(LN(1-AI$1))/$A10 -> 5.616838266240733 | AJ10: =1-(LN(1-AJ$1))/$A10 -> 5.7864768454717153 | AK10: =1-(LN(1-AK$1))/$A10 -> 5.9587455847602184 | AL10: =1-(LN(1-AL$1))/$A10 -> 6.1337273288506537 | AM10: =1-(LN(1-AM$1))/$A10 -> 6.3115088993666673 | AN10: =1-(LN(1-AN$1))/$A10 -> 6.4921813534975596 | AO10: =1-(LN(1-AO$1))/$A10 -> 6.6758402640665659 | AP10: =1-(LN(1-AP$1))/$A10 -> 6.8625860231374691 | AQ10: =1-(LN(1-AQ$1))/$A10 -> 7.0525241715741362 | AR10: =1-(LN(1-AR$1))/$A10 -> 7.245765757261573 | AS10: =1-(LN(1-AS$1))/$A10 -> 7.4424277250326947 | AT10: =1-(LN(1-AT$1))/$A10 -> 7.6426333417291197 | AU10: =1-(LN(1-AU$1))/$A10 -> 7.8465126602646365 | AV10: =1-(LN(1-AV$1))/$A10 -> 8.0542030270663325 | AW10: =1-(LN(1-AW$1))/$A10 -> 8.2658496378518258 | AX10: =1-(LN(1-AX$1))/$A10 -> 8.481606147375178 | AY10: =1-(LN(1-AY$1))/$A10 -> 8.7016353395549526 | AZ10: =1-(LN(1-AZ$1))/$A10 -> 8.9261098653051683 | BA10: =1-(LN(1-BA$1))/$A10 -> 9.1552130564466783 | BB10: =1-(LN(1-BB$1))/$A10 -> 9.3891398253114815 | BC10: =1-(LN(1-BC$1))/$A10 -> 9.6280976610999662 | BD10: =1-(LN(1-BD$1))/$A10 -> 9.872307735753024 | BE10: =1-(LN(1-BE$1))/$A10 -> 10.122006134109231 | BF10: =1-(LN(1-BF$1))/$A10 -> 10.377445225494775 | BG10: =1-(LN(1-BG$1))/$A10 -> 10.638895196719153 | BH10: =1-(LN(1-BH$1))/$A10 -> 10.906645769819827 | BI10: =1-(LN(1-BI$1))/$A10 -> 11.181008131935066 | BJ10: =1-(LN(1-BJ$1))/$A10 -> 11.462317109538287 | BK10: =1-(LN(1-BK$1))/$A10 -> 11.750933625130072 | BL10: =1-(LN(1-BL$1))/$A10 -> 12.047247481598532 | BM10: =1-(LN(1-BM$1))/$A10 -> 12.351680528133137 | BN10: =1-(LN(1-BN$1))/$A10 -> 12.664690272207542 | BO10: =1-(LN(1-BO$1))/$A10 -> 12.986774015243679 | BP10: =1-(LN(1-BP$1))/$A10 -> 13.318473605795692 | BQ10: =1-(LN(1-BQ$1))/$A10 -> 13.660380924315177 | BR10: =1-(LN(1-BR$1))/$A10 -> 14.013144238921628 | BS10: =1-(LN(1-BS$1))/$A10 -> 14.377475603621525 | BT10: =1-(LN(1-BT$1))/$A10 -> 14.754159511129098 | BU10: =1-(LN(1-BU$1))/$A10 -> 15.144063064587655 | BV10: =1-(LN(1-BV$1))/$A10 -> 15.548147999819598 | BW10: =1-(LN(1-BW$1))/$A10 -> 15.967484977406789 | BX10: =1-(LN(1-BX$1))/$A10 -> 16.403270679109916 | BY10: =1-(LN(1-BY$1))/$A10 -> 16.856848396001638 | BZ10: =1-(LN(1-BZ$1))/$A10 -> 17.329733000654929 | CA10: =1-(LN(1-CA$1))/$A10 -> 17.823641473664196 | CB10: =1-(LN(1-CB$1))/$A10 -> 18.34053053627412 | CC10: =1-(LN(1-CC$1))/$A10 -> 18.882643471490031 | CD10: =1-(LN(1-CD$1))/$A10 -> 19.452568964685039 | CE10: =1-(LN(1-CE$1))/$A10 -> 20.053315867688106 | CF10: =1-(LN(1-CF$1))/$A10 -> 20.688409354798647 | CG10: =1-(LN(1-CG$1))/$A10 -> 21.362016263870149 | CH10: =1-(LN(1-CH$1))/$A10 -> 22.079110943176499 | CI10: =1-(LN(1-CI$1))/$A10 -> 22.845698404142631 | CJ10: =1-(LN(1-CJ$1))/$A10 -> 23.669120316961767 | CK10: =1-(LN(1-CK$1))/$A10 -> 24.558483735556621 | CL10: =1-(LN(1-CL$1))/$A10 -> 25.525276813219179 | CM10: =1-(LN(1-CM$1))/$A10 -> 26.584278811045021 | CN10: =1-(LN(1-CN$1))/$A10 -> 27.754951207243096 | CO10: =1-(LN(1-CO$1))/$A10 -> 29.063651603425143 | CP10: =1-(LN(1-CP$1))/$A10 -> 30.547333743697632 | CQ10: =1-(LN(1-CQ$1))/$A10 -> 32.260119075111632 | CR10: =1-(LN(1-CR$1))/$A10 -> 34.285914150600036 | CS10: =1-(LN(1-CS$1))/$A10 -> 36.765286942980183 | CT10: =1-(LN(1-CT$1))/$A10 -> 39.9617544146667 | CU10: =1-(LN(1-CU$1))/$A10 -> 44.466922282535315 | CV10: =1-(LN(1-CV$1))/$A10 -> 52.168557622090638
A11: =A10+0.01 -> 00.1 | B11: =1-(LN(1-B$1))/$A11 -> 1.1005033585350146 | C11: =1-(LN(1-C$1))/$A11 -> 1.2020270731751947 | D11: =1-(LN(1-D$1))/$A11 -> 1.3045920748470858 | E11: =1-(LN(1-E$1))/$A11 -> 1.4082199452025517 | F11: =1-(LN(1-F$1))/$A11 -> 1.5129329438755059 | G11: =1-(LN(1-G$1))/$A11 -> 1.6187540371808753 | H11: =1-(LN(1-H$1))/$A11 -> 1.725706928348355 | I11: =1-(LN(1-I$1))/$A11 -> 1.8338160893905102 | J11: =1-(LN(1-J$1))/$A11 -> 1.943106794712413 | K11: =1-(LN(1-K$1))/$A11 -> 2.0536051565782629 | L11: =1-(LN(1-L$1))/$A11 -> 2.1653381625595154 | M11: =1-(LN(1-M$1))/$A11 -> 2.278333715098849 | N11: =1-(LN(1-N$1))/$A11 -> 2.3926206733350766 | O11: =1-(LN(1-O$1))/$A11 -> 2.5082288973458366 | P11: =1-(LN(1-P$1))/$A11 -> 2.6251892949777496 | Q11: =1-(LN(1-Q$1))/$A11 -> 2.7435338714477782 | R11: =1-(LN(1-R$1))/$A11 -> 2.8632957819149349 | S11: =1-(LN(1-S$1))/$A11 -> 2.9845093872383832 | T11: =1-(LN(1-T$1))/$A11 -> 3.1072103131565267 | U11: =1-(LN(1-U$1))/$A11 -> 3.2314355131420989 | V11: =1-(LN(1-V$1))/$A11 -> 3.3572233352106999 | W11: =1-(LN(1-W$1))/$A11 -> 3.4846135929849975 | X11: =1-(LN(1-X$1))/$A11 -> 3.6136476413440763 | Y11: =1-(LN(1-Y$1))/$A11 -> 3.7443684570176043 | Z11: =1-(LN(1-Z$1))/$A11 -> 3.8768207245178092 | AA11: =1-(LN(1-AA$1))/$A11 -> 4.0110509278392161 | AB11: =1-(LN(1-AB$1))/$A11 -> 4.1471074483970032 | AC11: =1-(LN(1-AC$1))/$A11 -> 4.2850406697203614 | AD11: =1-(LN(1-AD$1))/$A11 -> 4.4249030894677599 | AE11: =1-(LN(1-AE$1))/$A11 -> 4.5667494393873245 | AF11: =1-(LN(1-AF$1))/$A11 -> 4.7106368139083212 | AG11: =1-(LN(1-AG$1))/$A11 -> 4.8566248081198484 | AH11: =1-(LN(1-AH$1))/$A11 -> 5.0047756659712546 | AI11: =1-(LN(1-AI$1))/$A11 -> 5.15515443961666 | AJ11: =1-(LN(1-AJ$1))/$A11 -> 5.3078291609245447 | AK11: =1-(LN(1-AK$1))/$A11 -> 5.4628710262841969 | AL11: =1-(LN(1-AL$1))/$A11 -> 5.6203545959655887 | AM11: =1-(LN(1-AM$1))/$A11 -> 5.7803580094300004 | AN11: =1-(LN(1-AN$1))/$A11 -> 5.9429632181478036 | AO11: =1-(LN(1-AO$1))/$A11 -> 6.1082562376599094 | AP11: =1-(LN(1-AP$1))/$A11 -> 6.2763274208237227 | AQ11: =1-(LN(1-AQ$1))/$A11 -> 6.4472717544167235 | AR11: =1-(LN(1-AR$1))/$A11 -> 6.6211891815354162 | AS11: =1-(LN(1-AS$1))/$A11 -> 6.7981849525294251 | AT11: =1-(LN(1-AT$1))/$A11 -> 6.9783700075562081 | AU11: =1-(LN(1-AU$1))/$A11 -> 7.1618613942381737 | AV11: =1-(LN(1-AV$1))/$A11 -> 7.3487827243597001 | AW11: =1-(LN(1-AW$1))/$A11 -> 7.5392646740666445 | AX11: =1-(LN(1-AX$1))/$A11 -> 7.7334455326376599 | AY11: =1-(LN(1-AY$1))/$A11 -> 7.9314718055994575 | AZ11: =1-(LN(1-AZ$1))/$A11 -> 8.1334988787746525 | BA11: =1-(LN(1-BA$1))/$A11 -> 8.339691750802011 | BB11: =1-(LN(1-BB$1))/$A11 -> 8.5502258427803319 | BC11: =1-(LN(1-BC$1))/$A11 -> 8.7652878949899709 | BD11: =1-(LN(1-BD$1))/$A11 -> 8.9850769621777218 | BE11: =1-(LN(1-BE$1))/$A11 -> 9.2098055206983087 | BF11: =1-(LN(1-BF$1))/$A11 -> 9.4397007029452968 | BG11: =1-(LN(1-BG$1))/$A11 -> 9.6750056770472384 | BH11: =1-(LN(1-BH$1))/$A11 -> 9.9159811928378438 | BI11: =1-(LN(1-BI$1))/$A11 -> 10.16290731874156 | BJ11: =1-(LN(1-BJ$1))/$A11 -> 10.416085398584459 | BK11: =1-(LN(1-BK$1))/$A11 -> 10.675840262617065 | BL11: =1-(LN(1-BL$1))/$A11 -> 10.942522733438679 | BM11: =1-(LN(1-BM$1))/$A11 -> 11.216512475319824 | BN11: =1-(LN(1-BN$1))/$A11 -> 11.498221244986787 | BO11: =1-(LN(1-BO$1))/$A11 -> 11.788096613719313 | BP11: =1-(LN(1-BP$1))/$A11 -> 12.086626245216124 | BQ11: =1-(LN(1-BQ$1))/$A11 -> 12.394342831883661 | BR11: =1-(LN(1-BR$1))/$A11 -> 12.711829815029466 | BS11: =1-(LN(1-BS$1))/$A11 -> 13.039728043259373 | BT11: =1-(LN(1-BT$1))/$A11 -> 13.378743560016188 | BU11: =1-(LN(1-BU$1))/$A11 -> 13.72965675812889 | BV11: =1-(LN(1-BV$1))/$A11 -> 14.093333199837639 | BW11: =1-(LN(1-BW$1))/$A11 -> 14.470736479666112 | BX11: =1-(LN(1-BX$1))/$A11 -> 14.862943611198924 | BY11: =1-(LN(1-BY$1))/$A11 -> 15.271163556401477 | BZ11: =1-(LN(1-BZ$1))/$A11 -> 15.696759700589437 | CA11: =1-(LN(1-CA$1))/$A11 -> 16.141277326297779 | CB11: =1-(LN(1-CB$1))/$A11 -> 16.606477482646707 | CC11: =1-(LN(1-CC$1))/$A11 -> 17.094379124341028 | CD11: =1-(LN(1-CD$1))/$A11 -> 17.607312068216537 | CE11: =1-(LN(1-CE$1))/$A11 -> 18.147984280919296 | CF11: =1-(LN(1-CF$1))/$A11 -> 18.719568419318783 | CG11: =1-(LN(1-CG$1))/$A11 -> 19.325814637483134 | CH11: =1-(LN(1-CH$1))/$A11 -> 19.971199848858848 | CI11: =1-(LN(1-CI$1))/$A11 -> 20.661128563728369 | CJ11: =1-(LN(1-CJ$1))/$A11 -> 21.402208285265591 | CK11: =1-(LN(1-CK$1))/$A11 -> 22.202635362000962 | CL11: =1-(LN(1-CL$1))/$A11 -> 23.072749131897261 | CM11: =1-(LN(1-CM$1))/$A11 -> 24.025850929940518 | CN11: =1-(LN(1-CN$1))/$A11 -> 25.079456086518785 | CO11: =1-(LN(1-CO$1))/$A11 -> 26.257286443082631 | CP11: =1-(LN(1-CP$1))/$A11 -> 27.592600369327869 | CQ11: =1-(LN(1-CQ$1))/$A11 -> 29.134107167600469 | CR11: =1-(LN(1-CR$1))/$A11 -> 30.957322735540036 | CS11: =1-(LN(1-CS$1))/$A11 -> 33.18875824868217 | CT11: =1-(LN(1-CT$1))/$A11 -> 36.065578973200033 | CU11: =1-(LN(1-CU$1))/$A11 -> 40.120230054281784 | CV11: =1-(LN(1-CV$1))/$A11 -> 47.051701859881582
A12: =A11+0.01 -> 00.11 | B12: =1-(LN(1-B$1))/$A12 -> 1.091366689577286 | C12: =1-(LN(1-C$1))/$A12 -> 1.1836609756138134 | D12: =1-(LN(1-D$1))/$A12 -> 1.2769018862246235 | E12: =1-(LN(1-E$1))/$A12 -> 1.371109041093229 | F12: =1-(LN(1-F$1))/$A12 -> 1.4663026762504598 | G12: =1-(LN(1-G$1))/$A12 -> 1.5625036701644321 | H12: =1-(LN(1-H$1))/$A12 -> 1.6597335712257775 | I12: =1-(LN(1-I$1))/$A12 -> 1.7580146267186456 | J12: =1-(LN(1-J$1))/$A12 -> 1.857369813374921 | K12: =1-(LN(1-K$1))/$A12 -> 1.9578228696166027 | L12: =1-(LN(1-L$1))/$A12 -> 2.059398329599559 | M12: =1-(LN(1-M$1))/$A12 -> 2.1621215591807719 | N12: =1-(LN(1-N$1))/$A12 -> 2.2660187939409786 | O12: =1-(LN(1-O$1))/$A12 -> 2.3711171794053061 | P12: =1-(LN(1-P$1))/$A12 -> 2.477444813616136 | Q12: =1-(LN(1-Q$1))/$A12 -> 2.5850307922252531 | R12: =1-(LN(1-R$1))/$A12 -> 2.6939052562863046 | S12: =1-(LN(1-S$1))/$A12 -> 2.8040994429439849 | T12: =1-(LN(1-T$1))/$A12 -> 2.9156457392332062 | U12: =1-(LN(1-U$1))/$A12 -> 3.0285777392200899 | V12: =1-(LN(1-V$1))/$A12 -> 3.1429303047369999 | W12: =1-(LN(1-W$1))/$A12 -> 3.2587396299863616 | X12: =1-(LN(1-X$1))/$A12 -> 3.3760433103127969 | Y12: =1-(LN(1-Y$1))/$A12 -> 3.4948804154705493 | Z12: =1-(LN(1-Z$1))/$A12 -> 3.6152915677434629 | AA12: =1-(LN(1-AA$1))/$A12 -> 3.7373190253083788 | AB12: =1-(LN(1-AB$1))/$A12 -> 3.8610067712700027 | AC12: =1-(LN(1-AC$1))/$A12 -> 3.9864006088366923 | AD12: =1-(LN(1-AD$1))/$A12 -> 4.1135482631525093 | AE12: =1-(LN(1-AE$1))/$A12 -> 4.2424994903521132 | AF12: =1-(LN(1-AF$1))/$A12 -> 4.3733061944621099 | AG12: =1-(LN(1-AG$1))/$A12 -> 4.5060225528362263 | AH12: =1-(LN(1-AH$1))/$A12 -> 4.6407051508829582 | AI12: =1-(LN(1-AI$1))/$A12 -> 4.7774131269242366 | AJ12: =1-(LN(1-AJ$1))/$A12 -> 4.9162083281132221 | AK12: =1-(LN(1-AK$1))/$A12 -> 5.0571554784401789 | AL12: =1-(LN(1-AL$1))/$A12 -> 5.2003223599687169 | AM12: =1-(LN(1-AM$1))/$A12 -> 5.3457800085727278 | AN12: =1-(LN(1-AN$1))/$A12 -> 5.4936029255889123 | AO12: =1-(LN(1-AO$1))/$A12 -> 5.6438693069635546 | AP12: =1-(LN(1-AP$1))/$A12 -> 5.7966612916579301 | AQ12: =1-(LN(1-AQ$1))/$A12 -> 5.9520652312879303 | AR12: =1-(LN(1-AR$1))/$A12 -> 6.1101719832140144 | AS12: =1-(LN(1-AS$1))/$A12 -> 6.2710772295722048 | AT12: =1-(LN(1-AT$1))/$A12 -> 6.4348818250510984 | AU12: =1-(LN(1-AU$1))/$A12 -> 6.6016921765801575 | AV12: =1-(LN(1-AV$1))/$A12 -> 6.7716206585088186 | AW12: =1-(LN(1-AW$1))/$A12 -> 6.9447860673333128 | AX12: =1-(LN(1-AX$1))/$A12 -> 7.121314120579691 | AY12: =1-(LN(1-AY$1))/$A12 -> 7.3013380050904164 | AZ12: =1-(LN(1-AZ$1))/$A12 -> 7.4849989807042299 | BA12: =1-(LN(1-BA$1))/$A12 -> 7.6724470461836463 | BB12: =1-(LN(1-BB$1))/$A12 -> 7.8638416752548483 | BC12: =1-(LN(1-BC$1))/$A12 -> 8.0593526318090642 | BD12: =1-(LN(1-BD$1))/$A12 -> 8.2591608747070211 | BE12: =1-(LN(1-BE$1))/$A12 -> 8.4634595642711901 | BF12: =1-(LN(1-BF$1))/$A12 -> 8.6724551844957247 | BG12: =1-(LN(1-BG$1))/$A12 -> 8.8863687973156722 | BH12: =1-(LN(1-BH$1))/$A12 -> 9.1054374480344045 | BI12: =1-(LN(1-BI$1))/$A12 -> 9.3299157443105099 | BJ12: =1-(LN(1-BJ$1))/$A12 -> 9.5600776350767802 | BK12: =1-(LN(1-BK$1))/$A12 -> 9.7962184205609688 | BL12: =1-(LN(1-BL$1))/$A12 -> 10.038657030398799 | BM12: =1-(LN(1-BM$1))/$A12 -> 10.287738613927113 | BN12: =1-(LN(1-BN$1))/$A12 -> 10.543837495442535 | BO12: =1-(LN(1-BO$1))/$A12 -> 10.807360557926648 | BP12: =1-(LN(1-BP$1))/$A12 -> 11.078751132014657 | BQ12: =1-(LN(1-BQ$1))/$A12 -> 11.3584934835306 | BR12: =1-(LN(1-BR$1))/$A12 -> 11.647118013663151 | BS12: =1-(LN(1-BS$1))/$A12 -> 11.945207312053975 | BT12: =1-(LN(1-BT$1))/$A12 -> 12.253403236378354 | BU12: =1-(LN(1-BU$1))/$A12 -> 12.572415234662628 | BV12: =1-(LN(1-BV$1))/$A12 -> 12.903030181670582 | BW12: =1-(LN(1-BW$1))/$A12 -> 13.246124072423738 | BX12: =1-(LN(1-BX$1))/$A12 -> 13.602676010180842 | BY12: =1-(LN(1-BY$1))/$A12 -> 13.973785051274071 | BZ12: =1-(LN(1-BZ$1))/$A12 -> 14.36069063689949 | CA12: =1-(LN(1-CA$1))/$A12 -> 14.764797569361617 | CB12: =1-(LN(1-CB$1))/$A12 -> 15.187706802406097 | CC12: =1-(LN(1-CC$1))/$A12 -> 15.631253749400935 | CD12: =1-(LN(1-CD$1))/$A12 -> 16.097556425651398 | CE12: =1-(LN(1-CE$1))/$A12 -> 16.589076619017543 | CF12: =1-(LN(1-CF$1))/$A12 -> 17.108698563017079 | CG12: =1-(LN(1-CG$1))/$A12 -> 17.659831488621034 | CH12: =1-(LN(1-CH$1))/$A12 -> 18.24654531714441 | CI12: =1-(LN(1-CI$1))/$A12 -> 18.873753239753064 | CJ12: =1-(LN(1-CJ$1))/$A12 -> 19.547462077514176 | CK12: =1-(LN(1-CK$1))/$A12 -> 20.27512305636451 | CL12: =1-(LN(1-CL$1))/$A12 -> 21.066135574452058 | CM12: =1-(LN(1-CM$1))/$A12 -> 21.93259175449138 | CN12: =1-(LN(1-CN$1))/$A12 -> 22.89041462410799 | CO12: =1-(LN(1-CO$1))/$A12 -> 23.961169493711481 | CP12: =1-(LN(1-CP$1))/$A12 -> 25.175091244843518 | CQ12: =1-(LN(1-CQ$1))/$A12 -> 26.576461061454971 | CR12: =1-(LN(1-CR$1))/$A12 -> 28.233929759581851 | CS12: =1-(LN(1-CS$1))/$A12 -> 30.262507498801973 | CT12: =1-(LN(1-CT$1))/$A12 -> 32.877799066545485 | CU12: =1-(LN(1-CU$1))/$A12 -> 36.563845503892537 | CV12: =1-(LN(1-CV$1))/$A12 -> 42.865183508983257
A13: =A12+0.01 -> 00.12 | B13: =1-(LN(1-B$1))/$A13 -> 1.0837527987791788 | C13: =1-(LN(1-C$1))/$A13 -> 1.1683558943126622 | D13: =1-(LN(1-D$1))/$A13 -> 1.2538267290392382 | E13: =1-(LN(1-E$1))/$A13 -> 1.3401832876687931 | F13: =1-(LN(1-F$1))/$A13 -> 1.4274441198962549 | G13: =1-(LN(1-G$1))/$A13 -> 1.5156283643173962 | H13: =1-(LN(1-H$1))/$A13 -> 1.6047557736236291 | I13: =1-(LN(1-I$1))/$A13 -> 1.6948467411587584 | J13: =1-(LN(1-J$1))/$A13 -> 1.7859223289270107 | K13: =1-(LN(1-K$1))/$A13 -> 1.8780042971485524 | L13: =1-(LN(1-L$1))/$A13 -> 1.9711151354662628 | M13: =1-(LN(1-M$1))/$A13 -> 2.0652780959157075 | N13: =1-(LN(1-N$1))/$A13 -> 2.1605172277792306 | O13: =1-(LN(1-O$1))/$A13 -> 2.2568574144548643 | P13: =1-(LN(1-P$1))/$A13 -> 2.354324412481458 | Q13: =1-(LN(1-Q$1))/$A13 -> 2.4529448928731483 | R13: =1-(LN(1-R$1))/$A13 -> 2.5527464849291128 | S13: =1-(LN(1-S$1))/$A13 -> 2.6537578226986529 | T13: =1-(LN(1-T$1))/$A13 -> 2.7560085942971062 | U13: =1-(LN(1-U$1))/$A13 -> 2.8595295942850822 | V13: =1-(LN(1-V$1))/$A13 -> 2.9643527793422502 | W13: =1-(LN(1-W$1))/$A13 -> 3.0705113274874982 | X13: =1-(LN(1-X$1))/$A13 -> 3.1780397011200638 | Y13: =1-(LN(1-Y$1))/$A13 -> 3.2869737141813373 | Z13: =1-(LN(1-Z$1))/$A13 -> 3.3973506037648411 | AA13: =1-(LN(1-AA$1))/$A13 -> 3.5092091065326807 | AB13: =1-(LN(1-AB$1))/$A13 -> 3.6225895403308357 | AC13: =1-(LN(1-AC$1))/$A13 -> 3.7375338914336345 | AD13: =1-(LN(1-AD$1))/$A13 -> 3.8540859078898007 | AE13: =1-(LN(1-AE$1))/$A13 -> 3.9722911994894377 | AF13: =1-(LN(1-AF$1))/$A13 -> 4.0921973449236013 | AG13: =1-(LN(1-AG$1))/$A13 -> 4.2138540067665406 | AH13: =1-(LN(1-AH$1))/$A13 -> 4.337313054976045 | AI13: =1-(LN(1-AI$1))/$A13 -> 4.4626286996805504 | AJ13: =1-(LN(1-AJ$1))/$A13 -> 4.5898576341037867 | AK13: =1-(LN(1-AK$1))/$A13 -> 4.7190591885701636 | AL13: =1-(LN(1-AL$1))/$A13 -> 4.8502954966379903 | AM13: =1-(LN(1-AM$1))/$A13 -> 4.9836316745250002 | AN13: =1-(LN(1-AN$1))/$A13 -> 5.1191360151231704 | AO13: =1-(LN(1-AO$1))/$A13 -> 5.2568801980499256 | AP13: =1-(LN(1-AP$1))/$A13 -> 5.3969395173531023 | AQ13: =1-(LN(1-AQ$1))/$A13 -> 5.5393931286806026 | AR13: =1-(LN(1-AR$1))/$A13 -> 5.6843243179461798 | AS13: =1-(LN(1-AS$1))/$A13 -> 5.8318207937745212 | AT13: =1-(LN(1-AT$1))/$A13 -> 5.9819750062968406 | AU13: =1-(LN(1-AU$1))/$A13 -> 6.1348844951984782 | AV13: =1-(LN(1-AV$1))/$A13 -> 6.2906522702997503 | AW13: =1-(LN(1-AW$1))/$A13 -> 6.4493872283888702 | AX13: =1-(LN(1-AX$1))/$A13 -> 6.6112046105313835 | AY13: =1-(LN(1-AY$1))/$A13 -> 6.7762265046662149 | AZ13: =1-(LN(1-AZ$1))/$A13 -> 6.944582398978878 | BA13: =1-(LN(1-BA$1))/$A13 -> 7.1164097923350091 | BB13: =1-(LN(1-BB$1))/$A13 -> 7.2918548689836111 | BC13: =1-(LN(1-BC$1))/$A13 -> 7.471073245824976 | BD13: =1-(LN(1-BD$1))/$A13 -> 7.6542308018147693 | BE13: =1-(LN(1-BE$1))/$A13 -> 7.8415046005819242 | BF13: =1-(LN(1-BF$1))/$A13 -> 8.033083919121081 | BG13: =1-(LN(1-BG$1))/$A13 -> 8.2291713975393659 | BH13: =1-(LN(1-BH$1))/$A13 -> 8.4299843273648705 | BI13: =1-(LN(1-BI$1))/$A13 -> 8.6357560989513011 | BJ13: =1-(LN(1-BJ$1))/$A13 -> 8.8467378321537158 | BK13: =1-(LN(1-BK$1))/$A13 -> 9.0632002188475553 | BL13: =1-(LN(1-BL$1))/$A13 -> 9.2854356111988992 | BM13: =1-(LN(1-BM$1))/$A13 -> 9.5137603960998547 | BN13: =1-(LN(1-BN$1))/$A13 -> 9.7485177041556579 | BO13: =1-(LN(1-BO$1))/$A13 -> 9.99008051143276 | BP13: =1-(LN(1-BP$1))/$A13 -> 10.23885520434677 | BQ13: =1-(LN(1-BQ$1))/$A13 -> 10.495285693236385 | BR13: =1-(LN(1-BR$1))/$A13 -> 10.759858179191221 | BS13: =1-(LN(1-BS$1))/$A13 -> 11.033106702716145 | BT13: =1-(LN(1-BT$1))/$A13 -> 11.315619633346826 | BU13: =1-(LN(1-BU$1))/$A13 -> 11.608047298440741 | BV13: =1-(LN(1-BV$1))/$A13 -> 11.9111109998647 | BW13: =1-(LN(1-BW$1))/$A13 -> 12.225613733055093 | BX13: =1-(LN(1-BX$1))/$A13 -> 12.552453009332439 | BY13: =1-(LN(1-BY$1))/$A13 -> 12.892636297001232 | BZ13: =1-(LN(1-BZ$1))/$A13 -> 13.2472997504912 | CA13: =1-(LN(1-CA$1))/$A13 -> 13.617731105248149 | CB13: =1-(LN(1-CB$1))/$A13 -> 14.005397902205591 | CC13: =1-(LN(1-CC$1))/$A13 -> 14.411982603617524 | CD13: =1-(LN(1-CD$1))/$A13 -> 14.839426723513782 | CE13: =1-(LN(1-CE$1))/$A13 -> 15.289986900766081 | CF13: =1-(LN(1-CF$1))/$A13 -> 15.766307016098988 | CG13: =1-(LN(1-CG$1))/$A13 -> 16.271512197902613 | CH13: =1-(LN(1-CH$1))/$A13 -> 16.809333207382377 | CI13: =1-(LN(1-CI$1))/$A13 -> 17.384273803106975 | CJ13: =1-(LN(1-CJ$1))/$A13 -> 18.001840237721328 | CK13: =1-(LN(1-CK$1))/$A13 -> 18.668862801667469 | CL13: =1-(LN(1-CL$1))/$A13 -> 19.393957609914388 | CM13: =1-(LN(1-CM$1))/$A13 -> 20.188209108283768 | CN13: =1-(LN(1-CN$1))/$A13 -> 21.066213405432322 | CO13: =1-(LN(1-CO$1))/$A13 -> 22.047738702568861 | CP13: =1-(LN(1-CP$1))/$A13 -> 23.160500307773226 | CQ13: =1-(LN(1-CQ$1))/$A13 -> 24.445089306333724 | CR13: =1-(LN(1-CR$1))/$A13 -> 25.96443561295003 | CS13: =1-(LN(1-CS$1))/$A13 -> 27.82396520723514 | CT13: =1-(LN(1-CT$1))/$A13 -> 30.221315811000032 | CU13: =1-(LN(1-CU$1))/$A13 -> 33.600191711901495 | CV13: =1-(LN(1-CV$1))/$A13 -> 39.376418216567984
A14: =A13+0.01 -> 00.13 | B14: =1-(LN(1-B$1))/$A14 -> 1.077310275796165 | C14: =1-(LN(1-C$1))/$A14 -> 1.155405440903996 | D14: =1-(LN(1-D$1))/$A14 -> 1.2343015960362198 | E14: =1-(LN(1-E$1))/$A14 -> 1.3140153424635013 | F14: =1-(LN(1-F$1))/$A14 -> 1.3945638029811582 | G14: =1-(LN(1-G$1))/$A14 -> 1.4759646439852887 | H14: =1-(LN(1-H$1))/$A14 -> 1.5582360987295041 | I14: =1-(LN(1-I$1))/$A14 -> 1.641396991838854 | J14: =1-(LN(1-J$1))/$A14 -> 1.7254667651633948 | K14: =1-(LN(1-K$1))/$A14 -> 1.8104655050602023 | L14: =1-(LN(1-L$1))/$A14 -> 1.8964139711996273 | M14: =1-(LN(1-M$1))/$A14 -> 1.9833336269991146 | N14: =1-(LN(1-N$1))/$A14 -> 2.0712466717962128 | O14: =1-(LN(1-O$1))/$A14 -> 2.1601760748814129 | P14: =1-(LN(1-P$1))/$A14 -> 2.2501456115213458 | Q14: =1-(LN(1-Q$1))/$A14 -> 2.3411799011136756 | R14: =1-(LN(1-R$1))/$A14 -> 2.433304447626873 | S14: =1-(LN(1-S$1))/$A14 -> 2.5265456824910641 | T14: =1-(LN(1-T$1))/$A14 -> 2.6209310101204055 | U14: =1-(LN(1-U$1))/$A14 -> 2.7164888562631528 | V14: =1-(LN(1-V$1))/$A14 -> 2.8132487193928464 | W14: =1-(LN(1-W$1))/$A14 -> 2.9112412253730753 | X14: =1-(LN(1-X$1))/$A14 -> 3.0104981856492898 | Y14: =1-(LN(1-Y$1))/$A14 -> 3.1110526592443111 | Z14: =1-(LN(1-Z$1))/$A14 -> 3.2129390188598537 | AA14: =1-(LN(1-AA$1))/$A14 -> 3.3161930214147821 | AB14: =1-(LN(1-AB$1))/$A14 -> 3.4208518833823098 | AC14: =1-(LN(1-AC$1))/$A14 -> 3.5269543613233552 | AD14: =1-(LN(1-AD$1))/$A14 -> 3.6345408380521236 | AE14: =1-(LN(1-AE$1))/$A14 -> 3.7436534149133269 | AF14: =1-(LN(1-AF$1))/$A14 -> 3.8543360106987086 | AG14: =1-(LN(1-AG$1))/$A14 -> 3.9666344677844987 | AH14: =1-(LN(1-AH$1))/$A14 -> 4.0805966661317346 | AI14: =1-(LN(1-AI$1))/$A14 -> 4.1962726458589694 | AJ14: =1-(LN(1-AJ$1))/$A14 -> 4.3137147391727266 | AK14: =1-(LN(1-AK$1))/$A14 -> 4.4329777125263057 | AL14: =1-(LN(1-AL$1))/$A14 -> 4.5541189199735301 | AM14: =1-(LN(1-AM$1))/$A14 -> 4.6771984687923087 | AN14: =1-(LN(1-AN$1))/$A14 -> 4.8022793985752337 | AO14: =1-(LN(1-AO$1))/$A14 -> 4.9294278751230074 | AP14: =1-(LN(1-AP$1))/$A14 -> 5.058713400633633 | AQ14: =1-(LN(1-AQ$1))/$A14 -> 5.1902090418590179 | AR14: =1-(LN(1-AR$1))/$A14 -> 5.3239916781041661 | AS14: =1-(LN(1-AS$1))/$A14 -> 5.4601422711764815 | AT14: =1-(LN(1-AT$1))/$A14 -> 5.5987461596586217 | AU14: =1-(LN(1-AU$1))/$A14 -> 5.7398933801832106 | AV14: =1-(LN(1-AV$1))/$A14 -> 5.8836790187382313 | AW14: =1-(LN(1-AW$1))/$A14 -> 6.0302035954358804 | AX14: =1-(LN(1-AX$1))/$A14 -> 6.1795734866443546 | AY14: =1-(LN(1-AY$1))/$A14 -> 6.3319013889226605 | AZ14: =1-(LN(1-AZ$1))/$A14 -> 6.4873068298266565 | BA14: =1-(LN(1-BA$1))/$A14 -> 6.645916731386162 | BB14: =1-(LN(1-BB$1))/$A14 -> 6.807866032907949 | BC14: =1-(LN(1-BC$1))/$A14 -> 6.9732983807615163 | BD14: =1-(LN(1-BD$1))/$A14 -> 7.1423668939828637 | BE14: =1-(LN(1-BE$1))/$A14 -> 7.3152350159217763 | BF14: =1-(LN(1-BF$1))/$A14 -> 7.4920774638040752 | BG14: =1-(LN(1-BG$1))/$A14 -> 7.6730812900363379 | BH14: =1-(LN(1-BH$1))/$A14 -> 7.8584470714137264 | BI14: =1-(LN(1-BI$1))/$A14 -> 8.048390245185816 | BJ14: =1-(LN(1-BJ$1))/$A14 -> 8.2431426142957385 | BK14: =1-(LN(1-BK$1))/$A14 -> 8.4429540481669747 | BL14: =1-(LN(1-BL$1))/$A14 -> 8.6480944103374462 | BM14: =1-(LN(1-BM$1))/$A14 -> 8.8588557502460183 | BN14: =1-(LN(1-BN$1))/$A14 -> 9.0755548038359919 | BO14: =1-(LN(1-BO$1))/$A14 -> 9.2985358567071632 | BP14: =1-(LN(1-BP$1))/$A14 -> 9.5281740347816335 | BQ14: =1-(LN(1-BQ$1))/$A14 -> 9.7648791014489706 | BR14: =1-(LN(1-BR$1))/$A14 -> 10.009099857714974 | BS14: =1-(LN(1-BS$1))/$A14 -> 10.261329264045672 | BT14: =1-(LN(1-BT$1))/$A14 -> 10.522110430781684 | BU14: =1-(LN(1-BU$1))/$A14 -> 10.792043660099147 | BV14: =1-(LN(1-BV$1))/$A14 -> 11.071794769105876 | BW14: =1-(LN(1-BW$1))/$A14 -> 11.362104984358549 | BX14: =1-(LN(1-BX$1))/$A14 -> 11.663802777845328 | BY14: =1-(LN(1-BY$1))/$A14 -> 11.977818120308831 | BZ14: =1-(LN(1-BZ$1))/$A14 -> 12.305199769684185 | CA14: =1-(LN(1-CA$1))/$A14 -> 12.647136404844446 | CB14: =1-(LN(1-CB$1))/$A14 -> 13.004982678959006 | CC14: =1-(LN(1-CC$1))/$A14 -> 13.380291634108485 | CD14: =1-(LN(1-CD$1))/$A14 -> 13.774855437089645 | CE14: =1-(LN(1-CE$1))/$A14 -> 14.19075713916869 | CF14: =1-(LN(1-CF$1))/$A14 -> 14.630437245629835 | CG14: =1-(LN(1-CG$1))/$A14 -> 15.096780490371643 | CH14: =1-(LN(1-CH$1))/$A14 -> 15.593230652968348 | CI14: =1-(LN(1-CI$1))/$A14 -> 16.123945049021824 | CJ14: =1-(LN(1-CJ$1))/$A14 -> 16.694006373281226 | CK14: =1-(LN(1-CK$1))/$A14 -> 17.30971950923151 | CL14: =1-(LN(1-CL$1))/$A14 -> 17.979037793767127 | CM14: =1-(LN(1-CM$1))/$A14 -> 18.712193023031169 | CN14: =1-(LN(1-CN$1))/$A14 -> 19.522658528091377 | CO14: =1-(LN(1-CO$1))/$A14 -> 20.428681879294331 | CP14: =1-(LN(1-CP$1))/$A14 -> 21.455846437944519 | CQ14: =1-(LN(1-CQ$1))/$A14 -> 22.641620898154208 | CR14: =1-(LN(1-CR$1))/$A14 -> 24.044094411953875 | CS14: =1-(LN(1-CS$1))/$A14 -> 25.760583268217054 | CT14: =1-(LN(1-CT$1))/$A14 -> 27.973522287076953 | CU14: =1-(LN(1-CU$1))/$A14 -> 31.092484657139838 | CV14: =1-(LN(1-CV$1))/$A14 -> 36.424386046062757
A15: =A14+0.01 -> 00.14 | B15: =1-(LN(1-B$1))/$A15 -> 1.0717881132392961 | C15: =1-(LN(1-C$1))/$A15 -> 1.1443050522679963 | D15: =1-(LN(1-D$1))/$A15 -> 1.2175657677479184 | E15: =1-(LN(1-E$1))/$A15 -> 1.2915856751446797 | F15: =1-(LN(1-F$1))/$A15 -> 1.3663806741967899 | G15: =1-(LN(1-G$1))/$A15 -> 1.441967169414911 | H15: =1-(LN(1-H$1))/$A15 -> 1.5183620916773966 | I15: =1-(LN(1-I$1))/$A15 -> 1.5955829209932215 | J15: =1-(LN(1-J$1))/$A15 -> 1.6736477105088663 | K15: =1-(LN(1-K$1))/$A15 -> 1.7525751118416164 | L15: =1-(LN(1-L$1))/$A15 -> 1.8323844018282252 | M15: =1-(LN(1-M$1))/$A15 -> 1.9130955107848922 | N15: =1-(LN(1-N$1))/$A15 -> 1.9947290523821977 | O15: =1-(LN(1-O$1))/$A15 -> 2.0773063552470266 | P15: =1-(LN(1-P$1))/$A15 -> 2.1608494964126783 | Q15: =1-(LN(1-Q$1))/$A15 -> 2.2453813367484132 | R15: =1-(LN(1-R$1))/$A15 -> 2.3309255585106676 | S15: =1-(LN(1-S$1))/$A15 -> 2.4175067051702737 | T15: =1-(LN(1-T$1))/$A15 -> 2.5051502236832333 | U15: =1-(LN(1-U$1))/$A15 -> 2.5938825093872131 | V15: =1-(LN(1-V$1))/$A15 -> 2.6837309537219287 | W15: =1-(LN(1-W$1))/$A15 -> 2.7747239949892841 | X15: =1-(LN(1-X$1))/$A15 -> 2.8668911723886259 | Y15: =1-(LN(1-Y$1))/$A15 -> 2.9602631835840034 | Z15: =1-(LN(1-Z$1))/$A15 -> 3.0548719460841496 | AA15: =1-(LN(1-AA$1))/$A15 -> 3.1507506627422974 | AB15: =1-(LN(1-AB$1))/$A15 -> 3.2479338917121447 | AC15: =1-(LN(1-AC$1))/$A15 -> 3.3464576212288297 | AD15: =1-(LN(1-AD$1))/$A15 -> 3.4463593496198288 | AE15: =1-(LN(1-AE$1))/$A15 -> 3.5476781709909462 | AF15: =1-(LN(1-AF$1))/$A15 -> 3.650454867077372 | AG15: =1-(LN(1-AG$1))/$A15 -> 3.7547320057998914 | AH15: =1-(LN(1-AH$1))/$A15 -> 3.8605540471223248 | AI15: =1-(LN(1-AI$1))/$A15 -> 3.9679674568690428 | AJ15: =1-(LN(1-AJ$1))/$A15 -> 4.0770208292318175 | AK15: =1-(LN(1-AK$1))/$A15 -> 4.1877650187744262 | AL15: =1-(LN(1-AL$1))/$A15 -> 4.3002532828325641 | AM15: =1-(LN(1-AM$1))/$A15 -> 4.414541435307143 | AN15: =1-(LN(1-AN$1))/$A15 -> 4.5306880129627167 | AO15: =1-(LN(1-AO$1))/$A15 -> 4.648754455471364 | AP15: =1-(LN(1-AP$1))/$A15 -> 4.7688053005883733 | AQ15: =1-(LN(1-AQ$1))/$A15 -> 4.8909083960119446 | AR15: =1-(LN(1-AR$1))/$A15 -> 5.0151351296681543 | AS15: =1-(LN(1-AS$1))/$A15 -> 5.1415606803781611 | AT15: =1-(LN(1-AT$1))/$A15 -> 5.2702642911115776 | AU15: =1-(LN(1-AU$1))/$A15 -> 5.4013295673129811 | AV15: =1-(LN(1-AV$1))/$A15 -> 5.5348448031140718 | AW15: =1-(LN(1-AW$1))/$A15 -> 5.6709033386190315 | AX15: =1-(LN(1-AX$1))/$A15 -> 5.8096039518840428 | AY15: =1-(LN(1-AY$1))/$A15 -> 5.9510512897138987 | AZ15: =1-(LN(1-AZ$1))/$A15 -> 6.095356341981895 | BA15: =1-(LN(1-BA$1))/$A15 -> 6.2426369648585789 | BB15: =1-(LN(1-BB$1))/$A15 -> 6.3930184591288093 | BC15: =1-(LN(1-BC$1))/$A15 -> 6.546634210707122 | BD15: =1-(LN(1-BD$1))/$A15 -> 6.7036264015555158 | BE15: =1-(LN(1-BE$1))/$A15 -> 6.8641468004987916 | BF15: =1-(LN(1-BF$1))/$A15 -> 7.0283576449609262 | BG15: =1-(LN(1-BG$1))/$A15 -> 7.1964326264623129 | BH15: =1-(LN(1-BH$1))/$A15 -> 7.3685579948841742 | BI15: =1-(LN(1-BI$1))/$A15 -> 7.5449337991011145 | BJ15: =1-(LN(1-BJ$1))/$A15 -> 7.7257752847031842 | BK15: =1-(LN(1-BK$1))/$A15 -> 7.9113144732979039 | BL15: =1-(LN(1-BL$1))/$A15 -> 8.1018019524561993 | BM15: =1-(LN(1-BM$1))/$A15 -> 8.2975089109427316 | BN15: =1-(LN(1-BN$1))/$A15 -> 8.4987294607048476 | BO15: =1-(LN(1-BO$1))/$A15 -> 8.7057832955137933 | BP15: =1-(LN(1-BP$1))/$A15 -> 8.919018746582946 | BQ15: =1-(LN(1-BQ$1))/$A15 -> 9.1388163084883285 | BR15: =1-(LN(1-BR$1))/$A15 -> 9.3655927250210471 | BS15: =1-(LN(1-BS$1))/$A15 -> 9.5998057451852663 | BT15: =1-(LN(1-BT$1))/$A15 -> 9.8419596857258487 | BU15: =1-(LN(1-BU$1))/$A15 -> 10.092611970092065 | BV15: =1-(LN(1-BV$1))/$A15 -> 10.352380857026885 | BW15: =1-(LN(1-BW$1))/$A15 -> 10.621954628332936 | BX15: =1-(LN(1-BX$1))/$A15 -> 10.902102579427803 | BY15: =1-(LN(1-BY$1))/$A15 -> 11.193688254572484 | BZ15: =1-(LN(1-BZ$1))/$A15 -> 11.497685500421028 | CA15: =1-(LN(1-CA$1))/$A15 -> 11.8151980902127 | CB15: =1-(LN(1-CB$1))/$A15 -> 12.147483916176219 | CC15: =1-(LN(1-CC$1))/$A15 -> 12.49598508881502 | CD15: =1-(LN(1-CD$1))/$A15 -> 12.862365763011812 | CE15: =1-(LN(1-CE$1))/$A15 -> 13.248560200656641 | CF15: =1-(LN(1-CF$1))/$A15 -> 13.656834585227703 | CG15: =1-(LN(1-CG$1))/$A15 -> 14.08986759820224 | CH15: =1-(LN(1-CH$1))/$A15 -> 14.550857034899179 | CI15: =1-(LN(1-CI$1))/$A15 -> 15.043663259805978 | CJ15: =1-(LN(1-CJ$1))/$A15 -> 15.573005918046851 | CK15: =1-(LN(1-CK$1))/$A15 -> 16.144739544286402 | CL15: =1-(LN(1-CL$1))/$A15 -> 16.766249379926617 | CM15: =1-(LN(1-CM$1))/$A15 -> 17.447036378528942 | CN15: =1-(LN(1-CN$1))/$A15 -> 18.199611490370561 | CO15: =1-(LN(1-CO$1))/$A15 -> 19.040918887916163 | CP15: =1-(LN(1-CP$1))/$A15 -> 19.994714549519909 | CQ15: =1-(LN(1-CQ$1))/$A15 -> 21.095790834000336 | CR15: =1-(LN(1-CR$1))/$A15 -> 22.398087668242884 | CS15: =1-(LN(1-CS$1))/$A15 -> 23.991970177630119 | CT15: =1-(LN(1-CT$1))/$A15 -> 26.04684212371431 | CU15: =1-(LN(1-CU$1))/$A15 -> 28.943021467344135 | CV15: =1-(LN(1-CV$1))/$A15 -> 33.894072757058268
A16: =A15+0.01 -> 00.15 | B16: =1-(LN(1-B$1))/$A16 -> 1.0670022390233429 | C16: =1-(LN(1-C$1))/$A16 -> 1.1346847154501298 | D16: =1-(LN(1-D$1))/$A16 -> 1.2030613832313906 | E16: =1-(LN(1-E$1))/$A16 -> 1.2721466301350344 | F16: =1-(LN(1-F$1))/$A16 -> 1.3419552959170038 | G16: =1-(LN(1-G$1))/$A16 -> 1.4125026914539169 | H16: =1-(LN(1-H$1))/$A16 -> 1.4838046188989034 | I16: =1-(LN(1-I$1))/$A16 -> 1.5558773929270067 | J16: =1-(LN(1-J$1))/$A16 -> 1.6287378631416085 | K16: =1-(LN(1-K$1))/$A16 -> 1.7024034377188419 | L16: =1-(LN(1-L$1))/$A16 -> 1.77689210837301 | M16: =1-(LN(1-M$1))/$A16 -> 1.8522224767325659 | N16: =1-(LN(1-N$1))/$A16 -> 1.9284137822233844 | O16: =1-(LN(1-O$1))/$A16 -> 2.0054859315638911 | P16: =1-(LN(1-P$1))/$A16 -> 2.0834595299851664 | Q16: =1-(LN(1-Q$1))/$A16 -> 2.1623559142985185 | R16: =1-(LN(1-R$1))/$A16 -> 2.2421971879432903 | S16: =1-(LN(1-S$1))/$A16 -> 2.3230062581589221 | T16: =1-(LN(1-T$1))/$A16 -> 2.4048068754376848 | U16: =1-(LN(1-U$1))/$A16 -> 2.4876236754280656 | V16: =1-(LN(1-V$1))/$A16 -> 2.5714822234738 | W16: =1-(LN(1-W$1))/$A16 -> 2.656409061989998 | X16: =1-(LN(1-X$1))/$A16 -> 2.7424317608960509 | Y16: =1-(LN(1-Y$1))/$A16 -> 2.8295789713450694 | Z16: =1-(LN(1-Z$1))/$A16 -> 2.9178804830118725 | AA16: =1-(LN(1-AA$1))/$A16 -> 3.0073672852261444 | AB16: =1-(LN(1-AB$1))/$A16 -> 3.0980716322646682 | AC16: =1-(LN(1-AC$1))/$A16 -> 3.1900271131469076 | AD16: =1-(LN(1-AD$1))/$A16 -> 3.2832687263118401 | AE16: =1-(LN(1-AE$1))/$A16 -> 3.3778329595915499 | AF16: =1-(LN(1-AF$1))/$A16 -> 3.4737578759388805 | AG16: =1-(LN(1-AG$1))/$A16 -> 3.571083205413232 | AH16: =1-(LN(1-AH$1))/$A16 -> 3.6698504439808364 | AI16: =1-(LN(1-AI$1))/$A16 -> 3.77010295974444 | AJ16: =1-(LN(1-AJ$1))/$A16 -> 3.8718861072830295 | AK16: =1-(LN(1-AK$1))/$A16 -> 3.9752473508561312 | AL16: =1-(LN(1-AL$1))/$A16 -> 4.0802363973103919 | AM16: =1-(LN(1-AM$1))/$A16 -> 4.1869053396200009 | AN16: =1-(LN(1-AN$1))/$A16 -> 4.2953088120985363 | AO16: =1-(LN(1-AO$1))/$A16 -> 4.4055041584399399 | AP16: =1-(LN(1-AP$1))/$A16 -> 4.5175516138824818 | AQ16: =1-(LN(1-AQ$1))/$A16 -> 4.6315145029444817 | AR16: =1-(LN(1-AR$1))/$A16 -> 4.7474594543569442 | AS16: =1-(LN(1-AS$1))/$A16 -> 4.8654566350196173 | AT16: =1-(LN(1-AT$1))/$A16 -> 4.9855800050374715 | AU16: =1-(LN(1-AU$1))/$A16 -> 5.1079075961587819 | AV16: =1-(LN(1-AV$1))/$A16 -> 5.2325218162397995 | AW16: =1-(LN(1-AW$1))/$A16 -> 5.359509782711096 | AX16: =1-(LN(1-AX$1))/$A16 -> 5.4889636884251063 | AY16: =1-(LN(1-AY$1))/$A16 -> 5.6209812037329714 | AZ16: =1-(LN(1-AZ$1))/$A16 -> 5.7556659191831017 | BA16: =1-(LN(1-BA$1))/$A16 -> 5.8931278338680064 | BB16: =1-(LN(1-BB$1))/$A16 -> 6.0334838951868885 | BC16: =1-(LN(1-BC$1))/$A16 -> 6.1768585966599803 | BD16: =1-(LN(1-BD$1))/$A16 -> 6.3233846414518151 | BE16: =1-(LN(1-BE$1))/$A16 -> 6.4732036804655388 | BF16: =1-(LN(1-BF$1))/$A16 -> 6.6264671352968643 | BG16: =1-(LN(1-BG$1))/$A16 -> 6.7833371180314916 | BH16: =1-(LN(1-BH$1))/$A16 -> 6.9439874618918953 | BI16: =1-(LN(1-BI$1))/$A16 -> 7.1086048791610397 | BJ16: =1-(LN(1-BJ$1))/$A16 -> 7.2773902657229721 | BK16: =1-(LN(1-BK$1))/$A16 -> 7.450560175078043 | BL16: =1-(LN(1-BL$1))/$A16 -> 7.6283484889591184 | BM16: =1-(LN(1-BM$1))/$A16 -> 7.8110083168798825 | BN16: =1-(LN(1-BN$1))/$A16 -> 7.9988141633245249 | BO16: =1-(LN(1-BO$1))/$A16 -> 8.1920644091462087 | BP16: =1-(LN(1-BP$1))/$A16 -> 8.3910841634774158 | BQ16: =1-(LN(1-BQ$1))/$A16 -> 8.5962285545891071 | BR16: =1-(LN(1-BR$1))/$A16 -> 8.8078865433529767 | BS16: =1-(LN(1-BS$1))/$A16 -> 9.0264853621729149 | BT16: =1-(LN(1-BT$1))/$A16 -> 9.2524957066774594 | BU16: =1-(LN(1-BU$1))/$A16 -> 9.4864378387525932 | BV16: =1-(LN(1-BV$1))/$A16 -> 9.7288887998917595 | BW16: =1-(LN(1-BW$1))/$A16 -> 9.9804909864440745 | BX16: =1-(LN(1-BX$1))/$A16 -> 10.24196240746595 | BY16: =1-(LN(1-BY$1))/$A16 -> 10.514109037600985 | BZ16: =1-(LN(1-BZ$1))/$A16 -> 10.797839800392959 | CA16: =1-(LN(1-CA$1))/$A16 -> 11.094184884198519 | CB16: =1-(LN(1-CB$1))/$A16 -> 11.404318321764471 | CC16: =1-(LN(1-CC$1))/$A16 -> 11.729586082894018 | CD16: =1-(LN(1-CD$1))/$A16 -> 12.071541378811023 | CE16: =1-(LN(1-CE$1))/$A16 -> 12.431989520612865 | CF16: =1-(LN(1-CF$1))/$A16 -> 12.81304561287919 | CG16: =1-(LN(1-CG$1))/$A16 -> 13.21720975832209 | CH16: =1-(LN(1-CH$1))/$A16 -> 13.6474665659059 | CI16: =1-(LN(1-CI$1))/$A16 -> 14.107419042485578 | CJ16: =1-(LN(1-CJ$1))/$A16 -> 14.601472190177061 | CK16: =1-(LN(1-CK$1))/$A16 -> 15.135090241333973 | CL16: =1-(LN(1-CL$1))/$A16 -> 15.715166087931507 | CM16: =1-(LN(1-CM$1))/$A16 -> 16.350567286627012 | CN16: =1-(LN(1-CN$1))/$A16 -> 17.052970724345858 | CO16: =1-(LN(1-CO$1))/$A16 -> 17.838190962055087 | CP16: =1-(LN(1-CP$1))/$A16 -> 18.72840024621858 | CQ16: =1-(LN(1-CQ$1))/$A16 -> 19.756071445066979 | CR16: =1-(LN(1-CR$1))/$A16 -> 20.971548490360021 | CS16: =1-(LN(1-CS$1))/$A16 -> 22.459172165788111 | CT16: =1-(LN(1-CT$1))/$A16 -> 24.377052648800021 | CU16: =1-(LN(1-CU$1))/$A16 -> 27.080153369521192 | CV16: =1-(LN(1-CV$1))/$A16 -> 31.701134573254386
A17: =A16+0.01 -> 00.16 | B17: =1-(LN(1-B$1))/$A17 -> 1.062814599084384 | C17: =1-(LN(1-C$1))/$A17 -> 1.1262669207344966 | D17: =1-(LN(1-D$1))/$A17 -> 1.1903700467794285 | E17: =1-(LN(1-E$1))/$A17 -> 1.2551374657515948 | F17: =1-(LN(1-F$1))/$A17 -> 1.3205830899221911 | G17: =1-(LN(1-G$1))/$A17 -> 1.3867212732380469 | H17: =1-(LN(1-H$1))/$A17 -> 1.4535668302177218 | I17: =1-(LN(1-I$1))/$A17 -> 1.5211350558690688 | J17: =1-(LN(1-J$1))/$A17 -> 1.589441746695258 | K17: =1-(LN(1-K$1))/$A17 -> 1.6585032228614143 | L17: =1-(LN(1-L$1))/$A17 -> 1.728336351599697 | M17: =1-(LN(1-M$1))/$A17 -> 1.7989585719367804 | N17: =1-(LN(1-N$1))/$A17 -> 1.870387920834423 | O17: =1-(LN(1-O$1))/$A17 -> 1.942643060841148 | P17: =1-(LN(1-P$1))/$A17 -> 2.0157433093610932 | Q17: =1-(LN(1-Q$1))/$A17 -> 2.0897086696548612 | R17: =1-(LN(1-R$1))/$A17 -> 2.1645598636968342 | S17: =1-(LN(1-S$1))/$A17 -> 2.2403183670239892 | T17: =1-(LN(1-T$1))/$A17 -> 2.3170064457228294 | U17: =1-(LN(1-U$1))/$A17 -> 2.3946471957138113 | V17: =1-(LN(1-V$1))/$A17 -> 2.473264584506687 | W17: =1-(LN(1-W$1))/$A17 -> 2.5528834956156237 | X17: =1-(LN(1-X$1))/$A17 -> 2.6335297758400475 | Y17: =1-(LN(1-Y$1))/$A17 -> 2.7152302856360024 | Z17: =1-(LN(1-Z$1))/$A17 -> 2.7980129528236306 | AA17: =1-(LN(1-AA$1))/$A17 -> 2.8819068298995099 | AB17: =1-(LN(1-AB$1))/$A17 -> 2.9669421552481268 | AC17: =1-(LN(1-AC$1))/$A17 -> 3.0531504185752256 | AD17: =1-(LN(1-AD$1))/$A17 -> 3.1405644309173502 | AE17: =1-(LN(1-AE$1))/$A17 -> 3.2292183996170776 | AF17: =1-(LN(1-AF$1))/$A17 -> 3.3191480086927005 | AG17: =1-(LN(1-AG$1))/$A17 -> 3.410390505074905 | AH17: =1-(LN(1-AH$1))/$A17 -> 3.5029847912320338 | AI17: =1-(LN(1-AI$1))/$A17 -> 3.5969715247604124 | AJ17: =1-(LN(1-AJ$1))/$A17 -> 3.69239322557784 | AK17: =1-(LN(1-AK$1))/$A17 -> 3.7892943914276227 | AL17: =1-(LN(1-AL$1))/$A17 -> 3.8877216224784927 | AM17: =1-(LN(1-AM$1))/$A17 -> 3.9877237558937502 | AN17: =1-(LN(1-AN$1))/$A17 -> 4.0893520113423776 | AO17: =1-(LN(1-AO$1))/$A17 -> 4.1926601485374437 | AP17: =1-(LN(1-AP$1))/$A17 -> 4.2977046380148263 | AQ17: =1-(LN(1-AQ$1))/$A17 -> 4.4045448465104515 | AR17: =1-(LN(1-AR$1))/$A17 -> 4.5132432384596344 | AS17: =1-(LN(1-AS$1))/$A17 -> 4.6238655953308907 | AT17: =1-(LN(1-AT$1))/$A17 -> 4.73648125472263 | AU17: =1-(LN(1-AU$1))/$A17 -> 4.851163371398858 | AV17: =1-(LN(1-AV$1))/$A17 -> 4.9679892027248123 | AW17: =1-(LN(1-AW$1))/$A17 -> 5.0870404212916522 | AX17: =1-(LN(1-AX$1))/$A17 -> 5.2084034578985374 | AY17: =1-(LN(1-AY$1))/$A17 -> 5.332169878499661 | AZ17: =1-(LN(1-AZ$1))/$A17 -> 5.4584367992341578 | BA17: =1-(LN(1-BA$1))/$A17 -> 5.587307344251256 | BB17: =1-(LN(1-BB$1))/$A17 -> 5.7188911517377079 | BC17: =1-(LN(1-BC$1))/$A17 -> 5.8533049343687304 | BD17: =1-(LN(1-BD$1))/$A17 -> 5.9906731013610761 | BE17: =1-(LN(1-BE$1))/$A17 -> 6.1311284504364423 | BF17: =1-(LN(1-BF$1))/$A17 -> 6.2748129393408103 | BG17: =1-(LN(1-BG$1))/$A17 -> 6.4218785481545231 | BH17: =1-(LN(1-BH$1))/$A17 -> 6.572488245523652 | BI17: =1-(LN(1-BI$1))/$A17 -> 6.7268170742134741 | BJ17: =1-(LN(1-BJ$1))/$A17 -> 6.8850533741152855 | BK17: =1-(LN(1-BK$1))/$A17 -> 7.0474001641356656 | BL17: =1-(LN(1-BL$1))/$A17 -> 7.2140767083991735 | BM17: =1-(LN(1-BM$1))/$A17 -> 7.3853202970748892 | BN17: =1-(LN(1-BN$1))/$A17 -> 7.5613882781167421 | BO17: =1-(LN(1-BO$1))/$A17 -> 7.7425603835745695 | BP17: =1-(LN(1-BP$1))/$A17 -> 7.9291414032600764 | BQ17: =1-(LN(1-BQ$1))/$A17 -> 8.1214642699272872 | BR17: =1-(LN(1-BR$1))/$A17 -> 8.3198936343934147 | BS17: =1-(LN(1-BS$1))/$A17 -> 8.5248300270371082 | BT17: =1-(LN(1-BT$1))/$A17 -> 8.7367147250101169 | BU17: =1-(LN(1-BU$1))/$A17 -> 8.9560354738305552 | BV17: =1-(LN(1-BV$1))/$A17 -> 9.1833332498985243 | BW17: =1-(LN(1-BW$1))/$A17 -> 9.4192102997913185 | BX17: =1-(LN(1-BX$1))/$A17 -> 9.6643397569993272 | BY17: =1-(LN(1-BY$1))/$A17 -> 9.9194772227509223 | BZ17: =1-(LN(1-BZ$1))/$A17 -> 10.185474812868398 | CA17: =1-(LN(1-CA$1))/$A17 -> 10.46329832893611 | CB17: =1-(LN(1-CB$1))/$A17 -> 10.75404842665419 | CC17: =1-(LN(1-CC$1))/$A17 -> 11.058986952713141 | CD17: =1-(LN(1-CD$1))/$A17 -> 11.379570042635335 | CE17: =1-(LN(1-CE$1))/$A17 -> 11.717490175574559 | CF17: =1-(LN(1-CF$1))/$A17 -> 12.074730262074238 | CG17: =1-(LN(1-CG$1))/$A17 -> 12.453634148426959 | CH17: =1-(LN(1-CH$1))/$A17 -> 12.85699990553678 | CI17: =1-(LN(1-CI$1))/$A17 -> 13.288205352330229 | CJ17: =1-(LN(1-CJ$1))/$A17 -> 13.751380178290994 | CK17: =1-(LN(1-CK$1))/$A17 -> 14.251647101250599 | CL17: =1-(LN(1-CL$1))/$A17 -> 14.795468207435787 | CM17: =1-(LN(1-CM$1))/$A17 -> 15.391156831212824 | CN17: =1-(LN(1-CN$1))/$A17 -> 16.049660054074238 | CO17: =1-(LN(1-CO$1))/$A17 -> 16.785804026926641 | CP17: =1-(LN(1-CP$1))/$A17 -> 17.620375230829918 | CQ17: =1-(LN(1-CQ$1))/$A17 -> 18.583816979750292 | CR17: =1-(LN(1-CR$1))/$A17 -> 19.72332670971252 | CS17: =1-(LN(1-CS$1))/$A17 -> 21.117973905426354 | CT17: =1-(LN(1-CT$1))/$A17 -> 22.915986858250019 | CU17: =1-(LN(1-CU$1))/$A17 -> 25.450143783926116 | CV17: =1-(LN(1-CV$1))/$A17 -> 29.782313662425985
A18: =A17+0.01 -> 00.17 | B18: =1-(LN(1-B$1))/$A18 -> 1.0591196226676556 | C18: =1-(LN(1-C$1))/$A18 -> 1.118839454808938 | D18: =1-(LN(1-D$1))/$A18 -> 1.1791718087335799 | E18: =1-(LN(1-E$1))/$A18 -> 1.2401293795309127 | F18: =1-(LN(1-F$1))/$A18 -> 1.3017252611032386 | G18: =1-(LN(1-G$1))/$A18 -> 1.3639729630475736 | H18: =1-(LN(1-H$1))/$A18 -> 1.4268864284402087 | I18: =1-(LN(1-I$1))/$A18 -> 1.4904800525826529 | J18: =1-(LN(1-J$1))/$A18 -> 1.5547687027720074 | K18: =1-(LN(1-K$1))/$A18 -> 1.619767739163684 | L18: =1-(LN(1-L$1))/$A18 -> 1.6854930367997147 | M18: =1-(LN(1-M$1))/$A18 -> 1.7519610088816757 | N18: =1-(LN(1-N$1))/$A18 -> 1.8191886313735743 | O18: =1-(LN(1-O$1))/$A18 -> 1.8871934690269625 | P18: =1-(LN(1-P$1))/$A18 -> 1.9559937029280878 | Q18: =1-(LN(1-Q$1))/$A18 -> 2.0256081596751634 | R18: =1-(LN(1-R$1))/$A18 -> 2.0960563423029028 | S18: =1-(LN(1-S$1))/$A18 -> 2.1673584630814018 | T18: =1-(LN(1-T$1))/$A18 -> 2.2395354783273689 | U18: =1-(LN(1-U$1))/$A18 -> 2.3126091253777048 | V18: =1-(LN(1-V$1))/$A18 -> 2.3866019618886467 | W18: =1-(LN(1-W$1))/$A18 -> 2.4615374076382337 | X18: =1-(LN(1-X$1))/$A18 -> 2.5374397890259273 | Y18: =1-(LN(1-Y$1))/$A18 -> 2.6143343864809436 | Z18: =1-(LN(1-Z$1))/$A18 -> 2.6922474850104758 | AA18: =1-(LN(1-AA$1))/$A18 -> 2.7712064281407152 | AB18: =1-(LN(1-AB$1))/$A18 -> 2.8512396755276486 | AC18: =1-(LN(1-AC$1))/$A18 -> 2.9323768645413888 | AD18: =1-(LN(1-AD$1))/$A18 -> 3.0146488761575059 | AE18: =1-(LN(1-AE$1))/$A18 -> 3.0980879055219552 | AF18: =1-(LN(1-AF$1))/$A18 -> 3.1827275375931299 | AG18: =1-(LN(1-AG$1))/$A18 -> 3.2686028283057929 | AH18: =1-(LN(1-AH$1))/$A18 -> 3.3557503917477964 | AI18: =1-(LN(1-AI$1))/$A18 -> 3.4442084938921527 | AJ18: =1-(LN(1-AJ$1))/$A18 -> 3.5340171534850255 | AK18: =1-(LN(1-AK$1))/$A18 -> 3.6252182507554096 | AL18: =1-(LN(1-AL$1))/$A18 -> 3.7178556446856401 | AM18: =1-(LN(1-AM$1))/$A18 -> 3.8119752996647058 | AN18: =1-(LN(1-AN$1))/$A18 -> 3.9076254224398843 | AO18: =1-(LN(1-AO$1))/$A18 -> 4.004856610388182 | AP18: =1-(LN(1-AP$1))/$A18 -> 4.1037220122492482 | AQ18: =1-(LN(1-AQ$1))/$A18 -> 4.2042775025980719 | AR18: =1-(LN(1-AR$1))/$A18 -> 4.3065818714914208 | AS18: =1-(LN(1-AS$1))/$A18 -> 4.4106970308996614 | AT18: =1-(LN(1-AT$1))/$A18 -> 4.5166882397389454 | AU18: =1-(LN(1-AU$1))/$A18 -> 4.6246243495518655 | AV18: =1-(LN(1-AV$1))/$A18 -> 4.7345780731527647 | AW18: =1-(LN(1-AW$1))/$A18 -> 4.8466262788627308 | AX18: =1-(LN(1-AX$1))/$A18 -> 4.9608503133162696 | AY18: =1-(LN(1-AY$1))/$A18 -> 5.0773363562349747 | AZ18: =1-(LN(1-AZ$1))/$A18 -> 5.1961758110439131 | BA18: =1-(LN(1-BA$1))/$A18 -> 5.3174657357658877 | BB18: =1-(LN(1-BB$1))/$A18 -> 5.4413093192825484 | BC18: =1-(LN(1-BC$1))/$A18 -> 5.5678164088176292 | BD18: =1-(LN(1-BD$1))/$A18 -> 5.6971040953986591 | BE18: =1-(LN(1-BE$1))/$A18 -> 5.8292973651166511 | BF18: =1-(LN(1-BF$1))/$A18 -> 5.9645298252619385 | BG18: =1-(LN(1-BG$1))/$A18 -> 6.1029445159101394 | BH18: =1-(LN(1-BH$1))/$A18 -> 6.2446948193163783 | BI18: =1-(LN(1-BI$1))/$A18 -> 6.3899454816126813 | BJ18: =1-(LN(1-BJ$1))/$A18 -> 6.5388737638732097 | BK18: =1-(LN(1-BK$1))/$A18 -> 6.6916707427159201 | BL18: =1-(LN(1-BL$1))/$A18 -> 6.8485427843756925 | BM18: =1-(LN(1-BM$1))/$A18 -> 7.0097132207763666 | BN18: =1-(LN(1-BN$1))/$A18 -> 7.175424261756933 | BO18: =1-(LN(1-BO$1))/$A18 -> 7.3459391845407707 | BP18: =1-(LN(1-BP$1))/$A18 -> 7.52154485012713 | BQ18: =1-(LN(1-BQ$1))/$A18 -> 7.702554606990387 | BR18: =1-(LN(1-BR$1))/$A18 -> 7.8893116558996841 | BS18: =1-(LN(1-BS$1))/$A18 -> 8.0821929666231593 | BT18: =1-(LN(1-BT$1))/$A18 -> 8.281613858833051 | BU18: =1-(LN(1-BU$1))/$A18 -> 8.4880333871346387 | BV18: =1-(LN(1-BV$1))/$A18 -> 8.7019607057868456 | BW18: =1-(LN(1-BW$1))/$A18 -> 8.9239626350977108 | BX18: =1-(LN(1-BX$1))/$A18 -> 9.1546727124699547 | BY18: =1-(LN(1-BY$1))/$A18 -> 9.3948020920008677 | BZ18: =1-(LN(1-BZ$1))/$A18 -> 9.6451527650526092 | CA18: =1-(LN(1-CA$1))/$A18 -> 9.9066337213516338 | CB18: =1-(LN(1-CB$1))/$A18 -> 10.18028087214512 | CC18: =1-(LN(1-CC$1))/$A18 -> 10.467281837847663 | CD18: =1-(LN(1-CD$1))/$A18 -> 10.769007098950903 | CE18: =1-(LN(1-CE$1))/$A18 -> 11.087049577011349 | CF18: =1-(LN(1-CF$1))/$A18 -> 11.423275540775753 | CG18: =1-(LN(1-CG$1))/$A18 -> 11.779890963225371 | CH18: =1-(LN(1-CH$1))/$A18 -> 12.159529322858145 | CI18: =1-(LN(1-CI$1))/$A18 -> 12.565369743369628 | CJ18: =1-(LN(1-CJ$1))/$A18 -> 13.0012989913327 | CK18: =1-(LN(1-CK$1))/$A18 -> 13.472138448235857 | CL18: =1-(LN(1-CL$1))/$A18 -> 13.983970077586623 | CM18: =1-(LN(1-CM$1))/$A18 -> 14.544618194082656 | CN18: =1-(LN(1-CN$1))/$A18 -> 15.164385933246344 | CO18: =1-(LN(1-CO$1))/$A18 -> 15.857227319460367 | CP18: =1-(LN(1-CP$1))/$A18 -> 16.642706099604627 | CQ18: =1-(LN(1-CQ$1))/$A18 -> 17.549474804470861 | CR18: =1-(LN(1-CR$1))/$A18 -> 18.621954550317664 | CS18: =1-(LN(1-CS$1))/$A18 -> 19.93456367569539 | CT18: =1-(LN(1-CT$1))/$A18 -> 21.626811160705898 | CU18: =1-(LN(1-CU$1))/$A18 -> 24.011900031930459 | CV18: =1-(LN(1-CV$1))/$A18 -> 28.089236388165631
A19: =A18+0.01 -> 00.18 | B19: =1-(LN(1-B$1))/$A19 -> 1.0558351991861192 | C19: =1-(LN(1-C$1))/$A19 -> 1.112237262875108 | D19: =1-(LN(1-D$1))/$A19 -> 1.169217819359492 | E19: =1-(LN(1-E$1))/$A19 -> 1.2267888584458619 | F19: =1-(LN(1-F$1))/$A19 -> 1.2849627465975031 | G19: =1-(LN(1-G$1))/$A19 -> 1.343752242878264 | H19: =1-(LN(1-H$1))/$A19 -> 1.4031705157490861 | I19: =1-(LN(1-I$1))/$A19 -> 1.4632311607725055 | J19: =1-(LN(1-J$1))/$A19 -> 1.5239482192846738 | K19: =1-(LN(1-K$1))/$A19 -> 1.5853361980990348 | L19: =1-(LN(1-L$1))/$A19 -> 1.6474100903108417 | M19: =1-(LN(1-M$1))/$A19 -> 1.7101853972771381 | N19: =1-(LN(1-N$1))/$A19 -> 1.7736781518528202 | O19: =1-(LN(1-O$1))/$A19 -> 1.8379049429699092 | P19: =1-(LN(1-P$1))/$A19 -> 1.9028829416543052 | Q19: =1-(LN(1-Q$1))/$A19 -> 1.9686299285820987 | R19: =1-(LN(1-R$1))/$A19 -> 2.0351643232860748 | S19: =1-(LN(1-S$1))/$A19 -> 2.1025052151324353 | T19: =1-(LN(1-T$1))/$A19 -> 2.1706723961980705 | U19: =1-(LN(1-U$1))/$A19 -> 2.2396863961900548 | V19: =1-(LN(1-V$1))/$A19 -> 2.3095685195614997 | W19: =1-(LN(1-W$1))/$A19 -> 2.3803408849916652 | X19: =1-(LN(1-X$1))/$A19 -> 2.4520264674133756 | Y19: =1-(LN(1-Y$1))/$A19 -> 2.5246491427875579 | Z19: =1-(LN(1-Z$1))/$A19 -> 2.5982337358432268 | AA19: =1-(LN(1-AA$1))/$A19 -> 2.6728060710217862 | AB19: =1-(LN(1-AB$1))/$A19 -> 2.7483930268872232 | AC19: =1-(LN(1-AC$1))/$A19 -> 2.8250225942890892 | AD19: =1-(LN(1-AD$1))/$A19 -> 2.9027239385931995 | AE19: =1-(LN(1-AE$1))/$A19 -> 2.9815274663262912 | AF19: =1-(LN(1-AF$1))/$A19 -> 3.0614648966157336 | AG19: =1-(LN(1-AG$1))/$A19 -> 3.1425693378443595 | AH19: =1-(LN(1-AH$1))/$A19 -> 3.22487536998403 | AI19: =1-(LN(1-AI$1))/$A19 -> 3.3084191331203661 | AJ19: =1-(LN(1-AJ$1))/$A19 -> 3.3932384227358576 | AK19: =1-(LN(1-AK$1))/$A19 -> 3.4793727923801088 | AL19: =1-(LN(1-AL$1))/$A19 -> 3.5668636644253264 | AM19: =1-(LN(1-AM$1))/$A19 -> 3.6557544496833332 | AN19: =1-(LN(1-AN$1))/$A19 -> 3.7460906767487794 | AO19: =1-(LN(1-AO$1))/$A19 -> 3.8379201320332825 | AP19: =1-(LN(1-AP$1))/$A19 -> 3.9312930115687341 | AQ19: =1-(LN(1-AQ$1))/$A19 -> 4.0262620857870672 | AR19: =1-(LN(1-AR$1))/$A19 -> 4.1228828786307865 | AS19: =1-(LN(1-AS$1))/$A19 -> 4.2212138625163469 | AT19: =1-(LN(1-AT$1))/$A19 -> 4.3213166708645598 | AU19: =1-(LN(1-AU$1))/$A19 -> 4.4232563301323182 | AV19: =1-(LN(1-AV$1))/$A19 -> 4.5271015135331663 | AW19: =1-(LN(1-AW$1))/$A19 -> 4.6329248189259129 | AX19: =1-(LN(1-AX$1))/$A19 -> 4.7408030736875881 | AY19: =1-(LN(1-AY$1))/$A19 -> 4.8508176697774754 | AZ19: =1-(LN(1-AZ$1))/$A19 -> 4.9630549326525841 | BA19: =1-(LN(1-BA$1))/$A19 -> 5.0776065282233382 | BB19: =1-(LN(1-BB$1))/$A19 -> 5.1945699126557399 | BC19: =1-(LN(1-BC$1))/$A19 -> 5.3140488305499822 | BD19: =1-(LN(1-BD$1))/$A19 -> 5.436153867876512 | BE19: =1-(LN(1-BE$1))/$A19 -> 5.5610030670546147 | BF19: =1-(LN(1-BF$1))/$A19 -> 5.6887226127473864 | BG19: =1-(LN(1-BG$1))/$A19 -> 5.8194475983595755 | BH19: =1-(LN(1-BH$1))/$A19 -> 5.9533228849099125 | BI19: =1-(LN(1-BI$1))/$A19 -> 6.090504065967532 | BJ19: =1-(LN(1-BJ$1))/$A19 -> 6.2311585547691424 | BK19: =1-(LN(1-BK$1))/$A19 -> 6.3754668125650351 | BL19: =1-(LN(1-BL$1))/$A19 -> 6.5236237407992652 | BM19: =1-(LN(1-BM$1))/$A19 -> 6.6758402640665677 | BN19: =1-(LN(1-BN$1))/$A19 -> 6.8323451361037701 | BO19: =1-(LN(1-BO$1))/$A19 -> 6.9933870076218385 | BP19: =1-(LN(1-BP$1))/$A19 -> 7.159236802897845 | BQ19: =1-(LN(1-BQ$1))/$A19 -> 7.3301904621575877 | BR19: =1-(LN(1-BR$1))/$A19 -> 7.506572119460813 | BS19: =1-(LN(1-BS$1))/$A19 -> 7.6887378018107615 | BT19: =1-(LN(1-BT$1))/$A19 -> 7.877079755564548 | BU19: =1-(LN(1-BU$1))/$A19 -> 8.0720315322938276 | BV19: =1-(LN(1-BV$1))/$A19 -> 8.274073999909799 | BW19: =1-(LN(1-BW$1))/$A19 -> 8.4837424887033936 | BX19: =1-(LN(1-BX$1))/$A19 -> 8.7016353395549562 | BY19: =1-(LN(1-BY$1))/$A19 -> 8.928424198000819 | BZ19: =1-(LN(1-BZ$1))/$A19 -> 9.1648665003274647 | CA19: =1-(LN(1-CA$1))/$A19 -> 9.4118207368320981 | CB19: =1-(LN(1-CB$1))/$A19 -> 9.670265268137058 | CC19: =1-(LN(1-CC$1))/$A19 -> 9.9413217357450137 | CD19: =1-(LN(1-CD$1))/$A19 -> 10.226284482342519 | CE19: =1-(LN(1-CE$1))/$A19 -> 10.526657933844051 | CF19: =1-(LN(1-CF$1))/$A19 -> 10.844204677399322 | CG19: =1-(LN(1-CG$1))/$A19 -> 11.181008131935073 | CH19: =1-(LN(1-CH$1))/$A19 -> 11.539555471588248 | CI19: =1-(LN(1-CI$1))/$A19 -> 11.922849202071314 | CJ19: =1-(LN(1-CJ$1))/$A19 -> 12.334560158480881 | CK19: =1-(LN(1-CK$1))/$A19 -> 12.779241867778309 | CL19: =1-(LN(1-CL$1))/$A19 -> 13.262638406609588 | CM19: =1-(LN(1-CM$1))/$A19 -> 13.792139405522509 | CN19: =1-(LN(1-CN$1))/$A19 -> 14.377475603621546 | CO19: =1-(LN(1-CO$1))/$A19 -> 15.03182580171257 | CP19: =1-(LN(1-CP$1))/$A19 -> 15.773666871848814 | CQ19: =1-(LN(1-CQ$1))/$A19 -> 16.630059537555812 | CR19: =1-(LN(1-CR$1))/$A19 -> 17.642957075300018 | CS19: =1-(LN(1-CS$1))/$A19 -> 18.882643471490091 | CT19: =1-(LN(1-CT$1))/$A19 -> 20.48087720733335 | CU19: =1-(LN(1-CU$1))/$A19 -> 22.733461141267654 | CV19: =1-(LN(1-CV$1))/$A19 -> 26.584278811045316
A20: =A19+0.01 -> 00.19 | B20: =1-(LN(1-B$1))/$A20 -> 1.0528965044921128 | C20: =1-(LN(1-C$1))/$A20 -> 1.1063300385132604 | D20: =1-(LN(1-D$1))/$A20 -> 1.1603116183405715 | E20: =1-(LN(1-E$1))/$A20 -> 1.214852602738185 | F20: =1-(LN(1-F$1))/$A20 -> 1.2699647073028977 | G20: =1-(LN(1-G$1))/$A20 -> 1.3256600195688817 | H20: =1-(LN(1-H$1))/$A20 -> 1.3819510149201868 | I20: =1-(LN(1-I$1))/$A20 -> 1.4388505733634263 | J20: =1-(LN(1-J$1))/$A20 -> 1.4963719972170593 | K20: =1-(LN(1-K$1))/$A20 -> 1.554529029778033 | L20: =1-(LN(1-L$1))/$A20 -> 1.6133358750313236 | M20: =1-(LN(1-M$1))/$A20 -> 1.6728072184730782 | N20: =1-(LN(1-N$1))/$A20 -> 1.7329582491237243 | O20: =1-(LN(1-O$1))/$A20 -> 1.7938046828135981 | P20: =1-(LN(1-P$1))/$A20 -> 1.8553627868303941 | Q20: =1-(LN(1-Q$1))/$A20 -> 1.9176494060251463 | R20: =1-(LN(1-R$1))/$A20 -> 1.9806819904815445 | S20: =1-(LN(1-S$1))/$A20 -> 2.0444786248623066 | T20: =1-(LN(1-T$1))/$A20 -> 2.1090580595560668 | U20: =1-(LN(1-U$1))/$A20 -> 2.1744397437589988 | V20: =1-(LN(1-V$1))/$A20 -> 2.2406438606372099 | W20: =1-(LN(1-W$1))/$A20 -> 2.3076913647289459 | X20: =1-(LN(1-X$1))/$A20 -> 2.37560402176004 | Y20: =1-(LN(1-Y$1))/$A20 -> 2.4444044510618967 | Z20: =1-(LN(1-Z$1))/$A20 -> 2.5141161707988466 | AA20: =1-(LN(1-AA$1))/$A20 -> 2.5847636462311661 | AB20: =1-(LN(1-AB$1))/$A20 -> 2.6563723412615801 | AC20: =1-(LN(1-AC$1))/$A20 -> 2.7289687735370318 | AD20: =1-(LN(1-AD$1))/$A20 -> 2.8025805734040841 | AE20: =1-(LN(1-AE$1))/$A20 -> 2.87723654704596 | AF20: =1-(LN(1-AF$1))/$A20 -> 2.952966744162274 | AG20: =1-(LN(1-AG$1))/$A20 -> 3.0298025305893934 | AH20: =1-(LN(1-AH$1))/$A20 -> 3.1077766663006599 | AI20: =1-(LN(1-AI$1))/$A20 -> 3.1869233892719255 | AJ20: =1-(LN(1-AJ$1))/$A20 -> 3.2672785057497595 | AK20: =1-(LN(1-AK$1))/$A20 -> 3.3488794875179977 | AL20: =1-(LN(1-AL$1))/$A20 -> 3.4317655768239934 | AM20: =1-(LN(1-AM$1))/$A20 -> 3.5159778996999997 | AN20: =1-(LN(1-AN$1))/$A20 -> 3.6015595884988434 | AO20: =1-(LN(1-AO$1))/$A20 -> 3.6885559145578468 | AP20: =1-(LN(1-AP$1))/$A20 -> 3.7770144320124848 | AQ20: =1-(LN(1-AQ$1))/$A20 -> 3.8669851339035377 | AR20: =1-(LN(1-AR$1))/$A20 -> 3.9585206218607443 | AS20: =1-(LN(1-AS$1))/$A20 -> 4.0516762908049602 | AT20: =1-(LN(1-AT$1))/$A20 -> 4.1465105302927405 | AU20: =1-(LN(1-AU$1))/$A20 -> 4.2430849443358802 | AV20: =1-(LN(1-AV$1))/$A20 -> 4.3414645917682622 | AW20: =1-(LN(1-AW$1))/$A20 -> 4.4417182495087593 | AX20: =1-(LN(1-AX$1))/$A20 -> 4.5439187013882414 | AY20: =1-(LN(1-AY$1))/$A20 -> 4.6481430555786609 | AZ20: =1-(LN(1-AZ$1))/$A20 -> 4.7544730940919218 | BA20: =1-(LN(1-BA$1))/$A20 -> 4.8629956583168461 | BB20: =1-(LN(1-BB$1))/$A20 -> 4.9738030751475435 | BC20: =1-(LN(1-BC$1))/$A20 -> 5.0869936289420883 | BD20: =1-(LN(1-BD$1))/$A20 -> 5.2026720853566948 | BE20: =1-(LN(1-BE$1))/$A20 -> 5.3209502740517403 | BF20: =1-(LN(1-BF$1))/$A20 -> 5.441947738392261 | BG20: =1-(LN(1-BG$1))/$A20 -> 5.5657924616038086 | BH20: =1-(LN(1-BH$1))/$A20 -> 5.6926216804409693 | BI20: =1-(LN(1-BI$1))/$A20 -> 5.8225827993376615 | BJ20: =1-(LN(1-BJ$1))/$A20 -> 5.9558344203076086 | BK20: =1-(LN(1-BK$1))/$A20 -> 6.0925475066405594 | BL20: =1-(LN(1-BL$1))/$A20 -> 6.2329067018098296 | BM20: =1-(LN(1-BM$1))/$A20 -> 6.3771118291156954 | BN20: =1-(LN(1-BN$1))/$A20 -> 6.525379602624624 | BO20: =1-(LN(1-BO$1))/$A20 -> 6.6779455861680574 | BP20: =1-(LN(1-BP$1))/$A20 -> 6.8350664448505896 | BQ20: =1-(LN(1-BQ$1))/$A20 -> 6.9970225430966622 | BR20: =1-(LN(1-BR$1))/$A20 -> 7.1641209552786647 | BS20: =1-(LN(1-BS$1))/$A20 -> 7.3366989701365108 | BT20: =1-(LN(1-BT$1))/$A20 -> 7.5151281894822031 | BU20: =1-(LN(1-BU$1))/$A20 -> 7.6998193463836246 | BV20: =1-(LN(1-BV$1))/$A20 -> 7.8912279999145456 | BW20: =1-(LN(1-BW$1))/$A20 -> 8.0898613050874246 | BX20: =1-(LN(1-BX$1))/$A20 -> 8.2962861111573272 | BY20: =1-(LN(1-BY$1))/$A20 -> 8.5111387138955124 | BZ20: =1-(LN(1-BZ$1))/$A20 -> 8.7351366845207554 | CA20: =1-(LN(1-CA$1))/$A20 -> 8.9690933296304074 | CB20: =1-(LN(1-CB$1))/$A20 -> 9.2139355171824757 | CC20: =1-(LN(1-CC$1))/$A20 -> 9.4707258549163296 | CD20: =1-(LN(1-CD$1))/$A20 -> 9.7406905622192284 | CE20: =1-(LN(1-CE$1))/$A20 -> 10.025254884694364 | CF20: =1-(LN(1-CF$1))/$A20 -> 10.326088641746727 | CG20: =1-(LN(1-CG$1))/$A20 -> 10.645165598675332 | CH20: =1-(LN(1-CH$1))/$A20 -> 10.984842025715182 | CI20: =1-(LN(1-CI$1))/$A20 -> 11.347962401962297 | CJ20: =1-(LN(1-CJ$1))/$A20 -> 11.738004360666098 | CK20: =1-(LN(1-CK$1))/$A20 -> 12.159281769474187 | CL20: =1-(LN(1-CL$1))/$A20 -> 12.617236385209083 | CM20: =1-(LN(1-CM$1))/$A20 -> 13.118868910495006 | CN20: =1-(LN(1-CN$1))/$A20 -> 13.673397940273043 | CO20: =1-(LN(1-CO$1))/$A20 -> 14.293308654254012 | CP20: =1-(LN(1-CP$1))/$A20 -> 14.996105457540981 | CQ20: =1-(LN(1-CQ$1))/$A20 -> 15.807424825052875 | CR20: =1-(LN(1-CR$1))/$A20 -> 16.767011966073699 | CS20: =1-(LN(1-CS$1))/$A20 -> 17.941451709832716 | CT20: =1-(LN(1-CT$1))/$A20 -> 19.455567880631591 | CU20: =1-(LN(1-CU$1))/$A20 -> 21.589594765411462 | CV20: =1-(LN(1-CV$1))/$A20 -> 25.237737820990301
A21: =A20+0.01 -> 00.2 | B21: =1-(LN(1-B$1))/$A21 -> 1.0502516792675072 | C21: =1-(LN(1-C$1))/$A21 -> 1.1010135365875973 | D21: =1-(LN(1-D$1))/$A21 -> 1.1522960374235429 | E21: =1-(LN(1-E$1))/$A21 -> 1.2041099726012758 | F21: =1-(LN(1-F$1))/$A21 -> 1.256466471937753 | G21: =1-(LN(1-G$1))/$A21 -> 1.3093770185904376 | H21: =1-(LN(1-H$1))/$A21 -> 1.3628534641741774 | I21: =1-(LN(1-I$1))/$A21 -> 1.4169080446952549 | J21: =1-(LN(1-J$1))/$A21 -> 1.4715533973562063 | K21: =1-(LN(1-K$1))/$A21 -> 1.5268025782891312 | L21: =1-(LN(1-L$1))/$A21 -> 1.5826690812797575 | M21: =1-(LN(1-M$1))/$A21 -> 1.6391668575494243 | N21: =1-(LN(1-N$1))/$A21 -> 1.6963103366675383 | O21: =1-(LN(1-O$1))/$A21 -> 1.7541144486729181 | P21: =1-(LN(1-P$1))/$A21 -> 1.8125946474888746 | Q21: =1-(LN(1-Q$1))/$A21 -> 1.8717669357238889 | R21: =1-(LN(1-R$1))/$A21 -> 1.9316478909574673 | S21: =1-(LN(1-S$1))/$A21 -> 1.9922546936191914 | T21: =1-(LN(1-T$1))/$A21 -> 2.0536051565782634 | U21: =1-(LN(1-U$1))/$A21 -> 2.115717756571049 | V21: =1-(LN(1-V$1))/$A21 -> 2.1786116676053497 | W21: =1-(LN(1-W$1))/$A21 -> 2.2423067964924988 | X21: =1-(LN(1-X$1))/$A21 -> 2.306823820672038 | Y21: =1-(LN(1-Y$1))/$A21 -> 2.372184228508802 | Z21: =1-(LN(1-Z$1))/$A21 -> 2.438410362258904 | AA21: =1-(LN(1-AA$1))/$A21 -> 2.5055254639196081 | AB21: =1-(LN(1-AB$1))/$A21 -> 2.5735537241985007 | AC21: =1-(LN(1-AC$1))/$A21 -> 2.6425203348601802 | AD21: =1-(LN(1-AD$1))/$A21 -> 2.7124515447338799 | AE21: =1-(LN(1-AE$1))/$A21 -> 2.7833747196936618 | AF21: =1-(LN(1-AF$1))/$A21 -> 2.8553184069541597 | AG21: =1-(LN(1-AG$1))/$A21 -> 2.9283124040599233 | AH21: =1-(LN(1-AH$1))/$A21 -> 3.0023878329856268 | AI21: =1-(LN(1-AI$1))/$A21 -> 3.0775772198083295 | AJ21: =1-(LN(1-AJ$1))/$A21 -> 3.1539145804622715 | AK21: =1-(LN(1-AK$1))/$A21 -> 3.231435513142098 | AL21: =1-(LN(1-AL$1))/$A21 -> 3.3101772979827939 | AM21: =1-(LN(1-AM$1))/$A21 -> 3.3901790047149998 | AN21: =1-(LN(1-AN$1))/$A21 -> 3.4714816090739014 | AO21: =1-(LN(1-AO$1))/$A21 -> 3.5541281188299543 | AP21: =1-(LN(1-AP$1))/$A21 -> 3.6381637104118605 | AQ21: =1-(LN(1-AQ$1))/$A21 -> 3.7236358772083609 | AR21: =1-(LN(1-AR$1))/$A21 -> 3.8105945907677072 | AS21: =1-(LN(1-AS$1))/$A21 -> 3.8990924762647117 | AT21: =1-(LN(1-AT$1))/$A21 -> 3.9891850037781031 | AU21: =1-(LN(1-AU$1))/$A21 -> 4.0809306971190864 | AV21: =1-(LN(1-AV$1))/$A21 -> 4.1743913621798487 | AW21: =1-(LN(1-AW$1))/$A21 -> 4.2696323370333218 | AX21: =1-(LN(1-AX$1))/$A21 -> 4.3667227663188291 | AY21: =1-(LN(1-AY$1))/$A21 -> 4.4657359027997279 | AZ21: =1-(LN(1-AZ$1))/$A21 -> 4.5667494393873254 | BA21: =1-(LN(1-BA$1))/$A21 -> 4.6698458754010037 | BB21: =1-(LN(1-BB$1))/$A21 -> 4.775112921390166 | BC21: =1-(LN(1-BC$1))/$A21 -> 4.8826439474949836 | BD21: =1-(LN(1-BD$1))/$A21 -> 4.99253848108886 | BE21: =1-(LN(1-BE$1))/$A21 -> 5.1049027603491535 | BF21: =1-(LN(1-BF$1))/$A21 -> 5.2198503514726475 | BG21: =1-(LN(1-BG$1))/$A21 -> 5.3375028385236174 | BH21: =1-(LN(1-BH$1))/$A21 -> 5.457990596418921 | BI21: =1-(LN(1-BI$1))/$A21 -> 5.5814536593707782 | BJ21: =1-(LN(1-BJ$1))/$A21 -> 5.7080426992922275 | BK21: =1-(LN(1-BK$1))/$A21 -> 5.8379201313085316 | BL21: =1-(LN(1-BL$1))/$A21 -> 5.9712613667193377 | BM21: =1-(LN(1-BM$1))/$A21 -> 6.1082562376599103 | BN21: =1-(LN(1-BN$1))/$A21 -> 6.2491106224933928 | BO21: =1-(LN(1-BO$1))/$A21 -> 6.3940483068596548 | BP21: =1-(LN(1-BP$1))/$A21 -> 6.5433131226080601 | BQ21: =1-(LN(1-BQ$1))/$A21 -> 6.6971714159418285 | BR21: =1-(LN(1-BR$1))/$A21 -> 6.8559149075147312 | BS21: =1-(LN(1-BS$1))/$A21 -> 7.0198640216296848 | BT21: =1-(LN(1-BT$1))/$A21 -> 7.1893717800080923 | BU21: =1-(LN(1-BU$1))/$A21 -> 7.3648283790644431 | BV21: =1-(LN(1-BV$1))/$A21 -> 7.5466665999188178 | BW21: =1-(LN(1-BW$1))/$A21 -> 7.7353682398330541 | BX21: =1-(LN(1-BX$1))/$A21 -> 7.9314718055994602 | BY21: =1-(LN(1-BY$1))/$A21 -> 8.1355817782007378 | BZ21: =1-(LN(1-BZ$1))/$A21 -> 8.348379850294716 | CA21: =1-(LN(1-CA$1))/$A21 -> 8.5706386631488876 | CB21: =1-(LN(1-CB$1))/$A21 -> 8.8032387413233515 | CC21: =1-(LN(1-CC$1))/$A21 -> 9.0471895621705123 | CD21: =1-(LN(1-CD$1))/$A21 -> 9.3036560341082666 | CE21: =1-(LN(1-CE$1))/$A21 -> 9.5739921404596462 | CF21: =1-(LN(1-CF$1))/$A21 -> 9.8597842096593897 | CG21: =1-(LN(1-CG$1))/$A21 -> 10.162907318741565 | CH21: =1-(LN(1-CH$1))/$A21 -> 10.485599924429422 | CI21: =1-(LN(1-CI$1))/$A21 -> 10.830564281864183 | CJ21: =1-(LN(1-CJ$1))/$A21 -> 11.201104142632794 | CK21: =1-(LN(1-CK$1))/$A21 -> 11.601317681000477 | CL21: =1-(LN(1-CL$1))/$A21 -> 12.036374565948629 | CM21: =1-(LN(1-CM$1))/$A21 -> 12.512925464970255 | CN21: =1-(LN(1-CN$1))/$A21 -> 13.039728043259389 | CO21: =1-(LN(1-CO$1))/$A21 -> 13.628643221541312 | CP21: =1-(LN(1-CP$1))/$A21 -> 14.296300184663931 | CQ21: =1-(LN(1-CQ$1))/$A21 -> 15.067053583800231 | CR21: =1-(LN(1-CR$1))/$A21 -> 15.978661367770014 | CS21: =1-(LN(1-CS$1))/$A21 -> 17.094379124341078 | CT21: =1-(LN(1-CT$1))/$A21 -> 18.532789486600013 | CU21: =1-(LN(1-CU$1))/$A21 -> 20.560115027140888 | CV21: =1-(LN(1-CV$1))/$A21 -> 24.025850929940784
A22: =A21+0.01 -> 00.21 | B22: =1-(LN(1-B$1))/$A22 -> 1.0478587421595307 | C22: =1-(LN(1-C$1))/$A22 -> 1.096203368178664 | D22: =1-(LN(1-D$1))/$A22 -> 1.1450438451652789 | E22: =1-(LN(1-E$1))/$A22 -> 1.1943904500964531 | F22: =1-(LN(1-F$1))/$A22 -> 1.2442537827978599 | G22: =1-(LN(1-G$1))/$A22 -> 1.2946447796099405 | H22: =1-(LN(1-H$1))/$A22 -> 1.3455747277849308 | I22: =1-(LN(1-I$1))/$A22 -> 1.3970552806621477 | J22: =1-(LN(1-J$1))/$A22 -> 1.4490984736725774 | K22: =1-(LN(1-K$1))/$A22 -> 1.5017167412277441 | L22: =1-(LN(1-L$1))/$A22 -> 1.5549229345521498 | M22: =1-(LN(1-M$1))/$A22 -> 1.6087303405232611 | N22: =1-(LN(1-N$1))/$A22 -> 1.6631527015881316 | O22: =1-(LN(1-O$1))/$A22 -> 1.7182042368313506 | P22: =1-(LN(1-P$1))/$A22 -> 1.7738996642751186 | Q22: =1-(LN(1-Q$1))/$A22 -> 1.8302542244989417 | R22: =1-(LN(1-R$1))/$A22 -> 1.8872837056737783 | S22: =1-(LN(1-S$1))/$A22 -> 1.9450044701135156 | T22: =1-(LN(1-T$1))/$A22 -> 2.0034334824554887 | U22: =1-(LN(1-U$1))/$A22 -> 2.0625883395914753 | V22: =1-(LN(1-V$1))/$A22 -> 2.1224873024812854 | W22: =1-(LN(1-W$1))/$A22 -> 2.1831493299928555 | X22: =1-(LN(1-X$1))/$A22 -> 2.24459411492575 | Y22: =1-(LN(1-Y$1))/$A22 -> 2.3068421223893347 | Z22: =1-(LN(1-Z$1))/$A22 -> 2.3699146307227661 | AA22: =1-(LN(1-AA$1))/$A22 -> 2.4338337751615313 | AB22: =1-(LN(1-AB$1))/$A22 -> 2.4986225944747629 | AC22: =1-(LN(1-AC$1))/$A22 -> 2.5643050808192189 | AD22: =1-(LN(1-AD$1))/$A22 -> 2.6309062330798856 | AE22: =1-(LN(1-AE$1))/$A22 -> 2.6984521139939637 | AF22: =1-(LN(1-AF$1))/$A22 -> 2.7669699113849142 | AG22: =1-(LN(1-AG$1))/$A22 -> 2.8364880038665938 | AH22: =1-(LN(1-AH$1))/$A22 -> 2.9070360314148824 | AI22: =1-(LN(1-AI$1))/$A22 -> 2.9786449712460277 | AJ22: =1-(LN(1-AJ$1))/$A22 -> 3.0513472194878775 | AK22: =1-(LN(1-AK$1))/$A22 -> 3.1251766791829501 | AL22: =1-(LN(1-AL$1))/$A22 -> 3.2001688552217082 | AM22: =1-(LN(1-AM$1))/$A22 -> 3.2763609568714283 | AN22: =1-(LN(1-AN$1))/$A22 -> 3.3537920086418107 | AO22: =1-(LN(1-AO$1))/$A22 -> 3.4325029703142422 | AP22: =1-(LN(1-AP$1))/$A22 -> 3.5125368670589148 | AQ22: =1-(LN(1-AQ$1))/$A22 -> 3.5939389306746294 | AR22: =1-(LN(1-AR$1))/$A22 -> 3.6767567531121021 | AS22: =1-(LN(1-AS$1))/$A22 -> 3.7610404535854398 | AT22: =1-(LN(1-AT$1))/$A22 -> 3.8468428607410505 | AU22: =1-(LN(1-AU$1))/$A22 -> 3.9342197115419864 | AV22: =1-(LN(1-AV$1))/$A22 -> 4.0232298687427139 | AW22: =1-(LN(1-AW$1))/$A22 -> 4.1139355590793532 | AX22: =1-(LN(1-AX$1))/$A22 -> 4.2064026345893613 | AY22: =1-(LN(1-AY$1))/$A22 -> 4.3007008598092646 | AZ22: =1-(LN(1-AZ$1))/$A22 -> 4.3969042279879282 | BA22: =1-(LN(1-BA$1))/$A22 -> 4.4950913099057184 | BB22: =1-(LN(1-BB$1))/$A22 -> 4.5953456394192056 | BC22: =1-(LN(1-BC$1))/$A22 -> 4.6977561404714132 | BD22: =1-(LN(1-BD$1))/$A22 -> 4.8024176010370097 | BE22: =1-(LN(1-BE$1))/$A22 -> 4.9094312003325271 | BF22: =1-(LN(1-BF$1))/$A22 -> 5.0189050966406166 | BG22: =1-(LN(1-BG$1))/$A22 -> 5.1309550843082077 | BH22: =1-(LN(1-BH$1))/$A22 -> 5.2457053299227816 | BI22: =1-(LN(1-BI$1))/$A22 -> 5.3632891994007412 | BJ22: =1-(LN(1-BJ$1))/$A22 -> 5.4838501898021219 | BK22: =1-(LN(1-BK$1))/$A22 -> 5.6075429821986011 | BL22: =1-(LN(1-BL$1))/$A22 -> 5.7345346349707977 | BM22: =1-(LN(1-BM$1))/$A22 -> 5.8650059406284862 | BN22: =1-(LN(1-BN$1))/$A22 -> 5.9991529738032305 | BO22: =1-(LN(1-BO$1))/$A22 -> 6.1371888636758616 | BP22: =1-(LN(1-BP$1))/$A22 -> 6.279345831055295 | BQ22: =1-(LN(1-BQ$1))/$A22 -> 6.4258775389922178 | BR22: =1-(LN(1-BR$1))/$A22 -> 6.577061816680696 | BS22: =1-(LN(1-BS$1))/$A22 -> 6.7332038301235091 | BT22: =1-(LN(1-BT$1))/$A22 -> 6.8946397904838976 | BU22: =1-(LN(1-BU$1))/$A22 -> 7.061741313394708 | BV22: =1-(LN(1-BV$1))/$A22 -> 7.234920571351255 | BW22: =1-(LN(1-BW$1))/$A22 -> 7.4146364188886222 | BX22: =1-(LN(1-BX$1))/$A22 -> 7.6014017196185337 | BY22: =1-(LN(1-BY$1))/$A22 -> 7.7957921697149875 | BZ22: =1-(LN(1-BZ$1))/$A22 -> 7.9984570002806823 | CA22: =1-(LN(1-CA$1))/$A22 -> 8.2101320601417971 | CB22: =1-(LN(1-CB$1))/$A22 -> 8.4316559441174768 | CC22: =1-(LN(1-CC$1))/$A22 -> 8.6639900592100112 | CD22: =1-(LN(1-CD$1))/$A22 -> 8.908243842007872 | CE22: =1-(LN(1-CE$1))/$A22 -> 9.1657068004377571 | CF22: =1-(LN(1-CF$1))/$A22 -> 9.4378897234851333 | CG22: =1-(LN(1-CG$1))/$A22 -> 9.7265783988014896 | CH22: =1-(LN(1-CH$1))/$A22 -> 10.033904689932783 | CI22: =1-(LN(1-CI$1))/$A22 -> 10.362442173203982 | CJ22: =1-(LN(1-CJ$1))/$A22 -> 10.715337278697898 | CK22: =1-(LN(1-CK$1))/$A22 -> 11.096493029524265 | CL22: =1-(LN(1-CL$1))/$A22 -> 11.510832919951074 | CM22: =1-(LN(1-CM$1))/$A22 -> 11.964690919019292 | CN22: =1-(LN(1-CN$1))/$A22 -> 12.466407660247038 | CO22: =1-(LN(1-CO$1))/$A22 -> 13.027279258610772 | CP22: =1-(LN(1-CP$1))/$A22 -> 13.663143033013268 | CQ22: =1-(LN(1-CQ$1))/$A22 -> 14.397193889333552 | CR22: =1-(LN(1-CR$1))/$A22 -> 15.265391778828583 | CS22: =1-(LN(1-CS$1))/$A22 -> 16.327980118420076 | CT22: =1-(LN(1-CT$1))/$A22 -> 17.697894749142868 | CU22: =1-(LN(1-CU$1))/$A22 -> 19.628680978229415 | CV22: =1-(LN(1-CV$1))/$A22 -> 22.929381838038839
A23: =A22+0.01 -> 00.22 | B23: =1-(LN(1-B$1))/$A23 -> 1.0456833447886429 | C23: =1-(LN(1-C$1))/$A23 -> 1.0918304878069067 | D23: =1-(LN(1-D$1))/$A23 -> 1.1384509431123115 | E23: =1-(LN(1-E$1))/$A23 -> 1.1855545205466143 | F23: =1-(LN(1-F$1))/$A23 -> 1.2331513381252299 | G23: =1-(LN(1-G$1))/$A23 -> 1.281251835082216 | H23: =1-(LN(1-H$1))/$A23 -> 1.3298667856128885 | I23: =1-(LN(1-I$1))/$A23 -> 1.3790073133593226 | J23: =1-(LN(1-J$1))/$A23 -> 1.4286849066874603 | K23: =1-(LN(1-K$1))/$A23 -> 1.4789114348083012 | L23: =1-(LN(1-L$1))/$A23 -> 1.5296991647997795 | M23: =1-(LN(1-M$1))/$A23 -> 1.5810607795903857 | N23: =1-(LN(1-N$1))/$A23 -> 1.6330093969704893 | O23: =1-(LN(1-O$1))/$A23 -> 1.6855585897026528 | P23: =1-(LN(1-P$1))/$A23 -> 1.7387224068080678 | Q23: =1-(LN(1-Q$1))/$A23 -> 1.7925153961126261 | R23: =1-(LN(1-R$1))/$A23 -> 1.8469526281431521 | S23: =1-(LN(1-S$1))/$A23 -> 1.9020497214719922 | T23: =1-(LN(1-T$1))/$A23 -> 1.9578228696166029 | U23: =1-(LN(1-U$1))/$A23 -> 2.0142888696100445 | V23: =1-(LN(1-V$1))/$A23 -> 2.0714651523684995 | W23: =1-(LN(1-W$1))/$A23 -> 2.1293698149931801 | X23: =1-(LN(1-X$1))/$A23 -> 2.188021655156398 | Y23: =1-(LN(1-Y$1))/$A23 -> 2.2474402077352744 | Z23: =1-(LN(1-Z$1))/$A23 -> 2.307645783871731 | AA23: =1-(LN(1-AA$1))/$A23 -> 2.3686595126541885 | AB23: =1-(LN(1-AB$1))/$A23 -> 2.4305033856350007 | AC23: =1-(LN(1-AC$1))/$A23 -> 2.4932003044183455 | AD23: =1-(LN(1-AD$1))/$A23 -> 2.5567741315762542 | AE23: =1-(LN(1-AE$1))/$A23 -> 2.6212497451760561 | AF23: =1-(LN(1-AF$1))/$A23 -> 2.6866530972310545 | AG23: =1-(LN(1-AG$1))/$A23 -> 2.7530112764181123 | AH23: =1-(LN(1-AH$1))/$A23 -> 2.8203525754414787 | AI23: =1-(LN(1-AI$1))/$A23 -> 2.8887065634621174 | AJ23: =1-(LN(1-AJ$1))/$A23 -> 2.9581041640566106 | AK23: =1-(LN(1-AK$1))/$A23 -> 3.0285777392200885 | AL23: =1-(LN(1-AL$1))/$A23 -> 3.100161179984358 | AM23: =1-(LN(1-AM$1))/$A23 -> 3.172890004286363 | AN23: =1-(LN(1-AN$1))/$A23 -> 3.2468014627944557 | AO23: =1-(LN(1-AO$1))/$A23 -> 3.3219346534817764 | AP23: =1-(LN(1-AP$1))/$A23 -> 3.3983306458289642 | AQ23: =1-(LN(1-AQ$1))/$A23 -> 3.4760326156439643 | AR23: =1-(LN(1-AR$1))/$A23 -> 3.5550859916070063 | AS23: =1-(LN(1-AS$1))/$A23 -> 3.6355386147861015 | AT23: =1-(LN(1-AT$1))/$A23 -> 3.7174409125255483 | AU23: =1-(LN(1-AU$1))/$A23 -> 3.8008460882900779 | AV23: =1-(LN(1-AV$1))/$A23 -> 3.8858103292544079 | AW23: =1-(LN(1-AW$1))/$A23 -> 3.9723930336666555 | AX23: =1-(LN(1-AX$1))/$A23 -> 4.0606570602898451 | AY23: =1-(LN(1-AY$1))/$A23 -> 4.1506690025452073 | AZ23: =1-(LN(1-AZ$1))/$A23 -> 4.242499490352114 | BA23: =1-(LN(1-BA$1))/$A23 -> 4.3362235230918218 | BB23: =1-(LN(1-BB$1))/$A23 -> 4.4319208376274233 | BC23: =1-(LN(1-BC$1))/$A23 -> 4.5296763159045312 | BD23: =1-(LN(1-BD$1))/$A23 -> 4.6295804373535088 | BE23: =1-(LN(1-BE$1))/$A23 -> 4.7317297821355933 | BF23: =1-(LN(1-BF$1))/$A23 -> 4.8362275922478606 | BG23: =1-(LN(1-BG$1))/$A23 -> 4.9431843986578343 | BH23: =1-(LN(1-BH$1))/$A23 -> 5.0527187240172005 | BI23: =1-(LN(1-BI$1))/$A23 -> 5.1649578721552531 | BJ23: =1-(LN(1-BJ$1))/$A23 -> 5.2800388175383883 | BK23: =1-(LN(1-BK$1))/$A23 -> 5.3981092102804826 | BL23: =1-(LN(1-BL$1))/$A23 -> 5.5193285151993976 | BM23: =1-(LN(1-BM$1))/$A23 -> 5.6438693069635546 | BN23: =1-(LN(1-BN$1))/$A23 -> 5.7719187477212657 | BO23: =1-(LN(1-BO$1))/$A23 -> 5.9036802789633223 | BP23: =1-(LN(1-BP$1))/$A23 -> 6.0393755660073269 | BQ23: =1-(LN(1-BQ$1))/$A23 -> 6.1792467417652981 | BR23: =1-(LN(1-BR$1))/$A23 -> 6.323559006831573 | BS23: =1-(LN(1-BS$1))/$A23 -> 6.472603656026986 | BT23: =1-(LN(1-BT$1))/$A23 -> 6.6267016181891751 | BU23: =1-(LN(1-BU$1))/$A23 -> 6.7862076173313115 | BV23: =1-(LN(1-BV$1))/$A23 -> 6.9515150908352883 | BW23: =1-(LN(1-BW$1))/$A23 -> 7.1230620362118664 | BX23: =1-(LN(1-BX$1))/$A23 -> 7.3013380050904182 | BY23: =1-(LN(1-BY$1))/$A23 -> 7.4868925256370327 | BZ23: =1-(LN(1-BZ$1))/$A23 -> 7.6803453184497421 | CA23: =1-(LN(1-CA$1))/$A23 -> 7.8823987846808059 | CB23: =1-(LN(1-CB$1))/$A23 -> 8.0938534012030452 | CC23: =1-(LN(1-CC$1))/$A23 -> 8.3156268747004649 | CD23: =1-(LN(1-CD$1))/$A23 -> 8.5487782128256953 | CE23: =1-(LN(1-CE$1))/$A23 -> 8.7945383095087681 | CF23: =1-(LN(1-CF$1))/$A23 -> 9.0543492815085358 | CG23: =1-(LN(1-CG$1))/$A23 -> 9.3299157443105134 | CH23: =1-(LN(1-CH$1))/$A23 -> 9.6232726585722013 | CI23: =1-(LN(1-CI$1))/$A23 -> 9.9368766198765286 | CJ23: =1-(LN(1-CJ$1))/$A23 -> 10.273731038757084 | CK23: =1-(LN(1-CK$1))/$A23 -> 10.637561528182252 | CL23: =1-(LN(1-CL$1))/$A23 -> 11.033067787226026 | CM23: =1-(LN(1-CM$1))/$A23 -> 11.466295877245686 | CN23: =1-(LN(1-CN$1))/$A23 -> 11.94520731205399 | CO23: =1-(LN(1-CO$1))/$A23 -> 12.480584746855737 | CP23: =1-(LN(1-CP$1))/$A23 -> 13.087545622421755 | CQ23: =1-(LN(1-CQ$1))/$A23 -> 13.788230530727482 | CR23: =1-(LN(1-CR$1))/$A23 -> 14.61696487979092 | CS23: =1-(LN(1-CS$1))/$A23 -> 15.631253749400981 | CT23: =1-(LN(1-CT$1))/$A23 -> 16.938899533272739 | CU23: =1-(LN(1-CU$1))/$A23 -> 18.781922751946261 | CV23: =1-(LN(1-CV$1))/$A23 -> 21.932591754491618
A24: =A23+0.01 -> 00.23 | B24: =1-(LN(1-B$1))/$A24 -> 1.043697112406528 | C24: =1-(LN(1-C$1))/$A24 -> 1.0878378579022585 | D24: =1-(LN(1-D$1))/$A24 -> 1.1324313368900372 | E24: =1-(LN(1-E$1))/$A24 -> 1.1774869326967616 | F24: =1-(LN(1-F$1))/$A24 -> 1.2230143234241329 | G24: =1-(LN(1-G$1))/$A24 -> 1.2690234944264676 | H24: =1-(LN(1-H$1))/$A24 -> 1.3155247514558064 | I24: =1-(LN(1-I$1))/$A24 -> 1.3625287345176129 | J24: =1-(LN(1-J$1))/$A24 -> 1.4100464324836577 | K24: =1-(LN(1-K$1))/$A24 -> 1.4580891985122881 | L24: =1-(LN(1-L$1))/$A24 -> 1.5066687663302238 | M24: =1-(LN(1-M$1))/$A24 -> 1.5557972674342819 | N24: =1-(LN(1-N$1))/$A24 -> 1.6054872492761201 | O24: =1-(LN(1-O$1))/$A24 -> 1.6557516944981896 | P24: =1-(LN(1-P$1))/$A24 -> 1.7066040412946735 | Q24: =1-(LN(1-Q$1))/$A24 -> 1.7580582049772946 | R24: =1-(LN(1-R$1))/$A24 -> 1.8101286008325801 | S24: =1-(LN(1-S$1))/$A24 -> 1.8628301683645141 | T24: =1-(LN(1-T$1))/$A24 -> 1.9161783970245767 | U24: =1-(LN(1-U$1))/$A24 -> 1.9701893535400425 | V24: =1-(LN(1-V$1))/$A24 -> 2.0248797109611738 | W24: =1-(LN(1-W$1))/$A24 -> 2.080266779558694 | X24: =1-(LN(1-X$1))/$A24 -> 2.1363685397148151 | Y24: =1-(LN(1-Y$1))/$A24 -> 2.1932036769641754 | Z24: =1-(LN(1-Z$1))/$A24 -> 2.250791619355569 | AA24: =1-(LN(1-AA$1))/$A24 -> 2.3091525773213979 | AB24: =1-(LN(1-AB$1))/$A24 -> 2.3683075862595659 | AC24: =1-(LN(1-AC$1))/$A24 -> 2.4282785520523307 | AD24: =1-(LN(1-AD$1))/$A24 -> 2.489088299768591 | AE24: =1-(LN(1-AE$1))/$A24 -> 2.5507606258205753 | AF24: =1-(LN(1-AF$1))/$A24 -> 2.6133203538731822 | AG24: =1-(LN(1-AG$1))/$A24 -> 2.676793394834716 | AH24: =1-(LN(1-AH$1))/$A24 -> 2.7412068112918488 | AI24: =1-(LN(1-AI$1))/$A24 -> 2.8065888867898514 | AJ24: =1-(LN(1-AJ$1))/$A24 -> 2.8729692004019753 | AK24: =1-(LN(1-AK$1))/$A24 -> 2.9403787070800851 | AL24: =1-(LN(1-AL$1))/$A24 -> 3.0088498243328639 | AM24: =1-(LN(1-AM$1))/$A24 -> 3.0784165258391298 | AN24: =1-(LN(1-AN$1))/$A24 -> 3.1491144426729574 | AO24: =1-(LN(1-AO$1))/$A24 -> 3.220980972895612 | AP24: =1-(LN(1-AP$1))/$A24 -> 3.2940554003581393 | AQ24: =1-(LN(1-AQ$1))/$A24 -> 3.3683790236594437 | AR24: =1-(LN(1-AR$1))/$A24 -> 3.4439952963197453 | AS24: =1-(LN(1-AS$1))/$A24 -> 3.5209499793606187 | AT24: =1-(LN(1-AT$1))/$A24 -> 3.5992913076331328 | AU24: =1-(LN(1-AU$1))/$A24 -> 3.6790701714079006 | AV24: =1-(LN(1-AV$1))/$A24 -> 3.7603403149389991 | AW24: =1-(LN(1-AW$1))/$A24 -> 3.8431585539420183 | AX24: =1-(LN(1-AX$1))/$A24 -> 3.9275850141902859 | AY24: =1-(LN(1-AY$1))/$A24 -> 4.0136833937388943 | AZ24: =1-(LN(1-AZ$1))/$A24 -> 4.1015212516411523 | BA24: =1-(LN(1-BA$1))/$A24 -> 4.191170326435655 | BB24: =1-(LN(1-BB$1))/$A24 -> 4.2827068881653609 | BC24: =1-(LN(1-BC$1))/$A24 -> 4.3762121282565074 | BD24: =1-(LN(1-BD$1))/$A24 -> 4.4717725922511828 | BE24: =1-(LN(1-BE$1))/$A24 -> 4.5694806611731762 | BF24: =1-(LN(1-BF$1))/$A24 -> 4.6694350882370843 | BG24: =1-(LN(1-BG$1))/$A24 -> 4.7717415987161891 | BH24: =1-(LN(1-BH$1))/$A24 -> 4.8765135621034084 | BI24: =1-(LN(1-BI$1))/$A24 -> 4.9838727472789373 | BJ24: =1-(LN(1-BJ$1))/$A24 -> 5.0939501732975891 | BK24: =1-(LN(1-BK$1))/$A24 -> 5.2068870707030701 | BL24: =1-(LN(1-BL$1))/$A24 -> 5.3228359710602939 | BM24: =1-(LN(1-BM$1))/$A24 -> 5.4419619457912258 | BN24: =1-(LN(1-BN$1))/$A24 -> 5.5644440195594713 | BO24: =1-(LN(1-BO$1))/$A24 -> 5.6904767885736121 | BP24: =1-(LN(1-BP$1))/$A24 -> 5.8202722805287479 | BQ24: =1-(LN(1-BQ$1))/$A24 -> 5.9540621008189811 | BR24: =1-(LN(1-BR$1))/$A24 -> 6.0920999195780263 | BS24: =1-(LN(1-BS$1))/$A24 -> 6.2346643666345081 | BT24: =1-(LN(1-BT$1))/$A24 -> 6.3820624173983411 | BU24: =1-(LN(1-BU$1))/$A24 -> 6.5346333730995152 | BV24: =1-(LN(1-BV$1))/$A24 -> 6.6927535651467975 | BW24: =1-(LN(1-BW$1))/$A24 -> 6.8568419476809161 | BX24: =1-(LN(1-BX$1))/$A24 -> 7.0273667874777912 | BY24: =1-(LN(1-BY$1))/$A24 -> 7.2048537201745528 | BZ24: =1-(LN(1-BZ$1))/$A24 -> 7.3898955219954052 | CA24: =1-(LN(1-CA$1))/$A24 -> 7.5831640549120749 | CB24: =1-(LN(1-CB$1))/$A24 -> 7.7854249924550878 | CC24: =1-(LN(1-CC$1))/$A24 -> 7.997556141017836 | CD24: =1-(LN(1-CD$1))/$A24 -> 8.2205704644419697 | CE24: =1-(LN(1-CE$1))/$A24 -> 8.4556453395301254 | CF24: =1-(LN(1-CF$1))/$A24 -> 8.7041601823125134 | CG24: =1-(LN(1-CG$1))/$A24 -> 8.9677454945578816 | CH24: =1-(LN(1-CH$1))/$A24 -> 9.2483477603734094 | CI24: =1-(LN(1-CI$1))/$A24 -> 9.5483167668384183 | CJ24: =1-(LN(1-CJ$1))/$A24 -> 9.8705253414198193 | CK24: =1-(LN(1-CK$1))/$A24 -> 10.218537113913458 | CL24: =1-(LN(1-CL$1))/$A24 -> 10.59684744865098 | CM24: =1-(LN(1-CM$1))/$A24 -> 11.011239534756744 | CN24: =1-(LN(1-CN$1))/$A24 -> 11.469328733269034 | CO24: =1-(LN(1-CO$1))/$A24 -> 11.981428888296792 | CP24: =1-(LN(1-CP$1))/$A24 -> 12.56200016057733 | CQ24: =1-(LN(1-CQ$1))/$A24 -> 13.232220507652373 | CR24: =1-(LN(1-CR$1))/$A24 -> 14.024922928495663 | CS24: =1-(LN(1-CS$1))/$A24 -> 14.99511228203572 | CT24: =1-(LN(1-CT$1))/$A24 -> 16.245903901391316 | CU24: =1-(LN(1-CU$1))/$A24 -> 18.008795675774685 | CV24: =1-(LN(1-CV$1))/$A24 -> 21.022479069513722
A25: =A24+0.01 -> 00.24 | B25: =1-(LN(1-B$1))/$A25 -> 1.0418763993895894 | C25: =1-(LN(1-C$1))/$A25 -> 1.0841779471563311 | D25: =1-(LN(1-D$1))/$A25 -> 1.126913364519619 | E25: =1-(LN(1-E$1))/$A25 -> 1.1700916438343965 | F25: =1-(LN(1-F$1))/$A25 -> 1.2137220599481273 | G25: =1-(LN(1-G$1))/$A25 -> 1.2578141821586979 | H25: =1-(LN(1-H$1))/$A25 -> 1.3023778868118145 | I25: =1-(LN(1-I$1))/$A25 -> 1.3474233705793792 | J25: =1-(LN(1-J$1))/$A25 -> 1.3929611644635052 | K25: =1-(LN(1-K$1))/$A25 -> 1.4390021485742761 | L25: =1-(LN(1-L$1))/$A25 -> 1.4855575677331312 | M25: =1-(LN(1-M$1))/$A25 -> 1.5326390479578536 | N25: =1-(LN(1-N$1))/$A25 -> 1.5802586138896151 | O25: =1-(LN(1-O$1))/$A25 -> 1.6284287072274317 | P25: =1-(LN(1-P$1))/$A25 -> 1.6771622062407285 | Q25: =1-(LN(1-Q$1))/$A25 -> 1.7264724464365739 | R25: =1-(LN(1-R$1))/$A25 -> 1.776373242464556 | S25: =1-(LN(1-S$1))/$A25 -> 1.826878911349326 | T25: =1-(LN(1-T$1))/$A25 -> 1.8780042971485527 | U25: =1-(LN(1-U$1))/$A25 -> 1.9297647971425409 | V25: =1-(LN(1-V$1))/$A25 -> 1.9821763896711246 | W25: =1-(LN(1-W$1))/$A25 -> 2.0352556637437487 | X25: =1-(LN(1-X$1))/$A25 -> 2.0890198505600317 | Y25: =1-(LN(1-Y$1))/$A25 -> 2.143486857090668 | Z25: =1-(LN(1-Z$1))/$A25 -> 2.1986753018824201 | AA25: =1-(LN(1-AA$1))/$A25 -> 2.2546045532663399 | AB25: =1-(LN(1-AB$1))/$A25 -> 2.311294770165417 | AC25: =1-(LN(1-AC$1))/$A25 -> 2.3687669457168168 | AD25: =1-(LN(1-AD$1))/$A25 -> 2.4270429539448997 | AE25: =1-(LN(1-AE$1))/$A25 -> 2.4861455997447184 | AF25: =1-(LN(1-AF$1))/$A25 -> 2.5460986724617998 | AG25: =1-(LN(1-AG$1))/$A25 -> 2.6069270033832694 | AH25: =1-(LN(1-AH$1))/$A25 -> 2.6686565274880221 | AI25: =1-(LN(1-AI$1))/$A25 -> 2.7313143498402743 | AJ25: =1-(LN(1-AJ$1))/$A25 -> 2.7949288170518924 | AK25: =1-(LN(1-AK$1))/$A25 -> 2.8595295942850814 | AL25: =1-(LN(1-AL$1))/$A25 -> 2.9251477483189943 | AM25: =1-(LN(1-AM$1))/$A25 -> 2.9918158372624992 | AN25: =1-(LN(1-AN$1))/$A25 -> 3.0595680075615843 | AO25: =1-(LN(1-AO$1))/$A25 -> 3.1284400990249615 | AP25: =1-(LN(1-AP$1))/$A25 -> 3.1984697586765503 | AQ25: =1-(LN(1-AQ$1))/$A25 -> 3.2696965643403004 | AR25: =1-(LN(1-AR$1))/$A25 -> 3.342162158973089 | AS25: =1-(LN(1-AS$1))/$A25 -> 3.4159103968872597 | AT25: =1-(LN(1-AT$1))/$A25 -> 3.490987503148419 | AU25: =1-(LN(1-AU$1))/$A25 -> 3.5674422475992378 | AV25: =1-(LN(1-AV$1))/$A25 -> 3.6453261351498738 | AW25: =1-(LN(1-AW$1))/$A25 -> 3.7246936141944342 | AX25: =1-(LN(1-AX$1))/$A25 -> 3.8056023052656909 | AY25: =1-(LN(1-AY$1))/$A25 -> 3.8881132523331061 | AZ25: =1-(LN(1-AZ$1))/$A25 -> 3.9722911994894377 | BA25: =1-(LN(1-BA$1))/$A25 -> 4.0582048961675028 | BB25: =1-(LN(1-BB$1))/$A25 -> 4.1459274344918047 | BC25: =1-(LN(1-BC$1))/$A25 -> 4.2355366229124858 | BD25: =1-(LN(1-BD$1))/$A25 -> 4.3271154009073829 | BE25: =1-(LN(1-BE$1))/$A25 -> 4.4207523002909603 | BF25: =1-(LN(1-BF$1))/$A25 -> 4.5165419595605396 | BG25: =1-(LN(1-BG$1))/$A25 -> 4.6145856987696812 | BH25: =1-(LN(1-BH$1))/$A25 -> 4.7149921636824335 | BI25: =1-(LN(1-BI$1))/$A25 -> 4.8178780494756488 | BJ25: =1-(LN(1-BJ$1))/$A25 -> 4.9233689160768561 | BK25: =1-(LN(1-BK$1))/$A25 -> 5.0316001094237759 | BL25: =1-(LN(1-BL$1))/$A25 -> 5.1427178055994478 | BM25: =1-(LN(1-BM$1))/$A25 -> 5.2568801980499247 | BN25: =1-(LN(1-BN$1))/$A25 -> 5.3742588520778263 | BO25: =1-(LN(1-BO$1))/$A25 -> 5.4950402557163782 | BP25: =1-(LN(1-BP$1))/$A25 -> 5.6194276021733831 | BQ25: =1-(LN(1-BQ$1))/$A25 -> 5.7476428466181897 | BR25: =1-(LN(1-BR$1))/$A25 -> 5.8799290895956089 | BS25: =1-(LN(1-BS$1))/$A25 -> 6.0165533513580698 | BT25: =1-(LN(1-BT$1))/$A25 -> 6.1578098166734101 | BU25: =1-(LN(1-BU$1))/$A25 -> 6.304023649220369 | BV25: =1-(LN(1-BV$1))/$A25 -> 6.4555554999323475 | BW25: =1-(LN(1-BW$1))/$A25 -> 6.6128068665275439 | BX25: =1-(LN(1-BX$1))/$A25 -> 6.7762265046662167 | BY25: =1-(LN(1-BY$1))/$A25 -> 6.9463181485006134 | BZ25: =1-(LN(1-BZ$1))/$A25 -> 7.1236498752455963 | CA25: =1-(LN(1-CA$1))/$A25 -> 7.3088655526240718 | CB25: =1-(LN(1-CB$1))/$A25 -> 7.5026989511027917 | CC25: =1-(LN(1-CC$1))/$A25 -> 7.7059913018087594 | CD25: =1-(LN(1-CD$1))/$A25 -> 7.9197133617568873 | CE25: =1-(LN(1-CE$1))/$A25 -> 8.144993450383037 | CF25: =1-(LN(1-CF$1))/$A25 -> 8.3831535080494906 | CG25: =1-(LN(1-CG$1))/$A25 -> 8.6357560989513029 | CH25: =1-(LN(1-CH$1))/$A25 -> 8.9046666036911848 | CI25: =1-(LN(1-CI$1))/$A25 -> 9.192136901553484 | CJ25: =1-(LN(1-CJ$1))/$A25 -> 9.5009201188606607 | CK25: =1-(LN(1-CK$1))/$A25 -> 9.8344314008337292 | CL25: =1-(LN(1-CL$1))/$A25 -> 10.196978804957189 | CM25: =1-(LN(1-CM$1))/$A25 -> 10.594104554141879 | CN25: =1-(LN(1-CN$1))/$A25 -> 11.033106702716157 | CO25: =1-(LN(1-CO$1))/$A25 -> 11.523869351284425 | CP25: =1-(LN(1-CP$1))/$A25 -> 12.080250153886608 | CQ25: =1-(LN(1-CQ$1))/$A25 -> 12.722544653166857 | CR25: =1-(LN(1-CR$1))/$A25 -> 13.48221780647501 | CS25: =1-(LN(1-CS$1))/$A25 -> 14.411982603617565 | CT25: =1-(LN(1-CT$1))/$A25 -> 15.610657905500009 | CU25: =1-(LN(1-CU$1))/$A25 -> 17.300095855950737 | CV25: =1-(LN(1-CV$1))/$A25 -> 20.188209108283985
A26: =A25+0.01 -> 00.25 | B26: =1-(LN(1-B$1))/$A26 -> 1.0402013434140058 | C26: =1-(LN(1-C$1))/$A26 -> 1.0808108292700778 | D26: =1-(LN(1-D$1))/$A26 -> 1.1218368299388342 | E26: =1-(LN(1-E$1))/$A26 -> 1.1632879780810206 | F26: =1-(LN(1-F$1))/$A26 -> 1.2051731775502024 | G26: =1-(LN(1-G$1))/$A26 -> 1.2475016148723501 | H26: =1-(LN(1-H$1))/$A26 -> 1.2902827713393419 | I26: =1-(LN(1-I$1))/$A26 -> 1.333526435756204 | J26: =1-(LN(1-J$1))/$A26 -> 1.3772427178849651 | K26: =1-(LN(1-K$1))/$A26 -> 1.4214420626313049 | L26: =1-(LN(1-L$1))/$A26 -> 1.466135265023806 | M26: =1-(LN(1-M$1))/$A26 -> 1.5113334860395393 | N26: =1-(LN(1-N$1))/$A26 -> 1.5570482693340306 | O26: =1-(LN(1-O$1))/$A26 -> 1.6032915589383345 | P26: =1-(LN(1-P$1))/$A26 -> 1.6500757179910996 | Q26: =1-(LN(1-Q$1))/$A26 -> 1.6974135485791111 | R26: =1-(LN(1-R$1))/$A26 -> 1.7453183127659737 | S26: =1-(LN(1-S$1))/$A26 -> 1.7938037548953529 | T26: =1-(LN(1-T$1))/$A26 -> 1.8428841252626105 | U26: =1-(LN(1-U$1))/$A26 -> 1.8925742052568393 | V26: =1-(LN(1-V$1))/$A26 -> 1.9428893340842797 | W26: =1-(LN(1-W$1))/$A26 -> 1.9938454371939986 | X26: =1-(LN(1-X$1))/$A26 -> 2.0454590565376303 | Y26: =1-(LN(1-Y$1))/$A26 -> 2.0977473828070412 | Z26: =1-(LN(1-Z$1))/$A26 -> 2.1507282898071232 | AA26: =1-(LN(1-AA$1))/$A26 -> 2.2044203711356865 | AB26: =1-(LN(1-AB$1))/$A26 -> 2.2588429793588007 | AC26: =1-(LN(1-AC$1))/$A26 -> 2.3140162678881442 | AD26: =1-(LN(1-AD$1))/$A26 -> 2.3699612357871036 | AE26: =1-(LN(1-AE$1))/$A26 -> 2.4266997757549298 | AF26: =1-(LN(1-AF$1))/$A26 -> 2.484254725563328 | AG26: =1-(LN(1-AG$1))/$A26 -> 2.5426499232479385 | AH26: =1-(LN(1-AH$1))/$A26 -> 2.6019102663885012 | AI26: =1-(LN(1-AI$1))/$A26 -> 2.6620617758466634 | AJ26: =1-(LN(1-AJ$1))/$A26 -> 2.7231316643698174 | AK26: =1-(LN(1-AK$1))/$A26 -> 2.7851484105136781 | AL26: =1-(LN(1-AL$1))/$A26 -> 2.8481418383862351 | AM26: =1-(LN(1-AM$1))/$A26 -> 2.9121432037719996 | AN26: =1-(LN(1-AN$1))/$A26 -> 2.9771852872591209 | AO26: =1-(LN(1-AO$1))/$A26 -> 3.0433024950639633 | AP26: =1-(LN(1-AP$1))/$A26 -> 3.1105309683294884 | AQ26: =1-(LN(1-AQ$1))/$A26 -> 3.1789087017666886 | AR26: =1-(LN(1-AR$1))/$A26 -> 3.2484756726141657 | AS26: =1-(LN(1-AS$1))/$A26 -> 3.3192739810117695 | AT26: =1-(LN(1-AT$1))/$A26 -> 3.3913480030224825 | AU26: =1-(LN(1-AU$1))/$A26 -> 3.4647445576952687 | AV26: =1-(LN(1-AV$1))/$A26 -> 3.5395130897438793 | AW26: =1-(LN(1-AW$1))/$A26 -> 3.6157058696266571 | AX26: =1-(LN(1-AX$1))/$A26 -> 3.6933782130550634 | AY26: =1-(LN(1-AY$1))/$A26 -> 3.7725887222397825 | AZ26: =1-(LN(1-AZ$1))/$A26 -> 3.8533995515098605 | BA26: =1-(LN(1-BA$1))/$A26 -> 3.9358767003208035 | BB26: =1-(LN(1-BB$1))/$A26 -> 4.0200903371121317 | BC26: =1-(LN(1-BC$1))/$A26 -> 4.1061151579959869 | BD26: =1-(LN(1-BD$1))/$A26 -> 4.1940307848710878 | BE26: =1-(LN(1-BE$1))/$A26 -> 4.2839222082793222 | BF26: =1-(LN(1-BF$1))/$A26 -> 4.3758802811781177 | BG26: =1-(LN(1-BG$1))/$A26 -> 4.4700022708188936 | BH26: =1-(LN(1-BH$1))/$A26 -> 4.5663924771351363 | BI26: =1-(LN(1-BI$1))/$A26 -> 4.6651629274966222 | BJ26: =1-(LN(1-BJ$1))/$A26 -> 4.766434159433782 | BK26: =1-(LN(1-BK$1))/$A26 -> 4.8703361050468246 | BL26: =1-(LN(1-BL$1))/$A26 -> 4.9770090933754698 | BM26: =1-(LN(1-BM$1))/$A26 -> 5.0866049901279284 | BN26: =1-(LN(1-BN$1))/$A26 -> 5.199288497994714 | BO26: =1-(LN(1-BO$1))/$A26 -> 5.3152386454877236 | BP26: =1-(LN(1-BP$1))/$A26 -> 5.4346504980864481 | BQ26: =1-(LN(1-BQ$1))/$A26 -> 5.5577371327534628 | BR26: =1-(LN(1-BR$1))/$A26 -> 5.6847319260117848 | BS26: =1-(LN(1-BS$1))/$A26 -> 5.815891217303748 | BT26: =1-(LN(1-BT$1))/$A26 -> 5.9514974240064742 | BU26: =1-(LN(1-BU$1))/$A26 -> 6.0918627032515547 | BV26: =1-(LN(1-BV$1))/$A26 -> 6.2373332799350543 | BW26: =1-(LN(1-BW$1))/$A26 -> 6.3882945918664431 | BX26: =1-(LN(1-BX$1))/$A26 -> 6.5451774444795685 | BY26: =1-(LN(1-BY$1))/$A26 -> 6.7084654225605895 | BZ26: =1-(LN(1-BZ$1))/$A26 -> 6.8787038802357738 | CA26: =1-(LN(1-CA$1))/$A26 -> 7.0565109305191092 | CB26: =1-(LN(1-CB$1))/$A26 -> 7.2425909930586805 | CC26: =1-(LN(1-CC$1))/$A26 -> 7.4377516497364091 | CD26: =1-(LN(1-CD$1))/$A26 -> 7.6429248272866124 | CE26: =1-(LN(1-CE$1))/$A26 -> 7.8591937123677162 | CF26: =1-(LN(1-CF$1))/$A26 -> 8.0878273677275114 | CG26: =1-(LN(1-CG$1))/$A26 -> 8.3303258549932515 | CH26: =1-(LN(1-CH$1))/$A26 -> 8.5884799395435376 | CI26: =1-(LN(1-CI$1))/$A26 -> 8.864451425491346 | CJ26: =1-(LN(1-CJ$1))/$A26 -> 9.1608833141062345 | CK26: =1-(LN(1-CK$1))/$A26 -> 9.4810541448003818 | CL26: =1-(LN(1-CL$1))/$A26 -> 9.8290996527589023 | CM26: =1-(LN(1-CM$1))/$A26 -> 10.210340371976205 | CN26: =1-(LN(1-CN$1))/$A26 -> 10.631782434607512 | CO26: =1-(LN(1-CO$1))/$A26 -> 11.102914577233049 | CP26: =1-(LN(1-CP$1))/$A26 -> 11.637040147731145 | CQ26: =1-(LN(1-CQ$1))/$A26 -> 12.253642867040185 | CR26: =1-(LN(1-CR$1))/$A26 -> 12.982929094216011 | CS26: =1-(LN(1-CS$1))/$A26 -> 13.875503299472863 | CT26: =1-(LN(1-CT$1))/$A26 -> 15.026231589280009 | CU26: =1-(LN(1-CU$1))/$A26 -> 16.64809202171271 | CV26: =1-(LN(1-CV$1))/$A26 -> 19.420680743952627
A27: =A26+0.01 -> 00.26 | B27: =1-(LN(1-B$1))/$A27 -> 1.0386551378980824 | C27: =1-(LN(1-C$1))/$A27 -> 1.077702720451998 | D27: =1-(LN(1-D$1))/$A27 -> 1.1171507980181099 | E27: =1-(LN(1-E$1))/$A27 -> 1.1570076712317505 | F27: =1-(LN(1-F$1))/$A27 -> 1.1972819014905791 | G27: =1-(LN(1-G$1))/$A27 -> 1.2379823219926442 | H27: =1-(LN(1-H$1))/$A27 -> 1.2791180493647518 | I27: =1-(LN(1-I$1))/$A27 -> 1.320698495919427 | J27: =1-(LN(1-J$1))/$A27 -> 1.3627333825816972 | K27: =1-(LN(1-K$1))/$A27 -> 1.4052327525301009 | L27: =1-(LN(1-L$1))/$A27 -> 1.4482069855998134 | M27: =1-(LN(1-M$1))/$A27 -> 1.4916668134995572 | N27: =1-(LN(1-N$1))/$A27 -> 1.5356233358981062 | O27: =1-(LN(1-O$1))/$A27 -> 1.5800880374407063 | P27: =1-(LN(1-P$1))/$A27 -> 1.6250728057606727 | Q27: =1-(LN(1-Q$1))/$A27 -> 1.6705899505568376 | R27: =1-(LN(1-R$1))/$A27 -> 1.7166522238134363 | S27: =1-(LN(1-S$1))/$A27 -> 1.7632728412455316 | T27: =1-(LN(1-T$1))/$A27 -> 1.8104655050602023 | U27: =1-(LN(1-U$1))/$A27 -> 1.858244428131576 | V27: =1-(LN(1-V$1))/$A27 -> 1.9066243596964227 | W27: =1-(LN(1-W$1))/$A27 -> 1.9556206126865372 | X27: =1-(LN(1-X$1))/$A27 -> 2.0052490928246445 | Y27: =1-(LN(1-Y$1))/$A27 -> 2.0555263296221549 | Z27: =1-(LN(1-Z$1))/$A27 -> 2.1064695094299264 | AA27: =1-(LN(1-AA$1))/$A27 -> 2.1580965107073906 | AB27: =1-(LN(1-AB$1))/$A27 -> 2.2104259416911543 | AC27: =1-(LN(1-AC$1))/$A27 -> 2.2634771806616767 | AD27: =1-(LN(1-AD$1))/$A27 -> 2.3172704190260616 | AE27: =1-(LN(1-AE$1))/$A27 -> 2.371826707456663 | AF27: =1-(LN(1-AF$1))/$A27 -> 2.4271680053493538 | AG27: =1-(LN(1-AG$1))/$A27 -> 2.4833172338922491 | AH27: =1-(LN(1-AH$1))/$A27 -> 2.5402983330658664 | AI27: =1-(LN(1-AI$1))/$A27 -> 2.5981363229294843 | AJ27: =1-(LN(1-AJ$1))/$A27 -> 2.6568573695863629 | AK27: =1-(LN(1-AK$1))/$A27 -> 2.716488856263152 | AL27: =1-(LN(1-AL$1))/$A27 -> 2.7770594599867646 | AM27: =1-(LN(1-AM$1))/$A27 -> 2.8385992343961535 | AN27: =1-(LN(1-AN$1))/$A27 -> 2.9011396992876159 | AO27: =1-(LN(1-AO$1))/$A27 -> 2.9647139375615033 | AP27: =1-(LN(1-AP$1))/$A27 -> 3.0293567003168156 | AQ27: =1-(LN(1-AQ$1))/$A27 -> 3.0951045209295081 | AR27: =1-(LN(1-AR$1))/$A27 -> 3.1619958390520821 | AS27: =1-(LN(1-AS$1))/$A27 -> 3.2300711355882399 | AT27: =1-(LN(1-AT$1))/$A27 -> 3.2993730798293099 | AU27: =1-(LN(1-AU$1))/$A27 -> 3.3699466900916044 | AV27: =1-(LN(1-AV$1))/$A27 -> 3.4418395093691148 | AW27: =1-(LN(1-AW$1))/$A27 -> 3.5151017977179393 | AX27: =1-(LN(1-AX$1))/$A27 -> 3.589786743322176 | AY27: =1-(LN(1-AY$1))/$A27 -> 3.6659506944613289 | AZ27: =1-(LN(1-AZ$1))/$A27 -> 3.7436534149133269 | BA27: =1-(LN(1-BA$1))/$A27 -> 3.8229583656930801 | BB27: =1-(LN(1-BB$1))/$A27 -> 3.9039330164539732 | BC27: =1-(LN(1-BC$1))/$A27 -> 3.9866491903807568 | BD27: =1-(LN(1-BD$1))/$A27 -> 4.0711834469914301 | BE27: =1-(LN(1-BE$1))/$A27 -> 4.1576175079608868 | BF27: =1-(LN(1-BF$1))/$A27 -> 4.2460387319020363 | BG27: =1-(LN(1-BG$1))/$A27 -> 4.3365406450181672 | BH27: =1-(LN(1-BH$1))/$A27 -> 4.4292235357068623 | BI27: =1-(LN(1-BI$1))/$A27 -> 4.5241951225929062 | BJ27: =1-(LN(1-BJ$1))/$A27 -> 4.6215713071478675 | BK27: =1-(LN(1-BK$1))/$A27 -> 4.7214770240834856 | BL27: =1-(LN(1-BL$1))/$A27 -> 4.8240472051687213 | BM27: =1-(LN(1-BM$1))/$A27 -> 4.9294278751230074 | BN27: =1-(LN(1-BN$1))/$A27 -> 5.0377774019179942 | BO27: =1-(LN(1-BO$1))/$A27 -> 5.1492679283535798 | BP27: =1-(LN(1-BP$1))/$A27 -> 5.264087017390815 | BQ27: =1-(LN(1-BQ$1))/$A27 -> 5.3824395507244835 | BR27: =1-(LN(1-BR$1))/$A27 -> 5.5045499288574851 | BS27: =1-(LN(1-BS$1))/$A27 -> 5.6306646320228344 | BT27: =1-(LN(1-BT$1))/$A27 -> 5.7610552153908401 | BU27: =1-(LN(1-BU$1))/$A27 -> 5.8960218300495715 | BV27: =1-(LN(1-BV$1))/$A27 -> 6.0358973845529365 | BW27: =1-(LN(1-BW$1))/$A27 -> 6.1810524921792718 | BX27: =1-(LN(1-BX$1))/$A27 -> 6.3319013889226614 | BY27: =1-(LN(1-BY$1))/$A27 -> 6.4889090601544126 | BZ27: =1-(LN(1-BZ$1))/$A27 -> 6.6525998848420898 | CA27: =1-(LN(1-CA$1))/$A27 -> 6.8235682024222202 | CB27: =1-(LN(1-CB$1))/$A27 -> 7.0024913394795005 | CC27: =1-(LN(1-CC$1))/$A27 -> 7.1901458170542396 | CD27: =1-(LN(1-CD$1))/$A27 -> 7.3874277185448198 | CE27: =1-(LN(1-CE$1))/$A27 -> 7.5953785695843425 | CF27: =1-(LN(1-CF$1))/$A27 -> 7.815218622814915 | CG27: =1-(LN(1-CG$1))/$A27 -> 8.0483902451858178 | CH27: =1-(LN(1-CH$1))/$A27 -> 8.2966153264841704 | CI27: =1-(LN(1-CI$1))/$A27 -> 8.5619725245109084 | CJ27: =1-(LN(1-CJ$1))/$A27 -> 8.8470031866406096 | CK27: =1-(LN(1-CK$1))/$A27 -> 9.1548597546157513 | CL27: =1-(LN(1-CL$1))/$A27 -> 9.4895188968835598 | CM27: =1-(LN(1-CM$1))/$A27 -> 9.856096511515581 | CN27: =1-(LN(1-CN$1))/$A27 -> 10.261329264045685 | CO27: =1-(LN(1-CO$1))/$A27 -> 10.714340939647162 | CP27: =1-(LN(1-CP$1))/$A27 -> 11.227923218972254 | CQ27: =1-(LN(1-CQ$1))/$A27 -> 11.820810449077099 | CR27: =1-(LN(1-CR$1))/$A27 -> 12.522047205976932 | CS27: =1-(LN(1-CS$1))/$A27 -> 13.380291634108522 | CT27: =1-(LN(1-CT$1))/$A27 -> 14.48676114353847 | CU27: =1-(LN(1-CU$1))/$A27 -> 16.046242328569914 | CV27: =1-(LN(1-CV$1))/$A27 -> 18.712193023031372
A28: =A27+0.01 -> 00.27 | B28: =1-(LN(1-B$1))/$A28 -> 1.0372234661240793 | C28: =1-(LN(1-C$1))/$A28 -> 1.0748248419167388 | D28: =1-(LN(1-D$1))/$A28 -> 1.1128118795729947 | E28: =1-(LN(1-E$1))/$A28 -> 1.1511925722972414 | F28: =1-(LN(1-F$1))/$A28 -> 1.1899751643983354 | G28: =1-(LN(1-G$1))/$A28 -> 1.2291681619188426 | H28: =1-(LN(1-H$1))/$A28 -> 1.2687803438327241 | I28: =1-(LN(1-I$1))/$A28 -> 1.3088207738483371 | J28: =1-(LN(1-J$1))/$A28 -> 1.3492988128564491 | K28: =1-(LN(1-K$1))/$A28 -> 1.3902241320660231 | L28: =1-(LN(1-L$1))/$A28 -> 1.4316067268738943 | M28: =1-(LN(1-M$1))/$A28 -> 1.4734569315180921 | N28: =1-(LN(1-N$1))/$A28 -> 1.5157854345685466 | O28: =1-(LN(1-O$1))/$A28 -> 1.5586032953132727 | P28: =1-(LN(1-P$1))/$A28 -> 1.6019219611028701 | Q28: =1-(LN(1-Q$1))/$A28 -> 1.645753285721399 | R28: =1-(LN(1-R$1))/$A28 -> 1.6901095488573832 | S28: =1-(LN(1-S$1))/$A28 -> 1.7350034767549565 | T28: =1-(LN(1-T$1))/$A28 -> 1.7804482641320467 | U28: =1-(LN(1-U$1))/$A28 -> 1.8264575974600361 | V28: =1-(LN(1-V$1))/$A28 -> 1.8730456797076664 | W28: =1-(LN(1-W$1))/$A28 -> 1.9202272566611098 | X28: =1-(LN(1-X$1))/$A28 -> 1.9680176449422502 | Y28: =1-(LN(1-Y$1))/$A28 -> 2.0164327618583719 | Z28: =1-(LN(1-Z$1))/$A28 -> 2.0654891572288179 | AA28: =1-(LN(1-AA$1))/$A28 -> 2.1152040473478575 | AB28: =1-(LN(1-AB$1))/$A28 -> 2.1655953512581485 | AC28: =1-(LN(1-AC$1))/$A28 -> 2.2166817295260595 | AD28: =1-(LN(1-AD$1))/$A28 -> 2.2684826257288 | AE28: =1-(LN(1-AE$1))/$A28 -> 2.321018310884194 | AF28: =1-(LN(1-AF$1))/$A28 -> 2.3743099310771552 | AG28: =1-(LN(1-AG$1))/$A28 -> 2.4283795585629062 | AH28: =1-(LN(1-AH$1))/$A28 -> 2.4832502466560196 | AI28: =1-(LN(1-AI$1))/$A28 -> 2.5389460887469104 | AJ28: =1-(LN(1-AJ$1))/$A28 -> 2.5954922818239048 | AK28: =1-(LN(1-AK$1))/$A28 -> 2.6529151949200722 | AL28: =1-(LN(1-AL$1))/$A28 -> 2.7112424429502173 | AM28: =1-(LN(1-AM$1))/$A28 -> 2.7705029664555552 | AN28: =1-(LN(1-AN$1))/$A28 -> 2.8307271178325193 | AO28: =1-(LN(1-AO$1))/$A28 -> 2.8919467546888549 | AP28: =1-(LN(1-AP$1))/$A28 -> 2.9541953410458222 | AQ28: =1-(LN(1-AQ$1))/$A28 -> 3.0175080571913782 | AR28: =1-(LN(1-AR$1))/$A28 -> 3.0819219190871903 | AS28: =1-(LN(1-AS$1))/$A28 -> 3.147475908344231 | AT28: =1-(LN(1-AT$1))/$A28 -> 3.2142111139097058 | AU28: =1-(LN(1-AU$1))/$A28 -> 3.2821708867548782 | AV28: =1-(LN(1-AV$1))/$A28 -> 3.3514010090221102 | AW28: =1-(LN(1-AW$1))/$A28 -> 3.4219498792839413 | AX28: =1-(LN(1-AX$1))/$A28 -> 3.493868715791725 | AY28: =1-(LN(1-AY$1))/$A28 -> 3.5672117798516503 | AZ28: =1-(LN(1-AZ$1))/$A28 -> 3.6420366217683888 | BA28: =1-(LN(1-BA$1))/$A28 -> 3.7184043521488919 | BB28: =1-(LN(1-BB$1))/$A28 -> 3.7963799417704926 | BC28: =1-(LN(1-BC$1))/$A28 -> 3.876032553699988 | BD28: =1-(LN(1-BD$1))/$A28 -> 3.9574359119176741 | BE28: =1-(LN(1-BE$1))/$A28 -> 4.0406687113697428 | BF28: =1-(LN(1-BF$1))/$A28 -> 4.1258150751649243 | BG28: =1-(LN(1-BG$1))/$A28 -> 4.2129650655730497 | BH28: =1-(LN(1-BH$1))/$A28 -> 4.3022152566066074 | BI28: =1-(LN(1-BI$1))/$A28 -> 4.3936693773116877 | BJ28: =1-(LN(1-BJ$1))/$A28 -> 4.487439036512761 | BK28: =1-(LN(1-BK$1))/$A28 -> 4.5836445417100231 | BL28: =1-(LN(1-BL$1))/$A28 -> 4.6824158271995096 | BM28: =1-(LN(1-BM$1))/$A28 -> 4.7838935093777115 | BN28: =1-(LN(1-BN$1))/$A28 -> 4.8882300907358456 | BO28: =1-(LN(1-BO$1))/$A28 -> 4.9955913384145587 | BP28: =1-(LN(1-BP$1))/$A28 -> 5.1061578685985625 | BQ28: =1-(LN(1-BQ$1))/$A28 -> 5.2201269747717243 | BR28: =1-(LN(1-BR$1))/$A28 -> 5.3377147463072081 | BS28: =1-(LN(1-BS$1))/$A28 -> 5.4591585345405074 | BT28: =1-(LN(1-BT$1))/$A28 -> 5.5847198370430311 | BU28: =1-(LN(1-BU$1))/$A28 -> 5.7146876881958839 | BV28: =1-(LN(1-BV$1))/$A28 -> 5.8493826666065312 | BW28: =1-(LN(1-BW$1))/$A28 -> 5.9891616591355952 | BX28: =1-(LN(1-BX$1))/$A28 -> 6.1344235597033032 | BY28: =1-(LN(1-BY$1))/$A28 -> 6.2856161320005448 | BZ28: =1-(LN(1-BZ$1))/$A28 -> 6.4432443335516414 | CA28: =1-(LN(1-CA$1))/$A28 -> 6.6078804912213975 | CB28: =1-(LN(1-CB$1))/$A28 -> 6.7801768454247044 | CC28: =1-(LN(1-CC$1))/$A28 -> 6.9608811571633415 | CD28: =1-(LN(1-CD$1))/$A28 -> 7.1508563215616778 | CE28: =1-(LN(1-CE$1))/$A28 -> 7.3511052892293671 | CF28: =1-(LN(1-CF$1))/$A28 -> 7.5628031182662143 | CG28: =1-(LN(1-CG$1))/$A28 -> 7.7873387546233808 | CH28: =1-(LN(1-CH$1))/$A28 -> 8.0263703143921639 | CI28: =1-(LN(1-CI$1))/$A28 -> 8.2818994680475413 | CJ28: =1-(LN(1-CJ$1))/$A28 -> 8.5563734389872543 | CK28: =1-(LN(1-CK$1))/$A28 -> 8.8528279118522057 | CL28: =1-(LN(1-CL$1))/$A28 -> 9.1750922710730567 | CM28: =1-(LN(1-CM$1))/$A28 -> 9.5280929370150034 | CN28: =1-(LN(1-CN$1))/$A28 -> 9.9183170690810289 | CO28: =1-(LN(1-CO$1))/$A28 -> 10.354550534475045 | CP28: =1-(LN(1-CP$1))/$A28 -> 10.849111247899208 | CQ28: =1-(LN(1-CQ$1))/$A28 -> 11.420039691703874 | CR28: =1-(LN(1-CR$1))/$A28 -> 12.095304716866675 | CS28: =1-(LN(1-CS$1))/$A28 -> 12.921762314326724 | CT28: =1-(LN(1-CT$1))/$A28 -> 13.987251471555563 | CU28: =1-(LN(1-CU$1))/$A28 -> 15.488974094178435 | CV28: =1-(LN(1-CV$1))/$A28 -> 18.056185874030209
A29: =A28+0.01 -> 00.28 | B29: =1-(LN(1-B$1))/$A29 -> 1.035894056619648 | C29: =1-(LN(1-C$1))/$A29 -> 1.0721525261339981 | D29: =1-(LN(1-D$1))/$A29 -> 1.1087828838739591 | E29: =1-(LN(1-E$1))/$A29 -> 1.1457928375723399 | F29: =1-(LN(1-F$1))/$A29 -> 1.1831903370983949 | G29: =1-(LN(1-G$1))/$A29 -> 1.2209835847074555 | H29: =1-(LN(1-H$1))/$A29 -> 1.2591810458386981 | I29: =1-(LN(1-I$1))/$A29 -> 1.2977914604966108 | J29: =1-(LN(1-J$1))/$A29 -> 1.3368238552544331 | K29: =1-(LN(1-K$1))/$A29 -> 1.3762875559208081 | L29: =1-(LN(1-L$1))/$A29 -> 1.4161922009141124 | M29: =1-(LN(1-M$1))/$A29 -> 1.456547755392446 | N29: =1-(LN(1-N$1))/$A29 -> 1.4973645261910986 | O29: =1-(LN(1-O$1))/$A29 -> 1.5386531776235128 | P29: =1-(LN(1-P$1))/$A29 -> 1.5804247482063389 | Q29: =1-(LN(1-Q$1))/$A29 -> 1.6226906683742062 | R29: =1-(LN(1-R$1))/$A29 -> 1.6654627792553338 | S29: =1-(LN(1-S$1))/$A29 -> 1.7087533525851366 | T29: =1-(LN(1-T$1))/$A29 -> 1.7525751118416166 | U29: =1-(LN(1-U$1))/$A29 -> 1.7969412546936063 | V29: =1-(LN(1-V$1))/$A29 -> 1.8418654768609639 | W29: =1-(LN(1-W$1))/$A29 -> 1.8873619974946418 | X29: =1-(LN(1-X$1))/$A29 -> 1.9334455861943125 | Y29: =1-(LN(1-Y$1))/$A29 -> 1.9801315917920013 | Z29: =1-(LN(1-Z$1))/$A29 -> 2.0274359730420741 | AA29: =1-(LN(1-AA$1))/$A29 -> 2.0753753313711485 | AB29: =1-(LN(1-AB$1))/$A29 -> 2.1239669458560719 | AC29: =1-(LN(1-AC$1))/$A29 -> 2.1732288106144142 | AD29: =1-(LN(1-AD$1))/$A29 -> 2.2231796748099137 | AE29: =1-(LN(1-AE$1))/$A29 -> 2.2738390854954726 | AF29: =1-(LN(1-AF$1))/$A29 -> 2.3252274335386858 | AG29: =1-(LN(1-AG$1))/$A29 -> 2.3773660028999455 | AH29: =1-(LN(1-AH$1))/$A29 -> 2.4302770235611617 | AI29: =1-(LN(1-AI$1))/$A29 -> 2.483983728434521 | AJ29: =1-(LN(1-AJ$1))/$A29 -> 2.5385104146159083 | AK29: =1-(LN(1-AK$1))/$A29 -> 2.5938825093872122 | AL29: =1-(LN(1-AL$1))/$A29 -> 2.6501266414162812 | AM29: =1-(LN(1-AM$1))/$A29 -> 2.7072707176535711 | AN29: =1-(LN(1-AN$1))/$A29 -> 2.7653440064813579 | AO29: =1-(LN(1-AO$1))/$A29 -> 2.8243772277356811 | AP29: =1-(LN(1-AP$1))/$A29 -> 2.8844026502941862 | AQ29: =1-(LN(1-AQ$1))/$A29 -> 2.9454541980059719 | AR29: =1-(LN(1-AR$1))/$A29 -> 3.0075675648340763 | AS29: =1-(LN(1-AS$1))/$A29 -> 3.0707803401890796 | AT29: =1-(LN(1-AT$1))/$A29 -> 3.1351321455557879 | AU29: =1-(LN(1-AU$1))/$A29 -> 3.2006647836564897 | AV29: =1-(LN(1-AV$1))/$A29 -> 3.267422401557035 | AW29: =1-(LN(1-AW$1))/$A29 -> 3.3354516693095149 | AX29: =1-(LN(1-AX$1))/$A29 -> 3.4048019759420205 | AY29: =1-(LN(1-AY$1))/$A29 -> 3.4755256448569485 | AZ29: =1-(LN(1-AZ$1))/$A29 -> 3.5476781709909466 | BA29: =1-(LN(1-BA$1))/$A29 -> 3.6213184824292886 | BB29: =1-(LN(1-BB$1))/$A29 -> 3.6965092295644038 | BC29: =1-(LN(1-BC$1))/$A29 -> 3.7733171053535597 | BD29: =1-(LN(1-BD$1))/$A29 -> 3.851813200777757 | BE29: =1-(LN(1-BE$1))/$A29 -> 3.9320734002493949 | BF29: =1-(LN(1-BF$1))/$A29 -> 4.0141788224804618 | BG29: =1-(LN(1-BG$1))/$A29 -> 4.0982163132311555 | BH29: =1-(LN(1-BH$1))/$A29 -> 4.1842789974420853 | BI29: =1-(LN(1-BI$1))/$A29 -> 4.2724668995505564 | BJ29: =1-(LN(1-BJ$1))/$A29 -> 4.3628876423515912 | BK29: =1-(LN(1-BK$1))/$A29 -> 4.4556572366489506 | BL29: =1-(LN(1-BL$1))/$A29 -> 4.5509009762280979 | BM29: =1-(LN(1-BM$1))/$A29 -> 4.648754455471364 | BN29: =1-(LN(1-BN$1))/$A29 -> 4.7493647303524229 | BO29: =1-(LN(1-BO$1))/$A29 -> 4.8528916477568957 | BP29: =1-(LN(1-BP$1))/$A29 -> 4.9595093732914712 | BQ29: =1-(LN(1-BQ$1))/$A29 -> 5.0694081542441625 | BR29: =1-(LN(1-BR$1))/$A29 -> 5.1827963625105218 | BS29: =1-(LN(1-BS$1))/$A29 -> 5.2999028725926314 | BT29: =1-(LN(1-BT$1))/$A29 -> 5.4209798428629226 | BU29: =1-(LN(1-BU$1))/$A29 -> 5.5463059850460308 | BV29: =1-(LN(1-BV$1))/$A29 -> 5.6761904285134408 | BW29: =1-(LN(1-BW$1))/$A29 -> 5.8109773141664665 | BX29: =1-(LN(1-BX$1))/$A29 -> 5.9510512897138996 | BY29: =1-(LN(1-BY$1))/$A29 -> 6.0968441272862401 | BZ29: =1-(LN(1-BZ$1))/$A29 -> 6.2488427502105113 | CA29: =1-(LN(1-CA$1))/$A29 -> 6.4075990451063474 | CB29: =1-(LN(1-CB$1))/$A29 -> 6.5737419580881076 | CC29: =1-(LN(1-CC$1))/$A29 -> 6.7479925444075084 | CD29: =1-(LN(1-CD$1))/$A29 -> 6.9311828815059036 | CE29: =1-(LN(1-CE$1))/$A29 -> 7.1242801003283178 | CF29: =1-(LN(1-CF$1))/$A29 -> 7.3284172926138496 | CG29: =1-(LN(1-CG$1))/$A29 -> 7.5449337991011172 | CH29: =1-(LN(1-CH$1))/$A29 -> 7.775428517449587 | CI29: =1-(LN(1-CI$1))/$A29 -> 8.0218316299029873 | CJ29: =1-(LN(1-CJ$1))/$A29 -> 8.2865029590234229 | CK29: =1-(LN(1-CK$1))/$A29 -> 8.5723697721431975 | CL29: =1-(LN(1-CL$1))/$A29 -> 8.8831246899633047 | CM29: =1-(LN(1-CM$1))/$A29 -> 9.2235181892644675 | CN29: =1-(LN(1-CN$1))/$A29 -> 9.599805745185277 | CO29: =1-(LN(1-CO$1))/$A29 -> 10.020459443958078 | CP29: =1-(LN(1-CP$1))/$A29 -> 10.497357274759951 | CQ29: =1-(LN(1-CQ$1))/$A29 -> 11.047895417000163 | CR29: =1-(LN(1-CR$1))/$A29 -> 11.699043834121436 | CS29: =1-(LN(1-CS$1))/$A29 -> 12.495985088815056 | CT29: =1-(LN(1-CT$1))/$A29 -> 13.52342106185715 | CU29: =1-(LN(1-CU$1))/$A29 -> 14.971510733672062 | CV29: =1-(LN(1-CV$1))/$A29 -> 17.44703637852913
A30: =A29+0.01 -> 00.29 | B30: =1-(LN(1-B$1))/$A30 -> 1.0346563305293153 | C30: =1-(LN(1-C$1))/$A30 -> 1.0696645079914464 | D30: =1-(LN(1-D$1))/$A30 -> 1.1050317499472708 | E30: =1-(LN(1-E$1))/$A30 -> 1.1407654983457074 | F30: =1-(LN(1-F$1))/$A30 -> 1.1768734289225882 | G30: =1-(LN(1-G$1))/$A30 -> 1.2133634610968536 | H30: =1-(LN(1-H$1))/$A30 -> 1.2502437683959844 | I30: =1-(LN(1-I$1))/$A30 -> 1.2875227894450034 | J30: =1-(LN(1-J$1))/$A30 -> 1.3252092395560044 | K30: =1-(LN(1-K$1))/$A30 -> 1.3633121229580216 | L30: =1-(LN(1-L$1))/$A30 -> 1.4018407457101776 | M30: =1-(LN(1-M$1))/$A30 -> 1.4408047293444306 | N30: =1-(LN(1-N$1))/$A30 -> 1.4802140252879572 | O30: =1-(LN(1-O$1))/$A30 -> 1.5200789301192539 | P30: =1-(LN(1-P$1))/$A30 -> 1.5604101017164651 | Q30: =1-(LN(1-Q$1))/$A30 -> 1.6012185763613025 | R30: =1-(LN(1-R$1))/$A30 -> 1.6425157868672187 | S30: =1-(LN(1-S$1))/$A30 -> 1.6843135818063388 | T30: =1-(LN(1-T$1))/$A30 -> 1.7266242459160435 | U30: =1-(LN(1-U$1))/$A30 -> 1.7694605217731372 | V30: =1-(LN(1-V$1))/$A30 -> 1.8128356328312756 | W30: =1-(LN(1-W$1))/$A30 -> 1.856763307925861 | X30: =1-(LN(1-X$1))/$A30 -> 1.9012578073600261 | Y30: =1-(LN(1-Y$1))/$A30 -> 1.9463339506957253 | Z30: =1-(LN(1-Z$1))/$A30 -> 1.992007146385451 | AA30: =1-(LN(1-AA$1))/$A30 -> 2.0382934233928331 | AB30: =1-(LN(1-AB$1))/$A30 -> 2.0852094649644832 | AC30: =1-(LN(1-AC$1))/$A30 -> 2.1327726447311584 | AD30: =1-(LN(1-AD$1))/$A30 -> 2.1810010653337102 | AE30: =1-(LN(1-AE$1))/$A30 -> 2.2299135997887323 | AF30: =1-(LN(1-AF$1))/$A30 -> 2.279529935830455 | AG30: =1-(LN(1-AG$1))/$A30 -> 2.3298706234896023 | AH30: =1-(LN(1-AH$1))/$A30 -> 2.380957126196984 | AI30: =1-(LN(1-AI$1))/$A30 -> 2.4328118757298824 | AJ30: =1-(LN(1-AJ$1))/$A30 -> 2.4854583313532905 | AK30: =1-(LN(1-AK$1))/$A30 -> 2.5389210435462743 | AL30: =1-(LN(1-AL$1))/$A30 -> 2.5932257227467543 | AM30: =1-(LN(1-AM$1))/$A30 -> 2.6483993135965513 | AN30: =1-(LN(1-AN$1))/$A30 -> 2.7044700752233801 | AO30: =1-(LN(1-AO$1))/$A30 -> 2.761467668158589 | AP30: =1-(LN(1-AP$1))/$A30 -> 2.8194232485599038 | AQ30: =1-(LN(1-AQ$1))/$A30 -> 2.8783695704885242 | AR30: =1-(LN(1-AR$1))/$A30 -> 2.9383410970811772 | AS30: =1-(LN(1-AS$1))/$A30 -> 2.9993741215618703 | AT30: =1-(LN(1-AT$1))/$A30 -> 3.0615068991573122 | AU30: =1-(LN(1-AU$1))/$A30 -> 3.1247797911166106 | AV30: =1-(LN(1-AV$1))/$A30 -> 3.1892354221929993 | AW30: =1-(LN(1-AW$1))/$A30 -> 3.2549188531264281 | AX30: =1-(LN(1-AX$1))/$A30 -> 3.3218777698750541 | AY30: =1-(LN(1-AY$1))/$A30 -> 3.3901626915860188 | AZ30: =1-(LN(1-AZ$1))/$A30 -> 3.4598271995774654 | BA30: =1-(LN(1-BA$1))/$A30 -> 3.5309281899317266 | BB30: =1-(LN(1-BB$1))/$A30 -> 3.6035261526828726 | BC30: =1-(LN(1-BC$1))/$A30 -> 3.6776854810310233 | BD30: =1-(LN(1-BD$1))/$A30 -> 3.7534748145440413 | BE30: =1-(LN(1-BE$1))/$A30 -> 3.8309674209304503 | BF30: =1-(LN(1-BF$1))/$A30 -> 3.9102416217052736 | BG30: =1-(LN(1-BG$1))/$A30 -> 3.9913812679473222 | BH30: =1-(LN(1-BH$1))/$A30 -> 4.0744762733923583 | BI30: =1-(LN(1-BI$1))/$A30 -> 4.1596232133591577 | BJ30: =1-(LN(1-BJ$1))/$A30 -> 4.2469259995118804 | BK30: =1-(LN(1-BK$1))/$A30 -> 4.3364966422817455 | BL30: =1-(LN(1-BL$1))/$A30 -> 4.4284561149788537 | BM30: =1-(LN(1-BM$1))/$A30 -> 4.5229353363171789 | BN30: =1-(LN(1-BN$1))/$A30 -> 4.6200762913747528 | BO30: =1-(LN(1-BO$1))/$A30 -> 4.7200333150756233 | BP30: =1-(LN(1-BP$1))/$A30 -> 4.822974567315903 | BQ30: =1-(LN(1-BQ$1))/$A30 -> 4.9290837351322949 | BR30: =1-(LN(1-BR$1))/$A30 -> 5.0385620051825724 | BS30: =1-(LN(1-BS$1))/$A30 -> 5.15163035974461 | BT30: =1-(LN(1-BT$1))/$A30 -> 5.2685322620745465 | BU30: =1-(LN(1-BU$1))/$A30 -> 5.3895368131478909 | BV30: =1-(LN(1-BV$1))/$A30 -> 5.5149424827026321 | BW30: =1-(LN(1-BW$1))/$A30 -> 5.6450815447124505 | BX30: =1-(LN(1-BX$1))/$A30 -> 5.7803253831720411 | BY30: =1-(LN(1-BY$1))/$A30 -> 5.921090881517749 | BZ30: =1-(LN(1-BZ$1))/$A30 -> 6.0678481726170457 | CA30: =1-(LN(1-CA$1))/$A30 -> 6.2211301125164731 | CB30: =1-(LN(1-CB$1))/$A30 -> 6.381543959533345 | CC30: =1-(LN(1-CC$1))/$A30 -> 6.5497859049451801 | CD30: =1-(LN(1-CD$1))/$A30 -> 6.7266593338677687 | CE30: =1-(LN(1-CE$1))/$A30 -> 6.913098027903203 | CF30: =1-(LN(1-CF$1))/$A30 -> 7.1101960066616474 | CG30: =1-(LN(1-CG$1))/$A30 -> 7.3192464267183199 | CH30: =1-(LN(1-CH$1))/$A30 -> 7.541793051330635 | CI30: =1-(LN(1-CI$1))/$A30 -> 7.7796995047339177 | CJ30: =1-(LN(1-CJ$1))/$A30 -> 8.0352442362984782 | CK30: =1-(LN(1-CK$1))/$A30 -> 8.3112535731037767 | CL30: =1-(LN(1-CL$1))/$A30 -> 8.6112928041025008 | CM30: =1-(LN(1-CM$1))/$A30 -> 8.9399485965312095 | CN30: =1-(LN(1-CN$1))/$A30 -> 9.3032607194892343 | CO30: =1-(LN(1-CO$1))/$A30 -> 9.709409118304352 | CP30: =1-(LN(1-CP$1))/$A30 -> 10.169862196319951 | CQ30: =1-(LN(1-CQ$1))/$A30 -> 10.701416264689813 | CR30: =1-(LN(1-CR$1))/$A30 -> 11.33011128811725 | CS30: =1-(LN(1-CS$1))/$A30 -> 12.099571809890399 | CT30: =1-(LN(1-CT$1))/$A30 -> 13.091578956275869 | CU30: =1-(LN(1-CU$1))/$A30 -> 14.489734501476473 | CV30: =1-(LN(1-CV$1))/$A30 -> 16.879897193062607
A31: =A30+0.01 -> 00.3 | B31: =1-(LN(1-B$1))/$A31 -> 1.0335011195116715 | C31: =1-(LN(1-C$1))/$A31 -> 1.0673423577250649 | D31: =1-(LN(1-D$1))/$A31 -> 1.1015306916156953 | E31: =1-(LN(1-E$1))/$A31 -> 1.1360733150675171 | F31: =1-(LN(1-F$1))/$A31 -> 1.1709776479585019 | G31: =1-(LN(1-G$1))/$A31 -> 1.2062513457269584 | H31: =1-(LN(1-H$1))/$A31 -> 1.2419023094494515 | I31: =1-(LN(1-I$1))/$A31 -> 1.2779386964635033 | J31: =1-(LN(1-J$1))/$A31 -> 1.3143689315708043 | K31: =1-(LN(1-K$1))/$A31 -> 1.3512017188594208 | L31: =1-(LN(1-L$1))/$A31 -> 1.3884460541865049 | M31: =1-(LN(1-M$1))/$A31 -> 1.4261112383662828 | N31: =1-(LN(1-N$1))/$A31 -> 1.4642068911116921 | O31: =1-(LN(1-O$1))/$A31 -> 1.5027429657819453 | P31: =1-(LN(1-P$1))/$A31 -> 1.541729764992583 | Q31: =1-(LN(1-Q$1))/$A31 -> 1.5811779571492592 | R31: =1-(LN(1-R$1))/$A31 -> 1.6210985939716447 | S31: =1-(LN(1-S$1))/$A31 -> 1.6615031290794608 | T31: =1-(LN(1-T$1))/$A31 -> 1.7024034377188419 | U31: =1-(LN(1-U$1))/$A31 -> 1.7438118377140326 | V31: =1-(LN(1-V$1))/$A31 -> 1.7857411117368995 | W31: =1-(LN(1-W$1))/$A31 -> 1.828204530994999 | X31: =1-(LN(1-X$1))/$A31 -> 1.871215880448025 | Y31: =1-(LN(1-Y$1))/$A31 -> 1.9147894856725345 | Z31: =1-(LN(1-Z$1))/$A31 -> 1.958940241505936 | AA31: =1-(LN(1-AA$1))/$A31 -> 2.0036836426130717 | AB31: =1-(LN(1-AB$1))/$A31 -> 2.0490358161323341 | AC31: =1-(LN(1-AC$1))/$A31 -> 2.0950135565734533 | AD31: =1-(LN(1-AD$1))/$A31 -> 2.1416343631559194 | AE31: =1-(LN(1-AE$1))/$A31 -> 2.1889164797957745 | AF31: =1-(LN(1-AF$1))/$A31 -> 2.2368789379694398 | AG31: =1-(LN(1-AG$1))/$A31 -> 2.2855416027066155 | AH31: =1-(LN(1-AH$1))/$A31 -> 2.3349252219904173 | AI31: =1-(LN(1-AI$1))/$A31 -> 2.3850514798722191 | AJ31: =1-(LN(1-AJ$1))/$A31 -> 2.4359430536415143 | AK31: =1-(LN(1-AK$1))/$A31 -> 2.4876236754280647 | AL31: =1-(LN(1-AL$1))/$A31 -> 2.5401181986551959 | AM31: =1-(LN(1-AM$1))/$A31 -> 2.5934526698099996 | AN31: =1-(LN(1-AN$1))/$A31 -> 2.6476544060492673 | AO31: =1-(LN(1-AO$1))/$A31 -> 2.7027520792199695 | AP31: =1-(LN(1-AP$1))/$A31 -> 2.75877580694124 | AQ31: =1-(LN(1-AQ$1))/$A31 -> 2.81575725147224 | AR31: =1-(LN(1-AR$1))/$A31 -> 2.8737297271784712 | AS31: =1-(LN(1-AS$1))/$A31 -> 2.9327283175098078 | AT31: =1-(LN(1-AT$1))/$A31 -> 2.9927900025187348 | AU31: =1-(LN(1-AU$1))/$A31 -> 3.05395379807939 | AV31: =1-(LN(1-AV$1))/$A31 -> 3.1162609081198993 | AW31: =1-(LN(1-AW$1))/$A31 -> 3.1797548913555471 | AX31: =1-(LN(1-AX$1))/$A31 -> 3.2444818442125523 | AY31: =1-(LN(1-AY$1))/$A31 -> 3.3104906018664848 | AZ31: =1-(LN(1-AZ$1))/$A31 -> 3.3778329595915499 | BA31: =1-(LN(1-BA$1))/$A31 -> 3.4465639169340023 | BB31: =1-(LN(1-BB$1))/$A31 -> 3.5167419475934434 | BC31: =1-(LN(1-BC$1))/$A31 -> 3.5884292983299888 | BD31: =1-(LN(1-BD$1))/$A31 -> 3.6616923207259062 | BE31: =1-(LN(1-BE$1))/$A31 -> 3.7366018402327685 | BF31: =1-(LN(1-BF$1))/$A31 -> 3.8132335676484312 | BG31: =1-(LN(1-BG$1))/$A31 -> 3.8916685590157449 | BH31: =1-(LN(1-BH$1))/$A31 -> 3.9719937309459468 | BI31: =1-(LN(1-BI$1))/$A31 -> 4.0543024395805185 | BJ31: =1-(LN(1-BJ$1))/$A31 -> 4.1386951328614847 | BK31: =1-(LN(1-BK$1))/$A31 -> 4.2252800875390211 | BL31: =1-(LN(1-BL$1))/$A31 -> 4.3141742444795579 | BM31: =1-(LN(1-BM$1))/$A31 -> 4.4055041584399399 | BN31: =1-(LN(1-BN$1))/$A31 -> 4.4994070816622607 | BO31: =1-(LN(1-BO$1))/$A31 -> 4.5960322045731026 | BP31: =1-(LN(1-BP$1))/$A31 -> 4.6955420817387061 | BQ31: =1-(LN(1-BQ$1))/$A31 -> 4.7981142772945518 | BR31: =1-(LN(1-BR$1))/$A31 -> 4.9039432716764866 | BS31: =1-(LN(1-BS$1))/$A31 -> 5.0132426810864557 | BT31: =1-(LN(1-BT$1))/$A31 -> 5.1262478533387279 | BU31: =1-(LN(1-BU$1))/$A31 -> 5.2432189193762948 | BV31: =1-(LN(1-BV$1))/$A31 -> 5.364444399945878 | BW31: =1-(LN(1-BW$1))/$A31 -> 5.4902454932220355 | BX31: =1-(LN(1-BX$1))/$A31 -> 5.6209812037329732 | BY31: =1-(LN(1-BY$1))/$A31 -> 5.7570545188004907 | BZ31: =1-(LN(1-BZ$1))/$A31 -> 5.8989199001964776 | CA31: =1-(LN(1-CA$1))/$A31 -> 6.0470924420992578 | CB31: =1-(LN(1-CB$1))/$A31 -> 6.2021591608822337 | CC31: =1-(LN(1-CC$1))/$A31 -> 6.3647930414470073 | CD31: =1-(LN(1-CD$1))/$A31 -> 6.5357706894055099 | CE31: =1-(LN(1-CE$1))/$A31 -> 6.7159947603064296 | CF31: =1-(LN(1-CF$1))/$A31 -> 6.9065228064395923 | CG31: =1-(LN(1-CG$1))/$A31 -> 7.1086048791610423 | CH31: =1-(LN(1-CH$1))/$A31 -> 7.3237332829529471 | CI31: =1-(LN(1-CI$1))/$A31 -> 7.5537095212427872 | CJ31: =1-(LN(1-CJ$1))/$A31 -> 7.8007360950885278 | CK31: =1-(LN(1-CK$1))/$A31 -> 8.0675451206669848 | CL31: =1-(LN(1-CL$1))/$A31 -> 8.3575830439657501 | CM31: =1-(LN(1-CM$1))/$A31 -> 8.6752836433135023 | CN31: =1-(LN(1-CN$1))/$A31 -> 9.0264853621729255 | CO31: =1-(LN(1-CO$1))/$A31 -> 9.41909548102754 | CP31: =1-(LN(1-CP$1))/$A31 -> 9.8642001231092866 | CQ31: =1-(LN(1-CQ$1))/$A31 -> 10.378035722533486 | CR31: =1-(LN(1-CR$1))/$A31 -> 10.985774245180007 | CS31: =1-(LN(1-CS$1))/$A31 -> 11.729586082894052 | CT31: =1-(LN(1-CT$1))/$A31 -> 12.688526324400007 | CU31: =1-(LN(1-CU$1))/$A31 -> 14.04007668476059 | CV31: =1-(LN(1-CV$1))/$A31 -> 16.350567286627186
A32: =A31+0.01 -> 00.31 | B32: =1-(LN(1-B$1))/$A32 -> 1.0324204382371014 | C32: =1-(LN(1-C$1))/$A32 -> 1.0651700236049015 | D32: =1-(LN(1-D$1))/$A32 -> 1.098255508015189 | E32: =1-(LN(1-E$1))/$A32 -> 1.1316838532911457 | F32: =1-(LN(1-F$1))/$A32 -> 1.1654622399598404 | G32: =1-(LN(1-G$1))/$A32 -> 1.1995980765099596 | H32: =1-(LN(1-H$1))/$A32 -> 1.2340990091446304 | I32: =1-(LN(1-I$1))/$A32 -> 1.2689729320614549 | J32: =1-(LN(1-J$1))/$A32 -> 1.3042279982943266 | K32: =1-(LN(1-K$1))/$A32 -> 1.3398726311542781 | L32: =1-(LN(1-L$1))/$A32 -> 1.3759155363095208 | M32: =1-(LN(1-M$1))/$A32 -> 1.4123657145480157 | N32: =1-(LN(1-N$1))/$A32 -> 1.4492324752693793 | O32: =1-(LN(1-O$1))/$A32 -> 1.4865254507567214 | P32: =1-(LN(1-P$1))/$A32 -> 1.5242546112831448 | Q32: =1-(LN(1-Q$1))/$A32 -> 1.5624302811121864 | R32: =1-(LN(1-R$1))/$A32 -> 1.6010631554564303 | S32: =1-(LN(1-S$1))/$A32 -> 1.6401643184639942 | T32: =1-(LN(1-T$1))/$A32 -> 1.6797452623085567 | U32: =1-(LN(1-U$1))/$A32 -> 1.7198179074651927 | V32: =1-(LN(1-V$1))/$A32 -> 1.7603946242615156 | W32: =1-(LN(1-W$1))/$A32 -> 1.8014882558016119 | X32: =1-(LN(1-X$1))/$A32 -> 1.8431121423690566 | Y32: =1-(LN(1-Y$1))/$A32 -> 1.8852801474250334 | Z32: =1-(LN(1-Z$1))/$A32 -> 1.9280066853283251 | AA32: =1-(LN(1-AA$1))/$A32 -> 1.9713067509158759 | AB32: =1-(LN(1-AB$1))/$A32 -> 2.0151959510958068 | AC32: =1-(LN(1-AC$1))/$A32 -> 2.0596905386194706 | AD32: =1-(LN(1-AD$1))/$A32 -> 2.1048074482154062 | AE32: =1-(LN(1-AE$1))/$A32 -> 2.1505643352862336 | AF32: =1-(LN(1-AF$1))/$A32 -> 2.1969796173897804 | AG32: =1-(LN(1-AG$1))/$A32 -> 2.2440725187483377 | AH32: =1-(LN(1-AH$1))/$A32 -> 2.2918631180552431 | AI32: =1-(LN(1-AI$1))/$A32 -> 2.3403723998763413 | AJ32: =1-(LN(1-AJ$1))/$A32 -> 2.3896223099756586 | AK32: =1-(LN(1-AK$1))/$A32 -> 2.4396358149303854 | AL32: =1-(LN(1-AL$1))/$A32 -> 2.4904369664405119 | AM32: =1-(LN(1-AM$1))/$A32 -> 2.5420509707838708 | AN32: =1-(LN(1-AN$1))/$A32 -> 2.5945042639186457 | AO32: =1-(LN(1-AO$1))/$A32 -> 2.6478245927935187 | AP32: =1-(LN(1-AP$1))/$A32 -> 2.7020411034915224 | AQ32: =1-(LN(1-AQ$1))/$A32 -> 2.7571844369086196 | AR32: =1-(LN(1-AR$1))/$A32 -> 2.8132868327533593 | AS32: =1-(LN(1-AS$1))/$A32 -> 2.8703822427514267 | AT32: =1-(LN(1-AT$1))/$A32 -> 2.9285064540503889 | AU32: =1-(LN(1-AU$1))/$A32 -> 2.987697223947797 | AV32: =1-(LN(1-AV$1))/$A32 -> 3.0479944272128057 | AW32: =1-(LN(1-AW$1))/$A32 -> 3.1094402174408522 | AX32: =1-(LN(1-AX$1))/$A32 -> 3.1720792040766637 | AY32: =1-(LN(1-AY$1))/$A32 -> 3.2359586469675663 | AZ32: =1-(LN(1-AZ$1))/$A32 -> 3.3011286705724676 | BA32: =1-(LN(1-BA$1))/$A32 -> 3.3676425002587118 | BB32: =1-(LN(1-BB$1))/$A32 -> 3.4355567234775259 | BC32: =1-(LN(1-BC$1))/$A32 -> 3.5049315790290216 | BD32: =1-(LN(1-BD$1))/$A32 -> 3.5758312781218446 | BE32: =1-(LN(1-BE$1))/$A32 -> 3.648324361515582 | BF32: =1-(LN(1-BF$1))/$A32 -> 3.7224840977242883 | BG32: =1-(LN(1-BG$1))/$A32 -> 3.7983889280797531 | BH32: =1-(LN(1-BH$1))/$A32 -> 3.8761229654315614 | BI32: =1-(LN(1-BI$1))/$A32 -> 3.9557765544327599 | BJ32: =1-(LN(1-BJ$1))/$A32 -> 4.0374469027691786 | BK32: =1-(LN(1-BK$1))/$A32 -> 4.1212387943926005 | BL32: =1-(LN(1-BL$1))/$A32 -> 4.2072653978834431 | BM32: =1-(LN(1-BM$1))/$A32 -> 4.2956491855870382 | BN32: =1-(LN(1-BN$1))/$A32 -> 4.3865229822538012 | BO32: =1-(LN(1-BO$1))/$A32 -> 4.4800311657159053 | BP32: =1-(LN(1-BP$1))/$A32 -> 4.5763310468439098 | BQ32: =1-(LN(1-BQ$1))/$A32 -> 4.675594461897953 | BR32: =1-(LN(1-BR$1))/$A32 -> 4.7780096177514384 | BS32: =1-(LN(1-BS$1))/$A32 -> 4.8837832397610867 | BT32: =1-(LN(1-BT$1))/$A32 -> 4.9931430838761877 | BU32: =1-(LN(1-BU$1))/$A32 -> 5.1063408897189948 | BV32: =1-(LN(1-BV$1))/$A32 -> 5.2236558709153655 | BW32: =1-(LN(1-BW$1))/$A32 -> 5.3453988644084207 | BX32: =1-(LN(1-BX$1))/$A32 -> 5.4719172939351353 | BY32: =1-(LN(1-BY$1))/$A32 -> 5.6036011472262812 | BZ32: =1-(LN(1-BZ$1))/$A32 -> 5.7408902259965906 | CA32: =1-(LN(1-CA$1))/$A32 -> 5.8842830084831519 | CB32: =1-(LN(1-CB$1))/$A32 -> 6.034347575047323 | CC32: =1-(LN(1-CC$1))/$A32 -> 6.1917352014003297 | CD32: =1-(LN(1-CD$1))/$A32 -> 6.3571974413601708 | CE32: =1-(LN(1-CE$1))/$A32 -> 6.5316078325546094 | CF32: =1-(LN(1-CF$1))/$A32 -> 6.7159898126834765 | CG32: =1-(LN(1-CG$1))/$A32 -> 6.9115531088655251 | CH32: =1-(LN(1-CH$1))/$A32 -> 7.1197418867286588 | CI32: =1-(LN(1-CI$1))/$A32 -> 7.3422995366865678 | CJ32: =1-(LN(1-CJ$1))/$A32 -> 7.5813575113759946 | CK32: =1-(LN(1-CK$1))/$A32 -> 7.8395597941938551 | CL32: =1-(LN(1-CL$1))/$A32 -> 8.1202416554507266 | CM32: =1-(LN(1-CM$1))/$A32 -> 8.4276938483679054 | CN32: =1-(LN(1-CN$1))/$A32 -> 8.7675664795221859 | CO32: =1-(LN(1-CO$1))/$A32 -> 9.1475117558331025 | CP32: =1-(LN(1-CP$1))/$A32 -> 9.5782581836541478 | CQ32: =1-(LN(1-CQ$1))/$A32 -> 10.075518441161437 | CR32: =1-(LN(1-CR$1))/$A32 -> 10.663652495335491 | CS32: =1-(LN(1-CS$1))/$A32 -> 11.383470402800695 | CT32: =1-(LN(1-CT$1))/$A32 -> 12.311477088129038 | CU32: =1-(LN(1-CU$1))/$A32 -> 13.619429049768312 | CV32: =1-(LN(1-CV$1))/$A32 -> 15.855387696735987
A33: =A32+0.01 -> 00.32 | B33: =1-(LN(1-B$1))/$A33 -> 1.0314072995421921 | C33: =1-(LN(1-C$1))/$A33 -> 1.0631334603672482 | D33: =1-(LN(1-D$1))/$A33 -> 1.0951850233897142 | E33: =1-(LN(1-E$1))/$A33 -> 1.1275687328757973 | F33: =1-(LN(1-F$1))/$A33 -> 1.1602915449610955 | G33: =1-(LN(1-G$1))/$A33 -> 1.1933606366190235 | H33: =1-(LN(1-H$1))/$A33 -> 1.2267834151088608 | I33: =1-(LN(1-I$1))/$A33 -> 1.2605675279345343 | J33: =1-(LN(1-J$1))/$A33 -> 1.294720873347629 | K33: =1-(LN(1-K$1))/$A33 -> 1.3292516114307071 | L33: =1-(LN(1-L$1))/$A33 -> 1.3641681757998483 | M33: =1-(LN(1-M$1))/$A33 -> 1.3994792859683902 | N33: =1-(LN(1-N$1))/$A33 -> 1.4351939604172113 | O33: =1-(LN(1-O$1))/$A33 -> 1.4713215304205738 | P33: =1-(LN(1-P$1))/$A33 -> 1.5078716546805464 | Q33: =1-(LN(1-Q$1))/$A33 -> 1.5448543348274304 | R33: =1-(LN(1-R$1))/$A33 -> 1.5822799318484169 | S33: =1-(LN(1-S$1))/$A33 -> 1.6201591835119946 | T33: =1-(LN(1-T$1))/$A33 -> 1.6585032228614143 | U33: =1-(LN(1-U$1))/$A33 -> 1.6973235978569057 | V33: =1-(LN(1-V$1))/$A33 -> 1.7366322922533435 | W33: =1-(LN(1-W$1))/$A33 -> 1.7764417478078114 | X33: =1-(LN(1-X$1))/$A33 -> 1.8167648879200236 | Y33: =1-(LN(1-Y$1))/$A33 -> 1.857615142818001 | Z33: =1-(LN(1-Z$1))/$A33 -> 1.8990064764118149 | AA33: =1-(LN(1-AA$1))/$A33 -> 1.9409534149497547 | AB33: =1-(LN(1-AB$1))/$A33 -> 1.9834710776240629 | AC33: =1-(LN(1-AC$1))/$A33 -> 2.0265752092876124 | AD33: =1-(LN(1-AD$1))/$A33 -> 2.0702822154586746 | AE33: =1-(LN(1-AE$1))/$A33 -> 2.1146091998085383 | AF33: =1-(LN(1-AF$1))/$A33 -> 2.1595740043463501 | AG33: =1-(LN(1-AG$1))/$A33 -> 2.2051952525374521 | AH33: =1-(LN(1-AH$1))/$A33 -> 2.2514923956160162 | AI33: =1-(LN(1-AI$1))/$A33 -> 2.2984857623802055 | AJ33: =1-(LN(1-AJ$1))/$A33 -> 2.3461966127889196 | AK33: =1-(LN(1-AK$1))/$A33 -> 2.3946471957138109 | AL33: =1-(LN(1-AL$1))/$A33 -> 2.4438608112392459 | AM33: =1-(LN(1-AM$1))/$A33 -> 2.4938618779468742 | AN33: =1-(LN(1-AN$1))/$A33 -> 2.5446760056711879 | AO33: =1-(LN(1-AO$1))/$A33 -> 2.596330074268721 | AP33: =1-(LN(1-AP$1))/$A33 -> 2.6488523190074122 | AQ33: =1-(LN(1-AQ$1))/$A33 -> 2.7022724232552253 | AR33: =1-(LN(1-AR$1))/$A33 -> 2.7566216192298167 | AS33: =1-(LN(1-AS$1))/$A33 -> 2.8119327976654445 | AT33: =1-(LN(1-AT$1))/$A33 -> 2.8682406273613141 | AU33: =1-(LN(1-AU$1))/$A33 -> 2.9255816856994281 | AV33: =1-(LN(1-AV$1))/$A33 -> 2.9839946013624052 | AW33: =1-(LN(1-AW$1))/$A33 -> 3.0435202106458252 | AX33: =1-(LN(1-AX$1))/$A33 -> 3.1042017289492678 | AY33: =1-(LN(1-AY$1))/$A33 -> 3.1660849392498296 | AZ33: =1-(LN(1-AZ$1))/$A33 -> 3.229218399617078 | BA33: =1-(LN(1-BA$1))/$A33 -> 3.2936536721256271 | BB33: =1-(LN(1-BB$1))/$A33 -> 3.3594455758688531 | BC33: =1-(LN(1-BC$1))/$A33 -> 3.4266524671843648 | BD33: =1-(LN(1-BD$1))/$A33 -> 3.4953365506805372 | BE33: =1-(LN(1-BE$1))/$A33 -> 3.5655642252182203 | BF33: =1-(LN(1-BF$1))/$A33 -> 3.6374064696704043 | BG33: =1-(LN(1-BG$1))/$A33 -> 3.7109392740772607 | BH33: =1-(LN(1-BH$1))/$A33 -> 3.7862441227618251 | BI33: =1-(LN(1-BI$1))/$A33 -> 3.8634085371067362 | BJ33: =1-(LN(1-BJ$1))/$A33 -> 3.9425266870576419 | BK33: =1-(LN(1-BK$1))/$A33 -> 4.0237000820678315 | BL33: =1-(LN(1-BL$1))/$A33 -> 4.1070383541995863 | BM33: =1-(LN(1-BM$1))/$A33 -> 4.1926601485374437 | BN33: =1-(LN(1-BN$1))/$A33 -> 4.2806941390583697 | BO33: =1-(LN(1-BO$1))/$A33 -> 4.3712801917872834 | BP33: =1-(LN(1-BP$1))/$A33 -> 4.4645707016300369 | BQ33: =1-(LN(1-BQ$1))/$A33 -> 4.5607321349636418 | BR33: =1-(LN(1-BR$1))/$A33 -> 4.6599468171967064 | BS33: =1-(LN(1-BS$1))/$A33 -> 4.7624150135185523 | BT33: =1-(LN(1-BT$1))/$A33 -> 4.8683573625050567 | BU33: =1-(LN(1-BU$1))/$A33 -> 4.9780177369152767 | BV33: =1-(LN(1-BV$1))/$A33 -> 5.0916666249492604 | BW33: =1-(LN(1-BW$1))/$A33 -> 5.2096051498956575 | BX33: =1-(LN(1-BX$1))/$A33 -> 5.3321698784996618 | BY33: =1-(LN(1-BY$1))/$A33 -> 5.4597386113754593 | BZ33: =1-(LN(1-BZ$1))/$A33 -> 5.592737406434197 | CA33: =1-(LN(1-CA$1))/$A33 -> 5.7316491644680534 | CB33: =1-(LN(1-CB$1))/$A33 -> 5.8770242133270933 | CC33: =1-(LN(1-CC$1))/$A33 -> 6.0294934763565688 | CD33: =1-(LN(1-CD$1))/$A33 -> 6.1897850213176655 | CE33: =1-(LN(1-CE$1))/$A33 -> 6.3587450877872778 | CF33: =1-(LN(1-CF$1))/$A33 -> 6.5373651310371175 | CG33: =1-(LN(1-CG$1))/$A33 -> 6.7268170742134767 | CH33: =1-(LN(1-CH$1))/$A33 -> 6.9284999527683881 | CI33: =1-(LN(1-CI$1))/$A33 -> 7.1441026761651125 | CJ33: =1-(LN(1-CJ$1))/$A33 -> 7.3756900891454951 | CK33: =1-(LN(1-CK$1))/$A33 -> 7.6258235506252969 | CL33: =1-(LN(1-CL$1))/$A33 -> 7.897734103717891 | CM33: =1-(LN(1-CM$1))/$A33 -> 8.1955784156064091 | CN33: =1-(LN(1-CN$1))/$A33 -> 8.5248300270371171 | CO33: =1-(LN(1-CO$1))/$A33 -> 8.892902013463317 | CP33: =1-(LN(1-CP$1))/$A33 -> 9.3101876154149554 | CQ33: =1-(LN(1-CQ$1))/$A33 -> 9.7919084898751425 | CR33: =1-(LN(1-CR$1))/$A33 -> 10.361663354856256 | CS33: =1-(LN(1-CS$1))/$A33 -> 11.058986952713173 | CT33: =1-(LN(1-CT$1))/$A33 -> 11.957993429125006 | CU33: =1-(LN(1-CU$1))/$A33 -> 13.225071891963053 | CV33: =1-(LN(1-CV$1))/$A33 -> 15.391156831212987
A34: =A33+0.01 -> 00.33 | B34: =1-(LN(1-B$1))/$A34 -> 1.0304555631924286 | C34: =1-(LN(1-C$1))/$A34 -> 1.0612203252046044 | D34: =1-(LN(1-D$1))/$A34 -> 1.0923006287415411 | E34: =1-(LN(1-E$1))/$A34 -> 1.1237030136977428 | F34: =1-(LN(1-F$1))/$A34 -> 1.1554342254168199 | G34: =1-(LN(1-G$1))/$A34 -> 1.1875012233881439 | H34: =1-(LN(1-H$1))/$A34 -> 1.2199111904085924 | I34: =1-(LN(1-I$1))/$A34 -> 1.2526715422395485 | J34: =1-(LN(1-J$1))/$A34 -> 1.2857899377916402 | K34: =1-(LN(1-K$1))/$A34 -> 1.3192742898722007 | L34: =1-(LN(1-L$1))/$A34 -> 1.3531327765331862 | M34: =1-(LN(1-M$1))/$A34 -> 1.3873738530602571 | N34: =1-(LN(1-N$1))/$A34 -> 1.4220062646469929 | O34: =1-(LN(1-O$1))/$A34 -> 1.4570390598017684 | P34: =1-(LN(1-P$1))/$A34 -> 1.4924816045387117 | Q34: =1-(LN(1-Q$1))/$A34 -> 1.5283435974084174 | R34: =1-(LN(1-R$1))/$A34 -> 1.5646350854287681 | S34: =1-(LN(1-S$1))/$A34 -> 1.6013664809813279 | T34: =1-(LN(1-T$1))/$A34 -> 1.6385485797444019 | U34: =1-(LN(1-U$1))/$A34 -> 1.6761925797400297 | V34: =1-(LN(1-V$1))/$A34 -> 1.7143101015789997 | W34: =1-(LN(1-W$1))/$A34 -> 1.7529132099954534 | X34: =1-(LN(1-X$1))/$A34 -> 1.7920144367709319 | Y34: =1-(LN(1-Y$1))/$A34 -> 1.8316268051568494 | Z34: =1-(LN(1-Z$1))/$A34 -> 1.8717638559144874 | AA34: =1-(LN(1-AA$1))/$A34 -> 1.9124396751027923 | AB34: =1-(LN(1-AB$1))/$A34 -> 1.9536689237566671 | AC34: =1-(LN(1-AC$1))/$A34 -> 1.9954668696122302 | AD34: =1-(LN(1-AD$1))/$A34 -> 2.037849421050836 | AE34: =1-(LN(1-AE$1))/$A34 -> 2.0808331634507038 | AF34: =1-(LN(1-AF$1))/$A34 -> 2.124435398154036 | AG34: =1-(LN(1-AG$1))/$A34 -> 2.1686741842787414 | AH34: =1-(LN(1-AH$1))/$A34 -> 2.2135683836276523 | AI34: =1-(LN(1-AI$1))/$A34 -> 2.2591377089747446 | AJ34: =1-(LN(1-AJ$1))/$A34 -> 2.3054027760377398 | AK34: =1-(LN(1-AK$1))/$A34 -> 2.3523851594800593 | AL34: =1-(LN(1-AL$1))/$A34 -> 2.4001074533229048 | AM34: =1-(LN(1-AM$1))/$A34 -> 2.4485933361909087 | AN34: =1-(LN(1-AN$1))/$A34 -> 2.4978676418629702 | AO34: =1-(LN(1-AO$1))/$A34 -> 2.5479564356545175 | AP34: =1-(LN(1-AP$1))/$A34 -> 2.5988870972193094 | AQ34: =1-(LN(1-AQ$1))/$A34 -> 2.6506884104293094 | AR34: =1-(LN(1-AR$1))/$A34 -> 2.7033906610713374 | AS34: =1-(LN(1-AS$1))/$A34 -> 2.7570257431907343 | AT34: =1-(LN(1-AT$1))/$A34 -> 2.8116272750170319 | AU34: =1-(LN(1-AU$1))/$A34 -> 2.8672307255267184 | AV34: =1-(LN(1-AV$1))/$A34 -> 2.9238735528362718 | AW34: =1-(LN(1-AW$1))/$A34 -> 2.9815953557777704 | AX34: =1-(LN(1-AX$1))/$A34 -> 3.0404380401932296 | AY34: =1-(LN(1-AY$1))/$A34 -> 3.1004460016968043 | AZ34: =1-(LN(1-AZ$1))/$A34 -> 3.1616663269014089 | BA34: =1-(LN(1-BA$1))/$A34 -> 3.2241490153945476 | BB34: =1-(LN(1-BB$1))/$A34 -> 3.2879472250849484 | BC34: =1-(LN(1-BC$1))/$A34 -> 3.3531175439363534 | BD34: =1-(LN(1-BD$1))/$A34 -> 3.4197202915690057 | BE34: =1-(LN(1-BE$1))/$A34 -> 3.487819854757062 | BF34: =1-(LN(1-BF$1))/$A34 -> 3.5574850614985736 | BG34: =1-(LN(1-BG$1))/$A34 -> 3.6287895991052226 | BH34: =1-(LN(1-BH$1))/$A34 -> 3.7018124826781333 | BI34: =1-(LN(1-BI$1))/$A34 -> 3.7766385814368348 | BJ34: =1-(LN(1-BJ$1))/$A34 -> 3.8533592116922586 | BK34: =1-(LN(1-BK$1))/$A34 -> 3.9320728068536548 | BL34: =1-(LN(1-BL$1))/$A34 -> 4.0128856767995984 | BM34: =1-(LN(1-BM$1))/$A34 -> 4.0959128713090358 | BN34: =1-(LN(1-BN$1))/$A34 -> 4.1812791651475099 | BO34: =1-(LN(1-BO$1))/$A34 -> 4.269120185975547 | BP34: =1-(LN(1-BP$1))/$A34 -> 4.3595837106715507 | BQ34: =1-(LN(1-BQ$1))/$A34 -> 4.4528311611768654 | BR34: =1-(LN(1-BR$1))/$A34 -> 4.5490393378877148 | BS34: =1-(LN(1-BS$1))/$A34 -> 4.648402437351324 | BT34: =1-(LN(1-BT$1))/$A34 -> 4.7511344121261159 | BU34: =1-(LN(1-BU$1))/$A34 -> 4.8574717448875404 | BV34: =1-(LN(1-BV$1))/$A34 -> 4.9676767272235249 | BW34: =1-(LN(1-BW$1))/$A34 -> 5.0820413574745773 | BX34: =1-(LN(1-BX$1))/$A34 -> 5.2008920033936112 | BY34: =1-(LN(1-BY$1))/$A34 -> 5.3245950170913545 | BZ34: =1-(LN(1-BZ$1))/$A34 -> 5.4535635456331608 | CA34: =1-(LN(1-CA$1))/$A34 -> 5.5882658564538703 | CB34: =1-(LN(1-CB$1))/$A34 -> 5.7292356008020304 | CC34: =1-(LN(1-CC$1))/$A34 -> 5.8770845831336427 | CD34: =1-(LN(1-CD$1))/$A34 -> 6.0325188085504635 | CE34: =1-(LN(1-CE$1))/$A34 -> 6.1963588730058454 | CF34: =1-(LN(1-CF$1))/$A34 -> 6.3695661876723566 | CG34: =1-(LN(1-CG$1))/$A34 -> 6.553277162873675 | CH34: =1-(LN(1-CH$1))/$A34 -> 6.7488484390481336 | CI34: =1-(LN(1-CI$1))/$A34 -> 6.9579177465843518 | CJ34: =1-(LN(1-CJ$1))/$A34 -> 7.1824873591713887 | CK34: =1-(LN(1-CK$1))/$A34 -> 7.4250410187881668 | CL34: =1-(LN(1-CL$1))/$A34 -> 7.6887118581506826 | CM34: =1-(LN(1-CM$1))/$A34 -> 7.9775305848304567 | CN34: =1-(LN(1-CN$1))/$A34 -> 8.2968048747026586 | CO34: =1-(LN(1-CO$1))/$A34 -> 8.65372316457049 | CP34: =1-(LN(1-CP$1))/$A34 -> 9.0583637482811685 | CQ34: =1-(LN(1-CQ$1))/$A34 -> 9.5254870204849862 | CR34: =1-(LN(1-CR$1))/$A34 -> 10.07797658652728 | CS34: =1-(LN(1-CS$1))/$A34 -> 10.754169166267319 | CT34: =1-(LN(1-CT$1))/$A34 -> 11.625933022181824 | CU34: =1-(LN(1-CU$1))/$A34 -> 12.854615167964173 | CV34: =1-(LN(1-CV$1))/$A34 -> 14.955061169661079
A35: =A34+0.01 -> 00.34 | B35: =1-(LN(1-B$1))/$A35 -> 1.0295598113338278 | C35: =1-(LN(1-C$1))/$A35 -> 1.059419727404469 | D35: =1-(LN(1-D$1))/$A35 -> 1.0895859043667899 | E35: =1-(LN(1-E$1))/$A35 -> 1.1200646897654563 | F35: =1-(LN(1-F$1))/$A35 -> 1.1508626305516192 | G35: =1-(LN(1-G$1))/$A35 -> 1.1819864815237868 | H35: =1-(LN(1-H$1))/$A35 -> 1.2134432142201044 | I35: =1-(LN(1-I$1))/$A35 -> 1.2452400262913264 | J35: =1-(LN(1-J$1))/$A35 -> 1.2773843513860037 | K35: =1-(LN(1-K$1))/$A35 -> 1.3098838695818418 | L35: =1-(LN(1-L$1))/$A35 -> 1.3427465183998573 | M35: =1-(LN(1-M$1))/$A35 -> 1.3759805044408377 | N35: =1-(LN(1-N$1))/$A35 -> 1.4095943156867872 | O35: =1-(LN(1-O$1))/$A35 -> 1.4435967345134813 | P35: =1-(LN(1-P$1))/$A35 -> 1.4779968514640438 | Q35: =1-(LN(1-Q$1))/$A35 -> 1.5128040798375815 | R35: =1-(LN(1-R$1))/$A35 -> 1.5480281711514512 | S35: =1-(LN(1-S$1))/$A35 -> 1.5836792315407007 | T35: =1-(LN(1-T$1))/$A35 -> 1.619767739163684 | U35: =1-(LN(1-U$1))/$A35 -> 1.6563045626888522 | V35: =1-(LN(1-V$1))/$A35 -> 1.6933009809443231 | W35: =1-(LN(1-W$1))/$A35 -> 1.7307687038191166 | X35: =1-(LN(1-X$1))/$A35 -> 1.7687198945129632 | Y35: =1-(LN(1-Y$1))/$A35 -> 1.8071671932404714 | Z35: =1-(LN(1-Z$1))/$A35 -> 1.8461237425052377 | AA35: =1-(LN(1-AA$1))/$A35 -> 1.8856032140703574 | AB35: =1-(LN(1-AB$1))/$A35 -> 1.9256198377638238 | AC35: =1-(LN(1-AC$1))/$A35 -> 1.9661884322706942 | AD35: =1-(LN(1-AD$1))/$A35 -> 2.0073244380787525 | AE35: =1-(LN(1-AE$1))/$A35 -> 2.0490439527609774 | AF35: =1-(LN(1-AF$1))/$A35 -> 2.0913637687965645 | AG35: =1-(LN(1-AG$1))/$A35 -> 2.1343014141528958 | AH35: =1-(LN(1-AH$1))/$A35 -> 2.1778751958738978 | AI35: =1-(LN(1-AI$1))/$A35 -> 2.2221042469460759 | AJ35: =1-(LN(1-AJ$1))/$A35 -> 2.2670085767425121 | AK35: =1-(LN(1-AK$1))/$A35 -> 2.3126091253777044 | AL35: =1-(LN(1-AL$1))/$A35 -> 2.3589278223428196 | AM35: =1-(LN(1-AM$1))/$A35 -> 2.4059876498323525 | AN35: =1-(LN(1-AN$1))/$A35 -> 2.4538127112199417 | AO35: =1-(LN(1-AO$1))/$A35 -> 2.5024283051940905 | AP35: =1-(LN(1-AP$1))/$A35 -> 2.5518610061246236 | AQ35: =1-(LN(1-AQ$1))/$A35 -> 2.6021387512990355 | AR35: =1-(LN(1-AR$1))/$A35 -> 2.6532909357457095 | AS35: =1-(LN(1-AS$1))/$A35 -> 2.7053485154498302 | AT35: =1-(LN(1-AT$1))/$A35 -> 2.7583441198694718 | AU35: =1-(LN(1-AU$1))/$A35 -> 2.8123121747759328 | AV35: =1-(LN(1-AV$1))/$A35 -> 2.8672890365763815 | AW35: =1-(LN(1-AW$1))/$A35 -> 2.9233131394313649 | AX35: =1-(LN(1-AX$1))/$A35 -> 2.9804251566581343 | AY35: =1-(LN(1-AY$1))/$A35 -> 3.0386681781174865 | AZ35: =1-(LN(1-AZ$1))/$A35 -> 3.0980879055219557 | BA35: =1-(LN(1-BA$1))/$A35 -> 3.1587328678829434 | BB35: =1-(LN(1-BB$1))/$A35 -> 3.2206546596412733 | BC35: =1-(LN(1-BC$1))/$A35 -> 3.2839082044088137 | BD35: =1-(LN(1-BD$1))/$A35 -> 3.3485520476993291 | BE35: =1-(LN(1-BE$1))/$A35 -> 3.4146486825583247 | BF35: =1-(LN(1-BF$1))/$A35 -> 3.4822649126309684 | BG35: =1-(LN(1-BG$1))/$A35 -> 3.5514722579550688 | BH35: =1-(LN(1-BH$1))/$A35 -> 3.6223474096581882 | BI35: =1-(LN(1-BI$1))/$A35 -> 3.6949727408063398 | BJ35: =1-(LN(1-BJ$1))/$A35 -> 3.769436881936604 | BK35: =1-(LN(1-BK$1))/$A35 -> 3.8458353713579592 | BL35: =1-(LN(1-BL$1))/$A35 -> 3.9242713921878454 | BM35: =1-(LN(1-BM$1))/$A35 -> 4.004856610388182 | BN35: =1-(LN(1-BN$1))/$A35 -> 4.0877121308784652 | BO35: =1-(LN(1-BO$1))/$A35 -> 4.172969592270384 | BP35: =1-(LN(1-BP$1))/$A35 -> 4.2607724250635641 | BQ35: =1-(LN(1-BQ$1))/$A35 -> 4.351277303495193 | BR35: =1-(LN(1-BR$1))/$A35 -> 4.4446558279498412 | BS35: =1-(LN(1-BS$1))/$A35 -> 4.5410964833115788 | BT35: =1-(LN(1-BT$1))/$A35 -> 4.6408069294165237 | BU35: =1-(LN(1-BU$1))/$A35 -> 4.7440166935673194 | BV35: =1-(LN(1-BV$1))/$A35 -> 4.850980352893421 | BW35: =1-(LN(1-BW$1))/$A35 -> 4.9619813175488545 | BX35: =1-(LN(1-BX$1))/$A35 -> 5.0773363562349756 | BY35: =1-(LN(1-BY$1))/$A35 -> 5.1974010460004321 | BZ35: =1-(LN(1-BZ$1))/$A35 -> 5.3225763825263028 | CA35: =1-(LN(1-CA$1))/$A35 -> 5.4533168606758151 | CB35: =1-(LN(1-CB$1))/$A35 -> 5.5901404360725584 | CC35: =1-(LN(1-CC$1))/$A35 -> 5.7336409189238298 | CD35: =1-(LN(1-CD$1))/$A35 -> 5.8845035494754496 | CE35: =1-(LN(1-CE$1))/$A35 -> 6.0435247885056729 | CF35: =1-(LN(1-CF$1))/$A35 -> 6.2116377703878749 | CG35: =1-(LN(1-CG$1))/$A35 -> 6.3899454816126839 | CH35: =1-(LN(1-CH$1))/$A35 -> 6.5797646614290706 | CI35: =1-(LN(1-CI$1))/$A35 -> 6.7826848716848112 | CJ35: =1-(LN(1-CJ$1))/$A35 -> 7.0006494956663481 | CK35: =1-(LN(1-CK$1))/$A35 -> 7.2360692241179265 | CL35: =1-(LN(1-CL$1))/$A35 -> 7.4919850387933096 | CM35: =1-(LN(1-CM$1))/$A35 -> 7.772309097041326 | CN35: =1-(LN(1-CN$1))/$A35 -> 8.0821929666231682 | CO35: =1-(LN(1-CO$1))/$A35 -> 8.428613659730182 | CP35: =1-(LN(1-CP$1))/$A35 -> 8.8213530498023118 | CQ35: =1-(LN(1-CQ$1))/$A35 -> 9.2747374022354272 | CR35: =1-(LN(1-CR$1))/$A35 -> 9.8109772751588302 | CS35: =1-(LN(1-CS$1))/$A35 -> 10.467281837847692 | CT35: =1-(LN(1-CT$1))/$A35 -> 11.313405580352946 | CU35: =1-(LN(1-CU$1))/$A35 -> 12.505950015965226 | CV35: =1-(LN(1-CV$1))/$A35 -> 14.54461819408281
A36: =A35+0.01 -> 00.35 | B36: =1-(LN(1-B$1))/$A36 -> 1.0287152452957185 | C36: =1-(LN(1-C$1))/$A36 -> 1.0577220209071985 | D36: =1-(LN(1-D$1))/$A36 -> 1.0870263070991673 | E36: =1-(LN(1-E$1))/$A36 -> 1.116634270057872 | F36: =1-(LN(1-F$1))/$A36 -> 1.1465522696787158 | G36: =1-(LN(1-G$1))/$A36 -> 1.1767868677659643 | H36: =1-(LN(1-H$1))/$A36 -> 1.2073448366709585 | I36: =1-(LN(1-I$1))/$A36 -> 1.2382331683972885 | J36: =1-(LN(1-J$1))/$A36 -> 1.2694590842035465 | K36: =1-(LN(1-K$1))/$A36 -> 1.3010300447366463 | L36: =1-(LN(1-L$1))/$A36 -> 1.3329537607312898 | M36: =1-(LN(1-M$1))/$A36 -> 1.3652382043139566 | N36: =1-(LN(1-N$1))/$A36 -> 1.3978916209528789 | O36: =1-(LN(1-O$1))/$A36 -> 1.4309225420988103 | P36: =1-(LN(1-P$1))/$A36 -> 1.464339798565071 | Q36: =1-(LN(1-Q$1))/$A36 -> 1.4981525346993649 | R36: =1-(LN(1-R$1))/$A36 -> 1.5323702234042669 | S36: =1-(LN(1-S$1))/$A36 -> 1.5670026820681091 | T36: =1-(LN(1-T$1))/$A36 -> 1.602060089473293 | U36: =1-(LN(1-U$1))/$A36 -> 1.6375530037548849 | V36: =1-(LN(1-V$1))/$A36 -> 1.6734923814887712 | W36: =1-(LN(1-W$1))/$A36 -> 1.7098895979957134 | X36: =1-(LN(1-X$1))/$A36 -> 1.74675646895545 | Y36: =1-(LN(1-Y$1))/$A36 -> 1.7841052734336009 | Z36: =1-(LN(1-Z$1))/$A36 -> 1.8219487784336594 | AA36: =1-(LN(1-AA$1))/$A36 -> 1.8603002650969187 | AB36: =1-(LN(1-AB$1))/$A36 -> 1.8991735566848575 | AC36: =1-(LN(1-AC$1))/$A36 -> 1.9385830484915312 | AD36: =1-(LN(1-AD$1))/$A36 -> 1.9785437398479311 | AE36: =1-(LN(1-AE$1))/$A36 -> 2.0190712683963783 | AF36: =1-(LN(1-AF$1))/$A36 -> 2.0601819468309484 | AG36: =1-(LN(1-AG$1))/$A36 -> 2.1018928023199561 | AH36: =1-(LN(1-AH$1))/$A36 -> 2.1442216188489294 | AI36: =1-(LN(1-AI$1))/$A36 -> 2.1871869827476162 | AJ36: =1-(LN(1-AJ$1))/$A36 -> 2.2308083316927263 | AK36: =1-(LN(1-AK$1))/$A36 -> 2.2751060075097698 | AL36: =1-(LN(1-AL$1))/$A36 -> 2.3201013131330246 | AM36: =1-(LN(1-AM$1))/$A36 -> 2.3658165741228565 | AN36: =1-(LN(1-AN$1))/$A36 -> 2.412275205185086 | AO36: =1-(LN(1-AO$1))/$A36 -> 2.459501782188545 | AP36: =1-(LN(1-AP$1))/$A36 -> 2.5075221202353486 | AQ36: =1-(LN(1-AQ$1))/$A36 -> 2.5563633584047771 | AR36: =1-(LN(1-AR$1))/$A36 -> 2.606054051867261 | AS36: =1-(LN(1-AS$1))/$A36 -> 2.6566242721512636 | AT36: =1-(LN(1-AT$1))/$A36 -> 2.7081057164446301 | AU36: =1-(LN(1-AU$1))/$A36 -> 2.7605318269251917 | AV36: =1-(LN(1-AV$1))/$A36 -> 2.8139379212456275 | AW36: =1-(LN(1-AW$1))/$A36 -> 2.8683613354476121 | AX36: =1-(LN(1-AX$1))/$A36 -> 2.9238415807536162 | AY36: =1-(LN(1-AY$1))/$A36 -> 2.9804205158855583 | AZ36: =1-(LN(1-AZ$1))/$A36 -> 3.038142536792757 | BA36: =1-(LN(1-BA$1))/$A36 -> 3.0970547859434303 | BB36: =1-(LN(1-BB$1))/$A36 -> 3.1572073836515226 | BC36: =1-(LN(1-BC$1))/$A36 -> 3.2186536842828475 | BD36: =1-(LN(1-BD$1))/$A36 -> 3.2814505606222051 | BE36: =1-(LN(1-BE$1))/$A36 -> 3.3456587201995154 | BF36: =1-(LN(1-BF$1))/$A36 -> 3.4113430579843693 | BG36: =1-(LN(1-BG$1))/$A36 -> 3.4785730505849237 | BH36: =1-(LN(1-BH$1))/$A36 -> 3.5474231979536683 | BI36: =1-(LN(1-BI$1))/$A36 -> 3.6179735196404441 | BJ36: =1-(LN(1-BJ$1))/$A36 -> 3.6903101138812726 | BK36: =1-(LN(1-BK$1))/$A36 -> 3.7645257893191602 | BL36: =1-(LN(1-BL$1))/$A36 -> 3.8407207809824784 | BM36: =1-(LN(1-BM$1))/$A36 -> 3.9190035643770913 | BN36: =1-(LN(1-BN$1))/$A36 -> 3.999491784281938 | BO36: =1-(LN(1-BO$1))/$A36 -> 4.0823133182055162 | BP36: =1-(LN(1-BP$1))/$A36 -> 4.1676074986331759 | BQ36: =1-(LN(1-BQ$1))/$A36 -> 4.2555265233953303 | BR36: =1-(LN(1-BR$1))/$A36 -> 4.3462370900084171 | BS36: =1-(LN(1-BS$1))/$A36 -> 4.4399222980741051 | BT36: =1-(LN(1-BT$1))/$A36 -> 4.5367838742903377 | BU36: =1-(LN(1-BU$1))/$A36 -> 4.6370447880368237 | BV36: =1-(LN(1-BV$1))/$A36 -> 4.7409523428107523 | BW36: =1-(LN(1-BW$1))/$A36 -> 4.8487818513331726 | BX36: =1-(LN(1-BX$1))/$A36 -> 4.9608410317711193 | BY36: =1-(LN(1-BY$1))/$A36 -> 5.0774753018289918 | BZ36: =1-(LN(1-BZ$1))/$A36 -> 5.1990742001684085 | CA36: =1-(LN(1-CA$1))/$A36 -> 5.3260792360850777 | CB36: =1-(LN(1-CB$1))/$A36 -> 5.4589935664704852 | CC36: =1-(LN(1-CC$1))/$A36 -> 5.598394035526006 | CD36: =1-(LN(1-CD$1))/$A36 -> 5.7449463052047225 | CE36: =1-(LN(1-CE$1))/$A36 -> 5.8994240802626541 | CF36: =1-(LN(1-CF$1))/$A36 -> 6.0627338340910786 | CG36: =1-(LN(1-CG$1))/$A36 -> 6.2359470392808927 | CH36: =1-(LN(1-CH$1))/$A36 -> 6.4203428139596683 | CI36: =1-(LN(1-CI$1))/$A36 -> 6.6174653039223887 | CJ36: =1-(LN(1-CJ$1))/$A36 -> 6.8292023672187376 | CK36: =1-(LN(1-CK$1))/$A36 -> 7.0578958177145568 | CL36: =1-(LN(1-CL$1))/$A36 -> 7.3064997519706436 | CM36: =1-(LN(1-CM$1))/$A36 -> 7.5788145514115737 | CN36: =1-(LN(1-CN$1))/$A36 -> 7.8798445961482217 | CO36: =1-(LN(1-CO$1))/$A36 -> 8.2163675551664621 | CP36: =1-(LN(1-CP$1))/$A36 -> 8.59788581980796 | CQ36: =1-(LN(1-CQ$1))/$A36 -> 9.0383163336001306 | CR36: =1-(LN(1-CR$1))/$A36 -> 9.5592350672971484 | CS36: =1-(LN(1-CS$1))/$A36 -> 10.196788071052044 | CT36: =1-(LN(1-CT$1))/$A36 -> 11.01873684948572 | CU36: =1-(LN(1-CU$1))/$A36 -> 12.177208586937647 | CV36: =1-(LN(1-CV$1))/$A36 -> 14.157629102823302
A37: =A36+0.01 -> 00.36 | B37: =1-(LN(1-B$1))/$A37 -> 1.0279175995930596 | C37: =1-(LN(1-C$1))/$A37 -> 1.0561186314375541 | D37: =1-(LN(1-D$1))/$A37 -> 1.084608909679746 | E37: =1-(LN(1-E$1))/$A37 -> 1.113394429222931 | F37: =1-(LN(1-F$1))/$A37 -> 1.1424813732987515 | G37: =1-(LN(1-G$1))/$A37 -> 1.171876121439132 | H37: =1-(LN(1-H$1))/$A37 -> 1.201585257874543 | I37: =1-(LN(1-I$1))/$A37 -> 1.2316155803862527 | J37: =1-(LN(1-J$1))/$A37 -> 1.2619741096423369 | K37: =1-(LN(1-K$1))/$A37 -> 1.2926680990495174 | L37: =1-(LN(1-L$1))/$A37 -> 1.3237050451554206 | M37: =1-(LN(1-M$1))/$A37 -> 1.355092698638569 | N37: =1-(LN(1-N$1))/$A37 -> 1.38683907592641 | O37: =1-(LN(1-O$1))/$A37 -> 1.4189524714849544 | P37: =1-(LN(1-P$1))/$A37 -> 1.4514414708271524 | Q37: =1-(LN(1-Q$1))/$A37 -> 1.4843149642910491 | R37: =1-(LN(1-R$1))/$A37 -> 1.5175821616430372 | S37: =1-(LN(1-S$1))/$A37 -> 1.5512526075662172 | T37: =1-(LN(1-T$1))/$A37 -> 1.5853361980990348 | U37: =1-(LN(1-U$1))/$A37 -> 1.619843198095027 | V37: =1-(LN(1-V$1))/$A37 -> 1.6547842597807496 | W37: =1-(LN(1-W$1))/$A37 -> 1.6901704424958324 | X37: =1-(LN(1-X$1))/$A37 -> 1.7260132337066876 | Y37: =1-(LN(1-Y$1))/$A37 -> 1.7623245713937785 | Z37: =1-(LN(1-Z$1))/$A37 -> 1.7991168679216134 | AA37: =1-(LN(1-AA$1))/$A37 -> 1.8364030355108931 | AB37: =1-(LN(1-AB$1))/$A37 -> 1.8741965134436114 | AC37: =1-(LN(1-AC$1))/$A37 -> 1.9125112971445444 | AD37: =1-(LN(1-AD$1))/$A37 -> 1.9513619692965998 | AE37: =1-(LN(1-AE$1))/$A37 -> 1.9907637331631451 | AF37: =1-(LN(1-AF$1))/$A37 -> 2.0307324483078664 | AG37: =1-(LN(1-AG$1))/$A37 -> 2.0712846689221793 | AH37: =1-(LN(1-AH$1))/$A37 -> 2.1124376849920146 | AI37: =1-(LN(1-AI$1))/$A37 -> 2.1542095665601826 | AJ37: =1-(LN(1-AJ$1))/$A37 -> 2.1966192113679286 | AK37: =1-(LN(1-AK$1))/$A37 -> 2.2396863961900539 | AL37: =1-(LN(1-AL$1))/$A37 -> 2.283431832212663 | AM37: =1-(LN(1-AM$1))/$A37 -> 2.3278772248416661 | AN37: =1-(LN(1-AN$1))/$A37 -> 2.3730453383743892 | AO37: =1-(LN(1-AO$1))/$A37 -> 2.4189600660166408 | AP37: =1-(LN(1-AP$1))/$A37 -> 2.4656465057843668 | AQ37: =1-(LN(1-AQ$1))/$A37 -> 2.5131310428935336 | AR37: =1-(LN(1-AR$1))/$A37 -> 2.5614414393153924 | AS37: =1-(LN(1-AS$1))/$A37 -> 2.610606931258173 | AT37: =1-(LN(1-AT$1))/$A37 -> 2.660658335432279 | AU37: =1-(LN(1-AU$1))/$A37 -> 2.7116281650661582 | AV37: =1-(LN(1-AV$1))/$A37 -> 2.7635507567665822 | AW37: =1-(LN(1-AW$1))/$A37 -> 2.8164624094629556 | AX37: =1-(LN(1-AX$1))/$A37 -> 2.8704015368437936 | AY37: =1-(LN(1-AY$1))/$A37 -> 2.9254088348887373 | AZ37: =1-(LN(1-AZ$1))/$A37 -> 2.9815274663262912 | BA37: =1-(LN(1-BA$1))/$A37 -> 3.0388032641116687 | BB37: =1-(LN(1-BB$1))/$A37 -> 3.0972849563278695 | BC37: =1-(LN(1-BC$1))/$A37 -> 3.1570244152749907 | BD37: =1-(LN(1-BD$1))/$A37 -> 3.2180769339382551 | BE37: =1-(LN(1-BE$1))/$A37 -> 3.2805015335273069 | BF37: =1-(LN(1-BF$1))/$A37 -> 3.3443613063736923 | BG37: =1-(LN(1-BG$1))/$A37 -> 3.4097237991797873 | BH37: =1-(LN(1-BH$1))/$A37 -> 3.4766614424549553 | BI37: =1-(LN(1-BI$1))/$A37 -> 3.5452520329837651 | BJ37: =1-(LN(1-BJ$1))/$A37 -> 3.6155792773845703 | BK37: =1-(LN(1-BK$1))/$A37 -> 3.6877334062825167 | BL37: =1-(LN(1-BL$1))/$A37 -> 3.7618118703996317 | BM37: =1-(LN(1-BM$1))/$A37 -> 3.837920132033283 | BN37: =1-(LN(1-BN$1))/$A37 -> 3.9161725680518842 | BO37: =1-(LN(1-BO$1))/$A37 -> 3.9966935038109184 | BP37: =1-(LN(1-BP$1))/$A37 -> 4.0796184014489221 | BQ37: =1-(LN(1-BQ$1))/$A37 -> 4.1650952310787925 | BR37: =1-(LN(1-BR$1))/$A37 -> 4.2532860597304047 | BS37: =1-(LN(1-BS$1))/$A37 -> 4.3443689009053799 | BT37: =1-(LN(1-BT$1))/$A37 -> 4.4385398777822731 | BU37: =1-(LN(1-BU$1))/$A37 -> 4.536015766146912 | BV37: =1-(LN(1-BV$1))/$A37 -> 4.6370369999548977 | BW37: =1-(LN(1-BW$1))/$A37 -> 4.7418712443516959 | BX37: =1-(LN(1-BX$1))/$A37 -> 4.8508176697774772 | BY37: =1-(LN(1-BY$1))/$A37 -> 4.9642120990004077 | BZ37: =1-(LN(1-BZ$1))/$A37 -> 5.0824332501637306 | CA37: =1-(LN(1-CA$1))/$A37 -> 5.2059103684160473 | CB37: =1-(LN(1-CB$1))/$A37 -> 5.3351326340685272 | CC37: =1-(LN(1-CC$1))/$A37 -> 5.4706608678725059 | CD37: =1-(LN(1-CD$1))/$A37 -> 5.6131422411712579 | CE37: =1-(LN(1-CE$1))/$A37 -> 5.7633289669220247 | CF37: =1-(LN(1-CF$1))/$A37 -> 5.9221023386996601 | CG37: =1-(LN(1-CG$1))/$A37 -> 6.0905040659675347 | CH37: =1-(LN(1-CH$1))/$A37 -> 6.269777735794122 | CI37: =1-(LN(1-CI$1))/$A37 -> 6.4614246010356551 | CJ37: =1-(LN(1-CJ$1))/$A37 -> 6.6672800792404399 | CK37: =1-(LN(1-CK$1))/$A37 -> 6.8896209338891525 | CL37: =1-(LN(1-CL$1))/$A37 -> 7.1313192033047921 | CM37: =1-(LN(1-CM$1))/$A37 -> 7.3960697027612516 | CN37: =1-(LN(1-CN$1))/$A37 -> 7.6887378018107704 | CO37: =1-(LN(1-CO$1))/$A37 -> 8.0159129008562822 | CP37: =1-(LN(1-CP$1))/$A37 -> 8.3868334359244052 | CQ37: =1-(LN(1-CQ$1))/$A37 -> 8.8150297687779045 | CR37: =1-(LN(1-CR$1))/$A37 -> 9.3214785376500053 | CS37: =1-(LN(1-CS$1))/$A37 -> 9.9413217357450421 | CT37: =1-(LN(1-CT$1))/$A37 -> 10.740438603666671 | CU37: =1-(LN(1-CU$1))/$A37 -> 11.866730570633825 | CV37: =1-(LN(1-CV$1))/$A37 -> 13.792139405522654
A38: =A37+0.01 -> 00.37 | B38: =1-(LN(1-B$1))/$A38 -> 1.0271630698743281 | C38: =1-(LN(1-C$1))/$A38 -> 1.0546019116689715 | D38: =1-(LN(1-D$1))/$A38 -> 1.0823221823911042 | E38: =1-(LN(1-E$1))/$A38 -> 1.1103297149196085 | F38: =1-(LN(1-F$1))/$A38 -> 1.1386305253717584 | G38: =1-(LN(1-G$1))/$A38 -> 1.167230820859696 | H38: =1-(LN(1-H$1))/$A38 -> 1.1961370076617175 | I38: =1-(LN(1-I$1))/$A38 -> 1.2253556998352728 | J38: =1-(LN(1-J$1))/$A38 -> 1.254893728300652 | K38: =1-(LN(1-K$1))/$A38 -> 1.2847581504265575 | L38: =1-(LN(1-L$1))/$A38 -> 1.3149562601512201 | M38: =1-(LN(1-M$1))/$A38 -> 1.3454955986753645 | N38: =1-(LN(1-N$1))/$A38 -> 1.3763839657662367 | O38: =1-(LN(1-O$1))/$A38 -> 1.4076294317150908 | P38: =1-(LN(1-P$1))/$A38 -> 1.4392403499939861 | Q38: =1-(LN(1-Q$1))/$A38 -> 1.4712253706615614 | R38: =1-(LN(1-R$1))/$A38 -> 1.5035934545716039 | S38: =1-(LN(1-S$1))/$A38 -> 1.5363538884428061 | T38: =1-(LN(1-T$1))/$A38 -> 1.569516300853115 | U38: =1-(LN(1-U$1))/$A38 -> 1.6030906792275941 | V38: =1-(LN(1-V$1))/$A38 -> 1.6370873878947836 | W38: =1-(LN(1-W$1))/$A38 -> 1.6715171872932424 | X38: =1-(LN(1-X$1))/$A38 -> 1.7063912544173174 | Y38: =1-(LN(1-Y$1))/$A38 -> 1.7417212045993522 | Z38: =1-(LN(1-Z$1))/$A38 -> 1.7775191147345426 | AA38: =1-(LN(1-AA$1))/$A38 -> 1.8137975480646527 | AB38: =1-(LN(1-AB$1))/$A38 -> 1.8505695806478382 | AC38: =1-(LN(1-AC$1))/$A38 -> 1.8878488296541511 | AD38: =1-(LN(1-AD$1))/$A38 -> 1.9256494836399347 | AE38: =1-(LN(1-AE$1))/$A38 -> 1.9639863349695468 | AF38: =1-(LN(1-AF$1))/$A38 -> 2.0028748145698159 | AG38: =1-(LN(1-AG$1))/$A38 -> 2.0423310292215797 | AH38: =1-(LN(1-AH$1))/$A38 -> 2.0823718016138519 | AI38: =1-(LN(1-AI$1))/$A38 -> 2.1230147134099076 | AJ38: =1-(LN(1-AJ$1))/$A38 -> 2.1642781516012275 | AK38: =1-(LN(1-AK$1))/$A38 -> 2.2061813584551877 | AL38: =1-(LN(1-AL$1))/$A38 -> 2.2487444853961045 | AM38: =1-(LN(1-AM$1))/$A38 -> 2.2919886511972969 | AN38: =1-(LN(1-AN$1))/$A38 -> 2.335936004904811 | AO38: =1-(LN(1-AO$1))/$A38 -> 2.3806097939621371 | AP38: =1-(LN(1-AP$1))/$A38 -> 2.4260344380604648 | AQ38: =1-(LN(1-AQ$1))/$A38 -> 2.4722356093018165 | AR38: =1-(LN(1-AR$1))/$A38 -> 2.5192403193338953 | AS38: =1-(LN(1-AS$1))/$A38 -> 2.5670770141971411 | AT38: =1-(LN(1-AT$1))/$A38 -> 2.6157756777178931 | AU38: =1-(LN(1-AU$1))/$A38 -> 2.6653679443886946 | AV38: =1-(LN(1-AV$1))/$A38 -> 2.715887222799918 | AW38: =1-(LN(1-AW$1))/$A38 -> 2.767368830828822 | AX38: =1-(LN(1-AX$1))/$A38 -> 2.8198501439561232 | AY38: =1-(LN(1-AY$1))/$A38 -> 2.8733707582701227 | AZ38: =1-(LN(1-AZ$1))/$A38 -> 2.9279726699390944 | BA38: =1-(LN(1-BA$1))/$A38 -> 2.9837004731897316 | BB38: =1-(LN(1-BB$1))/$A38 -> 3.0406015791298189 | BC38: =1-(LN(1-BC$1))/$A38 -> 3.0987264581053964 | BD38: =1-(LN(1-BD$1))/$A38 -> 3.1581289086966806 | BE38: =1-(LN(1-BE$1))/$A38 -> 3.2188663569454876 | BF38: =1-(LN(1-BF$1))/$A38 -> 3.2810001899852144 | BG38: =1-(LN(1-BG$1))/$A38 -> 3.3445961289316846 | BH38: =1-(LN(1-BH$1))/$A38 -> 3.4097246467129296 | BI38: =1-(LN(1-BI$1))/$A38 -> 3.4764614374977176 | BJ38: =1-(LN(1-BJ$1))/$A38 -> 3.5448879455633655 | BK38: =1-(LN(1-BK$1))/$A38 -> 3.6150919628694758 | BL38: =1-(LN(1-BL$1))/$A38 -> 3.6871683063347764 | BM38: =1-(LN(1-BM$1))/$A38 -> 3.7612195879242756 | BN38: =1-(LN(1-BN$1))/$A38 -> 3.837357093239671 | BO38: =1-(LN(1-BO$1))/$A38 -> 3.9157017874917046 | BP38: =1-(LN(1-BP$1))/$A38 -> 3.9963854716800316 | BQ38: =1-(LN(1-BQ$1))/$A38 -> 4.0795521167253117 | BR38: =1-(LN(1-BR$1))/$A38 -> 4.1653594094674213 | BS38: =1-(LN(1-BS$1))/$A38 -> 4.253980552232262 | BT38: =1-(LN(1-BT$1))/$A38 -> 4.345606367571941 | BU38: =1-(LN(1-BU$1))/$A38 -> 4.440447772467266 | BV38: =1-(LN(1-BV$1))/$A38 -> 4.5387387026588195 | BW38: =1-(LN(1-BW$1))/$A38 -> 4.6407395890989473 | BX38: =1-(LN(1-BX$1))/$A38 -> 4.746741516540248 | BY38: =1-(LN(1-BY$1))/$A38 -> 4.857071231459857 | BZ38: =1-(LN(1-BZ$1))/$A38 -> 4.9720972163755217 | CA38: =1-(LN(1-CA$1))/$A38 -> 5.0922371152156138 | CB38: =1-(LN(1-CB$1))/$A38 -> 5.2179668872018103 | CC38: =1-(LN(1-CC$1))/$A38 -> 5.349832195767843 | CD38: =1-(LN(1-CD$1))/$A38 -> 5.4884627211396024 | CE38: =1-(LN(1-CE$1))/$A38 -> 5.6345903461944022 | CF38: =1-(LN(1-CF$1))/$A38 -> 5.7890725457618313 | CG38: =1-(LN(1-CG$1))/$A38 -> 5.9529228749954388 | CH38: =1-(LN(1-CH$1))/$A38 -> 6.1273513105023891 | CI38: =1-(LN(1-CI$1))/$A38 -> 6.313818530737394 | CJ38: =1-(LN(1-CJ$1))/$A38 -> 6.5141103473690762 | CK38: =1-(LN(1-CK$1))/$A38 -> 6.7304419897299868 | CL38: =1-(LN(1-CL$1))/$A38 -> 6.9656078734857436 | CM38: =1-(LN(1-CM$1))/$A38 -> 7.2232029540379745 | CN38: =1-(LN(1-CN$1))/$A38 -> 7.5079611044645338 | CO38: =1-(LN(1-CO$1))/$A38 -> 7.8262936332655721 | CP38: =1-(LN(1-CP$1))/$A38 -> 8.1871892890075291 | CQ38: =1-(LN(1-CQ$1))/$A38 -> 8.6038127480001236 | CR38: =1-(LN(1-CR$1))/$A38 -> 9.0965737123081141 | CS38: =1-(LN(1-CS$1))/$A38 -> 9.6996643915357161 | CT38: =1-(LN(1-CT$1))/$A38 -> 10.477183506270274 | CU38: =1-(LN(1-CU$1))/$A38 -> 11.573035149805882 | CV38: =1-(LN(1-CV$1))/$A38 -> 13.446405908076096
A39: =A38+0.01 -> 00.38 | B39: =1-(LN(1-B$1))/$A39 -> 1.0264482522460565 | C39: =1-(LN(1-C$1))/$A39 -> 1.0531650192566302 | D39: =1-(LN(1-D$1))/$A39 -> 1.0801558091702856 | E39: =1-(LN(1-E$1))/$A39 -> 1.1074263013690926 | F39: =1-(LN(1-F$1))/$A39 -> 1.1349823536514489 | G39: =1-(LN(1-G$1))/$A39 -> 1.1628300097844408 | H39: =1-(LN(1-H$1))/$A39 -> 1.1909755074600934 | I39: =1-(LN(1-I$1))/$A39 -> 1.219425286681713 | J39: =1-(LN(1-J$1))/$A39 -> 1.2481859986085295 | K39: =1-(LN(1-K$1))/$A39 -> 1.2772645148890165 | L39: =1-(LN(1-L$1))/$A39 -> 1.3066679375156618 | M39: =1-(LN(1-M$1))/$A39 -> 1.336403609236539 | N39: =1-(LN(1-N$1))/$A39 -> 1.3664791245618622 | O39: =1-(LN(1-O$1))/$A39 -> 1.3969023414067989 | P39: =1-(LN(1-P$1))/$A39 -> 1.4276813934151971 | Q39: =1-(LN(1-Q$1))/$A39 -> 1.4588247030125729 | R39: =1-(LN(1-R$1))/$A39 -> 1.4903409952407722 | S39: =1-(LN(1-S$1))/$A39 -> 1.5222393124311533 | T39: =1-(LN(1-T$1))/$A39 -> 1.554529029778033 | U39: =1-(LN(1-U$1))/$A39 -> 1.5872198718794994 | V39: =1-(LN(1-V$1))/$A39 -> 1.6203219303186049 | W39: =1-(LN(1-W$1))/$A39 -> 1.6538456823644727 | X39: =1-(LN(1-X$1))/$A39 -> 1.6878020108800198 | Y39: =1-(LN(1-Y$1))/$A39 -> 1.7222022255309481 | Z39: =1-(LN(1-Z$1))/$A39 -> 1.7570580853994231 | AA39: =1-(LN(1-AA$1))/$A39 -> 1.7923818231155828 | AB39: =1-(LN(1-AB$1))/$A39 -> 1.8281861706307896 | AC39: =1-(LN(1-AC$1))/$A39 -> 1.8644843867685157 | AD39: =1-(LN(1-AD$1))/$A39 -> 1.9012902867020416 | AE39: =1-(LN(1-AE$1))/$A39 -> 1.9386182735229798 | AF39: =1-(LN(1-AF$1))/$A39 -> 1.9764833720811366 | AG39: =1-(LN(1-AG$1))/$A39 -> 2.0149012652946965 | AH39: =1-(LN(1-AH$1))/$A39 -> 2.0538883331503293 | AI39: =1-(LN(1-AI$1))/$A39 -> 2.0934616946359625 | AJ39: =1-(LN(1-AJ$1))/$A39 -> 2.1336392528748798 | AK39: =1-(LN(1-AK$1))/$A39 -> 2.1744397437589988 | AL39: =1-(LN(1-AL$1))/$A39 -> 2.2158827884119967 | AM39: =1-(LN(1-AM$1))/$A39 -> 2.2579889498499996 | AN39: =1-(LN(1-AN$1))/$A39 -> 2.3007797942494213 | AO39: =1-(LN(1-AO$1))/$A39 -> 2.3442779572789227 | AP39: =1-(LN(1-AP$1))/$A39 -> 2.3885072160062419 | AQ39: =1-(LN(1-AQ$1))/$A39 -> 2.4334925669517684 | AR39: =1-(LN(1-AR$1))/$A39 -> 2.4792603109303717 | AS39: =1-(LN(1-AS$1))/$A39 -> 2.5258381454024796 | AT39: =1-(LN(1-AT$1))/$A39 -> 2.5732552651463694 | AU39: =1-(LN(1-AU$1))/$A39 -> 2.6215424721679392 | AV39: =1-(LN(1-AV$1))/$A39 -> 2.6707322958841306 | AW39: =1-(LN(1-AW$1))/$A39 -> 2.7208591247543792 | AX39: =1-(LN(1-AX$1))/$A39 -> 2.7719593506941202 | AY39: =1-(LN(1-AY$1))/$A39 -> 2.82407152778933 | AZ39: =1-(LN(1-AZ$1))/$A39 -> 2.8772365470459604 | BA39: =1-(LN(1-BA$1))/$A39 -> 2.9314978291584231 | BB39: =1-(LN(1-BB$1))/$A39 -> 2.9869015375737709 | BC39: =1-(LN(1-BC$1))/$A39 -> 3.0434968144710437 | BD39: =1-(LN(1-BD$1))/$A39 -> 3.1013360426783469 | BE39: =1-(LN(1-BE$1))/$A39 -> 3.1604751370258697 | BF39: =1-(LN(1-BF$1))/$A39 -> 3.2209738691961296 | BG39: =1-(LN(1-BG$1))/$A39 -> 3.2828962308019034 | BH39: =1-(LN(1-BH$1))/$A39 -> 3.3463108402204838 | BI39: =1-(LN(1-BI$1))/$A39 -> 3.4112913996688303 | BJ39: =1-(LN(1-BJ$1))/$A39 -> 3.4779172101538034 | BK39: =1-(LN(1-BK$1))/$A39 -> 3.5462737533202788 | BL39: =1-(LN(1-BL$1))/$A39 -> 3.6164533509049139 | BM39: =1-(LN(1-BM$1))/$A39 -> 3.6885559145578468 | BN39: =1-(LN(1-BN$1))/$A39 -> 3.7626898013123111 | BO39: =1-(LN(1-BO$1))/$A39 -> 3.8389727930840278 | BP39: =1-(LN(1-BP$1))/$A39 -> 3.9175332224252939 | BQ39: =1-(LN(1-BQ$1))/$A39 -> 3.9985112715483302 | BR39: =1-(LN(1-BR$1))/$A39 -> 4.082060477639331 | BS39: =1-(LN(1-BS$1))/$A39 -> 4.168349485068255 | BT39: =1-(LN(1-BT$1))/$A39 -> 4.2575640947411006 | BU39: =1-(LN(1-BU$1))/$A39 -> 4.3499096731918119 | BV39: =1-(LN(1-BV$1))/$A39 -> 4.4456139999572715 | BW39: =1-(LN(1-BW$1))/$A39 -> 4.5449306525437114 | BX39: =1-(LN(1-BX$1))/$A39 -> 4.6481430555786627 | BY39: =1-(LN(1-BY$1))/$A39 -> 4.7555693569477553 | BZ39: =1-(LN(1-BZ$1))/$A39 -> 4.8675683422603768 | CA39: =1-(LN(1-CA$1))/$A39 -> 4.9845466648152028 | CB39: =1-(LN(1-CB$1))/$A39 -> 5.1069677585912361 | CC39: =1-(LN(1-CC$1))/$A39 -> 5.235362927458163 | CD39: =1-(LN(1-CD$1))/$A39 -> 5.3703452811096124 | CE39: =1-(LN(1-CE$1))/$A39 -> 5.5126274423471813 | CF39: =1-(LN(1-CF$1))/$A39 -> 5.6630443208733618 | CG39: =1-(LN(1-CG$1))/$A39 -> 5.8225827993376642 | CH39: =1-(LN(1-CH$1))/$A39 -> 5.9924210128575899 | CI39: =1-(LN(1-CI$1))/$A39 -> 6.1739812009811468 | CJ39: =1-(LN(1-CJ$1))/$A39 -> 6.3690021803330481 | CK39: =1-(LN(1-CK$1))/$A39 -> 6.579640884737092 | CL39: =1-(LN(1-CL$1))/$A39 -> 6.8086181926045395 | CM39: =1-(LN(1-CM$1))/$A39 -> 7.0594344552475015 | CN39: =1-(LN(1-CN$1))/$A39 -> 7.3366989701365197 | CO39: =1-(LN(1-CO$1))/$A39 -> 7.6466543271270044 | CP39: =1-(LN(1-CP$1))/$A39 -> 7.9980527287704888 | CQ39: =1-(LN(1-CQ$1))/$A39 -> 8.4037124125264349 | CR39: =1-(LN(1-CR$1))/$A39 -> 8.8835059830368479 | CS39: =1-(LN(1-CS$1))/$A39 -> 9.4707258549163562 | CT39: =1-(LN(1-CT$1))/$A39 -> 10.227783940315794 | CU39: =1-(LN(1-CU$1))/$A39 -> 11.294797382705728 | CV39: =1-(LN(1-CV$1))/$A39 -> 13.118868910495147
A40: =A39+0.01 -> 00.39 | B40: =1-(LN(1-B$1))/$A40 -> 1.0257700919320549 | C40: =1-(LN(1-C$1))/$A40 -> 1.0518018136346652 | D40: =1-(LN(1-D$1))/$A40 -> 1.0781005320120731 | E40: =1-(LN(1-E$1))/$A40 -> 1.104671780821167 | F40: =1-(LN(1-F$1))/$A40 -> 1.1315212676603861 | G40: =1-(LN(1-G$1))/$A40 -> 1.1586548813284294 | H40: =1-(LN(1-H$1))/$A40 -> 1.1860786995765011 | I40: =1-(LN(1-I$1))/$A40 -> 1.2137989972796179 | J40: =1-(LN(1-J$1))/$A40 -> 1.2418222550544646 | K40: =1-(LN(1-K$1))/$A40 -> 1.2701551683534005 | L40: =1-(LN(1-L$1))/$A40 -> 1.2988046570665421 | M40: =1-(LN(1-M$1))/$A40 -> 1.3277778756663714 | N40: =1-(LN(1-N$1))/$A40 -> 1.3570822239320708 | O40: =1-(LN(1-O$1))/$A40 -> 1.3867253582938042 | P40: =1-(LN(1-P$1))/$A40 -> 1.4167152038404485 | Q40: =1-(LN(1-Q$1))/$A40 -> 1.4470599670378916 | R40: =1-(LN(1-R$1))/$A40 -> 1.4777681492089574 | S40: =1-(LN(1-S$1))/$A40 -> 1.5088485608303546 | T40: =1-(LN(1-T$1))/$A40 -> 1.5403103367068014 | U40: =1-(LN(1-U$1))/$A40 -> 1.5721629520877172 | V40: =1-(LN(1-V$1))/$A40 -> 1.6044162397976152 | W40: =1-(LN(1-W$1))/$A40 -> 1.6370804084576913 | X40: =1-(LN(1-X$1))/$A40 -> 1.670166061883096 | Y40: =1-(LN(1-Y$1))/$A40 -> 1.7036842197481032 | Z40: =1-(LN(1-Z$1))/$A40 -> 1.7376463396199506 | AA40: =1-(LN(1-AA$1))/$A40 -> 1.7720643404715934 | AB40: =1-(LN(1-AB$1))/$A40 -> 1.8069506277941028 | AC40: =1-(LN(1-AC$1))/$A40 -> 1.8423181204411179 | AD40: =1-(LN(1-AD$1))/$A40 -> 1.8781802793507074 | AE40: =1-(LN(1-AE$1))/$A40 -> 1.9145511383044418 | AF40: =1-(LN(1-AF$1))/$A40 -> 1.951445336899569 | AG40: =1-(LN(1-AG$1))/$A40 -> 1.9888781559281656 | AH40: =1-(LN(1-AH$1))/$A40 -> 2.0268655553772441 | AI40: =1-(LN(1-AI$1))/$A40 -> 2.0654242152863223 | AJ40: =1-(LN(1-AJ$1))/$A40 -> 2.1045715797242415 | AK40: =1-(LN(1-AK$1))/$A40 -> 2.1443259041754343 | AL40: =1-(LN(1-AL$1))/$A40 -> 2.1847063066578425 | AM40: =1-(LN(1-AM$1))/$A40 -> 2.2257328229307687 | AN40: =1-(LN(1-AN$1))/$A40 -> 2.2674264661917438 | AO40: =1-(LN(1-AO$1))/$A40 -> 2.3098092917076682 | AP40: =1-(LN(1-AP$1))/$A40 -> 2.3529044668778769 | AQ40: =1-(LN(1-AQ$1))/$A40 -> 2.3967363472863386 | AR40: =1-(LN(1-AR$1))/$A40 -> 2.4413305593680548 | AS40: =1-(LN(1-AS$1))/$A40 -> 2.4867140903921596 | AT40: =1-(LN(1-AT$1))/$A40 -> 2.5329153865528733 | AU40: =1-(LN(1-AU$1))/$A40 -> 2.5799644600610692 | AV40: =1-(LN(1-AV$1))/$A40 -> 2.6278930062460759 | AW40: =1-(LN(1-AW$1))/$A40 -> 2.6767345318119591 | AX40: =1-(LN(1-AX$1))/$A40 -> 2.7265244955481172 | AY40: =1-(LN(1-AY$1))/$A40 -> 2.7773004629742193 | AZ40: =1-(LN(1-AZ$1))/$A40 -> 2.829102276608884 | BA40: =1-(LN(1-BA$1))/$A40 -> 2.8819722437953863 | BB40: =1-(LN(1-BB$1))/$A40 -> 2.9359553443026485 | BC40: =1-(LN(1-BC$1))/$A40 -> 2.9910994602538374 | BD40: =1-(LN(1-BD$1))/$A40 -> 3.0474556313276202 | BE40: =1-(LN(1-BE$1))/$A40 -> 3.1050783386405909 | BF40: =1-(LN(1-BF$1))/$A40 -> 3.1640258212680239 | BG40: =1-(LN(1-BG$1))/$A40 -> 3.2243604300121111 | BH40: =1-(LN(1-BH$1))/$A40 -> 3.2861490238045739 | BI40: =1-(LN(1-BI$1))/$A40 -> 3.3494634150619369 | BJ40: =1-(LN(1-BJ$1))/$A40 -> 3.414380871431911 | BK40: =1-(LN(1-BK$1))/$A40 -> 3.480984682722323 | BL40: =1-(LN(1-BL$1))/$A40 -> 3.5493648034458136 | BM40: =1-(LN(1-BM$1))/$A40 -> 3.6196185834153383 | BN40: =1-(LN(1-BN$1))/$A40 -> 3.6918516012786622 | BO40: =1-(LN(1-BO$1))/$A40 -> 3.7661786189023863 | BP40: =1-(LN(1-BP$1))/$A40 -> 3.8427246782605429 | BQ40: =1-(LN(1-BQ$1))/$A40 -> 3.921626367149655 | BR40: =1-(LN(1-BR$1))/$A40 -> 4.0030332859049889 | BS40: =1-(LN(1-BS$1))/$A40 -> 4.0871097546818884 | BT40: =1-(LN(1-BT$1))/$A40 -> 4.1740368102605601 | BU40: =1-(LN(1-BU$1))/$A40 -> 4.2640145533663798 | BV40: =1-(LN(1-BV$1))/$A40 -> 4.3572649230352898 | BW40: =1-(LN(1-BW$1))/$A40 -> 4.4540349947861806 | BX40: =1-(LN(1-BX$1))/$A40 -> 4.5546009259484403 | BY40: =1-(LN(1-BY$1))/$A40 -> 4.6592727067696078 | BZ40: =1-(LN(1-BZ$1))/$A40 -> 4.7683999232280589 | CA40: =1-(LN(1-CA$1))/$A40 -> 4.8823788016148129 | CB40: =1-(LN(1-CB$1))/$A40 -> 5.0016608929863331 | CC40: =1-(LN(1-CC$1))/$A40 -> 5.1267638780361589 | CD40: =1-(LN(1-CD$1))/$A40 -> 5.2582851456965454 | CE40: =1-(LN(1-CE$1))/$A40 -> 5.3969190463895611 | CF40: =1-(LN(1-CF$1))/$A40 -> 5.5434790818766091 | CG40: =1-(LN(1-CG$1))/$A40 -> 5.6989268301238782 | CH40: =1-(LN(1-CH$1))/$A40 -> 5.864410217656113 | CI40: =1-(LN(1-CI$1))/$A40 -> 6.0413150163406044 | CJ40: =1-(LN(1-CJ$1))/$A40 -> 6.2313354577604052 | CK40: =1-(LN(1-CK$1))/$A40 -> 6.4365731697438333 | CL40: =1-(LN(1-CL$1))/$A40 -> 6.6596792645890384 | CM40: =1-(LN(1-CM$1))/$A40 -> 6.9040643410103861 | CN40: =1-(LN(1-CN$1))/$A40 -> 7.1742195093637884 | CO40: =1-(LN(1-CO$1))/$A40 -> 7.4762272930981064 | CP40: =1-(LN(1-CP$1))/$A40 -> 7.8186154793148344 | CQ40: =1-(LN(1-CQ$1))/$A40 -> 8.2138736327180659 | CR40: =1-(LN(1-CR$1))/$A40 -> 8.6813648039846214 | CS40: =1-(LN(1-CS$1))/$A40 -> 9.2535277560723461 | CT40: =1-(LN(1-CT$1))/$A40 -> 9.9911740956923119 | CU40: =1-(LN(1-CU$1))/$A40 -> 11.030828219046606 | CV40: =1-(LN(1-CV$1))/$A40 -> 12.808128682020911
A41: =A40+0.01 -> 00.4 | B41: =1-(LN(1-B$1))/$A41 -> 1.0251258396337537 | C41: =1-(LN(1-C$1))/$A41 -> 1.0505067682937987 | D41: =1-(LN(1-D$1))/$A41 -> 1.0761480187117713 | E41: =1-(LN(1-E$1))/$A41 -> 1.1020549863006379 | F41: =1-(LN(1-F$1))/$A41 -> 1.1282332359688765 | G41: =1-(LN(1-G$1))/$A41 -> 1.1546885092952188 | H41: =1-(LN(1-H$1))/$A41 -> 1.1814267320870886 | I41: =1-(LN(1-I$1))/$A41 -> 1.2084540223476274 | J41: =1-(LN(1-J$1))/$A41 -> 1.2357766986781031 | K41: =1-(LN(1-K$1))/$A41 -> 1.2634012891445656 | L41: =1-(LN(1-L$1))/$A41 -> 1.2913345406398786 | M41: =1-(LN(1-M$1))/$A41 -> 1.3195834287747121 | N41: =1-(LN(1-N$1))/$A41 -> 1.3481551683337689 | O41: =1-(LN(1-O$1))/$A41 -> 1.3770572243364589 | P41: =1-(LN(1-P$1))/$A41 -> 1.4062973237444372 | Q41: =1-(LN(1-Q$1))/$A41 -> 1.4358834678619443 | R41: =1-(LN(1-R$1))/$A41 -> 1.4658239454787334 | S41: =1-(LN(1-S$1))/$A41 -> 1.4961273468095957 | T41: =1-(LN(1-T$1))/$A41 -> 1.5268025782891315 | U41: =1-(LN(1-U$1))/$A41 -> 1.5578588782855243 | V41: =1-(LN(1-V$1))/$A41 -> 1.5893058338026747 | W41: =1-(LN(1-W$1))/$A41 -> 1.6211533982462489 | X41: =1-(LN(1-X$1))/$A41 -> 1.6534119103360188 | Y41: =1-(LN(1-Y$1))/$A41 -> 1.6860921142544008 | Z41: =1-(LN(1-Z$1))/$A41 -> 1.719205181129452 | AA41: =1-(LN(1-AA$1))/$A41 -> 1.7527627319598036 | AB41: =1-(LN(1-AB$1))/$A41 -> 1.7867768620992504 | AC41: =1-(LN(1-AC$1))/$A41 -> 1.8212601674300899 | AD41: =1-(LN(1-AD$1))/$A41 -> 1.8562257723669395 | AE41: =1-(LN(1-AE$1))/$A41 -> 1.8916873598468307 | AF41: =1-(LN(1-AF$1))/$A41 -> 1.9276592034770799 | AG41: =1-(LN(1-AG$1))/$A41 -> 1.9641562020299617 | AH41: =1-(LN(1-AH$1))/$A41 -> 2.001193916492813 | AI41: =1-(LN(1-AI$1))/$A41 -> 2.0387886099041643 | AJ41: =1-(LN(1-AJ$1))/$A41 -> 2.0769572902311353 | AK41: =1-(LN(1-AK$1))/$A41 -> 2.1157177565710485 | AL41: =1-(LN(1-AL$1))/$A41 -> 2.1550886489913967 | AM41: =1-(LN(1-AM$1))/$A41 -> 2.1950895023574994 | AN41: =1-(LN(1-AN$1))/$A41 -> 2.2357408045369502 | AO41: =1-(LN(1-AO$1))/$A41 -> 2.2770640594149767 | AP41: =1-(LN(1-AP$1))/$A41 -> 2.3190818552059298 | AQ41: =1-(LN(1-AQ$1))/$A41 -> 2.36181793860418 | AR41: =1-(LN(1-AR$1))/$A41 -> 2.4052972953838534 | AS41: =1-(LN(1-AS$1))/$A41 -> 2.4495462381323554 | AT41: =1-(LN(1-AT$1))/$A41 -> 2.4945925018890511 | AU41: =1-(LN(1-AU$1))/$A41 -> 2.5404653485595423 | AV41: =1-(LN(1-AV$1))/$A41 -> 2.5871956810899244 | AW41: =1-(LN(1-AW$1))/$A41 -> 2.63481616851666 | AX41: =1-(LN(1-AX$1))/$A41 -> 2.6833613831594141 | AY41: =1-(LN(1-AY$1))/$A41 -> 2.7328679513998635 | AZ41: =1-(LN(1-AZ$1))/$A41 -> 2.7833747196936622 | BA41: =1-(LN(1-BA$1))/$A41 -> 2.8349229377005019 | BB41: =1-(LN(1-BB$1))/$A41 -> 2.8875564606950821 | BC41: =1-(LN(1-BC$1))/$A41 -> 2.9413219737474914 | BD41: =1-(LN(1-BD$1))/$A41 -> 2.9962692405444296 | BE41: =1-(LN(1-BE$1))/$A41 -> 3.0524513801745758 | BF41: =1-(LN(1-BF$1))/$A41 -> 3.1099251757363233 | BG41: =1-(LN(1-BG$1))/$A41 -> 3.1687514192618083 | BH41: =1-(LN(1-BH$1))/$A41 -> 3.2289952982094596 | BI41: =1-(LN(1-BI$1))/$A41 -> 3.2907268296853887 | BJ41: =1-(LN(1-BJ$1))/$A41 -> 3.3540213496461133 | BK41: =1-(LN(1-BK$1))/$A41 -> 3.4189600656542649 | BL41: =1-(LN(1-BL$1))/$A41 -> 3.4856306833596684 | BM41: =1-(LN(1-BM$1))/$A41 -> 3.5541281188299547 | BN41: =1-(LN(1-BN$1))/$A41 -> 3.6245553112466955 | BO41: =1-(LN(1-BO$1))/$A41 -> 3.6970241534298265 | BP41: =1-(LN(1-BP$1))/$A41 -> 3.7716565613040292 | BQ41: =1-(LN(1-BQ$1))/$A41 -> 3.8485857079709134 | BR41: =1-(LN(1-BR$1))/$A41 -> 3.9279574537573647 | BS41: =1-(LN(1-BS$1))/$A41 -> 4.0099320108148415 | BT41: =1-(LN(1-BT$1))/$A41 -> 4.0946858900040457 | BU41: =1-(LN(1-BU$1))/$A41 -> 4.1824141895322207 | BV41: =1-(LN(1-BV$1))/$A41 -> 4.2733332999594076 | BW41: =1-(LN(1-BW$1))/$A41 -> 4.3676841199165253 | BX41: =1-(LN(1-BX$1))/$A41 -> 4.4657359027997288 | BY41: =1-(LN(1-BY$1))/$A41 -> 4.5677908891003671 | BZ41: =1-(LN(1-BZ$1))/$A41 -> 4.674189925147358 | CA41: =1-(LN(1-CA$1))/$A41 -> 4.785319331574442 | CB41: =1-(LN(1-CB$1))/$A41 -> 4.901619370661674 | CC41: =1-(LN(1-CC$1))/$A41 -> 5.0235947810852553 | CD41: =1-(LN(1-CD$1))/$A41 -> 5.1518280170541315 | CE41: =1-(LN(1-CE$1))/$A41 -> 5.2869960702298213 | CF41: =1-(LN(1-CF$1))/$A41 -> 5.429892104829694 | CG41: =1-(LN(1-CG$1))/$A41 -> 5.5814536593707809 | CH41: =1-(LN(1-CH$1))/$A41 -> 5.7427999622147095 | CI41: =1-(LN(1-CI$1))/$A41 -> 5.9152821409320895 | CJ41: =1-(LN(1-CJ$1))/$A41 -> 6.100552071316395 | CK41: =1-(LN(1-CK$1))/$A41 -> 6.3006588405002368 | CL41: =1-(LN(1-CL$1))/$A41 -> 6.5181872829743126 | CM41: =1-(LN(1-CM$1))/$A41 -> 6.7564627324851267 | CN41: =1-(LN(1-CN$1))/$A41 -> 7.0198640216296937 | CO41: =1-(LN(1-CO$1))/$A41 -> 7.3143216107706541 | CP41: =1-(LN(1-CP$1))/$A41 -> 7.6481500923319636 | CQ41: =1-(LN(1-CQ$1))/$A41 -> 8.0335267919001137 | CR41: =1-(LN(1-CR$1))/$A41 -> 8.4893306838850044 | CS41: =1-(LN(1-CS$1))/$A41 -> 9.0471895621705372 | CT41: =1-(LN(1-CT$1))/$A41 -> 9.7663947433000029 | CU41: =1-(LN(1-CU$1))/$A41 -> 10.780057513570441 | CV41: =1-(LN(1-CV$1))/$A41 -> 12.512925464970388
A42: =A41+0.01 -> 00.41 | B42: =1-(LN(1-B$1))/$A42 -> 1.0245130142768328 | C42: =1-(LN(1-C$1))/$A42 -> 1.0492748958963889 | D42: =1-(LN(1-D$1))/$A42 -> 1.0742907499627039 | E42: =1-(LN(1-E$1))/$A42 -> 1.0995658402933053 | F42: =1-(LN(1-F$1))/$A42 -> 1.1251055960671965 | G42: =1-(LN(1-G$1))/$A42 -> 1.1509156188246037 | H42: =1-(LN(1-H$1))/$A42 -> 1.177001689841062 | I42: =1-(LN(1-I$1))/$A42 -> 1.2033697779001242 | J42: =1-(LN(1-J$1))/$A42 -> 1.2300260474908322 | K42: =1-(LN(1-K$1))/$A42 -> 1.2569768674581128 | L42: =1-(LN(1-L$1))/$A42 -> 1.2842288201364669 | M42: =1-(LN(1-M$1))/$A42 -> 1.3117887109997191 | N42: =1-(LN(1-N$1))/$A42 -> 1.3396635788622135 | O42: =1-(LN(1-O$1))/$A42 -> 1.3678607066697159 | P42: =1-(LN(1-P$1))/$A42 -> 1.3963876329214022 | Q42: =1-(LN(1-Q$1))/$A42 -> 1.4252521637677504 | R42: =1-(LN(1-R$1))/$A42 -> 1.4544623858329107 | S42: =1-(LN(1-S$1))/$A42 -> 1.4840266798142396 | T42: =1-(LN(1-T$1))/$A42 -> 1.5139537349162258 | U42: =1-(LN(1-U$1))/$A42 -> 1.5442525641809994 | V42: =1-(LN(1-V$1))/$A42 -> 1.5749325207830971 | W42: =1-(LN(1-W$1))/$A42 -> 1.6060033153621942 | X42: =1-(LN(1-X$1))/$A42 -> 1.6374750344741646 | Y42: =1-(LN(1-Y$1))/$A42 -> 1.6693581602481959 | Z42: =1-(LN(1-Z$1))/$A42 -> 1.7016635913458067 | AA42: =1-(LN(1-AA$1))/$A42 -> 1.7344026653266376 | AB42: =1-(LN(1-AB$1))/$A42 -> 1.7675871825358538 | AC42: =1-(LN(1-AC$1))/$A42 -> 1.8012294316391122 | AD42: =1-(LN(1-AD$1))/$A42 -> 1.8353422169433558 | AE42: =1-(LN(1-AE$1))/$A42 -> 1.8699388876554446 | AF42: =1-(LN(1-AF$1))/$A42 -> 1.9050333692459316 | AG42: =1-(LN(1-AG$1))/$A42 -> 1.9406401971024014 | AH42: =1-(LN(1-AH$1))/$A42 -> 1.9767745526759151 | AI42: =1-(LN(1-AI$1))/$A42 -> 2.0134523023455264 | AJ42: =1-(LN(1-AJ$1))/$A42 -> 2.0506900392498881 | AK42: =1-(LN(1-AK$1))/$A42 -> 2.0885051283619989 | AL42: =1-(LN(1-AL$1))/$A42 -> 2.1269157551135578 | AM42: =1-(LN(1-AM$1))/$A42 -> 2.1659409779097558 | AN42: =1-(LN(1-AN$1))/$A42 -> 2.2056007849140977 | AO42: =1-(LN(1-AO$1))/$A42 -> 2.2459161555268068 | AP42: =1-(LN(1-AP$1))/$A42 -> 2.2869091270301753 | AQ42: =1-(LN(1-AQ$1))/$A42 -> 2.3286028669309076 | AR42: =1-(LN(1-AR$1))/$A42 -> 2.3710217515940029 | AS42: =1-(LN(1-AS$1))/$A42 -> 2.4141914518364445 | AT42: =1-(LN(1-AT$1))/$A42 -> 2.4581390262332206 | AU42: =1-(LN(1-AU$1))/$A42 -> 2.5028930229849196 | AV42: =1-(LN(1-AV$1))/$A42 -> 2.5484835913072432 | AW42: =1-(LN(1-AW$1))/$A42 -> 2.594942603430888 | AX42: =1-(LN(1-AX$1))/$A42 -> 2.642303788448209 | AY42: =1-(LN(1-AY$1))/$A42 -> 2.6906028794145009 | AZ42: =1-(LN(1-AZ$1))/$A42 -> 2.7398777753108901 | BA42: =1-(LN(1-BA$1))/$A42 -> 2.7901687197078067 | BB42: =1-(LN(1-BB$1))/$A42 -> 2.8415184982391049 | BC42: =1-(LN(1-BC$1))/$A42 -> 2.8939726573146256 | BD42: =1-(LN(1-BD$1))/$A42 -> 2.9475797468726141 | BE42: =1-(LN(1-BE$1))/$A42 -> 3.0023915904142204 | BF42: =1-(LN(1-BF$1))/$A42 -> 3.0584635860842178 | BG42: =1-(LN(1-BG$1))/$A42 -> 3.1158550431822518 | BH42: =1-(LN(1-BH$1))/$A42 -> 3.174629559228741 | BI42: =1-(LN(1-BI$1))/$A42 -> 3.2348554435955013 | BJ42: =1-(LN(1-BJ$1))/$A42 -> 3.2966061947766958 | BK42: =1-(LN(1-BK$1))/$A42 -> 3.3599610396626978 | BL42: =1-(LN(1-BL$1))/$A42 -> 3.4250055447411398 | BM42: =1-(LN(1-BM$1))/$A42 -> 3.491832311053614 | BN42: =1-(LN(1-BN$1))/$A42 -> 3.5605417670699469 | BO42: =1-(LN(1-BO$1))/$A42 -> 3.6312430765169039 | BP42: =1-(LN(1-BP$1))/$A42 -> 3.7040551817600287 | BQ42: =1-(LN(1-BQ$1))/$A42 -> 3.7791080077765011 | BR42: =1-(LN(1-BR$1))/$A42 -> 3.8565438573242581 | BS42: =1-(LN(1-BS$1))/$A42 -> 3.9365190349413091 | BT42: =1-(LN(1-BT$1))/$A42 -> 4.0192057463454098 | BU42: =1-(LN(1-BU$1))/$A42 -> 4.1047943312509467 | BV42: =1-(LN(1-BV$1))/$A42 -> 4.1934959023994223 | BW42: =1-(LN(1-BW$1))/$A42 -> 4.2855454828453912 | BX42: =1-(LN(1-BX$1))/$A42 -> 4.3812057588290045 | BY42: =1-(LN(1-BY$1))/$A42 -> 4.4807715991223098 | BZ42: =1-(LN(1-BZ$1))/$A42 -> 4.5845755367291297 | CA42: =1-(LN(1-CA$1))/$A42 -> 4.692994469828724 | CB42: =1-(LN(1-CB$1))/$A42 -> 4.8064579225967563 | CC42: =1-(LN(1-CC$1))/$A42 -> 4.9254583230100053 | CD42: =1-(LN(1-CD$1))/$A42 -> 5.0505639190772014 | CE42: =1-(LN(1-CE$1))/$A42 -> 5.1824351904681185 | CF42: =1-(LN(1-CF$1))/$A42 -> 5.3218459559314084 | CG42: =1-(LN(1-CG$1))/$A42 -> 5.4697108871910061 | CH42: =1-(LN(1-CH$1))/$A42 -> 5.6271219143558149 | CI42: =1-(LN(1-CI$1))/$A42 -> 5.7953972106654534 | CJ42: =1-(LN(1-CJ$1))/$A42 -> 5.9761483622598979 | CK42: =1-(LN(1-CK$1))/$A42 -> 6.1713744785368165 | CL42: =1-(LN(1-CL$1))/$A42 -> 6.3835973492432316 | CM42: =1-(LN(1-CM$1))/$A42 -> 6.6160612024245138 | CN42: =1-(LN(1-CN$1))/$A42 -> 6.8730380698826279 | CO42: =1-(LN(1-CO$1))/$A42 -> 7.1603137666055154 | CP42: =1-(LN(1-CP$1))/$A42 -> 7.4860000900799646 | CQ42: =1-(LN(1-CQ$1))/$A42 -> 7.8619773579513295 | CR42: =1-(LN(1-CR$1))/$A42 -> 8.3066640818390276 | CS42: =1-(LN(1-CS$1))/$A42 -> 8.8509166460200355 | CT42: =1-(LN(1-CT$1))/$A42 -> 9.5525802373658575 | CU42: =1-(LN(1-CU$1))/$A42 -> 10.541519525434577 | CV42: =1-(LN(1-CV$1))/$A42 -> 12.232122404849159
A43: =A42+0.01 -> 00.42 | B43: =1-(LN(1-B$1))/$A43 -> 1.0239293710797654 | C43: =1-(LN(1-C$1))/$A43 -> 1.048101684089332 | D43: =1-(LN(1-D$1))/$A43 -> 1.0725219225826395 | E43: =1-(LN(1-E$1))/$A43 -> 1.0971952250482266 | F43: =1-(LN(1-F$1))/$A43 -> 1.12212689139893 | G43: =1-(LN(1-G$1))/$A43 -> 1.1473223898049703 | H43: =1-(LN(1-H$1))/$A43 -> 1.1727873638924653 | I43: =1-(LN(1-I$1))/$A43 -> 1.1985276403310738 | J43: =1-(LN(1-J$1))/$A43 -> 1.2245492368362887 | K43: =1-(LN(1-K$1))/$A43 -> 1.2508583706138721 | L43: =1-(LN(1-L$1))/$A43 -> 1.2774614672760749 | M43: =1-(LN(1-M$1))/$A43 -> 1.3043651702616306 | N43: =1-(LN(1-N$1))/$A43 -> 1.3315763507940657 | O43: =1-(LN(1-O$1))/$A43 -> 1.3591021184156751 | P43: =1-(LN(1-P$1))/$A43 -> 1.3869498321375593 | Q43: =1-(LN(1-Q$1))/$A43 -> 1.4151271122494706 | R43: =1-(LN(1-R$1))/$A43 -> 1.4436418528368891 | S43: =1-(LN(1-S$1))/$A43 -> 1.4725022350567576 | T43: =1-(LN(1-T$1))/$A43 -> 1.5017167412277441 | U43: =1-(LN(1-U$1))/$A43 -> 1.5312941697957374 | V43: =1-(LN(1-V$1))/$A43 -> 1.5612436512406425 | W43: =1-(LN(1-W$1))/$A43 -> 1.5915746649964277 | X43: =1-(LN(1-X$1))/$A43 -> 1.622297057462875 | Y43: =1-(LN(1-Y$1))/$A43 -> 1.6534210611946674 | Z43: =1-(LN(1-Z$1))/$A43 -> 1.6849573153613826 | AA43: =1-(LN(1-AA$1))/$A43 -> 1.7169168875807654 | AB43: =1-(LN(1-AB$1))/$A43 -> 1.749311297237381 | AC43: =1-(LN(1-AC$1))/$A43 -> 1.7821525404096095 | AD43: =1-(LN(1-AD$1))/$A43 -> 1.8154531165399423 | AE43: =1-(LN(1-AE$1))/$A43 -> 1.8492260569969816 | AF43: =1-(LN(1-AF$1))/$A43 -> 1.8834849556924569 | AG43: =1-(LN(1-AG$1))/$A43 -> 1.9182440019332967 | AH43: =1-(LN(1-AH$1))/$A43 -> 1.953518015707441 | AI43: =1-(LN(1-AI$1))/$A43 -> 1.9893224856230138 | AJ43: =1-(LN(1-AJ$1))/$A43 -> 2.0256736097439383 | AK43: =1-(LN(1-AK$1))/$A43 -> 2.0625883395914748 | AL43: =1-(LN(1-AL$1))/$A43 -> 2.1000844276108541 | AM43: =1-(LN(1-AM$1))/$A43 -> 2.1381804784357135 | AN43: =1-(LN(1-AN$1))/$A43 -> 2.1768960043209047 | AO43: =1-(LN(1-AO$1))/$A43 -> 2.2162514851571204 | AP43: =1-(LN(1-AP$1))/$A43 -> 2.2562684335294572 | AQ43: =1-(LN(1-AQ$1))/$A43 -> 2.2969694653373143 | AR43: =1-(LN(1-AR$1))/$A43 -> 2.3383783765560509 | AS43: =1-(LN(1-AS$1))/$A43 -> 2.3805202267927195 | AT43: =1-(LN(1-AT$1))/$A43 -> 2.4234214303705248 | AU43: =1-(LN(1-AU$1))/$A43 -> 2.4671098557709925 | AV43: =1-(LN(1-AV$1))/$A43 -> 2.5116149343713561 | AW43: =1-(LN(1-AW$1))/$A43 -> 2.5569677795396766 | AX43: =1-(LN(1-AX$1))/$A43 -> 2.6032013172946802 | AY43: =1-(LN(1-AY$1))/$A43 -> 2.6503504299046319 | AZ43: =1-(LN(1-AZ$1))/$A43 -> 2.6984521139939641 | BA43: =1-(LN(1-BA$1))/$A43 -> 2.7475456549528587 | BB43: =1-(LN(1-BB$1))/$A43 -> 2.7976728197096019 | BC43: =1-(LN(1-BC$1))/$A43 -> 2.8488780702357062 | BD43: =1-(LN(1-BD$1))/$A43 -> 2.9012088005185044 | BE43: =1-(LN(1-BE$1))/$A43 -> 2.9547156001662627 | BF43: =1-(LN(1-BF$1))/$A43 -> 3.0094525483203078 | BG43: =1-(LN(1-BG$1))/$A43 -> 3.065477542154103 | BH43: =1-(LN(1-BH$1))/$A43 -> 3.1228526649613904 | BI43: =1-(LN(1-BI$1))/$A43 -> 3.1816445997003702 | BJ43: =1-(LN(1-BJ$1))/$A43 -> 3.2419250949010601 | BK43: =1-(LN(1-BK$1))/$A43 -> 3.3037714910993001 | BL43: =1-(LN(1-BL$1))/$A43 -> 3.3672673174853984 | BM43: =1-(LN(1-BM$1))/$A43 -> 3.4325029703142422 | BN43: =1-(LN(1-BN$1))/$A43 -> 3.4995764869016148 | BO43: =1-(LN(1-BO$1))/$A43 -> 3.5685944318379299 | BP43: =1-(LN(1-BP$1))/$A43 -> 3.639672915527647 | BQ43: =1-(LN(1-BQ$1))/$A43 -> 3.712938769496108 | BR43: =1-(LN(1-BR$1))/$A43 -> 3.7885309083403471 | BS43: =1-(LN(1-BS$1))/$A43 -> 3.8666019150617541 | BT43: =1-(LN(1-BT$1))/$A43 -> 3.9473198952419479 | BU43: =1-(LN(1-BU$1))/$A43 -> 4.0308706566973527 | BV43: =1-(LN(1-BV$1))/$A43 -> 4.1174602856756266 | BW43: =1-(LN(1-BW$1))/$A43 -> 4.2073182094443098 | BX43: =1-(LN(1-BX$1))/$A43 -> 4.3007008598092664 | BY43: =1-(LN(1-BY$1))/$A43 -> 4.3978960848574928 | BZ43: =1-(LN(1-BZ$1))/$A43 -> 4.4992285001403403 | CA43: =1-(LN(1-CA$1))/$A43 -> 4.6050660300708977 | CB43: =1-(LN(1-CB$1))/$A43 -> 4.7158279720587375 | CC43: =1-(LN(1-CC$1))/$A43 -> 4.8319950296050047 | CD43: =1-(LN(1-CD$1))/$A43 -> 4.9541219210039351 | CE43: =1-(LN(1-CE$1))/$A43 -> 5.0828534002188777 | CF43: =1-(LN(1-CF$1))/$A43 -> 5.2189448617425649 | CG43: =1-(LN(1-CG$1))/$A43 -> 5.3632891994007439 | CH43: =1-(LN(1-CH$1))/$A43 -> 5.5169523449663904 | CI43: =1-(LN(1-CI$1))/$A43 -> 5.6812210866019903 | CJ43: =1-(LN(1-CJ$1))/$A43 -> 5.8576686393489474 | CK43: =1-(LN(1-CK$1))/$A43 -> 6.0482465147621305 | CL43: =1-(LN(1-CL$1))/$A43 -> 6.2554164599755353 | CM43: =1-(LN(1-CM$1))/$A43 -> 6.4823454595096441 | CN43: =1-(LN(1-CN$1))/$A43 -> 6.7332038301235171 | CO43: =1-(LN(1-CO$1))/$A43 -> 7.0136396293053842 | CP43: =1-(LN(1-CP$1))/$A43 -> 7.3315715165066324 | CQ43: =1-(LN(1-CQ$1))/$A43 -> 7.6985969446667744 | CR43: =1-(LN(1-CR$1))/$A43 -> 8.1326958894142898 | CS43: =1-(LN(1-CS$1))/$A43 -> 8.6639900592100361 | CT43: =1-(LN(1-CT$1))/$A43 -> 9.3489473745714324 | CU43: =1-(LN(1-CU$1))/$A43 -> 10.314340489114706 | CV43: =1-(LN(1-CV$1))/$A43 -> 11.964690919019418
A44: =A43+0.01 -> 00.43 | B44: =1-(LN(1-B$1))/$A44 -> 1.0233728740779104 | C44: =1-(LN(1-C$1))/$A44 -> 1.0469830402733011 | D44: =1-(LN(1-D$1))/$A44 -> 1.0708353662435082 | E44: =1-(LN(1-E$1))/$A44 -> 1.0949348709773377 | F44: =1-(LN(1-F$1))/$A44 -> 1.1192867311338386 | G44: =1-(LN(1-G$1))/$A44 -> 1.1438962877164824 | H44: =1-(LN(1-H$1))/$A44 -> 1.1687690531042685 | I44: =1-(LN(1-I$1))/$A44 -> 1.1939107184629092 | J44: =1-(LN(1-J$1))/$A44 -> 1.2193271615610262 | K44: =1-(LN(1-K$1))/$A44 -> 1.2450244550182006 | L44: =1-(LN(1-L$1))/$A44 -> 1.2710088750138406 | M44: =1-(LN(1-M$1))/$A44 -> 1.2972869104881042 | N44: =1-(LN(1-N$1))/$A44 -> 1.3238652728686222 | O44: =1-(LN(1-O$1))/$A44 -> 1.3507509063594967 | P44: =1-(LN(1-P$1))/$A44 -> 1.3779509988320346 | Q44: =1-(LN(1-Q$1))/$A44 -> 1.4054729933599481 | R44: =1-(LN(1-R$1))/$A44 -> 1.4333246004453335 | S44: =1-(LN(1-S$1))/$A44 -> 1.4615138109856702 | T44: =1-(LN(1-T$1))/$A44 -> 1.4900489100364014 | U44: =1-(LN(1-U$1))/$A44 -> 1.5189384914283948 | V44: =1-(LN(1-V$1))/$A44 -> 1.5481914733048137 | W44: =1-(LN(1-W$1))/$A44 -> 1.5778171146476736 | X44: =1-(LN(1-X$1))/$A44 -> 1.6078250328707151 | Y44: =1-(LN(1-Y$1))/$A44 -> 1.6382252225622334 | Z44: =1-(LN(1-Z$1))/$A44 -> 1.6690280754692575 | AA44: =1-(LN(1-AA$1))/$A44 -> 1.7002444018230731 | AB44: =1-(LN(1-AB$1))/$A44 -> 1.7318854531155816 | AC44: =1-(LN(1-AC$1))/$A44 -> 1.7639629464465951 | AD44: =1-(LN(1-AD$1))/$A44 -> 1.7964890905738973 | AE44: =1-(LN(1-AE$1))/$A44 -> 1.8294766138110052 | AF44: =1-(LN(1-AF$1))/$A44 -> 1.8629387939321673 | AG44: =1-(LN(1-AG$1))/$A44 -> 1.8968894902604294 | AH44: =1-(LN(1-AH$1))/$A44 -> 1.9313431781328494 | AI44: =1-(LN(1-AI$1))/$A44 -> 1.9663149859573621 | AJ44: =1-(LN(1-AJ$1))/$A44 -> 2.0018207350987307 | AK44: =1-(LN(1-AK$1))/$A44 -> 2.0378769828567895 | AL44: =1-(LN(1-AL$1))/$A44 -> 2.074501068829206 | AM44: =1-(LN(1-AM$1))/$A44 -> 2.1117111649837206 | AN44: =1-(LN(1-AN$1))/$A44 -> 2.1495263298018141 | AO44: =1-(LN(1-AO$1))/$A44 -> 2.1879665668976527 | AP44: =1-(LN(1-AP$1))/$A44 -> 2.2270528885636556 | AQ44: =1-(LN(1-AQ$1))/$A44 -> 2.2668073847480743 | AR44: =1-(LN(1-AR$1))/$A44 -> 2.3072532980314913 | AS44: =1-(LN(1-AS$1))/$A44 -> 2.3484151052394004 | AT44: =1-(LN(1-AT$1))/$A44 -> 2.3903186064084196 | AU44: =1-(LN(1-AU$1))/$A44 -> 2.4329910219158535 | AV44: =1-(LN(1-AV$1))/$A44 -> 2.4764610986883016 | AW44: =1-(LN(1-AW$1))/$A44 -> 2.5207592265271259 | AX44: =1-(LN(1-AX$1))/$A44 -> 2.5659175657296878 | AY44: =1-(LN(1-AY$1))/$A44 -> 2.6119701873487102 | AZ44: =1-(LN(1-AZ$1))/$A44 -> 2.6589532276220114 | BA44: =1-(LN(1-BA$1))/$A44 -> 2.7069050583260479 | BB44: =1-(LN(1-BB$1))/$A44 -> 2.7558664750651927 | BC44: =1-(LN(1-BC$1))/$A44 -> 2.8058809058116196 | BD44: =1-(LN(1-BD$1))/$A44 -> 2.856994642366911 | BE44: =1-(LN(1-BE$1))/$A44 -> 2.9092570978368149 | BF44: =1-(LN(1-BF$1))/$A44 -> 2.9627210937082076 | BG44: =1-(LN(1-BG$1))/$A44 -> 3.0174431807086588 | BH44: =1-(LN(1-BH$1))/$A44 -> 3.0734839983343809 | BI44: =1-(LN(1-BI$1))/$A44 -> 3.1309086787771054 | BJ44: =1-(LN(1-BJ$1))/$A44 -> 3.1897873019963843 | BK44: =1-(LN(1-BK$1))/$A44 -> 3.250195409910944 | BL44: =1-(LN(1-BL$1))/$A44 -> 3.3122145891717842 | BM44: =1-(LN(1-BM$1))/$A44 -> 3.3759331337953067 | BN44: =1-(LN(1-BN$1))/$A44 -> 3.4414468011597168 | BO44: =1-(LN(1-BO$1))/$A44 -> 3.508859677609141 | BP44: =1-(LN(1-BP$1))/$A44 -> 3.5782851733060737 | BQ44: =1-(LN(1-BQ$1))/$A44 -> 3.6498471702055006 | BR44: =1-(LN(1-BR$1))/$A44 -> 3.7236813523324321 | BS44: =1-(LN(1-BS$1))/$A44 -> 3.7999367542463642 | BT44: =1-(LN(1-BT$1))/$A44 -> 3.8787775720967863 | BU44: =1-(LN(1-BU$1))/$A44 -> 3.960385292588112 | BV44: =1-(LN(1-BV$1))/$A44 -> 4.0449612092645655 | BW44: =1-(LN(1-BW$1))/$A44 -> 4.1327294138758379 | BX44: =1-(LN(1-BX$1))/$A44 -> 4.2239403746974222 | BY44: =1-(LN(1-BY$1))/$A44 -> 4.3188752456747608 | BZ44: =1-(LN(1-BZ$1))/$A44 -> 4.4178510931603325 | CA44: =1-(LN(1-CA$1))/$A44 -> 4.5212272851855282 | CB44: =1-(LN(1-CB$1))/$A44 -> 4.6294133680573717 | CC44: =1-(LN(1-CC$1))/$A44 -> 4.7428788661258183 | CD44: =1-(LN(1-CD$1))/$A44 -> 4.8621655972596578 | CE44: =1-(LN(1-CE$1))/$A44 -> 4.98790332114402 | CF44: =1-(LN(1-CF$1))/$A44 -> 5.1208298649578543 | CG44: =1-(LN(1-CG$1))/$A44 -> 5.2618173575542153 | CH44: =1-(LN(1-CH$1))/$A44 -> 5.4119069415950785 | CI44: =1-(LN(1-CI$1))/$A44 -> 5.5723554799368271 | CJ44: =1-(LN(1-CJ$1))/$A44 -> 5.7446996012245535 | CK44: =1-(LN(1-CK$1))/$A44 -> 5.9308454330234763 | CL44: =1-(LN(1-CL$1))/$A44 -> 6.1331974725342437 | CM44: =1-(LN(1-CM$1))/$A44 -> 6.3548490534745357 | CN44: =1-(LN(1-CN$1))/$A44 -> 6.5998735084927374 | CO44: =1-(LN(1-CO$1))/$A44 -> 6.8737875449029335 | CP44: =1-(LN(1-CP$1))/$A44 -> 7.184325667285548 | CQ44: =1-(LN(1-CQ$1))/$A44 -> 7.5428156203721981 | CR44: =1-(LN(1-CR$1))/$A44 -> 7.9668192408232601 | CS44: =1-(LN(1-CS$1))/$A44 -> 8.4857577322516633 | CT44: =1-(LN(1-CT$1))/$A44 -> 9.1547858077209341 | CU44: =1-(LN(1-CU$1))/$A44 -> 10.097727919600411 | CV44: =1-(LN(1-CV$1))/$A44 -> 11.709698106949197
A45: =A44+0.01 -> 00.44 | B45: =1-(LN(1-B$1))/$A45 -> 1.0228416723943214 | C45: =1-(LN(1-C$1))/$A45 -> 1.0459152439034534 | D45: =1-(LN(1-D$1))/$A45 -> 1.0692254715561558 | E45: =1-(LN(1-E$1))/$A45 -> 1.0927772602733072 | F45: =1-(LN(1-F$1))/$A45 -> 1.116575669062615 | G45: =1-(LN(1-G$1))/$A45 -> 1.140625917541108 | H45: =1-(LN(1-H$1))/$A45 -> 1.1649333928064443 | I45: =1-(LN(1-I$1))/$A45 -> 1.1895036566796613 | J45: =1-(LN(1-J$1))/$A45 -> 1.2143424533437301 | K45: =1-(LN(1-K$1))/$A45 -> 1.2394557174041505 | L45: =1-(LN(1-L$1))/$A45 -> 1.2648495823998895 | M45: =1-(LN(1-M$1))/$A45 -> 1.2905303897951927 | N45: =1-(LN(1-N$1))/$A45 -> 1.3165046984852444 | O45: =1-(LN(1-O$1))/$A45 -> 1.3427792948513262 | P45: =1-(LN(1-P$1))/$A45 -> 1.3693612034040337 | Q45: =1-(LN(1-Q$1))/$A45 -> 1.3962576980563131 | R45: =1-(LN(1-R$1))/$A45 -> 1.4234763140715758 | S45: =1-(LN(1-S$1))/$A45 -> 1.4510248607359959 | T45: =1-(LN(1-T$1))/$A45 -> 1.4789114348083012 | U45: =1-(LN(1-U$1))/$A45 -> 1.507144434805022 | V45: =1-(LN(1-V$1))/$A45 -> 1.5357325761842495 | W45: =1-(LN(1-W$1))/$A45 -> 1.5646849074965901 | X45: =1-(LN(1-X$1))/$A45 -> 1.5940108275781988 | Y45: =1-(LN(1-Y$1))/$A45 -> 1.623720103867637 | Z45: =1-(LN(1-Z$1))/$A45 -> 1.6538228919358655 | AA45: =1-(LN(1-AA$1))/$A45 -> 1.6843297563270943 | AB45: =1-(LN(1-AB$1))/$A45 -> 1.7152516928175001 | AC45: =1-(LN(1-AC$1))/$A45 -> 1.7466001522091725 | AD45: =1-(LN(1-AD$1))/$A45 -> 1.7783870657881269 | AE45: =1-(LN(1-AE$1))/$A45 -> 1.8106248725880278 | AF45: =1-(LN(1-AF$1))/$A45 -> 1.843326548615527 | AG45: =1-(LN(1-AG$1))/$A45 -> 1.8765056382090559 | AH45: =1-(LN(1-AH$1))/$A45 -> 1.9101762877207391 | AI45: =1-(LN(1-AI$1))/$A45 -> 1.9443532817310585 | AJ45: =1-(LN(1-AJ$1))/$A45 -> 1.9790520820283048 | AK45: =1-(LN(1-AK$1))/$A45 -> 2.0142888696100441 | AL45: =1-(LN(1-AL$1))/$A45 -> 2.0500805899921786 | AM45: =1-(LN(1-AM$1))/$A45 -> 2.0864450021431811 | AN45: =1-(LN(1-AN$1))/$A45 -> 2.1234007313972274 | AO45: =1-(LN(1-AO$1))/$A45 -> 2.160967326740888 | AP45: =1-(LN(1-AP$1))/$A45 -> 2.1991653229144816 | AQ45: =1-(LN(1-AQ$1))/$A45 -> 2.2380163078219817 | AR45: =1-(LN(1-AR$1))/$A45 -> 2.2775429958035032 | AS45: =1-(LN(1-AS$1))/$A45 -> 2.3177693073930508 | AT45: =1-(LN(1-AT$1))/$A45 -> 2.3587204562627737 | AU45: =1-(LN(1-AU$1))/$A45 -> 2.4004230441450387 | AV45: =1-(LN(1-AV$1))/$A45 -> 2.442905164627204 | AW45: =1-(LN(1-AW$1))/$A45 -> 2.4861965168333273 | AX45: =1-(LN(1-AX$1))/$A45 -> 2.5303285301449217 | AY45: =1-(LN(1-AY$1))/$A45 -> 2.5753345012726032 | AZ45: =1-(LN(1-AZ$1))/$A45 -> 2.6212497451760566 | BA45: =1-(LN(1-BA$1))/$A45 -> 2.6681117615459105 | BB45: =1-(LN(1-BB$1))/$A45 -> 2.7159604188137108 | BC45: =1-(LN(1-BC$1))/$A45 -> 2.7648381579522647 | BD45: =1-(LN(1-BD$1))/$A45 -> 2.8147902186767539 | BE45: =1-(LN(1-BE$1))/$A45 -> 2.8658648910677962 | BF45: =1-(LN(1-BF$1))/$A45 -> 2.9181137961239303 | BG45: =1-(LN(1-BG$1))/$A45 -> 2.9715921993289163 | BH45: =1-(LN(1-BH$1))/$A45 -> 3.0263593620085998 | BI45: =1-(LN(1-BI$1))/$A45 -> 3.0824789360776261 | BJ45: =1-(LN(1-BJ$1))/$A45 -> 3.1400194087691937 | BK45: =1-(LN(1-BK$1))/$A45 -> 3.1990546051402409 | BL45: =1-(LN(1-BL$1))/$A45 -> 3.2596642575996984 | BM45: =1-(LN(1-BM$1))/$A45 -> 3.3219346534817769 | BN45: =1-(LN(1-BN$1))/$A45 -> 3.3859593738606324 | BO45: =1-(LN(1-BO$1))/$A45 -> 3.4518401394816602 | BP45: =1-(LN(1-BP$1))/$A45 -> 3.519687783003663 | BQ45: =1-(LN(1-BQ$1))/$A45 -> 3.5896233708826486 | BR45: =1-(LN(1-BR$1))/$A45 -> 3.6617795034157861 | BS45: =1-(LN(1-BS$1))/$A45 -> 3.7363018280134921 | BT45: =1-(LN(1-BT$1))/$A45 -> 3.8133508090945867 | BU45: =1-(LN(1-BU$1))/$A45 -> 3.8931038086656549 | BV45: =1-(LN(1-BV$1))/$A45 -> 3.9757575454176433 | BW45: =1-(LN(1-BW$1))/$A45 -> 4.0615310181059323 | BX45: =1-(LN(1-BX$1))/$A45 -> 4.1506690025452082 | BY45: =1-(LN(1-BY$1))/$A45 -> 4.2434462628185159 | BZ45: =1-(LN(1-BZ$1))/$A45 -> 4.3401726592248702 | CA45: =1-(LN(1-CA$1))/$A45 -> 4.4411993923404021 | CB45: =1-(LN(1-CB$1))/$A45 -> 4.5469267006015226 | CC45: =1-(LN(1-CC$1))/$A45 -> 4.6578134373502316 | CD45: =1-(LN(1-CD$1))/$A45 -> 4.7743891064128476 | CE45: =1-(LN(1-CE$1))/$A45 -> 4.8972691547543832 | CF45: =1-(LN(1-CF$1))/$A45 -> 5.027174640754267 | CG45: =1-(LN(1-CG$1))/$A45 -> 5.1649578721552558 | CH45: =1-(LN(1-CH$1))/$A45 -> 5.3116363292860997 | CI45: =1-(LN(1-CI$1))/$A45 -> 5.4684383099382634 | CJ45: =1-(LN(1-CJ$1))/$A45 -> 5.6368655193785413 | CK45: =1-(LN(1-CK$1))/$A45 -> 5.8187807640911249 | CL45: =1-(LN(1-CL$1))/$A45 -> 6.0165338936130111 | CM45: =1-(LN(1-CM$1))/$A45 -> 6.2331479386228423 | CN45: =1-(LN(1-CN$1))/$A45 -> 6.4726036560269939 | CO45: =1-(LN(1-CO$1))/$A45 -> 6.7402923734278666 | CP45: =1-(LN(1-CP$1))/$A45 -> 7.043772811210876 | CQ45: =1-(LN(1-CQ$1))/$A45 -> 7.3941152653637392 | CR45: =1-(LN(1-CR$1))/$A45 -> 7.8084824398954584 | CS45: =1-(LN(1-CS$1))/$A45 -> 8.315626874700488 | CT45: =1-(LN(1-CT$1))/$A45 -> 8.969449766636366 | CU45: =1-(LN(1-CU$1))/$A45 -> 9.890961375973129 | CV45: =1-(LN(1-CV$1))/$A45 -> 11.466295877245807
A46: =A45+0.01 -> 00.45 | B46: =1-(LN(1-B$1))/$A46 -> 1.0223340796744476 | C46: =1-(LN(1-C$1))/$A46 -> 1.0448949051500431 | D46: =1-(LN(1-D$1))/$A46 -> 1.0676871277437967 | E46: =1-(LN(1-E$1))/$A46 -> 1.0907155433783449 | F46: =1-(LN(1-F$1))/$A46 -> 1.1139850986390012 | G46: =1-(LN(1-G$1))/$A46 -> 1.1375008971513056 | H46: =1-(LN(1-H$1))/$A46 -> 1.1612682062996345 | I46: =1-(LN(1-I$1))/$A46 -> 1.1852924643090021 | J46: =1-(LN(1-J$1))/$A46 -> 1.2095792877138694 | K46: =1-(LN(1-K$1))/$A46 -> 1.2341344792396138 | L46: =1-(LN(1-L$1))/$A46 -> 1.2589640361243366 | M46: =1-(LN(1-M$1))/$A46 -> 1.2840741589108551 | N46: =1-(LN(1-N$1))/$A46 -> 1.3094712607411281 | O46: =1-(LN(1-O$1))/$A46 -> 1.3351619771879635 | P46: =1-(LN(1-P$1))/$A46 -> 1.361153176661722 | Q46: =1-(LN(1-Q$1))/$A46 -> 1.3874519714328393 | R46: =1-(LN(1-R$1))/$A46 -> 1.4140657293144296 | S46: =1-(LN(1-S$1))/$A46 -> 1.4410020860529738 | T46: =1-(LN(1-T$1))/$A46 -> 1.4682689584792279 | U46: =1-(LN(1-U$1))/$A46 -> 1.4958745584760216 | V46: =1-(LN(1-V$1))/$A46 -> 1.5238274078245997 | W46: =1-(LN(1-W$1))/$A46 -> 1.5521363539966657 | X46: =1-(LN(1-X$1))/$A46 -> 1.5808105869653499 | Y46: =1-(LN(1-Y$1))/$A46 -> 1.6098596571150228 | Z46: =1-(LN(1-Z$1))/$A46 -> 1.6392934943372905 | AA46: =1-(LN(1-AA$1))/$A46 -> 1.6691224284087145 | AB46: =1-(LN(1-AB$1))/$A46 -> 1.6993572107548891 | AC46: =1-(LN(1-AC$1))/$A46 -> 1.7300090377156354 | AD46: =1-(LN(1-AD$1))/$A46 -> 1.7610895754372797 | AE46: =1-(LN(1-AE$1))/$A46 -> 1.7926109865305162 | AF46: =1-(LN(1-AF$1))/$A46 -> 1.8245859586462929 | AG46: =1-(LN(1-AG$1))/$A46 -> 1.8570277351377436 | AH46: =1-(LN(1-AH$1))/$A46 -> 1.8899501479936116 | AI46: =1-(LN(1-AI$1))/$A46 -> 1.9233676532481461 | AJ46: =1-(LN(1-AJ$1))/$A46 -> 1.9572953690943427 | AK46: =1-(LN(1-AK$1))/$A46 -> 1.9917491169520432 | AL46: =1-(LN(1-AL$1))/$A46 -> 2.02674546577013 | AM46: =1-(LN(1-AM$1))/$A46 -> 2.0623017798733327 | AN46: =1-(LN(1-AN$1))/$A46 -> 2.0984362706995112 | AO46: =1-(LN(1-AO$1))/$A46 -> 2.1351680528133126 | AP46: =1-(LN(1-AP$1))/$A46 -> 2.1725172046274932 | AQ46: =1-(LN(1-AQ$1))/$A46 -> 2.2105048343148264 | AR46: =1-(LN(1-AR$1))/$A46 -> 2.249153151452314 | AS46: =1-(LN(1-AS$1))/$A46 -> 2.2884855450065382 | AT46: =1-(LN(1-AT$1))/$A46 -> 2.3285266683458232 | AU46: =1-(LN(1-AU$1))/$A46 -> 2.3693025320529264 | AV46: =1-(LN(1-AV$1))/$A46 -> 2.4108406054132656 | AW46: =1-(LN(1-AW$1))/$A46 -> 2.4531699275703645 | AX46: =1-(LN(1-AX$1))/$A46 -> 2.4963212294750345 | AY46: =1-(LN(1-AY$1))/$A46 -> 2.5403270679109897 | AZ46: =1-(LN(1-AZ$1))/$A46 -> 2.5852219730610333 | BA46: =1-(LN(1-BA$1))/$A46 -> 2.6310426112893346 | BB46: =1-(LN(1-BB$1))/$A46 -> 2.6778279650622956 | BC46: =1-(LN(1-BC$1))/$A46 -> 2.7256195322199925 | BD46: =1-(LN(1-BD$1))/$A46 -> 2.774461547150604 | BE46: =1-(LN(1-BE$1))/$A46 -> 2.8244012268218452 | BF46: =1-(LN(1-BF$1))/$A46 -> 2.8754890450989539 | BG46: =1-(LN(1-BG$1))/$A46 -> 2.9277790393438297 | BH46: =1-(LN(1-BH$1))/$A46 -> 2.9813291539639639 | BI46: =1-(LN(1-BI$1))/$A46 -> 3.0362016263870122 | BJ46: =1-(LN(1-BJ$1))/$A46 -> 3.0924634219076559 | BK46: =1-(LN(1-BK$1))/$A46 -> 3.1501867250260132 | BL46: =1-(LN(1-BL$1))/$A46 -> 3.2094494963197051 | BM46: =1-(LN(1-BM$1))/$A46 -> 3.270336105626626 | BN46: =1-(LN(1-BN$1))/$A46 -> 3.3329380544415073 | BO46: =1-(LN(1-BO$1))/$A46 -> 3.3973548030487346 | BP46: =1-(LN(1-BP$1))/$A46 -> 3.4636947211591371 | BQ46: =1-(LN(1-BQ$1))/$A46 -> 3.5320761848630342 | BR46: =1-(LN(1-BR$1))/$A46 -> 3.6026288477843242 | BS46: =1-(LN(1-BS$1))/$A46 -> 3.6754951207243036 | BT46: =1-(LN(1-BT$1))/$A46 -> 3.7508319022258179 | BU46: =1-(LN(1-BU$1))/$A46 -> 3.8288126129175293 | BV46: =1-(LN(1-BV$1))/$A46 -> 3.9096295999639179 | BW46: =1-(LN(1-BW$1))/$A46 -> 3.9934969954813564 | BX46: =1-(LN(1-BX$1))/$A46 -> 4.0806541358219812 | BY46: =1-(LN(1-BY$1))/$A46 -> 4.1713696792003265 | BZ46: =1-(LN(1-BZ$1))/$A46 -> 4.2659466001309845 | CA46: =1-(LN(1-CA$1))/$A46 -> 4.3647282947328376 | CB46: =1-(LN(1-CB$1))/$A46 -> 4.4681061072548216 | CC46: =1-(LN(1-CC$1))/$A46 -> 4.5765286942980037 | CD46: =1-(LN(1-CD$1))/$A46 -> 4.690513792937006 | CE46: =1-(LN(1-CE$1))/$A46 -> 4.8106631735376197 | CF46: =1-(LN(1-CF$1))/$A46 -> 4.937681870959727 | CG46: =1-(LN(1-CG$1))/$A46 -> 5.0724032527740279 | CH46: =1-(LN(1-CH$1))/$A46 -> 5.2158221886352978 | CI46: =1-(LN(1-CI$1))/$A46 -> 5.3691396808285239 | CJ46: =1-(LN(1-CJ$1))/$A46 -> 5.533824063392351 | CK46: =1-(LN(1-CK$1))/$A46 -> 5.711696747111322 | CL46: =1-(LN(1-CL$1))/$A46 -> 5.9050553626438331 | CM46: =1-(LN(1-CM$1))/$A46 -> 6.116855762209001 | CN46: =1-(LN(1-CN$1))/$A46 -> 6.3509902414486161 | CO46: =1-(LN(1-CO$1))/$A46 -> 6.6127303206850252 | CP46: =1-(LN(1-CP$1))/$A46 -> 6.9094667487395229 | CQ46: =1-(LN(1-CQ$1))/$A46 -> 7.2520238150223229 | CR46: =1-(LN(1-CR$1))/$A46 -> 7.6571828301200036 | CS46: =1-(LN(1-CS$1))/$A46 -> 8.1530573885960322 | CT46: =1-(LN(1-CT$1))/$A46 -> 8.7923508829333361 | CU46: =1-(LN(1-CU$1))/$A46 -> 9.6933844565070579 | CV46: =1-(LN(1-CV$1))/$A46 -> 11.233711524418123
A47: =A46+0.01 -> 00.46 | B47: =1-(LN(1-B$1))/$A47 -> 1.021848556203264 | C47: =1-(LN(1-C$1))/$A47 -> 1.0439189289511293 | D47: =1-(LN(1-D$1))/$A47 -> 1.0662156684450186 | E47: =1-(LN(1-E$1))/$A47 -> 1.0887434663483808 | F47: =1-(LN(1-F$1))/$A47 -> 1.1115071617120664 | G47: =1-(LN(1-G$1))/$A47 -> 1.1345117472132338 | H47: =1-(LN(1-H$1))/$A47 -> 1.1577623757279032 | I47: =1-(LN(1-I$1))/$A47 -> 1.1812643672588066 | J47: =1-(LN(1-J$1))/$A47 -> 1.2050232162418288 | K47: =1-(LN(1-K$1))/$A47 -> 1.2290445992561441 | L47: =1-(LN(1-L$1))/$A47 -> 1.2533343831651118 | M47: =1-(LN(1-M$1))/$A47 -> 1.277898633717141 | N47: =1-(LN(1-N$1))/$A47 -> 1.3027436246380599 | O47: =1-(LN(1-O$1))/$A47 -> 1.3278758472490948 | P47: =1-(LN(1-P$1))/$A47 -> 1.3533020206473365 | Q47: =1-(LN(1-Q$1))/$A47 -> 1.3790291024886472 | R47: =1-(LN(1-R$1))/$A47 -> 1.4050643004162899 | S47: =1-(LN(1-S$1))/$A47 -> 1.431415084182257 | T47: =1-(LN(1-T$1))/$A47 -> 1.4580891985122881 | U47: =1-(LN(1-U$1))/$A47 -> 1.485094676770021 | V47: =1-(LN(1-V$1))/$A47 -> 1.5124398554805865 | W47: =1-(LN(1-W$1))/$A47 -> 1.540133389779347 | X47: =1-(LN(1-X$1))/$A47 -> 1.5681842698574076 | Y47: =1-(LN(1-Y$1))/$A47 -> 1.5966018384820875 | Z47: =1-(LN(1-Z$1))/$A47 -> 1.6253958096777841 | AA47: =1-(LN(1-AA$1))/$A47 -> 1.6545762886606989 | AB47: =1-(LN(1-AB$1))/$A47 -> 1.6841537931297828 | AC47: =1-(LN(1-AC$1))/$A47 -> 1.7141392760261651 | AD47: =1-(LN(1-AD$1))/$A47 -> 1.7445441498842953 | AE47: =1-(LN(1-AE$1))/$A47 -> 1.7753803129102876 | AF47: =1-(LN(1-AF$1))/$A47 -> 1.8066601769365911 | AG47: =1-(LN(1-AG$1))/$A47 -> 1.8383966974173578 | AH47: =1-(LN(1-AH$1))/$A47 -> 1.8706034056459244 | AI47: =1-(LN(1-AI$1))/$A47 -> 1.9032944433949255 | AJ47: =1-(LN(1-AJ$1))/$A47 -> 1.9364846002009872 | AK47: =1-(LN(1-AK$1))/$A47 -> 1.9701893535400421 | AL47: =1-(LN(1-AL$1))/$A47 -> 2.0044249121664315 | AM47: =1-(LN(1-AM$1))/$A47 -> 2.0392082629195647 | AN47: =1-(LN(1-AN$1))/$A47 -> 2.0745572213364785 | AO47: =1-(LN(1-AO$1))/$A47 -> 2.110490486447806 | AP47: =1-(LN(1-AP$1))/$A47 -> 2.1470277001790694 | AQ47: =1-(LN(1-AQ$1))/$A47 -> 2.1841895118297217 | AR47: =1-(LN(1-AR$1))/$A47 -> 2.2219976481598724 | AS47: =1-(LN(1-AS$1))/$A47 -> 2.2604749896803091 | AT47: =1-(LN(1-AT$1))/$A47 -> 2.2996456538165662 | AU47: =1-(LN(1-AU$1))/$A47 -> 2.3395350857039499 | AV47: =1-(LN(1-AV$1))/$A47 -> 2.3801701574694993 | AW47: =1-(LN(1-AW$1))/$A47 -> 2.4215792769710087 | AX47: =1-(LN(1-AX$1))/$A47 -> 2.4637925070951425 | AY47: =1-(LN(1-AY$1))/$A47 -> 2.5068416968694462 | AZ47: =1-(LN(1-AZ$1))/$A47 -> 2.5507606258205757 | BA47: =1-(LN(1-BA$1))/$A47 -> 2.5955851632178275 | BB47: =1-(LN(1-BB$1))/$A47 -> 2.6413534440826805 | BC47: =1-(LN(1-BC$1))/$A47 -> 2.6881060641282533 | BD47: =1-(LN(1-BD$1))/$A47 -> 2.7358862961255905 | BE47: =1-(LN(1-BE$1))/$A47 -> 2.7847403305865877 | BF47: =1-(LN(1-BF$1))/$A47 -> 2.8347175441185417 | BG47: =1-(LN(1-BG$1))/$A47 -> 2.8858707993580941 | BH47: =1-(LN(1-BH$1))/$A47 -> 2.9382567810517042 | BI47: =1-(LN(1-BI$1))/$A47 -> 2.9919363736394682 | BJ47: =1-(LN(1-BJ$1))/$A47 -> 3.0469750866487941 | BK47: =1-(LN(1-BK$1))/$A47 -> 3.1034435353515346 | BL47: =1-(LN(1-BL$1))/$A47 -> 3.1614179855301461 | BM47: =1-(LN(1-BM$1))/$A47 -> 3.2209809728956125 | BN47: =1-(LN(1-BN$1))/$A47 -> 3.2822220097797352 | BO47: =1-(LN(1-BO$1))/$A47 -> 3.3452383942868056 | BP47: =1-(LN(1-BP$1))/$A47 -> 3.4101361402643731 | BQ47: =1-(LN(1-BQ$1))/$A47 -> 3.4770310504094897 | BR47: =1-(LN(1-BR$1))/$A47 -> 3.5460499597890127 | BS47: =1-(LN(1-BS$1))/$A47 -> 3.6173321833172536 | BT47: =1-(LN(1-BT$1))/$A47 -> 3.6910312086991697 | BU47: =1-(LN(1-BU$1))/$A47 -> 3.7673166865497572 | BV47: =1-(LN(1-BV$1))/$A47 -> 3.8463767825733979 | BW47: =1-(LN(1-BW$1))/$A47 -> 3.9284209738404572 | BX47: =1-(LN(1-BX$1))/$A47 -> 4.0136833937388943 | BY47: =1-(LN(1-BY$1))/$A47 -> 4.1024268600872755 | BZ47: =1-(LN(1-BZ$1))/$A47 -> 4.1949477609977022 | CA47: =1-(LN(1-CA$1))/$A47 -> 4.2915820274560375 | CB47: =1-(LN(1-CB$1))/$A47 -> 4.392712496227543 | CC47: =1-(LN(1-CC$1))/$A47 -> 4.4987780705089175 | CD47: =1-(LN(1-CD$1))/$A47 -> 4.610285232220984 | CE47: =1-(LN(1-CE$1))/$A47 -> 4.7278226697650627 | CF47: =1-(LN(1-CF$1))/$A47 -> 4.8520800911562549 | CG47: =1-(LN(1-CG$1))/$A47 -> 4.9838727472789399 | CH47: =1-(LN(1-CH$1))/$A47 -> 5.1241738801867038 | CI47: =1-(LN(1-CI$1))/$A47 -> 5.2741583834192083 | CJ47: =1-(LN(1-CJ$1))/$A47 -> 5.4352626707099088 | CK47: =1-(LN(1-CK$1))/$A47 -> 5.609268556956728 | CL47: =1-(LN(1-CL$1))/$A47 -> 5.798423724325489 | CM47: =1-(LN(1-CM$1))/$A47 -> 6.0056197673783709 | CN47: =1-(LN(1-CN$1))/$A47 -> 6.2346643666345161 | CO47: =1-(LN(1-CO$1))/$A47 -> 6.4907144441483942 | CP47: =1-(LN(1-CP$1))/$A47 -> 6.7810000802886643 | CQ47: =1-(LN(1-CQ$1))/$A47 -> 7.1161102538261849 | CR47: =1-(LN(1-CR$1))/$A47 -> 7.5124614642478296 | CS47: =1-(LN(1-CS$1))/$A47 -> 7.9975561410178582 | CT47: =1-(LN(1-CT$1))/$A47 -> 8.6229519506956542 | CU47: =1-(LN(1-CU$1))/$A47 -> 9.5043978378873391 | CV47: =1-(LN(1-CV$1))/$A47 -> 11.011239534756859
A48: =A47+0.01 -> 00.47 | B48: =1-(LN(1-B$1))/$A48 -> 1.0213836933053222 | C48: =1-(LN(1-C$1))/$A48 -> 1.0429844836542967 | D48: =1-(LN(1-D$1))/$A48 -> 1.0648068244355502 | E48: =1-(LN(1-E$1))/$A48 -> 1.0868553074899046 | F48: =1-(LN(1-F$1))/$A48 -> 1.1091346689096819 | G48: =1-(LN(1-G$1))/$A48 -> 1.131649795144867 | H48: =1-(LN(1-H$1))/$A48 -> 1.1544057294358201 | I48: =1-(LN(1-I$1))/$A48 -> 1.1774076785937255 | J48: =1-(LN(1-J$1))/$A48 -> 1.2006610201515771 | K48: =1-(LN(1-K$1))/$A48 -> 1.2241713099102687 | L48: =1-(LN(1-L$1))/$A48 -> 1.2479442899062796 | M48: =1-(LN(1-M$1))/$A48 -> 1.2719858968295421 | N48: =1-(LN(1-N$1))/$A48 -> 1.2963022709223566 | O48: =1-(LN(1-O$1))/$A48 -> 1.320899765392731 | P48: =1-(LN(1-P$1))/$A48 -> 1.3457849563782442 | Q48: =1-(LN(1-Q$1))/$A48 -> 1.370964653499527 | R48: =1-(LN(1-R$1))/$A48 -> 1.3964459110457306 | S48: =1-(LN(1-S$1))/$A48 -> 1.4222360398379537 | T48: =1-(LN(1-T$1))/$A48 -> 1.4483426198205374 | U48: =1-(LN(1-U$1))/$A48 -> 1.4747735134344888 | V48: =1-(LN(1-V$1))/$A48 -> 1.5015368798320634 | W48: =1-(LN(1-W$1))/$A48 -> 1.5286411899968075 | X48: =1-(LN(1-X$1))/$A48 -> 1.5560952428391648 | Y48: =1-(LN(1-Y$1))/$A48 -> 1.5839081823441707 | Z48: =1-(LN(1-Z$1))/$A48 -> 1.6120895158548527 | AA48: =1-(LN(1-AA$1))/$A48 -> 1.6406491335828117 | AB48: =1-(LN(1-AB$1))/$A48 -> 1.6695973294461703 | AC48: =1-(LN(1-AC$1))/$A48 -> 1.6989448233447573 | AD48: =1-(LN(1-AD$1))/$A48 -> 1.72870278499314 | AE48: =1-(LN(1-AE$1))/$A48 -> 1.7588828594441113 | AF48: =1-(LN(1-AF$1))/$A48 -> 1.7894971944485785 | AG48: =1-(LN(1-AG$1))/$A48 -> 1.8205584698127333 | AH48: =1-(LN(1-AH$1))/$A48 -> 1.8520799289300536 | AI48: =1-(LN(1-AI$1))/$A48 -> 1.8840754126843953 | AJ48: =1-(LN(1-AJ$1))/$A48 -> 1.9165593959413918 | AK48: =1-(LN(1-AK$1))/$A48 -> 1.9495470268689774 | AL48: =1-(LN(1-AL$1))/$A48 -> 1.9830541693543799 | AM48: =1-(LN(1-AM$1))/$A48 -> 2.0170974488148934 | AN48: =1-(LN(1-AN$1))/$A48 -> 2.0516943017335745 | AO48: =1-(LN(1-AO$1))/$A48 -> 2.0868630292893418 | AP48: =1-(LN(1-AP$1))/$A48 -> 2.1226228554944084 | AQ48: =1-(LN(1-AQ$1))/$A48 -> 2.1589939903014299 | AR48: =1-(LN(1-AR$1))/$A48 -> 2.1959976981990241 | AS48: =1-(LN(1-AS$1))/$A48 -> 2.2336563728786003 | AT48: =1-(LN(1-AT$1))/$A48 -> 2.2719936186289793 | AU48: =1-(LN(1-AU$1))/$A48 -> 2.3110343391996104 | AV48: =1-(LN(1-AV$1))/$A48 -> 2.3508048349701482 | AW48: =1-(LN(1-AW$1))/$A48 -> 2.3913329093758806 | AX48: =1-(LN(1-AX$1))/$A48 -> 2.4326479856675864 | AY48: =1-(LN(1-AY$1))/$A48 -> 2.4747812352339262 | AZ48: =1-(LN(1-AZ$1))/$A48 -> 2.517765718888223 | BA48: =1-(LN(1-BA$1))/$A48 -> 2.5616365427238312 | BB48: =1-(LN(1-BB$1))/$A48 -> 2.6064310303787934 | BC48: =1-(LN(1-BC$1))/$A48 -> 2.6521889138276524 | BD48: =1-(LN(1-BD$1))/$A48 -> 2.6989525451441949 | BE48: =1-(LN(1-BE$1))/$A48 -> 2.7467671320634688 | BF48: =1-(LN(1-BF$1))/$A48 -> 2.7956810006266579 | BG48: =1-(LN(1-BG$1))/$A48 -> 2.8457458887334539 | BH48: =1-(LN(1-BH$1))/$A48 -> 2.8970172750718808 | BI48: =1-(LN(1-BI$1))/$A48 -> 2.9495547486684157 | BJ48: =1-(LN(1-BJ$1))/$A48 -> 3.0034224252307347 | BK48: =1-(LN(1-BK$1))/$A48 -> 3.0586894175780976 | BL48: =1-(LN(1-BL$1))/$A48 -> 3.1154303688167388 | BM48: =1-(LN(1-BM$1))/$A48 -> 3.1737260585786848 | BN48: =1-(LN(1-BN$1))/$A48 -> 3.2336640946780388 | BO48: =1-(LN(1-BO$1))/$A48 -> 3.2953397050466608 | BP48: =1-(LN(1-BP$1))/$A48 -> 3.3588566479183228 | BQ48: =1-(LN(1-BQ$1))/$A48 -> 3.4243282621029048 | BR48: =1-(LN(1-BR$1))/$A48 -> 3.491878684048821 | BS48: =1-(LN(1-BS$1))/$A48 -> 3.5616442645232693 | BT48: =1-(LN(1-BT$1))/$A48 -> 3.6337752255353575 | BU48: =1-(LN(1-BU$1))/$A48 -> 3.7084376081125283 | BV48: =1-(LN(1-BV$1))/$A48 -> 3.7858155744335384 | BW48: =1-(LN(1-BW$1))/$A48 -> 3.8661141446098091 | BX48: =1-(LN(1-BX$1))/$A48 -> 3.9495624704678547 | BY48: =1-(LN(1-BY$1))/$A48 -> 4.0364177779577588 | BZ48: =1-(LN(1-BZ$1))/$A48 -> 4.1269701490615809 | CA48: =1-(LN(1-CA$1))/$A48 -> 4.2215483672973981 | CB48: =1-(LN(1-CB$1))/$A48 -> 4.3205271239673824 | CC48: =1-(LN(1-CC$1))/$A48 -> 4.4243359839023446 | CD48: =1-(LN(1-CD$1))/$A48 -> 4.533470652812027 | CE48: =1-(LN(1-CE$1))/$A48 -> 4.6485072938126137 | CF48: =1-(LN(1-CF$1))/$A48 -> 4.7701209402805897 | CG48: =1-(LN(1-CG$1))/$A48 -> 4.899109497336835 | CH48: =1-(LN(1-CH$1))/$A48 -> 5.0364254997571996 | CI48: =1-(LN(1-CI$1))/$A48 -> 5.1832188433464585 | CJ48: =1-(LN(1-CJ$1))/$A48 -> 5.3408953798437402 | CK48: =1-(LN(1-CK$1))/$A48 -> 5.5111990131916908 | CL48: =1-(LN(1-CL$1))/$A48 -> 5.6963296025313293 | CM48: =1-(LN(1-CM$1))/$A48 -> 5.8991172191362775 | CN48: =1-(LN(1-CN$1))/$A48 -> 6.1232885290465475 | CO48: =1-(LN(1-CO$1))/$A48 -> 6.3738907325707688 | CP48: =1-(LN(1-CP$1))/$A48 -> 6.6580000785803941 | CQ48: =1-(LN(1-CQ$1))/$A48 -> 6.9859802484256281 | CR48: =1-(LN(1-CR$1))/$A48 -> 7.3738984543702166 | CS48: =1-(LN(1-CS$1))/$A48 -> 7.8486719678047123 | CT48: =1-(LN(1-CT$1))/$A48 -> 8.4607614836595779 | CU48: =1-(LN(1-CU$1))/$A48 -> 9.3234532030386728 | CV48: =1-(LN(1-CV$1))/$A48 -> 10.79823443827267
A49: =A48+0.01 -> 00.48 | B49: =1-(LN(1-B$1))/$A49 -> 1.0209381996947946 | C49: =1-(LN(1-C$1))/$A49 -> 1.0420889735781655 | D49: =1-(LN(1-D$1))/$A49 -> 1.0634566822598095 | E49: =1-(LN(1-E$1))/$A49 -> 1.0850458219171981 | F49: =1-(LN(1-F$1))/$A49 -> 1.1068610299740635 | G49: =1-(LN(1-G$1))/$A49 -> 1.1289070910793488 | H49: =1-(LN(1-H$1))/$A49 -> 1.1511889434059073 | I49: =1-(LN(1-I$1))/$A49 -> 1.1737116852896896 | J49: =1-(LN(1-J$1))/$A49 -> 1.1964805822317526 | K49: =1-(LN(1-K$1))/$A49 -> 1.2195010742871379 | L49: =1-(LN(1-L$1))/$A49 -> 1.2427787838665656 | M49: =1-(LN(1-M$1))/$A49 -> 1.2663195239789267 | N49: =1-(LN(1-N$1))/$A49 -> 1.2901293069448074 | O49: =1-(LN(1-O$1))/$A49 -> 1.3142143536137159 | P49: =1-(LN(1-P$1))/$A49 -> 1.3385811031203643 | Q49: =1-(LN(1-Q$1))/$A49 -> 1.3632362232182869 | R49: =1-(LN(1-R$1))/$A49 -> 1.3881866212322778 | S49: =1-(LN(1-S$1))/$A49 -> 1.413439455674663 | T49: =1-(LN(1-T$1))/$A49 -> 1.4390021485742761 | U49: =1-(LN(1-U$1))/$A49 -> 1.4648823985712702 | V49: =1-(LN(1-V$1))/$A49 -> 1.4910881948355621 | W49: =1-(LN(1-W$1))/$A49 -> 1.5176278318718741 | X49: =1-(LN(1-X$1))/$A49 -> 1.5445099252800156 | Y49: =1-(LN(1-Y$1))/$A49 -> 1.571743428545334 | Z49: =1-(LN(1-Z$1))/$A49 -> 1.5993376509412098 | AA49: =1-(LN(1-AA$1))/$A49 -> 1.6273022766331697 | AB49: =1-(LN(1-AB$1))/$A49 -> 1.6556473850827085 | AC49: =1-(LN(1-AC$1))/$A49 -> 1.6843834728584082 | AD49: =1-(LN(1-AD$1))/$A49 -> 1.7135214769724496 | AE49: =1-(LN(1-AE$1))/$A49 -> 1.7430727998723587 | AF49: =1-(LN(1-AF$1))/$A49 -> 1.7730493362308999 | AG49: =1-(LN(1-AG$1))/$A49 -> 1.8034635016916345 | AH49: =1-(LN(1-AH$1))/$A49 -> 1.8343282637440108 | AI49: =1-(LN(1-AI$1))/$A49 -> 1.8656571749201369 | AJ49: =1-(LN(1-AJ$1))/$A49 -> 1.8974644085259462 | AK49: =1-(LN(1-AK$1))/$A49 -> 1.9297647971425405 | AL49: =1-(LN(1-AL$1))/$A49 -> 1.9625738741594971 | AM49: =1-(LN(1-AM$1))/$A49 -> 1.9959079186312496 | AN49: =1-(LN(1-AN$1))/$A49 -> 2.0297840037807919 | AO49: =1-(LN(1-AO$1))/$A49 -> 2.0642200495124805 | AP49: =1-(LN(1-AP$1))/$A49 -> 2.0992348793382751 | AQ49: =1-(LN(1-AQ$1))/$A49 -> 2.1348482821701502 | AR49: =1-(LN(1-AR$1))/$A49 -> 2.1710810794865445 | AS49: =1-(LN(1-AS$1))/$A49 -> 2.2079551984436296 | AT49: =1-(LN(1-AT$1))/$A49 -> 2.2454937515742093 | AU49: =1-(LN(1-AU$1))/$A49 -> 2.2837211237996184 | AV49: =1-(LN(1-AV$1))/$A49 -> 2.3226630675749367 | AW49: =1-(LN(1-AW$1))/$A49 -> 2.3623468070972167 | AX49: =1-(LN(1-AX$1))/$A49 -> 2.4028011526328452 | AY49: =1-(LN(1-AY$1))/$A49 -> 2.4440566261665531 | AZ49: =1-(LN(1-AZ$1))/$A49 -> 2.4861455997447184 | BA49: =1-(LN(1-BA$1))/$A49 -> 2.5291024480837514 | BB49: =1-(LN(1-BB$1))/$A49 -> 2.5729637172459014 | BC49: =1-(LN(1-BC$1))/$A49 -> 2.6177683114562429 | BD49: =1-(LN(1-BD$1))/$A49 -> 2.6635577004536914 | BE49: =1-(LN(1-BE$1))/$A49 -> 2.7103761501454802 | BF49: =1-(LN(1-BF$1))/$A49 -> 2.7582709797802689 | BG49: =1-(LN(1-BG$1))/$A49 -> 2.8072928493848401 | BH49: =1-(LN(1-BH$1))/$A49 -> 2.8574960818412163 | BI49: =1-(LN(1-BI$1))/$A49 -> 2.9089390247378235 | BJ49: =1-(LN(1-BJ$1))/$A49 -> 2.9616844580384276 | BK49: =1-(LN(1-BK$1))/$A49 -> 3.0158000547118875 | BL49: =1-(LN(1-BL$1))/$A49 -> 3.0713589027997235 | BM49: =1-(LN(1-BM$1))/$A49 -> 3.1284400990249619 | BN49: =1-(LN(1-BN$1))/$A49 -> 3.1871294260389127 | BO49: =1-(LN(1-BO$1))/$A49 -> 3.2475201278581887 | BP49: =1-(LN(1-BP$1))/$A49 -> 3.3097138010866911 | BQ49: =1-(LN(1-BQ$1))/$A49 -> 3.3738214233090944 | BR49: =1-(LN(1-BR$1))/$A49 -> 3.4399645447978036 | BS49: =1-(LN(1-BS$1))/$A49 -> 3.5082766756790345 | BT49: =1-(LN(1-BT$1))/$A49 -> 3.5789049083367042 | BU49: =1-(LN(1-BU$1))/$A49 -> 3.6520118246101836 | BV49: =1-(LN(1-BV$1))/$A49 -> 3.7277777499661733 | BW49: =1-(LN(1-BW$1))/$A49 -> 3.8064034332637715 | BX49: =1-(LN(1-BX$1))/$A49 -> 3.8881132523331075 | BY49: =1-(LN(1-BY$1))/$A49 -> 3.9731590742503058 | BZ49: =1-(LN(1-BZ$1))/$A49 -> 4.0618249376227977 | CA49: =1-(LN(1-CA$1))/$A49 -> 4.154432776312035 | CB49: =1-(LN(1-CB$1))/$A49 -> 4.251349475551395 | CC49: =1-(LN(1-CC$1))/$A49 -> 4.3529956509043792 | CD49: =1-(LN(1-CD$1))/$A49 -> 4.4598566808784428 | CE49: =1-(LN(1-CE$1))/$A49 -> 4.5724967251915185 | CF49: =1-(LN(1-CF$1))/$A49 -> 4.6915767540247444 | CG49: =1-(LN(1-CG$1))/$A49 -> 4.8178780494756506 | CH49: =1-(LN(1-CH$1))/$A49 -> 4.9523333018455915 | CI49: =1-(LN(1-CI$1))/$A49 -> 5.0960684507767411 | CJ49: =1-(LN(1-CJ$1))/$A49 -> 5.2504600594303295 | CK49: =1-(LN(1-CK$1))/$A49 -> 5.4172157004168637 | CL49: =1-(LN(1-CL$1))/$A49 -> 5.5984894024785934 | CM49: =1-(LN(1-CM$1))/$A49 -> 5.7970522770709385 | CN49: =1-(LN(1-CN$1))/$A49 -> 6.0165533513580778 | CO49: =1-(LN(1-CO$1))/$A49 -> 6.2619346756422107 | CP49: =1-(LN(1-CP$1))/$A49 -> 6.540125076943303 | CQ49: =1-(LN(1-CQ$1))/$A49 -> 6.8612723265834274 | CR49: =1-(LN(1-CR$1))/$A49 -> 7.2411089032375031 | CS49: =1-(LN(1-CS$1))/$A49 -> 7.7059913018087807 | CT49: =1-(LN(1-CT$1))/$A49 -> 8.3053289527500027 | CU49: =1-(LN(1-CU$1))/$A49 -> 9.1500479279753666 | CV49: =1-(LN(1-CV$1))/$A49 -> 10.594104554141989
A50: =A49+0.01 -> 00.49 | B50: =1-(LN(1-B$1))/$A50 -> 1.0205108894969417 | C50: =1-(LN(1-C$1))/$A50 -> 1.0412300149337133 | D50: =1-(LN(1-D$1))/$A50 -> 1.0621616479279767 | E50: =1-(LN(1-E$1))/$A50 -> 1.0833101928984799 | F50: =1-(LN(1-F$1))/$A50 -> 1.1046801926276542 | G50: =1-(LN(1-G$1))/$A50 -> 1.126276334118546 | H50: =1-(LN(1-H$1))/$A50 -> 1.1481034547649704 | I50: =1-(LN(1-I$1))/$A50 -> 1.170166548855206 | J50: =1-(LN(1-J$1))/$A50 -> 1.1924707744311045 | K50: =1-(LN(1-K$1))/$A50 -> 1.215021460526176 | L50: =1-(LN(1-L$1))/$A50 -> 1.2378241148080642 | M50: =1-(LN(1-M$1))/$A50 -> 1.2608844316528263 | N50: =1-(LN(1-N$1))/$A50 -> 1.2842083006806277 | O50: =1-(LN(1-O$1))/$A50 -> 1.3078018157848645 | P50: =1-(LN(1-P$1))/$A50 -> 1.3316712846893364 | Q50: =1-(LN(1-Q$1))/$A50 -> 1.355823239070975 | R50: =1-(LN(1-R$1))/$A50 -> 1.380264445288762 | S50: =1-(LN(1-S$1))/$A50 -> 1.4050019157629352 | T50: =1-(LN(1-T$1))/$A50 -> 1.4300429210523522 | U50: =1-(LN(1-U$1))/$A50 -> 1.4553950026820606 | V50: =1-(LN(1-V$1))/$A50 -> 1.4810659867776936 | W50: =1-(LN(1-W$1))/$A50 -> 1.5070639985683667 | X50: =1-(LN(1-X$1))/$A50 -> 1.5333974778253214 | Y50: =1-(LN(1-Y$1))/$A50 -> 1.5600751953097149 | Z50: =1-(LN(1-Z$1))/$A50 -> 1.5871062703097567 | AA50: =1-(LN(1-AA$1))/$A50 -> 1.6145001893549418 | AB50: =1-(LN(1-AB$1))/$A50 -> 1.6422668262034694 | AC50: =1-(LN(1-AC$1))/$A50 -> 1.6704164632082366 | AD50: =1-(LN(1-AD$1))/$A50 -> 1.6989598141770936 | AE50: =1-(LN(1-AE$1))/$A50 -> 1.7279080488545557 | AF50: =1-(LN(1-AF$1))/$A50 -> 1.7572728191649629 | AG50: =1-(LN(1-AG$1))/$A50 -> 1.7870662873713972 | AH50: =1-(LN(1-AH$1))/$A50 -> 1.8173011563206636 | AI50: =1-(LN(1-AI$1))/$A50 -> 1.847990701962583 | AJ50: =1-(LN(1-AJ$1))/$A50 -> 1.8791488083519474 | AK50: =1-(LN(1-AK$1))/$A50 -> 1.9107900053641211 | AL50: =1-(LN(1-AL$1))/$A50 -> 1.9429295093807317 | AM50: =1-(LN(1-AM$1))/$A50 -> 1.9755832672306117 | AN50: =1-(LN(1-AN$1))/$A50 -> 2.0087680037036328 | AO50: =1-(LN(1-AO$1))/$A50 -> 2.0425012729918177 | AP50: =1-(LN(1-AP$1))/$A50 -> 2.0768015144538206 | AQ50: =1-(LN(1-AQ$1))/$A50 -> 2.1116881131462693 | AR50: =1-(LN(1-AR$1))/$A50 -> 2.1471814656194717 | AS50: =1-(LN(1-AS$1))/$A50 -> 2.1833030515366167 | AT50: =1-(LN(1-AT$1))/$A50 -> 2.2200755117461641 | AU50: =1-(LN(1-AU$1))/$A50 -> 2.2575227335179937 | AV50: =1-(LN(1-AV$1))/$A50 -> 2.2956699437468768 | AW50: =1-(LN(1-AW$1))/$A50 -> 2.334543811034008 | AX50: =1-(LN(1-AX$1))/$A50 -> 2.3741725576811543 | AY50: =1-(LN(1-AY$1))/$A50 -> 2.4145860827753989 | AZ50: =1-(LN(1-AZ$1))/$A50 -> 2.4558160977091119 | BA50: =1-(LN(1-BA$1))/$A50 -> 2.4978962756738787 | BB50: =1-(LN(1-BB$1))/$A50 -> 2.5408624168939449 | BC50: =1-(LN(1-BC$1))/$A50 -> 2.5847526316306051 | BD50: =1-(LN(1-BD$1))/$A50 -> 2.6296075433015753 | BE50: =1-(LN(1-BE$1))/$A50 -> 2.6754705144282251 | BF50: =1-(LN(1-BF$1))/$A50 -> 2.7223878985602639 | BG50: =1-(LN(1-BG$1))/$A50 -> 2.7704093218463739 | BH50: =1-(LN(1-BH$1))/$A50 -> 2.8195879985383341 | BI50: =1-(LN(1-BI$1))/$A50 -> 2.8699810854574599 | BJ50: =1-(LN(1-BJ$1))/$A50 -> 2.921650081343766 | BK50: =1-(LN(1-BK$1))/$A50 -> 2.9746612780851143 | BL50: =1-(LN(1-BL$1))/$A50 -> 3.0290862721303413 | BM50: =1-(LN(1-BM$1))/$A50 -> 3.0850025459836363 | BN50: =1-(LN(1-BN$1))/$A50 -> 3.1424941316299555 | BO50: =1-(LN(1-BO$1))/$A50 -> 3.2016523701467969 | BP50: =1-(LN(1-BP$1))/$A50 -> 3.2625767847379827 | BQ50: =1-(LN(1-BQ$1))/$A50 -> 3.3253760881395209 | BR50: =1-(LN(1-BR$1))/$A50 -> 3.3901693500060119 | BS50: =1-(LN(1-BS$1))/$A50 -> 3.4570873557672175 | BT50: =1-(LN(1-BT$1))/$A50 -> 3.5262741959216695 | BU50: =1-(LN(1-BU$1))/$A50 -> 3.5978891343120165 | BV50: =1-(LN(1-BV$1))/$A50 -> 3.6721088162933939 | BW50: =1-(LN(1-BW$1))/$A50 -> 3.7491298938094086 | BX50: =1-(LN(1-BX$1))/$A50 -> 3.8291721655507991 | BY50: =1-(LN(1-BY$1))/$A50 -> 3.9124823584492794 | BZ50: =1-(LN(1-BZ$1))/$A50 -> 3.9993387144060057 | CA50: =1-(LN(1-CA$1))/$A50 -> 4.0900565972036258 | CB50: =1-(LN(1-CB$1))/$A50 -> 4.184995404621775 | CC50: =1-(LN(1-CC$1))/$A50 -> 4.2845671682328614 | CD50: =1-(LN(1-CD$1))/$A50 -> 4.3892473608605158 | CE50: =1-(LN(1-CE$1))/$A50 -> 4.4995886287590379 | CF50: =1-(LN(1-CF$1))/$A50 -> 4.6162384529221985 | CG50: =1-(LN(1-CG$1))/$A50 -> 4.7399621709149233 | CH50: =1-(LN(1-CH$1))/$A50 -> 4.8716734385426204 | CI50: =1-(LN(1-CI$1))/$A50 -> 5.0124752170874194 | CJ50: =1-(LN(1-CJ$1))/$A50 -> 5.163715976584812 | CK50: =1-(LN(1-CK$1))/$A50 -> 5.3270684412246831 | CL50: =1-(LN(1-CL$1))/$A50 -> 5.50464267997903 | CM50: =1-(LN(1-CM$1))/$A50 -> 5.6991532510082665 | CN50: =1-(LN(1-CN$1))/$A50 -> 5.914174711534443 | CO50: =1-(LN(1-CO$1))/$A50 -> 6.1545482536903293 | CP50: =1-(LN(1-CP$1))/$A50 -> 6.4270612998628271 | CQ50: =1-(LN(1-CQ$1))/$A50 -> 6.7416545240000918 | CR50: =1-(LN(1-CR$1))/$A50 -> 7.113739333783677 | CS50: =1-(LN(1-CS$1))/$A50 -> 7.5691343364657442 | CT50: =1-(LN(1-CT$1))/$A50 -> 8.156240606775512 | CU50: =1-(LN(1-CU$1))/$A50 -> 8.9837204192411768 | CV50: =1-(LN(1-CV$1))/$A50 -> 10.398306502016643
A51: =A50+0.01 -> 00.5 | B51: =1-(LN(1-B$1))/$A51 -> 1.0201006717070029 | C51: =1-(LN(1-C$1))/$A51 -> 1.040405414635039 | D51: =1-(LN(1-D$1))/$A51 -> 1.0609184149694171 | E51: =1-(LN(1-E$1))/$A51 -> 1.0816439890405103 | F51: =1-(LN(1-F$1))/$A51 -> 1.1025865887751012 | G51: =1-(LN(1-G$1))/$A51 -> 1.1237508074361751 | H51: =1-(LN(1-H$1))/$A51 -> 1.1451413856696711 | I51: =1-(LN(1-I$1))/$A51 -> 1.166763217878102 | J51: =1-(LN(1-J$1))/$A51 -> 1.1886213589424826 | K51: =1-(LN(1-K$1))/$A51 -> 1.2107210313156525 | L51: =1-(LN(1-L$1))/$A51 -> 1.233067632511903 | M51: =1-(LN(1-M$1))/$A51 -> 1.2556667430197697 | N51: =1-(LN(1-N$1))/$A51 -> 1.2785241346670153 | O51: =1-(LN(1-O$1))/$A51 -> 1.3016457794691672 | P51: =1-(LN(1-P$1))/$A51 -> 1.3250378589955498 | Q51: =1-(LN(1-Q$1))/$A51 -> 1.3487067742895555 | R51: =1-(LN(1-R$1))/$A51 -> 1.3726591563829869 | S51: =1-(LN(1-S$1))/$A51 -> 1.3969018774476765 | T51: =1-(LN(1-T$1))/$A51 -> 1.4214420626313051 | U51: =1-(LN(1-U$1))/$A51 -> 1.4462871026284194 | V51: =1-(LN(1-V$1))/$A51 -> 1.4714446670421397 | W51: =1-(LN(1-W$1))/$A51 -> 1.4969227185969993 | X51: =1-(LN(1-X$1))/$A51 -> 1.5227295282688149 | Y51: =1-(LN(1-Y$1))/$A51 -> 1.5488736914035206 | Z51: =1-(LN(1-Z$1))/$A51 -> 1.5753641449035616 | AA51: =1-(LN(1-AA$1))/$A51 -> 1.602210185567843 | AB51: =1-(LN(1-AB$1))/$A51 -> 1.6294214896794001 | AC51: =1-(LN(1-AC$1))/$A51 -> 1.6570081339440719 | AD51: =1-(LN(1-AD$1))/$A51 -> 1.6849806178935518 | AE51: =1-(LN(1-AE$1))/$A51 -> 1.7133498878774645 | AF51: =1-(LN(1-AF$1))/$A51 -> 1.7421273627816638 | AG51: =1-(LN(1-AG$1))/$A51 -> 1.7713249616239692 | AH51: =1-(LN(1-AH$1))/$A51 -> 1.8009551331942504 | AI51: =1-(LN(1-AI$1))/$A51 -> 1.8310308879233315 | AJ51: =1-(LN(1-AJ$1))/$A51 -> 1.8615658321849085 | AK51: =1-(LN(1-AK$1))/$A51 -> 1.8925742052568388 | AL51: =1-(LN(1-AL$1))/$A51 -> 1.9240709191931171 | AM51: =1-(LN(1-AM$1))/$A51 -> 1.9560716018859996 | AN51: =1-(LN(1-AN$1))/$A51 -> 1.9885926436295602 | AO51: =1-(LN(1-AO$1))/$A51 -> 2.0216512475319814 | AP51: =1-(LN(1-AP$1))/$A51 -> 2.0552654841647442 | AQ51: =1-(LN(1-AQ$1))/$A51 -> 2.0894543508833441 | AR51: =1-(LN(1-AR$1))/$A51 -> 2.1242378363070826 | AS51: =1-(LN(1-AS$1))/$A51 -> 2.1596369905058843 | AT51: =1-(LN(1-AT$1))/$A51 -> 2.1956740015112413 | AU51: =1-(LN(1-AU$1))/$A51 -> 2.2323722788476341 | AV51: =1-(LN(1-AV$1))/$A51 -> 2.2697565448719392 | AW51: =1-(LN(1-AW$1))/$A51 -> 2.3078529348133281 | AX51: =1-(LN(1-AX$1))/$A51 -> 2.3466891065275313 | AY51: =1-(LN(1-AY$1))/$A51 -> 2.3862943611198908 | AZ51: =1-(LN(1-AZ$1))/$A51 -> 2.4266997757549298 | BA51: =1-(LN(1-BA$1))/$A51 -> 2.4679383501604013 | BB51: =1-(LN(1-BB$1))/$A51 -> 2.5100451685560659 | BC51: =1-(LN(1-BC$1))/$A51 -> 2.5530575789979935 | BD51: =1-(LN(1-BD$1))/$A51 -> 2.5970153924355435 | BE51: =1-(LN(1-BE$1))/$A51 -> 2.6419611041396607 | BF51: =1-(LN(1-BF$1))/$A51 -> 2.6879401405890588 | BG51: =1-(LN(1-BG$1))/$A51 -> 2.7350011354094468 | BH51: =1-(LN(1-BH$1))/$A51 -> 2.7831962385675677 | BI51: =1-(LN(1-BI$1))/$A51 -> 2.8325814637483111 | BJ51: =1-(LN(1-BJ$1))/$A51 -> 2.8832170797168906 | BK51: =1-(LN(1-BK$1))/$A51 -> 2.9351680525234123 | BL51: =1-(LN(1-BL$1))/$A51 -> 2.9885045466877349 | BM51: =1-(LN(1-BM$1))/$A51 -> 3.0433024950639638 | BN51: =1-(LN(1-BN$1))/$A51 -> 3.0996442489973566 | BO51: =1-(LN(1-BO$1))/$A51 -> 3.1576193227438614 | BP51: =1-(LN(1-BP$1))/$A51 -> 3.2173252490432236 | BQ51: =1-(LN(1-BQ$1))/$A51 -> 3.278868566376731 | BR51: =1-(LN(1-BR$1))/$A51 -> 3.3423659630058919 | BS51: =1-(LN(1-BS$1))/$A51 -> 3.4079456086518736 | BT51: =1-(LN(1-BT$1))/$A51 -> 3.4757487120032367 | BU51: =1-(LN(1-BU$1))/$A51 -> 3.5459313516257764 | BV51: =1-(LN(1-BV$1))/$A51 -> 3.6186666399675262 | BW51: =1-(LN(1-BW$1))/$A51 -> 3.6941472959332207 | BX51: =1-(LN(1-BX$1))/$A51 -> 3.7725887222397834 | BY51: =1-(LN(1-BY$1))/$A51 -> 3.8542327112802939 | BZ51: =1-(LN(1-BZ$1))/$A51 -> 3.939351940117886 | CA51: =1-(LN(1-CA$1))/$A51 -> 4.0282554652595541 | CB51: =1-(LN(1-CB$1))/$A51 -> 4.1212954965293402 | CC51: =1-(LN(1-CC$1))/$A51 -> 4.2188758248682046 | CD51: =1-(LN(1-CD$1))/$A51 -> 4.3214624136433057 | CE51: =1-(LN(1-CE$1))/$A51 -> 4.4295968561838581 | CF51: =1-(LN(1-CF$1))/$A51 -> 4.5439136838637548 | CG51: =1-(LN(1-CG$1))/$A51 -> 4.6651629274966249 | CH51: =1-(LN(1-CH$1))/$A51 -> 4.7942399697717679 | CI51: =1-(LN(1-CI$1))/$A51 -> 4.9322257127456712 | CJ51: =1-(LN(1-CJ$1))/$A51 -> 5.0804416570531163 | CK51: =1-(LN(1-CK$1))/$A51 -> 5.24052707240019 | CL51: =1-(LN(1-CL$1))/$A51 -> 5.4145498263794503 | CM51: =1-(LN(1-CM$1))/$A51 -> 5.6051701859881016 | CN51: =1-(LN(1-CN$1))/$A51 -> 5.8158912173037551 | CO51: =1-(LN(1-CO$1))/$A51 -> 6.0514572886165228 | CP51: =1-(LN(1-CP$1))/$A51 -> 6.3185200738655709 | CQ51: =1-(LN(1-CQ$1))/$A51 -> 6.6268214335200906 | CR51: =1-(LN(1-CR$1))/$A51 -> 6.9914645471080039 | CS51: =1-(LN(1-CS$1))/$A51 -> 7.4377516497364304 | CT51: =1-(LN(1-CT$1))/$A51 -> 8.0131157946400027 | CU51: =1-(LN(1-CU$1))/$A51 -> 8.8240460108563532 | CV51: =1-(LN(1-CV$1))/$A51 -> 10.210340371976312
A52: =A51+0.01 -> 00.51 | B52: =1-(LN(1-B$1))/$A52 -> 1.0197065408892185 | C52: =1-(LN(1-C$1))/$A52 -> 1.0396131516029794 | D52: =1-(LN(1-D$1))/$A52 -> 1.0597239362445265 | E52: =1-(LN(1-E$1))/$A52 -> 1.0800431265103043 | F52: =1-(LN(1-F$1))/$A52 -> 1.1005750870344129 | G52: =1-(LN(1-G$1))/$A52 -> 1.1213243210158579 | H52: =1-(LN(1-H$1))/$A52 -> 1.1422954761467361 | I52: =1-(LN(1-I$1))/$A52 -> 1.1634933508608842 | J52: =1-(LN(1-J$1))/$A52 -> 1.1849229009240025 | K52: =1-(LN(1-K$1))/$A52 -> 1.2065892463878947 | L52: =1-(LN(1-L$1))/$A52 -> 1.228497678933238 | M52: =1-(LN(1-M$1))/$A52 -> 1.250653669627225 | N52: =1-(LN(1-N$1))/$A52 -> 1.2730628771245247 | O52: =1-(LN(1-O$1))/$A52 -> 1.2957311563423208 | P52: =1-(LN(1-P$1))/$A52 -> 1.3186645676426958 | Q52: =1-(LN(1-Q$1))/$A52 -> 1.3418693865583877 | R52: =1-(LN(1-R$1))/$A52 -> 1.3653521141009675 | S52: =1-(LN(1-S$1))/$A52 -> 1.3891194876938004 | T52: =1-(LN(1-T$1))/$A52 -> 1.4131784927757893 | U52: =1-(LN(1-U$1))/$A52 -> 1.4375363751259016 | V52: =1-(LN(1-V$1))/$A52 -> 1.462200653962882 | W52: =1-(LN(1-W$1))/$A52 -> 1.4871791358794111 | X52: =1-(LN(1-X$1))/$A52 -> 1.5124799296753089 | Y52: =1-(LN(1-Y$1))/$A52 -> 1.5381114621603142 | Z52: =1-(LN(1-Z$1))/$A52 -> 1.5640824950034917 | AA52: =1-(LN(1-AA$1))/$A52 -> 1.5904021427135715 | AB52: =1-(LN(1-AB$1))/$A52 -> 1.6170798918425491 | AC52: =1-(LN(1-AC$1))/$A52 -> 1.6441256215137958 | AD52: =1-(LN(1-AD$1))/$A52 -> 1.6715496253858348 | AE52: =1-(LN(1-AE$1))/$A52 -> 1.6993626351739848 | AF52: =1-(LN(1-AF$1))/$A52 -> 1.7275758458643762 | AG52: =1-(LN(1-AG$1))/$A52 -> 1.7562009427685972 | AH52: =1-(LN(1-AH$1))/$A52 -> 1.7852501305825985 | AI52: =1-(LN(1-AI$1))/$A52 -> 1.8147361646307172 | AJ52: =1-(LN(1-AJ$1))/$A52 -> 1.8446723844950084 | AK52: =1-(LN(1-AK$1))/$A52 -> 1.8750727502518028 | AL52: =1-(LN(1-AL$1))/$A52 -> 1.9059518815618797 | AM52: =1-(LN(1-AM$1))/$A52 -> 1.937325099888235 | AN52: =1-(LN(1-AN$1))/$A52 -> 1.9692084741466278 | AO52: =1-(LN(1-AO$1))/$A52 -> 2.0016188701293935 | AP52: =1-(LN(1-AP$1))/$A52 -> 2.0345740040830824 | AQ52: =1-(LN(1-AQ$1))/$A52 -> 2.0680925008660234 | AR52: =1-(LN(1-AR$1))/$A52 -> 2.1021939571638066 | AS52: =1-(LN(1-AS$1))/$A52 -> 2.1368990102998868 | AT52: =1-(LN(1-AT$1))/$A52 -> 2.1722294132463147 | AU52: =1-(LN(1-AU$1))/$A52 -> 2.2082081165172882 | AV52: =1-(LN(1-AV$1))/$A52 -> 2.2448593577175875 | AW52: =1-(LN(1-AW$1))/$A52 -> 2.28220875962091 | AX52: =1-(LN(1-AX$1))/$A52 -> 2.3202834377720896 | AY52: =1-(LN(1-AY$1))/$A52 -> 2.3591121187449913 | AZ52: =1-(LN(1-AZ$1))/$A52 -> 2.3987252703479705 | BA52: =1-(LN(1-BA$1))/$A52 -> 2.4391552452552956 | BB52: =1-(LN(1-BB$1))/$A52 -> 2.4804364397608492 | BC52: =1-(LN(1-BC$1))/$A52 -> 2.5226054696058755 | BD52: =1-(LN(1-BD$1))/$A52 -> 2.5657013651328859 | BE52: =1-(LN(1-BE$1))/$A52 -> 2.6097657883722167 | BF52: =1-(LN(1-BF$1))/$A52 -> 2.6548432750873125 | BG52: =1-(LN(1-BG$1))/$A52 -> 2.7009815053033792 | BH52: =1-(LN(1-BH$1))/$A52 -> 2.7482316064387922 | BI52: =1-(LN(1-BI$1))/$A52 -> 2.7966484938708929 | BJ52: =1-(LN(1-BJ$1))/$A52 -> 2.8462912546244024 | BK52: =1-(LN(1-BK$1))/$A52 -> 2.897223580905306 | BL52: =1-(LN(1-BL$1))/$A52 -> 2.9495142614585634 | BM52: =1-(LN(1-BM$1))/$A52 -> 3.003237740258788 | BN52: =1-(LN(1-BN$1))/$A52 -> 3.0584747539189769 | BO52: =1-(LN(1-BO$1))/$A52 -> 3.1153130615135893 | BP52: =1-(LN(1-BP$1))/$A52 -> 3.1738482833757091 | BQ52: =1-(LN(1-BQ$1))/$A52 -> 3.2341848689967949 | BR52: =1-(LN(1-BR$1))/$A52 -> 3.2964372186332271 | BS52: =1-(LN(1-BS$1))/$A52 -> 3.3607309888743857 | BT52: =1-(LN(1-BT$1))/$A52 -> 3.427204619611016 | BU52: =1-(LN(1-BU$1))/$A52 -> 3.496011129044879 | BV52: =1-(LN(1-BV$1))/$A52 -> 3.5673202352622808 | BW52: =1-(LN(1-BW$1))/$A52 -> 3.6413208783659026 | BX52: =1-(LN(1-BX$1))/$A52 -> 3.7182242374899839 | BY52: =1-(LN(1-BY$1))/$A52 -> 3.7982673640002882 | BZ52: =1-(LN(1-BZ$1))/$A52 -> 3.8817175883508686 | CA52: =1-(LN(1-CA$1))/$A52 -> 3.9688779071172098 | CB52: =1-(LN(1-CB$1))/$A52 -> 4.0600936240483723 | CC52: =1-(LN(1-CC$1))/$A52 -> 4.1557606126158859 | CD52: =1-(LN(1-CD$1))/$A52 -> 4.2563356996502995 | CE52: =1-(LN(1-CE$1))/$A52 -> 4.3623498590037819 | CF52: =1-(LN(1-CF$1))/$A52 -> 4.4744251802585833 | CG52: =1-(LN(1-CG$1))/$A52 -> 4.5932969877417893 | CH52: =1-(LN(1-CH$1))/$A52 -> 4.719843107619381 | CI52: =1-(LN(1-CI$1))/$A52 -> 4.8551232477898747 | CJ52: =1-(LN(1-CJ$1))/$A52 -> 5.0004329971108987 | CK52: =1-(LN(1-CK$1))/$A52 -> 5.1573794827452843 | CL52: =1-(LN(1-CL$1))/$A52 -> 5.3279900258622055 | CM52: =1-(LN(1-CM$1))/$A52 -> 5.5148727313608834 | CN52: =1-(LN(1-CN$1))/$A52 -> 5.7214619777487794 | CO52: =1-(LN(1-CO$1))/$A52 -> 5.9524091064867877 | CP52: =1-(LN(1-CP$1))/$A52 -> 6.214235366534874 | CQ52: =1-(LN(1-CQ$1))/$A52 -> 6.5164916014902854 | CR52: =1-(LN(1-CR$1))/$A52 -> 6.8739848501058862 | CS52: =1-(LN(1-CS$1))/$A52 -> 7.311521225231794 | CT52: =1-(LN(1-CT$1))/$A52 -> 7.8756037202352971 | CU52: =1-(LN(1-CU$1))/$A52 -> 8.6706333439768173 | CV52: =1-(LN(1-CV$1))/$A52 -> 10.029745462721873
A53: =A52+0.01 -> 00.52 | B53: =1-(LN(1-B$1))/$A53 -> 1.0193275689490413 | C53: =1-(LN(1-C$1))/$A53 -> 1.038851360225999 | D53: =1-(LN(1-D$1))/$A53 -> 1.058575399009055 | E53: =1-(LN(1-E$1))/$A53 -> 1.0785038356158754 | F53: =1-(LN(1-F$1))/$A53 -> 1.0986409507452894 | G53: =1-(LN(1-G$1))/$A53 -> 1.1189911609963221 | H53: =1-(LN(1-H$1))/$A53 -> 1.1395590246823759 | I53: =1-(LN(1-I$1))/$A53 -> 1.1603492479597135 | J53: =1-(LN(1-J$1))/$A53 -> 1.1813666912908485 | K53: =1-(LN(1-K$1))/$A53 -> 1.2026163762650504 | L53: =1-(LN(1-L$1))/$A53 -> 1.2241034927999066 | M53: =1-(LN(1-M$1))/$A53 -> 1.2458334067497785 | N53: =1-(LN(1-N$1))/$A53 -> 1.267811667949053 | O53: =1-(LN(1-O$1))/$A53 -> 1.290044018720353 | P53: =1-(LN(1-P$1))/$A53 -> 1.3125364028803364 | Q53: =1-(LN(1-Q$1))/$A53 -> 1.3352949752784187 | R53: =1-(LN(1-R$1))/$A53 -> 1.358326111906718 | S53: =1-(LN(1-S$1))/$A53 -> 1.3816364206227658 | T53: =1-(LN(1-T$1))/$A53 -> 1.4052327525301012 | U53: =1-(LN(1-U$1))/$A53 -> 1.429122214065788 | V53: =1-(LN(1-V$1))/$A53 -> 1.4533121798482114 | W53: =1-(LN(1-W$1))/$A53 -> 1.4778103063432686 | X53: =1-(LN(1-X$1))/$A53 -> 1.502624546412322 | Y53: =1-(LN(1-Y$1))/$A53 -> 1.5277631648110774 | Z53: =1-(LN(1-Z$1))/$A53 -> 1.553234754714963 | AA53: =1-(LN(1-AA$1))/$A53 -> 1.5790482553536953 | AB53: =1-(LN(1-AB$1))/$A53 -> 1.6052129708455771 | AC53: =1-(LN(1-AC$1))/$A53 -> 1.6317385903308383 | AD53: =1-(LN(1-AD$1))/$A53 -> 1.6586352095130303 | AE53: =1-(LN(1-AE$1))/$A53 -> 1.6859133537283313 | AF53: =1-(LN(1-AF$1))/$A53 -> 1.7135840026746767 | AG53: =1-(LN(1-AG$1))/$A53 -> 1.7416586169461241 | AH53: =1-(LN(1-AH$1))/$A53 -> 1.7701491665329332 | AI53: =1-(LN(1-AI$1))/$A53 -> 1.7990681614647417 | AJ53: =1-(LN(1-AJ$1))/$A53 -> 1.828428684793181 | AK53: =1-(LN(1-AK$1))/$A53 -> 1.858244428131576 | AL53: =1-(LN(1-AL$1))/$A53 -> 1.8885297299933819 | AM53: =1-(LN(1-AM$1))/$A53 -> 1.9192996171980765 | AN53: =1-(LN(1-AN$1))/$A53 -> 1.950569849643808 | AO53: =1-(LN(1-AO$1))/$A53 -> 1.9823569687807514 | AP53: =1-(LN(1-AP$1))/$A53 -> 2.0146783501584076 | AQ53: =1-(LN(1-AQ$1))/$A53 -> 2.0475522604647538 | AR53: =1-(LN(1-AR$1))/$A53 -> 2.0809979195260411 | AS53: =1-(LN(1-AS$1))/$A53 -> 2.1150355677941199 | AT53: =1-(LN(1-AT$1))/$A53 -> 2.1496865399146547 | AU53: =1-(LN(1-AU$1))/$A53 -> 2.184973345045802 | AV53: =1-(LN(1-AV$1))/$A53 -> 2.2209197546845569 | AW53: =1-(LN(1-AW$1))/$A53 -> 2.2575508988589696 | AX53: =1-(LN(1-AX$1))/$A53 -> 2.2948933716610878 | AY53: =1-(LN(1-AY$1))/$A53 -> 2.332975347230664 | AZ53: =1-(LN(1-AZ$1))/$A53 -> 2.3718267074566635 | BA53: =1-(LN(1-BA$1))/$A53 -> 2.4114791828465396 | BB53: =1-(LN(1-BB$1))/$A53 -> 2.4519665082269864 | BC53: =1-(LN(1-BC$1))/$A53 -> 2.4933245951903782 | BD53: =1-(LN(1-BD$1))/$A53 -> 2.535591723495715 | BE53: =1-(LN(1-BE$1))/$A53 -> 2.578808753980443 | BF53: =1-(LN(1-BF$1))/$A53 -> 2.6230193659510177 | BG53: =1-(LN(1-BG$1))/$A53 -> 2.6682703225090831 | BH53: =1-(LN(1-BH$1))/$A53 -> 2.7146117678534303 | BI53: =1-(LN(1-BI$1))/$A53 -> 2.7620975612964527 | BJ53: =1-(LN(1-BJ$1))/$A53 -> 2.8107856535739333 | BK53: =1-(LN(1-BK$1))/$A53 -> 2.8607385120417423 | BL53: =1-(LN(1-BL$1))/$A53 -> 2.9120236025843602 | BM53: =1-(LN(1-BM$1))/$A53 -> 2.9647139375615037 | BN53: =1-(LN(1-BN$1))/$A53 -> 3.0188887009589966 | BO53: =1-(LN(1-BO$1))/$A53 -> 3.0746339641767895 | BP53: =1-(LN(1-BP$1))/$A53 -> 3.132043508695407 | BQ53: =1-(LN(1-BQ$1))/$A53 -> 3.1912197753622413 | BR53: =1-(LN(1-BR$1))/$A53 -> 3.2522749644287421 | BS53: =1-(LN(1-BS$1))/$A53 -> 3.3153323160114168 | BT53: =1-(LN(1-BT$1))/$A53 -> 3.3805276076954196 | BU53: =1-(LN(1-BU$1))/$A53 -> 3.4480109150247853 | BV53: =1-(LN(1-BV$1))/$A53 -> 3.5179486922764678 | BW53: =1-(LN(1-BW$1))/$A53 -> 3.5905262460896354 | BX53: =1-(LN(1-BX$1))/$A53 -> 3.6659506944613303 | BY53: =1-(LN(1-BY$1))/$A53 -> 3.7444545300772059 | BZ53: =1-(LN(1-BZ$1))/$A53 -> 3.8262999424210444 | CA53: =1-(LN(1-CA$1))/$A53 -> 3.9117841012111096 | CB53: =1-(LN(1-CB$1))/$A53 -> 4.0012456697397498 | CC53: =1-(LN(1-CC$1))/$A53 -> 4.0950729085271194 | CD53: =1-(LN(1-CD$1))/$A53 -> 4.1937138592724086 | CE53: =1-(LN(1-CE$1))/$A53 -> 4.2976892847921704 | CF53: =1-(LN(1-CF$1))/$A53 -> 4.407609311407457 | CG53: =1-(LN(1-CG$1))/$A53 -> 4.5241951225929089 | CH53: =1-(LN(1-CH$1))/$A53 -> 4.6483076632420843 | CI53: =1-(LN(1-CI$1))/$A53 -> 4.7809862622554533 | CJ53: =1-(LN(1-CJ$1))/$A53 -> 4.9235015933203039 | CK53: =1-(LN(1-CK$1))/$A53 -> 5.0774298773078748 | CL53: =1-(LN(1-CL$1))/$A53 -> 5.244759448441779 | CM53: =1-(LN(1-CM$1))/$A53 -> 5.4280482557577896 | CN53: =1-(LN(1-CN$1))/$A53 -> 5.6306646320228406 | CO53: =1-(LN(1-CO$1))/$A53 -> 5.85717046982358 | CP53: =1-(LN(1-CP$1))/$A53 -> 6.1139616094861262 | CQ53: =1-(LN(1-CQ$1))/$A53 -> 6.4104052245385486 | CR53: =1-(LN(1-CR$1))/$A53 -> 6.7610236029884652 | CS53: =1-(LN(1-CS$1))/$A53 -> 7.19014581705426 | CT53: =1-(LN(1-CT$1))/$A53 -> 7.7433805717692339 | CU53: =1-(LN(1-CU$1))/$A53 -> 8.5231211642849551 | CV53: =1-(LN(1-CV$1))/$A53 -> 9.856096511515684
A54: =A53+0.01 -> 00.53 | B54: =1-(LN(1-B$1))/$A54 -> 1.0189628978367953 | C54: =1-(LN(1-C$1))/$A54 -> 1.038118315693433 | D54: =1-(LN(1-D$1))/$A54 -> 1.057470202801337 | E54: =1-(LN(1-E$1))/$A54 -> 1.0770226311702928 | F54: =1-(LN(1-F$1))/$A54 -> 1.0967798007312275 | G54: =1-(LN(1-G$1))/$A54 -> 1.1167460447511084 | H54: =1-(LN(1-H$1))/$A54 -> 1.1369258355374254 | I54: =1-(LN(1-I$1))/$A54 -> 1.1573237904510396 | J54: =1-(LN(1-J$1))/$A54 -> 1.1779446782476251 | K54: =1-(LN(1-K$1))/$A54 -> 1.1987934257694834 | L54: =1-(LN(1-L$1))/$A54 -> 1.2198751250112292 | M54: =1-(LN(1-M$1))/$A54 -> 1.2411950405846883 | N54: =1-(LN(1-N$1))/$A54 -> 1.2627586176103915 | O54: =1-(LN(1-O$1))/$A54 -> 1.2845714900652521 | P54: =1-(LN(1-P$1))/$A54 -> 1.3066394896184432 | Q54: =1-(LN(1-Q$1))/$A54 -> 1.3289686549901467 | R54: =1-(LN(1-R$1))/$A54 -> 1.3515652418707422 | S54: =1-(LN(1-S$1))/$A54 -> 1.3744357334412043 | T54: =1-(LN(1-T$1))/$A54 -> 1.3975868515389671 | U54: =1-(LN(1-U$1))/$A54 -> 1.4210255685173769 | V54: =1-(LN(1-V$1))/$A54 -> 1.4447591198510752 | W54: =1-(LN(1-W$1))/$A54 -> 1.4687950175443389 | X54: =1-(LN(1-X$1))/$A54 -> 1.4931410644045424 | Y54: =1-(LN(1-Y$1))/$A54 -> 1.5178053692486042 | Z54: =1-(LN(1-Z$1))/$A54 -> 1.5427963631165675 | AA54: =1-(LN(1-AA$1))/$A54 -> 1.5681228165734367 | AB54: =1-(LN(1-AB$1))/$A54 -> 1.5937938581881133 | AC54: =1-(LN(1-AC$1))/$A54 -> 1.6198189942868604 | AD54: =1-(LN(1-AD$1))/$A54 -> 1.6462081300882563 | AE54: =1-(LN(1-AE$1))/$A54 -> 1.6729715923372308 | AF54: =1-(LN(1-AF$1))/$A54 -> 1.7001201535676074 | AG54: =1-(LN(1-AG$1))/$A54 -> 1.7276650581358202 | AH54: =1-(LN(1-AH$1))/$A54 -> 1.755618050183255 | AI54: =1-(LN(1-AI$1))/$A54 -> 1.7839914037012563 | AJ54: =1-(LN(1-AJ$1))/$A54 -> 1.812797954891423 | AK54: =1-(LN(1-AK$1))/$A54 -> 1.8420511370347536 | AL54: =1-(LN(1-AL$1))/$A54 -> 1.8717650181067143 | AM54: =1-(LN(1-AM$1))/$A54 -> 1.9019543414018865 | AN54: =1-(LN(1-AN$1))/$A54 -> 1.9326345694618494 | AO54: =1-(LN(1-AO$1))/$A54 -> 1.9638219316339447 | AP54: =1-(LN(1-AP$1))/$A54 -> 1.9955334756271168 | AQ54: =1-(LN(1-AQ$1))/$A54 -> 2.0277871234748526 | AR54: =1-(LN(1-AR$1))/$A54 -> 2.0606017323651722 | AS54: =1-(LN(1-AS$1))/$A54 -> 2.0939971608546077 | AT54: =1-(LN(1-AT$1))/$A54 -> 2.1279943410483404 | AU54: =1-(LN(1-AU$1))/$A54 -> 2.1626153574034284 | AV54: =1-(LN(1-AV$1))/$A54 -> 2.1978835328980559 | AW54: =1-(LN(1-AW$1))/$A54 -> 2.2338235234088 | AX54: =1-(LN(1-AX$1))/$A54 -> 2.2704614212523877 | AY54: =1-(LN(1-AY$1))/$A54 -> 2.307824868981029 | AZ54: =1-(LN(1-AZ$1))/$A54 -> 2.3459431846744621 | BA54: =1-(LN(1-BA$1))/$A54 -> 2.3848475001513219 | BB54: =1-(LN(1-BB$1))/$A54 -> 2.4245709137321376 | BC54: =1-(LN(1-BC$1))/$A54 -> 2.4651486594320691 | BD54: =1-(LN(1-BD$1))/$A54 -> 2.5066182947505129 | BE54: =1-(LN(1-BE$1))/$A54 -> 2.5490199095657178 | BF54: =1-(LN(1-BF$1))/$A54 -> 2.5923963590462815 | BG54: =1-(LN(1-BG$1))/$A54 -> 2.6367935239711762 | BH54: =1-(LN(1-BH$1))/$A54 -> 2.6822606024222337 | BI54: =1-(LN(1-BI$1))/$A54 -> 2.7288504374984068 | BJ54: =1-(LN(1-BJ$1))/$A54 -> 2.7766198865253684 | BK54: =1-(LN(1-BK$1))/$A54 -> 2.8256302382296341 | BL54: =1-(LN(1-BL$1))/$A54 -> 2.8759476855544666 | BM54: =1-(LN(1-BM$1))/$A54 -> 2.9276438632678903 | BN54: =1-(LN(1-BN$1))/$A54 -> 2.9807964613182607 | BO54: =1-(LN(1-BO$1))/$A54 -> 3.0354899271168501 | BP54: =1-(LN(1-BP$1))/$A54 -> 3.0918162726822862 | BQ54: =1-(LN(1-BQ$1))/$A54 -> 3.1498760060157838 | BR54: =1-(LN(1-BR$1))/$A54 -> 3.2097792103829166 | BS54: =1-(LN(1-BS$1))/$A54 -> 3.2716468006149748 | BT54: =1-(LN(1-BT$1))/$A54 -> 3.3356119924558834 | BU54: =1-(LN(1-BU$1))/$A54 -> 3.4018220298356381 | BV54: =1-(LN(1-BV$1))/$A54 -> 3.4704402263844587 | BW54: =1-(LN(1-BW$1))/$A54 -> 3.5416483923898308 | BX54: =1-(LN(1-BX$1))/$A54 -> 3.6156497379620598 | BY54: =1-(LN(1-BY$1))/$A54 -> 3.6926723691323526 | BZ54: =1-(LN(1-BZ$1))/$A54 -> 3.7729735284130999 | CA54: =1-(LN(1-CA$1))/$A54 -> 3.856844778546749 | CB54: =1-(LN(1-CB$1))/$A54 -> 3.9446183929522074 | CC54: =1-(LN(1-CC$1))/$A54 -> 4.0366753064794381 | CD54: =1-(LN(1-CD$1))/$A54 -> 4.1334551072106658 | CE54: =1-(LN(1-CE$1))/$A54 -> 4.235468732248922 | CF54: =1-(LN(1-CF$1))/$A54 -> 4.3433147960978822 | CG54: =1-(LN(1-CG$1))/$A54 -> 4.4577008749968154 | CH54: =1-(LN(1-CH$1))/$A54 -> 4.5794716695960069 | CI54: =1-(LN(1-CI$1))/$A54 -> 4.709646898816672 | CJ54: =1-(LN(1-CJ$1))/$A54 -> 4.8494732613708642 | CK54: =1-(LN(1-CK$1))/$A54 -> 5.000497238113387 | CL54: =1-(LN(1-CL$1))/$A54 -> 5.1646696475277833 | CM54: =1-(LN(1-CM$1))/$A54 -> 5.3445001754604728 | CN54: =1-(LN(1-CN$1))/$A54 -> 5.5432936012299576 | CO54: =1-(LN(1-CO$1))/$A54 -> 5.765525743977852 | CP54: =1-(LN(1-CP$1))/$A54 -> 6.0174717677977085 | CQ54: =1-(LN(1-CQ$1))/$A54 -> 6.3083221070944253 | CR54: =1-(LN(1-CR$1))/$A54 -> 6.652325044441513 | CS54: =1-(LN(1-CS$1))/$A54 -> 7.0733506129588966 | CT54: =1-(LN(1-CT$1))/$A54 -> 7.6161469760754743 | CU54: =1-(LN(1-CU$1))/$A54 -> 8.3811754819399553 | CV54: =1-(LN(1-CV$1))/$A54 -> 9.6890003509210487
A55: =A54+0.01 -> 00.54 | B55: =1-(LN(1-B$1))/$A55 -> 1.0186117330620397 | C55: =1-(LN(1-C$1))/$A55 -> 1.0374124209583693 | D55: =1-(LN(1-D$1))/$A55 -> 1.0564059397864973 | E55: =1-(LN(1-E$1))/$A55 -> 1.0755962861486206 | F55: =1-(LN(1-F$1))/$A55 -> 1.0949875821991677 | G55: =1-(LN(1-G$1))/$A55 -> 1.1145840809594212 | H55: =1-(LN(1-H$1))/$A55 -> 1.134390171916362 | I55: =1-(LN(1-I$1))/$A55 -> 1.1544103869241684 | J55: =1-(LN(1-J$1))/$A55 -> 1.1746494064282245 | K55: =1-(LN(1-K$1))/$A55 -> 1.1951120660330115 | L55: =1-(LN(1-L$1))/$A55 -> 1.2158033634369472 | M55: =1-(LN(1-M$1))/$A55 -> 1.236728465759046 | N55: =1-(LN(1-N$1))/$A55 -> 1.2578927172842733 | O55: =1-(LN(1-O$1))/$A55 -> 1.2793016476566363 | P55: =1-(LN(1-P$1))/$A55 -> 1.3009609805514351 | Q55: =1-(LN(1-Q$1))/$A55 -> 1.3228766428606995 | R55: =1-(LN(1-R$1))/$A55 -> 1.3450547744286916 | S55: =1-(LN(1-S$1))/$A55 -> 1.3675017383774781 | T55: =1-(LN(1-T$1))/$A55 -> 1.3902241320660234 | U55: =1-(LN(1-U$1))/$A55 -> 1.4132287987300181 | V55: =1-(LN(1-V$1))/$A55 -> 1.436522839853833 | W55: =1-(LN(1-W$1))/$A55 -> 1.4601136283305549 | X55: =1-(LN(1-X$1))/$A55 -> 1.484008822471125 | Y55: =1-(LN(1-Y$1))/$A55 -> 1.5082163809291858 | Z55: =1-(LN(1-Z$1))/$A55 -> 1.5327445786144089 | AA55: =1-(LN(1-AA$1))/$A55 -> 1.5576020236739287 | AB55: =1-(LN(1-AB$1))/$A55 -> 1.5827976756290743 | AC55: =1-(LN(1-AC$1))/$A55 -> 1.6083408647630295 | AD55: =1-(LN(1-AD$1))/$A55 -> 1.6342413128643996 | AE55: =1-(LN(1-AE$1))/$A55 -> 1.6605091554420968 | AF55: =1-(LN(1-AF$1))/$A55 -> 1.6871549655385776 | AG55: =1-(LN(1-AG$1))/$A55 -> 1.7141897792814529 | AH55: =1-(LN(1-AH$1))/$A55 -> 1.7416251233280096 | AI55: =1-(LN(1-AI$1))/$A55 -> 1.7694730443734552 | AJ55: =1-(LN(1-AJ$1))/$A55 -> 1.7977461409119522 | AK55: =1-(LN(1-AK$1))/$A55 -> 1.8264575974600361 | AL55: =1-(LN(1-AL$1))/$A55 -> 1.8556212214751087 | AM55: =1-(LN(1-AM$1))/$A55 -> 1.8852514832277774 | AN55: =1-(LN(1-AN$1))/$A55 -> 1.9153635589162594 | AO55: =1-(LN(1-AO$1))/$A55 -> 1.9459733773444272 | AP55: =1-(LN(1-AP$1))/$A55 -> 1.9770976705229111 | AQ55: =1-(LN(1-AQ$1))/$A55 -> 2.0087540285956891 | AR55: =1-(LN(1-AR$1))/$A55 -> 2.0409609595435949 | AS55: =1-(LN(1-AS$1))/$A55 -> 2.073737954172115 | AT55: =1-(LN(1-AT$1))/$A55 -> 2.1071055569548527 | AU55: =1-(LN(1-AU$1))/$A55 -> 2.1410854433774391 | AV55: =1-(LN(1-AV$1))/$A55 -> 2.1757005045110551 | AW55: =1-(LN(1-AW$1))/$A55 -> 2.2109749396419707 | AX55: =1-(LN(1-AX$1))/$A55 -> 2.2469343578958623 | AY55: =1-(LN(1-AY$1))/$A55 -> 2.2836058899258251 | AZ55: =1-(LN(1-AZ$1))/$A55 -> 2.3210183108841944 | BA55: =1-(LN(1-BA$1))/$A55 -> 2.3592021760744455 | BB55: =1-(LN(1-BB$1))/$A55 -> 2.3981899708852463 | BC55: =1-(LN(1-BC$1))/$A55 -> 2.4380162768499938 | BD55: =1-(LN(1-BD$1))/$A55 -> 2.4787179559588366 | BE55: =1-(LN(1-BE$1))/$A55 -> 2.520334355684871 | BF55: =1-(LN(1-BF$1))/$A55 -> 2.5629075375824613 | BG55: =1-(LN(1-BG$1))/$A55 -> 2.6064825327865249 | BH55: =1-(LN(1-BH$1))/$A55 -> 2.6511076283033033 | BI55: =1-(LN(1-BI$1))/$A55 -> 2.6968346886558434 | BJ55: =1-(LN(1-BJ$1))/$A55 -> 2.7437195182563801 | BK55: =1-(LN(1-BK$1))/$A55 -> 2.7918222708550111 | BL55: =1-(LN(1-BL$1))/$A55 -> 2.8412079135997543 | BM55: =1-(LN(1-BM$1))/$A55 -> 2.8919467546888553 | BN55: =1-(LN(1-BN$1))/$A55 -> 2.9441150453679228 | BO55: =1-(LN(1-BO$1))/$A55 -> 2.9977956692072789 | BP55: =1-(LN(1-BP$1))/$A55 -> 3.0530789342992808 | BQ55: =1-(LN(1-BQ$1))/$A55 -> 3.1100634873858617 | BR55: =1-(LN(1-BR$1))/$A55 -> 3.1688573731536036 | BS55: =1-(LN(1-BS$1))/$A55 -> 3.2295792672702532 | BT55: =1-(LN(1-BT$1))/$A55 -> 3.2923599185215151 | BU55: =1-(LN(1-BU$1))/$A55 -> 3.3573438440979411 | BV55: =1-(LN(1-BV$1))/$A55 -> 3.4246913333032651 | BW55: =1-(LN(1-BW$1))/$A55 -> 3.4945808295677971 | BX55: =1-(LN(1-BX$1))/$A55 -> 3.5672117798516512 | BY55: =1-(LN(1-BY$1))/$A55 -> 3.642808066000272 | BZ55: =1-(LN(1-BZ$1))/$A55 -> 3.7216221667758203 | CA55: =1-(LN(1-CA$1))/$A55 -> 3.8039402456106983 | CB55: =1-(LN(1-CB$1))/$A55 -> 3.8900884227123513 | CC55: =1-(LN(1-CC$1))/$A55 -> 3.9804405785816703 | CD55: =1-(LN(1-CD$1))/$A55 -> 4.075428160780838 | CE55: =1-(LN(1-CE$1))/$A55 -> 4.1755526446146831 | CF55: =1-(LN(1-CF$1))/$A55 -> 4.2814015591331067 | CG55: =1-(LN(1-CG$1))/$A55 -> 4.3936693773116904 | CH55: =1-(LN(1-CH$1))/$A55 -> 4.5131851571960819 | CI55: =1-(LN(1-CI$1))/$A55 -> 4.6409497340237698 | CJ55: =1-(LN(1-CJ$1))/$A55 -> 4.7781867194936263 | CK55: =1-(LN(1-CK$1))/$A55 -> 4.9264139559261011 | CL55: =1-(LN(1-CL$1))/$A55 -> 5.0875461355365275 | CM55: =1-(LN(1-CM$1))/$A55 -> 5.2640464685075008 | CN55: =1-(LN(1-CN$1))/$A55 -> 5.4591585345405136 | CO55: =1-(LN(1-CO$1))/$A55 -> 5.6772752672375217 | CP55: =1-(LN(1-CP$1))/$A55 -> 5.9245556239496029 | CQ55: =1-(LN(1-CQ$1))/$A55 -> 6.210019845851936 | CR55: =1-(LN(1-CR$1))/$A55 -> 6.5476523584333366 | CS55: =1-(LN(1-CS$1))/$A55 -> 6.9608811571633611 | CT55: =1-(LN(1-CT$1))/$A55 -> 7.4936257357777807 | CU55: =1-(LN(1-CU$1))/$A55 -> 8.2444870470892155 | CV55: =1-(LN(1-CV$1))/$A55 -> 9.5280929370151028
A56: =A55+0.01 -> 00.55 | B56: =1-(LN(1-B$1))/$A56 -> 1.0182733379154572 | C56: =1-(LN(1-C$1))/$A56 -> 1.0367321951227626 | D56: =1-(LN(1-D$1))/$A56 -> 1.0553803772449246 | E56: =1-(LN(1-E$1))/$A56 -> 1.0742218082186457 | F56: =1-(LN(1-F$1))/$A56 -> 1.0932605352500919 | G56: =1-(LN(1-G$1))/$A56 -> 1.1125007340328863 | H56: =1-(LN(1-H$1))/$A56 -> 1.1319467142451554 | I56: =1-(LN(1-I$1))/$A56 -> 1.151602925343729 | J56: =1-(LN(1-J$1))/$A56 -> 1.1714739626749842 | K56: =1-(LN(1-K$1))/$A56 -> 1.1915645739233205 | L56: =1-(LN(1-L$1))/$A56 -> 1.2118796659199118 | M56: =1-(LN(1-M$1))/$A56 -> 1.2324243118361542 | N56: =1-(LN(1-N$1))/$A56 -> 1.2532037587881957 | O56: =1-(LN(1-O$1))/$A56 -> 1.2742234358810611 | P56: =1-(LN(1-P$1))/$A56 -> 1.2954889627232271 | Q56: =1-(LN(1-Q$1))/$A56 -> 1.3170061584450503 | R56: =1-(LN(1-R$1))/$A56 -> 1.3387810512572607 | S56: =1-(LN(1-S$1))/$A56 -> 1.3608198885887968 | T56: =1-(LN(1-T$1))/$A56 -> 1.383129147846641 | U56: =1-(LN(1-U$1))/$A56 -> 1.4057155478440178 | V56: =1-(LN(1-V$1))/$A56 -> 1.4285860609473997 | W56: =1-(LN(1-W$1))/$A56 -> 1.4517479259972721 | X56: =1-(LN(1-X$1))/$A56 -> 1.4752086620625591 | Y56: =1-(LN(1-Y$1))/$A56 -> 1.4989760830941097 | Z56: =1-(LN(1-Z$1))/$A56 -> 1.5230583135486921 | AA56: =1-(LN(1-AA$1))/$A56 -> 1.5474638050616754 | AB56: =1-(LN(1-AB$1))/$A56 -> 1.5722013542540001 | AC56: =1-(LN(1-AC$1))/$A56 -> 1.597280121767338 | AD56: =1-(LN(1-AD$1))/$A56 -> 1.6227096526305016 | AE56: =1-(LN(1-AE$1))/$A56 -> 1.6484998980704222 | AF56: =1-(LN(1-AF$1))/$A56 -> 1.6746612388924216 | AG56: =1-(LN(1-AG$1))/$A56 -> 1.7012045105672446 | AH56: =1-(LN(1-AH$1))/$A56 -> 1.7281410301765914 | AI56: =1-(LN(1-AI$1))/$A56 -> 1.7554826253848468 | AJ56: =1-(LN(1-AJ$1))/$A56 -> 1.783241665622644 | AK56: =1-(LN(1-AK$1))/$A56 -> 1.8114310956880353 | AL56: =1-(LN(1-AL$1))/$A56 -> 1.8400644719937429 | AM56: =1-(LN(1-AM$1))/$A56 -> 1.8691560017145452 | AN56: =1-(LN(1-AN$1))/$A56 -> 1.898720585117782 | AO56: =1-(LN(1-AO$1))/$A56 -> 1.9287738613927103 | AP56: =1-(LN(1-AP$1))/$A56 -> 1.9593322583315853 | AQ56: =1-(LN(1-AQ$1))/$A56 -> 1.9904130462575855 | AR56: =1-(LN(1-AR$1))/$A56 -> 2.0220343966428023 | AS56: =1-(LN(1-AS$1))/$A56 -> 2.0542154459144406 | AT56: =1-(LN(1-AT$1))/$A56 -> 2.0869763650102193 | AU56: =1-(LN(1-AU$1))/$A56 -> 2.1203384353160306 | AV56: =1-(LN(1-AV$1))/$A56 -> 2.1543241317017632 | AW56: =1-(LN(1-AW$1))/$A56 -> 2.1889572134666619 | AX56: =1-(LN(1-AX$1))/$A56 -> 2.2242628241159377 | AY56: =1-(LN(1-AY$1))/$A56 -> 2.2602676010180822 | AZ56: =1-(LN(1-AZ$1))/$A56 -> 2.2969997961408453 | BA56: =1-(LN(1-BA$1))/$A56 -> 2.3344894092367285 | BB56: =1-(LN(1-BB$1))/$A56 -> 2.372768335050969 | BC56: =1-(LN(1-BC$1))/$A56 -> 2.4118705263618119 | BD56: =1-(LN(1-BD$1))/$A56 -> 2.4518321749414032 | BE56: =1-(LN(1-BE$1))/$A56 -> 2.4926919128542373 | BF56: =1-(LN(1-BF$1))/$A56 -> 2.5344910368991442 | BG56: =1-(LN(1-BG$1))/$A56 -> 2.5772737594631332 | BH56: =1-(LN(1-BH$1))/$A56 -> 2.6210874896068797 | BI56: =1-(LN(1-BI$1))/$A56 -> 2.6659831488621011 | BJ56: =1-(LN(1-BJ$1))/$A56 -> 2.712015527015355 | BK56: =1-(LN(1-BK$1))/$A56 -> 2.7592436841121928 | BL56: =1-(LN(1-BL$1))/$A56 -> 2.8077314060797587 | BM56: =1-(LN(1-BM$1))/$A56 -> 2.8575477227854216 | BN56: =1-(LN(1-BN$1))/$A56 -> 2.9087674990885057 | BO56: =1-(LN(1-BO$1))/$A56 -> 2.9614721115853282 | BP56: =1-(LN(1-BP$1))/$A56 -> 3.0157502264029303 | BQ56: =1-(LN(1-BQ$1))/$A56 -> 3.0716986967061191 | BR56: =1-(LN(1-BR$1))/$A56 -> 3.1294236027326288 | BS56: =1-(LN(1-BS$1))/$A56 -> 3.1890414624107941 | BT56: =1-(LN(1-BT$1))/$A56 -> 3.2506806472756695 | BU56: =1-(LN(1-BU$1))/$A56 -> 3.3144830469325242 | BV56: =1-(LN(1-BV$1))/$A56 -> 3.3806060363341146 | BW56: =1-(LN(1-BW$1))/$A56 -> 3.4492248144847459 | BX56: =1-(LN(1-BX$1))/$A56 -> 3.5205352020361667 | BY56: =1-(LN(1-BY$1))/$A56 -> 3.5947570102548125 | BZ56: =1-(LN(1-BZ$1))/$A56 -> 3.6721381273798963 | CA56: =1-(LN(1-CA$1))/$A56 -> 3.7529595138723217 | CB56: =1-(LN(1-CB$1))/$A56 -> 3.8375413604812176 | CC56: =1-(LN(1-CC$1))/$A56 -> 3.9262507498801855 | CD56: =1-(LN(1-CD$1))/$A56 -> 4.0195112851302781 | CE56: =1-(LN(1-CE$1))/$A56 -> 4.1178153238035069 | CF56: =1-(LN(1-CF$1))/$A56 -> 4.221739712603414 | CG56: =1-(LN(1-CG$1))/$A56 -> 4.3319662977242039 | CH56: =1-(LN(1-CH$1))/$A56 -> 4.4493090634288794 | CI56: =1-(LN(1-CI$1))/$A56 -> 4.5747506479506104 | CJ56: =1-(LN(1-CJ$1))/$A56 -> 4.709492415502833 | CK56: =1-(LN(1-CK$1))/$A56 -> 4.8550246112728992 | CL56: =1-(LN(1-CL$1))/$A56 -> 5.0132271148904088 | CM56: =1-(LN(1-CM$1))/$A56 -> 5.1865183508982735 | CN56: =1-(LN(1-CN$1))/$A56 -> 5.3780829248215953 | CO56: =1-(LN(1-CO$1))/$A56 -> 5.5922338987422933 | CP56: =1-(LN(1-CP$1))/$A56 -> 5.8350182489687006 | CQ56: =1-(LN(1-CQ$1))/$A56 -> 6.1152922122909912 | CR56: =1-(LN(1-CR$1))/$A56 -> 6.4467859519163673 | CS56: =1-(LN(1-CS$1))/$A56 -> 6.8525014997603906 | CT56: =1-(LN(1-CT$1))/$A56 -> 7.3755598133090938 | CU56: =1-(LN(1-CU$1))/$A56 -> 8.1127691007785039 | CV56: =1-(LN(1-CV$1))/$A56 -> 9.3730367017966465
A57: =A56+0.01 -> 00.56 | B57: =1-(LN(1-B$1))/$A57 -> 1.017947028309824 | C57: =1-(LN(1-C$1))/$A57 -> 1.0360762630669991 | D57: =1-(LN(1-D$1))/$A57 -> 1.0543914419369795 | E57: =1-(LN(1-E$1))/$A57 -> 1.0728964187861698 | F57: =1-(LN(1-F$1))/$A57 -> 1.0915951685491974 | G57: =1-(LN(1-G$1))/$A57 -> 1.1104917923537276 | H57: =1-(LN(1-H$1))/$A57 -> 1.129590522919349 | I57: =1-(LN(1-I$1))/$A57 -> 1.1488957302483054 | J57: =1-(LN(1-J$1))/$A57 -> 1.1684119276272165 | K57: =1-(LN(1-K$1))/$A57 -> 1.188143777960404 | L57: =1-(LN(1-L$1))/$A57 -> 1.2080961004570561 | M57: =1-(LN(1-M$1))/$A57 -> 1.228273877696223 | N57: =1-(LN(1-N$1))/$A57 -> 1.2486822630955492 | O57: =1-(LN(1-O$1))/$A57 -> 1.2693265888117564 | P57: =1-(LN(1-P$1))/$A57 -> 1.2902123741031695 | Q57: =1-(LN(1-Q$1))/$A57 -> 1.3113453341871031 | R57: =1-(LN(1-R$1))/$A57 -> 1.3327313896276669 | S57: =1-(LN(1-S$1))/$A57 -> 1.3543766762925682 | T57: =1-(LN(1-T$1))/$A57 -> 1.3762875559208081 | U57: =1-(LN(1-U$1))/$A57 -> 1.3984706273468031 | V57: =1-(LN(1-V$1))/$A57 -> 1.420932738430482 | W57: =1-(LN(1-W$1))/$A57 -> 1.4436809987473207 | X57: =1-(LN(1-X$1))/$A57 -> 1.4667227930971563 | Y57: =1-(LN(1-Y$1))/$A57 -> 1.4900657958960006 | Z57: =1-(LN(1-Z$1))/$A57 -> 1.5137179865210371 | AA57: =1-(LN(1-AA$1))/$A57 -> 1.537687665685574 | AB57: =1-(LN(1-AB$1))/$A57 -> 1.561983472928036 | AC57: =1-(LN(1-AC$1))/$A57 -> 1.5866144053072069 | AD57: =1-(LN(1-AD$1))/$A57 -> 1.6115898374049569 | AE57: =1-(LN(1-AE$1))/$A57 -> 1.6369195427477363 | AF57: =1-(LN(1-AF$1))/$A57 -> 1.6626137167693427 | AG57: =1-(LN(1-AG$1))/$A57 -> 1.6886830014499725 | AH57: =1-(LN(1-AH$1))/$A57 -> 1.7151385117805806 | AI57: =1-(LN(1-AI$1))/$A57 -> 1.7419918642172603 | AJ57: =1-(LN(1-AJ$1))/$A57 -> 1.7692552073079539 | AK57: =1-(LN(1-AK$1))/$A57 -> 1.7969412546936061 | AL57: =1-(LN(1-AL$1))/$A57 -> 1.8250633207081404 | AM57: =1-(LN(1-AM$1))/$A57 -> 1.8536353588267853 | AN57: =1-(LN(1-AN$1))/$A57 -> 1.8826720032406787 | AO57: =1-(LN(1-AO$1))/$A57 -> 1.9121886138678406 | AP57: =1-(LN(1-AP$1))/$A57 -> 1.9422013251470926 | AQ57: =1-(LN(1-AQ$1))/$A57 -> 1.9727270990029857 | AR57: =1-(LN(1-AR$1))/$A57 -> 2.0037837824170381 | AS57: =1-(LN(1-AS$1))/$A57 -> 2.0353901700945398 | AT57: =1-(LN(1-AT$1))/$A57 -> 2.0675660727778937 | AU57: =1-(LN(1-AU$1))/$A57 -> 2.1003323918282444 | AV57: =1-(LN(1-AV$1))/$A57 -> 2.1337112007785173 | AW57: =1-(LN(1-AW$1))/$A57 -> 2.1677258346547572 | AX57: =1-(LN(1-AX$1))/$A57 -> 2.2024009879710098 | AY57: =1-(LN(1-AY$1))/$A57 -> 2.2377628224284738 | AZ57: =1-(LN(1-AZ$1))/$A57 -> 2.2738390854954731 | BA57: =1-(LN(1-BA$1))/$A57 -> 2.3106592412146441 | BB57: =1-(LN(1-BB$1))/$A57 -> 2.3482546147822019 | BC57: =1-(LN(1-BC$1))/$A57 -> 2.3866585526767796 | BD57: =1-(LN(1-BD$1))/$A57 -> 2.4259066003888785 | BE57: =1-(LN(1-BE$1))/$A57 -> 2.4660367001246968 | BF57: =1-(LN(1-BF$1))/$A57 -> 2.5070894112402309 | BG57: =1-(LN(1-BG$1))/$A57 -> 2.5491081566155773 | BH57: =1-(LN(1-BH$1))/$A57 -> 2.5921394987210427 | BI57: =1-(LN(1-BI$1))/$A57 -> 2.6362334497752773 | BJ57: =1-(LN(1-BJ$1))/$A57 -> 2.6814438211757952 | BK57: =1-(LN(1-BK$1))/$A57 -> 2.7278286183244749 | BL57: =1-(LN(1-BL$1))/$A57 -> 2.7754504881140489 | BM57: =1-(LN(1-BM$1))/$A57 -> 2.824377227735682 | BN57: =1-(LN(1-BN$1))/$A57 -> 2.874682365176211 | BO57: =1-(LN(1-BO$1))/$A57 -> 2.9264458238784474 | BP57: =1-(LN(1-BP$1))/$A57 -> 2.9797546866457352 | BQ57: =1-(LN(1-BQ$1))/$A57 -> 3.0347040771220808 | BR57: =1-(LN(1-BR$1))/$A57 -> 3.0913981812552604 | BS57: =1-(LN(1-BS$1))/$A57 -> 3.1499514362963152 | BT57: =1-(LN(1-BT$1))/$A57 -> 3.2104899214314608 | BU57: =1-(LN(1-BU$1))/$A57 -> 3.2731529925230149 | BV57: =1-(LN(1-BV$1))/$A57 -> 3.33809521425672 | BW57: =1-(LN(1-BW$1))/$A57 -> 3.4054886570832328 | BX57: =1-(LN(1-BX$1))/$A57 -> 3.4755256448569494 | BY57: =1-(LN(1-BY$1))/$A57 -> 3.5484220636431196 | BZ57: =1-(LN(1-BZ$1))/$A57 -> 3.6244213751052552 | CA57: =1-(LN(1-CA$1))/$A57 -> 3.7037995225531732 | CB57: =1-(LN(1-CB$1))/$A57 -> 3.7868709790440533 | CC57: =1-(LN(1-CC$1))/$A57 -> 3.8739962722037533 | CD57: =1-(LN(1-CD$1))/$A57 -> 3.9655914407529513 | CE57: =1-(LN(1-CE$1))/$A57 -> 4.0621400501641585 | CF57: =1-(LN(1-CF$1))/$A57 -> 4.1642086463069239 | CG57: =1-(LN(1-CG$1))/$A57 -> 4.2724668995505581 | CH57: =1-(LN(1-CH$1))/$A57 -> 4.3877142587247926 | CI57: =1-(LN(1-CI$1))/$A57 -> 4.5109158149514919 | CJ57: =1-(LN(1-CJ$1))/$A57 -> 4.6432514795117115 | CK57: =1-(LN(1-CK$1))/$A57 -> 4.7861848860715979 | CL57: =1-(LN(1-CL$1))/$A57 -> 4.9415623449816515 | CM57: =1-(LN(1-CM$1))/$A57 -> 5.1117590946322329 | CN57: =1-(LN(1-CN$1))/$A57 -> 5.2999028725926376 | CO57: =1-(LN(1-CO$1))/$A57 -> 5.5102297219790382 | CP57: =1-(LN(1-CP$1))/$A57 -> 5.7486786373799736 | CQ57: =1-(LN(1-CQ$1))/$A57 -> 6.0239477085000805 | CR57: =1-(LN(1-CR$1))/$A57 -> 6.3495219170607173 | CS57: =1-(LN(1-CS$1))/$A57 -> 6.747992544407527 | CT57: =1-(LN(1-CT$1))/$A57 -> 7.2617105309285739 | CU57: =1-(LN(1-CU$1))/$A57 -> 7.9857553668360293 | CV57: =1-(LN(1-CV$1))/$A57 -> 9.2235181892645635
A58: =A57+0.01 -> 00.57 | B58: =1-(LN(1-B$1))/$A58 -> 1.0176321681640377 | C58: =1-(LN(1-C$1))/$A58 -> 1.0354433461710868 | D58: =1-(LN(1-D$1))/$A58 -> 1.0534372061135238 | E58: =1-(LN(1-E$1))/$A58 -> 1.0716175342460617 | F58: =1-(LN(1-F$1))/$A58 -> 1.0899882357676325 | G58: =1-(LN(1-G$1))/$A58 -> 1.1085533398562939 | H58: =1-(LN(1-H$1))/$A58 -> 1.1273170049733956 | I58: =1-(LN(1-I$1))/$A58 -> 1.1462835244544753 | J58: =1-(LN(1-J$1))/$A58 -> 1.1654573324056865 | K58: =1-(LN(1-K$1))/$A58 -> 1.184843009926011 | L58: =1-(LN(1-L$1))/$A58 -> 1.2044452916771078 | M58: =1-(LN(1-M$1))/$A58 -> 1.2242690728243593 | N58: =1-(LN(1-N$1))/$A58 -> 1.2443194163745748 | O58: =1-(LN(1-O$1))/$A58 -> 1.264601560937866 | P58: =1-(LN(1-P$1))/$A58 -> 1.2851209289434646 | Q58: =1-(LN(1-Q$1))/$A58 -> 1.3058831353417153 | R58: =1-(LN(1-R$1))/$A58 -> 1.3268939968271813 | S58: =1-(LN(1-S$1))/$A58 -> 1.3481595416207688 | T58: =1-(LN(1-T$1))/$A58 -> 1.369686019852022 | U58: =1-(LN(1-U$1))/$A58 -> 1.3914799145863328 | V58: =1-(LN(1-V$1))/$A58 -> 1.4135479535457365 | W58: =1-(LN(1-W$1))/$A58 -> 1.435897121576315 | X58: =1-(LN(1-X$1))/$A58 -> 1.4585346739200131 | Y58: =1-(LN(1-Y$1))/$A58 -> 1.4814681503539653 | Z58: =1-(LN(1-Z$1))/$A58 -> 1.5047053902662819 | AA58: =1-(LN(1-AA$1))/$A58 -> 1.528254548743722 | AB58: =1-(LN(1-AB$1))/$A58 -> 1.5521241137538597 | AC58: =1-(LN(1-AC$1))/$A58 -> 1.5763229245123438 | AD58: =1-(LN(1-AD$1))/$A58 -> 1.6008601911346945 | AE58: =1-(LN(1-AE$1))/$A58 -> 1.6257455156819864 | AF58: =1-(LN(1-AF$1))/$A58 -> 1.6509889147207577 | AG58: =1-(LN(1-AG$1))/$A58 -> 1.6766008435297977 | AH58: =1-(LN(1-AH$1))/$A58 -> 1.7025922221002197 | AI58: =1-(LN(1-AI$1))/$A58 -> 1.7289744630906416 | AJ58: =1-(LN(1-AJ$1))/$A58 -> 1.7557595019165864 | AK58: =1-(LN(1-AK$1))/$A58 -> 1.7829598291726656 | AL58: =1-(LN(1-AL$1))/$A58 -> 1.8105885256079977 | AM58: =1-(LN(1-AM$1))/$A58 -> 1.8386592998999998 | AN58: =1-(LN(1-AN$1))/$A58 -> 1.8671865294996142 | AO58: =1-(LN(1-AO$1))/$A58 -> 1.8961853048526152 | AP58: =1-(LN(1-AP$1))/$A58 -> 1.9256714773374948 | AQ58: =1-(LN(1-AQ$1))/$A58 -> 1.9556617113011789 | AR58: =1-(LN(1-AR$1))/$A58 -> 1.9861735406202479 | AS58: =1-(LN(1-AS$1))/$A58 -> 2.0172254302683195 | AT58: =1-(LN(1-AT$1))/$A58 -> 2.0488368434309132 | AU58: =1-(LN(1-AU$1))/$A58 -> 2.0810283147786262 | AV58: =1-(LN(1-AV$1))/$A58 -> 2.1138215305894201 | AW58: =1-(LN(1-AW$1))/$A58 -> 2.1472394165029192 | AX58: =1-(LN(1-AX$1))/$A58 -> 2.18130623379608 | AY58: =1-(LN(1-AY$1))/$A58 -> 2.2160476851928865 | AZ58: =1-(LN(1-AZ$1))/$A58 -> 2.2514910313639733 | BA58: =1-(LN(1-BA$1))/$A58 -> 2.2876652194389484 | BB58: =1-(LN(1-BB$1))/$A58 -> 2.3246010250491804 | BC58: =1-(LN(1-BC$1))/$A58 -> 2.3623312096473623 | BD58: =1-(LN(1-BD$1))/$A58 -> 2.400890695118898 | BE58: =1-(LN(1-BE$1))/$A58 -> 2.4403167580172465 | BF58: =1-(LN(1-BF$1))/$A58 -> 2.4806492461307528 | BG58: =1-(LN(1-BG$1))/$A58 -> 2.5219308205346023 | BH58: =1-(LN(1-BH$1))/$A58 -> 2.564207226813656 | BI58: =1-(LN(1-BI$1))/$A58 -> 2.6075275997792202 | BJ58: =1-(LN(1-BJ$1))/$A58 -> 2.651944806769202 | BK58: =1-(LN(1-BK$1))/$A58 -> 2.6975158355468527 | BL58: =1-(LN(1-BL$1))/$A58 -> 2.744302233936609 | BM58: =1-(LN(1-BM$1))/$A58 -> 2.7923706097052312 | BN58: =1-(LN(1-BN$1))/$A58 -> 2.8417932008748741 | BO58: =1-(LN(1-BO$1))/$A58 -> 2.8926485287226855 | BP58: =1-(LN(1-BP$1))/$A58 -> 2.9450221482835293 | BQ58: =1-(LN(1-BQ$1))/$A58 -> 2.9990075143655535 | BR58: =1-(LN(1-BR$1))/$A58 -> 3.0547069850928876 | BS58: =1-(LN(1-BS$1))/$A58 -> 3.112232990045503 | BT58: =1-(LN(1-BT$1))/$A58 -> 3.1717093964940668 | BU58: =1-(LN(1-BU$1))/$A58 -> 3.2332731154612073 | BV58: =1-(LN(1-BV$1))/$A58 -> 3.2970759999715145 | BW58: =1-(LN(1-BW$1))/$A58 -> 3.3632871016958075 | BX58: =1-(LN(1-BX$1))/$A58 -> 3.4320953703857748 | BY58: =1-(LN(1-BY$1))/$A58 -> 3.5037129046318367 | BZ58: =1-(LN(1-BZ$1))/$A58 -> 3.5783788948402506 | CA58: =1-(LN(1-CA$1))/$A58 -> 3.6563644432101352 | CB58: =1-(LN(1-CB$1))/$A58 -> 3.737978505727491 | CC58: =1-(LN(1-CC$1))/$A58 -> 3.8235752849721085 | CD58: =1-(LN(1-CD$1))/$A58 -> 3.9135635207397415 | CE58: =1-(LN(1-CE$1))/$A58 -> 4.0084182948981208 | CF58: =1-(LN(1-CF$1))/$A58 -> 4.1086962139155743 | CG58: =1-(LN(1-CG$1))/$A58 -> 4.2150551995584422 | CH58: =1-(LN(1-CH$1))/$A58 -> 4.3282806752383927 | CI58: =1-(LN(1-CI$1))/$A58 -> 4.4493208006540979 | CJ58: =1-(LN(1-CJ$1))/$A58 -> 4.5793347868886984 | CK58: =1-(LN(1-CK$1))/$A58 -> 4.7197605898247277 | CL58: =1-(LN(1-CL$1))/$A58 -> 4.8724121284030257 | CM58: =1-(LN(1-CM$1))/$A58 -> 5.0396229701650013 | CN58: =1-(LN(1-CN$1))/$A58 -> 5.2244659800910132 | CO58: =1-(LN(1-CO$1))/$A58 -> 5.4311028847513363 | CP58: =1-(LN(1-CP$1))/$A58 -> 5.6653684858469919 | CQ58: =1-(LN(1-CQ$1))/$A58 -> 5.9358082750176235 | CR58: =1-(LN(1-CR$1))/$A58 -> 6.255670655357898 | CS58: =1-(LN(1-CS$1))/$A58 -> 6.6471505699442366 | CT58: =1-(LN(1-CT$1))/$A58 -> 7.1518559602105283 | CU58: =1-(LN(1-CU$1))/$A58 -> 7.863198255137152 | CV58: =1-(LN(1-CV$1))/$A58 -> 9.0792459403300967
A59: =A58+0.01 -> 00.58 | B59: =1-(LN(1-B$1))/$A59 -> 1.0173281652646577 | C59: =1-(LN(1-C$1))/$A59 -> 1.0348322539957231 | D59: =1-(LN(1-D$1))/$A59 -> 1.0525158749736354 | E59: =1-(LN(1-E$1))/$A59 -> 1.0703827491728537 | F59: =1-(LN(1-F$1))/$A59 -> 1.0884367144612941 | G59: =1-(LN(1-G$1))/$A59 -> 1.1066817305484267 | H59: =1-(LN(1-H$1))/$A59 -> 1.1251218841979922 | I59: =1-(LN(1-I$1))/$A59 -> 1.1437613947225016 | J59: =1-(LN(1-J$1))/$A59 -> 1.1626046197780022 | K59: =1-(LN(1-K$1))/$A59 -> 1.1816560614790108 | L59: =1-(LN(1-L$1))/$A59 -> 1.2009203728550888 | M59: =1-(LN(1-M$1))/$A59 -> 1.2204023646722153 | N59: =1-(LN(1-N$1))/$A59 -> 1.2401070126439786 | O59: =1-(LN(1-O$1))/$A59 -> 1.2600394650596269 | P59: =1-(LN(1-P$1))/$A59 -> 1.2802050508582326 | Q59: =1-(LN(1-Q$1))/$A59 -> 1.3006092881806512 | R59: =1-(LN(1-R$1))/$A59 -> 1.3212578934336092 | S59: =1-(LN(1-S$1))/$A59 -> 1.3421567909031693 | T59: =1-(LN(1-T$1))/$A59 -> 1.3633121229580216 | U59: =1-(LN(1-U$1))/$A59 -> 1.3847302608865686 | V59: =1-(LN(1-V$1))/$A59 -> 1.4064178164156376 | W59: =1-(LN(1-W$1))/$A59 -> 1.4283816539629304 | X59: =1-(LN(1-X$1))/$A59 -> 1.4506289036800128 | Y59: =1-(LN(1-Y$1))/$A59 -> 1.4731669753478625 | Z59: =1-(LN(1-Z$1))/$A59 -> 1.4960035731927255 | AA59: =1-(LN(1-AA$1))/$A59 -> 1.5191467116964164 | AB59: =1-(LN(1-AB$1))/$A59 -> 1.5426047324822414 | AC59: =1-(LN(1-AC$1))/$A59 -> 1.5663863223655792 | AD59: =1-(LN(1-AD$1))/$A59 -> 1.5905005326668549 | AE59: =1-(LN(1-AE$1))/$A59 -> 1.6149567998943661 | AF59: =1-(LN(1-AF$1))/$A59 -> 1.6397649679152275 | AG59: =1-(LN(1-AG$1))/$A59 -> 1.6649353117448009 | AH59: =1-(LN(1-AH$1))/$A59 -> 1.6904785630984918 | AI59: =1-(LN(1-AI$1))/$A59 -> 1.7164059378649408 | AJ59: =1-(LN(1-AJ$1))/$A59 -> 1.742729165676645 | AK59: =1-(LN(1-AK$1))/$A59 -> 1.769460521773137 | AL59: =1-(LN(1-AL$1))/$A59 -> 1.7966128613733769 | AM59: =1-(LN(1-AM$1))/$A59 -> 1.8241996567982754 | AN59: =1-(LN(1-AN$1))/$A59 -> 1.8522350376116898 | AO59: =1-(LN(1-AO$1))/$A59 -> 1.8807338340792943 | AP59: =1-(LN(1-AP$1))/$A59 -> 1.9097116242799517 | AQ59: =1-(LN(1-AQ$1))/$A59 -> 1.9391847852442621 | AR59: =1-(LN(1-AR$1))/$A59 -> 1.9691705485405884 | AS59: =1-(LN(1-AS$1))/$A59 -> 1.9996870607809347 | AT59: =1-(LN(1-AT$1))/$A59 -> 2.0307534495786559 | AU59: =1-(LN(1-AU$1))/$A59 -> 2.0623898955583053 | AV59: =1-(LN(1-AV$1))/$A59 -> 2.0946177110964994 | AW59: =1-(LN(1-AW$1))/$A59 -> 2.1274594265632141 | AX59: =1-(LN(1-AX$1))/$A59 -> 2.1609388849375266 | AY59: =1-(LN(1-AY$1))/$A59 -> 2.1950813457930094 | AZ59: =1-(LN(1-AZ$1))/$A59 -> 2.2299135997887323 | BA59: =1-(LN(1-BA$1))/$A59 -> 2.2654640949658633 | BB59: =1-(LN(1-BB$1))/$A59 -> 2.3017630763414361 | BC59: =1-(LN(1-BC$1))/$A59 -> 2.3388427405155112 | BD59: =1-(LN(1-BD$1))/$A59 -> 2.37673740727202 | BE59: =1-(LN(1-BE$1))/$A59 -> 2.4154837104652245 | BF59: =1-(LN(1-BF$1))/$A59 -> 2.4551208108526366 | BG59: =1-(LN(1-BG$1))/$A59 -> 2.4956906339736609 | BH59: =1-(LN(1-BH$1))/$A59 -> 2.5372381366961791 | BI59: =1-(LN(1-BI$1))/$A59 -> 2.579811606679578 | BJ59: =1-(LN(1-BJ$1))/$A59 -> 2.6234629997559402 | BK59: =1-(LN(1-BK$1))/$A59 -> 2.6682483211408723 | BL59: =1-(LN(1-BL$1))/$A59 -> 2.7142280574894264 | BM59: =1-(LN(1-BM$1))/$A59 -> 2.7614676681585895 | BN59: =1-(LN(1-BN$1))/$A59 -> 2.8100381456873764 | BO59: =1-(LN(1-BO$1))/$A59 -> 2.8600166575378116 | BP59: =1-(LN(1-BP$1))/$A59 -> 2.9114872836579511 | BQ59: =1-(LN(1-BQ$1))/$A59 -> 2.9645418675661475 | BR59: =1-(LN(1-BR$1))/$A59 -> 3.0192810025912857 | BS59: =1-(LN(1-BS$1))/$A59 -> 3.0758151798723046 | BT59: =1-(LN(1-BT$1))/$A59 -> 3.1342661310372728 | BU59: =1-(LN(1-BU$1))/$A59 -> 3.1947684065739455 | BV59: =1-(LN(1-BV$1))/$A59 -> 3.2574712413513156 | BW59: =1-(LN(1-BW$1))/$A59 -> 3.3225407723562248 | BX59: =1-(LN(1-BX$1))/$A59 -> 3.3901626915860201 | BY59: =1-(LN(1-BY$1))/$A59 -> 3.460545440758874 | BZ59: =1-(LN(1-BZ$1))/$A59 -> 3.5339240863085224 | CA59: =1-(LN(1-CA$1))/$A59 -> 3.6105650562582361 | CB59: =1-(LN(1-CB$1))/$A59 -> 3.690771979766672 | CC59: =1-(LN(1-CC$1))/$A59 -> 3.7748929524725896 | CD59: =1-(LN(1-CD$1))/$A59 -> 3.8633296669338839 | CE59: =1-(LN(1-CE$1))/$A59 -> 3.9565490139516011 | CF59: =1-(LN(1-CF$1))/$A59 -> 4.0550980033308228 | CG59: =1-(LN(1-CG$1))/$A59 -> 4.1596232133591595 | CH59: =1-(LN(1-CH$1))/$A59 -> 4.2708965256653171 | CI59: =1-(LN(1-CI$1))/$A59 -> 4.389849752366958 | CJ59: =1-(LN(1-CJ$1))/$A59 -> 4.5176221181492382 | CK59: =1-(LN(1-CK$1))/$A59 -> 4.6556267865518874 | CL59: =1-(LN(1-CL$1))/$A59 -> 4.8056464020512504 | CM59: =1-(LN(1-CM$1))/$A59 -> 4.9699742982656048 | CN59: =1-(LN(1-CN$1))/$A59 -> 5.1516303597446162 | CO59: =1-(LN(1-CO$1))/$A59 -> 5.3547045591521751 | CP59: =1-(LN(1-CP$1))/$A59 -> 5.5849310981599745 | CQ59: =1-(LN(1-CQ$1))/$A59 -> 5.8507081323449057 | CR59: =1-(LN(1-CR$1))/$A59 -> 6.1650556440586239 | CS59: =1-(LN(1-CS$1))/$A59 -> 6.5497859049451979 | CT59: =1-(LN(1-CT$1))/$A59 -> 7.0457894781379338 | CU59: =1-(LN(1-CU$1))/$A59 -> 7.7448672507382348 | CV59: =1-(LN(1-CV$1))/$A59 -> 8.9399485965313019
A60: =A59+0.01 -> 00.59 | B60: =1-(LN(1-B$1))/$A60 -> 1.0170344675483076 | C60: =1-(LN(1-C$1))/$A60 -> 1.0342418768093551 | D60: =1-(LN(1-D$1))/$A60 -> 1.0516257753978111 | E60: =1-(LN(1-E$1))/$A60 -> 1.0691898212207713 | F60: =1-(LN(1-F$1))/$A60 -> 1.0869377870975434 | G60: =1-(LN(1-G$1))/$A60 -> 1.1048735656238771 | H60: =1-(LN(1-H$1))/$A60 -> 1.1230011742963313 | I60: =1-(LN(1-I$1))/$A60 -> 1.1413247609136457 | J60: =1-(LN(1-J$1))/$A60 -> 1.1598486092732903 | K60: =1-(LN(1-K$1))/$A60 -> 1.1785771451827562 | L60: =1-(LN(1-L$1))/$A60 -> 1.1975149428066973 | M60: =1-(LN(1-M$1))/$A60 -> 1.2166667313726862 | N60: =1-(LN(1-N$1))/$A60 -> 1.2360374022601823 | O60: =1-(LN(1-O$1))/$A60 -> 1.2556320164992942 | P60: =1-(LN(1-P$1))/$A60 -> 1.2754558127080931 | Q60: =1-(LN(1-Q$1))/$A60 -> 1.2955142154996233 | R60: =1-(LN(1-R$1))/$A60 -> 1.3158128443923616 | S60: =1-(LN(1-S$1))/$A60 -> 1.3363575232607428 | T60: =1-(LN(1-T$1))/$A60 -> 1.3571542903655129 | U60: =1-(LN(1-U$1))/$A60 -> 1.3782094090071351 | V60: =1-(LN(1-V$1))/$A60 -> 1.3995293788492709 | W60: =1-(LN(1-W$1))/$A60 -> 1.4211209479635587 | X60: =1-(LN(1-X$1))/$A60 -> 1.4429911256515382 | Y60: =1-(LN(1-Y$1))/$A60 -> 1.4651471961046785 | Z60: =1-(LN(1-Z$1))/$A60 -> 1.48759673296912 | AA60: =1-(LN(1-AA$1))/$A60 -> 1.5103476148880026 | AB60: =1-(LN(1-AB$1))/$A60 -> 1.5334080421011866 | AC60: =1-(LN(1-AC$1))/$A60 -> 1.5567865541898915 | AD60: =1-(LN(1-AD$1))/$A60 -> 1.580492049062332 | AE60: =1-(LN(1-AE$1))/$A60 -> 1.604533803285987 | AF60: =1-(LN(1-AF$1))/$A60 -> 1.6289214938827659 | AG60: =1-(LN(1-AG$1))/$A60 -> 1.6536652217152281 | AH60: =1-(LN(1-AH$1))/$A60 -> 1.678775536605297 | AI60: =1-(LN(1-AI$1))/$A60 -> 1.7042634643418064 | AJ60: =1-(LN(1-AJ$1))/$A60 -> 1.7301405357499222 | AK60: =1-(LN(1-AK$1))/$A60 -> 1.7564188180142701 | AL60: =1-(LN(1-AL$1))/$A60 -> 1.7831109484687433 | AM60: =1-(LN(1-AM$1))/$A60 -> 1.8102301710898301 | AN60: =1-(LN(1-AN$1))/$A60 -> 1.8377903759572543 | AO60: =1-(LN(1-AO$1))/$A60 -> 1.8658061419762553 | AP60: =1-(LN(1-AP$1))/$A60 -> 1.894292783190461 | AQ60: =1-(LN(1-AQ$1))/$A60 -> 1.9232663990536814 | AR60: =1-(LN(1-AR$1))/$A60 -> 1.9527439290737987 | AS60: =1-(LN(1-AS$1))/$A60 -> 1.9827432122931223 | AT60: =1-(LN(1-AT$1))/$A60 -> 2.0132830521281702 | AU60: =1-(LN(1-AU$1))/$A60 -> 2.044383287159012 | AV60: =1-(LN(1-AV$1))/$A60 -> 2.0760648685355418 | AW60: =1-(LN(1-AW$1))/$A60 -> 2.1083499447570579 | AX60: =1-(LN(1-AX$1))/$A60 -> 2.1412619546843485 | AY60: =1-(LN(1-AY$1))/$A60 -> 2.1748257297626195 | AZ60: =1-(LN(1-AZ$1))/$A60 -> 2.2090676065719741 | BA60: =1-(LN(1-BA$1))/$A60 -> 2.2440155509833906 | BB60: =1-(LN(1-BB$1))/$A60 -> 2.2796992953864965 | BC60: =1-(LN(1-BC$1))/$A60 -> 2.3161504906762653 | BD60: =1-(LN(1-BD$1))/$A60 -> 2.3534028749453757 | BE60: =1-(LN(1-BE$1))/$A60 -> 2.3914924611353054 | BF60: =1-(LN(1-BF$1))/$A60 -> 2.4304577462619141 | BG60: =1-(LN(1-BG$1))/$A60 -> 2.4703399452622428 | BH60: =1-(LN(1-BH$1))/$A60 -> 2.5111832530233622 | BI60: =1-(LN(1-BI$1))/$A60 -> 2.5530351387697552 | BJ60: =1-(LN(1-BJ$1))/$A60 -> 2.5959466777261784 | BK60: =1-(LN(1-BK$1))/$A60 -> 2.6399729258672986 | BL60: =1-(LN(1-BL$1))/$A60 -> 2.6851733446506225 | BM60: =1-(LN(1-BM$1))/$A60 -> 2.7316122839525114 | BN60: =1-(LN(1-BN$1))/$A60 -> 2.7793595330486074 | BO60: =1-(LN(1-BO$1))/$A60 -> 2.8284909514778485 | BP60: =1-(LN(1-BP$1))/$A60 -> 2.8790891941044263 | BQ60: =1-(LN(1-BQ$1))/$A60 -> 2.9312445477768905 | BR60: =1-(LN(1-BR$1))/$A60 -> 2.9850559008524504 | BS60: =1-(LN(1-BS$1))/$A60 -> 3.0406318717388756 | BT60: =1-(LN(1-BT$1))/$A60 -> 3.0980921288163019 | BU60: =1-(LN(1-BU$1))/$A60 -> 3.1575689420557427 | BV60: =1-(LN(1-BV$1))/$A60 -> 3.2192090169216323 | BW60: =1-(LN(1-BW$1))/$A60 -> 3.2831756745196783 | BX60: =1-(LN(1-BX$1))/$A60 -> 3.3496514595252402 | BY60: =1-(LN(1-BY$1))/$A60 -> 3.4188412807460118 | BZ60: =1-(LN(1-BZ$1))/$A60 -> 3.4909762204388861 | CA60: =1-(LN(1-CA$1))/$A60 -> 3.5663181908979271 | CB60: =1-(LN(1-CB$1))/$A60 -> 3.645165675024864 | CC60: =1-(LN(1-CC$1))/$A60 -> 3.727860868532376 | CD60: =1-(LN(1-CD$1))/$A60 -> 3.8147986556299198 | CE60: =1-(LN(1-CE$1))/$A60 -> 3.9064380137151331 | CF60: =1-(LN(1-CF$1))/$A60 -> 4.0033166812404701 | CG60: =1-(LN(1-CG$1))/$A60 -> 4.1060702775395121 | CH60: =1-(LN(1-CH$1))/$A60 -> 4.2154576015014982 | CI60: =1-(LN(1-CI$1))/$A60 -> 4.3323946718183652 | CJ60: =1-(LN(1-CJ$1))/$A60 -> 4.4580014042823013 | CK60: =1-(LN(1-CK$1))/$A60 -> 4.5936670105086357 | CL60: =1-(LN(1-CL$1))/$A60 -> 4.7411439206605506 | CM60: =1-(LN(1-CM$1))/$A60 -> 4.9026865982950003 | CN60: =1-(LN(1-CN$1))/$A60 -> 5.0812637434777583 | CO60: =1-(LN(1-CO$1))/$A60 -> 5.2808960073021378 | CP60: =1-(LN(1-CP$1))/$A60 -> 5.5072204015809927 | CQ60: =1-(LN(1-CQ$1))/$A60 -> 5.7684927402712631 | CR60: =1-(LN(1-CR$1))/$A60 -> 6.0775123280576304 | CS60: =1-(LN(1-CS$1))/$A60 -> 6.4557217370647706 | CT60: =1-(LN(1-CT$1))/$A60 -> 6.9433184700339003 | CU60: =1-(LN(1-CU$1))/$A60 -> 7.6305474668274176 | CV60: =1-(LN(1-CV$1))/$A60 -> 8.805373196590093
A61: =A60+0.01 -> 00.6 | B61: =1-(LN(1-B$1))/$A61 -> 1.0167505597558357 | C61: =1-(LN(1-C$1))/$A61 -> 1.0336711788625323 | D61: =1-(LN(1-D$1))/$A61 -> 1.0507653458078476 | E61: =1-(LN(1-E$1))/$A61 -> 1.0680366575337585 | F61: =1-(LN(1-F$1))/$A61 -> 1.0854888239792508 | G61: =1-(LN(1-G$1))/$A61 -> 1.1031256728634791 | H61: =1-(LN(1-H$1))/$A61 -> 1.1209511547247257 | I61: =1-(LN(1-I$1))/$A61 -> 1.1389693482317516 | J61: =1-(LN(1-J$1))/$A61 -> 1.157184465785402 | K61: =1-(LN(1-K$1))/$A61 -> 1.1756008594297103 | L61: =1-(LN(1-L$1))/$A61 -> 1.1942230270932523 | M61: =1-(LN(1-M$1))/$A61 -> 1.2130556191831414 | N61: =1-(LN(1-N$1))/$A61 -> 1.2321034455558459 | O61: =1-(LN(1-O$1))/$A61 -> 1.2513714828909726 | P61: =1-(LN(1-P$1))/$A61 -> 1.2708648824962914 | Q61: =1-(LN(1-Q$1))/$A61 -> 1.2905889785746294 | R61: =1-(LN(1-R$1))/$A61 -> 1.3105492969858223 | S61: =1-(LN(1-S$1))/$A61 -> 1.3307515645397303 | T61: =1-(LN(1-T$1))/$A61 -> 1.351201718859421 | U61: =1-(LN(1-U$1))/$A61 -> 1.3719059188570162 | V61: =1-(LN(1-V$1))/$A61 -> 1.3928705558684498 | W61: =1-(LN(1-W$1))/$A61 -> 1.4141022654974993 | X61: =1-(LN(1-X$1))/$A61 -> 1.4356079402240125 | Y61: =1-(LN(1-Y$1))/$A61 -> 1.457394742836267 | Z61: =1-(LN(1-Z$1))/$A61 -> 1.4794701207529679 | AA61: =1-(LN(1-AA$1))/$A61 -> 1.5018418213065359 | AB61: =1-(LN(1-AB$1))/$A61 -> 1.5245179080661668 | AC61: =1-(LN(1-AC$1))/$A61 -> 1.5475067782867264 | AD61: =1-(LN(1-AD$1))/$A61 -> 1.5708171815779597 | AE61: =1-(LN(1-AE$1))/$A61 -> 1.5944582398978873 | AF61: =1-(LN(1-AF$1))/$A61 -> 1.6184394689847199 | AG61: =1-(LN(1-AG$1))/$A61 -> 1.6427708013533078 | AH61: =1-(LN(1-AH$1))/$A61 -> 1.6674626109952086 | AI61: =1-(LN(1-AI$1))/$A61 -> 1.6925257399361096 | AJ61: =1-(LN(1-AJ$1))/$A61 -> 1.7179715268207569 | AK61: =1-(LN(1-AK$1))/$A61 -> 1.7438118377140324 | AL61: =1-(LN(1-AL$1))/$A61 -> 1.7700590993275975 | AM61: =1-(LN(1-AM$1))/$A61 -> 1.7967263349049998 | AN61: =1-(LN(1-AN$1))/$A61 -> 1.8238272030246334 | AO61: =1-(LN(1-AO$1))/$A61 -> 1.8513760396099843 | AP61: =1-(LN(1-AP$1))/$A61 -> 1.87938790347062 | AQ61: =1-(LN(1-AQ$1))/$A61 -> 1.90787862573612 | AR61: =1-(LN(1-AR$1))/$A61 -> 1.9368648635892354 | AS61: =1-(LN(1-AS$1))/$A61 -> 1.9663641587549037 | AT61: =1-(LN(1-AT$1))/$A61 -> 1.9963950012593674 | AU61: =1-(LN(1-AU$1))/$A61 -> 2.026976899039695 | AV61: =1-(LN(1-AV$1))/$A61 -> 2.0581304540599494 | AW61: =1-(LN(1-AW$1))/$A61 -> 2.0898774456777733 | AX61: =1-(LN(1-AX$1))/$A61 -> 2.1222409221062764 | AY61: =1-(LN(1-AY$1))/$A61 -> 2.1552453009332422 | AZ61: =1-(LN(1-AZ$1))/$A61 -> 2.1889164797957745 | BA61: =1-(LN(1-BA$1))/$A61 -> 2.2232819584670009 | BB61: =1-(LN(1-BB$1))/$A61 -> 2.2583709737967217 | BC61: =1-(LN(1-BC$1))/$A61 -> 2.294214649164994 | BD61: =1-(LN(1-BD$1))/$A61 -> 2.3308461603629529 | BE61: =1-(LN(1-BE$1))/$A61 -> 2.3683009201163836 | BF61: =1-(LN(1-BF$1))/$A61 -> 2.4066167838242154 | BG61: =1-(LN(1-BG$1))/$A61 -> 2.445834279507872 | BH61: =1-(LN(1-BH$1))/$A61 -> 2.4859968654729734 | BI61: =1-(LN(1-BI$1))/$A61 -> 2.5271512197902588 | BJ61: =1-(LN(1-BJ$1))/$A61 -> 2.5693475664307419 | BK61: =1-(LN(1-BK$1))/$A61 -> 2.6126400437695096 | BL61: =1-(LN(1-BL$1))/$A61 -> 2.6570871222397789 | BM61: =1-(LN(1-BM$1))/$A61 -> 2.7027520792199695 | BN61: =1-(LN(1-BN$1))/$A61 -> 2.7497035408311303 | BO61: =1-(LN(1-BO$1))/$A61 -> 2.7980161022865508 | BP61: =1-(LN(1-BP$1))/$A61 -> 2.8477710408693531 | BQ61: =1-(LN(1-BQ$1))/$A61 -> 2.8990571386472759 | BR61: =1-(LN(1-BR$1))/$A61 -> 2.9519716358382428 | BS61: =1-(LN(1-BS$1))/$A61 -> 3.0066213405432278 | BT61: =1-(LN(1-BT$1))/$A61 -> 3.0631239266693635 | BU61: =1-(LN(1-BU$1))/$A61 -> 3.121609459688147 | BV61: =1-(LN(1-BV$1))/$A61 -> 3.1822221999729385 | BW61: =1-(LN(1-BW$1))/$A61 -> 3.2451227466110173 | BX61: =1-(LN(1-BX$1))/$A61 -> 3.3104906018664861 | BY61: =1-(LN(1-BY$1))/$A61 -> 3.3785272594002449 | BZ61: =1-(LN(1-BZ$1))/$A61 -> 3.4494599500982384 | CA61: =1-(LN(1-CA$1))/$A61 -> 3.5235462210496284 | CB61: =1-(LN(1-CB$1))/$A61 -> 3.6010795804411164 | CC61: =1-(LN(1-CC$1))/$A61 -> 3.6823965207235032 | CD61: =1-(LN(1-CD$1))/$A61 -> 3.7678853447027545 | CE61: =1-(LN(1-CE$1))/$A61 -> 3.8579973801532144 | CF61: =1-(LN(1-CF$1))/$A61 -> 3.9532614032197957 | CG61: =1-(LN(1-CG$1))/$A61 -> 4.0543024395805212 | CH61: =1-(LN(1-CH$1))/$A61 -> 4.1618666414764736 | CI61: =1-(LN(1-CI$1))/$A61 -> 4.2768547606213927 | CJ61: =1-(LN(1-CJ$1))/$A61 -> 4.4003680475442639 | CK61: =1-(LN(1-CK$1))/$A61 -> 4.5337725603334915 | CL61: =1-(LN(1-CL$1))/$A61 -> 4.6787915219828751 | CM61: =1-(LN(1-CM$1))/$A61 -> 4.8376418216567512 | CN61: =1-(LN(1-CN$1))/$A61 -> 5.0132426810864619 | CO61: =1-(LN(1-CO$1))/$A61 -> 5.2095477405137691 | CP61: =1-(LN(1-CP$1))/$A61 -> 5.4321000615546424 | CQ61: =1-(LN(1-CQ$1))/$A61 -> 5.6890178612667421 | CR61: =1-(LN(1-CR$1))/$A61 -> 5.9928871225900027 | CS61: =1-(LN(1-CS$1))/$A61 -> 6.3647930414470251 | CT61: =1-(LN(1-CT$1))/$A61 -> 6.8442631622000025 | CU61: =1-(LN(1-CU$1))/$A61 -> 7.5200383423802943 | CV61: =1-(LN(1-CV$1))/$A61 -> 8.6752836433135911
A62: =A61+0.01 -> 00.61 | B62: =1-(LN(1-B$1))/$A62 -> 1.0164759604155762 | C62: =1-(LN(1-C$1))/$A62 -> 1.0331191923238023 | D62: =1-(LN(1-D$1))/$A62 -> 1.0499331270241123 | E62: =1-(LN(1-E$1))/$A62 -> 1.0669213024922215 | F62: =1-(LN(1-F$1))/$A62 -> 1.0840873678484435 | G62: =1-(LN(1-G$1))/$A62 -> 1.1014350880624386 | H62: =1-(LN(1-H$1))/$A62 -> 1.1189683489095663 | I62: =1-(LN(1-I$1))/$A62 -> 1.1366911621951656 | J62: =1-(LN(1-J$1))/$A62 -> 1.1546076712643298 | K62: =1-(LN(1-K$1))/$A62 -> 1.1727221568161086 | L62: =1-(LN(1-L$1))/$A62 -> 1.1910390430425433 | M62: =1-(LN(1-M$1))/$A62 -> 1.2095629041145652 | N62: =1-(LN(1-N$1))/$A62 -> 1.228298471038537 | O62: =1-(LN(1-O$1))/$A62 -> 1.2472506389091533 | P62: =1-(LN(1-P$1))/$A62 -> 1.2664244745865161 | Q62: =1-(LN(1-Q$1))/$A62 -> 1.2858252248275044 | R62: =1-(LN(1-R$1))/$A62 -> 1.3054583249040874 | S62: =1-(LN(1-S$1))/$A62 -> 1.325329407743997 | T62: =1-(LN(1-T$1))/$A62 -> 1.3454443136322174 | U62: =1-(LN(1-U$1))/$A62 -> 1.3658091005150979 | V62: =1-(LN(1-V$1))/$A62 -> 1.3864300549525734 | W62: =1-(LN(1-W$1))/$A62 -> 1.4073137037680321 | X62: =1-(LN(1-X$1))/$A62 -> 1.4284668264498483 | Y62: =1-(LN(1-Y$1))/$A62 -> 1.4498964683635414 | Z62: =1-(LN(1-Z$1))/$A62 -> 1.4716099548389847 | AA62: =1-(LN(1-AA$1))/$A62 -> 1.4936149062031499 | AB62: =1-(LN(1-AB$1))/$A62 -> 1.5159192538355739 | AC62: =1-(LN(1-AC$1))/$A62 -> 1.5385312573312064 | AD62: =1-(LN(1-AD$1))/$A62 -> 1.5614595228635668 | AE62: =1-(LN(1-AE$1))/$A62 -> 1.5847130228503807 | AF62: =1-(LN(1-AF$1))/$A62 -> 1.6083011170341506 | AG62: =1-(LN(1-AG$1))/$A62 -> 1.6322335751016142 | AH62: =1-(LN(1-AH$1))/$A62 -> 1.6565206009788938 | AI62: =1-(LN(1-AI$1))/$A62 -> 1.6811728589535504 | AJ62: =1-(LN(1-AJ$1))/$A62 -> 1.7062015017909085 | AK62: =1-(LN(1-AK$1))/$A62 -> 1.7316182010301957 | AL62: =1-(LN(1-AL$1))/$A62 -> 1.7574351796664895 | AM62: =1-(LN(1-AM$1))/$A62 -> 1.7836652474475407 | AN62: =1-(LN(1-AN$1))/$A62 -> 1.810321839040623 | AO62: =1-(LN(1-AO$1))/$A62 -> 1.8374190553540832 | AP62: =1-(LN(1-AP$1))/$A62 -> 1.8649717083317574 | AQ62: =1-(LN(1-AQ$1))/$A62 -> 1.8929953695765116 | AR62: =1-(LN(1-AR$1))/$A62 -> 1.9215064232025267 | AS62: =1-(LN(1-AS$1))/$A62 -> 1.950522123365479 | AT62: =1-(LN(1-AT$1))/$A62 -> 1.980060656976427 | AU62: =1-(LN(1-AU$1))/$A62 -> 2.0101412121701916 | AV62: =1-(LN(1-AV$1))/$A62 -> 2.0407840531737209 | AW62: =1-(LN(1-AW$1))/$A62 -> 2.0720106023060065 | AX62: =1-(LN(1-AX$1))/$A62 -> 2.1038435299405993 | AY62: =1-(LN(1-AY$1))/$A62 -> 2.1363068533769596 | AZ62: =1-(LN(1-AZ$1))/$A62 -> 2.1694260457007619 | BA62: =1-(LN(1-BA$1))/$A62 -> 2.2032281558691813 | BB62: =1-(LN(1-BB$1))/$A62 -> 2.2377419414393982 | BC62: =1-(LN(1-BC$1))/$A62 -> 2.2729980155721252 | BD62: =1-(LN(1-BD$1))/$A62 -> 2.3090290101930684 | BE62: =1-(LN(1-BE$1))/$A62 -> 2.345869757491525 | BF62: =1-(LN(1-BF$1))/$A62 -> 2.3835574922861134 | BG62: =1-(LN(1-BG$1))/$A62 -> 2.4221320782044646 | BH62: =1-(LN(1-BH$1))/$A62 -> 2.4616362611209572 | BI62: =1-(LN(1-BI$1))/$A62 -> 2.5021159538920581 | BJ62: =1-(LN(1-BJ$1))/$A62 -> 2.5436205571449921 | BK62: =1-(LN(1-BK$1))/$A62 -> 2.5862033217405016 | BL62: =1-(LN(1-BL$1))/$A62 -> 2.6299217595801103 | BM62: =1-(LN(1-BM$1))/$A62 -> 2.6748381107081669 | BN62: =1-(LN(1-BN$1))/$A62 -> 2.7210198762273414 | BO62: =1-(LN(1-BO$1))/$A62 -> 2.7685404284785746 | BP62: =1-(LN(1-BP$1))/$A62 -> 2.8174797123305106 | BQ62: =1-(LN(1-BQ$1))/$A62 -> 2.8679250544071562 | BR62: =1-(LN(1-BR$1))/$A62 -> 2.9199721008245012 | BS62: =1-(LN(1-BS$1))/$A62 -> 2.9737259087310437 | BT62: =1-(LN(1-BT$1))/$A62 -> 3.0293022229534725 | BU62: =1-(LN(1-BU$1))/$A62 -> 3.0868289767424395 | BV62: =1-(LN(1-BV$1))/$A62 -> 3.1464480655471525 | BW62: =1-(LN(1-BW$1))/$A62 -> 3.2083174556829679 | BX62: =1-(LN(1-BX$1))/$A62 -> 3.2726137067539205 | BY62: =1-(LN(1-BY$1))/$A62 -> 3.3395350092461422 | BZ62: =1-(LN(1-BZ$1))/$A62 -> 3.4093048689490866 | CA62: =1-(LN(1-CA$1))/$A62 -> 3.4821766108684868 | CB62: =1-(LN(1-CB$1))/$A62 -> 3.558438931581426 | CC62: =1-(LN(1-CC$1))/$A62 -> 3.6384228072690195 | CD62: =1-(LN(1-CD$1))/$A62 -> 3.7225101751174634 | CE62: =1-(LN(1-CE$1))/$A62 -> 3.8111449640851287 | CF62: =1-(LN(1-CF$1))/$A62 -> 3.9048472818555369 | CG62: =1-(LN(1-CG$1))/$A62 -> 4.0042319077841189 | CH62: =1-(LN(1-CH$1))/$A62 -> 4.1100327621080064 | CI62: =1-(LN(1-CI$1))/$A62 -> 4.2231358301194026 | CJ62: =1-(LN(1-CJ$1))/$A62 -> 4.344624309059931 | CK62: =1-(LN(1-CK$1))/$A62 -> 4.4758418626231062 | CL62: =1-(LN(1-CL$1))/$A62 -> 4.6184834642454504 | CM62: =1-(LN(1-CM$1))/$A62 -> 4.7747296606459848 | CN62: =1-(LN(1-CN$1))/$A62 -> 4.9474518174620936 | CO62: =1-(LN(1-CO$1))/$A62 -> 5.1405387611610847 | CP62: =1-(LN(1-CP$1))/$A62 -> 5.3594426834963693 | CQ62: =1-(LN(1-CQ$1))/$A62 -> 5.6121487160000738 | CR62: =1-(LN(1-CR$1))/$A62 -> 5.9110365140229533 | CS62: =1-(LN(1-CS$1))/$A62 -> 6.2768456145380576 | CT62: =1-(LN(1-CT$1))/$A62 -> 6.7484555693770512 | CU62: =1-(LN(1-CU$1))/$A62 -> 7.4131524679150429 | CV62: =1-(LN(1-CV$1))/$A62 -> 8.5494593212920584
A63: =A62+0.01 -> 00.62 | B63: =1-(LN(1-B$1))/$A63 -> 1.0162102191185507 | C63: =1-(LN(1-C$1))/$A63 -> 1.0325850118024507 | D63: =1-(LN(1-D$1))/$A63 -> 1.0491277540075945 | E63: =1-(LN(1-E$1))/$A63 -> 1.0658419266455728 | F63: =1-(LN(1-F$1))/$A63 -> 1.0827311199799203 | G63: =1-(LN(1-G$1))/$A63 -> 1.0997990382549798 | H63: =1-(LN(1-H$1))/$A63 -> 1.1170495045723152 | I63: =1-(LN(1-I$1))/$A63 -> 1.1344864660307274 | J63: =1-(LN(1-J$1))/$A63 -> 1.1521139991471632 | K63: =1-(LN(1-K$1))/$A63 -> 1.169936315577139 | L63: =1-(LN(1-L$1))/$A63 -> 1.1879577681547604 | M63: =1-(LN(1-M$1))/$A63 -> 1.2061828572740079 | N63: =1-(LN(1-N$1))/$A63 -> 1.2246162376346896 | O63: =1-(LN(1-O$1))/$A63 -> 1.2432627253783606 | P63: =1-(LN(1-P$1))/$A63 -> 1.2621273056415723 | Q63: =1-(LN(1-Q$1))/$A63 -> 1.281215140556093 | R63: =1-(LN(1-R$1))/$A63 -> 1.3005315777282151 | S63: =1-(LN(1-S$1))/$A63 -> 1.3200821592319971 | T63: =1-(LN(1-T$1))/$A63 -> 1.3398726311542783 | U63: =1-(LN(1-U$1))/$A63 -> 1.3599089537325963 | V63: =1-(LN(1-V$1))/$A63 -> 1.3801973121307578 | W63: =1-(LN(1-W$1))/$A63 -> 1.4007441279008059 | X63: =1-(LN(1-X$1))/$A63 -> 1.4215560711845283 | Y63: =1-(LN(1-Y$1))/$A63 -> 1.4426400737125165 | Z63: =1-(LN(1-Z$1))/$A63 -> 1.4640033426641625 | AA63: =1-(LN(1-AA$1))/$A63 -> 1.4856533754579377 | AB63: =1-(LN(1-AB$1))/$A63 -> 1.5075979755479034 | AC63: =1-(LN(1-AC$1))/$A63 -> 1.5298452693097353 | AD63: =1-(LN(1-AD$1))/$A63 -> 1.5524037241077031 | AE63: =1-(LN(1-AE$1))/$A63 -> 1.5752821676431166 | AF63: =1-(LN(1-AF$1))/$A63 -> 1.59848980869489 | AG63: =1-(LN(1-AG$1))/$A63 -> 1.6220362593741688 | AH63: =1-(LN(1-AH$1))/$A63 -> 1.6459315590276213 | AI63: =1-(LN(1-AI$1))/$A63 -> 1.6701861999381706 | AJ63: =1-(LN(1-AJ$1))/$A63 -> 1.6948111549878293 | AK63: =1-(LN(1-AK$1))/$A63 -> 1.7198179074651927 | AL63: =1-(LN(1-AL$1))/$A63 -> 1.7452184832202557 | AM63: =1-(LN(1-AM$1))/$A63 -> 1.7710254853919352 | AN63: =1-(LN(1-AN$1))/$A63 -> 1.7972521319593227 | AO63: =1-(LN(1-AO$1))/$A63 -> 1.8239122963967591 | AP63: =1-(LN(1-AP$1))/$A63 -> 1.8510205517457612 | AQ63: =1-(LN(1-AQ$1))/$A63 -> 1.8785922184543096 | AR63: =1-(LN(1-AR$1))/$A63 -> 1.9066434163766794 | AS63: =1-(LN(1-AS$1))/$A63 -> 1.9351911213757131 | AT63: =1-(LN(1-AT$1))/$A63 -> 1.9642532270251942 | AU63: =1-(LN(1-AU$1))/$A63 -> 1.9938486119738983 | AV63: =1-(LN(1-AV$1))/$A63 -> 2.0239972136064024 | AW63: =1-(LN(1-AW$1))/$A63 -> 2.0547201087204261 | AX63: =1-(LN(1-AX$1))/$A63 -> 2.0860396020383316 | AY63: =1-(LN(1-AY$1))/$A63 -> 2.1179793234837829 | AZ63: =1-(LN(1-AZ$1))/$A63 -> 2.1505643352862336 | BA63: =1-(LN(1-BA$1))/$A63 -> 2.1838212501293559 | BB63: =1-(LN(1-BB$1))/$A63 -> 2.2177783617387625 | BC63: =1-(LN(1-BC$1))/$A63 -> 2.2524657895145106 | BD63: =1-(LN(1-BD$1))/$A63 -> 2.2879156390609223 | BE63: =1-(LN(1-BE$1))/$A63 -> 2.3241621807577908 | BF63: =1-(LN(1-BF$1))/$A63 -> 2.3612420488621439 | BG63: =1-(LN(1-BG$1))/$A63 -> 2.3991944640398764 | BH63: =1-(LN(1-BH$1))/$A63 -> 2.4380614827157805 | BI63: =1-(LN(1-BI$1))/$A63 -> 2.4778882772163797 | BJ63: =1-(LN(1-BJ$1))/$A63 -> 2.5187234513845889 | BK63: =1-(LN(1-BK$1))/$A63 -> 2.5606193971962998 | BL63: =1-(LN(1-BL$1))/$A63 -> 2.6036326989417216 | BM63: =1-(LN(1-BM$1))/$A63 -> 2.6478245927935191 | BN63: =1-(LN(1-BN$1))/$A63 -> 2.6932614911269006 | BO63: =1-(LN(1-BO$1))/$A63 -> 2.7400155828579527 | BP63: =1-(LN(1-BP$1))/$A63 -> 2.788165523421954 | BQ63: =1-(LN(1-BQ$1))/$A63 -> 2.8377972309489765 | BR63: =1-(LN(1-BR$1))/$A63 -> 2.8890048088757192 | BS63: =1-(LN(1-BS$1))/$A63 -> 2.9418916198805429 | BT63: =1-(LN(1-BT$1))/$A63 -> 2.9965715419380938 | BU63: =1-(LN(1-BU$1))/$A63 -> 3.053170444859497 | BV63: =1-(LN(1-BV$1))/$A63 -> 3.1118279354576823 | BW63: =1-(LN(1-BW$1))/$A63 -> 3.1726994322042104 | BX63: =1-(LN(1-BX$1))/$A63 -> 3.2359586469675672 | BY63: =1-(LN(1-BY$1))/$A63 -> 3.3018005736131402 | BZ63: =1-(LN(1-BZ$1))/$A63 -> 3.3704451129982949 | CA63: =1-(LN(1-CA$1))/$A63 -> 3.4421415042415755 | CB63: =1-(LN(1-CB$1))/$A63 -> 3.5171737875236611 | CC63: =1-(LN(1-CC$1))/$A63 -> 3.5958676007001644 | CD63: =1-(LN(1-CD$1))/$A63 -> 3.678598720680085 | CE63: =1-(LN(1-CE$1))/$A63 -> 3.7658039162773043 | CF63: =1-(LN(1-CF$1))/$A63 -> 3.8579949063417378 | CG63: =1-(LN(1-CG$1))/$A63 -> 3.9557765544327617 | CH63: =1-(LN(1-CH$1))/$A63 -> 4.059870943364329 | CI63: =1-(LN(1-CI$1))/$A63 -> 4.1711497683432839 | CJ63: =1-(LN(1-CJ$1))/$A63 -> 4.2906787556879973 | CK63: =1-(LN(1-CK$1))/$A63 -> 4.4197798970969266 | CL63: =1-(LN(1-CL$1))/$A63 -> 4.5601208277253633 | CM63: =1-(LN(1-CM$1))/$A63 -> 4.7138469241839527 | CN63: =1-(LN(1-CN$1))/$A63 -> 4.8837832397610921 | CO63: =1-(LN(1-CO$1))/$A63 -> 5.0737558779165504 | CP63: =1-(LN(1-CP$1))/$A63 -> 5.289129091827073 | CQ63: =1-(LN(1-CQ$1))/$A63 -> 5.5377592205807176 | CR63: =1-(LN(1-CR$1))/$A63 -> 5.8318262476677445 | CS63: =1-(LN(1-CS$1))/$A63 -> 6.1917352014003466 | CT63: =1-(LN(1-CT$1))/$A63 -> 6.6557385440645183 | CU63: =1-(LN(1-CU$1))/$A63 -> 7.3097145248841553 | CV63: =1-(LN(1-CV$1))/$A63 -> 8.4276938483679924
A64: =A63+0.01 -> 00.63 | B64: =1-(LN(1-B$1))/$A64 -> 1.0159529140531769 | C64: =1-(LN(1-C$1))/$A64 -> 1.032067789392888 | D64: =1-(LN(1-D$1))/$A64 -> 1.0483479483884264 | E64: =1-(LN(1-E$1))/$A64 -> 1.0647968166988178 | F64: =1-(LN(1-F$1))/$A64 -> 1.0814179275992866 | G64: =1-(LN(1-G$1))/$A64 -> 1.0982149265366468 | H64: =1-(LN(1-H$1))/$A64 -> 1.1151915759283102 | I64: =1-(LN(1-I$1))/$A64 -> 1.1323517602207158 | J64: =1-(LN(1-J$1))/$A64 -> 1.1496994912241925 | K64: =1-(LN(1-K$1))/$A64 -> 1.1672389137425814 | L64: =1-(LN(1-L$1))/$A64 -> 1.1849743115173832 | M64: =1-(LN(1-M$1))/$A64 -> 1.2029101135077536 | N64: =1-(LN(1-N$1))/$A64 -> 1.221050900529377 | O64: =1-(LN(1-O$1))/$A64 -> 1.2394014122771169 | P64: =1-(LN(1-P$1))/$A64 -> 1.2579665547583727 | Q64: =1-(LN(1-Q$1))/$A64 -> 1.2767514081663138 | R64: =1-(LN(1-R$1))/$A64 -> 1.2957612352245926 | S64: =1-(LN(1-S$1))/$A64 -> 1.3150014900378384 | T64: =1-(LN(1-T$1))/$A64 -> 1.3344778274851627 | U64: =1-(LN(1-U$1))/$A64 -> 1.3541961131971583 | V64: =1-(LN(1-V$1))/$A64 -> 1.3741624341604284 | W64: =1-(LN(1-W$1))/$A64 -> 1.3943831099976185 | X64: =1-(LN(1-X$1))/$A64 -> 1.4148647049752499 | Y64: =1-(LN(1-Y$1))/$A64 -> 1.4356140407964448 | Z64: =1-(LN(1-Z$1))/$A64 -> 1.4566382102409219 | AA64: =1-(LN(1-AA$1))/$A64 -> 1.4779445917205103 | AB64: =1-(LN(1-AB$1))/$A64 -> 1.4995408648249207 | AC64: =1-(LN(1-AC$1))/$A64 -> 1.5214350269397396 | AD64: =1-(LN(1-AD$1))/$A64 -> 1.5436354110266284 | AE64: =1-(LN(1-AE$1))/$A64 -> 1.5661507046646543 | AF64: =1-(LN(1-AF$1))/$A64 -> 1.5889899704616379 | AG64: =1-(LN(1-AG$1))/$A64 -> 1.612162667955531 | AH64: =1-(LN(1-AH$1))/$A64 -> 1.6356786771382938 | AI64: =1-(LN(1-AI$1))/$A64 -> 1.6595483237486759 | AJ64: =1-(LN(1-AJ$1))/$A64 -> 1.683782406495959 | AK64: =1-(LN(1-AK$1))/$A64 -> 1.7083922263943165 | AL64: =1-(LN(1-AL$1))/$A64 -> 1.7333896184072359 | AM64: =1-(LN(1-AM$1))/$A64 -> 1.7587869856238092 | AN64: =1-(LN(1-AN$1))/$A64 -> 1.7845973362139365 | AO64: =1-(LN(1-AO$1))/$A64 -> 1.8108343234380804 | AP64: =1-(LN(1-AP$1))/$A64 -> 1.8375122890196378 | AQ64: =1-(LN(1-AQ$1))/$A64 -> 1.864646310224876 | AR64: =1-(LN(1-AR$1))/$A64 -> 1.8922522510373669 | AS64: =1-(LN(1-AS$1))/$A64 -> 1.9203468178618128 | AT64: =1-(LN(1-AT$1))/$A64 -> 1.9489476202470164 | AU64: =1-(LN(1-AU$1))/$A64 -> 1.978073237180662 | AV64: =1-(LN(1-AV$1))/$A64 -> 2.0077432895809042 | AW64: =1-(LN(1-AW$1))/$A64 -> 2.0379785196931177 | AX64: =1-(LN(1-AX$1))/$A64 -> 2.0688008781964533 | AY64: =1-(LN(1-AY$1))/$A64 -> 2.1002336199364211 | AZ64: =1-(LN(1-AZ$1))/$A64 -> 2.1323014093293091 | BA64: =1-(LN(1-BA$1))/$A64 -> 2.1650304366352389 | BB64: =1-(LN(1-BB$1))/$A64 -> 2.1984485464730681 | BC64: =1-(LN(1-BC$1))/$A64 -> 2.2325853801571371 | BD64: =1-(LN(1-BD$1))/$A64 -> 2.2674725336790029 | BE64: =1-(LN(1-BE$1))/$A64 -> 2.3031437334441751 | BF64: =1-(LN(1-BF$1))/$A64 -> 2.3396350322135384 | BG64: =1-(LN(1-BG$1))/$A64 -> 2.3769850281027356 | BH64: =1-(LN(1-BH$1))/$A64 -> 2.4152351099742599 | BI64: =1-(LN(1-BI$1))/$A64 -> 2.4544297331335798 | BJ64: =1-(LN(1-BJ$1))/$A64 -> 2.49461672993404 | BK64: =1-(LN(1-BK$1))/$A64 -> 2.5358476607328666 | BL64: =1-(LN(1-BL$1))/$A64 -> 2.5781782116569323 | BM64: =1-(LN(1-BM$1))/$A64 -> 2.6216686468761616 | BN64: =1-(LN(1-BN$1))/$A64 -> 2.6663843246010765 | BO64: =1-(LN(1-BO$1))/$A64 -> 2.712396287891953 | BP64: =1-(LN(1-BP$1))/$A64 -> 2.7597819436850979 | BQ64: =1-(LN(1-BQ$1))/$A64 -> 2.8086258463307385 | BR64: =1-(LN(1-BR$1))/$A64 -> 2.8590206055602314 | BS64: =1-(LN(1-BS$1))/$A64 -> 2.9110679433745026 | BT64: =1-(LN(1-BT$1))/$A64 -> 2.9648799301612985 | BU64: =1-(LN(1-BU$1))/$A64 -> 3.0205804377982353 | BV64: =1-(LN(1-BV$1))/$A64 -> 3.0783068571170844 | BW64: =1-(LN(1-BW$1))/$A64 -> 3.1382121396295402 | BX64: =1-(LN(1-BX$1))/$A64 -> 3.200467239872844 | BY64: =1-(LN(1-BY$1))/$A64 -> 3.2652640565716617 | BZ64: =1-(LN(1-BZ$1))/$A64 -> 3.33281900009356 | CA64: =1-(LN(1-CA$1))/$A64 -> 3.4033773533805984 | CB64: =1-(LN(1-CB$1))/$A64 -> 3.4772186480391585 | CC64: =1-(LN(1-CC$1))/$A64 -> 3.5546633530700031 | CD64: =1-(LN(1-CD$1))/$A64 -> 3.6360812806692899 | CE64: =1-(LN(1-CE$1))/$A64 -> 3.721902266812585 | CF64: =1-(LN(1-CF$1))/$A64 -> 3.8126299078283767 | CG64: =1-(LN(1-CG$1))/$A64 -> 3.9088594662671623 | CH64: =1-(LN(1-CH$1))/$A64 -> 4.0113015633109264 | CI64: =1-(LN(1-CI$1))/$A64 -> 4.1208140577346599 | CJ64: =1-(LN(1-CJ$1))/$A64 -> 4.2384457595659644 | CK64: =1-(LN(1-CK$1))/$A64 -> 4.3654976765080864 | CL64: =1-(LN(1-CL$1))/$A64 -> 4.5036109733170235 | CM64: =1-(LN(1-CM$1))/$A64 -> 4.6548969730064291 | CN64: =1-(LN(1-CN$1))/$A64 -> 4.8221358867490114 | CO64: =1-(LN(1-CO$1))/$A64 -> 5.0090930862035892 | CP64: =1-(LN(1-CP$1))/$A64 -> 5.2210476776710877 | CQ64: =1-(LN(1-CQ$1))/$A64 -> 5.4657312964445159 | CR64: =1-(LN(1-CR$1))/$A64 -> 5.7551305929428596 | CS64: =1-(LN(1-CS$1))/$A64 -> 6.1093267061400232 | CT64: =1-(LN(1-CT$1))/$A64 -> 6.5659649163809544 | CU64: =1-(LN(1-CU$1))/$A64 -> 7.2095603260764705 | CV64: =1-(LN(1-CV$1))/$A64 -> 8.3097939460129453
A65: =A64+0.01 -> 00.64 | B65: =1-(LN(1-B$1))/$A65 -> 1.0157036497710961 | C65: =1-(LN(1-C$1))/$A65 -> 1.0315667301836242 | D65: =1-(LN(1-D$1))/$A65 -> 1.047592511694857 | E65: =1-(LN(1-E$1))/$A65 -> 1.0637843664378988 | F65: =1-(LN(1-F$1))/$A65 -> 1.0801457724805477 | G65: =1-(LN(1-G$1))/$A65 -> 1.0966803183095117 | H65: =1-(LN(1-H$1))/$A65 -> 1.1133917075544304 | I65: =1-(LN(1-I$1))/$A65 -> 1.1302837639672672 | J65: =1-(LN(1-J$1))/$A65 -> 1.1473604366738144 | K65: =1-(LN(1-K$1))/$A65 -> 1.1646258057153536 | L65: =1-(LN(1-L$1))/$A65 -> 1.1820840878999241 | M65: =1-(LN(1-M$1))/$A65 -> 1.1997396429841951 | N65: =1-(LN(1-N$1))/$A65 -> 1.2175969802086055 | O65: =1-(LN(1-O$1))/$A65 -> 1.2356607652102869 | P65: =1-(LN(1-P$1))/$A65 -> 1.2539358273402732 | Q65: =1-(LN(1-Q$1))/$A65 -> 1.2724271674137151 | R65: =1-(LN(1-R$1))/$A65 -> 1.2911399659242084 | S65: =1-(LN(1-S$1))/$A65 -> 1.3100795917559971 | T65: =1-(LN(1-T$1))/$A65 -> 1.3292516114307071 | U65: =1-(LN(1-U$1))/$A65 -> 1.3486617989284526 | V65: =1-(LN(1-V$1))/$A65 -> 1.3683161461266717 | W65: =1-(LN(1-W$1))/$A65 -> 1.3882208739039057 | X65: =1-(LN(1-X$1))/$A65 -> 1.4083824439600117 | Y65: =1-(LN(1-Y$1))/$A65 -> 1.4288075714090005 | Z65: =1-(LN(1-Z$1))/$A65 -> 1.4495032382059074 | AA65: =1-(LN(1-AA$1))/$A65 -> 1.4704767074748772 | AB65: =1-(LN(1-AB$1))/$A65 -> 1.4917355388120312 | AC65: =1-(LN(1-AC$1))/$A65 -> 1.5132876046438062 | AD65: =1-(LN(1-AD$1))/$A65 -> 1.5351411077293373 | AE65: =1-(LN(1-AE$1))/$A65 -> 1.5573045999042692 | AF65: =1-(LN(1-AF$1))/$A65 -> 1.5797870021731748 | AG65: =1-(LN(1-AG$1))/$A65 -> 1.602597626268726 | AH65: =1-(LN(1-AH$1))/$A65 -> 1.6257461978080081 | AI65: =1-(LN(1-AI$1))/$A65 -> 1.6492428811901028 | AJ65: =1-(LN(1-AJ$1))/$A65 -> 1.6730983063944596 | AK65: =1-(LN(1-AK$1))/$A65 -> 1.6973235978569052 | AL65: =1-(LN(1-AL$1))/$A65 -> 1.7219304056196227 | AM65: =1-(LN(1-AM$1))/$A65 -> 1.7469309389734371 | AN65: =1-(LN(1-AN$1))/$A65 -> 1.772338002835594 | AO65: =1-(LN(1-AO$1))/$A65 -> 1.7981650371343605 | AP65: =1-(LN(1-AP$1))/$A65 -> 1.8244261595037061 | AQ65: =1-(LN(1-AQ$1))/$A65 -> 1.8511362116276124 | AR65: =1-(LN(1-AR$1))/$A65 -> 1.8783108096149082 | AS65: =1-(LN(1-AS$1))/$A65 -> 1.9059663988327222 | AT65: =1-(LN(1-AT$1))/$A65 -> 1.9341203136806571 | AU65: =1-(LN(1-AU$1))/$A65 -> 1.9627908428497141 | AV65: =1-(LN(1-AV$1))/$A65 -> 1.9919973006812026 | AW65: =1-(LN(1-AW$1))/$A65 -> 2.0217601053229126 | AX65: =1-(LN(1-AX$1))/$A65 -> 2.0521008644746335 | AY65: =1-(LN(1-AY$1))/$A65 -> 2.0830424696249148 | AZ65: =1-(LN(1-AZ$1))/$A65 -> 2.1146091998085388 | BA65: =1-(LN(1-BA$1))/$A65 -> 2.1468268360628135 | BB65: =1-(LN(1-BB$1))/$A65 -> 2.1797227879344261 | BC65: =1-(LN(1-BC$1))/$A65 -> 2.2133262335921824 | BD65: =1-(LN(1-BD$1))/$A65 -> 2.2476682753402684 | BE65: =1-(LN(1-BE$1))/$A65 -> 2.2827821126091097 | BF65: =1-(LN(1-BF$1))/$A65 -> 2.3187032348352021 | BG65: =1-(LN(1-BG$1))/$A65 -> 2.3554696370386301 | BH65: =1-(LN(1-BH$1))/$A65 -> 2.3931220613809119 | BI65: =1-(LN(1-BI$1))/$A65 -> 2.4317042685533679 | BJ65: =1-(LN(1-BJ$1))/$A65 -> 2.4712633435288209 | BK65: =1-(LN(1-BK$1))/$A65 -> 2.5118500410339157 | BL65: =1-(LN(1-BL$1))/$A65 -> 2.5535191770997923 | BM65: =1-(LN(1-BM$1))/$A65 -> 2.5963300742687214 | BN65: =1-(LN(1-BN$1))/$A65 -> 2.6403470695291844 | BO65: =1-(LN(1-BO$1))/$A65 -> 2.6856400958936417 | BP65: =1-(LN(1-BP$1))/$A65 -> 2.732285350815018 | BQ65: =1-(LN(1-BQ$1))/$A65 -> 2.7803660674818209 | BR65: =1-(LN(1-BR$1))/$A65 -> 2.8299734085983528 | BS65: =1-(LN(1-BS$1))/$A65 -> 2.8812075067592762 | BT65: =1-(LN(1-BT$1))/$A65 -> 2.9341786812525283 | BU65: =1-(LN(1-BU$1))/$A65 -> 2.9890088684576379 | BV65: =1-(LN(1-BV$1))/$A65 -> 3.0458333124746297 | BW65: =1-(LN(1-BW$1))/$A65 -> 3.1048025749478287 | BX65: =1-(LN(1-BX$1))/$A65 -> 3.1660849392498305 | BY65: =1-(LN(1-BY$1))/$A65 -> 3.2298693056877292 | BZ65: =1-(LN(1-BZ$1))/$A65 -> 3.2963687032170981 | CA65: =1-(LN(1-CA$1))/$A65 -> 3.3658245822340263 | CB65: =1-(LN(1-CB$1))/$A65 -> 3.4385121066635462 | CC65: =1-(LN(1-CC$1))/$A65 -> 3.514746738178284 | CD65: =1-(LN(1-CD$1))/$A65 -> 3.5948925106588323 | CE65: =1-(LN(1-CE$1))/$A65 -> 3.6793725438936384 | CF65: =1-(LN(1-CF$1))/$A65 -> 3.7686825655185583 | CG65: =1-(LN(1-CG$1))/$A65 -> 3.8634085371067379 | CH65: =1-(LN(1-CH$1))/$A65 -> 3.9642499763841936 | CI65: =1-(LN(1-CI$1))/$A65 -> 4.0720513380825558 | CJ65: =1-(LN(1-CJ$1))/$A65 -> 4.1878450445727466 | CK65: =1-(LN(1-CK$1))/$A65 -> 4.3129117753126476 | CL65: =1-(LN(1-CL$1))/$A65 -> 4.4488670518589455 | CM65: =1-(LN(1-CM$1))/$A65 -> 4.5977892078032037 | CN65: =1-(LN(1-CN$1))/$A65 -> 4.7624150135185577 | CO65: =1-(LN(1-CO$1))/$A65 -> 4.9464510067316585 | CP65: =1-(LN(1-CP$1))/$A65 -> 5.1550938077074768 | CQ65: =1-(LN(1-CQ$1))/$A65 -> 5.3959542449375704 | CR65: =1-(LN(1-CR$1))/$A65 -> 5.6808316774281273 | CS65: =1-(LN(1-CS$1))/$A65 -> 6.0294934763565857 | CT65: =1-(LN(1-CT$1))/$A65 -> 6.478996714562502 | CU65: =1-(LN(1-CU$1))/$A65 -> 7.1125359459815254 | CV65: =1-(LN(1-CV$1))/$A65 -> 8.1955784156064926
A66: =A65+0.01 -> 00.65 | B66: =1-(LN(1-B$1))/$A66 -> 1.015462055159233 | C66: =1-(LN(1-C$1))/$A66 -> 1.0310810881807992 | D66: =1-(LN(1-D$1))/$A66 -> 1.0468603192072439 | E66: =1-(LN(1-E$1))/$A66 -> 1.0628030684927001 | F66: =1-(LN(1-F$1))/$A66 -> 1.0789127605962316 | G66: =1-(LN(1-G$1))/$A66 -> 1.0951929287970577 | H66: =1-(LN(1-H$1))/$A66 -> 1.1116472197459006 | I66: =1-(LN(1-I$1))/$A66 -> 1.1282793983677708 | J66: =1-(LN(1-J$1))/$A66 -> 1.1450933530326788 | K66: =1-(LN(1-K$1))/$A66 -> 1.1620931010120403 | L66: =1-(LN(1-L$1))/$A66 -> 1.1792827942399253 | M66: =1-(LN(1-M$1))/$A66 -> 1.1966667253998229 | N66: =1-(LN(1-N$1))/$A66 -> 1.2142493343592424 | O66: =1-(LN(1-O$1))/$A66 -> 1.2320352149762823 | P66: =1-(LN(1-P$1))/$A66 -> 1.250029122304269 | Q66: =1-(LN(1-Q$1))/$A66 -> 1.268235980222735 | R66: =1-(LN(1-R$1))/$A66 -> 1.2866608895253744 | S66: =1-(LN(1-S$1))/$A66 -> 1.3053091364982126 | T66: =1-(LN(1-T$1))/$A66 -> 1.3241862020240809 | U66: =1-(LN(1-U$1))/$A66 -> 1.3432977712526304 | V66: =1-(LN(1-V$1))/$A66 -> 1.362649743878569 | W66: =1-(LN(1-W$1))/$A66 -> 1.3822482450746147 | X66: =1-(LN(1-X$1))/$A66 -> 1.4020996371298577 | Y66: =1-(LN(1-Y$1))/$A66 -> 1.422210531848862 | Z66: =1-(LN(1-Z$1))/$A66 -> 1.4425878037719704 | AA66: =1-(LN(1-AA$1))/$A66 -> 1.4632386042829562 | AB66: =1-(LN(1-AB$1))/$A66 -> 1.4841703766764616 | AC66: =1-(LN(1-AC$1))/$A66 -> 1.5053908722646705 | AD66: =1-(LN(1-AD$1))/$A66 -> 1.5269081676104244 | AE66: =1-(LN(1-AE$1))/$A66 -> 1.548730682982665 | AF66: =1-(LN(1-AF$1))/$A66 -> 1.5708672021397412 | AG66: =1-(LN(1-AG$1))/$A66 -> 1.5933268935568994 | AH66: =1-(LN(1-AH$1))/$A66 -> 1.6161193332263464 | AI66: =1-(LN(1-AI$1))/$A66 -> 1.6392545291717933 | AJ66: =1-(LN(1-AJ$1))/$A66 -> 1.6627429478345448 | AK66: =1-(LN(1-AK$1))/$A66 -> 1.6865955425052606 | AL66: =1-(LN(1-AL$1))/$A66 -> 1.7108237839947056 | AM66: =1-(LN(1-AM$1))/$A66 -> 1.7354396937584613 | AN66: =1-(LN(1-AN$1))/$A66 -> 1.7604558797150462 | AO66: =1-(LN(1-AO$1))/$A66 -> 1.785885575024601 | AP66: =1-(LN(1-AP$1))/$A66 -> 1.811742680126726 | AQ66: =1-(LN(1-AQ$1))/$A66 -> 1.8380418083718029 | AR66: =1-(LN(1-AR$1))/$A66 -> 1.8647983356208326 | AS66: =1-(LN(1-AS$1))/$A66 -> 1.8920284542352956 | AT66: =1-(LN(1-AT$1))/$A66 -> 1.9197492319317238 | AU66: =1-(LN(1-AU$1))/$A66 -> 1.9479786760366413 | AV66: =1-(LN(1-AV$1))/$A66 -> 1.9767358037476455 | AW66: =1-(LN(1-AW$1))/$A66 -> 2.0060407190871752 | AX66: =1-(LN(1-AX$1))/$A66 -> 2.0359146973288702 | AY66: =1-(LN(1-AY$1))/$A66 -> 2.066380277784531 | AZ66: =1-(LN(1-AZ$1))/$A66 -> 2.0974613659653305 | BA66: =1-(LN(1-BA$1))/$A66 -> 2.1291833462772316 | BB66: =1-(LN(1-BB$1))/$A66 -> 2.1615732065815889 | BC66: =1-(LN(1-BC$1))/$A66 -> 2.1946596761523023 | BD66: =1-(LN(1-BD$1))/$A66 -> 2.228473378796572 | BE66: =1-(LN(1-BE$1))/$A66 -> 2.2630470031843544 | BF66: =1-(LN(1-BF$1))/$A66 -> 2.2984154927608138 | BG66: =1-(LN(1-BG$1))/$A66 -> 2.3346162580072667 | BH66: =1-(LN(1-BH$1))/$A66 -> 2.371689414282744 | BI66: =1-(LN(1-BI$1))/$A66 -> 2.4096780490371623 | BJ66: =1-(LN(1-BJ$1))/$A66 -> 2.4486285228591465 | BK66: =1-(LN(1-BK$1))/$A66 -> 2.4885908096333935 | BL66: =1-(LN(1-BL$1))/$A66 -> 2.5296188820674881 | BM66: =1-(LN(1-BM$1))/$A66 -> 2.5717711500492024 | BN66: =1-(LN(1-BN$1))/$A66 -> 2.615110960767197 | BO66: =1-(LN(1-BO$1))/$A66 -> 2.6597071713414318 | BP66: =1-(LN(1-BP$1))/$A66 -> 2.7056348069563256 | BQ66: =1-(LN(1-BQ$1))/$A66 -> 2.7529758202897927 | BR66: =1-(LN(1-BR$1))/$A66 -> 2.8018199715429937 | BS66: =1-(LN(1-BS$1))/$A66 -> 2.8522658528091331 | BT66: =1-(LN(1-BT$1))/$A66 -> 2.9044220861563357 | BU66: =1-(LN(1-BU$1))/$A66 -> 2.9584087320198282 | BV66: =1-(LN(1-BV$1))/$A66 -> 3.0143589538211741 | BW66: =1-(LN(1-BW$1))/$A66 -> 3.072420996871708 | BX66: =1-(LN(1-BX$1))/$A66 -> 3.1327605555690639 | BY66: =1-(LN(1-BY$1))/$A66 -> 3.1955636240617644 | BZ66: =1-(LN(1-BZ$1))/$A66 -> 3.2610399539368351 | CA66: =1-(LN(1-CA$1))/$A66 -> 3.3294272809688876 | CB66: =1-(LN(1-CB$1))/$A66 -> 3.4009965357917995 | CC66: =1-(LN(1-CC$1))/$A66 -> 3.4760583268216951 | CD66: =1-(LN(1-CD$1))/$A66 -> 3.5549710874179272 | CE66: =1-(LN(1-CE$1))/$A66 -> 3.6381514278337361 | CF66: =1-(LN(1-CF$1))/$A66 -> 3.726087449125965 | CG66: =1-(LN(1-CG$1))/$A66 -> 3.8193560980743269 | CH66: =1-(LN(1-CH$1))/$A66 -> 3.9186461305936673 | CI66: =1-(LN(1-CI$1))/$A66 -> 4.0247890098043619 | CJ66: =1-(LN(1-CJ$1))/$A66 -> 4.1388012746562435 | CK66: =1-(LN(1-CK$1))/$A66 -> 4.2619439018462995 | CL66: =1-(LN(1-CL$1))/$A66 -> 4.3958075587534227 | CM66: =1-(LN(1-CM$1))/$A66 -> 4.5424386046062315 | CN66: =1-(LN(1-CN$1))/$A66 -> 4.7045317056182725 | CO66: =1-(LN(1-CO$1))/$A66 -> 4.8857363758588637 | CP66: =1-(LN(1-CP$1))/$A66 -> 5.0911692875889001 | CQ66: =1-(LN(1-CQ$1))/$A66 -> 5.3283241796308385 | CR66: =1-(LN(1-CR$1))/$A66 -> 5.6088188823907714 | CS66: =1-(LN(1-CS$1))/$A66 -> 5.9521166536434071 | CT66: =1-(LN(1-CT$1))/$A66 -> 6.3947044574153864 | CU66: =1-(LN(1-CU$1))/$A66 -> 7.018496931427963 | CV66: =1-(LN(1-CV$1))/$A66 -> 8.0848772092125465
A67: =A66+0.01 -> 00.66 | B67: =1-(LN(1-B$1))/$A67 -> 1.0152277815962143 | C67: =1-(LN(1-C$1))/$A67 -> 1.0306101626023021 | D67: =1-(LN(1-D$1))/$A67 -> 1.0461503143707704 | E67: =1-(LN(1-E$1))/$A67 -> 1.0618515068488714 | F67: =1-(LN(1-F$1))/$A67 -> 1.07771711270841 | G67: =1-(LN(1-G$1))/$A67 -> 1.0937506116940721 | H67: =1-(LN(1-H$1))/$A67 -> 1.1099555952042961 | I67: =1-(LN(1-I$1))/$A67 -> 1.1263357711197741 | J67: =1-(LN(1-J$1))/$A67 -> 1.1428949688958201 | K67: =1-(LN(1-K$1))/$A67 -> 1.1596371449361003 | L67: =1-(LN(1-L$1))/$A67 -> 1.1765663882665931 | M67: =1-(LN(1-M$1))/$A67 -> 1.1936869265301284 | N67: =1-(LN(1-N$1))/$A67 -> 1.2110031323234964 | O67: =1-(LN(1-O$1))/$A67 -> 1.2285195299008842 | P67: =1-(LN(1-P$1))/$A67 -> 1.2462408022693559 | Q67: =1-(LN(1-Q$1))/$A67 -> 1.2641717987042087 | R67: =1-(LN(1-R$1))/$A67 -> 1.282317542714384 | S67: =1-(LN(1-S$1))/$A67 -> 1.3006832404906641 | T67: =1-(LN(1-T$1))/$A67 -> 1.319274289872201 | U67: =1-(LN(1-U$1))/$A67 -> 1.3380962898700148 | V67: =1-(LN(1-V$1))/$A67 -> 1.3571550507894998 | W67: =1-(LN(1-W$1))/$A67 -> 1.3764566049977267 | X67: =1-(LN(1-X$1))/$A67 -> 1.3960072183854659 | Y67: =1-(LN(1-Y$1))/$A67 -> 1.4158134025784246 | Z67: =1-(LN(1-Z$1))/$A67 -> 1.4358819279572437 | AA67: =1-(LN(1-AA$1))/$A67 -> 1.4562198375513962 | AB67: =1-(LN(1-AB$1))/$A67 -> 1.4768344618783336 | AC67: =1-(LN(1-AC$1))/$A67 -> 1.4977334348061151 | AD67: =1-(LN(1-AD$1))/$A67 -> 1.5189247105254178 | AE67: =1-(LN(1-AE$1))/$A67 -> 1.5404165817253519 | AF67: =1-(LN(1-AF$1))/$A67 -> 1.562217699077018 | AG67: =1-(LN(1-AG$1))/$A67 -> 1.5843370921393705 | AH67: =1-(LN(1-AH$1))/$A67 -> 1.6067841918138259 | AI67: =1-(LN(1-AI$1))/$A67 -> 1.6295688544873723 | AJ67: =1-(LN(1-AJ$1))/$A67 -> 1.6527013880188699 | AK67: =1-(LN(1-AK$1))/$A67 -> 1.6761925797400292 | AL67: =1-(LN(1-AL$1))/$A67 -> 1.7000537266614524 | AM67: =1-(LN(1-AM$1))/$A67 -> 1.7242966680954543 | AN67: =1-(LN(1-AN$1))/$A67 -> 1.7489338209314851 | AO67: =1-(LN(1-AO$1))/$A67 -> 1.7739782178272585 | AP67: =1-(LN(1-AP$1))/$A67 -> 1.7994435486096543 | AQ67: =1-(LN(1-AQ$1))/$A67 -> 1.8253442052146545 | AR67: =1-(LN(1-AR$1))/$A67 -> 1.8516953305356685 | AS67: =1-(LN(1-AS$1))/$A67 -> 1.878512871595367 | AT67: =1-(LN(1-AT$1))/$A67 -> 1.9058136375085157 | AU67: =1-(LN(1-AU$1))/$A67 -> 1.933615362763359 | AV67: =1-(LN(1-AV$1))/$A67 -> 1.9619367764181357 | AW67: =1-(LN(1-AW$1))/$A67 -> 1.9907976778888847 | AX67: =1-(LN(1-AX$1))/$A67 -> 2.0202190200966146 | AY67: =1-(LN(1-AY$1))/$A67 -> 2.0502230008484021 | AZ67: =1-(LN(1-AZ$1))/$A67 -> 2.0808331634507042 | BA67: =1-(LN(1-BA$1))/$A67 -> 2.1120745076972733 | BB67: =1-(LN(1-BB$1))/$A67 -> 2.143973612542474 | BC67: =1-(LN(1-BC$1))/$A67 -> 2.1765587719681765 | BD67: =1-(LN(1-BD$1))/$A67 -> 2.2098601457845026 | BE67: =1-(LN(1-BE$1))/$A67 -> 2.2439099273785308 | BF67: =1-(LN(1-BF$1))/$A67 -> 2.2787425307492866 | BG67: =1-(LN(1-BG$1))/$A67 -> 2.3143947995526108 | BH67: =1-(LN(1-BH$1))/$A67 -> 2.3509062413390662 | BI67: =1-(LN(1-BI$1))/$A67 -> 2.3883192907184174 | BJ67: =1-(LN(1-BJ$1))/$A67 -> 2.4266796058461289 | BK67: =1-(LN(1-BK$1))/$A67 -> 2.466036403426827 | BL67: =1-(LN(1-BL$1))/$A67 -> 2.5064428383997988 | BM67: =1-(LN(1-BM$1))/$A67 -> 2.5479564356545179 | BN67: =1-(LN(1-BN$1))/$A67 -> 2.5906395825737549 | BO67: =1-(LN(1-BO$1))/$A67 -> 2.6345600929877735 | BP67: =1-(LN(1-BP$1))/$A67 -> 2.6797918553357754 | BQ67: =1-(LN(1-BQ$1))/$A67 -> 2.7264155805884323 | BR67: =1-(LN(1-BR$1))/$A67 -> 2.7745196689438574 | BS67: =1-(LN(1-BS$1))/$A67 -> 2.8242012186756615 | BT67: =1-(LN(1-BT$1))/$A67 -> 2.8755672060630575 | BU67: =1-(LN(1-BU$1))/$A67 -> 2.9287358724437702 | BV67: =1-(LN(1-BV$1))/$A67 -> 2.9838383636117625 | BW67: =1-(LN(1-BW$1))/$A67 -> 3.0410206787372882 | BX67: =1-(LN(1-BX$1))/$A67 -> 3.1004460016968056 | BY67: =1-(LN(1-BY$1))/$A67 -> 3.1622975085456768 | BZ67: =1-(LN(1-BZ$1))/$A67 -> 3.22678177281658 | CA67: =1-(LN(1-CA$1))/$A67 -> 3.2941329282269347 | CB67: =1-(LN(1-CB$1))/$A67 -> 3.3646178004010148 | CC67: =1-(LN(1-CC$1))/$A67 -> 3.4385422915668209 | CD67: =1-(LN(1-CD$1))/$A67 -> 3.5162594042752313 | CE67: =1-(LN(1-CE$1))/$A67 -> 3.5981794365029223 | CF67: =1-(LN(1-CF$1))/$A67 -> 3.6847830938361779 | CG67: =1-(LN(1-CG$1))/$A67 -> 3.7766385814368366 | CH67: =1-(LN(1-CH$1))/$A67 -> 3.8744242195240663 | CI67: =1-(LN(1-CI$1))/$A67 -> 3.978958873292175 | CJ67: =1-(LN(1-CJ$1))/$A67 -> 4.0912436795856939 | CK67: =1-(LN(1-CK$1))/$A67 -> 4.212520509394083 | CL67: =1-(LN(1-CL$1))/$A67 -> 4.3443559290753404 | CM67: =1-(LN(1-CM$1))/$A67 -> 4.4887652924152279 | CN67: =1-(LN(1-CN$1))/$A67 -> 4.6484024373513293 | CO67: =1-(LN(1-CO$1))/$A67 -> 4.826861582285245 | CP67: =1-(LN(1-CP$1))/$A67 -> 5.0291818741405834 | CQ67: =1-(LN(1-CQ$1))/$A67 -> 5.2627435102424922 | CR67: =1-(LN(1-CR$1))/$A67 -> 5.538988293263639 | CS67: =1-(LN(1-CS$1))/$A67 -> 5.8770845831336587 | CT67: =1-(LN(1-CT$1))/$A67 -> 6.3129665110909112 | CU67: =1-(LN(1-CU$1))/$A67 -> 6.9273075839820848 | CV67: =1-(LN(1-CV$1))/$A67 -> 7.9775305848305376
A68: =A67+0.01 -> 00.67 | B68: =1-(LN(1-B$1))/$A68 -> 1.0150005012738827 | C68: =1-(LN(1-C$1))/$A68 -> 1.0301532945037604 | D68: =1-(LN(1-D$1))/$A68 -> 1.0454615037085202 | E68: =1-(LN(1-E$1))/$A68 -> 1.0609283500302316 | F68: =1-(LN(1-F$1))/$A68 -> 1.0765571558023144 | G68: =1-(LN(1-G$1))/$A68 -> 1.0923513488329664 | H68: =1-(LN(1-H$1))/$A68 -> 1.1083144669176648 | I68: =1-(LN(1-I$1))/$A68 -> 1.1244501625955985 | J68: =1-(LN(1-J$1))/$A68 -> 1.1407622081660316 | K68: =1-(LN(1-K$1))/$A68 -> 1.1572545009818302 | L68: =1-(LN(1-L$1))/$A68 -> 1.1739310690387335 | M68: =1-(LN(1-M$1))/$A68 -> 1.1907960768804251 | N68: =1-(LN(1-N$1))/$A68 -> 1.2078538318410561 | O68: =1-(LN(1-O$1))/$A68 -> 1.2251087906486322 | P68: =1-(LN(1-P$1))/$A68 -> 1.2425655664145894 | Q68: =1-(LN(1-Q$1))/$A68 -> 1.2602289360369816 | R68: =1-(LN(1-R$1))/$A68 -> 1.2781038480470051 | S68: =1-(LN(1-S$1))/$A68 -> 1.2961954309311019 | T68: =1-(LN(1-T$1))/$A68 -> 1.3145090019636605 | U68: =1-(LN(1-U$1))/$A68 -> 1.3330500765883726 | V68: =1-(LN(1-V$1))/$A68 -> 1.3518243783896564 | W68: =1-(LN(1-W$1))/$A68 -> 1.370837849699253 | X68: =1-(LN(1-X$1))/$A68 -> 1.3900966628871754 | Y68: =1-(LN(1-Y$1))/$A68 -> 1.409607232390687 | Z68: =1-(LN(1-Z$1))/$A68 -> 1.4293762275399713 | AA68: =1-(LN(1-AA$1))/$A68 -> 1.4494105862446589 | AB68: =1-(LN(1-AB$1))/$A68 -> 1.4697175296114926 | AC68: =1-(LN(1-AC$1))/$A68 -> 1.4903045775702028 | AD68: =1-(LN(1-AD$1))/$A68 -> 1.5111795655922027 | AE68: =1-(LN(1-AE$1))/$A68 -> 1.5323506625951229 | AF68: =1-(LN(1-AF$1))/$A68 -> 1.55382639013557 | AG68: =1-(LN(1-AG$1))/$A68 -> 1.575615643002962 | AH68: =1-(LN(1-AH$1))/$A68 -> 1.5977277113389929 | AI68: =1-(LN(1-AI$1))/$A68 -> 1.6201723044203966 | AJ68: =1-(LN(1-AJ$1))/$A68 -> 1.6429595762573943 | AK68: =1-(LN(1-AK$1))/$A68 -> 1.6661001531767452 | AL68: =1-(LN(1-AL$1))/$A68 -> 1.6896051635769531 | AM68: =1-(LN(1-AM$1))/$A68 -> 1.7134862700641786 | AN68: =1-(LN(1-AN$1))/$A68 -> 1.7377557042011644 | AO68: =1-(LN(1-AO$1))/$A68 -> 1.7624263041283443 | AP68: =1-(LN(1-AP$1))/$A68 -> 1.7875115553468237 | AQ68: =1-(LN(1-AQ$1))/$A68 -> 1.8130256349875702 | AR68: =1-(LN(1-AR$1))/$A68 -> 1.8389834599306587 | AS68: =1-(LN(1-AS$1))/$A68 -> 1.8654007391834959 | AT68: =1-(LN(1-AT$1))/$A68 -> 1.8922940309785379 | AU68: =1-(LN(1-AU$1))/$A68 -> 1.9196808051101746 | AV68: =1-(LN(1-AV$1))/$A68 -> 1.9475795110984619 | AW68: =1-(LN(1-AW$1))/$A68 -> 1.9760096528457671 | AX68: =1-(LN(1-AX$1))/$A68 -> 2.0049918705429337 | AY68: =1-(LN(1-AY$1))/$A68 -> 2.0345480306864854 | AZ68: =1-(LN(1-AZ$1))/$A68 -> 2.0647013251902457 | BA68: =1-(LN(1-BA$1))/$A68 -> 2.0954763807167174 | BB68: =1-(LN(1-BB$1))/$A68 -> 2.1268993795194522 | BC68: =1-(LN(1-BC$1))/$A68 -> 2.1589981932820841 | BD68: =1-(LN(1-BD$1))/$A68 -> 2.1918025316683161 | BE68: =1-(LN(1-BE$1))/$A68 -> 2.2253441075669107 | BF68: =1-(LN(1-BF$1))/$A68 -> 2.2596568213351182 | BG68: =1-(LN(1-BG$1))/$A68 -> 2.2947769667234672 | BH68: =1-(LN(1-BH$1))/$A68 -> 2.3307434616175877 | BI68: =1-(LN(1-BI$1))/$A68 -> 2.3675981072748589 | BJ68: =1-(LN(1-BJ$1))/$A68 -> 2.4053858803857393 | BK68: =1-(LN(1-BK$1))/$A68 -> 2.4441552630771728 | BL68: =1-(LN(1-BL$1))/$A68 -> 2.4839586169311452 | BM68: =1-(LN(1-BM$1))/$A68 -> 2.5248526082566891 | BN68: =1-(LN(1-BN$1))/$A68 -> 2.5668986932816091 | BO68: =1-(LN(1-BO$1))/$A68 -> 2.6101636736894482 | BP68: =1-(LN(1-BP$1))/$A68 -> 2.6547203351068829 | BQ68: =1-(LN(1-BQ$1))/$A68 -> 2.7006481838632315 | BR68: =1-(LN(1-BR$1))/$A68 -> 2.7480343007506653 | BS68: =1-(LN(1-BS$1))/$A68 -> 2.7969743348148306 | BT68: =1-(LN(1-BT$1))/$A68 -> 2.8475736656740569 | BU68: =1-(LN(1-BU$1))/$A68 -> 2.8999487698699822 | BV68: =1-(LN(1-BV$1))/$A68 -> 2.9542288357966613 | BW68: =1-(LN(1-BW$1))/$A68 -> 3.0105576835322543 | BX68: =1-(LN(1-BX$1))/$A68 -> 3.0690960613729725 | BY68: =1-(LN(1-BY$1))/$A68 -> 3.1300244114032041 | BZ68: =1-(LN(1-BZ$1))/$A68 -> 3.1935462239685712 | CA68: =1-(LN(1-CA$1))/$A68 -> 3.2598921382533983 | CB68: =1-(LN(1-CB$1))/$A68 -> 3.3293249974099548 | CC68: =1-(LN(1-CC$1))/$A68 -> 3.402146137961346 | CD68: =1-(LN(1-CD$1))/$A68 -> 3.4787032937636608 | CE68: =1-(LN(1-CE$1))/$A68 -> 3.5594006389431772 | CF68: =1-(LN(1-CF$1))/$A68 -> 3.6447117043759363 | CG68: =1-(LN(1-CG$1))/$A68 -> 3.73519621454972 | CH68: =1-(LN(1-CH$1))/$A68 -> 3.8315223655013191 | CI68: =1-(LN(1-CI$1))/$A68 -> 3.9344968005564711 | CJ68: =1-(LN(1-CJ$1))/$A68 -> 4.0451057142187432 | CK68: =1-(LN(1-CK$1))/$A68 -> 4.1645724420896935 | CL68: =1-(LN(1-CL$1))/$A68 -> 4.2944401689398877 | CM68: =1-(LN(1-CM$1))/$A68 -> 4.4366941686478363 | CN68: =1-(LN(1-CN$1))/$A68 -> 4.5939486696296674 | CO68: =1-(LN(1-CO$1))/$A68 -> 4.7697442452362111 | CP68: =1-(LN(1-CP$1))/$A68 -> 4.9690448312429627 | CQ68: =1-(LN(1-CQ$1))/$A68 -> 5.1991204727761868 | CR68: =1-(LN(1-CR$1))/$A68 -> 5.4712421993343305 | CS68: =1-(LN(1-CS$1))/$A68 -> 5.8042922759227089 | CT68: =1-(LN(1-CT$1))/$A68 -> 6.2336685034626882 | CU68: =1-(LN(1-CU$1))/$A68 -> 6.8388403066092183 | CV68: =1-(LN(1-CV$1))/$A68 -> 7.8733883372957534
A69: =A68+0.01 -> 00.68 | B69: =1-(LN(1-B$1))/$A69 -> 1.0147799056669138 | C69: =1-(LN(1-C$1))/$A69 -> 1.0297098637022344 | D69: =1-(LN(1-D$1))/$A69 -> 1.044792952183395 | E69: =1-(LN(1-E$1))/$A69 -> 1.0600323448827282 | F69: =1-(LN(1-F$1))/$A69 -> 1.0754313152758097 | G69: =1-(LN(1-G$1))/$A69 -> 1.0909932407618934 | H69: =1-(LN(1-H$1))/$A69 -> 1.1067216071100521 | I69: =1-(LN(1-I$1))/$A69 -> 1.1226200131456632 | J69: =1-(LN(1-J$1))/$A69 -> 1.1386921756930017 | K69: =1-(LN(1-K$1))/$A69 -> 1.1549419347909209 | L69: =1-(LN(1-L$1))/$A69 -> 1.1713732591999286 | M69: =1-(LN(1-M$1))/$A69 -> 1.1879902522204189 | N69: =1-(LN(1-N$1))/$A69 -> 1.2047971578433936 | O69: =1-(LN(1-O$1))/$A69 -> 1.2217983672567405 | P69: =1-(LN(1-P$1))/$A69 -> 1.2389984257320219 | Q69: =1-(LN(1-Q$1))/$A69 -> 1.2564020399187907 | R69: =1-(LN(1-R$1))/$A69 -> 1.2740140855757256 | S69: =1-(LN(1-S$1))/$A69 -> 1.2918396157703502 | T69: =1-(LN(1-T$1))/$A69 -> 1.309883869581842 | U69: =1-(LN(1-U$1))/$A69 -> 1.3281522813444262 | V69: =1-(LN(1-V$1))/$A69 -> 1.3466504904721615 | W69: =1-(LN(1-W$1))/$A69 -> 1.3653843519095583 | X69: =1-(LN(1-X$1))/$A69 -> 1.3843599472564816 | Y69: =1-(LN(1-Y$1))/$A69 -> 1.4035835966202357 | Z69: =1-(LN(1-Z$1))/$A69 -> 1.4230618712526186 | AA69: =1-(LN(1-AA$1))/$A69 -> 1.4428016070351786 | AB69: =1-(LN(1-AB$1))/$A69 -> 1.4628099188819119 | AC69: =1-(LN(1-AC$1))/$A69 -> 1.4830942161353469 | AD69: =1-(LN(1-AD$1))/$A69 -> 1.5036622190393762 | AE69: =1-(LN(1-AE$1))/$A69 -> 1.5245219763804885 | AF69: =1-(LN(1-AF$1))/$A69 -> 1.5456818843982822 | AG69: =1-(LN(1-AG$1))/$A69 -> 1.5671507070764479 | AH69: =1-(LN(1-AH$1))/$A69 -> 1.5889375979369489 | AI69: =1-(LN(1-AI$1))/$A69 -> 1.6110521234730379 | AJ69: =1-(LN(1-AJ$1))/$A69 -> 1.6335042883712561 | AK69: =1-(LN(1-AK$1))/$A69 -> 1.656304562688852 | AL69: =1-(LN(1-AL$1))/$A69 -> 1.6794639111714096 | AM69: =1-(LN(1-AM$1))/$A69 -> 1.702993824916176 | AN69: =1-(LN(1-AN$1))/$A69 -> 1.7269063556099706 | AO69: =1-(LN(1-AO$1))/$A69 -> 1.751214152597045 | AP69: =1-(LN(1-AP$1))/$A69 -> 1.7759305030623116 | AQ69: =1-(LN(1-AQ$1))/$A69 -> 1.8010693756495177 | AR69: =1-(LN(1-AR$1))/$A69 -> 1.8266454678728548 | AS69: =1-(LN(1-AS$1))/$A69 -> 1.8526742577249149 | AT69: =1-(LN(1-AT$1))/$A69 -> 1.8791720599347359 | AU69: =1-(LN(1-AU$1))/$A69 -> 1.9061560873879659 | AV69: =1-(LN(1-AV$1))/$A69 -> 1.9336445182881907 | AW69: =1-(LN(1-AW$1))/$A69 -> 1.9616565697156823 | AX69: =1-(LN(1-AX$1))/$A69 -> 1.990212578329067 | AY69: =1-(LN(1-AY$1))/$A69 -> 2.0193340890587432 | AZ69: =1-(LN(1-AZ$1))/$A69 -> 2.0490439527609778 | BA69: =1-(LN(1-BA$1))/$A69 -> 2.0793664339414715 | BB69: =1-(LN(1-BB$1))/$A69 -> 2.1103273298206364 | BC69: =1-(LN(1-BC$1))/$A69 -> 2.1419541022044069 | BD69: =1-(LN(1-BD$1))/$A69 -> 2.1742760238496643 | BE69: =1-(LN(1-BE$1))/$A69 -> 2.2073243412791621 | BF69: =1-(LN(1-BF$1))/$A69 -> 2.241132456315484 | BG69: =1-(LN(1-BG$1))/$A69 -> 2.2757361289775342 | BH69: =1-(LN(1-BH$1))/$A69 -> 2.3111737048290939 | BI69: =1-(LN(1-BI$1))/$A69 -> 2.3474863704031694 | BJ69: =1-(LN(1-BJ$1))/$A69 -> 2.3847184409683018 | BK69: =1-(LN(1-BK$1))/$A69 -> 2.4229176856789794 | BL69: =1-(LN(1-BL$1))/$A69 -> 2.4621356960939225 | BM69: =1-(LN(1-BM$1))/$A69 -> 2.5024283051940905 | BN69: =1-(LN(1-BN$1))/$A69 -> 2.5438560654392326 | BO69: =1-(LN(1-BO$1))/$A69 -> 2.586484796135192 | BP69: =1-(LN(1-BP$1))/$A69 -> 2.6303862125317821 | BQ69: =1-(LN(1-BQ$1))/$A69 -> 2.6756386517475961 | BR69: =1-(LN(1-BR$1))/$A69 -> 2.7223279139749201 | BS69: =1-(LN(1-BS$1))/$A69 -> 2.7705482416557889 | BT69: =1-(LN(1-BT$1))/$A69 -> 2.8204034647082619 | BU69: =1-(LN(1-BU$1))/$A69 -> 2.8720083467836588 | BV69: =1-(LN(1-BV$1))/$A69 -> 2.9254901764467105 | BW69: =1-(LN(1-BW$1))/$A69 -> 2.9809906587744268 | BX69: =1-(LN(1-BX$1))/$A69 -> 3.0386681781174878 | BY69: =1-(LN(1-BY$1))/$A69 -> 3.098700523000216 | BZ69: =1-(LN(1-BZ$1))/$A69 -> 3.1612881912631514 | CA69: =1-(LN(1-CA$1))/$A69 -> 3.2266584303379071 | CB69: =1-(LN(1-CB$1))/$A69 -> 3.2950702180362788 | CC69: =1-(LN(1-CC$1))/$A69 -> 3.3668204594619144 | CD69: =1-(LN(1-CD$1))/$A69 -> 3.4422517747377244 | CE69: =1-(LN(1-CE$1))/$A69 -> 3.521762394252836 | CF69: =1-(LN(1-CF$1))/$A69 -> 3.605818885193937 | CG69: =1-(LN(1-CG$1))/$A69 -> 3.6949727408063415 | CH69: =1-(LN(1-CH$1))/$A69 -> 3.7898823307145348 | CI69: =1-(LN(1-CI$1))/$A69 -> 3.8913424358424051 | CJ69: =1-(LN(1-CJ$1))/$A69 -> 4.000324747833174 | CK69: =1-(LN(1-CK$1))/$A69 -> 4.1180346120589633 | CL69: =1-(LN(1-CL$1))/$A69 -> 4.2459925193966539 | CM69: =1-(LN(1-CM$1))/$A69 -> 4.3861545485206621 | CN69: =1-(LN(1-CN$1))/$A69 -> 4.5410964833115841 | CO69: =1-(LN(1-CO$1))/$A69 -> 4.7143068298650901 | CP69: =1-(LN(1-CP$1))/$A69 -> 4.910676524901155 | CQ69: =1-(LN(1-CQ$1))/$A69 -> 5.1373687011177136 | CR69: =1-(LN(1-CR$1))/$A69 -> 5.4054886375794142 | CS69: =1-(LN(1-CS$1))/$A69 -> 5.7336409189238449 | CT69: =1-(LN(1-CT$1))/$A69 -> 6.1567027901764719 | CU69: =1-(LN(1-CU$1))/$A69 -> 6.7529750079826121 | CV69: =1-(LN(1-CV$1))/$A69 -> 7.7723090970414042
A70: =A69+0.01 -> 00.69 | B70: =1-(LN(1-B$1))/$A70 -> 1.0145657041355094 | C70: =1-(LN(1-C$1))/$A70 -> 1.0292792859674196 | D70: =1-(LN(1-D$1))/$A70 -> 1.0441437789633456 | E70: =1-(LN(1-E$1))/$A70 -> 1.0591623108989205 | F70: =1-(LN(1-F$1))/$A70 -> 1.0743381078080443 | G70: =1-(LN(1-G$1))/$A70 -> 1.0896744981421558 | H70: =1-(LN(1-H$1))/$A70 -> 1.1051749171519354 | I70: =1-(LN(1-I$1))/$A70 -> 1.1208429115058709 | J70: =1-(LN(1-J$1))/$A70 -> 1.1366821441612192 | K70: =1-(LN(1-K$1))/$A70 -> 1.152696399504096 | L70: =1-(LN(1-L$1))/$A70 -> 1.1688895887767412 | M70: =1-(LN(1-M$1))/$A70 -> 1.1852657558114272 | N70: =1-(LN(1-N$1))/$A70 -> 1.20182908309204 | O70: =1-(LN(1-O$1))/$A70 -> 1.2185838981660631 | P70: =1-(LN(1-P$1))/$A70 -> 1.2355346804315577 | Q70: =1-(LN(1-Q$1))/$A70 -> 1.2526860683257648 | R70: =1-(LN(1-R$1))/$A70 -> 1.2700428669441934 | S70: =1-(LN(1-S$1))/$A70 -> 1.2876100561215047 | T70: =1-(LN(1-T$1))/$A70 -> 1.3053927990081922 | U70: =1-(LN(1-U$1))/$A70 -> 1.323396451180014 | V70: =1-(LN(1-V$1))/$A70 -> 1.3416265703203911 | W70: =1-(LN(1-W$1))/$A70 -> 1.3600889265195646 | X70: =1-(LN(1-X$1))/$A70 -> 1.3787895132382717 | Y70: =1-(LN(1-Y$1))/$A70 -> 1.3977345589880583 | Z70: =1-(LN(1-Z$1))/$A70 -> 1.4169305397851895 | AA70: =1-(LN(1-AA$1))/$A70 -> 1.4363841924404659 | AB70: =1-(LN(1-AB$1))/$A70 -> 1.4561025287531886 | AC70: =1-(LN(1-AC$1))/$A70 -> 1.47609285068411 | AD70: =1-(LN(1-AD$1))/$A70 -> 1.49636276658953 | AE70: =1-(LN(1-AE$1))/$A70 -> 1.5169202086068583 | AF70: =1-(LN(1-AF$1))/$A70 -> 1.5377734512910606 | AG70: =1-(LN(1-AG$1))/$A70 -> 1.5589311316115717 | AH70: =1-(LN(1-AH$1))/$A70 -> 1.5804022704306162 | AI70: =1-(LN(1-AI$1))/$A70 -> 1.6021962955966171 | AJ70: =1-(LN(1-AJ$1))/$A70 -> 1.6243230668006583 | AK70: =1-(LN(1-AK$1))/$A70 -> 1.6467929023600281 | AL70: =1-(LN(1-AL$1))/$A70 -> 1.6696166081109545 | AM70: =1-(LN(1-AM$1))/$A70 -> 1.6928055086130431 | AN70: =1-(LN(1-AN$1))/$A70 -> 1.7163714808909856 | AO70: =1-(LN(1-AO$1))/$A70 -> 1.7403269909652037 | AP70: =1-(LN(1-AP$1))/$A70 -> 1.7646851334527129 | AQ70: =1-(LN(1-AQ$1))/$A70 -> 1.7894596745531479 | AR70: =1-(LN(1-AR$1))/$A70 -> 1.814665098773248 | AS70: =1-(LN(1-AS$1))/$A70 -> 1.8403166597868728 | AT70: =1-(LN(1-AT$1))/$A70 -> 1.8664304358777106 | AU70: =1-(LN(1-AU$1))/$A70 -> 1.8930233904692999 | AV70: =1-(LN(1-AV$1))/$A70 -> 1.9201134383129994 | AW70: =1-(LN(1-AW$1))/$A70 -> 1.9477195179806723 | AX70: =1-(LN(1-AX$1))/$A70 -> 1.9758616713967618 | AY70: =1-(LN(1-AY$1))/$A70 -> 2.0045611312462976 | AZ70: =1-(LN(1-AZ$1))/$A70 -> 2.0338404172137174 | BA70: =1-(LN(1-BA$1))/$A70 -> 2.0637234421452182 | BB70: =1-(LN(1-BB$1))/$A70 -> 2.0942356293884536 | BC70: =1-(LN(1-BC$1))/$A70 -> 2.1254040427521685 | BD70: =1-(LN(1-BD$1))/$A70 -> 2.1572575307503938 | BE70: =1-(LN(1-BE$1))/$A70 -> 2.1898268870577251 | BF70: =1-(LN(1-BF$1))/$A70 -> 2.2231450294123611 | BG70: =1-(LN(1-BG$1))/$A70 -> 2.2572471995720624 | BH70: =1-(LN(1-BH$1))/$A70 -> 2.2921711873678028 | BI70: =1-(LN(1-BI$1))/$A70 -> 2.3279575824263121 | BJ70: =1-(LN(1-BJ$1))/$A70 -> 2.3646500577658625 | BK70: =1-(LN(1-BK$1))/$A70 -> 2.4022956902343564 | BL70: =1-(LN(1-BL$1))/$A70 -> 2.4409453236867642 | BM70: =1-(LN(1-BM$1))/$A70 -> 2.4806539819304083 | BN70: =1-(LN(1-BN$1))/$A70 -> 2.5214813398531568 | BO70: =1-(LN(1-BO$1))/$A70 -> 2.5634922628578702 | BP70: =1-(LN(1-BP$1))/$A70 -> 2.6067574268429157 | BQ70: =1-(LN(1-BQ$1))/$A70 -> 2.6513540336063266 | BR70: =1-(LN(1-BR$1))/$A70 -> 2.6973666398593417 | BS70: =1-(LN(1-BS$1))/$A70 -> 2.7448881222115022 | BT70: =1-(LN(1-BT$1))/$A70 -> 2.7940208057994464 | BU70: =1-(LN(1-BU$1))/$A70 -> 2.8448777910331713 | BV70: =1-(LN(1-BV$1))/$A70 -> 2.8975845217155989 | BW70: =1-(LN(1-BW$1))/$A70 -> 2.9522806492269713 | BX70: =1-(LN(1-BX$1))/$A70 -> 3.0091222624925966 | BY70: =1-(LN(1-BY$1))/$A70 -> 3.0682845733915172 | BZ70: =1-(LN(1-BZ$1))/$A70 -> 3.129965173998468 | CA70: =1-(LN(1-CA$1))/$A70 -> 3.1943880183040245 | CB70: =1-(LN(1-CB$1))/$A70 -> 3.2618083308183619 | CC70: =1-(LN(1-CC$1))/$A70 -> 3.3325187136726115 | CD70: =1-(LN(1-CD$1))/$A70 -> 3.4068568214806558 | CE70: =1-(LN(1-CE$1))/$A70 -> 3.4852151131767082 | CF70: =1-(LN(1-CF$1))/$A70 -> 3.5680533941041701 | CG70: =1-(LN(1-CG$1))/$A70 -> 3.6559151648526265 | CH70: =1-(LN(1-CH$1))/$A70 -> 3.7494492534578026 | CI70: =1-(LN(1-CI$1))/$A70 -> 3.849438922279472 | CJ70: =1-(LN(1-CJ$1))/$A70 -> 3.9568417804732725 | CK70: =1-(LN(1-CK$1))/$A70 -> 4.0728457046378184 | CL70: =1-(LN(1-CL$1))/$A70 -> 4.1989491495503257 | CM70: =1-(LN(1-CM$1))/$A70 -> 4.3370798449189136 | CN70: =1-(LN(1-CN$1))/$A70 -> 4.4897762444230107 | CO70: =1-(LN(1-CO$1))/$A70 -> 4.6604762960989294 | CP70: =1-(LN(1-CP$1))/$A70 -> 4.8540000535257759 | CQ70: =1-(LN(1-CQ$1))/$A70 -> 5.0774068358841236 | CR70: =1-(LN(1-CR$1))/$A70 -> 5.3416409761652197 | CS70: =1-(LN(1-CS$1))/$A70 -> 5.6650374273452391 | CT70: =1-(LN(1-CT$1))/$A70 -> 6.0819679671304367 | CU70: =1-(LN(1-CU$1))/$A70 -> 6.6695985585915594 | CV70: =1-(LN(1-CV$1))/$A70 -> 7.6741596898379054
A71: =A70+0.01 -> 00.7 | B71: =1-(LN(1-B$1))/$A71 -> 1.0143576226478592 | C71: =1-(LN(1-C$1))/$A71 -> 1.0288610104535991 | D71: =1-(LN(1-D$1))/$A71 -> 1.0435131535495836 | E71: =1-(LN(1-E$1))/$A71 -> 1.058317135028936 | F71: =1-(LN(1-F$1))/$A71 -> 1.073276134839358 | G71: =1-(LN(1-G$1))/$A71 -> 1.0883934338829822 | H71: =1-(LN(1-H$1))/$A71 -> 1.1036724183354791 | I71: =1-(LN(1-I$1))/$A71 -> 1.1191165841986441 | J71: =1-(LN(1-J$1))/$A71 -> 1.1347295421017731 | K71: =1-(LN(1-K$1))/$A71 -> 1.1505150223683231 | L71: =1-(LN(1-L$1))/$A71 -> 1.1664768803656449 | M71: =1-(LN(1-M$1))/$A71 -> 1.1826191021569783 | N71: =1-(LN(1-N$1))/$A71 -> 1.1989458104764394 | O71: =1-(LN(1-O$1))/$A71 -> 1.215461271049405 | P71: =1-(LN(1-P$1))/$A71 -> 1.2321698992825354 | Q71: =1-(LN(1-Q$1))/$A71 -> 1.2490762673496825 | R71: =1-(LN(1-R$1))/$A71 -> 1.2661851117021334 | S71: =1-(LN(1-S$1))/$A71 -> 1.2835013410340546 | T71: =1-(LN(1-T$1))/$A71 -> 1.3010300447366465 | U71: =1-(LN(1-U$1))/$A71 -> 1.3187765018774424 | V71: =1-(LN(1-V$1))/$A71 -> 1.3367461907443854 | W71: =1-(LN(1-W$1))/$A71 -> 1.3549447989978565 | X71: =1-(LN(1-X$1))/$A71 -> 1.373378234477725 | Y71: =1-(LN(1-Y$1))/$A71 -> 1.3920526367168002 | Z71: =1-(LN(1-Z$1))/$A71 -> 1.4109743892168296 | AA71: =1-(LN(1-AA$1))/$A71 -> 1.4301501325484591 | AB71: =1-(LN(1-AB$1))/$A71 -> 1.4495867783424288 | AC71: =1-(LN(1-AC$1))/$A71 -> 1.4692915242457656 | AD71: =1-(LN(1-AD$1))/$A71 -> 1.4892718699239653 | AE71: =1-(LN(1-AE$1))/$A71 -> 1.5095356341981889 | AF71: =1-(LN(1-AF$1))/$A71 -> 1.530090973415474 | AG71: =1-(LN(1-AG$1))/$A71 -> 1.5509464011599778 | AH71: =1-(LN(1-AH$1))/$A71 -> 1.5721108094244647 | AI71: =1-(LN(1-AI$1))/$A71 -> 1.5935934913738081 | AJ71: =1-(LN(1-AJ$1))/$A71 -> 1.6154041658463631 | AK71: =1-(LN(1-AK$1))/$A71 -> 1.6375530037548849 | AL71: =1-(LN(1-AL$1))/$A71 -> 1.6600506565665123 | AM71: =1-(LN(1-AM$1))/$A71 -> 1.6829082870614283 | AN71: =1-(LN(1-AN$1))/$A71 -> 1.706137602592543 | AO71: =1-(LN(1-AO$1))/$A71 -> 1.7297508910942723 | AP71: =1-(LN(1-AP$1))/$A71 -> 1.7537610601176743 | AQ71: =1-(LN(1-AQ$1))/$A71 -> 1.7781816792023886 | AR71: =1-(LN(1-AR$1))/$A71 -> 1.8030270259336303 | AS71: =1-(LN(1-AS$1))/$A71 -> 1.8283121360756316 | AT71: =1-(LN(1-AT$1))/$A71 -> 1.8540528582223148 | AU71: =1-(LN(1-AU$1))/$A71 -> 1.8802659134625956 | AV71: =1-(LN(1-AV$1))/$A71 -> 1.9069689606228137 | AW71: =1-(LN(1-AW$1))/$A71 -> 1.9341806677238056 | AX71: =1-(LN(1-AX$1))/$A71 -> 1.9619207903768081 | AY71: =1-(LN(1-AY$1))/$A71 -> 1.9902102579427789 | AZ71: =1-(LN(1-AZ$1))/$A71 -> 2.0190712683963783 | BA71: =1-(LN(1-BA$1))/$A71 -> 2.0485273929717152 | BB71: =1-(LN(1-BB$1))/$A71 -> 2.0786036918257613 | BC71: =1-(LN(1-BC$1))/$A71 -> 2.1093268421414235 | BD71: =1-(LN(1-BD$1))/$A71 -> 2.1407252803111025 | BE71: =1-(LN(1-BE$1))/$A71 -> 2.1728293600997577 | BF71: =1-(LN(1-BF$1))/$A71 -> 2.2056715289921844 | BG71: =1-(LN(1-BG$1))/$A71 -> 2.2392865252924619 | BH71: =1-(LN(1-BH$1))/$A71 -> 2.2737115989768339 | BI71: =1-(LN(1-BI$1))/$A71 -> 2.3089867598202218 | BJ71: =1-(LN(1-BJ$1))/$A71 -> 2.3451550569406363 | BK71: =1-(LN(1-BK$1))/$A71 -> 2.3822628946595801 | BL71: =1-(LN(1-BL$1))/$A71 -> 2.420360390491239 | BM71: =1-(LN(1-BM$1))/$A71 -> 2.4595017821885454 | BN71: =1-(LN(1-BN$1))/$A71 -> 2.499745892140969 | BO71: =1-(LN(1-BO$1))/$A71 -> 2.5411566591027581 | BP71: =1-(LN(1-BP$1))/$A71 -> 2.583803749316588 | BQ71: =1-(LN(1-BQ$1))/$A71 -> 2.6277632616976647 | BR71: =1-(LN(1-BR$1))/$A71 -> 2.6731185450042085 | BS71: =1-(LN(1-BS$1))/$A71 -> 2.7199611490370521 | BT71: =1-(LN(1-BT$1))/$A71 -> 2.7683919371451688 | BU71: =1-(LN(1-BU$1))/$A71 -> 2.8185223940184114 | BV71: =1-(LN(1-BV$1))/$A71 -> 2.8704761714053757 | BW71: =1-(LN(1-BW$1))/$A71 -> 2.9243909256665859 | BX71: =1-(LN(1-BX$1))/$A71 -> 2.9804205158855597 | BY71: =1-(LN(1-BY$1))/$A71 -> 3.0387376509144954 | BZ71: =1-(LN(1-BZ$1))/$A71 -> 3.0995371000842042 | CA71: =1-(LN(1-CA$1))/$A71 -> 3.1630396180425384 | CB71: =1-(LN(1-CB$1))/$A71 -> 3.2294967832352426 | CC71: =1-(LN(1-CC$1))/$A71 -> 3.2991970177630026 | CD71: =1-(LN(1-CD$1))/$A71 -> 3.3724731526023608 | CE71: =1-(LN(1-CE$1))/$A71 -> 3.4497120401313266 | CF71: =1-(LN(1-CF$1))/$A71 -> 3.5313669170455388 | CG71: =1-(LN(1-CG$1))/$A71 -> 3.6179735196404459 | CH71: =1-(LN(1-CH$1))/$A71 -> 3.7101714069798342 | CI71: =1-(LN(1-CI$1))/$A71 -> 3.8087326519611939 | CJ71: =1-(LN(1-CJ$1))/$A71 -> 3.9146011836093684 | CK71: =1-(LN(1-CK$1))/$A71 -> 4.0289479088572779 | CL71: =1-(LN(1-CL$1))/$A71 -> 4.1532498759853205 | CM71: =1-(LN(1-CM$1))/$A71 -> 4.2894072757057859 | CN71: =1-(LN(1-CN$1))/$A71 -> 4.4399222980741104 | CO71: =1-(LN(1-CO$1))/$A71 -> 4.6081837775832302 | CP71: =1-(LN(1-CP$1))/$A71 -> 4.7989429099039791 | CQ71: =1-(LN(1-CQ$1))/$A71 -> 5.0191581668000644 | CR71: =1-(LN(1-CR$1))/$A71 -> 5.2796175336485733 | CS71: =1-(LN(1-CS$1))/$A71 -> 5.5983940355260211 | CT71: =1-(LN(1-CT$1))/$A71 -> 6.0093684247428589 | CU71: =1-(LN(1-CU$1))/$A71 -> 6.5886042934688227 | CV71: =1-(LN(1-CV$1))/$A71 -> 7.5788145514116501
A72: =A71+0.01 -> 00.71 | B72: =1-(LN(1-B$1))/$A72 -> 1.0141554026105655 | C72: =1-(LN(1-C$1))/$A72 -> 1.028454517348619 | D72: =1-(LN(1-D$1))/$A72 -> 1.0429002922319839 | E72: =1-(LN(1-E$1))/$A72 -> 1.0574957669299367 | F72: =1-(LN(1-F$1))/$A72 -> 1.0722440766021839 | G72: =1-(LN(1-G$1))/$A72 -> 1.0871484559409683 | H72: =1-(LN(1-H$1))/$A72 -> 1.1022122434293458 | I72: =1-(LN(1-I$1))/$A72 -> 1.1174388858296493 | J72: =1-(LN(1-J$1))/$A72 -> 1.1328319429172411 | K72: =1-(LN(1-K$1))/$A72 -> 1.1483950924758115 | L72: =1-(LN(1-L$1))/$A72 -> 1.1641321355717626 | M72: =1-(LN(1-M$1))/$A72 -> 1.1800470021265983 | N72: =1-(LN(1-N$1))/$A72 -> 1.1961437568077571 | O72: =1-(LN(1-O$1))/$A72 -> 1.2124266052599768 | P72: =1-(LN(1-P$1))/$A72 -> 1.2288999007010912 | Q72: =1-(LN(1-Q$1))/$A72 -> 1.2455681509081376 | R72: =1-(LN(1-R$1))/$A72 -> 1.2624360256218217 | S72: =1-(LN(1-S$1))/$A72 -> 1.279508364399772 | T72: =1-(LN(1-T$1))/$A72 -> 1.2967901849516232 | U72: =1-(LN(1-U$1))/$A72 -> 1.3142866919918448 | V72: =1-(LN(1-V$1))/$A72 -> 1.3320032866493943 | W72: =1-(LN(1-W$1))/$A72 -> 1.3499455764767601 | X72: =1-(LN(1-X$1))/$A72 -> 1.3681193861047993 | Y72: =1-(LN(1-Y$1))/$A72 -> 1.3865307685940285 | Z72: =1-(LN(1-Z$1))/$A72 -> 1.4051860175377193 | AA72: =1-(LN(1-AA$1))/$A72 -> 1.4240916799773542 | AB72: =1-(LN(1-AB$1))/$A72 -> 1.4432545701967605 | AC72: =1-(LN(1-AC$1))/$A72 -> 1.4626817844676563 | AD72: =1-(LN(1-AD$1))/$A72 -> 1.4823807168264449 | AE72: =1-(LN(1-AE$1))/$A72 -> 1.5023590759700454 | AF72: =1-(LN(1-AF$1))/$A72 -> 1.5226249033673689 | AG72: =1-(LN(1-AG$1))/$A72 -> 1.543186592692936 | AH72: =1-(LN(1-AH$1))/$A72 -> 1.5640529107001764 | AI72: =1-(LN(1-AI$1))/$A72 -> 1.5852330196643178 | AJ72: =1-(LN(1-AJ$1))/$A72 -> 1.6067365015386676 | AK72: =1-(LN(1-AK$1))/$A72 -> 1.6285733839836891 | AL72: =1-(LN(1-AL$1))/$A72 -> 1.6507541684458571 | AM72: =1-(LN(1-AM$1))/$A72 -> 1.6732898604830981 | AN72: =1-(LN(1-AN$1))/$A72 -> 1.6961920025560282 | AO72: =1-(LN(1-AO$1))/$A72 -> 1.7194727095295643 | AP72: =1-(LN(1-AP$1))/$A72 -> 1.7431447071582702 | AQ72: =1-(LN(1-AQ$1))/$A72 -> 1.7672213738615099 | AR72: =1-(LN(1-AR$1))/$A72 -> 1.7917167861317482 | AS72: =1-(LN(1-AS$1))/$A72 -> 1.8166457679618904 | AT72: =1-(LN(1-AT$1))/$A72 -> 1.8420239447262259 | AU72: =1-(LN(1-AU$1))/$A72 -> 1.8678678020053758 | AV72: =1-(LN(1-AV$1))/$A72 -> 1.8941947499098162 | AW72: =1-(LN(1-AW$1))/$A72 -> 1.9210231935305127 | AX72: =1-(LN(1-AX$1))/$A72 -> 1.9483726102306558 | AY72: =1-(LN(1-AY$1))/$A72 -> 1.9762636345914721 | AZ72: =1-(LN(1-AZ$1))/$A72 -> 2.0047181519400912 | BA72: =1-(LN(1-BA$1))/$A72 -> 2.0337594015214093 | BB72: =1-(LN(1-BB$1))/$A72 -> 2.0634120905324407 | BC72: =1-(LN(1-BC$1))/$A72 -> 2.0937025204211217 | BD72: =1-(LN(1-BD$1))/$A72 -> 2.1246587270672839 | BE72: =1-(LN(1-BE$1))/$A72 -> 2.1563106367180707 | BF72: =1-(LN(1-BF$1))/$A72 -> 2.1886902398514496 | BG72: =1-(LN(1-BG$1))/$A72 -> 2.2218317854996101 | BH72: =1-(LN(1-BH$1))/$A72 -> 2.2557719989912446 | BI72: =1-(LN(1-BI$1))/$A72 -> 2.2905503265833174 | BJ72: =1-(LN(1-BJ$1))/$A72 -> 2.3262092110682326 | BK72: =1-(LN(1-BK$1))/$A72 -> 2.362794403185501 | BL72: =1-(LN(1-BL$1))/$A72 -> 2.4003553145688272 | BM72: =1-(LN(1-BM$1))/$A72 -> 2.4389454190591291 | BN72: =1-(LN(1-BN$1))/$A72 -> 2.4786227105615186 | BO72: =1-(LN(1-BO$1))/$A72 -> 2.519450227284409 | BP72: =1-(LN(1-BP$1))/$A72 -> 2.5614966542557909 | BQ72: =1-(LN(1-BQ$1))/$A72 -> 2.6048370185751626 | BR72: =1-(LN(1-BR$1))/$A72 -> 2.6495534950745716 | BS72: =1-(LN(1-BS$1))/$A72 -> 2.6957363441210376 | BT72: =1-(LN(1-BT$1))/$A72 -> 2.7434850084529829 | BU72: =1-(LN(1-BU$1))/$A72 -> 2.7929094025533638 | BV72: =1-(LN(1-BV$1))/$A72 -> 2.8441314365968493 | BW72: =1-(LN(1-BW$1))/$A72 -> 2.8972868281219863 | BX72: =1-(LN(1-BX$1))/$A72 -> 2.9525272691829461 | BY72: =1-(LN(1-BY$1))/$A72 -> 3.0100230361128828 | BZ72: =1-(LN(1-BZ$1))/$A72 -> 3.0699661550125956 | CA72: =1-(LN(1-CA$1))/$A72 -> 3.132574271309545 | CB72: =1-(LN(1-CB$1))/$A72 -> 3.1980954200910841 | CC72: =1-(LN(1-CC$1))/$A72 -> 3.2668139611747913 | CD72: =1-(LN(1-CD$1))/$A72 -> 3.3390580377769754 | CE72: =1-(LN(1-CE$1))/$A72 -> 3.4152090536506035 | CF72: =1-(LN(1-CF$1))/$A72 -> 3.4957138618758834 | CG72: =1-(LN(1-CG$1))/$A72 -> 3.5811006531666369 | CH72: =1-(LN(1-CH$1))/$A72 -> 3.6719999787125124 | CI72: =1-(LN(1-CI$1))/$A72 -> 3.7691730371448386 | CJ72: =1-(LN(1-CJ$1))/$A72 -> 3.8735504627134616 | CK72: =1-(LN(1-CK$1))/$A72 -> 3.9862866707043585 | CL72: =1-(LN(1-CL$1))/$A72 -> 4.1088379059010212 | CM72: =1-(LN(1-CM$1))/$A72 -> 4.2430775957662679 | CN72: =1-(LN(1-CN$1))/$A72 -> 4.3914726882420805 | CO72: =1-(LN(1-CO$1))/$A72 -> 4.557364287758114 | CP72: =1-(LN(1-CP$1))/$A72 -> 4.7454366717363179 | CQ72: =1-(LN(1-CQ$1))/$A72 -> 4.9625503052958386 | CR72: =1-(LN(1-CR$1))/$A72 -> 5.2193412303577489 | CS72: =1-(LN(1-CS$1))/$A72 -> 5.5336279223495985 | CT72: =1-(LN(1-CT$1))/$A72 -> 5.9388139398873259 | CU72: =1-(LN(1-CU$1))/$A72 -> 6.5098915569410929 | CV72: =1-(LN(1-CV$1))/$A72 -> 7.4861551915326121
A73: =A72+0.01 -> 00.72 | B73: =1-(LN(1-B$1))/$A73 -> 1.0139587997965298 | C73: =1-(LN(1-C$1))/$A73 -> 1.028059315718777 | D73: =1-(LN(1-D$1))/$A73 -> 1.042304454839873 | E73: =1-(LN(1-E$1))/$A73 -> 1.0566972146114655 | F73: =1-(LN(1-F$1))/$A73 -> 1.0712406866493758 | G73: =1-(LN(1-G$1))/$A73 -> 1.0859380607195659 | H73: =1-(LN(1-H$1))/$A73 -> 1.1007926289372714 | I73: =1-(LN(1-I$1))/$A73 -> 1.1158077901931263 | J73: =1-(LN(1-J$1))/$A73 -> 1.1309870548211685 | K73: =1-(LN(1-K$1))/$A73 -> 1.1463340495247587 | L73: =1-(LN(1-L$1))/$A73 -> 1.1618525225777103 | M73: =1-(LN(1-M$1))/$A73 -> 1.1775463493192844 | N73: =1-(LN(1-N$1))/$A73 -> 1.1934195379632049 | O73: =1-(LN(1-O$1))/$A73 -> 1.2094762357424771 | P73: =1-(LN(1-P$1))/$A73 -> 1.2257207354135762 | Q73: =1-(LN(1-Q$1))/$A73 -> 1.2421574821455246 | R73: =1-(LN(1-R$1))/$A73 -> 1.2587910808215186 | S73: =1-(LN(1-S$1))/$A73 -> 1.2756263037831086 | T73: =1-(LN(1-T$1))/$A73 -> 1.2926680990495174 | U73: =1-(LN(1-U$1))/$A73 -> 1.3099215990475135 | V73: =1-(LN(1-V$1))/$A73 -> 1.3273921298903748 | W73: =1-(LN(1-W$1))/$A73 -> 1.3450852212479161 | X73: =1-(LN(1-X$1))/$A73 -> 1.3630066168533437 | Y73: =1-(LN(1-Y$1))/$A73 -> 1.3811622856968893 | Z73: =1-(LN(1-Z$1))/$A73 -> 1.3995584339608067 | AA73: =1-(LN(1-AA$1))/$A73 -> 1.4182015177554463 | AB73: =1-(LN(1-AB$1))/$A73 -> 1.4370982567218056 | AC73: =1-(LN(1-AC$1))/$A73 -> 1.456255648572272 | AD73: =1-(LN(1-AD$1))/$A73 -> 1.4756809846482997 | AE73: =1-(LN(1-AE$1))/$A73 -> 1.4953818665815726 | AF73: =1-(LN(1-AF$1))/$A73 -> 1.5153662241539332 | AG73: =1-(LN(1-AG$1))/$A73 -> 1.5356423344610897 | AH73: =1-(LN(1-AH$1))/$A73 -> 1.5562188424960071 | AI73: =1-(LN(1-AI$1))/$A73 -> 1.5771047832800913 | AJ73: =1-(LN(1-AJ$1))/$A73 -> 1.5983096056839641 | AK73: =1-(LN(1-AK$1))/$A73 -> 1.619843198095027 | AL73: =1-(LN(1-AL$1))/$A73 -> 1.6417159161063313 | AM73: =1-(LN(1-AM$1))/$A73 -> 1.6639386124208331 | AN73: =1-(LN(1-AN$1))/$A73 -> 1.6865226691871946 | AO73: =1-(LN(1-AO$1))/$A73 -> 1.7094800330083202 | AP73: =1-(LN(1-AP$1))/$A73 -> 1.7328232528921832 | AQ73: =1-(LN(1-AQ$1))/$A73 -> 1.7565655214467666 | AR73: =1-(LN(1-AR$1))/$A73 -> 1.7807207196576962 | AS73: =1-(LN(1-AS$1))/$A73 -> 1.8053034656290863 | AT73: =1-(LN(1-AT$1))/$A73 -> 1.8303291677161395 | AU73: =1-(LN(1-AU$1))/$A73 -> 1.8558140825330791 | AV73: =1-(LN(1-AV$1))/$A73 -> 1.8817753783832911 | AW73: =1-(LN(1-AW$1))/$A73 -> 1.9082312047314778 | AX73: =1-(LN(1-AX$1))/$A73 -> 1.9352007684218966 | AY73: =1-(LN(1-AY$1))/$A73 -> 1.9627044174443684 | AZ73: =1-(LN(1-AZ$1))/$A73 -> 1.9907637331631456 | BA73: =1-(LN(1-BA$1))/$A73 -> 2.0194016320558341 | BB73: =1-(LN(1-BB$1))/$A73 -> 2.0486424781639343 | BC73: =1-(LN(1-BC$1))/$A73 -> 2.0785122076374951 | BD73: =1-(LN(1-BD$1))/$A73 -> 2.1090384669691273 | BE73: =1-(LN(1-BE$1))/$A73 -> 2.1402507667636534 | BF73: =1-(LN(1-BF$1))/$A73 -> 2.1721806531868459 | BG73: =1-(LN(1-BG$1))/$A73 -> 2.2048618995898934 | BH73: =1-(LN(1-BH$1))/$A73 -> 2.2383307212274772 | BI73: =1-(LN(1-BI$1))/$A73 -> 2.2726260164918823 | BJ73: =1-(LN(1-BJ$1))/$A73 -> 2.3077896386922849 | BK73: =1-(LN(1-BK$1))/$A73 -> 2.3438667031412583 | BL73: =1-(LN(1-BL$1))/$A73 -> 2.3809059351998156 | BM73: =1-(LN(1-BM$1))/$A73 -> 2.4189600660166413 | BN73: =1-(LN(1-BN$1))/$A73 -> 2.4580862840259421 | BO73: =1-(LN(1-BO$1))/$A73 -> 2.498346751905459 | BP73: =1-(LN(1-BP$1))/$A73 -> 2.5398092007244606 | BQ73: =1-(LN(1-BQ$1))/$A73 -> 2.5825476155393963 | BR73: =1-(LN(1-BR$1))/$A73 -> 2.6266430298652024 | BS73: =1-(LN(1-BS$1))/$A73 -> 2.6721844504526899 | BT73: =1-(LN(1-BT$1))/$A73 -> 2.7192699388911361 | BU73: =1-(LN(1-BU$1))/$A73 -> 2.768007883073456 | BV73: =1-(LN(1-BV$1))/$A73 -> 2.8185184999774489 | BW73: =1-(LN(1-BW$1))/$A73 -> 2.8709356221758475 | BX73: =1-(LN(1-BX$1))/$A73 -> 2.9254088348887382 | BY73: =1-(LN(1-BY$1))/$A73 -> 2.9821060495002039 | BZ73: =1-(LN(1-BZ$1))/$A73 -> 3.0412166250818649 | CA73: =1-(LN(1-CA$1))/$A73 -> 3.1029551842080236 | CB73: =1-(LN(1-CB$1))/$A73 -> 3.1675663170342636 | CC73: =1-(LN(1-CC$1))/$A73 -> 3.2353304339362525 | CD73: =1-(LN(1-CD$1))/$A73 -> 3.3065711205856285 | CE73: =1-(LN(1-CE$1))/$A73 -> 3.3816644834610119 | CF73: =1-(LN(1-CF$1))/$A73 -> 3.4610511693498296 | CG73: =1-(LN(1-CG$1))/$A73 -> 3.5452520329837669 | CH73: =1-(LN(1-CH$1))/$A73 -> 3.6348888678970606 | CI73: =1-(LN(1-CI$1))/$A73 -> 3.7307123005178271 | CJ73: =1-(LN(1-CJ$1))/$A73 -> 3.8336400396202195 | CK73: =1-(LN(1-CK$1))/$A73 -> 3.9448104669445758 | CL73: =1-(LN(1-CL$1))/$A73 -> 4.0656596016523956 | CM73: =1-(LN(1-CM$1))/$A73 -> 4.1980348513806254 | CN73: =1-(LN(1-CN$1))/$A73 -> 4.3443689009053852 | CO73: =1-(LN(1-CO$1))/$A73 -> 4.5079564504281411 | CP73: =1-(LN(1-CP$1))/$A73 -> 4.6934167179622017 | CQ73: =1-(LN(1-CQ$1))/$A73 -> 4.9075148843889513 | CR73: =1-(LN(1-CR$1))/$A73 -> 5.1607392688250018 | CS73: =1-(LN(1-CS$1))/$A73 -> 5.4706608678725202 | CT73: =1-(LN(1-CT$1))/$A73 -> 5.8702193018333348 | CU73: =1-(LN(1-CU$1))/$A73 -> 6.4333652853169117 | CV73: =1-(LN(1-CV$1))/$A73 -> 7.3960697027613262
A74: =A73+0.01 -> 00.73 | B74: =1-(LN(1-B$1))/$A74 -> 1.013767583360961 | C74: =1-(LN(1-C$1))/$A74 -> 1.0276749415308486 | D74: =1-(LN(1-D$1))/$A74 -> 1.0417249417598748 | E74: =1-(LN(1-E$1))/$A74 -> 1.0559205404387058 | F74: =1-(LN(1-F$1))/$A74 -> 1.070264786832261 | G74: =1-(LN(1-G$1))/$A74 -> 1.0847608270110787 | H74: =1-(LN(1-H$1))/$A74 -> 1.0994119079929252 | I74: =1-(LN(1-I$1))/$A74 -> 1.1142213821082889 | J74: =1-(LN(1-J$1))/$A74 -> 1.12919271160444 | K74: =1-(LN(1-K$1))/$A74 -> 1.1443294735038716 | L74: =1-(LN(1-L$1))/$A74 -> 1.1596353647341799 | M74: =1-(LN(1-M$1))/$A74 -> 1.1751142075477874 | N74: =1-(LN(1-N$1))/$A74 -> 1.1907699552513802 | O74: =1-(LN(1-O$1))/$A74 -> 1.2066066982665529 | P74: =1-(LN(1-P$1))/$A74 -> 1.222628670544897 | Q74: =1-(LN(1-Q$1))/$A74 -> 1.2388402563627092 | R74: =1-(LN(1-R$1))/$A74 -> 1.2552459975225936 | S74: =1-(LN(1-S$1))/$A74 -> 1.2718506009915591 | T74: =1-(LN(1-T$1))/$A74 -> 1.2886589470077432 | U74: =1-(LN(1-U$1))/$A74 -> 1.3056760976906983 | V74: =1-(LN(1-V$1))/$A74 -> 1.3229073061932464 | W74: =1-(LN(1-W$1))/$A74 -> 1.3403580264363009 | X74: =1-(LN(1-X$1))/$A74 -> 1.3580339234717911 | Y74: =1-(LN(1-Y$1))/$A74 -> 1.3759408845229593 | Z74: =1-(LN(1-Z$1))/$A74 -> 1.3940850307558641 | AA74: =1-(LN(1-AA$1))/$A74 -> 1.4124727298409883 | AB74: =1-(LN(1-AB$1))/$A74 -> 1.4311106093694521 | AC74: =1-(LN(1-AC$1))/$A74 -> 1.4500055711945699 | AD74: =1-(LN(1-AD$1))/$A74 -> 1.4691648067764052 | AE74: =1-(LN(1-AE$1))/$A74 -> 1.4885958136147017 | AF74: =1-(LN(1-AF$1))/$A74 -> 1.5083064128641532 | AG74: =1-(LN(1-AG$1))/$A74 -> 1.5283047682355952 | AH74: =1-(LN(1-AH$1))/$A74 -> 1.5485994062974318 | AI74: =1-(LN(1-AI$1))/$A74 -> 1.5691992383036517 | AJ74: =1-(LN(1-AJ$1))/$A74 -> 1.5901135836882934 | AK74: =1-(LN(1-AK$1))/$A74 -> 1.6113521953813965 | AL74: =1-(LN(1-AL$1))/$A74 -> 1.6329252871185735 | AM74: =1-(LN(1-AM$1))/$A74 -> 1.654843562935616 | AN74: =1-(LN(1-AN$1))/$A74 -> 1.6771182490613425 | AO74: =1-(LN(1-AO$1))/$A74 -> 1.6997611284465626 | AP74: =1-(LN(1-AP$1))/$A74 -> 1.7227845781950299 | AQ74: =1-(LN(1-AQ$1))/$A74 -> 1.7462016101940712 | AR74: =1-(LN(1-AR$1))/$A74 -> 1.7700259152788236 | AS74: =1-(LN(1-AS$1))/$A74 -> 1.7942719113054002 | AT74: =1-(LN(1-AT$1))/$A74 -> 1.8189547955556442 | AU74: =1-(LN(1-AU$1))/$A74 -> 1.8440906019504342 | AV74: =1-(LN(1-AV$1))/$A74 -> 1.8696962636109173 | AW74: =1-(LN(1-AW$1))/$A74 -> 1.8957896813789916 | AX74: =1-(LN(1-AX$1))/$A74 -> 1.9223897989914596 | AY74: =1-(LN(1-AY$1))/$A74 -> 1.9495166856985553 | AZ74: =1-(LN(1-AZ$1))/$A74 -> 1.9771916272294039 | BA74: =1-(LN(1-BA$1))/$A74 -> 2.0054372261372611 | BB74: =1-(LN(1-BB$1))/$A74 -> 2.0342775127096342 | BC74: =1-(LN(1-BC$1))/$A74 -> 2.0637380678068444 | BD74: =1-(LN(1-BD$1))/$A74 -> 2.0938461592024269 | BE74: =1-(LN(1-BE$1))/$A74 -> 2.1246308932463429 | BF74: =1-(LN(1-BF$1))/$A74 -> 2.1561233839651086 | BG74: =1-(LN(1-BG$1))/$A74 -> 2.1883569420612647 | BH74: =1-(LN(1-BH$1))/$A74 -> 2.2213672866901151 | BI74: =1-(LN(1-BI$1))/$A74 -> 2.255192783389254 | BJ74: =1-(LN(1-BJ$1))/$A74 -> 2.2898747121348562 | BK74: =1-(LN(1-BK$1))/$A74 -> 2.325457570221515 | BL74: =1-(LN(1-BL$1))/$A74 -> 2.3619894155395444 | BM74: =1-(LN(1-BM$1))/$A74 -> 2.3995222568931256 | BN74: =1-(LN(1-BN$1))/$A74 -> 2.4381124993132577 | BO74: =1-(LN(1-BO$1))/$A74 -> 2.4778214539341512 | BP74: =1-(LN(1-BP$1))/$A74 -> 2.5187159240022075 | BQ74: =1-(LN(1-BQ$1))/$A74 -> 2.5608688810799523 | BR74: =1-(LN(1-BR$1))/$A74 -> 2.6043602486341721 | BS74: =1-(LN(1-BS$1))/$A74 -> 2.6492778141451185 | BT74: =1-(LN(1-BT$1))/$A74 -> 2.6957182958926276 | BU74: =1-(LN(1-BU$1))/$A74 -> 2.7437885970039564 | BV74: =1-(LN(1-BV$1))/$A74 -> 2.7936072876489906 | BW74: =1-(LN(1-BW$1))/$A74 -> 2.8453063670775482 | BX74: =1-(LN(1-BX$1))/$A74 -> 2.8990333713971115 | BY74: =1-(LN(1-BY$1))/$A74 -> 2.9549539118358172 | BZ74: =1-(LN(1-BZ$1))/$A74 -> 3.0132547535054011 | CA74: =1-(LN(1-CA$1))/$A74 -> 3.0741475789449 | CB74: =1-(LN(1-CB$1))/$A74 -> 3.1378736277598214 | CC74: =1-(LN(1-CC$1))/$A74 -> 3.2047094690878106 | CD74: =1-(LN(1-CD$1))/$A74 -> 3.2749742559200721 | CE74: =1-(LN(1-CE$1))/$A74 -> 3.3490389425916827 | CF74: =1-(LN(1-CF$1))/$A74 -> 3.4273381396327087 | CG74: =1-(LN(1-CG$1))/$A74 -> 3.5103855667785098 | CH74: =1-(LN(1-CH$1))/$A74 -> 3.5987944998436765 | CI74: =1-(LN(1-CI$1))/$A74 -> 3.6933052827025143 | CJ74: =1-(LN(1-CJ$1))/$A74 -> 3.7948230527761067 | CK74: =1-(LN(1-CK$1))/$A74 -> 3.9044705975343761 | CL74: =1-(LN(1-CL$1))/$A74 -> 4.0236642646434584 | CM74: =1-(LN(1-CM$1))/$A74 -> 4.1542261547863699 | CN74: =1-(LN(1-CN$1))/$A74 -> 4.2985556282902424 | CO74: =1-(LN(1-CO$1))/$A74 -> 4.45990225247707 | CP74: =1-(LN(1-CP$1))/$A74 -> 4.6428219684010763 | CQ74: =1-(LN(1-CQ$1))/$A74 -> 4.8539872832329385 | CR74: =1-(LN(1-CR$1))/$A74 -> 5.1037428404849337 | CS74: =1-(LN(1-CS$1))/$A74 -> 5.4094189381756363 | CT74: =1-(LN(1-CT$1))/$A74 -> 5.8035039689315084 | CU74: =1-(LN(1-CU$1))/$A74 -> 6.3589356238742134 | CV74: =1-(LN(1-CV$1))/$A74 -> 7.3084523095728144
A75: =A74+0.01 -> 00.74 | B75: =1-(LN(1-B$1))/$A75 -> 1.0135815349371642 | C75: =1-(LN(1-C$1))/$A75 -> 1.0273009558344857 | D75: =1-(LN(1-D$1))/$A75 -> 1.041161091195552 | E75: =1-(LN(1-E$1))/$A75 -> 1.0551648574598043 | F75: =1-(LN(1-F$1))/$A75 -> 1.0693152626858791 | G75: =1-(LN(1-G$1))/$A75 -> 1.0836154104298479 | H75: =1-(LN(1-H$1))/$A75 -> 1.0980685038308586 | I75: =1-(LN(1-I$1))/$A75 -> 1.1126778499176364 | J75: =1-(LN(1-J$1))/$A75 -> 1.1274468641503259 | K75: =1-(LN(1-K$1))/$A75 -> 1.1423790752132787 | L75: =1-(LN(1-L$1))/$A75 -> 1.1574781300756101 | M75: =1-(LN(1-M$1))/$A75 -> 1.1727477993376823 | N75: =1-(LN(1-N$1))/$A75 -> 1.1881919828831182 | O75: =1-(LN(1-O$1))/$A75 -> 1.2038147158575454 | P75: =1-(LN(1-P$1))/$A75 -> 1.219620174996993 | Q75: =1-(LN(1-Q$1))/$A75 -> 1.2356126853307807 | R75: =1-(LN(1-R$1))/$A75 -> 1.2517967272858019 | S75: =1-(LN(1-S$1))/$A75 -> 1.268176944221403 | T75: =1-(LN(1-T$1))/$A75 -> 1.2847581504265575 | U75: =1-(LN(1-U$1))/$A75 -> 1.301545339613797 | V75: =1-(LN(1-V$1))/$A75 -> 1.3185436939473916 | W75: =1-(LN(1-W$1))/$A75 -> 1.335758593646621 | X75: =1-(LN(1-X$1))/$A75 -> 1.3531956272086587 | Y75: =1-(LN(1-Y$1))/$A75 -> 1.3708606022996759 | Z75: =1-(LN(1-Z$1))/$A75 -> 1.3887595573672713 | AA75: =1-(LN(1-AA$1))/$A75 -> 1.4068987740323262 | AB75: =1-(LN(1-AB$1))/$A75 -> 1.425284790323919 | AC75: =1-(LN(1-AC$1))/$A75 -> 1.4439244148270756 | AD75: =1-(LN(1-AD$1))/$A75 -> 1.4628247418199674 | AE75: =1-(LN(1-AE$1))/$A75 -> 1.4819931674847733 | AF75: =1-(LN(1-AF$1))/$A75 -> 1.5014374072849079 | AG75: =1-(LN(1-AG$1))/$A75 -> 1.5211655146107899 | AH75: =1-(LN(1-AH$1))/$A75 -> 1.541185900806926 | AI75: =1-(LN(1-AI$1))/$A75 -> 1.5615073567049538 | AJ75: =1-(LN(1-AJ$1))/$A75 -> 1.5821390758006137 | AK75: =1-(LN(1-AK$1))/$A75 -> 1.6030906792275936 | AL75: =1-(LN(1-AL$1))/$A75 -> 1.624372242698052 | AM75: =1-(LN(1-AM$1))/$A75 -> 1.6459943255986484 | AN75: =1-(LN(1-AN$1))/$A75 -> 1.6679680024524055 | AO75: =1-(LN(1-AO$1))/$A75 -> 1.6903048969810683 | AP75: =1-(LN(1-AP$1))/$A75 -> 1.7130172190302324 | AQ75: =1-(LN(1-AQ$1))/$A75 -> 1.736117804650908 | AR75: =1-(LN(1-AR$1))/$A75 -> 1.7596201596669476 | AS75: =1-(LN(1-AS$1))/$A75 -> 1.7835385070985703 | AT75: =1-(LN(1-AT$1))/$A75 -> 1.8078878388589463 | AU75: =1-(LN(1-AU$1))/$A75 -> 1.8326839721943471 | AV75: =1-(LN(1-AV$1))/$A75 -> 1.8579436113999588 | AW75: =1-(LN(1-AW$1))/$A75 -> 1.8836844154144108 | AX75: =1-(LN(1-AX$1))/$A75 -> 1.9099250719780616 | AY75: =1-(LN(1-AY$1))/$A75 -> 1.9366853791350613 | AZ75: =1-(LN(1-AZ$1))/$A75 -> 1.963986334969547 | BA75: =1-(LN(1-BA$1))/$A75 -> 1.9918502365948656 | BB75: =1-(LN(1-BB$1))/$A75 -> 2.0203007895649092 | BC75: =1-(LN(1-BC$1))/$A75 -> 2.0493632290526982 | BD75: =1-(LN(1-BD$1))/$A75 -> 2.0790644543483401 | BE75: =1-(LN(1-BE$1))/$A75 -> 2.1094331784727434 | BF75: =1-(LN(1-BF$1))/$A75 -> 2.140500094992607 | BG75: =1-(LN(1-BG$1))/$A75 -> 2.1722980644658421 | BH75: =1-(LN(1-BH$1))/$A75 -> 2.2048623233564646 | BI75: =1-(LN(1-BI$1))/$A75 -> 2.2382307187488584 | BJ75: =1-(LN(1-BJ$1))/$A75 -> 2.2724439727816828 | BK75: =1-(LN(1-BK$1))/$A75 -> 2.3075459814347377 | BL75: =1-(LN(1-BL$1))/$A75 -> 2.343584153167388 | BM75: =1-(LN(1-BM$1))/$A75 -> 2.3806097939621376 | BN75: =1-(LN(1-BN$1))/$A75 -> 2.4186785466198355 | BO75: =1-(LN(1-BO$1))/$A75 -> 2.4578508937458521 | BP75: =1-(LN(1-BP$1))/$A75 -> 2.4981927358400156 | BQ75: =1-(LN(1-BQ$1))/$A75 -> 2.5397760583626559 | BR75: =1-(LN(1-BR$1))/$A75 -> 2.5826797047337102 | BS75: =1-(LN(1-BS$1))/$A75 -> 2.6269902761161301 | BT75: =1-(LN(1-BT$1))/$A75 -> 2.6728031837859705 | BU75: =1-(LN(1-BU$1))/$A75 -> 2.7202238862336325 | BV75: =1-(LN(1-BV$1))/$A75 -> 2.7693693513294093 | BW75: =1-(LN(1-BW$1))/$A75 -> 2.8203697945494732 | BX75: =1-(LN(1-BX$1))/$A75 -> 2.8733707582701236 | BY75: =1-(LN(1-BY$1))/$A75 -> 2.928535615729928 | BZ75: =1-(LN(1-BZ$1))/$A75 -> 2.9860486081877609 | CA75: =1-(LN(1-CA$1))/$A75 -> 3.0461185576078065 | CB75: =1-(LN(1-CB$1))/$A75 -> 3.1089834436009047 | CC75: =1-(LN(1-CC$1))/$A75 -> 3.1749160978839215 | CD75: =1-(LN(1-CD$1))/$A75 -> 3.2442313605698008 | CE75: =1-(LN(1-CE$1))/$A75 -> 3.3172951730972007 | CF75: =1-(LN(1-CF$1))/$A75 -> 3.3945362728809152 | CG75: =1-(LN(1-CG$1))/$A75 -> 3.4764614374977194 | CH75: =1-(LN(1-CH$1))/$A75 -> 3.5636756552511941 | CI75: =1-(LN(1-CI$1))/$A75 -> 3.6569092653686965 | CJ75: =1-(LN(1-CJ$1))/$A75 -> 3.7570551736845377 | CK75: =1-(LN(1-CK$1))/$A75 -> 3.8652209948649929 | CL75: =1-(LN(1-CL$1))/$A75 -> 3.9828039367428714 | CM75: =1-(LN(1-CM$1))/$A75 -> 4.1116014770189864 | CN75: =1-(LN(1-CN$1))/$A75 -> 4.2539805522322665 | CO75: =1-(LN(1-CO$1))/$A75 -> 4.4131468166327856 | CP75: =1-(LN(1-CP$1))/$A75 -> 4.5935946445037636 | CQ75: =1-(LN(1-CQ$1))/$A75 -> 4.8019063740000609 | CR75: =1-(LN(1-CR$1))/$A75 -> 5.0482868561540561 | CS75: =1-(LN(1-CS$1))/$A75 -> 5.3498321957678581 | CT75: =1-(LN(1-CT$1))/$A75 -> 5.7385917531351369 | CU75: =1-(LN(1-CU$1))/$A75 -> 6.2865175749029403 | CV75: =1-(LN(1-CV$1))/$A75 -> 7.2232029540380474
A76: =A75+0.01 -> 00.75 | B76: =1-(LN(1-B$1))/$A76 -> 1.0134004478046685 | C76: =1-(LN(1-C$1))/$A76 -> 1.0269369430900259 | D76: =1-(LN(1-D$1))/$A76 -> 1.040612276646278 | E76: =1-(LN(1-E$1))/$A76 -> 1.0544293260270068 | F76: =1-(LN(1-F$1))/$A76 -> 1.0683910591834007 | G76: =1-(LN(1-G$1))/$A76 -> 1.0825005382907833 | H76: =1-(LN(1-H$1))/$A76 -> 1.0967609237797806 | I76: =1-(LN(1-I$1))/$A76 -> 1.1111754785854013 | J76: =1-(LN(1-J$1))/$A76 -> 1.1257475726283217 | K76: =1-(LN(1-K$1))/$A76 -> 1.1404806875437683 | L76: =1-(LN(1-L$1))/$A76 -> 1.1553784216746019 | M76: =1-(LN(1-M$1))/$A76 -> 1.170444495346513 | N76: =1-(LN(1-N$1))/$A76 -> 1.1856827564446768 | O76: =1-(LN(1-O$1))/$A76 -> 1.2010971863127782 | P76: =1-(LN(1-P$1))/$A76 -> 1.2166919059970331 | Q76: =1-(LN(1-Q$1))/$A76 -> 1.2324711828597037 | R76: =1-(LN(1-R$1))/$A76 -> 1.2484394375886578 | S76: =1-(LN(1-S$1))/$A76 -> 1.2646012516317842 | T76: =1-(LN(1-T$1))/$A76 -> 1.2809613750875366 | U76: =1-(LN(1-U$1))/$A76 -> 1.2975247350856129 | V76: =1-(LN(1-V$1))/$A76 -> 1.3142964446947598 | W76: =1-(LN(1-W$1))/$A76 -> 1.3312818123979995 | X76: =1-(LN(1-X$1))/$A76 -> 1.3484863521792101 | Y76: =1-(LN(1-Y$1))/$A76 -> 1.3659157942690137 | Z76: =1-(LN(1-Z$1))/$A76 -> 1.3835760966023742 | AA76: =1-(LN(1-AA$1))/$A76 -> 1.4014734570452285 | AB76: =1-(LN(1-AB$1))/$A76 -> 1.4196143264529333 | AC76: =1-(LN(1-AC$1))/$A76 -> 1.4380054226293812 | AD76: =1-(LN(1-AD$1))/$A76 -> 1.4566537452623678 | AE76: =1-(LN(1-AE$1))/$A76 -> 1.4755665919183096 | AF76: =1-(LN(1-AF$1))/$A76 -> 1.4947515751877758 | AG76: =1-(LN(1-AG$1))/$A76 -> 1.5142166410826461 | AH76: =1-(LN(1-AH$1))/$A76 -> 1.5339700887961669 | AI76: =1-(LN(1-AI$1))/$A76 -> 1.5540205919488876 | AJ76: =1-(LN(1-AJ$1))/$A76 -> 1.5743772214566056 | AK76: =1-(LN(1-AK$1))/$A76 -> 1.5950494701712259 | AL76: =1-(LN(1-AL$1))/$A76 -> 1.6160472794620779 | AM76: =1-(LN(1-AM$1))/$A76 -> 1.6373810679239997 | AN76: =1-(LN(1-AN$1))/$A76 -> 1.6590617624197068 | AO76: =1-(LN(1-AO$1))/$A76 -> 1.6811008316879876 | AP76: =1-(LN(1-AP$1))/$A76 -> 1.7035103227764958 | AQ76: =1-(LN(1-AQ$1))/$A76 -> 1.7263029005888959 | AR76: =1-(LN(1-AR$1))/$A76 -> 1.7494918908713881 | AS76: =1-(LN(1-AS$1))/$A76 -> 1.773091327003923 | AT76: =1-(LN(1-AT$1))/$A76 -> 1.7971160010074938 | AU76: =1-(LN(1-AU$1))/$A76 -> 1.8215815192317559 | AV76: =1-(LN(1-AV$1))/$A76 -> 1.8465043632479594 | AW76: =1-(LN(1-AW$1))/$A76 -> 1.8719019565422186 | AX76: =1-(LN(1-AX$1))/$A76 -> 1.8977927376850208 | AY76: =1-(LN(1-AY$1))/$A76 -> 1.9241962407465938 | AZ76: =1-(LN(1-AZ$1))/$A76 -> 1.9511331838366197 | BA76: =1-(LN(1-BA$1))/$A76 -> 1.9786255667736006 | BB76: =1-(LN(1-BB$1))/$A76 -> 2.0066967790373771 | BC76: =1-(LN(1-BC$1))/$A76 -> 2.0353717193319953 | BD76: =1-(LN(1-BD$1))/$A76 -> 2.0646769282903623 | BE76: =1-(LN(1-BE$1))/$A76 -> 2.094640736093107 | BF76: =1-(LN(1-BF$1))/$A76 -> 2.125293427059372 | BG76: =1-(LN(1-BG$1))/$A76 -> 2.1566674236062977 | BH76: =1-(LN(1-BH$1))/$A76 -> 2.1887974923783782 | BI76: =1-(LN(1-BI$1))/$A76 -> 2.2217209758322074 | BJ76: =1-(LN(1-BJ$1))/$A76 -> 2.2554780531445937 | BK76: =1-(LN(1-BK$1))/$A76 -> 2.2901120350156079 | BL76: =1-(LN(1-BL$1))/$A76 -> 2.325669697791823 | BM76: =1-(LN(1-BM$1))/$A76 -> 2.3622016633759757 | BN76: =1-(LN(1-BN$1))/$A76 -> 2.3997628326649041 | BO76: =1-(LN(1-BO$1))/$A76 -> 2.4384128818292403 | BP76: =1-(LN(1-BP$1))/$A76 -> 2.4782168326954821 | BQ76: =1-(LN(1-BQ$1))/$A76 -> 2.5192457109178203 | BR76: =1-(LN(1-BR$1))/$A76 -> 2.5615773086705946 | BS76: =1-(LN(1-BS$1))/$A76 -> 2.6052970724345821 | BT76: =1-(LN(1-BT$1))/$A76 -> 2.6504991413354908 | BU76: =1-(LN(1-BU$1))/$A76 -> 2.6972875677505175 | BV76: =1-(LN(1-BV$1))/$A76 -> 2.7457777599783508 | BW76: =1-(LN(1-BW$1))/$A76 -> 2.7960981972888135 | BX76: =1-(LN(1-BX$1))/$A76 -> 2.8483924814931889 | BY76: =1-(LN(1-BY$1))/$A76 -> 2.9028218075201959 | BZ76: =1-(LN(1-BZ$1))/$A76 -> 2.9595679600785907 | CA76: =1-(LN(1-CA$1))/$A76 -> 3.0188369768397023 | CB76: =1-(LN(1-CB$1))/$A76 -> 3.080863664352893 | CC76: =1-(LN(1-CC$1))/$A76 -> 3.1459172165788023 | CD76: =1-(LN(1-CD$1))/$A76 -> 3.2143082757622032 | CE76: =1-(LN(1-CE$1))/$A76 -> 3.2863979041225715 | CF76: =1-(LN(1-CF$1))/$A76 -> 3.3626091225758366 | CG76: =1-(LN(1-CG$1))/$A76 -> 3.4434419516644161 | CH76: =1-(LN(1-CH$1))/$A76 -> 3.5294933131811783 | CI76: =1-(LN(1-CI$1))/$A76 -> 3.6214838084971142 | CJ76: =1-(LN(1-CJ$1))/$A76 -> 3.7202944380354106 | CK76: =1-(LN(1-CK$1))/$A76 -> 3.827018048266793 | CL76: =1-(LN(1-CL$1))/$A76 -> 3.9430332175862994 | CM76: =1-(LN(1-CM$1))/$A76 -> 4.0701134573253999 | CN76: =1-(LN(1-CN$1))/$A76 -> 4.2105941448691695 | CO76: =1-(LN(1-CO$1))/$A76 -> 4.3676381924110146 | CP76: =1-(LN(1-CP$1))/$A76 -> 4.5456800492437139 | CQ76: =1-(LN(1-CQ$1))/$A76 -> 4.7512142890133937 | CR76: =1-(LN(1-CR$1))/$A76 -> 4.9943096980720014 | CS76: =1-(LN(1-CS$1))/$A76 -> 5.2918344331576197 | CT76: =1-(LN(1-CT$1))/$A76 -> 5.6754105297600015 | CU76: =1-(LN(1-CU$1))/$A76 -> 6.2160306739042346 | CV76: =1-(LN(1-CV$1))/$A76 -> 7.1402269146508734
A77: =A76+0.01 -> 00.76 | B77: =1-(LN(1-B$1))/$A77 -> 1.0132241261230281 | C77: =1-(LN(1-C$1))/$A77 -> 1.026582509628315 | D77: =1-(LN(1-D$1))/$A77 -> 1.0400779045851429 | E77: =1-(LN(1-E$1))/$A77 -> 1.0537131506845463 | F77: =1-(LN(1-F$1))/$A77 -> 1.0674911768257245 | G77: =1-(LN(1-G$1))/$A77 -> 1.0814150048922204 | H77: =1-(LN(1-H$1))/$A77 -> 1.0954877537300467 | I77: =1-(LN(1-I$1))/$A77 -> 1.1097126433408566 | J77: =1-(LN(1-J$1))/$A77 -> 1.1240929993042648 | K77: =1-(LN(1-K$1))/$A77 -> 1.1386322574445082 | L77: =1-(LN(1-L$1))/$A77 -> 1.1533339687578308 | M77: =1-(LN(1-M$1))/$A77 -> 1.1682018046182694 | N77: =1-(LN(1-N$1))/$A77 -> 1.1832395622809311 | O77: =1-(LN(1-O$1))/$A77 -> 1.1984511707033993 | P77: =1-(LN(1-P$1))/$A77 -> 1.2138406967075985 | Q77: =1-(LN(1-Q$1))/$A77 -> 1.2294123515062865 | R77: =1-(LN(1-R$1))/$A77 -> 1.2451704976203861 | S77: =1-(LN(1-S$1))/$A77 -> 1.2611196562155766 | T77: =1-(LN(1-T$1))/$A77 -> 1.2772645148890165 | U77: =1-(LN(1-U$1))/$A77 -> 1.2936099359397497 | V77: =1-(LN(1-V$1))/$A77 -> 1.3101609651593025 | W77: =1-(LN(1-W$1))/$A77 -> 1.3269228411822362 | X77: =1-(LN(1-X$1))/$A77 -> 1.3439010054400098 | Y77: =1-(LN(1-Y$1))/$A77 -> 1.361101112765474 | Z77: =1-(LN(1-Z$1))/$A77 -> 1.3785290426997114 | AA77: =1-(LN(1-AA$1))/$A77 -> 1.3961909115577913 | AB77: =1-(LN(1-AB$1))/$A77 -> 1.4140930853153948 | AC77: =1-(LN(1-AC$1))/$A77 -> 1.4322421933842577 | AD77: =1-(LN(1-AD$1))/$A77 -> 1.4506451433510208 | AE77: =1-(LN(1-AE$1))/$A77 -> 1.4693091367614897 | AF77: =1-(LN(1-AF$1))/$A77 -> 1.4882416860405683 | AG77: =1-(LN(1-AG$1))/$A77 -> 1.5074506326473482 | AH77: =1-(LN(1-AH$1))/$A77 -> 1.5269441665751646 | AI77: =1-(LN(1-AI$1))/$A77 -> 1.5467308473179813 | AJ77: =1-(LN(1-AJ$1))/$A77 -> 1.5668196264374397 | AK77: =1-(LN(1-AK$1))/$A77 -> 1.5872198718794992 | AL77: =1-(LN(1-AL$1))/$A77 -> 1.6079413942059981 | AM77: =1-(LN(1-AM$1))/$A77 -> 1.6289944749249996 | AN77: =1-(LN(1-AN$1))/$A77 -> 1.6503898971247106 | AO77: =1-(LN(1-AO$1))/$A77 -> 1.6721389786394614 | AP77: =1-(LN(1-AP$1))/$A77 -> 1.694253608003121 | AQ77: =1-(LN(1-AQ$1))/$A77 -> 1.7167462834758842 | AR77: =1-(LN(1-AR$1))/$A77 -> 1.7396301554651858 | AS77: =1-(LN(1-AS$1))/$A77 -> 1.7629190727012398 | AT77: =1-(LN(1-AT$1))/$A77 -> 1.7866276325731847 | AU77: =1-(LN(1-AU$1))/$A77 -> 1.8107712360839696 | AV77: =1-(LN(1-AV$1))/$A77 -> 1.8353661479420653 | AW77: =1-(LN(1-AW$1))/$A77 -> 1.8604295623771896 | AX77: =1-(LN(1-AX$1))/$A77 -> 1.8859796753470599 | AY77: =1-(LN(1-AY$1))/$A77 -> 1.9120357638946648 | AZ77: =1-(LN(1-AZ$1))/$A77 -> 1.93861827352298 | BA77: =1-(LN(1-BA$1))/$A77 -> 1.9657489145792111 | BB77: =1-(LN(1-BB$1))/$A77 -> 1.9934507687868854 | BC77: =1-(LN(1-BC$1))/$A77 -> 2.0217484072355214 | BD77: =1-(LN(1-BD$1))/$A77 -> 2.050668021339173 | BE77: =1-(LN(1-BE$1))/$A77 -> 2.0802375685129348 | BF77: =1-(LN(1-BF$1))/$A77 -> 2.1104869345980646 | BG77: =1-(LN(1-BG$1))/$A77 -> 2.1414481154009515 | BH77: =1-(LN(1-BH$1))/$A77 -> 2.1731554201102421 | BI77: =1-(LN(1-BI$1))/$A77 -> 2.2056456998344149 | BJ77: =1-(LN(1-BJ$1))/$A77 -> 2.2389586050769017 | BK77: =1-(LN(1-BK$1))/$A77 -> 2.2731368766601392 | BL77: =1-(LN(1-BL$1))/$A77 -> 2.308226675452457 | BM77: =1-(LN(1-BM$1))/$A77 -> 2.3442779572789236 | BN77: =1-(LN(1-BN$1))/$A77 -> 2.3813449006561553 | BO77: =1-(LN(1-BO$1))/$A77 -> 2.4194863965420135 | BP77: =1-(LN(1-BP$1))/$A77 -> 2.4587666112126465 | BQ77: =1-(LN(1-BQ$1))/$A77 -> 2.4992556357741647 | BR77: =1-(LN(1-BR$1))/$A77 -> 2.5410302388196655 | BS77: =1-(LN(1-BS$1))/$A77 -> 2.584174742534127 | BT77: =1-(LN(1-BT$1))/$A77 -> 2.6287820473705503 | BU77: =1-(LN(1-BU$1))/$A77 -> 2.6749548365959055 | BV77: =1-(LN(1-BV$1))/$A77 -> 2.7228069999786353 | BW77: =1-(LN(1-BW$1))/$A77 -> 2.7724653262718553 | BX77: =1-(LN(1-BX$1))/$A77 -> 2.8240715277893309 | BY77: =1-(LN(1-BY$1))/$A77 -> 2.8777846784738772 | BZ77: =1-(LN(1-BZ$1))/$A77 -> 2.933784171130188 | CA77: =1-(LN(1-CA$1))/$A77 -> 2.992273332407601 | CB77: =1-(LN(1-CB$1))/$A77 -> 3.053483879295618 | CC77: =1-(LN(1-CC$1))/$A77 -> 3.1176814637290811 | CD77: =1-(LN(1-CD$1))/$A77 -> 3.1851726405548062 | CE77: =1-(LN(1-CE$1))/$A77 -> 3.2563137211735902 | CF77: =1-(LN(1-CF$1))/$A77 -> 3.3315221604366805 | CG77: =1-(LN(1-CG$1))/$A77 -> 3.4112913996688321 | CH77: =1-(LN(1-CH$1))/$A77 -> 3.4962105064287945 | CI77: =1-(LN(1-CI$1))/$A77 -> 3.5869906004905729 | CJ77: =1-(LN(1-CJ$1))/$A77 -> 3.6845010901665236 | CK77: =1-(LN(1-CK$1))/$A77 -> 3.7898204423685455 | CL77: =1-(LN(1-CL$1))/$A77 -> 3.9043090963022693 | CM77: =1-(LN(1-CM$1))/$A77 -> 4.0297172276237507 | CN77: =1-(LN(1-CN$1))/$A77 -> 4.1683494850682594 | CO77: =1-(LN(1-CO$1))/$A77 -> 4.3233271635635013 | CP77: =1-(LN(1-CP$1))/$A77 -> 4.4990263643852435 | CQ77: =1-(LN(1-CQ$1))/$A77 -> 4.7018562062632174 | CR77: =1-(LN(1-CR$1))/$A77 -> 4.9417529915184231 | CS77: =1-(LN(1-CS$1))/$A77 -> 5.2353629274581772 | CT77: =1-(LN(1-CT$1))/$A77 -> 5.613891970157896 | CU77: =1-(LN(1-CU$1))/$A77 -> 6.1473986913528629 | CV77: =1-(LN(1-CV$1))/$A77 -> 7.0594344552475725
A78: =A77+0.01 -> 00.77 | B78: =1-(LN(1-B$1))/$A78 -> 1.0130523842253265 | C78: =1-(LN(1-C$1))/$A78 -> 1.0262372822305448 | D78: =1-(LN(1-D$1))/$A78 -> 1.0395574123178033 | E78: =1-(LN(1-E$1))/$A78 -> 1.0530155772990326 | F78: =1-(LN(1-F$1))/$A78 -> 1.06661466803578 | G78: =1-(LN(1-G$1))/$A78 -> 1.0803576671663473 | H78: =1-(LN(1-H$1))/$A78 -> 1.0942476530322538 | I78: =1-(LN(1-I$1))/$A78 -> 1.1082878038169492 | J78: =1-(LN(1-J$1))/$A78 -> 1.122481401910703 | K78: =1-(LN(1-K$1))/$A78 -> 1.1368318385166574 | L78: =1-(LN(1-L$1))/$A78 -> 1.1513426185142226 | M78: =1-(LN(1-M$1))/$A78 -> 1.166017365597253 | N78: =1-(LN(1-N$1))/$A78 -> 1.180859827705854 | O78: =1-(LN(1-O$1))/$A78 -> 1.1958738827721864 | P78: =1-(LN(1-P$1))/$A78 -> 1.211063544802305 | Q78: =1-(LN(1-Q$1))/$A78 -> 1.2264329703178931 | R78: =1-(LN(1-R$1))/$A78 -> 1.2419864651837575 | S78: =1-(LN(1-S$1))/$A78 -> 1.2577284918491405 | T78: =1-(LN(1-T$1))/$A78 -> 1.273663677033315 | U78: =1-(LN(1-U$1))/$A78 -> 1.2897968198885841 | V78: =1-(LN(1-V$1))/$A78 -> 1.3061329006767139 | W78: =1-(LN(1-W$1))/$A78 -> 1.3226770899980513 | X78: =1-(LN(1-X$1))/$A78 -> 1.3394347586161137 | Y78: =1-(LN(1-Y$1))/$A78 -> 1.3564114879243641 | Z78: =1-(LN(1-Z$1))/$A78 -> 1.3736130811062086 | AA78: =1-(LN(1-AA$1))/$A78 -> 1.3910455750440538 | AB78: =1-(LN(1-AB$1))/$A78 -> 1.4087152530385714 | AC78: =1-(LN(1-AC$1))/$A78 -> 1.4266286584052414 | AD78: =1-(LN(1-AD$1))/$A78 -> 1.4447926090217869 | AE78: =1-(LN(1-AE$1))/$A78 -> 1.4632142129074444 | AF78: =1-(LN(1-AF$1))/$A78 -> 1.4819008849231583 | AG78: =1-(LN(1-AG$1))/$A78 -> 1.5008603646908889 | AH78: =1-(LN(1-AH$1))/$A78 -> 1.5201007358404222 | AI78: =1-(LN(1-AI$1))/$A78 -> 1.5396304467034621 | AJ78: =1-(LN(1-AJ$1))/$A78 -> 1.5594583325876028 | AK78: =1-(LN(1-AK$1))/$A78 -> 1.5795936397771682 | AL78: =1-(LN(1-AL$1))/$A78 -> 1.6000460514241022 | AM78: =1-(LN(1-AM$1))/$A78 -> 1.6208257155103891 | AN78: =1-(LN(1-AN$1))/$A78 -> 1.6419432750841301 | AO78: =1-(LN(1-AO$1))/$A78 -> 1.6634099009947931 | AP78: =1-(LN(1-AP$1))/$A78 -> 1.6852373273797037 | AQ78: =1-(LN(1-AQ$1))/$A78 -> 1.7074378901839895 | AR78: =1-(LN(1-AR$1))/$A78 -> 1.7300245690305731 | AS78: =1-(LN(1-AS$1))/$A78 -> 1.7530110327960289 | AT78: =1-(LN(1-AT$1))/$A78 -> 1.7764116892930135 | AU78: =1-(LN(1-AU$1))/$A78 -> 1.8002417395114505 | AV78: =1-(LN(1-AV$1))/$A78 -> 1.8245172369298306 | AW78: =1-(LN(1-AW$1))/$A78 -> 1.8492551524761871 | AX78: =1-(LN(1-AX$1))/$A78 -> 1.8744734457970982 | AY78: =1-(LN(1-AY$1))/$A78 -> 1.9001911435843446 | AZ78: =1-(LN(1-AZ$1))/$A78 -> 1.9264284258148894 | BA78: =1-(LN(1-BA$1))/$A78 -> 1.9532067208833772 | BB78: =1-(LN(1-BB$1))/$A78 -> 1.9805488107506921 | BC78: =1-(LN(1-BC$1))/$A78 -> 2.0084789474012941 | BD78: =1-(LN(1-BD$1))/$A78 -> 2.0370229821010022 | BE78: =1-(LN(1-BE$1))/$A78 -> 2.0662085091815978 | BF78: =1-(LN(1-BF$1))/$A78 -> 2.0960650263565315 | BG78: =1-(LN(1-BG$1))/$A78 -> 2.1266241139022379 | BH78: =1-(LN(1-BH$1))/$A78 -> 2.1579196354334851 | BI78: =1-(LN(1-BI$1))/$A78 -> 2.1899879634729289 | BJ78: =1-(LN(1-BJ$1))/$A78 -> 2.2228682335823962 | BK78: =1-(LN(1-BK$1))/$A78 -> 2.2566026315087089 | BL78: =1-(LN(1-BL$1))/$A78 -> 2.2912367186283991 | BM78: =1-(LN(1-BM$1))/$A78 -> 2.3268198019895867 | BN78: =1-(LN(1-BN$1))/$A78 -> 2.3634053564917901 | BO78: =1-(LN(1-BO$1))/$A78 -> 2.4010515082752342 | BP78: =1-(LN(1-BP$1))/$A78 -> 2.4398215902878073 | BQ78: =1-(LN(1-BQ$1))/$A78 -> 2.479784783361513 | BR78: =1-(LN(1-BR$1))/$A78 -> 2.5210168590947344 | BS78: =1-(LN(1-BS$1))/$A78 -> 2.5636010445791384 | BT78: =1-(LN(1-BT$1))/$A78 -> 2.607629033768335 | BU78: =1-(LN(1-BU$1))/$A78 -> 2.6532021763803741 | BV78: =1-(LN(1-BV$1))/$A78 -> 2.7004328830957962 | BW78: =1-(LN(1-BW$1))/$A78 -> 2.7494462960605328 | BX78: =1-(LN(1-BX$1))/$A78 -> 2.8003822871686905 | BY78: =1-(LN(1-BY$1))/$A78 -> 2.8533978644677234 | BZ78: =1-(LN(1-BZ$1))/$A78 -> 2.9086700909856402 | CA78: =1-(LN(1-CA$1))/$A78 -> 2.966399652765944 | CB78: =1-(LN(1-CB$1))/$A78 -> 3.0268152574865841 | CC78: =1-(LN(1-CC$1))/$A78 -> 3.0901791070572751 | CD78: =1-(LN(1-CD$1))/$A78 -> 3.156793775093055 | CE78: =1-(LN(1-CE$1))/$A78 -> 3.2270109455739329 | CF78: =1-(LN(1-CF$1))/$A78 -> 3.3012426518595808 | CG78: =1-(LN(1-CG$1))/$A78 -> 3.37997592694586 | CH78: =1-(LN(1-CH$1))/$A78 -> 3.4637921881634854 | CI78: =1-(LN(1-CI$1))/$A78 -> 3.5533933199647216 | CJ78: =1-(LN(1-CJ$1))/$A78 -> 3.6496374396448803 | CK78: =1-(LN(1-CK$1))/$A78 -> 3.7535890080520709 | CL78: =1-(LN(1-CL$1))/$A78 -> 3.8665907963502919 | CM78: =1-(LN(1-CM$1))/$A78 -> 3.9903702506416239 | CN78: =1-(LN(1-CN$1))/$A78 -> 4.1272020891582812 | CO78: =1-(LN(1-CO$1))/$A78 -> 4.2801670705302097 | CP78: =1-(LN(1-CP$1))/$A78 -> 4.4535844635490722 | CQ78: =1-(LN(1-CQ$1))/$A78 -> 4.6537801516364219 | CR78: =1-(LN(1-CR$1))/$A78 -> 4.8905613942259762 | CS78: =1-(LN(1-CS$1))/$A78 -> 5.1803582141145643 | CT78: =1-(LN(1-CT$1))/$A78 -> 5.5539712952207809 | CU78: =1-(LN(1-CU$1))/$A78 -> 6.0805493576989296 | CV78: =1-(LN(1-CV$1))/$A78 -> 6.9807405012833179
A79: =A78+0.01 -> 00.78 | B79: =1-(LN(1-B$1))/$A79 -> 1.0128850459660275 | C79: =1-(LN(1-C$1))/$A79 -> 1.0259009068173326 | D79: =1-(LN(1-D$1))/$A79 -> 1.0390502660060366 | E79: =1-(LN(1-E$1))/$A79 -> 1.0523358904105835 | F79: =1-(LN(1-F$1))/$A79 -> 1.065760633830193 | G79: =1-(LN(1-G$1))/$A79 -> 1.0793274406642148 | H79: =1-(LN(1-H$1))/$A79 -> 1.0930393497882507 | I79: =1-(LN(1-I$1))/$A79 -> 1.1068994986398089 | J79: =1-(LN(1-J$1))/$A79 -> 1.1209111275272323 | K79: =1-(LN(1-K$1))/$A79 -> 1.1350775841767002 | L79: =1-(LN(1-L$1))/$A79 -> 1.1494023285332711 | M79: =1-(LN(1-M$1))/$A79 -> 1.1638889378331856 | N79: =1-(LN(1-N$1))/$A79 -> 1.1785411119660354 | O79: =1-(LN(1-O$1))/$A79 -> 1.1933626791469021 | P79: =1-(LN(1-P$1))/$A79 -> 1.2083576019202242 | Q79: =1-(LN(1-Q$1))/$A79 -> 1.2235299835189457 | R79: =1-(LN(1-R$1))/$A79 -> 1.2388840746044787 | S79: =1-(LN(1-S$1))/$A79 -> 1.2544242804151771 | T79: =1-(LN(1-T$1))/$A79 -> 1.2701551683534007 | U79: =1-(LN(1-U$1))/$A79 -> 1.2860814760438586 | V79: =1-(LN(1-V$1))/$A79 -> 1.3022081198988076 | W79: =1-(LN(1-W$1))/$A79 -> 1.3185402042288457 | X79: =1-(LN(1-X$1))/$A79 -> 1.335083030941548 | Y79: =1-(LN(1-Y$1))/$A79 -> 1.3518421098740516 | Z79: =1-(LN(1-Z$1))/$A79 -> 1.3688231698099753 | AA79: =1-(LN(1-AA$1))/$A79 -> 1.3860321702357967 | AB79: =1-(LN(1-AB$1))/$A79 -> 1.4034753138970513 | AC79: =1-(LN(1-AC$1))/$A79 -> 1.4211590602205588 | AD79: =1-(LN(1-AD$1))/$A79 -> 1.4390901396753537 | AE79: =1-(LN(1-AE$1))/$A79 -> 1.4572755691522208 | AF79: =1-(LN(1-AF$1))/$A79 -> 1.4757226684497844 | AG79: =1-(LN(1-AG$1))/$A79 -> 1.4944390779640828 | AH79: =1-(LN(1-AH$1))/$A79 -> 1.5134327776886221 | AI79: =1-(LN(1-AI$1))/$A79 -> 1.5327121076431611 | AJ79: =1-(LN(1-AJ$1))/$A79 -> 1.5522857898621207 | AK79: =1-(LN(1-AK$1))/$A79 -> 1.5721629520877172 | AL79: =1-(LN(1-AL$1))/$A79 -> 1.5923531533289212 | AM79: =1-(LN(1-AM$1))/$A79 -> 1.6128664114653843 | AN79: =1-(LN(1-AN$1))/$A79 -> 1.6337132330958717 | AO79: =1-(LN(1-AO$1))/$A79 -> 1.6549046458538341 | AP79: =1-(LN(1-AP$1))/$A79 -> 1.6764522334389382 | AQ79: =1-(LN(1-AQ$1))/$A79 -> 1.6983681736431691 | AR79: =1-(LN(1-AR$1))/$A79 -> 1.7206652796840272 | AS79: =1-(LN(1-AS$1))/$A79 -> 1.7433570451960798 | AT79: =1-(LN(1-AT$1))/$A79 -> 1.7664576932764364 | AU79: =1-(LN(1-AU$1))/$A79 -> 1.7899822300305344 | AV79: =1-(LN(1-AV$1))/$A79 -> 1.813946503123038 | AW79: =1-(LN(1-AW$1))/$A79 -> 1.8383672659059793 | AX79: =1-(LN(1-AX$1))/$A79 -> 1.8632622477740584 | AY79: =1-(LN(1-AY$1))/$A79 -> 1.8886502314871094 | AZ79: =1-(LN(1-AZ$1))/$A79 -> 1.914551138304442 | BA79: =1-(LN(1-BA$1))/$A79 -> 1.9409861218976929 | BB79: =1-(LN(1-BB$1))/$A79 -> 1.9679776721513242 | BC79: =1-(LN(1-BC$1))/$A79 -> 1.9955497301269185 | BD79: =1-(LN(1-BD$1))/$A79 -> 2.0237278156638099 | BE79: =1-(LN(1-BE$1))/$A79 -> 2.052539169320295 | BF79: =1-(LN(1-BF$1))/$A79 -> 2.0820129106340115 | BG79: =1-(LN(1-BG$1))/$A79 -> 2.1121802150060551 | BH79: =1-(LN(1-BH$1))/$A79 -> 2.1430745119022871 | BI79: =1-(LN(1-BI$1))/$A79 -> 2.1747317075309684 | BJ79: =1-(LN(1-BJ$1))/$A79 -> 2.2071904357159555 | BK79: =1-(LN(1-BK$1))/$A79 -> 2.2404923413611613 | BL79: =1-(LN(1-BL$1))/$A79 -> 2.2746824017229068 | BM79: =1-(LN(1-BM$1))/$A79 -> 2.3098092917076691 | BN79: =1-(LN(1-BN$1))/$A79 -> 2.3459258006393311 | BO79: =1-(LN(1-BO$1))/$A79 -> 2.3830893094511927 | BP79: =1-(LN(1-BP$1))/$A79 -> 2.4213623391302712 | BQ79: =1-(LN(1-BQ$1))/$A79 -> 2.4608131835748273 | BR79: =1-(LN(1-BR$1))/$A79 -> 2.5015166429524944 | BS79: =1-(LN(1-BS$1))/$A79 -> 2.5435548773409442 | BT79: =1-(LN(1-BT$1))/$A79 -> 2.5870184051302796 | BU79: =1-(LN(1-BU$1))/$A79 -> 2.6320072766831899 | BV79: =1-(LN(1-BV$1))/$A79 -> 2.6786324615176449 | BW79: =1-(LN(1-BW$1))/$A79 -> 2.7270174973930903 | BX79: =1-(LN(1-BX$1))/$A79 -> 2.7773004629742202 | BY79: =1-(LN(1-BY$1))/$A79 -> 2.8296363533848035 | BZ79: =1-(LN(1-BZ$1))/$A79 -> 2.884199961614029 | CA79: =1-(LN(1-CA$1))/$A79 -> 2.9411894008074064 | CB79: =1-(LN(1-CB$1))/$A79 -> 3.0008304464931661 | CC79: =1-(LN(1-CC$1))/$A79 -> 3.063381939018079 | CD79: =1-(LN(1-CD$1))/$A79 -> 3.1291425728482727 | CE79: =1-(LN(1-CE$1))/$A79 -> 3.1984595231947801 | CF79: =1-(LN(1-CF$1))/$A79 -> 3.2717395409383041 | CG79: =1-(LN(1-CG$1))/$A79 -> 3.3494634150619387 | CH79: =1-(LN(1-CH$1))/$A79 -> 3.4322051088280561 | CI79: =1-(LN(1-CI$1))/$A79 -> 3.5206575081703018 | CJ79: =1-(LN(1-CJ$1))/$A79 -> 3.6156677288802022 | CK79: =1-(LN(1-CK$1))/$A79 -> 3.7182865848719162 | CL79: =1-(LN(1-CL$1))/$A79 -> 3.8298396322945187 | CM79: =1-(LN(1-CM$1))/$A79 -> 3.9520321705051926 | CN79: =1-(LN(1-CN$1))/$A79 -> 4.0871097546818937 | CO79: =1-(LN(1-CO$1))/$A79 -> 4.2381136465490528 | CP79: =1-(LN(1-CP$1))/$A79 -> 4.4093077396574163 | CQ79: =1-(LN(1-CQ$1))/$A79 -> 4.6069368163590321 | CR79: =1-(LN(1-CR$1))/$A79 -> 4.8406824019923089 | CS79: =1-(LN(1-CS$1))/$A79 -> 5.1267638780361722 | CT79: =1-(LN(1-CT$1))/$A79 -> 5.495587047846155 | CU79: =1-(LN(1-CU$1))/$A79 -> 6.0154141095233022 | CV79: =1-(LN(1-CV$1))/$A79 -> 6.9040643410104545
A80: =A79+0.01 -> 00.79 | B80: =1-(LN(1-B$1))/$A80 -> 1.0127219441183564 | C80: =1-(LN(1-C$1))/$A80 -> 1.0255730472373663 | D80: =1-(LN(1-D$1))/$A80 -> 1.0385559588414033 | E80: =1-(LN(1-E$1))/$A80 -> 1.0516734107851331 | F80: =1-(LN(1-F$1))/$A80 -> 1.0649282207437349 | G80: =1-(LN(1-G$1))/$A80 -> 1.0783232958456803 | H80: =1-(LN(1-H$1))/$A80 -> 1.0918616364997917 | I80: =1-(LN(1-I$1))/$A80 -> 1.1055463404291785 | J80: =1-(LN(1-J$1))/$A80 -> 1.1193806069256218 | K80: =1-(LN(1-K$1))/$A80 -> 1.1333677413390206 | L80: =1-(LN(1-L$1))/$A80 -> 1.1475111598176602 | M80: =1-(LN(1-M$1))/$A80 -> 1.16181439431631 | N80: =1-(LN(1-N$1))/$A80 -> 1.1762810978905158 | O80: =1-(LN(1-O$1))/$A80 -> 1.1909150502969412 | P80: =1-(LN(1-P$1))/$A80 -> 1.205720163921234 | Q80: =1-(LN(1-Q$1))/$A80 -> 1.2207004900566807 | R80: =1-(LN(1-R$1))/$A80 -> 1.2358602255588524 | S80: =1-(LN(1-S$1))/$A80 -> 1.2512037199035926 | T80: =1-(LN(1-T$1))/$A80 -> 1.2667354826780413 | U80: =1-(LN(1-U$1))/$A80 -> 1.2824601915369742 | V80: =1-(LN(1-V$1))/$A80 -> 1.2983827006595821 | W80: =1-(LN(1-W$1))/$A80 -> 1.3145080497449362 | X80: =1-(LN(1-X$1))/$A80 -> 1.3308414735878575 | Y80: =1-(LN(1-Y$1))/$A80 -> 1.3473884122807092 | Z80: =1-(LN(1-Z$1))/$A80 -> 1.3641545220908617 | AA80: =1-(LN(1-AA$1))/$A80 -> 1.381145687068255 | AB80: =1-(LN(1-AB$1))/$A80 -> 1.3983680314426583 | AC80: =1-(LN(1-AC$1))/$A80 -> 1.4158279328759948 | AD80: =1-(LN(1-AD$1))/$A80 -> 1.4335320366414883 | AE80: =1-(LN(1-AE$1))/$A80 -> 1.4514872708085218 | AF80: =1-(LN(1-AF$1))/$A80 -> 1.4697008625200403 | AG80: =1-(LN(1-AG$1))/$A80 -> 1.4881803554582083 | AH80: =1-(LN(1-AH$1))/$A80 -> 1.5069336286039559 | AI80: =1-(LN(1-AI$1))/$A80 -> 1.5259689164071717 | AJ80: =1-(LN(1-AJ$1))/$A80 -> 1.5452948304967773 | AK80: =1-(LN(1-AK$1))/$A80 -> 1.5649203830739484 | AL80: =1-(LN(1-AL$1))/$A80 -> 1.5848550121475424 | AM80: =1-(LN(1-AM$1))/$A80 -> 1.6051086087886073 | AN80: =1-(LN(1-AN$1))/$A80 -> 1.6256915466009874 | AO80: =1-(LN(1-AO$1))/$A80 -> 1.6466147136278364 | AP80: =1-(LN(1-AP$1))/$A80 -> 1.6678895469397113 | AQ80: =1-(LN(1-AQ$1))/$A80 -> 1.6895280701793316 | AR80: =1-(LN(1-AR$1))/$A80 -> 1.7115429343715711 | AS80: =1-(LN(1-AS$1))/$A80 -> 1.7339474623454962 | AT80: =1-(LN(1-AT$1))/$A80 -> 1.7567556971590133 | AU80: =1-(LN(1-AU$1))/$A80 -> 1.7799824549668568 | AV80: =1-(LN(1-AV$1))/$A80 -> 1.8036433828303413 | AW80: =1-(LN(1-AW$1))/$A80 -> 1.827755022033752 | AX80: =1-(LN(1-AX$1))/$A80 -> 1.8523348775490702 | AY80: =1-(LN(1-AY$1))/$A80 -> 1.8774014943796775 | AZ80: =1-(LN(1-AZ$1))/$A80 -> 1.902974541617044 | BA80: =1-(LN(1-BA$1))/$A80 -> 1.9290749051648108 | BB80: =1-(LN(1-BB$1))/$A80 -> 1.9557247902253581 | BC80: =1-(LN(1-BC$1))/$A80 -> 1.9829478348088563 | BD80: =1-(LN(1-BD$1))/$A80 -> 2.0107692357186986 | BE80: =1-(LN(1-BE$1))/$A80 -> 2.0392158886959875 | BF80: =1-(LN(1-BF$1))/$A80 -> 2.0683165446766192 | BG80: =1-(LN(1-BG$1))/$A80 -> 2.0981019844363584 | BH80: =1-(LN(1-BH$1))/$A80 -> 2.1286052142832705 | BI80: =1-(LN(1-BI$1))/$A80 -> 2.1598616859166526 | BJ80: =1-(LN(1-BJ$1))/$A80 -> 2.1919095441246141 | BK80: =1-(LN(1-BK$1))/$A80 -> 2.2247899066603871 | BL80: =1-(LN(1-BL$1))/$A80 -> 2.2585471814479332 | BM80: =1-(LN(1-BM$1))/$A80 -> 2.2932294272556728 | BN80: =1-(LN(1-BN$1))/$A80 -> 2.3288887651882 | BO80: =1-(LN(1-BO$1))/$A80 -> 2.3655818498378869 | BP80: =1-(LN(1-BP$1))/$A80 -> 2.4033704107868501 | BQ80: =1-(LN(1-BQ$1))/$A80 -> 2.4423218774536268 | BR80: =1-(LN(1-BR$1))/$A80 -> 2.4825101031682859 | BS80: =1-(LN(1-BS$1))/$A80 -> 2.5240162080075148 | BT80: =1-(LN(1-BT$1))/$A80 -> 2.5669295645590102 | BU80: =1-(LN(1-BU$1))/$A80 -> 2.6113489567251751 | BV80: =1-(LN(1-BV$1))/$A80 -> 2.6573839493465354 | BW80: =1-(LN(1-BW$1))/$A80 -> 2.7051565164134308 | BX80: =1-(LN(1-BX$1))/$A80 -> 2.7548029887593564 | BY80: =1-(LN(1-BY$1))/$A80 -> 2.8064763995444895 | BZ80: =1-(LN(1-BZ$1))/$A80 -> 2.8603493291885353 | CA80: =1-(LN(1-CA$1))/$A80 -> 2.9166173830756668 | CB80: =1-(LN(1-CB$1))/$A80 -> 2.9755034788160373 | CC80: =1-(LN(1-CC$1))/$A80 -> 3.0372631802963315 | CD80: =1-(LN(1-CD$1))/$A80 -> 3.1021914010400664 | CE80: =1-(LN(1-CE$1))/$A80 -> 3.1706309216353525 | CF80: =1-(LN(1-CF$1))/$A80 -> 3.2429833442175662 | CG80: =1-(LN(1-CG$1))/$A80 -> 3.3197233718333066 | CH80: =1-(LN(1-CH$1))/$A80 -> 3.4014177023871945 | CI80: =1-(LN(1-CI$1))/$A80 -> 3.4887504511048553 | CJ80: =1-(LN(1-CJ$1))/$A80 -> 3.582558010793111 | CK80: =1-(LN(1-CK$1))/$A80 -> 3.6838778939241705 | CL80: =1-(LN(1-CL$1))/$A80 -> 3.7940188774553478 | CM80: =1-(LN(1-CM$1))/$A80 -> 3.914664674676013 | CN80: =1-(LN(1-CN$1))/$A80 -> 4.0480324160150341 | CO80: =1-(LN(1-CO$1))/$A80 -> 4.197124866212989 | CP80: =1-(LN(1-CP$1))/$A80 -> 4.3661519454845381 | CQ80: =1-(LN(1-CQ$1))/$A80 -> 4.5612793883038538 | CR80: =1-(LN(1-CR$1))/$A80 -> 4.7920661690556976 | CS80: =1-(LN(1-CS$1))/$A80 -> 5.0745263605926771 | CT80: =1-(LN(1-CT$1))/$A80 -> 5.4386808826835455 | CU80: =1-(LN(1-CU$1))/$A80 -> 5.9519278549723751 | CV80: =1-(LN(1-CV$1))/$A80 -> 6.8293293493520943
A81: =A80+0.01 -> 00.8 | B81: =1-(LN(1-B$1))/$A81 -> 1.0125629198168768 | C81: =1-(LN(1-C$1))/$A81 -> 1.0252533841468994 | D81: =1-(LN(1-D$1))/$A81 -> 1.0380740093558858 | E81: =1-(LN(1-E$1))/$A81 -> 1.051027493150319 | F81: =1-(LN(1-F$1))/$A81 -> 1.0641166179844381 | G81: =1-(LN(1-G$1))/$A81 -> 1.0773442546476093 | H81: =1-(LN(1-H$1))/$A81 -> 1.0907133660435444 | I81: =1-(LN(1-I$1))/$A81 -> 1.1042270111738137 | J81: =1-(LN(1-J$1))/$A81 -> 1.1178883493390515 | K81: =1-(LN(1-K$1))/$A81 -> 1.1317006445722828 | L81: =1-(LN(1-L$1))/$A81 -> 1.1456672703199393 | M81: =1-(LN(1-M$1))/$A81 -> 1.159791714387356 | N81: =1-(LN(1-N$1))/$A81 -> 1.1740775841668845 | O81: =1-(LN(1-O$1))/$A81 -> 1.1885286121682295 | P81: =1-(LN(1-P$1))/$A81 -> 1.2031486618722185 | Q81: =1-(LN(1-Q$1))/$A81 -> 1.2179417339309722 | R81: =1-(LN(1-R$1))/$A81 -> 1.2329119727393667 | S81: =1-(LN(1-S$1))/$A81 -> 1.2480636734047978 | T81: =1-(LN(1-T$1))/$A81 -> 1.2634012891445656 | U81: =1-(LN(1-U$1))/$A81 -> 1.2789294391427621 | V81: =1-(LN(1-V$1))/$A81 -> 1.2946529169013372 | W81: =1-(LN(1-W$1))/$A81 -> 1.3105766991231245 | X81: =1-(LN(1-X$1))/$A81 -> 1.3267059551680094 | Y81: =1-(LN(1-Y$1))/$A81 -> 1.3430460571272003 | Z81: =1-(LN(1-Z$1))/$A81 -> 1.359602590564726 | AA81: =1-(LN(1-AA$1))/$A81 -> 1.3763813659799018 | AB81: =1-(LN(1-AB$1))/$A81 -> 1.3933884310496252 | AC81: =1-(LN(1-AC$1))/$A81 -> 1.4106300837150449 | AD81: =1-(LN(1-AD$1))/$A81 -> 1.4281128861834698 | AE81: =1-(LN(1-AE$1))/$A81 -> 1.4458436799234153 | AF81: =1-(LN(1-AF$1))/$A81 -> 1.4638296017385399 | AG81: =1-(LN(1-AG$1))/$A81 -> 1.4820781010149806 | AH81: =1-(LN(1-AH$1))/$A81 -> 1.5005969582464065 | AI81: =1-(LN(1-AI$1))/$A81 -> 1.5193943049520822 | AJ81: =1-(LN(1-AJ$1))/$A81 -> 1.5384786451155676 | AK81: =1-(LN(1-AK$1))/$A81 -> 1.5578588782855243 | AL81: =1-(LN(1-AL$1))/$A81 -> 1.5775443244956981 | AM81: =1-(LN(1-AM$1))/$A81 -> 1.5975447511787495 | AN81: =1-(LN(1-AN$1))/$A81 -> 1.6178704022684749 | AO81: =1-(LN(1-AO$1))/$A81 -> 1.6385320297074881 | AP81: =1-(LN(1-AP$1))/$A81 -> 1.6595409276029649 | AQ81: =1-(LN(1-AQ$1))/$A81 -> 1.6809089693020898 | AR81: =1-(LN(1-AR$1))/$A81 -> 1.7026486476919265 | AS81: =1-(LN(1-AS$1))/$A81 -> 1.7247731190661777 | AT81: =1-(LN(1-AT$1))/$A81 -> 1.7472962509445256 | AU81: =1-(LN(1-AU$1))/$A81 -> 1.7702326742797712 | AV81: =1-(LN(1-AV$1))/$A81 -> 1.793597840544962 | AW81: =1-(LN(1-AW$1))/$A81 -> 1.81740808425833 | AX81: =1-(LN(1-AX$1))/$A81 -> 1.841680691579707 | AY81: =1-(LN(1-AY$1))/$A81 -> 1.8664339756999317 | AZ81: =1-(LN(1-AZ$1))/$A81 -> 1.8916873598468311 | BA81: =1-(LN(1-BA$1))/$A81 -> 1.9174614688502507 | BB81: =1-(LN(1-BB$1))/$A81 -> 1.943778230347541 | BC81: =1-(LN(1-BC$1))/$A81 -> 1.9706609868737455 | BD81: =1-(LN(1-BD$1))/$A81 -> 1.9981346202722148 | BE81: =1-(LN(1-BE$1))/$A81 -> 2.0262256900872879 | BF81: =1-(LN(1-BF$1))/$A81 -> 2.0549625878681614 | BG81: =1-(LN(1-BG$1))/$A81 -> 2.0843757096309039 | BH81: =1-(LN(1-BH$1))/$A81 -> 2.1144976491047296 | BI81: =1-(LN(1-BI$1))/$A81 -> 2.1453634148426941 | BJ81: =1-(LN(1-BJ$1))/$A81 -> 2.1770106748230562 | BK81: =1-(LN(1-BK$1))/$A81 -> 2.2094800328271322 | BL81: =1-(LN(1-BL$1))/$A81 -> 2.242815341679834 | BM81: =1-(LN(1-BM$1))/$A81 -> 2.2770640594149771 | BN81: =1-(LN(1-BN$1))/$A81 -> 2.3122776556233475 | BO81: =1-(LN(1-BO$1))/$A81 -> 2.348512076714913 | BP81: =1-(LN(1-BP$1))/$A81 -> 2.3858282806520146 | BQ81: =1-(LN(1-BQ$1))/$A81 -> 2.4242928539854565 | BR81: =1-(LN(1-BR$1))/$A81 -> 2.4639787268786821 | BS81: =1-(LN(1-BS$1))/$A81 -> 2.5049660054074208 | BT81: =1-(LN(1-BT$1))/$A81 -> 2.5473429450020224 | BU81: =1-(LN(1-BU$1))/$A81 -> 2.5912070947661103 | BV81: =1-(LN(1-BV$1))/$A81 -> 2.6366666499797038 | BW81: =1-(LN(1-BW$1))/$A81 -> 2.6838420599582626 | BX81: =1-(LN(1-BX$1))/$A81 -> 2.7328679513998644 | BY81: =1-(LN(1-BY$1))/$A81 -> 2.7838954445501836 | BZ81: =1-(LN(1-BZ$1))/$A81 -> 2.8370949625736785 | CA81: =1-(LN(1-CA$1))/$A81 -> 2.892659665787221 | CB81: =1-(LN(1-CB$1))/$A81 -> 2.950809685330837 | CC81: =1-(LN(1-CC$1))/$A81 -> 3.0117973905426272 | CD81: =1-(LN(1-CD$1))/$A81 -> 3.0759140085270658 | CE81: =1-(LN(1-CE$1))/$A81 -> 3.1434980351149107 | CF81: =1-(LN(1-CF$1))/$A81 -> 3.2149460524148465 | CG81: =1-(LN(1-CG$1))/$A81 -> 3.2907268296853904 | CH81: =1-(LN(1-CH$1))/$A81 -> 3.3713999811073547 | CI81: =1-(LN(1-CI$1))/$A81 -> 3.4576410704660443 | CJ81: =1-(LN(1-CJ$1))/$A81 -> 3.550276035658197 | CK81: =1-(LN(1-CK$1))/$A81 -> 3.6503294202501184 | CL81: =1-(LN(1-CL$1))/$A81 -> 3.7590936414871559 | CM81: =1-(LN(1-CM$1))/$A81 -> 3.8782313662425629 | CN81: =1-(LN(1-CN$1))/$A81 -> 4.0099320108148468 | CO81: =1-(LN(1-CO$1))/$A81 -> 4.1571608053853266 | CP81: =1-(LN(1-CP$1))/$A81 -> 4.3240750461659818 | CQ81: =1-(LN(1-CQ$1))/$A81 -> 4.5167633959500559 | CR81: =1-(LN(1-CR$1))/$A81 -> 4.7446653419425022 | CS81: =1-(LN(1-CS$1))/$A81 -> 5.0235947810852686 | CT81: =1-(LN(1-CT$1))/$A81 -> 5.3831973716500015 | CU81: =1-(LN(1-CU$1))/$A81 -> 5.8900287567852203 | CV81: =1-(LN(1-CV$1))/$A81 -> 6.7564627324851934
A82: =A81+0.01 -> 0.8100000000000005 | B82: =1-(LN(1-B$1))/$A82 -> 1.0124078220413597 | C82: =1-(LN(1-C$1))/$A82 -> 1.0249416139722463 | D82: =1-(LN(1-D$1))/$A82 -> 1.037603959857665 | E82: =1-(LN(1-E$1))/$A82 -> 1.0503975240990804 | F82: =1-(LN(1-F$1))/$A82 -> 1.0633250547994451 | G82: =1-(LN(1-G$1))/$A82 -> 1.0763893873062809 | H82: =1-(LN(1-H$1))/$A82 -> 1.0895934479442413 | I82: =1-(LN(1-I$1))/$A82 -> 1.1029402579494456 | J82: =1-(LN(1-J$1))/$A82 -> 1.1164329376188162 | K82: =1-(LN(1-K$1))/$A82 -> 1.1300747106886744 | L82: =1-(LN(1-L$1))/$A82 -> 1.1438689089579648 | M82: =1-(LN(1-M$1))/$A82 -> 1.1578189771726972 | N82: =1-(LN(1-N$1))/$A82 -> 1.1719284781895154 | O82: =1-(LN(1-O$1))/$A82 -> 1.1862010984377576 | P82: =1-(LN(1-P$1))/$A82 -> 1.2006406537009566 | Q82: =1-(LN(1-Q$1))/$A82 -> 1.2152510952404663 | R82: =1-(LN(1-R$1))/$A82 -> 1.2300365162857942 | S82: =1-(LN(1-S$1))/$A82 -> 1.2450011589183188 | T82: =1-(LN(1-T$1))/$A82 -> 1.2601494213773488 | U82: =1-(LN(1-U$1))/$A82 -> 1.2754858658200119 | V82: =1-(LN(1-V$1))/$A82 -> 1.2910152265692221 | W82: =1-(LN(1-W$1))/$A82 -> 1.3067424188870365 | X82: =1-(LN(1-X$1))/$A82 -> 1.3226725483140833 | Y82: =1-(LN(1-Y$1))/$A82 -> 1.3388109206194572 | Z82: =1-(LN(1-Z$1))/$A82 -> 1.3551630524096059 | AA82: =1-(LN(1-AA$1))/$A82 -> 1.3717346824492858 | AB82: =1-(LN(1-AB$1))/$A82 -> 1.388531783752716 | AC82: =1-(LN(1-AC$1))/$A82 -> 1.4055605765086863 | AD82: =1-(LN(1-AD$1))/$A82 -> 1.4228275419095997 | AE82: =1-(LN(1-AE$1))/$A82 -> 1.4403394369613978 | AF82: =1-(LN(1-AF$1))/$A82 -> 1.4581033103590517 | AG82: =1-(LN(1-AG$1))/$A82 -> 1.4761265195209685 | AH82: =1-(LN(1-AH$1))/$A82 -> 1.4944167488853397 | AI82: =1-(LN(1-AI$1))/$A82 -> 1.5129820295823033 | AJ82: =1-(LN(1-AJ$1))/$A82 -> 1.531830760607968 | AK82: =1-(LN(1-AK$1))/$A82 -> 1.5509717316400238 | AL82: =1-(LN(1-AL$1))/$A82 -> 1.5704141476500721 | AM82: =1-(LN(1-AM$1))/$A82 -> 1.5901676554851849 | AN82: =1-(LN(1-AN$1))/$A82 -> 1.6102423726108395 | AO82: =1-(LN(1-AO$1))/$A82 -> 1.630648918229618 | AP82: =1-(LN(1-AP$1))/$A82 -> 1.6513984470152741 | AQ82: =1-(LN(1-AQ$1))/$A82 -> 1.6725026857304592 | AR82: =1-(LN(1-AR$1))/$A82 -> 1.6939739730290633 | AS82: =1-(LN(1-AS$1))/$A82 -> 1.7158253027814099 | AT82: =1-(LN(1-AT$1))/$A82 -> 1.7380703713032351 | AU82: =1-(LN(1-AU$1))/$A82 -> 1.7607236289182926 | AV82: =1-(LN(1-AV$1))/$A82 -> 1.7838003363407031 | AW82: =1-(LN(1-AW$1))/$A82 -> 1.8073166264279803 | AX82: =1-(LN(1-AX$1))/$A82 -> 1.8312895719305748 | AY82: =1-(LN(1-AY$1))/$A82 -> 1.8557372599505497 | AZ82: =1-(LN(1-AZ$1))/$A82 -> 1.880678873922796 | BA82: =1-(LN(1-BA$1))/$A82 -> 1.9061347840496303 | BB82: =1-(LN(1-BB$1))/$A82 -> 1.9321266472568306 | BC82: =1-(LN(1-BC$1))/$A82 -> 1.9586775178999956 | BD82: =1-(LN(1-BD$1))/$A82 -> 1.9858119706392243 | BE82: =1-(LN(1-BE$1))/$A82 -> 2.0135562371232472 | BF82: =1-(LN(1-BF$1))/$A82 -> 2.0419383583883075 | BG82: =1-(LN(1-BG$1))/$A82 -> 2.070988355191016 | BH82: =1-(LN(1-BH$1))/$A82 -> 2.1007384188688691 | BI82: =1-(LN(1-BI$1))/$A82 -> 2.1312231257705623 | BJ82: =1-(LN(1-BJ$1))/$A82 -> 2.1624796788375864 | BK82: =1-(LN(1-BK$1))/$A82 -> 2.1945481805700071 | BL82: =1-(LN(1-BL$1))/$A82 -> 2.2274719423998359 | BM82: =1-(LN(1-BM$1))/$A82 -> 2.2612978364592369 | BN82: =1-(LN(1-BN$1))/$A82 -> 2.2960766969119479 | BO82: =1-(LN(1-BO$1))/$A82 -> 2.3318637794715191 | BP82: =1-(LN(1-BP$1))/$A82 -> 2.3687192895328537 | BQ82: =1-(LN(1-BQ$1))/$A82 -> 2.4067089915905742 | BR82: =1-(LN(1-BR$1))/$A82 -> 2.4459049154357357 | BS82: =1-(LN(1-BS$1))/$A82 -> 2.4863861781801688 | BT82: =1-(LN(1-BT$1))/$A82 -> 2.5282399456810101 | BU82: =1-(LN(1-BU$1))/$A82 -> 2.5715625627319607 | BV82: =1-(LN(1-BV$1))/$A82 -> 2.6164608888688434 | BW82: =1-(LN(1-BW$1))/$A82 -> 2.6630538863785311 | BX82: =1-(LN(1-BX$1))/$A82 -> 2.7114745199011008 | BY82: =1-(LN(1-BY$1))/$A82 -> 2.7618720440001812 | BZ82: =1-(LN(1-BZ$1))/$A82 -> 2.8144147778505468 | CA82: =1-(LN(1-CA$1))/$A82 -> 2.8692934970737984 | CB82: =1-(LN(1-CB$1))/$A82 -> 2.9267256151415673 | CC82: =1-(LN(1-CC$1))/$A82 -> 2.9869603857211136 | CD82: =1-(LN(1-CD$1))/$A82 -> 3.0502854405205588 | CE82: =1-(LN(1-CE$1))/$A82 -> 3.1170350964097882 | CF82: =1-(LN(1-CF$1))/$A82 -> 3.1876010394220708 | CG82: =1-(LN(1-CG$1))/$A82 -> 3.2624462515411263 | CH82: =1-(LN(1-CH$1))/$A82 -> 3.3421234381307205 | CI82: =1-(LN(1-CI$1))/$A82 -> 3.4272998226825129 | CJ82: =1-(LN(1-CJ$1))/$A82 -> 3.5187911463290837 | CK82: =1-(LN(1-CK$1))/$A82 -> 3.6176093039507342 | CL82: =1-(LN(1-CL$1))/$A82 -> 3.7250307570243515 | CM82: =1-(LN(1-CM$1))/$A82 -> 3.8426976456716671 | CN82: =1-(LN(1-CN$1))/$A82 -> 3.9727723563603421 | CO82: =1-(LN(1-CO$1))/$A82 -> 4.1181835114916803 | CP82: =1-(LN(1-CP$1))/$A82 -> 4.2830370826330686 | CQ82: =1-(LN(1-CQ$1))/$A82 -> 4.4733465639012895 | CR82: =1-(LN(1-CR$1))/$A82 -> 4.6984349056222241 | CS82: =1-(LN(1-CS$1))/$A82 -> 4.9739207714422404 | CT82: =1-(LN(1-CT$1))/$A82 -> 5.3290838238518532 | CU82: =1-(LN(1-CU$1))/$A82 -> 5.8296580313928095 | CV82: =1-(LN(1-CV$1))/$A82 -> 6.6853952913434007
A83: =A82+0.01 -> 0.82000000000000051 | B83: =1-(LN(1-B$1))/$A83 -> 1.0122565071384164 | C83: =1-(LN(1-C$1))/$A83 -> 1.0246374479481946 | D83: =1-(LN(1-D$1))/$A83 -> 1.037145374981352 | E83: =1-(LN(1-E$1))/$A83 -> 1.0497829201466526 | F83: =1-(LN(1-F$1))/$A83 -> 1.0625527980335983 | G83: =1-(LN(1-G$1))/$A83 -> 1.0754578094123017 | H83: =1-(LN(1-H$1))/$A83 -> 1.0885008449205311 | I83: =1-(LN(1-I$1))/$A83 -> 1.1016848889500621 | J83: =1-(LN(1-J$1))/$A83 -> 1.1150130237454161 | K83: =1-(LN(1-K$1))/$A83 -> 1.1284884337290564 | L83: =1-(LN(1-L$1))/$A83 -> 1.1421144100682334 | M83: =1-(LN(1-M$1))/$A83 -> 1.1558943554998595 | N83: =1-(LN(1-N$1))/$A83 -> 1.1698317894311068 | O83: =1-(LN(1-O$1))/$A83 -> 1.183930353334858 | P83: =1-(LN(1-P$1))/$A83 -> 1.1981938164607011 | Q83: =1-(LN(1-Q$1))/$A83 -> 1.2126260818838752 | R83: =1-(LN(1-R$1))/$A83 -> 1.2272311929164554 | S83: =1-(LN(1-S$1))/$A83 -> 1.2420133399071198 | T83: =1-(LN(1-T$1))/$A83 -> 1.2569768674581128 | U83: =1-(LN(1-U$1))/$A83 -> 1.2721262820904997 | V83: =1-(LN(1-V$1))/$A83 -> 1.2874662603915485 | W83: =1-(LN(1-W$1))/$A83 -> 1.303001657681097 | X83: =1-(LN(1-X$1))/$A83 -> 1.3187375172370823 | Y83: =1-(LN(1-Y$1))/$A83 -> 1.334679080124098 | Z83: =1-(LN(1-Z$1))/$A83 -> 1.3508317956729035 | AA83: =1-(LN(1-AA$1))/$A83 -> 1.3672013326633188 | AB83: =1-(LN(1-AB$1))/$A83 -> 1.3837935912679269 | AC83: =1-(LN(1-AC$1))/$A83 -> 1.4006147158195561 | AD83: =1-(LN(1-AD$1))/$A83 -> 1.4176711084716778 | AE83: =1-(LN(1-AE$1))/$A83 -> 1.4349694438277223 | AF83: =1-(LN(1-AF$1))/$A83 -> 1.4525166846229656 | AG83: =1-(LN(1-AG$1))/$A83 -> 1.4703200985512006 | AH83: =1-(LN(1-AH$1))/$A83 -> 1.4883872763379575 | AI83: =1-(LN(1-AI$1))/$A83 -> 1.5067261511727632 | AJ83: =1-(LN(1-AJ$1))/$A83 -> 1.5253450196249441 | AK83: =1-(LN(1-AK$1))/$A83 -> 1.5442525641809992 | AL83: =1-(LN(1-AL$1))/$A83 -> 1.5634578775567787 | AM83: =1-(LN(1-AM$1))/$A83 -> 1.5829704889548777 | AN83: =1-(LN(1-AN$1))/$A83 -> 1.6028003924570489 | AO83: =1-(LN(1-AO$1))/$A83 -> 1.6229580777634032 | AP83: =1-(LN(1-AP$1))/$A83 -> 1.6434545635150877 | AQ83: =1-(LN(1-AQ$1))/$A83 -> 1.6643014334654536 | AR83: =1-(LN(1-AR$1))/$A83 -> 1.6855108757970014 | AS83: =1-(LN(1-AS$1))/$A83 -> 1.7070957259182222 | AT83: =1-(LN(1-AT$1))/$A83 -> 1.7290695131166101 | AU83: =1-(LN(1-AU$1))/$A83 -> 1.7514465114924596 | AV83: =1-(LN(1-AV$1))/$A83 -> 1.7742417956536214 | AW83: =1-(LN(1-AW$1))/$A83 -> 1.797471301715444 | AX83: =1-(LN(1-AX$1))/$A83 -> 1.8211518942241043 | AY83: =1-(LN(1-AY$1))/$A83 -> 1.8453014397072502 | AZ83: =1-(LN(1-AZ$1))/$A83 -> 1.869938887655445 | BA83: =1-(LN(1-BA$1))/$A83 -> 1.8950843598539031 | BB83: =1-(LN(1-BB$1))/$A83 -> 1.9207592491195522 | BC83: =1-(LN(1-BC$1))/$A83 -> 1.9469863286573128 | BD83: =1-(LN(1-BD$1))/$A83 -> 1.9737898734363069 | BE83: =1-(LN(1-BE$1))/$A83 -> 2.00119579520711 | BF83: =1-(LN(1-BF$1))/$A83 -> 2.0292317930421087 | BG83: =1-(LN(1-BG$1))/$A83 -> 2.0579275215911261 | BH83: =1-(LN(1-BH$1))/$A83 -> 2.0873147796143705 | BI83: =1-(LN(1-BI$1))/$A83 -> 2.1174277217977506 | BJ83: =1-(LN(1-BJ$1))/$A83 -> 2.1483030973883475 | BK83: =1-(LN(1-BK$1))/$A83 -> 2.1799805198313487 | BL83: =1-(LN(1-BL$1))/$A83 -> 2.2125027723705699 | BM83: =1-(LN(1-BM$1))/$A83 -> 2.2459161555268068 | BN83: =1-(LN(1-BN$1))/$A83 -> 2.280270883534973 | BO83: =1-(LN(1-BO$1))/$A83 -> 2.3156215382584517 | BP83: =1-(LN(1-BP$1))/$A83 -> 2.3520275908800139 | BQ83: =1-(LN(1-BQ$1))/$A83 -> 2.3895540038882501 | BR83: =1-(LN(1-BR$1))/$A83 -> 2.428271928662129 | BS83: =1-(LN(1-BS$1))/$A83 -> 2.4682595174706545 | BT83: =1-(LN(1-BT$1))/$A83 -> 2.5096028731727049 | BU83: =1-(LN(1-BU$1))/$A83 -> 2.5523971656254734 | BV83: =1-(LN(1-BV$1))/$A83 -> 2.5967479511997107 | BW83: =1-(LN(1-BW$1))/$A83 -> 2.6427727414226956 | BX83: =1-(LN(1-BX$1))/$A83 -> 2.6906028794145018 | BY83: =1-(LN(1-BY$1))/$A83 -> 2.7403857995611545 | BZ83: =1-(LN(1-BZ$1))/$A83 -> 2.7922877683645644 | CA83: =1-(LN(1-CA$1))/$A83 -> 2.846497234914362 | CB83: =1-(LN(1-CB$1))/$A83 -> 2.9032289612983773 | CC83: =1-(LN(1-CC$1))/$A83 -> 2.9627291615050022 | CD83: =1-(LN(1-CD$1))/$A83 -> 3.0252819595386007 | CE83: =1-(LN(1-CE$1))/$A83 -> 3.0912175952340593 | CF83: =1-(LN(1-CF$1))/$A83 -> 3.1609229779657038 | CG83: =1-(LN(1-CG$1))/$A83 -> 3.2348554435955026 | CH83: =1-(LN(1-CH$1))/$A83 -> 3.313560957177907 | CI83: =1-(LN(1-CI$1))/$A83 -> 3.3976986053327263 | CJ83: =1-(LN(1-CJ$1))/$A83 -> 3.4880741811299485 | CK83: =1-(LN(1-CK$1))/$A83 -> 3.5856872392684078 | CL83: =1-(LN(1-CL$1))/$A83 -> 3.6917986746216154 | CM83: =1-(LN(1-CM$1))/$A83 -> 3.8080306012122564 | CN83: =1-(LN(1-CN$1))/$A83 -> 3.9365190349413135 | CO83: =1-(LN(1-CO$1))/$A83 -> 4.0801568833027577 | CP83: =1-(LN(1-CP$1))/$A83 -> 4.2430000450399818 | CQ83: =1-(LN(1-CQ$1))/$A83 -> 4.4309886789756643 | CR83: =1-(LN(1-CR$1))/$A83 -> 4.6533320409195138 | CS83: =1-(LN(1-CS$1))/$A83 -> 4.9254583230100177 | CT83: =1-(LN(1-CT$1))/$A83 -> 5.2762901186829279 | CU83: =1-(LN(1-CU$1))/$A83 -> 5.7707597627172875 | CV83: =1-(LN(1-CV$1))/$A83 -> 6.6160612024245786
A84: =A83+0.01 -> 0.83000000000000052 | B84: =1-(LN(1-B$1))/$A84 -> 1.0121088383777126 | C84: =1-(LN(1-C$1))/$A84 -> 1.024340611225927 | D84: =1-(LN(1-D$1))/$A84 -> 1.0366978403430223 | E84: =1-(LN(1-E$1))/$A84 -> 1.0491831259280182 | F84: =1-(LN(1-F$1))/$A84 -> 1.0617991498645187 | G84: =1-(LN(1-G$1))/$A84 -> 1.0745486791784187 | H84: =1-(LN(1-H$1))/$A84 -> 1.0874345696805245 | I84: =1-(LN(1-I$1))/$A84 -> 1.1004597698060854 | J84: =1-(LN(1-J$1))/$A84 -> 1.1136273246641462 | K84: =1-(LN(1-K$1))/$A84 -> 1.1269403803106339 | L84: =1-(LN(1-L$1))/$A84 -> 1.1404021882601825 | M84: =1-(LN(1-M$1))/$A84 -> 1.1540161102528732 | N84: =1-(LN(1-N$1))/$A84 -> 1.1677856232933825 | O84: =1-(LN(1-O$1))/$A84 -> 1.1817143249814259 | P84: =1-(LN(1-P$1))/$A84 -> 1.1958059391539455 | Q84: =1-(LN(1-Q$1))/$A84 -> 1.210064321861178 | R84: =1-(LN(1-R$1))/$A84 -> 1.2244934677005945 | S84: =1-(LN(1-S$1))/$A84 -> 1.2390975165347449 | T84: =1-(LN(1-T$1))/$A84 -> 1.2538807606212681 | U84: =1-(LN(1-U$1))/$A84 -> 1.2688476521857948 | V84: =1-(LN(1-V$1))/$A84 -> 1.2840028114711686 | W84: =1-(LN(1-W$1))/$A84 -> 1.2993510352993971 | X84: =1-(LN(1-X$1))/$A84 -> 1.3148973061860332 | Y84: =1-(LN(1-Y$1))/$A84 -> 1.3306468020503135 | Z84: =1-(LN(1-Z$1))/$A84 -> 1.3466049065684105 | AA84: =1-(LN(1-AA$1))/$A84 -> 1.362777220221592 | AB84: =1-(LN(1-AB$1))/$A84 -> 1.3791695720960242 | AC84: =1-(LN(1-AC$1))/$A84 -> 1.3957880324964287 | AD84: =1-(LN(1-AD$1))/$A84 -> 1.4126389264418986 | AE84: =1-(LN(1-AE$1))/$A84 -> 1.4297288481189545 | AF84: =1-(LN(1-AF$1))/$A84 -> 1.4470646763744961 | AG84: =1-(LN(1-AG$1))/$A84 -> 1.4646535913397405 | AH84: =1-(LN(1-AH$1))/$A84 -> 1.482503092285693 | AI84: =1-(LN(1-AI$1))/$A84 -> 1.5006210168212841 | AJ84: =1-(LN(1-AJ$1))/$A84 -> 1.5190155615571737 | AK84: =1-(LN(1-AK$1))/$A84 -> 1.5376953043715895 | AL84: =1-(LN(1-AL$1))/$A84 -> 1.5566692284295887 | AM84: =1-(LN(1-AM$1))/$A84 -> 1.5759467481240961 | AN84: =1-(LN(1-AN$1))/$A84 -> 1.5955377371262411 | AO84: =1-(LN(1-AO$1))/$A84 -> 1.6154525587542055 | AP84: =1-(LN(1-AP$1))/$A84 -> 1.635702098894424 | AQ84: =1-(LN(1-AQ$1))/$A84 -> 1.6562978017369541 | AR84: =1-(LN(1-AR$1))/$A84 -> 1.6772517086187242 | AS84: =1-(LN(1-AS$1))/$A84 -> 1.6985765003047497 | AT84: =1-(LN(1-AT$1))/$A84 -> 1.7202855430790607 | AU84: =1-(LN(1-AU$1))/$A84 -> 1.7423929390648396 | AV84: =1-(LN(1-AV$1))/$A84 -> 1.7649135812481562 | AW84: =1-(LN(1-AW$1))/$A84 -> 1.7878632137429686 | AX84: =1-(LN(1-AX$1))/$A84 -> 1.8112584979081512 | AY84: =1-(LN(1-AY$1))/$A84 -> 1.8351170850119822 | AZ84: =1-(LN(1-AZ$1))/$A84 -> 1.8594576962379095 | BA84: =1-(LN(1-BA$1))/$A84 -> 1.8843002109400007 | BB84: =1-(LN(1-BB$1))/$A84 -> 1.9096657641904009 | BC84: =1-(LN(1-BC$1))/$A84 -> 1.9355768548180681 | BD84: =1-(LN(1-BD$1))/$A84 -> 1.9620574653226166 | BE84: =1-(LN(1-BE$1))/$A84 -> 1.9891331952648557 | BF84: =1-(LN(1-BF$1))/$A84 -> 2.0168314099934088 | BG84: =1-(LN(1-BG$1))/$A84 -> 2.0451814068731604 | BH84: =1-(LN(1-BH$1))/$A84 -> 2.0742146015467275 | BI84: =1-(LN(1-BI$1))/$A84 -> 2.1039647371977774 | BJ84: =1-(LN(1-BJ$1))/$A84 -> 2.1344681203113796 | BK84: =1-(LN(1-BK$1))/$A84 -> 2.1657638870622962 | BL84: =1-(LN(1-BL$1))/$A84 -> 2.1978943052335751 | BM84: =1-(LN(1-BM$1))/$A84 -> 2.2309051175084118 | BN84: =1-(LN(1-BN$1))/$A84 -> 2.2648459331309372 | BO84: =1-(LN(1-BO$1))/$A84 -> 2.2997706763517236 | BP84: =1-(LN(1-BP$1))/$A84 -> 2.3357381018332672 | BQ84: =1-(LN(1-BQ$1))/$A84 -> 2.3728123893835726 | BR84: =1-(LN(1-BR$1))/$A84 -> 2.4110638331360792 | BS84: =1-(LN(1-BS$1))/$A84 -> 2.4505696437661886 | BT84: =1-(LN(1-BT$1))/$A84 -> 2.4914148867489372 | BU84: =1-(LN(1-BU$1))/$A84 -> 2.5336935853167324 | BV84: =1-(LN(1-BV$1))/$A84 -> 2.5775100240768229 | BW84: =1-(LN(1-BW$1))/$A84 -> 2.622980298754952 | BX84: =1-(LN(1-BX$1))/$A84 -> 2.6702341700239653 | BY84: =1-(LN(1-BY$1))/$A84 -> 2.7194172959519838 | BZ84: =1-(LN(1-BZ$1))/$A84 -> 2.7706939398300516 | CA84: =1-(LN(1-CA$1))/$A84 -> 2.8242502802768392 | CB84: =1-(LN(1-CB$1))/$A84 -> 2.880298491885144 | CC84: =1-(LN(1-CC$1))/$A84 -> 2.9390818222097614 | CD84: =1-(LN(1-CD$1))/$A84 -> 3.0008809720742802 | CE84: =1-(LN(1-CE$1))/$A84 -> 3.0660222025203958 | CF84: =1-(LN(1-CF$1))/$A84 -> 3.1348877613637076 | CG84: =1-(LN(1-CG$1))/$A84 -> 3.2079294743955566 | CH84: =1-(LN(1-CH$1))/$A84 -> 3.285686728778173 | CI84: =1-(LN(1-CI$1))/$A84 -> 3.3688106703287173 | CJ84: =1-(LN(1-CJ$1))/$A84 -> 3.4580973837669373 | CK84: =1-(LN(1-CK$1))/$A84 -> 3.5545343809639696 | CL84: =1-(LN(1-CL$1))/$A84 -> 3.659367365288825 | CM84: =1-(LN(1-CM$1))/$A84 -> 3.7741989072217472 | CN84: =1-(LN(1-CN$1))/$A84 -> 3.901139287532382 | CO84: =1-(LN(1-CO$1))/$A84 -> 4.0430465594075438 | CP84: =1-(LN(1-CP$1))/$A84 -> 4.2039277553407048 | CQ84: =1-(LN(1-CQ$1))/$A84 -> 4.3896514659759571 | CR84: =1-(LN(1-CR$1))/$A84 -> 4.6093159922337366 | CS84: =1-(LN(1-CS$1))/$A84 -> 4.8781636444195353 | CT84: =1-(LN(1-CT$1))/$A84 -> 5.2247685509879531 | CU84: =1-(LN(1-CU$1))/$A84 -> 5.7132807294315375 | CV84: =1-(LN(1-CV$1))/$A84 -> 6.5483978144435602
A85: =A84+0.01 -> 0.84000000000000052 | B85: =1-(LN(1-B$1))/$A85 -> 1.0119646855398827 | C85: =1-(LN(1-C$1))/$A85 -> 1.0240508420446661 | D85: =1-(LN(1-D$1))/$A85 -> 1.0362609612913196 | E85: =1-(LN(1-E$1))/$A85 -> 1.0485976125241132 | F85: =1-(LN(1-F$1))/$A85 -> 1.061063445699465 | G85: =1-(LN(1-G$1))/$A85 -> 1.073661194902485 | H85: =1-(LN(1-H$1))/$A85 -> 1.0863936819462328 | I85: =1-(LN(1-I$1))/$A85 -> 1.0992638201655369 | J85: =1-(LN(1-J$1))/$A85 -> 1.1122746184181442 | K85: =1-(LN(1-K$1))/$A85 -> 1.125429185306936 | L85: =1-(LN(1-L$1))/$A85 -> 1.1387307336380375 | M85: =1-(LN(1-M$1))/$A85 -> 1.1521825851308152 | N85: =1-(LN(1-N$1))/$A85 -> 1.1657881753970329 | O85: =1-(LN(1-O$1))/$A85 -> 1.1795510592078375 | P85: =1-(LN(1-P$1))/$A85 -> 1.1934749160687796 | Q85: =1-(LN(1-Q$1))/$A85 -> 1.2075635561247353 | R85: =1-(LN(1-R$1))/$A85 -> 1.2218209264184445 | S85: =1-(LN(1-S$1))/$A85 -> 1.2362511175283788 | T85: =1-(LN(1-T$1))/$A85 -> 1.2508583706138721 | U85: =1-(LN(1-U$1))/$A85 -> 1.2656470848978687 | V85: =1-(LN(1-V$1))/$A85 -> 1.2806218256203212 | W85: =1-(LN(1-W$1))/$A85 -> 1.2957873324982139 | X85: =1-(LN(1-X$1))/$A85 -> 1.3111485287314375 | Y85: =1-(LN(1-Y$1))/$A85 -> 1.3267105305973337 | Z85: =1-(LN(1-Z$1))/$A85 -> 1.3424786576806913 | AA85: =1-(LN(1-AA$1))/$A85 -> 1.3584584437903826 | AB85: =1-(LN(1-AB$1))/$A85 -> 1.3746556486186905 | AC85: =1-(LN(1-AC$1))/$A85 -> 1.3910762702048047 | AD85: =1-(LN(1-AD$1))/$A85 -> 1.4077265582699712 | AE85: =1-(LN(1-AE$1))/$A85 -> 1.4246130284984908 | AF85: =1-(LN(1-AF$1))/$A85 -> 1.4417424778462284 | AG85: =1-(LN(1-AG$1))/$A85 -> 1.4591220009666483 | AH85: =1-(LN(1-AH$1))/$A85 -> 1.4767590078537205 | AI85: =1-(LN(1-AI$1))/$A85 -> 1.4946612428115067 | AJ85: =1-(LN(1-AJ$1))/$A85 -> 1.5128368048719691 | AK85: =1-(LN(1-AK$1))/$A85 -> 1.5312941697957374 | AL85: =1-(LN(1-AL$1))/$A85 -> 1.5500422138054268 | AM85: =1-(LN(1-AM$1))/$A85 -> 1.5690902392178567 | AN85: =1-(LN(1-AN$1))/$A85 -> 1.5884480021604523 | AO85: =1-(LN(1-AO$1))/$A85 -> 1.6081257425785602 | AP85: =1-(LN(1-AP$1))/$A85 -> 1.6281342167647286 | AQ85: =1-(LN(1-AQ$1))/$A85 -> 1.6484847326686571 | AR85: =1-(LN(1-AR$1))/$A85 -> 1.6691891882780252 | AS85: =1-(LN(1-AS$1))/$A85 -> 1.6902601133963597 | AT85: =1-(LN(1-AT$1))/$A85 -> 1.7117107151852622 | AU85: =1-(LN(1-AU$1))/$A85 -> 1.7335549278854963 | AV85: =1-(LN(1-AV$1))/$A85 -> 1.755807467185678 | AW85: =1-(LN(1-AW$1))/$A85 -> 1.7784838897698381 | AX85: =1-(LN(1-AX$1))/$A85 -> 1.8016006586473399 | AY85: =1-(LN(1-AY$1))/$A85 -> 1.8251752149523157 | AZ85: =1-(LN(1-AZ$1))/$A85 -> 1.8492260569969818 | BA85: =1-(LN(1-BA$1))/$A85 -> 1.8737728274764291 | BB85: =1-(LN(1-BB$1))/$A85 -> 1.898836409854801 | BC85: =1-(LN(1-BC$1))/$A85 -> 1.9244390351178531 | BD85: =1-(LN(1-BD$1))/$A85 -> 1.950604400259252 | BE85: =1-(LN(1-BE$1))/$A85 -> 1.9773578000831313 | BF85: =1-(LN(1-BF$1))/$A85 -> 2.0047262741601539 | BG85: =1-(LN(1-BG$1))/$A85 -> 2.0327387710770513 | BH85: =1-(LN(1-BH$1))/$A85 -> 2.061426332480695 | BI85: =1-(LN(1-BI$1))/$A85 -> 2.0908222998501849 | BJ85: =1-(LN(1-BJ$1))/$A85 -> 2.1209625474505298 | BK85: =1-(LN(1-BK$1))/$A85 -> 2.1518857455496496 | BL85: =1-(LN(1-BL$1))/$A85 -> 2.183633658742699 | BM85: =1-(LN(1-BM$1))/$A85 -> 2.2162514851571213 | BN85: =1-(LN(1-BN$1))/$A85 -> 2.2497882434508072 | BO85: =1-(LN(1-BO$1))/$A85 -> 2.284297215918965 | BP85: =1-(LN(1-BP$1))/$A85 -> 2.3198364577638233 | BQ85: =1-(LN(1-BQ$1))/$A85 -> 2.3564693847480536 | BR85: =1-(LN(1-BR$1))/$A85 -> 2.3942654541701733 | BS85: =1-(LN(1-BS$1))/$A85 -> 2.4333009575308768 | BT85: =1-(LN(1-BT$1))/$A85 -> 2.4736599476209737 | BU85: =1-(LN(1-BU$1))/$A85 -> 2.5154353283486763 | BV85: =1-(LN(1-BV$1))/$A85 -> 2.5587301428378133 | BW85: =1-(LN(1-BW$1))/$A85 -> 2.6036591047221549 | BX85: =1-(LN(1-BX$1))/$A85 -> 2.6503504299046328 | BY85: =1-(LN(1-BY$1))/$A85 -> 2.6989480424287464 | BZ85: =1-(LN(1-BZ$1))/$A85 -> 2.7496142500701701 | CA85: =1-(LN(1-CA$1))/$A85 -> 2.8025330150354488 | CB85: =1-(LN(1-CB$1))/$A85 -> 2.8579139860293683 | CC85: =1-(LN(1-CC$1))/$A85 -> 2.9159975148025019 | CD85: =1-(LN(1-CD$1))/$A85 -> 2.9770609605019676 | CE85: =1-(LN(1-CE$1))/$A85 -> 3.0414267001094388 | CF85: =1-(LN(1-CF$1))/$A85 -> 3.1094724308712824 | CG85: =1-(LN(1-CG$1))/$A85 -> 3.1816445997003715 | CH85: =1-(LN(1-CH$1))/$A85 -> 3.2584761724831948 | CI85: =1-(LN(1-CI$1))/$A85 -> 3.3406105433009947 | CJ85: =1-(LN(1-CJ$1))/$A85 -> 3.4288343196744737 | CK85: =1-(LN(1-CK$1))/$A85 -> 3.5241232573810648 | CL85: =1-(LN(1-CL$1))/$A85 -> 3.6277082299877672 | CM85: =1-(LN(1-CM$1))/$A85 -> 3.7411727297548216 | CN85: =1-(LN(1-CN$1))/$A85 -> 3.8666019150617581 | CO85: =1-(LN(1-CO$1))/$A85 -> 4.0068198146526921 | CP85: =1-(LN(1-CP$1))/$A85 -> 4.1657857582533158 | CQ85: =1-(LN(1-CQ$1))/$A85 -> 4.3492984723333867 | CR85: =1-(LN(1-CR$1))/$A85 -> 4.5663479447071449 | CS85: =1-(LN(1-CS$1))/$A85 -> 4.8319950296050171 | CT85: =1-(LN(1-CT$1))/$A85 -> 5.1744736872857153 | CU85: =1-(LN(1-CU$1))/$A85 -> 5.657170244557352 | CV85: =1-(LN(1-CV$1))/$A85 -> 6.4823454595097081
A86: =A85+0.01 -> 0.85000000000000053 | B86: =1-(LN(1-B$1))/$A86 -> 1.0118239245335312 | C86: =1-(LN(1-C$1))/$A86 -> 1.0237678909617876 | D86: =1-(LN(1-D$1))/$A86 -> 1.0358343617467161 | E86: =1-(LN(1-E$1))/$A86 -> 1.0480258759061825 | F86: =1-(LN(1-F$1))/$A86 -> 1.0603450522206477 | G86: =1-(LN(1-G$1))/$A86 -> 1.0727945926095146 | H86: =1-(LN(1-H$1))/$A86 -> 1.0853772856880417 | I86: =1-(LN(1-I$1))/$A86 -> 1.0980960105165305 | J86: =1-(LN(1-J$1))/$A86 -> 1.1109537405544014 | K86: =1-(LN(1-K$1))/$A86 -> 1.1239535478327367 | L86: =1-(LN(1-L$1))/$A86 -> 1.1370986073599429 | M86: =1-(LN(1-M$1))/$A86 -> 1.1503922017763351 | N86: =1-(LN(1-N$1))/$A86 -> 1.1638377262747148 | O86: =1-(LN(1-O$1))/$A86 -> 1.1774386938053925 | P86: =1-(LN(1-P$1))/$A86 -> 1.1911987405856175 | Q86: =1-(LN(1-Q$1))/$A86 -> 1.2051216319350326 | R86: =1-(LN(1-R$1))/$A86 -> 1.2192112684605805 | S86: =1-(LN(1-S$1))/$A86 -> 1.2334716926162803 | T86: =1-(LN(1-T$1))/$A86 -> 1.2479070956654736 | U86: =1-(LN(1-U$1))/$A86 -> 1.2625218250755408 | V86: =1-(LN(1-V$1))/$A86 -> 1.2773203923777292 | W86: =1-(LN(1-W$1))/$A86 -> 1.2923074815276465 | X86: =1-(LN(1-X$1))/$A86 -> 1.3074879578051852 | Y86: =1-(LN(1-Y$1))/$A86 -> 1.3228668772961885 | Z86: =1-(LN(1-Z$1))/$A86 -> 1.338449497002095 | AA86: =1-(LN(1-AA$1))/$A86 -> 1.3542412856281429 | AB86: =1-(LN(1-AB$1))/$A86 -> 1.3702479351055294 | AC86: =1-(LN(1-AC$1))/$A86 -> 1.3864753729082775 | AD86: =1-(LN(1-AD$1))/$A86 -> 1.4029297752315009 | AE86: =1-(LN(1-AE$1))/$A86 -> 1.419617581104391 | AF86: =1-(LN(1-AF$1))/$A86 -> 1.4365455075186258 | AG86: =1-(LN(1-AG$1))/$A86 -> 1.4537205656611583 | AH86: =1-(LN(1-AH$1))/$A86 -> 1.471150078349559 | AI86: =1-(LN(1-AI$1))/$A86 -> 1.4888416987784301 | AJ86: =1-(LN(1-AJ$1))/$A86 -> 1.5068034306970048 | AK86: =1-(LN(1-AK$1))/$A86 -> 1.5250436501510816 | AL86: =1-(LN(1-AL$1))/$A86 -> 1.5435711289371277 | AM86: =1-(LN(1-AM$1))/$A86 -> 1.5623950599329408 | AN86: =1-(LN(1-AN$1))/$A86 -> 1.5815250844879765 | AO86: =1-(LN(1-AO$1))/$A86 -> 1.600971322077636 | AP86: =1-(LN(1-AP$1))/$A86 -> 1.6207444024498492 | AQ86: =1-(LN(1-AQ$1))/$A86 -> 1.6408555005196139 | AR86: =1-(LN(1-AR$1))/$A86 -> 1.6613163742982837 | AS86: =1-(LN(1-AS$1))/$A86 -> 1.682139406179932 | AT86: =1-(LN(1-AT$1))/$A86 -> 1.7033376479477886 | AU86: =1-(LN(1-AU$1))/$A86 -> 1.7249248699103727 | AV86: =1-(LN(1-AV$1))/$A86 -> 1.7469156146305524 | AW86: =1-(LN(1-AW$1))/$A86 -> 1.7693252557725458 | AX86: =1-(LN(1-AX$1))/$A86 -> 1.7921700626632537 | AY86: =1-(LN(1-AY$1))/$A86 -> 1.8154672712469946 | AZ86: =1-(LN(1-AZ$1))/$A86 -> 1.8392351622087821 | BA86: =1-(LN(1-BA$1))/$A86 -> 1.863493147153177 | BB86: =1-(LN(1-BB$1))/$A86 -> 1.8882618638565092 | BC86: =1-(LN(1-BC$1))/$A86 -> 1.9135632817635253 | BD86: =1-(LN(1-BD$1))/$A86 -> 1.9394208190797313 | BE86: =1-(LN(1-BE$1))/$A86 -> 1.9658594730233299 | BF86: =1-(LN(1-BF$1))/$A86 -> 1.9929059650523873 | BG86: =1-(LN(1-BG$1))/$A86 -> 2.020588903182027 | BH86: =1-(LN(1-BH$1))/$A86 -> 2.0489389638632751 | BI86: =1-(LN(1-BI$1))/$A86 -> 2.0779890963225354 | BJ86: =1-(LN(1-BJ$1))/$A86 -> 2.1077747527746413 | BK86: =1-(LN(1-BK$1))/$A86 -> 2.1383341485431835 | BL86: =1-(LN(1-BL$1))/$A86 -> 2.169708556875138 | BM86: =1-(LN(1-BM$1))/$A86 -> 2.2019426441552725 | BN86: =1-(LN(1-BN$1))/$A86 -> 2.235084852351386 | BO86: =1-(LN(1-BO$1))/$A86 -> 2.2691878369081535 | BP86: =1-(LN(1-BP$1))/$A86 -> 2.3043089700254251 | BQ86: =1-(LN(1-BQ$1))/$A86 -> 2.340510921398077 | BR86: =1-(LN(1-BR$1))/$A86 -> 2.3778623311799363 | BS86: =1-(LN(1-BS$1))/$A86 -> 2.4164385933246311 | BT86: =1-(LN(1-BT$1))/$A86 -> 2.4563227717666094 | BU86: =1-(LN(1-BU$1))/$A86 -> 2.4976066774269272 | BV86: =1-(LN(1-BV$1))/$A86 -> 2.5403921411573682 | BW86: =1-(LN(1-BW$1))/$A86 -> 2.5847925270195411 | BX86: =1-(LN(1-BX$1))/$A86 -> 2.6309345424939901 | BY86: =1-(LN(1-BY$1))/$A86 -> 2.6789604184001723 | BZ86: =1-(LN(1-BZ$1))/$A86 -> 2.7290305530105208 | CA86: =1-(LN(1-CA$1))/$A86 -> 2.7813267442703253 | CB86: =1-(LN(1-CB$1))/$A86 -> 2.8360561744290234 | CC86: =1-(LN(1-CC$1))/$A86 -> 2.8934563675695317 | CD86: =1-(LN(1-CD$1))/$A86 -> 2.9538014197901794 | CE86: =1-(LN(1-CE$1))/$A86 -> 3.0174099154022689 | CF86: =1-(LN(1-CF$1))/$A86 -> 3.0846551081551494 | CG86: =1-(LN(1-CG$1))/$A86 -> 3.155978192645073 | CH86: =1-(LN(1-CH$1))/$A86 -> 3.2319058645716279 | CI86: =1-(LN(1-CI$1))/$A86 -> 3.313073948673924 | CJ86: =1-(LN(1-CJ$1))/$A86 -> 3.4002597982665383 | CK86: =1-(LN(1-CK$1))/$A86 -> 3.49442768964717 | CL86: =1-(LN(1-CL$1))/$A86 -> 3.596794015517323 | CM86: =1-(LN(1-CM$1))/$A86 -> 3.7089236388165299 | CN86: =1-(LN(1-CN$1))/$A86 -> 3.832877186649267 | CO86: =1-(LN(1-CO$1))/$A86 -> 3.971445463892072 | CP86: =1-(LN(1-CP$1))/$A86 -> 4.1285412199209235 | CQ86: =1-(LN(1-CQ$1))/$A86 -> 4.3098949608941703 | CR86: =1-(LN(1-CR$1))/$A86 -> 4.5243909100635307 | CS86: =1-(LN(1-CS$1))/$A86 -> 4.7869127351390759 | CT86: =1-(LN(1-CT$1))/$A86 -> 5.1253622321411774 | CU86: =1-(LN(1-CU$1))/$A86 -> 5.6023800063860891 | CV86: =1-(LN(1-CV$1))/$A86 -> 6.4178472776331228
A87: =A86+0.01 -> 0.86000000000000054 | B87: =1-(LN(1-B$1))/$A87 -> 1.0116864370389551 | C87: =1-(LN(1-C$1))/$A87 -> 1.0234915201366506 | D87: =1-(LN(1-D$1))/$A87 -> 1.0354176831217541 | E87: =1-(LN(1-E$1))/$A87 -> 1.0474674354886688 | F87: =1-(LN(1-F$1))/$A87 -> 1.0596433655669193 | G87: =1-(LN(1-G$1))/$A87 -> 1.0719481438582412 | H87: =1-(LN(1-H$1))/$A87 -> 1.0843845265521344 | I87: =1-(LN(1-I$1))/$A87 -> 1.0969553592314547 | J87: =1-(LN(1-J$1))/$A87 -> 1.1096635807805131 | K87: =1-(LN(1-K$1))/$A87 -> 1.1225122275091002 | L87: =1-(LN(1-L$1))/$A87 -> 1.1355044375069203 | M87: =1-(LN(1-M$1))/$A87 -> 1.1486434552440521 | N87: =1-(LN(1-N$1))/$A87 -> 1.1619326364343112 | O87: =1-(LN(1-O$1))/$A87 -> 1.1753754531797482 | P87: =1-(LN(1-P$1))/$A87 -> 1.1889754994160173 | Q87: =1-(LN(1-Q$1))/$A87 -> 1.2027364966799741 | R87: =1-(LN(1-R$1))/$A87 -> 1.2166623002226666 | S87: =1-(LN(1-S$1))/$A87 -> 1.2307569054928351 | T87: =1-(LN(1-T$1))/$A87 -> 1.2450244550182006 | U87: =1-(LN(1-U$1))/$A87 -> 1.2594692457141974 | V87: =1-(LN(1-V$1))/$A87 -> 1.2740957366524068 | W87: =1-(LN(1-W$1))/$A87 -> 1.2889085573238368 | X87: =1-(LN(1-X$1))/$A87 -> 1.3039125164353575 | Y87: =1-(LN(1-Y$1))/$A87 -> 1.3191126112811165 | Z87: =1-(LN(1-Z$1))/$A87 -> 1.3345140377346287 | AA87: =1-(LN(1-AA$1))/$A87 -> 1.3501222009115366 | AB87: =1-(LN(1-AB$1))/$A87 -> 1.3659427265577908 | AC87: =1-(LN(1-AC$1))/$A87 -> 1.3819814732232976 | AD87: =1-(LN(1-AD$1))/$A87 -> 1.3982445452869485 | AE87: =1-(LN(1-AE$1))/$A87 -> 1.4147383069055026 | AF87: =1-(LN(1-AF$1))/$A87 -> 1.4314693969660834 | AG87: =1-(LN(1-AG$1))/$A87 -> 1.4484447451302147 | AH87: =1-(LN(1-AH$1))/$A87 -> 1.4656715890664245 | AI87: =1-(LN(1-AI$1))/$A87 -> 1.483157492978681 | AJ87: =1-(LN(1-AJ$1))/$A87 -> 1.5009103675493654 | AK87: =1-(LN(1-AK$1))/$A87 -> 1.5189384914283948 | AL87: =1-(LN(1-AL$1))/$A87 -> 1.537250534414603 | AM87: =1-(LN(1-AM$1))/$A87 -> 1.5558555824918603 | AN87: =1-(LN(1-AN$1))/$A87 -> 1.5747631649009071 | AO87: =1-(LN(1-AO$1))/$A87 -> 1.5939832834488263 | AP87: =1-(LN(1-AP$1))/$A87 -> 1.6135264442818278 | AQ87: =1-(LN(1-AQ$1))/$A87 -> 1.6334036923740372 | AR87: =1-(LN(1-AR$1))/$A87 -> 1.6536266490157456 | AS87: =1-(LN(1-AS$1))/$A87 -> 1.6742075526197002 | AT87: =1-(LN(1-AT$1))/$A87 -> 1.6951593032042096 | AU87: =1-(LN(1-AU$1))/$A87 -> 1.7164955109579267 | AV87: =1-(LN(1-AV$1))/$A87 -> 1.7382305493441508 | AW87: =1-(LN(1-AW$1))/$A87 -> 1.7603796132635627 | AX87: =1-(LN(1-AX$1))/$A87 -> 1.7829587828648437 | AY87: =1-(LN(1-AY$1))/$A87 -> 1.8059850936743551 | AZ87: =1-(LN(1-AZ$1))/$A87 -> 1.8294766138110057 | BA87: =1-(LN(1-BA$1))/$A87 -> 1.8534525291630239 | BB87: =1-(LN(1-BB$1))/$A87 -> 1.8779332375325963 | BC87: =1-(LN(1-BC$1))/$A87 -> 1.9029404529058098 | BD87: =1-(LN(1-BD$1))/$A87 -> 1.9284973211834555 | BE87: =1-(LN(1-BE$1))/$A87 -> 1.9546285489184072 | BF87: =1-(LN(1-BF$1))/$A87 -> 1.9813605468541036 | BG87: =1-(LN(1-BG$1))/$A87 -> 2.0087215903543294 | BH87: =1-(LN(1-BH$1))/$A87 -> 2.0367419991671905 | BI87: =1-(LN(1-BI$1))/$A87 -> 2.0654543393885527 | BJ87: =1-(LN(1-BJ$1))/$A87 -> 2.0948936509981921 | BK87: =1-(LN(1-BK$1))/$A87 -> 2.125097704955472 | BL87: =1-(LN(1-BL$1))/$A87 -> 2.1561072945858921 | BM87: =1-(LN(1-BM$1))/$A87 -> 2.1879665668976531 | BN87: =1-(LN(1-BN$1))/$A87 -> 2.2207234005798582 | BO87: =1-(LN(1-BO$1))/$A87 -> 2.2544298388045703 | BP87: =1-(LN(1-BP$1))/$A87 -> 2.2891425866530364 | BQ87: =1-(LN(1-BQ$1))/$A87 -> 2.3249235851027503 | BR87: =1-(LN(1-BR$1))/$A87 -> 2.3618406761662158 | BS87: =1-(LN(1-BS$1))/$A87 -> 2.3999683771231819 | BT87: =1-(LN(1-BT$1))/$A87 -> 2.4393887860483927 | BU87: =1-(LN(1-BU$1))/$A87 -> 2.4801926462940562 | BV87: =1-(LN(1-BV$1))/$A87 -> 2.5224806046322827 | BW87: =1-(LN(1-BW$1))/$A87 -> 2.566364706937919 | BX87: =1-(LN(1-BX$1))/$A87 -> 2.6119701873487111 | BY87: =1-(LN(1-BY$1))/$A87 -> 2.6594376228373799 | BZ87: =1-(LN(1-BZ$1))/$A87 -> 2.7089255465801658 | CA87: =1-(LN(1-CA$1))/$A87 -> 2.7606136425927637 | CB87: =1-(LN(1-CB$1))/$A87 -> 2.8147066840286854 | CC87: =1-(LN(1-CC$1))/$A87 -> 2.8714394330629087 | CD87: =1-(LN(1-CD$1))/$A87 -> 2.9310827986298285 | CE87: =1-(LN(1-CE$1))/$A87 -> 2.9939516605720096 | CF87: =1-(LN(1-CF$1))/$A87 -> 3.0604149324789272 | CG87: =1-(LN(1-CG$1))/$A87 -> 3.1309086787771072 | CH87: =1-(LN(1-CH$1))/$A87 -> 3.2059534707975392 | CI87: =1-(LN(1-CI$1))/$A87 -> 3.2861777399684136 | CJ87: =1-(LN(1-CJ$1))/$A87 -> 3.3723498006122763 | CK87: =1-(LN(1-CK$1))/$A87 -> 3.4654227165117377 | CL87: =1-(LN(1-CL$1))/$A87 -> 3.5665987362671219 | CM87: =1-(LN(1-CM$1))/$A87 -> 3.6774245267372678 | CN87: =1-(LN(1-CN$1))/$A87 -> 3.7999367542463687 | CO87: =1-(LN(1-CO$1))/$A87 -> 3.9368937724514663 | CP87: =1-(LN(1-CP$1))/$A87 -> 4.0921628336427736 | CQ87: =1-(LN(1-CQ$1))/$A87 -> 4.2714078101860986 | CR87: =1-(LN(1-CR$1))/$A87 -> 4.4834096204116296 | CS87: =1-(LN(1-CS$1))/$A87 -> 4.7428788661258308 | CT87: =1-(LN(1-CT$1))/$A87 -> 5.0773929038604662 | CU87: =1-(LN(1-CU$1))/$A87 -> 5.5488639598002045 | CV87: =1-(LN(1-CV$1))/$A87 -> 6.3548490534745987
A88: =A87+0.01 -> 0.87000000000000055 | B88: =1-(LN(1-B$1))/$A88 -> 1.0115521101764384 | C88: =1-(LN(1-C$1))/$A88 -> 1.0232215026638154 | D88: =1-(LN(1-D$1))/$A88 -> 1.035010583315757 | E88: =1-(LN(1-E$1))/$A88 -> 1.0469218327819025 | F88: =1-(LN(1-F$1))/$A88 -> 1.0589578096408627 | G88: =1-(LN(1-G$1))/$A88 -> 1.0711211536989511 | H88: =1-(LN(1-H$1))/$A88 -> 1.0834145894653282 | I88: =1-(LN(1-I$1))/$A88 -> 1.0958409298150011 | J88: =1-(LN(1-J$1))/$A88 -> 1.1084030798520015 | K88: =1-(LN(1-K$1))/$A88 -> 1.1211040409860071 | L88: =1-(LN(1-L$1))/$A88 -> 1.1339469152367259 | M88: =1-(LN(1-M$1))/$A88 -> 1.1469349097814767 | N88: =1-(LN(1-N$1))/$A88 -> 1.1600713417626523 | O88: =1-(LN(1-O$1))/$A88 -> 1.1733596433730846 | P88: =1-(LN(1-P$1))/$A88 -> 1.1868033672388216 | Q88: =1-(LN(1-Q$1))/$A88 -> 1.2004061921204341 | R88: =1-(LN(1-R$1))/$A88 -> 1.2141719289557396 | S88: =1-(LN(1-S$1))/$A88 -> 1.2281045272687796 | T88: =1-(LN(1-T$1))/$A88 -> 1.2422080819720145 | U88: =1-(LN(1-U$1))/$A88 -> 1.2564868405910457 | V88: =1-(LN(1-V$1))/$A88 -> 1.2709452109437585 | W88: =1-(LN(1-W$1))/$A88 -> 1.2855877693086202 | X88: =1-(LN(1-X$1))/$A88 -> 1.3004192691200085 | Y88: =1-(LN(1-Y$1))/$A88 -> 1.3154446502319084 | Z88: =1-(LN(1-Z$1))/$A88 -> 1.3306690487951502 | AA88: =1-(LN(1-AA$1))/$A88 -> 1.3460978077976109 | AB88: =1-(LN(1-AB$1))/$A88 -> 1.3617364883214944 | AC88: =1-(LN(1-AC$1))/$A88 -> 1.3775908815770528 | AD88: =1-(LN(1-AD$1))/$A88 -> 1.3936670217779032 | AE88: =1-(LN(1-AE$1))/$A88 -> 1.4099711999295772 | AF88: =1-(LN(1-AF$1))/$A88 -> 1.4265099786101516 | AG88: =1-(LN(1-AG$1))/$A88 -> 1.4432902078298673 | AH88: =1-(LN(1-AH$1))/$A88 -> 1.4603190420656611 | AI88: =1-(LN(1-AI$1))/$A88 -> 1.4776039585766272 | AJ88: =1-(LN(1-AJ$1))/$A88 -> 1.4951527771177633 | AK88: =1-(LN(1-AK$1))/$A88 -> 1.5129736811820913 | AL88: =1-(LN(1-AL$1))/$A88 -> 1.5310752409155846 | AM88: =1-(LN(1-AM$1))/$A88 -> 1.549466437865517 | AN88: =1-(LN(1-AN$1))/$A88 -> 1.5681566917411265 | AO88: =1-(LN(1-AO$1))/$A88 -> 1.5871558893861961 | AP88: =1-(LN(1-AP$1))/$A88 -> 1.6064744161866344 | AQ88: =1-(LN(1-AQ$1))/$A88 -> 1.6261231901628412 | AR88: =1-(LN(1-AR$1))/$A88 -> 1.6461136990270588 | AS88: =1-(LN(1-AS$1))/$A88 -> 1.6664580405206231 | AT88: =1-(LN(1-AT$1))/$A88 -> 1.6871689663857705 | AU88: =1-(LN(1-AU$1))/$A88 -> 1.7082599303722033 | AV88: =1-(LN(1-AV$1))/$A88 -> 1.7297451407309996 | AW88: =1-(LN(1-AW$1))/$A88 -> 1.7516396177088092 | AX88: =1-(LN(1-AX$1))/$A88 -> 1.7739592566250177 | AY88: =1-(LN(1-AY$1))/$A88 -> 1.7967208971953395 | AZ88: =1-(LN(1-AZ$1))/$A88 -> 1.8199423998591548 | BA88: =1-(LN(1-BA$1))/$A88 -> 1.843642729977242 | BB88: =1-(LN(1-BB$1))/$A88 -> 1.8678420508942906 | BC88: =1-(LN(1-BC$1))/$A88 -> 1.8925618270103408 | BD88: =1-(LN(1-BD$1))/$A88 -> 1.9178249381813468 | BE88: =1-(LN(1-BE$1))/$A88 -> 1.9436558069768164 | BF88: =1-(LN(1-BF$1))/$A88 -> 1.9700805405684243 | BG88: =1-(LN(1-BG$1))/$A88 -> 1.9971270893157738 | BH88: =1-(LN(1-BH$1))/$A88 -> 2.0248254244641193 | BI88: =1-(LN(1-BI$1))/$A88 -> 2.0532077377863853 | BJ88: =1-(LN(1-BJ$1))/$A88 -> 2.0823086665039598 | BK88: =1-(LN(1-BK$1))/$A88 -> 2.112165547427248 | BL88: =1-(LN(1-BL$1))/$A88 -> 2.1428187049929508 | BM88: =1-(LN(1-BM$1))/$A88 -> 2.1743117787723927 | BN88: =1-(LN(1-BN$1))/$A88 -> 2.2066920971249173 | BO88: =1-(LN(1-BO$1))/$A88 -> 2.2400111050252072 | BP88: =1-(LN(1-BP$1))/$A88 -> 2.2743248557719671 | BQ88: =1-(LN(1-BQ$1))/$A88 -> 2.3096945783774312 | BR88: =1-(LN(1-BR$1))/$A88 -> 2.3461873350608569 | BS88: =1-(LN(1-BS$1))/$A88 -> 2.3838767865815362 | BT88: =1-(LN(1-BT$1))/$A88 -> 2.4228440873581816 | BU88: =1-(LN(1-BU$1))/$A88 -> 2.4631789377159636 | BV88: =1-(LN(1-BV$1))/$A88 -> 2.5049808275675436 | BW88: =1-(LN(1-BW$1))/$A88 -> 2.5483605149041493 | BX88: =1-(LN(1-BX$1))/$A88 -> 2.5934417943906798 | BY88: =1-(LN(1-BY$1))/$A88 -> 2.6403636271725821 | BZ88: =1-(LN(1-BZ$1))/$A88 -> 2.6892827242056816 | CA88: =1-(LN(1-CA$1))/$A88 -> 2.7403767041721574 | CB88: =1-(LN(1-CB$1))/$A88 -> 2.7938479865111145 | CC88: =1-(LN(1-CC$1))/$A88 -> 2.8499286349817261 | CD88: =1-(LN(1-CD$1))/$A88 -> 2.9088864446225893 | CE88: =1-(LN(1-CE$1))/$A88 -> 2.9710326759677339 | CF88: =1-(LN(1-CF$1))/$A88 -> 3.0367320022205484 | CG88: =1-(LN(1-CG$1))/$A88 -> 3.1064154755727724 | CH88: =1-(LN(1-CH$1))/$A88 -> 3.1805976837768779 | CI88: =1-(LN(1-CI$1))/$A88 -> 3.2598998349113053 | CJ88: =1-(LN(1-CJ$1))/$A88 -> 3.3450814120994918 | CK88: =1-(LN(1-CK$1))/$A88 -> 3.4370845243679247 | CL88: =1-(LN(1-CL$1))/$A88 -> 3.5370976013674995 | CM88: =1-(LN(1-CM$1))/$A88 -> 3.6466495321770691 | CN88: =1-(LN(1-CN$1))/$A88 -> 3.7677535731630769 | CO88: =1-(LN(1-CO$1))/$A88 -> 3.9031363727681163 | CP88: =1-(LN(1-CP$1))/$A88 -> 4.0566207321066496 | CQ88: =1-(LN(1-CQ$1))/$A88 -> 4.2338054215632699 | CR88: =1-(LN(1-CR$1))/$A88 -> 4.4433704293724148 | CS88: =1-(LN(1-CS$1))/$A88 -> 4.6998572699634646 | CT88: =1-(LN(1-CT$1))/$A88 -> 5.0305263187586213 | CU88: =1-(LN(1-CU$1))/$A88 -> 5.4965781671588232 | CV88: =1-(LN(1-CV$1))/$A88 -> 6.2932990643542004
A89: =A88+0.01 -> 0.88000000000000056 | B89: =1-(LN(1-B$1))/$A89 -> 1.0114208361971608 | C89: =1-(LN(1-C$1))/$A89 -> 1.0229576219517267 | D89: =1-(LN(1-D$1))/$A89 -> 1.0346127357780779 | E89: =1-(LN(1-E$1))/$A89 -> 1.0463886301366536 | F89: =1-(LN(1-F$1))/$A89 -> 1.0582878345313074 | G89: =1-(LN(1-G$1))/$A89 -> 1.070312958770554 | H89: =1-(LN(1-H$1))/$A89 -> 1.0824666964032221 | I89: =1-(LN(1-I$1))/$A89 -> 1.0947518283398305 | J89: =1-(LN(1-J$1))/$A89 -> 1.107171226671865 | K89: =1-(LN(1-K$1))/$A89 -> 1.1197278587020751 | L89: =1-(LN(1-L$1))/$A89 -> 1.1324247911999448 | M89: =1-(LN(1-M$1))/$A89 -> 1.1452651948975965 | N89: =1-(LN(1-N$1))/$A89 -> 1.1582523492426222 | O89: =1-(LN(1-O$1))/$A89 -> 1.1713896474256631 | P89: =1-(LN(1-P$1))/$A89 -> 1.1846806017020168 | Q89: =1-(LN(1-Q$1))/$A89 -> 1.1981288490281565 | R89: =1-(LN(1-R$1))/$A89 -> 1.2117381570357879 | S89: =1-(LN(1-S$1))/$A89 -> 1.2255124303679978 | T89: =1-(LN(1-T$1))/$A89 -> 1.2394557174041507 | U89: =1-(LN(1-U$1))/$A89 -> 1.253572217402511 | V89: =1-(LN(1-V$1))/$A89 -> 1.2678662880921248 | W89: =1-(LN(1-W$1))/$A89 -> 1.282342453748295 | X89: =1-(LN(1-X$1))/$A89 -> 1.2970054137890994 | Y89: =1-(LN(1-Y$1))/$A89 -> 1.3118600519338184 | Z89: =1-(LN(1-Z$1))/$A89 -> 1.3269114459679328 | AA89: =1-(LN(1-AA$1))/$A89 -> 1.3421648781635471 | AB89: =1-(LN(1-AB$1))/$A89 -> 1.3576258464087501 | AC89: =1-(LN(1-AC$1))/$A89 -> 1.3733000761045862 | AD89: =1-(LN(1-AD$1))/$A89 -> 1.3891935328940634 | AE89: =1-(LN(1-AE$1))/$A89 -> 1.4053124362940139 | AF89: =1-(LN(1-AF$1))/$A89 -> 1.4216632743077635 | AG89: =1-(LN(1-AG$1))/$A89 -> 1.4382528191045278 | AH89: =1-(LN(1-AH$1))/$A89 -> 1.4550881438603696 | AI89: =1-(LN(1-AI$1))/$A89 -> 1.4721766408655292 | AJ89: =1-(LN(1-AJ$1))/$A89 -> 1.4895260410141524 | AK89: =1-(LN(1-AK$1))/$A89 -> 1.507144434805022 | AL89: =1-(LN(1-AL$1))/$A89 -> 1.5250402949960893 | AM89: =1-(LN(1-AM$1))/$A89 -> 1.5432225010715905 | AN89: =1-(LN(1-AN$1))/$A89 -> 1.5617003656986137 | AO89: =1-(LN(1-AO$1))/$A89 -> 1.580483663370444 | AP89: =1-(LN(1-AP$1))/$A89 -> 1.5995826614572408 | AQ89: =1-(LN(1-AQ$1))/$A89 -> 1.6190081539109908 | AR89: =1-(LN(1-AR$1))/$A89 -> 1.6387714979017514 | AS89: =1-(LN(1-AS$1))/$A89 -> 1.6588846536965252 | AT89: =1-(LN(1-AT$1))/$A89 -> 1.6793602281313866 | AU89: =1-(LN(1-AU$1))/$A89 -> 1.7002115220725194 | AV89: =1-(LN(1-AV$1))/$A89 -> 1.7214525823136018 | AW89: =1-(LN(1-AW$1))/$A89 -> 1.7430982584166634 | AX89: =1-(LN(1-AX$1))/$A89 -> 1.7651642650724608 | AY89: =1-(LN(1-AY$1))/$A89 -> 1.7876672506363014 | AZ89: =1-(LN(1-AZ$1))/$A89 -> 1.8106248725880283 | BA89: =1-(LN(1-BA$1))/$A89 -> 1.8340558807729552 | BB89: =1-(LN(1-BB$1))/$A89 -> 1.8579802094068554 | BC89: =1-(LN(1-BC$1))/$A89 -> 1.8824190789761324 | BD89: =1-(LN(1-BD$1))/$A89 -> 1.9073951093383767 | BE89: =1-(LN(1-BE$1))/$A89 -> 1.9329324455338979 | BF89: =1-(LN(1-BF$1))/$A89 -> 1.9590568980619649 | BG89: =1-(LN(1-BG$1))/$A89 -> 1.9857960996644581 | BH89: =1-(LN(1-BH$1))/$A89 -> 2.0131796810042997 | BI89: =1-(LN(1-BI$1))/$A89 -> 2.0412394680388131 | BJ89: =1-(LN(1-BJ$1))/$A89 -> 2.0700097043845966 | BK89: =1-(LN(1-BK$1))/$A89 -> 2.0995273025701202 | BL89: =1-(LN(1-BL$1))/$A89 -> 2.129832128799849 | BM89: =1-(LN(1-BM$1))/$A89 -> 2.160967326740888 | BN89: =1-(LN(1-BN$1))/$A89 -> 2.192979686930316 | BO89: =1-(LN(1-BO$1))/$A89 -> 2.2259200697408303 | BP89: =1-(LN(1-BP$1))/$A89 -> 2.2598438915018315 | BQ89: =1-(LN(1-BQ$1))/$A89 -> 2.2948116854413243 | BR89: =1-(LN(1-BR$1))/$A89 -> 2.3308897517078928 | BS89: =1-(LN(1-BS$1))/$A89 -> 2.3681509140067458 | BT89: =1-(LN(1-BT$1))/$A89 -> 2.4066754045472933 | BU89: =1-(LN(1-BU$1))/$A89 -> 2.4465519043328277 | BV89: =1-(LN(1-BV$1))/$A89 -> 2.4878787727088216 | BW89: =1-(LN(1-BW$1))/$A89 -> 2.5307655090529662 | BX89: =1-(LN(1-BX$1))/$A89 -> 2.5753345012726037 | BY89: =1-(LN(1-BY$1))/$A89 -> 2.6217231314092575 | BZ89: =1-(LN(1-BZ$1))/$A89 -> 2.6700863296124346 | CA89: =1-(LN(1-CA$1))/$A89 -> 2.7205996961702006 | CB89: =1-(LN(1-CB$1))/$A89 -> 2.7734633503007609 | CC89: =1-(LN(1-CC$1))/$A89 -> 2.8289067186751158 | CD89: =1-(LN(1-CD$1))/$A89 -> 2.8871945532064234 | CE89: =1-(LN(1-CE$1))/$A89 -> 2.9486345773771916 | CF89: =1-(LN(1-CF$1))/$A89 -> 3.0135873203771331 | CG89: =1-(LN(1-CG$1))/$A89 -> 3.0824789360776275 | CH89: =1-(LN(1-CH$1))/$A89 -> 3.1558181646430494 | CI89: =1-(LN(1-CI$1))/$A89 -> 3.2342191549691313 | CJ89: =1-(LN(1-CJ$1))/$A89 -> 3.3184327596892702 | CK89: =1-(LN(1-CK$1))/$A89 -> 3.409390382045562 | CL89: =1-(LN(1-CL$1))/$A89 -> 3.5082669468065051 | CM89: =1-(LN(1-CM$1))/$A89 -> 3.6165739693114207 | CN89: =1-(LN(1-CN$1))/$A89 -> 3.7363018280134965 | CO89: =1-(LN(1-CO$1))/$A89 -> 3.8701461867139333 | CP89: =1-(LN(1-CP$1))/$A89 -> 4.0218864056054375 | CQ89: =1-(LN(1-CQ$1))/$A89 -> 4.1970576326818687 | CR89: =1-(LN(1-CR$1))/$A89 -> 4.4042412199477283 | CS89: =1-(LN(1-CS$1))/$A89 -> 4.657813437350244 | CT89: =1-(LN(1-CT$1))/$A89 -> 4.984724883318183 | CU89: =1-(LN(1-CU$1))/$A89 -> 5.4454806879865636 | CV89: =1-(LN(1-CV$1))/$A89 -> 6.2331479386229027
A90: =A89+0.01 -> 0.89000000000000057 | B90: =1-(LN(1-B$1))/$A90 -> 1.0112925121949454 | C90: =1-(LN(1-C$1))/$A90 -> 1.0226996711432803 | D90: =1-(LN(1-D$1))/$A90 -> 1.034223828634504 | E90: =1-(LN(1-E$1))/$A90 -> 1.0458674095733205 | F90: =1-(LN(1-F$1))/$A90 -> 1.0576329150421917 | G90: =1-(LN(1-G$1))/$A90 -> 1.0695229255259411 | H90: =1-(LN(1-H$1))/$A90 -> 1.0815401043088038 | I90: =1-(LN(1-I$1))/$A90 -> 1.0936872010551135 | J90: =1-(LN(1-J$1))/$A90 -> 1.1059670555856642 | K90: =1-(LN(1-K$1))/$A90 -> 1.1183826018627261 | L90: =1-(LN(1-L$1))/$A90 -> 1.1309368721976982 | M90: =1-(LN(1-M$1))/$A90 -> 1.1436330016964997 | N90: =1-(LN(1-N$1))/$A90 -> 1.1564742329589972 | O90: =1-(LN(1-O$1))/$A90 -> 1.1694639210500939 | P90: =1-(LN(1-P$1))/$A90 -> 1.1826055387615448 | Q90: =1-(LN(1-Q$1))/$A90 -> 1.1959026821851435 | R90: =1-(LN(1-R$1))/$A90 -> 1.2093590766196556 | S90: =1-(LN(1-S$1))/$A90 -> 1.2229785828357733 | T90: =1-(LN(1-T$1))/$A90 -> 1.2367652037254522 | U90: =1-(LN(1-U$1))/$A90 -> 1.2507230913642806 | V90: =1-(LN(1-V$1))/$A90 -> 1.2648565545180559 | W90: =1-(LN(1-W$1))/$A90 -> 1.2791700666275276 | X90: =1-(LN(1-X$1))/$A90 -> 1.293668274308323 | Y90: =1-(LN(1-Y$1))/$A90 -> 1.3083560064064721 | Z90: =1-(LN(1-Z$1))/$A90 -> 1.3232382836536862 | AA90: =1-(LN(1-AA$1))/$A90 -> 1.3383203289706982 | AB90: =1-(LN(1-AB$1))/$A90 -> 1.3536075784715731 | AC90: =1-(LN(1-AC$1))/$A90 -> 1.3691056932270067 | AD90: =1-(LN(1-AD$1))/$A90 -> 1.3848205718503099 | AE90: =1-(LN(1-AE$1))/$A90 -> 1.4007583639761036 | AF90: =1-(LN(1-AF$1))/$A90 -> 1.4169254847087998 | AG90: =1-(LN(1-AG$1))/$A90 -> 1.4333286301258252 | AH90: =1-(LN(1-AH$1))/$A90 -> 1.4499747939293541 | AI90: =1-(LN(1-AI$1))/$A90 -> 1.4668712853501862 | AJ90: =1-(LN(1-AJ$1))/$A90 -> 1.4840257484184878 | AK90: =1-(LN(1-AK$1))/$A90 -> 1.5014461827285612 | AL90: =1-(LN(1-AL$1))/$A90 -> 1.51914096583883 | AM90: =1-(LN(1-AM$1))/$A90 -> 1.5371188774640445 | AN90: =1-(LN(1-AN$1))/$A90 -> 1.5553891256345844 | AO90: =1-(LN(1-AO$1))/$A90 -> 1.5739613750179671 | AP90: =1-(LN(1-AP$1))/$A90 -> 1.5928457776206426 | AQ90: =1-(LN(1-AQ$1))/$A90 -> 1.612053006114238 | AR90: =1-(LN(1-AR$1))/$A90 -> 1.6315942900601588 | AS90: =1-(LN(1-AS$1))/$A90 -> 1.6514814553403845 | AT90: =1-(LN(1-AT$1))/$A90 -> 1.6717269671411463 | AU90: =1-(LN(1-AU$1))/$A90 -> 1.6923439768806932 | AV90: =1-(LN(1-AV$1))/$A90 -> 1.7133463735235615 | AW90: =1-(LN(1-AW$1))/$A90 -> 1.7347488397827684 | AX90: =1-(LN(1-AX$1))/$A90 -> 1.7565669137795119 | AY90: =1-(LN(1-AY$1))/$A90 -> 1.7788170568089274 | AZ90: =1-(LN(1-AZ$1))/$A90 -> 1.8015167279522077 | BA90: =1-(LN(1-BA$1))/$A90 -> 1.8246844663822479 | BB90: =1-(LN(1-BB$1))/$A90 -> 1.8483399823348683 | BC90: =1-(LN(1-BC$1))/$A90 -> 1.872504257864041 | BD90: =1-(LN(1-BD$1))/$A90 -> 1.8971996586716535 | BE90: =1-(LN(1-BE$1))/$A90 -> 1.9224500585054272 | BF90: =1-(LN(1-BF$1))/$A90 -> 1.9482809778590213 | BG90: =1-(LN(1-BG$1))/$A90 -> 1.9747197389940709 | BH90: =1-(LN(1-BH$1))/$A90 -> 2.0017956396447008 | BI90: =1-(LN(1-BI$1))/$A90 -> 2.0295401481732083 | BJ90: =1-(LN(1-BJ$1))/$A90 -> 2.0579871234364555 | BK90: =1-(LN(1-BK$1))/$A90 -> 2.0871730632154 | BL90: =1-(LN(1-BL$1))/$A90 -> 2.1171373857796261 | BM90: =1-(LN(1-BM$1))/$A90 -> 2.1479227500359346 | BN90: =1-(LN(1-BN$1))/$A90 -> 2.1795754207850315 | BO90: =1-(LN(1-BO$1))/$A90 -> 2.2121456869347531 | BP90: =1-(LN(1-BP$1))/$A90 -> 2.2456883421591138 | BQ90: =1-(LN(1-BQ$1))/$A90 -> 2.2802632395374891 | BR90: =1-(LN(1-BR$1))/$A90 -> 2.3159359342729724 | BS90: =1-(LN(1-BS$1))/$A90 -> 2.3527784318268949 | BT90: =1-(LN(1-BT$1))/$A90 -> 2.3908700629231663 | BU90: =1-(LN(1-BU$1))/$A90 -> 2.4302985121493124 | BV90: =1-(LN(1-BV$1))/$A90 -> 2.4711610336896213 | BW90: =1-(LN(1-BW$1))/$A90 -> 2.5135658965916967 | BX90: =1-(LN(1-BX$1))/$A90 -> 2.5576341136178558 | BY90: =1-(LN(1-BY$1))/$A90 -> 2.6035015231911762 | BZ90: =1-(LN(1-BZ$1))/$A90 -> 2.6513213146729693 | CA90: =1-(LN(1-CA$1))/$A90 -> 2.7012671153143559 | CB90: =1-(LN(1-CB$1))/$A90 -> 2.7535367958029995 | CC90: =1-(LN(1-CC$1))/$A90 -> 2.808357204982137 | CD90: =1-(LN(1-CD$1))/$A90 -> 2.8659901200243287 | CE90: =1-(LN(1-CE$1))/$A90 -> 2.9267398068448633 | CF90: =1-(LN(1-CF$1))/$A90 -> 2.9909627437436823 | CG90: =1-(LN(1-CG$1))/$A90 -> 3.0590802963464183 | CH90: =1-(LN(1-CH$1))/$A90 -> 3.1315954886358242 | CI90: =1-(LN(1-CI$1))/$A90 -> 3.209115568958242 | CJ90: =1-(LN(1-CJ$1))/$A90 -> 3.2923829534006268 | CK90: =1-(LN(1-CK$1))/$A90 -> 3.3823185800001063 | CL90: =1-(LN(1-CL$1))/$A90 -> 3.480084172123286 | CM90: =1-(LN(1-CM$1))/$A90 -> 3.5871742617910676 | CN90: =1-(LN(1-CN$1))/$A90 -> 3.7055568636537943 | CO90: =1-(LN(1-CO$1))/$A90 -> 3.8378973531553497 | CP90: =1-(LN(1-CP$1))/$A90 -> 3.9879326257671743 | CQ90: =1-(LN(1-CQ$1))/$A90 -> 4.1611356368090391 | CR90: =1-(LN(1-CR$1))/$A90 -> 4.3659913186000017 | CS90: =1-(LN(1-CS$1))/$A90 -> 4.6167144099642865 | CT90: =1-(LN(1-CT$1))/$A90 -> 4.939952693617979 | CU90: =1-(LN(1-CU$1))/$A90 -> 5.3955314667732317 | CV90: =1-(LN(1-CV$1))/$A90 -> 6.1743485235821964
A91: =A90+0.01 -> 0.90000000000000058 | B91: =1-(LN(1-B$1))/$A91 -> 1.0111670398372239 | C91: =1-(LN(1-C$1))/$A91 -> 1.0224474525750216 | D91: =1-(LN(1-D$1))/$A91 -> 1.0338435638718984 | E91: =1-(LN(1-E$1))/$A91 -> 1.0453577716891724 | F91: =1-(LN(1-F$1))/$A91 -> 1.0569925493195007 | G91: =1-(LN(1-G$1))/$A91 -> 1.0687504485756527 | H91: =1-(LN(1-H$1))/$A91 -> 1.0806341031498172 | I91: =1-(LN(1-I$1))/$A91 -> 1.092646232154501 | J91: =1-(LN(1-J$1))/$A91 -> 1.1047896438569347 | K91: =1-(LN(1-K$1))/$A91 -> 1.1170672396198069 | L91: =1-(LN(1-L$1))/$A91 -> 1.1294820180621683 | M91: =1-(LN(1-M$1))/$A91 -> 1.1420370794554275 | N91: =1-(LN(1-N$1))/$A91 -> 1.154735630370564 | O91: =1-(LN(1-O$1))/$A91 -> 1.1675809885939818 | P91: =1-(LN(1-P$1))/$A91 -> 1.180576588330861 | Q91: =1-(LN(1-Q$1))/$A91 -> 1.1937259857164197 | R91: =1-(LN(1-R$1))/$A91 -> 1.2070328646572148 | S91: =1-(LN(1-S$1))/$A91 -> 1.2205010430264869 | T91: =1-(LN(1-T$1))/$A91 -> 1.2341344792396138 | U91: =1-(LN(1-U$1))/$A91 -> 1.2479372792380108 | V91: =1-(LN(1-V$1))/$A91 -> 1.2619137039122998 | W91: =1-(LN(1-W$1))/$A91 -> 1.2760681769983329 | X91: =1-(LN(1-X$1))/$A91 -> 1.2904052934826749 | Y91: =1-(LN(1-Y$1))/$A91 -> 1.3049298285575115 | Z91: =1-(LN(1-Z$1))/$A91 -> 1.3196467471686453 | AA91: =1-(LN(1-AA$1))/$A91 -> 1.3345612142043572 | AB91: =1-(LN(1-AB$1))/$A91 -> 1.3496786053774446 | AC91: =1-(LN(1-AC$1))/$A91 -> 1.3650045188578177 | AD91: =1-(LN(1-AD$1))/$A91 -> 1.3805447877186396 | AE91: =1-(LN(1-AE$1))/$A91 -> 1.3963054932652581 | AF91: =1-(LN(1-AF$1))/$A91 -> 1.4122929793231465 | AG91: =1-(LN(1-AG$1))/$A91 -> 1.4285138675688718 | AH91: =1-(LN(1-AH$1))/$A91 -> 1.4449750739968057 | AI91: =1-(LN(1-AI$1))/$A91 -> 1.461683826624073 | AJ91: =1-(LN(1-AJ$1))/$A91 -> 1.4786476845471712 | AK91: =1-(LN(1-AK$1))/$A91 -> 1.4958745584760216 | AL91: =1-(LN(1-AL$1))/$A91 -> 1.513372732885065 | AM91: =1-(LN(1-AM$1))/$A91 -> 1.5311508899366664 | AN91: =1-(LN(1-AN$1))/$A91 -> 1.5492181353497556 | AO91: =1-(LN(1-AO$1))/$A91 -> 1.5675840264066563 | AP91: =1-(LN(1-AP$1))/$A91 -> 1.5862586023137464 | AQ91: =1-(LN(1-AQ$1))/$A91 -> 1.6052524171574132 | AR91: =1-(LN(1-AR$1))/$A91 -> 1.6245765757261568 | AS91: =1-(LN(1-AS$1))/$A91 -> 1.6442427725032691 | AT91: =1-(LN(1-AT$1))/$A91 -> 1.6642633341729116 | AU91: =1-(LN(1-AU$1))/$A91 -> 1.6846512660264632 | AV91: =1-(LN(1-AV$1))/$A91 -> 1.7054203027066328 | AW91: =1-(LN(1-AW$1))/$A91 -> 1.7265849637851822 | AX91: =1-(LN(1-AX$1))/$A91 -> 1.7481606147375173 | AY91: =1-(LN(1-AY$1))/$A91 -> 1.7701635339554946 | AZ91: =1-(LN(1-AZ$1))/$A91 -> 1.7926109865305164 | BA91: =1-(LN(1-BA$1))/$A91 -> 1.8155213056446673 | BB91: =1-(LN(1-BB$1))/$A91 -> 1.8389139825311476 | BC91: =1-(LN(1-BC$1))/$A91 -> 1.862809766109996 | BD91: =1-(LN(1-BD$1))/$A91 -> 1.8872307735753018 | BE91: =1-(LN(1-BE$1))/$A91 -> 1.9122006134109224 | BF91: =1-(LN(1-BF$1))/$A91 -> 1.9377445225494769 | BG91: =1-(LN(1-BG$1))/$A91 -> 1.9638895196719146 | BH91: =1-(LN(1-BH$1))/$A91 -> 1.990664576981982 | BI91: =1-(LN(1-BI$1))/$A91 -> 2.0181008131935059 | BJ91: =1-(LN(1-BJ$1))/$A91 -> 2.0462317109538279 | BK91: =1-(LN(1-BK$1))/$A91 -> 2.0750933625130066 | BL91: =1-(LN(1-BL$1))/$A91 -> 2.1047247481598523 | BM91: =1-(LN(1-BM$1))/$A91 -> 2.135168052813313 | BN91: =1-(LN(1-BN$1))/$A91 -> 2.1664690272207534 | BO91: =1-(LN(1-BO$1))/$A91 -> 2.1986774015243671 | BP91: =1-(LN(1-BP$1))/$A91 -> 2.2318473605795681 | BQ91: =1-(LN(1-BQ$1))/$A91 -> 2.2660380924315167 | BR91: =1-(LN(1-BR$1))/$A91 -> 2.3013144238921619 | BS91: =1-(LN(1-BS$1))/$A91 -> 2.3377475603621516 | BT91: =1-(LN(1-BT$1))/$A91 -> 2.3754159511129087 | BU91: =1-(LN(1-BU$1))/$A91 -> 2.4144063064587646 | BV91: =1-(LN(1-BV$1))/$A91 -> 2.4548147999819587 | BW91: =1-(LN(1-BW$1))/$A91 -> 2.4967484977406782 | BX91: =1-(LN(1-BX$1))/$A91 -> 2.5403270679109906 | BY91: =1-(LN(1-BY$1))/$A91 -> 2.5856848396001633 | BZ91: =1-(LN(1-BZ$1))/$A91 -> 2.6329733000654922 | CA91: =1-(LN(1-CA$1))/$A91 -> 2.6823641473664184 | CB91: =1-(LN(1-CB$1))/$A91 -> 2.7340530536274104 | CC91: =1-(LN(1-CC$1))/$A91 -> 2.7882643471490018 | CD91: =1-(LN(1-CD$1))/$A91 -> 2.845256896468503 | CE91: =1-(LN(1-CE$1))/$A91 -> 2.9053315867688094 | CF91: =1-(LN(1-CF$1))/$A91 -> 2.9688409354798635 | CG91: =1-(LN(1-CG$1))/$A91 -> 3.0362016263870135 | CH91: =1-(LN(1-CH$1))/$A91 -> 3.1079110943176484 | CI91: =1-(LN(1-CI$1))/$A91 -> 3.1845698404142615 | CJ91: =1-(LN(1-CJ$1))/$A91 -> 3.2669120316961755 | CK91: =1-(LN(1-CK$1))/$A91 -> 3.3558483735556606 | CL91: =1-(LN(1-CL$1))/$A91 -> 3.4525276813219161 | CM91: =1-(LN(1-CM$1))/$A91 -> 3.5584278811045 | CN91: =1-(LN(1-CN$1))/$A91 -> 3.6754951207243076 | CO91: =1-(LN(1-CO$1))/$A91 -> 3.8063651603425122 | CP91: =1-(LN(1-CP$1))/$A91 -> 3.954733374369761 | CQ91: =1-(LN(1-CQ$1))/$A91 -> 4.1260119075111614 | CR91: =1-(LN(1-CR$1))/$A91 -> 4.3285914150600018 | CS91: =1-(LN(1-CS$1))/$A91 -> 4.5765286942980161 | CT91: =1-(LN(1-CT$1))/$A91 -> 4.8961754414666672 | CU91: =1-(LN(1-CU$1))/$A91 -> 5.346692228253529 | CV91: =1-(LN(1-CV$1))/$A91 -> 6.1168557622090605
A92: =A91+0.01 -> 0.91000000000000059 | B92: =1-(LN(1-B$1))/$A92 -> 1.0110443251137378 | C92: =1-(LN(1-C$1))/$A92 -> 1.0222007772719994 | D92: =1-(LN(1-D$1))/$A92 -> 1.0334716565766029 | E92: =1-(LN(1-E$1))/$A92 -> 1.0448593346376429 | F92: =1-(LN(1-F$1))/$A92 -> 1.0563662575687369 | G92: =1-(LN(1-G$1))/$A92 -> 1.0679949491407554 | H92: =1-(LN(1-H$1))/$A92 -> 1.0797480141042148 | I92: =1-(LN(1-I$1))/$A92 -> 1.0916281416912648 | J92: =1-(LN(1-J$1))/$A92 -> 1.1036381093090564 | K92: =1-(LN(1-K$1))/$A92 -> 1.1157807864371716 | L92: =1-(LN(1-L$1))/$A92 -> 1.1280591387428038 | M92: =1-(LN(1-M$1))/$A92 -> 1.1404762324284448 | N92: =1-(LN(1-N$1))/$A92 -> 1.1530352388280303 | O92: =1-(LN(1-O$1))/$A92 -> 1.1657394392687732 | P92: =1-(LN(1-P$1))/$A92 -> 1.1785922302173351 | Q92: =1-(LN(1-Q$1))/$A92 -> 1.1915971287305249 | R92: =1-(LN(1-R$1))/$A92 -> 1.2047577782324104 | S92: =1-(LN(1-S$1))/$A92 -> 1.2180779546415805 | T92: =1-(LN(1-T$1))/$A92 -> 1.2315615728743434 | U92: =1-(LN(1-U$1))/$A92 -> 1.2452126937518788 | V92: =1-(LN(1-V$1))/$A92 -> 1.2590355313418349 | W92: =1-(LN(1-W$1))/$A92 -> 1.2730344607675819 | X92: =1-(LN(1-X$1))/$A92 -> 1.287214026521327 | Y92: =1-(LN(1-Y$1))/$A92 -> 1.3015789513206157 | Z92: =1-(LN(1-Z$1))/$A92 -> 1.3161341455514073 | AA92: =1-(LN(1-AA$1))/$A92 -> 1.3308847173449685 | AB92: =1-(LN(1-AB$1))/$A92 -> 1.3458359833403297 | AC92: =1-(LN(1-AC$1))/$A92 -> 1.3609934801890504 | AD92: =1-(LN(1-AD$1))/$A92 -> 1.3763629768645889 | AE92: =1-(LN(1-AE$1))/$A92 -> 1.3919504878447606 | AF92: =1-(LN(1-AF$1))/$A92 -> 1.4077622872426723 | AG92: =1-(LN(1-AG$1))/$A92 -> 1.4238049239692137 | AH92: =1-(LN(1-AH$1))/$A92 -> 1.4400852380188187 | AI92: =1-(LN(1-AI$1))/$A92 -> 1.4566103779798523 | AJ92: =1-(LN(1-AJ$1))/$A92 -> 1.4733878198818178 | AK92: =1-(LN(1-AK$1))/$A92 -> 1.4904253875037576 | AL92: =1-(LN(1-AL$1))/$A92 -> 1.5077312742819324 | AM92: =1-(LN(1-AM$1))/$A92 -> 1.5253140669703293 | AN92: =1-(LN(1-AN$1))/$A92 -> 1.543182771225033 | AO92: =1-(LN(1-AO$1))/$A92 -> 1.5613468393032863 | AP92: =1-(LN(1-AP$1))/$A92 -> 1.5798162000905185 | AQ92: =1-(LN(1-AQ$1))/$A92 -> 1.598601291694145 | AR92: =1-(LN(1-AR$1))/$A92 -> 1.6177130968720232 | AS92: =1-(LN(1-AS$1))/$A92 -> 1.6371631815966396 | AT92: =1-(LN(1-AT$1))/$A92 -> 1.6569637370940882 | AU92: =1-(LN(1-AU$1))/$A92 -> 1.6771276257404582 | AV92: =1-(LN(1-AV$1))/$A92 -> 1.6976684312483181 | AW92: =1-(LN(1-AW$1))/$A92 -> 1.7186005136336968 | AX92: =1-(LN(1-AX$1))/$A92 -> 1.7399390695206214 | AY92: =1-(LN(1-AY$1))/$A92 -> 1.7617001984175222 | AZ92: =1-(LN(1-AZ$1))/$A92 -> 1.7839009756895217 | BA92: =1-(LN(1-BA$1))/$A92 -> 1.8065595330551654 | BB92: =1-(LN(1-BB$1))/$A92 -> 1.8296951475582777 | BC92: =1-(LN(1-BC$1))/$A92 -> 1.8533283401087872 | BD92: =1-(LN(1-BD$1))/$A92 -> 1.8774809848546941 | BE92: =1-(LN(1-BE$1))/$A92 -> 1.9021764308459672 | BF92: =1-(LN(1-BF$1))/$A92 -> 1.9274396376862957 | BG92: =1-(LN(1-BG$1))/$A92 -> 1.9532973271480474 | BH92: =1-(LN(1-BH$1))/$A92 -> 1.979778153059103 | BI92: =1-(LN(1-BI$1))/$A92 -> 2.0069128921694013 | BJ92: =1-(LN(1-BJ$1))/$A92 -> 2.0347346591851045 | BK92: =1-(LN(1-BK$1))/$A92 -> 2.063279149738138 | BL92: =1-(LN(1-BL$1))/$A92 -> 2.0925849157624912 | BM92: =1-(LN(1-BM$1))/$A92 -> 2.1226936786065735 | BN92: =1-(LN(1-BN$1))/$A92 -> 2.1536506862622833 | BO92: =1-(LN(1-BO$1))/$A92 -> 2.1855051223867368 | BP92: =1-(LN(1-BP$1))/$A92 -> 2.2183105763973754 | BQ92: =1-(LN(1-BQ$1))/$A92 -> 2.2521255859212808 | BR92: =1-(LN(1-BR$1))/$A92 -> 2.2870142653878522 | BS92: =1-(LN(1-BS$1))/$A92 -> 2.3230470377208094 | BT92: =1-(LN(1-BT$1))/$A92 -> 2.3603014901116683 | BU92: =1-(LN(1-BU$1))/$A92 -> 2.3988633800141628 | BV92: =1-(LN(1-BV$1))/$A92 -> 2.4388278241579813 | BW92: =1-(LN(1-BW$1))/$A92 -> 2.4803007120512199 | BX92: =1-(LN(1-BX$1))/$A92 -> 2.5234003968350454 | BY92: =1-(LN(1-BY$1))/$A92 -> 2.5682597314726889 | BZ92: =1-(LN(1-BZ$1))/$A92 -> 2.6150285385263108 | CA92: =1-(LN(1-CA$1))/$A92 -> 2.6638766292634912 | CB92: =1-(LN(1-CB$1))/$A92 -> 2.7149975255655709 | CC92: =1-(LN(1-CC$1))/$A92 -> 2.7686130905869248 | CD92: =1-(LN(1-CD$1))/$A92 -> 2.824979348155662 | CE92: =1-(LN(1-CE$1))/$A92 -> 2.8843938770240971 | CF92: =1-(LN(1-CF$1))/$A92 -> 2.9472053208042608 | CG92: =1-(LN(1-CG$1))/$A92 -> 3.0138257843388048 | CH92: =1-(LN(1-CH$1))/$A92 -> 3.0847472361383335 | CI92: =1-(LN(1-CI$1))/$A92 -> 3.1605635784316872 | CJ92: =1-(LN(1-CJ$1))/$A92 -> 3.2420009104687448 | CK92: =1-(LN(1-CK$1))/$A92 -> 3.3299599298902138 | CL92: =1-(LN(1-CL$1))/$A92 -> 3.4255768276810161 | CM92: =1-(LN(1-CM$1))/$A92 -> 3.5303132890044506 | CN92: =1-(LN(1-CN$1))/$A92 -> 3.6460940754416229 | CO92: =1-(LN(1-CO$1))/$A92 -> 3.775525982756331 | CP92: =1-(LN(1-CP$1))/$A92 -> 3.9222637768492143 | CQ92: =1-(LN(1-CQ$1))/$A92 -> 4.0916601283077414 | CR92: =1-(LN(1-CR$1))/$A92 -> 4.2920134874219791 | CS92: =1-(LN(1-CS$1))/$A92 -> 4.5372261811738621 | CT92: =1-(LN(1-CT$1))/$A92 -> 4.8533603267252756 | CU92: =1-(LN(1-CU$1))/$A92 -> 5.2989263795914017 | CV92: =1-(LN(1-CV$1))/$A92 -> 6.0606265780089608
A93: =A92+0.01 -> 0.9200000000000006 | B93: =1-(LN(1-B$1))/$A93 -> 1.0109242781016321 | C93: =1-(LN(1-C$1))/$A93 -> 1.0219594644755645 | D93: =1-(LN(1-D$1))/$A93 -> 1.0331078342225093 | E93: =1-(LN(1-E$1))/$A93 -> 1.0443717331741904 | F93: =1-(LN(1-F$1))/$A93 -> 1.0557535808560332 | G93: =1-(LN(1-G$1))/$A93 -> 1.0672558736066169 | H93: =1-(LN(1-H$1))/$A93 -> 1.0788811878639515 | I93: =1-(LN(1-I$1))/$A93 -> 1.0906321836294033 | J93: =1-(LN(1-J$1))/$A93 -> 1.1025116081209143 | K93: =1-(LN(1-K$1))/$A93 -> 1.1145222996280719 | L93: =1-(LN(1-L$1))/$A93 -> 1.1266671915825559 | M93: =1-(LN(1-M$1))/$A93 -> 1.1389493168585705 | N93: =1-(LN(1-N$1))/$A93 -> 1.15137181231903 | O93: =1-(LN(1-O$1))/$A93 -> 1.1639379236245473 | P93: =1-(LN(1-P$1))/$A93 -> 1.1766510103236683 | Q93: =1-(LN(1-Q$1))/$A93 -> 1.1895145512443235 | R93: =1-(LN(1-R$1))/$A93 -> 1.202532150208145 | S93: =1-(LN(1-S$1))/$A93 -> 1.2157075420911285 | T93: =1-(LN(1-T$1))/$A93 -> 1.2290445992561441 | U93: =1-(LN(1-U$1))/$A93 -> 1.2425473383850105 | V93: =1-(LN(1-V$1))/$A93 -> 1.2562199277402932 | W93: =1-(LN(1-W$1))/$A93 -> 1.2700666948896735 | X93: =1-(LN(1-X$1))/$A93 -> 1.2840921349287038 | Y93: =1-(LN(1-Y$1))/$A93 -> 1.2983009192410437 | Z93: =1-(LN(1-Z$1))/$A93 -> 1.312697904838892 | AA93: =1-(LN(1-AA$1))/$A93 -> 1.3272881443303493 | AB93: =1-(LN(1-AB$1))/$A93 -> 1.3420768965648913 | AC93: =1-(LN(1-AC$1))/$A93 -> 1.3570696380130824 | AD93: =1-(LN(1-AD$1))/$A93 -> 1.3722720749421475 | AE93: =1-(LN(1-AE$1))/$A93 -> 1.3876901564551436 | AF93: =1-(LN(1-AF$1))/$A93 -> 1.4033300884682955 | AG93: =1-(LN(1-AG$1))/$A93 -> 1.4191983487086788 | AH93: =1-(LN(1-AH$1))/$A93 -> 1.435301702822962 | AI93: =1-(LN(1-AI$1))/$A93 -> 1.4516472216974627 | AJ93: =1-(LN(1-AJ$1))/$A93 -> 1.4682423001004936 | AK93: =1-(LN(1-AK$1))/$A93 -> 1.485094676770021 | AL93: =1-(LN(1-AL$1))/$A93 -> 1.5022124560832157 | AM93: =1-(LN(1-AM$1))/$A93 -> 1.5196041314597823 | AN93: =1-(LN(1-AN$1))/$A93 -> 1.5372786106682392 | AO93: =1-(LN(1-AO$1))/$A93 -> 1.555245243223903 | AP93: =1-(LN(1-AP$1))/$A93 -> 1.5735138500895345 | AQ93: =1-(LN(1-AQ$1))/$A93 -> 1.5920947559148608 | AR93: =1-(LN(1-AR$1))/$A93 -> 1.6109988240799362 | AS93: =1-(LN(1-AS$1))/$A93 -> 1.6302374948401543 | AT93: =1-(LN(1-AT$1))/$A93 -> 1.6498228269082831 | AU93: =1-(LN(1-AU$1))/$A93 -> 1.6697675428519747 | AV93: =1-(LN(1-AV$1))/$A93 -> 1.6900850787347494 | AW93: =1-(LN(1-AW$1))/$A93 -> 1.7107896384855041 | AX93: =1-(LN(1-AX$1))/$A93 -> 1.7318962535475713 | AY93: =1-(LN(1-AY$1))/$A93 -> 1.7534208484347231 | AZ93: =1-(LN(1-AZ$1))/$A93 -> 1.7753803129102876 | BA93: =1-(LN(1-BA$1))/$A93 -> 1.7977925816089138 | BB93: =1-(LN(1-BB$1))/$A93 -> 1.82067672204134 | BC93: =1-(LN(1-BC$1))/$A93 -> 1.8440530320641266 | BD93: =1-(LN(1-BD$1))/$A93 -> 1.8679431480627953 | BE93: =1-(LN(1-BE$1))/$A93 -> 1.8923701652932938 | BF93: =1-(LN(1-BF$1))/$A93 -> 1.9173587720592709 | BG93: =1-(LN(1-BG$1))/$A93 -> 1.942935399679047 | BH93: =1-(LN(1-BH$1))/$A93 -> 1.9691283905258519 | BI93: =1-(LN(1-BI$1))/$A93 -> 1.9959681868197339 | BJ93: =1-(LN(1-BJ$1))/$A93 -> 2.0234875433243968 | BK93: =1-(LN(1-BK$1))/$A93 -> 2.0517217676757671 | BL93: =1-(LN(1-BL$1))/$A93 -> 2.0807089927650733 | BM93: =1-(LN(1-BM$1))/$A93 -> 2.110490486447806 | BN93: =1-(LN(1-BN$1))/$A93 -> 2.1411110048898676 | BO93: =1-(LN(1-BO$1))/$A93 -> 2.1726191971434026 | BP93: =1-(LN(1-BP$1))/$A93 -> 2.2050680701321865 | BQ93: =1-(LN(1-BQ$1))/$A93 -> 2.2385155252047451 | BR93: =1-(LN(1-BR$1))/$A93 -> 2.2730249798945064 | BS93: =1-(LN(1-BS$1))/$A93 -> 2.3086660916586266 | BT93: =1-(LN(1-BT$1))/$A93 -> 2.3455156043495848 | BU93: =1-(LN(1-BU$1))/$A93 -> 2.3836583432748784 | BV93: =1-(LN(1-BV$1))/$A93 -> 2.4231883912866987 | BW93: =1-(LN(1-BW$1))/$A93 -> 2.4642104869202281 | BX93: =1-(LN(1-BX$1))/$A93 -> 2.5068416968694471 | BY93: =1-(LN(1-BY$1))/$A93 -> 2.5512134300436378 | BZ93: =1-(LN(1-BZ$1))/$A93 -> 2.5974738804988506 | CA93: =1-(LN(1-CA$1))/$A93 -> 2.6457910137280183 | CB93: =1-(LN(1-CB$1))/$A93 -> 2.6963562481137711 | CC93: =1-(LN(1-CC$1))/$A93 -> 2.7493890352544583 | CD93: =1-(LN(1-CD$1))/$A93 -> 2.8051426161104915 | CE93: =1-(LN(1-CE$1))/$A93 -> 2.8639113348825309 | CF93: =1-(LN(1-CF$1))/$A93 -> 2.9260400455781275 | CG93: =1-(LN(1-CG$1))/$A93 -> 2.9919363736394695 | CH93: =1-(LN(1-CH$1))/$A93 -> 3.0620869400933519 | CI93: =1-(LN(1-CI$1))/$A93 -> 3.1370791917096037 | CJ93: =1-(LN(1-CJ$1))/$A93 -> 3.2176313353549539 | CK93: =1-(LN(1-CK$1))/$A93 -> 3.3046342784783636 | CL93: =1-(LN(1-CL$1))/$A93 -> 3.3992118621627441 | CM93: =1-(LN(1-CM$1))/$A93 -> 3.502809883689185 | CN93: =1-(LN(1-CN$1))/$A93 -> 3.6173321833172576 | CO93: =1-(LN(1-CO$1))/$A93 -> 3.7453572220741966 | CP93: =1-(LN(1-CP$1))/$A93 -> 3.8905000401443317 | CQ93: =1-(LN(1-CQ$1))/$A93 -> 4.058055126913092 | CR93: =1-(LN(1-CR$1))/$A93 -> 4.2562307321239139 | CS93: =1-(LN(1-CS$1))/$A93 -> 4.4987780705089282 | CT93: =1-(LN(1-CT$1))/$A93 -> 4.8114759753478271 | CU93: =1-(LN(1-CU$1))/$A93 -> 5.2521989189436695 | CV93: =1-(LN(1-CV$1))/$A93 -> 6.0056197673784286
A94: =A93+0.01 -> 0.9300000000000006 | B94: =1-(LN(1-B$1))/$A94 -> 1.0108068127457004 | C94: =1-(LN(1-C$1))/$A94 -> 1.0217233412016338 | D94: =1-(LN(1-D$1))/$A94 -> 1.0327518360050629 | E94: =1-(LN(1-E$1))/$A94 -> 1.0438946177637152 | F94: =1-(LN(1-F$1))/$A94 -> 1.0551540799866135 | G94: =1-(LN(1-G$1))/$A94 -> 1.0665326921699865 | H94: =1-(LN(1-H$1))/$A94 -> 1.0780330030482101 | I94: =1-(LN(1-I$1))/$A94 -> 1.0896576440204848 | J94: =1-(LN(1-J$1))/$A94 -> 1.1014093327647756 | K94: =1-(LN(1-K$1))/$A94 -> 1.113290877051426 | L94: =1-(LN(1-L$1))/$A94 -> 1.1253051787698403 | M94: =1-(LN(1-M$1))/$A94 -> 1.1374552381826719 | N94: =1-(LN(1-N$1))/$A94 -> 1.1497441584231265 | O94: =1-(LN(1-O$1))/$A94 -> 1.1621751502522404 | P94: =1-(LN(1-P$1))/$A94 -> 1.1747515370943815 | Q94: =1-(LN(1-Q$1))/$A94 -> 1.1874767603707288 | R94: =1-(LN(1-R$1))/$A94 -> 1.2003543851521434 | S94: =1-(LN(1-S$1))/$A94 -> 1.2133881061546647 | T94: =1-(LN(1-T$1))/$A94 -> 1.2265817541028521 | U94: =1-(LN(1-U$1))/$A94 -> 1.2399393024883976 | V94: =1-(LN(1-V$1))/$A94 -> 1.2534648747538384 | W94: =1-(LN(1-W$1))/$A94 -> 1.2671627519338706 | X94: =1-(LN(1-X$1))/$A94 -> 1.2810373807896855 | Y94: =1-(LN(1-Y$1))/$A94 -> 1.295093382475011 | Z94: =1-(LN(1-Z$1))/$A94 -> 1.3093355617761082 | AA94: =1-(LN(1-AA$1))/$A94 -> 1.3237689169719586 | AB94: =1-(LN(1-AB$1))/$A94 -> 1.3383986503652689 | AC94: =1-(LN(1-AC$1))/$A94 -> 1.3532301795398236 | AD94: =1-(LN(1-AD$1))/$A94 -> 1.3682691494051353 | AE94: =1-(LN(1-AE$1))/$A94 -> 1.383521445095411 | AF94: =1-(LN(1-AF$1))/$A94 -> 1.3989932057965935 | AG94: =1-(LN(1-AG$1))/$A94 -> 1.4146908395827791 | AH94: =1-(LN(1-AH$1))/$A94 -> 1.4306210393517476 | AI94: =1-(LN(1-AI$1))/$A94 -> 1.4467907999587803 | AJ94: =1-(LN(1-AJ$1))/$A94 -> 1.4632074366585528 | AK94: =1-(LN(1-AK$1))/$A94 -> 1.4798786049767951 | AL94: =1-(LN(1-AL$1))/$A94 -> 1.496812322146837 | AM94: =1-(LN(1-AM$1))/$A94 -> 1.5140169902612901 | AN94: =1-(LN(1-AN$1))/$A94 -> 1.531501421306215 | AO94: =1-(LN(1-AO$1))/$A94 -> 1.549274864264506 | AP94: =1-(LN(1-AP$1))/$A94 -> 1.5673470344971741 | AQ94: =1-(LN(1-AQ$1))/$A94 -> 1.5857281456362062 | AR94: =1-(LN(1-AR$1))/$A94 -> 1.6044289442511195 | AS94: =1-(LN(1-AS$1))/$A94 -> 1.6234607475838088 | AT94: =1-(LN(1-AT$1))/$A94 -> 1.6428354846834627 | AU94: =1-(LN(1-AU$1))/$A94 -> 1.662565741315932 | AV94: =1-(LN(1-AV$1))/$A94 -> 1.6826648090709351 | AW94: =1-(LN(1-AW$1))/$A94 -> 1.7031467391469506 | AX94: =1-(LN(1-AX$1))/$A94 -> 1.7240264013588877 | AY94: =1-(LN(1-AY$1))/$A94 -> 1.7453195489891886 | AZ94: =1-(LN(1-AZ$1))/$A94 -> 1.7670428901908224 | BA94: =1-(LN(1-BA$1))/$A94 -> 1.7892141667529038 | BB94: =1-(LN(1-BB$1))/$A94 -> 1.8118522411591749 | BC94: =1-(LN(1-BC$1))/$A94 -> 1.8349771930096734 | BD94: =1-(LN(1-BD$1))/$A94 -> 1.8586104260406147 | BE94: =1-(LN(1-BE$1))/$A94 -> 1.8827747871718605 | BF94: =1-(LN(1-BF$1))/$A94 -> 1.907494699241429 | BG94: =1-(LN(1-BG$1))/$A94 -> 1.9327963093599174 | BH94: =1-(LN(1-BH$1))/$A94 -> 1.9587076551438534 | BI94: =1-(LN(1-BI$1))/$A94 -> 1.9852588514775862 | BJ94: =1-(LN(1-BJ$1))/$A94 -> 2.0124823009230592 | BK94: =1-(LN(1-BK$1))/$A94 -> 2.0404129314641999 | BL94: =1-(LN(1-BL$1))/$A94 -> 2.0690884659611477 | BM94: =1-(LN(1-BM$1))/$A94 -> 2.0985497285290124 | BN94: =1-(LN(1-BN$1))/$A94 -> 2.1288409940845998 | BO94: =1-(LN(1-BO$1))/$A94 -> 2.1600103885719681 | BP94: =1-(LN(1-BP$1))/$A94 -> 2.1921103489479696 | BQ94: =1-(LN(1-BQ$1))/$A94 -> 2.2251981539659837 | BR94: =1-(LN(1-BR$1))/$A94 -> 2.2593365392504792 | BS94: =1-(LN(1-BS$1))/$A94 -> 2.2945944132536953 | BT94: =1-(LN(1-BT$1))/$A94 -> 2.3310476946253957 | BU94: =1-(LN(1-BU$1))/$A94 -> 2.3687802965729978 | BV94: =1-(LN(1-BV$1))/$A94 -> 2.4078852903051216 | BW94: =1-(LN(1-BW$1))/$A94 -> 2.4484662881361396 | BX94: =1-(LN(1-BX$1))/$A94 -> 2.4906390979783781 | BY94: =1-(LN(1-BY$1))/$A94 -> 2.5345337157420933 | BZ94: =1-(LN(1-BZ$1))/$A94 -> 2.5802967419988629 | CA94: =1-(LN(1-CA$1))/$A94 -> 2.62809433616105 | CB94: =1-(LN(1-CB$1))/$A94 -> 2.6781158583491074 | CC94: =1-(LN(1-CC$1))/$A94 -> 2.7305784004667757 | CD94: =1-(LN(1-CD$1))/$A94 -> 2.7857324804533898 | CE94: =1-(LN(1-CE$1))/$A94 -> 2.8438692775182028 | CF94: =1-(LN(1-CF$1))/$A94 -> 2.9053299375611585 | CG94: =1-(LN(1-CG$1))/$A94 -> 2.9705177029551741 | CH94: =1-(LN(1-CH$1))/$A94 -> 3.0399139622428857 | CI94: =1-(LN(1-CI$1))/$A94 -> 3.1140998455621887 | CJ94: =1-(LN(1-CJ$1))/$A94 -> 3.1937858371253309 | CK94: =1-(LN(1-CK$1))/$A94 -> 3.2798532647312846 | CL94: =1-(LN(1-CL$1))/$A94 -> 3.3734138851502413 | CM94: =1-(LN(1-CM$1))/$A94 -> 3.4758979494559679 | CN94: =1-(LN(1-CN$1))/$A94 -> 3.5891888265073946 | CO94: =1-(LN(1-CO$1))/$A94 -> 3.7158372519443668 | CP94: =1-(LN(1-CP$1))/$A94 -> 3.8594193945513817 | CQ94: =1-(LN(1-CQ$1))/$A94 -> 4.0251728137204781 | CR94: =1-(LN(1-CR$1))/$A94 -> 4.2212174984451627 | CS94: =1-(LN(1-CS$1))/$A94 -> 4.4611568009335638 | CT94: =1-(LN(1-CT$1))/$A94 -> 4.7704923627096782 | CU94: =1-(LN(1-CU$1))/$A94 -> 5.2064763499227693 | CV94: =1-(LN(1-CV$1))/$A94 -> 5.9517958989119943
A95: =A94+0.01 -> 0.94000000000000061 | B95: =1-(LN(1-B$1))/$A95 -> 1.0106918466526611 | C95: =1-(LN(1-C$1))/$A95 -> 1.0214922418271484 | D95: =1-(LN(1-D$1))/$A95 -> 1.032403412217775 | E95: =1-(LN(1-E$1))/$A95 -> 1.0434276537449523 | F95: =1-(LN(1-F$1))/$A95 -> 1.054567334454841 | G95: =1-(LN(1-G$1))/$A95 -> 1.0658248975724336 | H95: =1-(LN(1-H$1))/$A95 -> 1.0772028647179102 | I95: =1-(LN(1-I$1))/$A95 -> 1.0887038392968627 | J95: =1-(LN(1-J$1))/$A95 -> 1.1003305100757885 | K95: =1-(LN(1-K$1))/$A95 -> 1.1120856549551343 | L95: =1-(LN(1-L$1))/$A95 -> 1.1239721449531399 | M95: =1-(LN(1-M$1))/$A95 -> 1.1359929484147711 | N95: =1-(LN(1-N$1))/$A95 -> 1.1481511354611782 | O95: =1-(LN(1-O$1))/$A95 -> 1.1604498826963654 | P95: =1-(LN(1-P$1))/$A95 -> 1.1728924781891221 | Q95: =1-(LN(1-Q$1))/$A95 -> 1.1854823267497636 | R95: =1-(LN(1-R$1))/$A95 -> 1.1982229555228652 | S95: =1-(LN(1-S$1))/$A95 -> 1.2111180199189768 | T95: =1-(LN(1-T$1))/$A95 -> 1.2241713099102687 | U95: =1-(LN(1-U$1))/$A95 -> 1.2373867567172443 | V95: =1-(LN(1-V$1))/$A95 -> 1.2507684399160317 | W95: =1-(LN(1-W$1))/$A95 -> 1.2643205949984038 | X95: =1-(LN(1-X$1))/$A95 -> 1.2780476214195824 | Y95: =1-(LN(1-Y$1))/$A95 -> 1.2919540911720855 | Z95: =1-(LN(1-Z$1))/$A95 -> 1.3060447579274264 | AA95: =1-(LN(1-AA$1))/$A95 -> 1.3203245667914056 | AB95: =1-(LN(1-AB$1))/$A95 -> 1.3347986647230852 | AC95: =1-(LN(1-AC$1))/$A95 -> 1.3494724116723786 | AD95: =1-(LN(1-AD$1))/$A95 -> 1.36435139249657 | AE95: =1-(LN(1-AE$1))/$A95 -> 1.3794414297220556 | AF95: =1-(LN(1-AF$1))/$A95 -> 1.3947485972242892 | AG95: =1-(LN(1-AG$1))/$A95 -> 1.4102792349063664 | AH95: =1-(LN(1-AH$1))/$A95 -> 1.4260399644650268 | AI95: =1-(LN(1-AI$1))/$A95 -> 1.4420377063421976 | AJ95: =1-(LN(1-AJ$1))/$A95 -> 1.4582796979706958 | AK95: =1-(LN(1-AK$1))/$A95 -> 1.4747735134344886 | AL95: =1-(LN(1-AL$1))/$A95 -> 1.49152708467719 | AM95: =1-(LN(1-AM$1))/$A95 -> 1.5085487244074465 | AN95: =1-(LN(1-AN$1))/$A95 -> 1.5258471508667872 | AO95: =1-(LN(1-AO$1))/$A95 -> 1.5434315146446709 | AP95: =1-(LN(1-AP$1))/$A95 -> 1.5613114277472042 | AQ95: =1-(LN(1-AQ$1))/$A95 -> 1.579496995150715 | AR95: =1-(LN(1-AR$1))/$A95 -> 1.5979988490995118 | AS95: =1-(LN(1-AS$1))/$A95 -> 1.6168281864393002 | AT95: =1-(LN(1-AT$1))/$A95 -> 1.6359968093144897 | AU95: =1-(LN(1-AU$1))/$A95 -> 1.6555171695998052 | AV95: =1-(LN(1-AV$1))/$A95 -> 1.6754024174850741 | AW95: =1-(LN(1-AW$1))/$A95 -> 1.6956664546879403 | AX95: =1-(LN(1-AX$1))/$A95 -> 1.716323992833793 | AY95: =1-(LN(1-AY$1))/$A95 -> 1.7373906176169629 | AZ95: =1-(LN(1-AZ$1))/$A95 -> 1.7588828594441115 | BA95: =1-(LN(1-BA$1))/$A95 -> 1.7808182713619154 | BB95: =1-(LN(1-BB$1))/$A95 -> 1.8032155151893967 | BC95: =1-(LN(1-BC$1))/$A95 -> 1.826094456913826 | BD95: =1-(LN(1-BD$1))/$A95 -> 1.8494762725720975 | BE95: =1-(LN(1-BE$1))/$A95 -> 1.8733835660317344 | BF95: =1-(LN(1-BF$1))/$A95 -> 1.897840500313329 | BG95: =1-(LN(1-BG$1))/$A95 -> 1.9228729443667267 | BH95: =1-(LN(1-BH$1))/$A95 -> 1.9485086375359402 | BI95: =1-(LN(1-BI$1))/$A95 -> 1.9747773743342076 | BJ95: =1-(LN(1-BJ$1))/$A95 -> 2.0017112126153673 | BK95: =1-(LN(1-BK$1))/$A95 -> 2.0293447087890488 | BL95: =1-(LN(1-BL$1))/$A95 -> 2.0577151844083694 | BM95: =1-(LN(1-BM$1))/$A95 -> 2.0868630292893422 | BN95: =1-(LN(1-BN$1))/$A95 -> 2.1168320473390194 | BO95: =1-(LN(1-BO$1))/$A95 -> 2.1476698525233302 | BP95: =1-(LN(1-BP$1))/$A95 -> 2.1794283239591614 | BQ95: =1-(LN(1-BQ$1))/$A95 -> 2.2121641310514524 | BR95: =1-(LN(1-BR$1))/$A95 -> 2.2459393420244105 | BS95: =1-(LN(1-BS$1))/$A95 -> 2.2808221322616342 | BT95: =1-(LN(1-BT$1))/$A95 -> 2.3168876127676787 | BU95: =1-(LN(1-BU$1))/$A95 -> 2.3542188040562637 | BV95: =1-(LN(1-BV$1))/$A95 -> 2.3929077872167692 | BW95: =1-(LN(1-BW$1))/$A95 -> 2.4330570723049041 | BX95: =1-(LN(1-BX$1))/$A95 -> 2.4747812352339271 | BY95: =1-(LN(1-BY$1))/$A95 -> 2.5182088889788794 | BZ95: =1-(LN(1-BZ$1))/$A95 -> 2.5634850745307904 | CA95: =1-(LN(1-CA$1))/$A95 -> 2.6107741836486986 | CB95: =1-(LN(1-CB$1))/$A95 -> 2.6602635619836912 | CC95: =1-(LN(1-CC$1))/$A95 -> 2.7121679919511719 | CD95: =1-(LN(1-CD$1))/$A95 -> 2.7667353264060131 | CE95: =1-(LN(1-CE$1))/$A95 -> 2.8242536469063069 | CF95: =1-(LN(1-CF$1))/$A95 -> 2.8850604701402949 | CG95: =1-(LN(1-CG$1))/$A95 -> 2.949554748668417 | CH95: =1-(LN(1-CH$1))/$A95 -> 3.0182127498785998 | CI95: =1-(LN(1-CI$1))/$A95 -> 3.0916094216732293 | CJ95: =1-(LN(1-CJ$1))/$A95 -> 3.1704476899218701 | CK95: =1-(LN(1-CK$1))/$A95 -> 3.2555995065958454 | CL95: =1-(LN(1-CL$1))/$A95 -> 3.3481648012656646 | CM95: =1-(LN(1-CM$1))/$A95 -> 3.4495586095681383 | CN95: =1-(LN(1-CN$1))/$A95 -> 3.5616442645232733 | CO95: =1-(LN(1-CO$1))/$A95 -> 3.6869453662853839 | CP95: =1-(LN(1-CP$1))/$A95 -> 3.8290000392901971 | CQ95: =1-(LN(1-CQ$1))/$A95 -> 3.9929901242128136 | CR95: =1-(LN(1-CR$1))/$A95 -> 4.1869492271851083 | CS95: =1-(LN(1-CS$1))/$A95 -> 4.4243359839023562 | CT95: =1-(LN(1-CT$1))/$A95 -> 4.7303807418297881 | CU95: =1-(LN(1-CU$1))/$A95 -> 5.1617266015193364 | CV95: =1-(LN(1-CV$1))/$A95 -> 5.8991172191363344
A96: =A95+0.01 -> 0.95000000000000062 | B96: =1-(LN(1-B$1))/$A96 -> 1.0105793008984225 | C96: =1-(LN(1-C$1))/$A96 -> 1.0212660077026521 | D96: =1-(LN(1-D$1))/$A96 -> 1.0320623236681143 | E96: =1-(LN(1-E$1))/$A96 -> 1.0429705205476369 | F96: =1-(LN(1-F$1))/$A96 -> 1.0539929414605795 | G96: =1-(LN(1-G$1))/$A96 -> 1.0651320039137764 | H96: =1-(LN(1-H$1))/$A96 -> 1.0763902029840373 | I96: =1-(LN(1-I$1))/$A96 -> 1.0877701146726853 | J96: =1-(LN(1-J$1))/$A96 -> 1.0992743994434118 | K96: =1-(LN(1-K$1))/$A96 -> 1.1109058059556065 | L96: =1-(LN(1-L$1))/$A96 -> 1.1226671750062647 | M96: =1-(LN(1-M$1))/$A96 -> 1.1345614436946156 | N96: =1-(LN(1-N$1))/$A96 -> 1.1465916498247448 | O96: =1-(LN(1-O$1))/$A96 -> 1.1587609365627196 | P96: =1-(LN(1-P$1))/$A96 -> 1.1710725573660787 | Q96: =1-(LN(1-Q$1))/$A96 -> 1.1835298812050292 | R96: =1-(LN(1-R$1))/$A96 -> 1.1961363980963089 | S96: =1-(LN(1-S$1))/$A96 -> 1.2088957249724612 | T96: =1-(LN(1-T$1))/$A96 -> 1.2218116119112132 | U96: =1-(LN(1-U$1))/$A96 -> 1.2348879487517996 | V96: =1-(LN(1-V$1))/$A96 -> 1.2481287721274419 | W96: =1-(LN(1-W$1))/$A96 -> 1.2615382729457889 | X96: =1-(LN(1-X$1))/$A96 -> 1.2751208043520079 | Y96: =1-(LN(1-Y$1))/$A96 -> 1.2888808902123792 | Z96: =1-(LN(1-Z$1))/$A96 -> 1.3028232341597692 | AA96: =1-(LN(1-AA$1))/$A96 -> 1.3169527292462331 | AB96: =1-(LN(1-AB$1))/$A96 -> 1.3312744682523159 | AC96: =1-(LN(1-AC$1))/$A96 -> 1.3457937547074061 | AD96: =1-(LN(1-AD$1))/$A96 -> 1.3605161146808167 | AE96: =1-(LN(1-AE$1))/$A96 -> 1.3754473094091919 | AF96: =1-(LN(1-AF$1))/$A96 -> 1.3905933488324544 | AG96: =1-(LN(1-AG$1))/$A96 -> 1.4059605061178786 | AH96: =1-(LN(1-AH$1))/$A96 -> 1.4215553332601316 | AI96: =1-(LN(1-AI$1))/$A96 -> 1.4373846778543848 | AJ96: =1-(LN(1-AJ$1))/$A96 -> 1.4534557011499518 | AK96: =1-(LN(1-AK$1))/$A96 -> 1.4697758975035993 | AL96: =1-(LN(1-AL$1))/$A96 -> 1.4863531153647984 | AM96: =1-(LN(1-AM$1))/$A96 -> 1.5031955799399999 | AN96: =1-(LN(1-AN$1))/$A96 -> 1.5203119176997686 | AO96: =1-(LN(1-AO$1))/$A96 -> 1.5377111829115691 | AP96: =1-(LN(1-AP$1))/$A96 -> 1.5554028864024967 | AQ96: =1-(LN(1-AQ$1))/$A96 -> 1.5733970267807074 | AR96: =1-(LN(1-AR$1))/$A96 -> 1.5917041243721486 | AS96: =1-(LN(1-AS$1))/$A96 -> 1.6103352581609918 | AT96: =1-(LN(1-AT$1))/$A96 -> 1.6293021060585477 | AU96: =1-(LN(1-AU$1))/$A96 -> 1.6486169888671758 | AV96: =1-(LN(1-AV$1))/$A96 -> 1.6682929183536521 | AW96: =1-(LN(1-AW$1))/$A96 -> 1.6883436499017517 | AX96: =1-(LN(1-AX$1))/$A96 -> 1.708783740277648 | AY96: =1-(LN(1-AY$1))/$A96 -> 1.7296286111157317 | AZ96: =1-(LN(1-AZ$1))/$A96 -> 1.7508946188183838 | BA96: =1-(LN(1-BA$1))/$A96 -> 1.7725991316633689 | BB96: =1-(LN(1-BB$1))/$A96 -> 1.7947606150295081 | BC96: =1-(LN(1-BC$1))/$A96 -> 1.8173987257884172 | BD96: =1-(LN(1-BD$1))/$A96 -> 1.8405344170713387 | BE96: =1-(LN(1-BE$1))/$A96 -> 1.8641900548103476 | BF96: =1-(LN(1-BF$1))/$A96 -> 1.8883895476784516 | BG96: =1-(LN(1-BG$1))/$A96 -> 1.9131584923207612 | BH96: =1-(LN(1-BH$1))/$A96 -> 1.9385243360881934 | BI96: =1-(LN(1-BI$1))/$A96 -> 1.964516559867532 | BJ96: =1-(LN(1-BJ$1))/$A96 -> 1.9911668840615211 | BK96: =1-(LN(1-BK$1))/$A96 -> 2.0185095013281114 | BL96: =1-(LN(1-BL$1))/$A96 -> 2.0465813403619655 | BM96: =1-(LN(1-BM$1))/$A96 -> 2.0754223658231385 | BN96: =1-(LN(1-BN$1))/$A96 -> 2.1050759205249241 | BO96: =1-(LN(1-BO$1))/$A96 -> 2.1355891172336108 | BP96: =1-(LN(1-BP$1))/$A96 -> 2.1670132889701175 | BQ96: =1-(LN(1-BQ$1))/$A96 -> 2.1994045086193319 | BR96: =1-(LN(1-BR$1))/$A96 -> 2.232824191055732 | BS96: =1-(LN(1-BS$1))/$A96 -> 2.2673397940273015 | BT96: =1-(LN(1-BT$1))/$A96 -> 2.30302563789644 | BU96: =1-(LN(1-BU$1))/$A96 -> 2.3399638692767244 | BV96: =1-(LN(1-BV$1))/$A96 -> 2.3782455999829084 | BW96: =1-(LN(1-BW$1))/$A96 -> 2.4179722610174843 | BX96: =1-(LN(1-BX$1))/$A96 -> 2.4592572222314644 | BY96: =1-(LN(1-BY$1))/$A96 -> 2.5022277427791018 | BZ96: =1-(LN(1-BZ$1))/$A96 -> 2.5470273369041503 | CA96: =1-(LN(1-CA$1))/$A96 -> 2.5938186659260807 | CB96: =1-(LN(1-CB$1))/$A96 -> 2.6427871034364943 | CC96: =1-(LN(1-CC$1))/$A96 -> 2.6941451709832647 | CD96: =1-(LN(1-CD$1))/$A96 -> 2.7481381124438444 | CE96: =1-(LN(1-CE$1))/$A96 -> 2.8050509769388721 | CF96: =1-(LN(1-CF$1))/$A96 -> 2.8652177283493443 | CG96: =1-(LN(1-CG$1))/$A96 -> 2.9290331197350654 | CH96: =1-(LN(1-CH$1))/$A96 -> 2.9969684051430354 | CI96: =1-(LN(1-CI$1))/$A96 -> 3.0695924803924584 | CJ96: =1-(LN(1-CJ$1))/$A96 -> 3.1476008721332187 | CK96: =1-(LN(1-CK$1))/$A96 -> 3.2318563538948362 | CL96: =1-(LN(1-CL$1))/$A96 -> 3.3234472770418155 | CM96: =1-(LN(1-CM$1))/$A96 -> 3.423773782099 | CN96: =1-(LN(1-CN$1))/$A96 -> 3.5346795880546074 | CO96: =1-(LN(1-CO$1))/$A96 -> 3.6586617308508012 | CP96: =1-(LN(1-CP$1))/$A96 -> 3.799221091508195 | CQ96: =1-(LN(1-CQ$1))/$A96 -> 3.9614849650105732 | CR96: =1-(LN(1-CR$1))/$A96 -> 4.1534023932147388 | CS96: =1-(LN(1-CS$1))/$A96 -> 4.3882903419665418 | CT96: =1-(LN(1-CT$1))/$A96 -> 4.6911135761263161 | CU96: =1-(LN(1-CU$1))/$A96 -> 5.1179189530822899 | CV96: =1-(LN(1-CV$1))/$A96 -> 5.8475475641980577
A97: =A96+0.01 -> 0.96000000000000063 | B97: =1-(LN(1-B$1))/$A97 -> 1.0104690998473973 | C97: =1-(LN(1-C$1))/$A97 -> 1.0210444867890827 | D97: =1-(LN(1-D$1))/$A97 -> 1.0317283411299047 | E97: =1-(LN(1-E$1))/$A97 -> 1.0425229109585992 | F97: =1-(LN(1-F$1))/$A97 -> 1.0534305149870318 | G97: =1-(LN(1-G$1))/$A97 -> 1.0644535455396744 | H97: =1-(LN(1-H$1))/$A97 -> 1.0755944717029535 | I97: =1-(LN(1-I$1))/$A97 -> 1.0868558426448447 | J97: =1-(LN(1-J$1))/$A97 -> 1.0982402911158762 | K97: =1-(LN(1-K$1))/$A97 -> 1.109750537143569 | L97: =1-(LN(1-L$1))/$A97 -> 1.1213893919332827 | M97: =1-(LN(1-M$1))/$A97 -> 1.1331597619894633 | N97: =1-(LN(1-N$1))/$A97 -> 1.1450646534724038 | O97: =1-(LN(1-O$1))/$A97 -> 1.1571071768068579 | P97: =1-(LN(1-P$1))/$A97 -> 1.1692905515601821 | Q97: =1-(LN(1-Q$1))/$A97 -> 1.1816181116091435 | R97: =1-(LN(1-R$1))/$A97 -> 1.1940933106161389 | S97: =1-(LN(1-S$1))/$A97 -> 1.2067197278373314 | T97: =1-(LN(1-T$1))/$A97 -> 1.2195010742871379 | U97: =1-(LN(1-U$1))/$A97 -> 1.2324411992856352 | V97: =1-(LN(1-V$1))/$A97 -> 1.2455440974177812 | W97: =1-(LN(1-W$1))/$A97 -> 1.2588139159359371 | X97: =1-(LN(1-X$1))/$A97 -> 1.2722549626400077 | Y97: =1-(LN(1-Y$1))/$A97 -> 1.285871714272667 | Z97: =1-(LN(1-Z$1))/$A97 -> 1.2996688254706048 | AA97: =1-(LN(1-AA$1))/$A97 -> 1.3136511383165848 | AB97: =1-(LN(1-AB$1))/$A97 -> 1.3278236925413542 | AC97: =1-(LN(1-AC$1))/$A97 -> 1.342191736429204 | AD97: =1-(LN(1-AD$1))/$A97 -> 1.3567607384862248 | AE97: =1-(LN(1-AE$1))/$A97 -> 1.3715363999361794 | AF97: =1-(LN(1-AF$1))/$A97 -> 1.3865246681154497 | AG97: =1-(LN(1-AG$1))/$A97 -> 1.4017317508458174 | AH97: =1-(LN(1-AH$1))/$A97 -> 1.4171641318720054 | AI97: =1-(LN(1-AI$1))/$A97 -> 1.4328285874600684 | AJ97: =1-(LN(1-AJ$1))/$A97 -> 1.4487322042629731 | AK97: =1-(LN(1-AK$1))/$A97 -> 1.4648823985712702 | AL97: =1-(LN(1-AL$1))/$A97 -> 1.4812869370797483 | AM97: =1-(LN(1-AM$1))/$A97 -> 1.4979539593156246 | AN97: =1-(LN(1-AN$1))/$A97 -> 1.514892001890396 | AO97: =1-(LN(1-AO$1))/$A97 -> 1.5321100247562403 | AP97: =1-(LN(1-AP$1))/$A97 -> 1.5496174396691373 | AQ97: =1-(LN(1-AQ$1))/$A97 -> 1.5674241410850749 | AR97: =1-(LN(1-AR$1))/$A97 -> 1.585540539743272 | AS97: =1-(LN(1-AS$1))/$A97 -> 1.6039775992218148 | AT97: =1-(LN(1-AT$1))/$A97 -> 1.6227468757871044 | AU97: =1-(LN(1-AU$1))/$A97 -> 1.6418605618998092 | AV97: =1-(LN(1-AV$1))/$A97 -> 1.6613315337874681 | AW97: =1-(LN(1-AW$1))/$A97 -> 1.6811734035486083 | AX97: =1-(LN(1-AX$1))/$A97 -> 1.7014005763164224 | AY97: =1-(LN(1-AY$1))/$A97 -> 1.7220283130832763 | AZ97: =1-(LN(1-AZ$1))/$A97 -> 1.7430727998723592 | BA97: =1-(LN(1-BA$1))/$A97 -> 1.7645512240418755 | BB97: =1-(LN(1-BB$1))/$A97 -> 1.7864818586229507 | BC97: =1-(LN(1-BC$1))/$A97 -> 1.8088841557281214 | BD97: =1-(LN(1-BD$1))/$A97 -> 1.8317788502268455 | BE97: =1-(LN(1-BE$1))/$A97 -> 1.8551880750727399 | BF97: =1-(LN(1-BF$1))/$A97 -> 1.8791354898901345 | BG97: =1-(LN(1-BG$1))/$A97 -> 1.9036464246924201 | BH97: =1-(LN(1-BH$1))/$A97 -> 1.9287480409206079 | BI97: =1-(LN(1-BI$1))/$A97 -> 1.9544695123689118 | BJ97: =1-(LN(1-BJ$1))/$A97 -> 1.9808422290192138 | BK97: =1-(LN(1-BK$1))/$A97 -> 2.0079000273559435 | BL97: =1-(LN(1-BL$1))/$A97 -> 2.0356794513998615 | BM97: =1-(LN(1-BM$1))/$A97 -> 2.0642200495124809 | BN97: =1-(LN(1-BN$1))/$A97 -> 2.0935647130194566 | BO97: =1-(LN(1-BO$1))/$A97 -> 2.1237600639290939 | BP97: =1-(LN(1-BP$1))/$A97 -> 2.1548569005433453 | BQ97: =1-(LN(1-BQ$1))/$A97 -> 2.186910711654547 | BR97: =1-(LN(1-BR$1))/$A97 -> 2.2199822723989016 | BS97: =1-(LN(1-BS$1))/$A97 -> 2.2541383378395174 | BT97: =1-(LN(1-BT$1))/$A97 -> 2.2894524541683521 | BU97: =1-(LN(1-BU$1))/$A97 -> 2.3260059123050918 | BV97: =1-(LN(1-BV$1))/$A97 -> 2.3638888749830862 | BW97: =1-(LN(1-BW$1))/$A97 -> 2.4032017166318855 | BX97: =1-(LN(1-BX$1))/$A97 -> 2.4440566261665535 | BY97: =1-(LN(1-BY$1))/$A97 -> 2.4865795371251527 | BZ97: =1-(LN(1-BZ$1))/$A97 -> 2.5309124688113984 | CA97: =1-(LN(1-CA$1))/$A97 -> 2.5772163881560175 | CB97: =1-(LN(1-CB$1))/$A97 -> 2.6256747377756975 | CC97: =1-(LN(1-CC$1))/$A97 -> 2.6764978254521892 | CD97: =1-(LN(1-CD$1))/$A97 -> 2.7299283404392214 | CE97: =1-(LN(1-CE$1))/$A97 -> 2.7862483625957588 | CF97: =1-(LN(1-CF$1))/$A97 -> 2.8457883770123722 | CG97: =1-(LN(1-CG$1))/$A97 -> 2.9089390247378253 | CH97: =1-(LN(1-CH$1))/$A97 -> 2.9761666509227953 | CI97: =1-(LN(1-CI$1))/$A97 -> 3.0480342253883701 | CJ97: =1-(LN(1-CJ$1))/$A97 -> 3.1252300297151643 | CK97: =1-(LN(1-CK$1))/$A97 -> 3.2086078502084319 | CL97: =1-(LN(1-CL$1))/$A97 -> 3.2992447012392963 | CM97: =1-(LN(1-CM$1))/$A97 -> 3.3985261385354688 | CN97: =1-(LN(1-CN$1))/$A97 -> 3.5082766756790384 | CO97: =1-(LN(1-CO$1))/$A97 -> 3.6309673378211054 | CP97: =1-(LN(1-CP$1))/$A97 -> 3.7700625384716511 | CQ97: =1-(LN(1-CQ$1))/$A97 -> 3.9306361632917133 | CR97: =1-(LN(1-CR$1))/$A97 -> 4.1205544516187516 | CS97: =1-(LN(1-CS$1))/$A97 -> 4.3529956509043899 | CT97: =1-(LN(1-CT$1))/$A97 -> 4.6526644763750014 | CU97: =1-(LN(1-CU$1))/$A97 -> 5.0750239639876833 | CV97: =1-(LN(1-CV$1))/$A97 -> 5.7970522770709945
A98: =A97+0.01 -> 0.97000000000000064 | B98: =1-(LN(1-B$1))/$A98 -> 1.0103611709829912 | C98: =1-(LN(1-C$1))/$A98 -> 1.0208275333170305 | D98: =1-(LN(1-D$1))/$A98 -> 1.0314012448295964 | E98: =1-(LN(1-E$1))/$A98 -> 1.0420845304332527 | F98: =1-(LN(1-F$1))/$A98 -> 1.0528796849356192 | G98: =1-(LN(1-G$1))/$A98 -> 1.0637890759980284 | H98: =1-(LN(1-H$1))/$A98 -> 1.0748151472524077 | I98: =1-(LN(1-I$1))/$A98 -> 1.0859604215866505 | J98: =1-(LN(1-J$1))/$A98 -> 1.097227504609527 | K98: =1-(LN(1-K$1))/$A98 -> 1.1086190883070373 | L98: =1-(LN(1-L$1))/$A98 -> 1.1201379549030428 | M98: =1-(LN(1-M$1))/$A98 -> 1.1317869809380257 | N98: =1-(LN(1-N$1))/$A98 -> 1.1435691415809357 | O98: =1-(LN(1-O$1))/$A98 -> 1.1554875151902924 | P98: =1-(LN(1-P$1))/$A98 -> 1.1675452881420358 | Q98: =1-(LN(1-Q$1))/$A98 -> 1.1797457599430698 | R98: =1-(LN(1-R$1))/$A98 -> 1.1920923486510242 | S98: =1-(LN(1-S$1))/$A98 -> 1.2045885966225136 | T98: =1-(LN(1-T$1))/$A98 -> 1.2172381766140747 | U98: =1-(LN(1-U$1))/$A98 -> 1.2300448982620718 | V98: =1-(LN(1-V$1))/$A98 -> 1.2430127149701751 | W98: =1-(LN(1-W$1))/$A98 -> 1.2561457312355666 | X98: =1-(LN(1-X$1))/$A98 -> 1.2694482104478428 | Y98: =1-(LN(1-Y$1))/$A98 -> 1.282924583197691 | Z98: =1-(LN(1-Z$1))/$A98 -> 1.2965794561358563 | AA98: =1-(LN(1-AA$1))/$A98 -> 1.3104176214267231 | AB98: =1-(LN(1-AB$1))/$A98 -> 1.3244440668450514 | AC98: =1-(LN(1-AC$1))/$A98 -> 1.3386639865691092 | AD98: =1-(LN(1-AD$1))/$A98 -> 1.3530827927286349 | AE98: =1-(LN(1-AE$1))/$A98 -> 1.3677061277718889 | AF98: =1-(LN(1-AF$1))/$A98 -> 1.3825398777225071 | AG98: =1-(LN(1-AG$1))/$A98 -> 1.3975901864041078 | AH98: =1-(LN(1-AH$1))/$A98 -> 1.4128634707186858 | AI98: =1-(LN(1-AI$1))/$A98 -> 1.4283664370738822 | AJ98: =1-(LN(1-AJ$1))/$A98 -> 1.4441060990643857 | AK98: =1-(LN(1-AK$1))/$A98 -> 1.4600897965241437 | AL98: =1-(LN(1-AL$1))/$A98 -> 1.4763252160789264 | AM98: =1-(LN(1-AM$1))/$A98 -> 1.4928204133432987 | AN98: =1-(LN(1-AN$1))/$A98 -> 1.5095838369224537 | AO98: =1-(LN(1-AO$1))/$A98 -> 1.5266243543979283 | AP98: =1-(LN(1-AP$1))/$A98 -> 1.5439512804972906 | AQ98: =1-(LN(1-AQ$1))/$A98 -> 1.5615744076718268 | AR98: =1-(LN(1-AR$1))/$A98 -> 1.5795040393335475 | AS98: =1-(LN(1-AS$1))/$A98 -> 1.5977510260339609 | AT98: =1-(LN(1-AT$1))/$A98 -> 1.6163268049027013 | AU98: =1-(LN(1-AU$1))/$A98 -> 1.6352434427049658 | AV98: =1-(LN(1-AV$1))/$A98 -> 1.65451368292368 | AW98: =1-(LN(1-AW$1))/$A98 -> 1.6741509973264577 | AX98: =1-(LN(1-AX$1))/$A98 -> 1.6941696425399644 | AY98: =1-(LN(1-AY$1))/$A98 -> 1.7145847222267476 | AZ98: =1-(LN(1-AZ$1))/$A98 -> 1.7354122555437781 | BA98: =1-(LN(1-BA$1))/$A98 -> 1.7566692526600005 | BB98: =1-(LN(1-BB$1))/$A98 -> 1.778373798224776 | BC98: =1-(LN(1-BC$1))/$A98 -> 1.8005451438133984 | BD98: =1-(LN(1-BD$1))/$A98 -> 1.8232038105337853 | BE98: =1-(LN(1-BE$1))/$A98 -> 1.8463717031647735 | BF98: =1-(LN(1-BF$1))/$A98 -> 1.8700722374170402 | BG98: =1-(LN(1-BG$1))/$A98 -> 1.8943304821698177 | BH98: =1-(LN(1-BH$1))/$A98 -> 1.9191733188492615 | BI98: =1-(LN(1-BI$1))/$A98 -> 1.9446296204888198 | BJ98: =1-(LN(1-BJ$1))/$A98 -> 1.9707304534623145 | BK98: =1-(LN(1-BK$1))/$A98 -> 1.9975093054244391 | BL98: =1-(LN(1-BL$1))/$A98 -> 2.0250023436534712 | BM98: =1-(LN(1-BM$1))/$A98 -> 2.0532487087958575 | BN98: =1-(LN(1-BN$1))/$A98 -> 2.0822908499986372 | BO98: =1-(LN(1-BO$1))/$A98 -> 2.1121749086308563 | BP98: =1-(LN(1-BP$1))/$A98 -> 2.1429511593006305 | BQ98: =1-(LN(1-BQ$1))/$A98 -> 2.174674518750892 | BR98: =1-(LN(1-BR$1))/$A98 -> 2.2074051355700472 | BS98: =1-(LN(1-BS$1))/$A98 -> 2.2412090766246768 | BT98: =1-(LN(1-BT$1))/$A98 -> 2.2761591298985753 | BU98: =1-(LN(1-BU$1))/$A98 -> 2.3123357482607094 | BV98: =1-(LN(1-BV$1))/$A98 -> 2.3498281649317141 | BW98: =1-(LN(1-BW$1))/$A98 -> 2.3887357195532064 | BX98: =1-(LN(1-BX$1))/$A98 -> 2.4291694444534961 | BY98: =1-(LN(1-BY$1))/$A98 -> 2.471253974886749 | BZ98: =1-(LN(1-BZ$1))/$A98 -> 2.5151298660401471 | CA98: =1-(LN(1-CA$1))/$A98 -> 2.5609564253915225 | CB98: =1-(LN(1-CB$1))/$A98 -> 2.6089152043965664 | CC98: =1-(LN(1-CC$1))/$A98 -> 2.6592143427155688 | CD98: =1-(LN(1-CD$1))/$A98 -> 2.712094027651188 | CE98: =1-(LN(1-CE$1))/$A98 -> 2.7678334310226065 | CF98: =1-(LN(1-CF$1))/$A98 -> 2.8267596308576053 | CG98: =1-(LN(1-CG$1))/$A98 -> 2.8892592409776414 | CH98: =1-(LN(1-CH$1))/$A98 -> 2.9557937988514267 | CI98: =1-(LN(1-CI$1))/$A98 -> 3.0269204704874593 | CJ98: =1-(LN(1-CJ$1))/$A98 -> 3.1033204417799563 | CK98: =1-(LN(1-CK$1))/$A98 -> 3.1858386971134993 | CL98: =1-(LN(1-CL$1))/$A98 -> 3.2755411476182728 | CM98: =1-(LN(1-CM$1))/$A98 -> 3.37379906494232 | CN98: =1-(LN(1-CN$1))/$A98 -> 3.4824181532493577 | CO98: =1-(LN(1-CO$1))/$A98 -> 3.603843963204393 | CP98: =1-(LN(1-CP$1))/$A98 -> 3.7415051927142113 | CQ98: =1-(LN(1-CQ$1))/$A98 -> 3.9004234193402523 | CR98: =1-(LN(1-CR$1))/$A98 -> 4.0883837871690734 | CS98: =1-(LN(1-CS$1))/$A98 -> 4.3184286854311491 | CT98: =1-(LN(1-CT$1))/$A98 -> 4.615008141567011 | CU98: =1-(LN(1-CU$1))/$A98 -> 5.0330134076579132 | CV98: =1-(LN(1-CV$1))/$A98 -> 5.747598129884695
A99: =A98+0.01 -> 0.98000000000000065 | B99: =1-(LN(1-B$1))/$A99 -> 1.0102554447484708 | C99: =1-(LN(1-C$1))/$A99 -> 1.0206150074668565 | D99: =1-(LN(1-D$1))/$A99 -> 1.0310808239639884 | E99: =1-(LN(1-E$1))/$A99 -> 1.0416550964492399 | F99: =1-(LN(1-F$1))/$A99 -> 1.0523400963138272 | G99: =1-(LN(1-G$1))/$A99 -> 1.063138167059273 | H99: =1-(LN(1-H$1))/$A99 -> 1.0740517273824852 | I99: =1-(LN(1-I$1))/$A99 -> 1.0850832744276031 | J99: =1-(LN(1-J$1))/$A99 -> 1.0962353872155524 | K99: =1-(LN(1-K$1))/$A99 -> 1.107510730263088 | L99: =1-(LN(1-L$1))/$A99 -> 1.1189120574040321 | M99: =1-(LN(1-M$1))/$A99 -> 1.1304422158264131 | N99: =1-(LN(1-N$1))/$A99 -> 1.1421041503403138 | O99: =1-(LN(1-O$1))/$A99 -> 1.1539009078924323 | P99: =1-(LN(1-P$1))/$A99 -> 1.1658356423446681 | Q99: =1-(LN(1-Q$1))/$A99 -> 1.1779116195354875 | R99: =1-(LN(1-R$1))/$A99 -> 1.1901322226443809 | S99: =1-(LN(1-S$1))/$A99 -> 1.2025009578814676 | T99: =1-(LN(1-T$1))/$A99 -> 1.215021460526176 | U99: =1-(LN(1-U$1))/$A99 -> 1.2276975013410303 | V99: =1-(LN(1-V$1))/$A99 -> 1.2405329933888467 | W99: =1-(LN(1-W$1))/$A99 -> 1.2535319992841831 | X99: =1-(LN(1-X$1))/$A99 -> 1.2666987389126607 | Y99: =1-(LN(1-Y$1))/$A99 -> 1.2800375976548573 | Z99: =1-(LN(1-Z$1))/$A99 -> 1.2935531351548784 | AA99: =1-(LN(1-AA$1))/$A99 -> 1.3072500946774708 | AB99: =1-(LN(1-AB$1))/$A99 -> 1.3211334131017347 | AC99: =1-(LN(1-AC$1))/$A99 -> 1.3352082316041183 | AD99: =1-(LN(1-AD$1))/$A99 -> 1.3494799070885466 | AE99: =1-(LN(1-AE$1))/$A99 -> 1.3639540244272776 | AF99: =1-(LN(1-AF$1))/$A99 -> 1.3786364095824815 | AG99: =1-(LN(1-AG$1))/$A99 -> 1.3935331436856986 | AH99: =1-(LN(1-AH$1))/$A99 -> 1.4086505781603318 | AI99: =1-(LN(1-AI$1))/$A99 -> 1.4239953509812915 | AJ99: =1-(LN(1-AJ$1))/$A99 -> 1.4395744041759735 | AK99: =1-(LN(1-AK$1))/$A99 -> 1.4553950026820606 | AL99: =1-(LN(1-AL$1))/$A99 -> 1.4714647546903659 | AM99: =1-(LN(1-AM$1))/$A99 -> 1.4877916336153059 | AN99: =1-(LN(1-AN$1))/$A99 -> 1.5043840018518164 | AO99: =1-(LN(1-AO$1))/$A99 -> 1.5212506364959086 | AP99: =1-(LN(1-AP$1))/$A99 -> 1.5384007572269101 | AQ99: =1-(LN(1-AQ$1))/$A99 -> 1.5558440565731346 | AR99: =1-(LN(1-AR$1))/$A99 -> 1.5735907328097358 | AS99: =1-(LN(1-AS$1))/$A99 -> 1.5916515257683082 | AT99: =1-(LN(1-AT$1))/$A99 -> 1.6100377558730821 | AU99: =1-(LN(1-AU$1))/$A99 -> 1.6287613667589969 | AV99: =1-(LN(1-AV$1))/$A99 -> 1.6478349718734382 | AW99: =1-(LN(1-AW$1))/$A99 -> 1.667271905517004 | AX99: =1-(LN(1-AX$1))/$A99 -> 1.6870862788405772 | AY99: =1-(LN(1-AY$1))/$A99 -> 1.7072930413876992 | AZ99: =1-(LN(1-AZ$1))/$A99 -> 1.7279080488545557 | BA99: =1-(LN(1-BA$1))/$A99 -> 1.7489481378369391 | BB99: =1-(LN(1-BB$1))/$A99 -> 1.7704312084469722 | BC99: =1-(LN(1-BC$1))/$A99 -> 1.7923763158153023 | BD99: =1-(LN(1-BD$1))/$A99 -> 1.8148037716507874 | BE99: =1-(LN(1-BE$1))/$A99 -> 1.8377352572141126 | BF99: =1-(LN(1-BF$1))/$A99 -> 1.8611939492801317 | BG99: =1-(LN(1-BG$1))/$A99 -> 1.8852046609231867 | BH99: =1-(LN(1-BH$1))/$A99 -> 1.909793999269167 | BI99: =1-(LN(1-BI$1))/$A99 -> 1.9349905427287299 | BJ99: =1-(LN(1-BJ$1))/$A99 -> 1.9608250406718828 | BK99: =1-(LN(1-BK$1))/$A99 -> 1.9873306390425571 | BL99: =1-(LN(1-BL$1))/$A99 -> 2.0145431360651704 | BM99: =1-(LN(1-BM$1))/$A99 -> 2.0425012729918182 | BN99: =1-(LN(1-BN$1))/$A99 -> 2.0712470658149775 | BO99: =1-(LN(1-BO$1))/$A99 -> 2.1008261850733985 | BP99: =1-(LN(1-BP$1))/$A99 -> 2.1312883923689911 | BQ99: =1-(LN(1-BQ$1))/$A99 -> 2.1626880440697605 | BR99: =1-(LN(1-BR$1))/$A99 -> 2.195084675003006 | BS99: =1-(LN(1-BS$1))/$A99 -> 2.2285436778836085 | BT99: =1-(LN(1-BT$1))/$A99 -> 2.2631370979608345 | BU99: =1-(LN(1-BU$1))/$A99 -> 2.298944567156008 | BV99: =1-(LN(1-BV$1))/$A99 -> 2.3360544081466967 | BW99: =1-(LN(1-BW$1))/$A99 -> 2.3745649469047043 | BX99: =1-(LN(1-BX$1))/$A99 -> 2.4145860827753993 | BY99: =1-(LN(1-BY$1))/$A99 -> 2.4562411792246395 | BZ99: =1-(LN(1-BZ$1))/$A99 -> 2.4996693572030031 | CA99: =1-(LN(1-CA$1))/$A99 -> 2.5450282986018129 | CB99: =1-(LN(1-CB$1))/$A99 -> 2.5924977023108875 | CC99: =1-(LN(1-CC$1))/$A99 -> 2.6422835841164303 | CD99: =1-(LN(1-CD$1))/$A99 -> 2.6946236804302579 | CE99: =1-(LN(1-CE$1))/$A99 -> 2.7497943143795185 | CF99: =1-(LN(1-CF$1))/$A99 -> 2.8081192264610992 | CG99: =1-(LN(1-CG$1))/$A99 -> 2.8699810854574617 | CH99: =1-(LN(1-CH$1))/$A99 -> 2.9358367192713097 | CI99: =1-(LN(1-CI$1))/$A99 -> 3.0062376085437097 | CJ99: =1-(LN(1-CJ$1))/$A99 -> 3.081857988292406 | CK99: =1-(LN(1-CK$1))/$A99 -> 3.1635342206123411 | CL99: =1-(LN(1-CL$1))/$A99 -> 3.252321339989515 | CM99: =1-(LN(1-CM$1))/$A99 -> 3.3495766255041328 | CN99: =1-(LN(1-CN$1))/$A99 -> 3.4570873557672215 | CO99: =1-(LN(1-CO$1))/$A99 -> 3.5772741268451642 | CP99: =1-(LN(1-CP$1))/$A99 -> 3.7135306499314131 | CQ99: =1-(LN(1-CQ$1))/$A99 -> 3.8708272620000455 | CR99: =1-(LN(1-CR$1))/$A99 -> 4.0568696668918385 | CS99: =1-(LN(1-CS$1))/$A99 -> 4.2845671682328721 | CT99: =1-(LN(1-CT$1))/$A99 -> 4.578120303387756 | CU99: =1-(LN(1-CU$1))/$A99 -> 4.9918602096205875 | CV99: =1-(LN(1-CV$1))/$A99 -> 5.6991532510083207
A100: =A99+0.01 -> 0.99000000000000066 | B100: =1-(LN(1-B$1))/$A100 -> 1.0101518543974761 | C100: =1-(LN(1-C$1))/$A100 -> 1.0204067750682015 | D100: =1-(LN(1-D$1))/$A100 -> 1.0307668762471804 | E100: =1-(LN(1-E$1))/$A100 -> 1.0412343378992477 | F100: =1-(LN(1-F$1))/$A100 -> 1.0518114084722732 | G100: =1-(LN(1-G$1))/$A100 -> 1.062500407796048 | H100: =1-(LN(1-H$1))/$A100 -> 1.0733037301361974 | I100: =1-(LN(1-I$1))/$A100 -> 1.0842238474131829 | J100: =1-(LN(1-J$1))/$A100 -> 1.0952633125972133 | K100: =1-(LN(1-K$1))/$A100 -> 1.1064247632907336 | L100: =1-(LN(1-L$1))/$A100 -> 1.117710925511062 | M100: =1-(LN(1-M$1))/$A100 -> 1.1291246176867524 | N100: =1-(LN(1-N$1))/$A100 -> 1.1406687548823309 | O100: =1-(LN(1-O$1))/$A100 -> 1.1523463532672562 | P100: =1-(LN(1-P$1))/$A100 -> 1.1641605348462372 | Q100: =1-(LN(1-Q$1))/$A100 -> 1.1761145324694724 | R100: =1-(LN(1-R$1))/$A100 -> 1.1882116951429227 | S100: =1-(LN(1-S$1))/$A100 -> 1.2004554936604426 | T100: =1-(LN(1-T$1))/$A100 -> 1.2128495265814672 | U100: =1-(LN(1-U$1))/$A100 -> 1.2253975265800099 | V100: =1-(LN(1-V$1))/$A100 -> 1.2381033671929997 | W100: =1-(LN(1-W$1))/$A100 -> 1.2509710699984844 | X100: =1-(LN(1-X$1))/$A100 -> 1.2640048122569771 | Y100: =1-(LN(1-Y$1))/$A100 -> 1.2772089350522831 | Z100: =1-(LN(1-Z$1))/$A100 -> 1.2905879519714958 | AA100: =1-(LN(1-AA$1))/$A100 -> 1.3041465583675973 | AB100: =1-(LN(1-AB$1))/$A100 -> 1.3178896412522223 | AC100: =1-(LN(1-AC$1))/$A100 -> 1.3318222898707432 | AD100: =1-(LN(1-AD$1))/$A100 -> 1.3459498070169453 | AE100: =1-(LN(1-AE$1))/$A100 -> 1.3602777211502346 | AF100: =1-(LN(1-AF$1))/$A100 -> 1.3748117993846787 | AG100: =1-(LN(1-AG$1))/$A100 -> 1.389558061426247 | AH100: =1-(LN(1-AH$1))/$A100 -> 1.4045227945425507 | AI100: =1-(LN(1-AI$1))/$A100 -> 1.4197125696582482 | AJ100: =1-(LN(1-AJ$1))/$A100 -> 1.4351342586792466 | AK100: =1-(LN(1-AK$1))/$A100 -> 1.4507950531600196 | AL100: =1-(LN(1-AL$1))/$A100 -> 1.4667024844409682 | AM100: =1-(LN(1-AM$1))/$A100 -> 1.4828644453969693 | AN100: =1-(LN(1-AN$1))/$A100 -> 1.4992892139543232 | AO100: =1-(LN(1-AO$1))/$A100 -> 1.5159854785515057 | AP100: =1-(LN(1-AP$1))/$A100 -> 1.5329623657397695 | AQ100: =1-(LN(1-AQ$1))/$A100 -> 1.550229470143103 | AR100: =1-(LN(1-AR$1))/$A100 -> 1.5677968870237788 | AS100: =1-(LN(1-AS$1))/$A100 -> 1.5856752477302445 | AT100: =1-(LN(1-AT$1))/$A100 -> 1.6038757583390104 | AU100: =1-(LN(1-AU$1))/$A100 -> 1.6224102418422393 | AV100: =1-(LN(1-AV$1))/$A100 -> 1.641291184278757 | AW100: =1-(LN(1-AW$1))/$A100 -> 1.6605317852592565 | AX100: =1-(LN(1-AX$1))/$A100 -> 1.6801460133977431 | AY100: =1-(LN(1-AY$1))/$A100 -> 1.7001486672322681 | AZ100: =1-(LN(1-AZ$1))/$A100 -> 1.7205554423004694 | BA100: =1-(LN(1-BA$1))/$A100 -> 1.7413830051315156 | BB100: =1-(LN(1-BB$1))/$A100 -> 1.7626490750283159 | BC100: =1-(LN(1-BC$1))/$A100 -> 1.784372514645451 | BD100: =1-(LN(1-BD$1))/$A100 -> 1.8065734305230017 | BE100: =1-(LN(1-BE$1))/$A100 -> 1.8292732849190205 | BF100: =1-(LN(1-BF$1))/$A100 -> 1.8524950204995243 | BG100: =1-(LN(1-BG$1))/$A100 -> 1.8762631997017407 | BH100: =1-(LN(1-BH$1))/$A100 -> 1.9006041608927107 | BI100: =1-(LN(1-BI$1))/$A100 -> 1.925546193812278 | BJ100: =1-(LN(1-BJ$1))/$A100 -> 1.9511197372307527 | BK100: =1-(LN(1-BK$1))/$A100 -> 1.9773576022845514 | BL100: =1-(LN(1-BL$1))/$A100 -> 2.0042952255998658 | BM100: =1-(LN(1-BM$1))/$A100 -> 2.0319709571030118 | BN100: =1-(LN(1-BN$1))/$A100 -> 2.0604263883825031 | BO100: =1-(LN(1-BO$1))/$A100 -> 2.0897067286585154 | BP100: =1-(LN(1-BP$1))/$A100 -> 2.1198612368905168 | BQ100: =1-(LN(1-BQ$1))/$A100 -> 2.1509437203922879 | BR100: =1-(LN(1-BR$1))/$A100 -> 2.1830131126292383 | BS100: =1-(LN(1-BS$1))/$A100 -> 2.2161341457837742 | BT100: =1-(LN(1-BT$1))/$A100 -> 2.250378137375372 | BU100: =1-(LN(1-BU$1))/$A100 -> 2.2858239149625135 | BV100: =1-(LN(1-BV$1))/$A100 -> 2.322558909074508 | BW100: =1-(LN(1-BW$1))/$A100 -> 2.3606804524915255 | BX100: =1-(LN(1-BX$1))/$A100 -> 2.4002973344645371 | BY100: =1-(LN(1-BY$1))/$A100 -> 2.4415316723637845 | BZ100: =1-(LN(1-BZ$1))/$A100 -> 2.48452118187772 | CA100: =1-(LN(1-CA$1))/$A100 -> 2.5294219521512895 | CB100: =1-(LN(1-CB$1))/$A100 -> 2.5764118669340097 | CC100: =1-(LN(1-CC$1))/$A100 -> 2.625694861044547 | CD100: =1-(LN(1-CD$1))/$A100 -> 2.6775062695168206 | CE100: =1-(LN(1-CE$1))/$A100 -> 2.7321196243352812 | CF100: =1-(LN(1-CF$1))/$A100 -> 2.7898553958907852 | CG100: =1-(LN(1-CG$1))/$A100 -> 2.8510923876245577 | CH100: =1-(LN(1-CH$1))/$A100 -> 2.9162828130160441 | CI100: =1-(LN(1-CI$1))/$A100 -> 2.9859725821947833 | CJ100: =1-(LN(1-CJ$1))/$A100 -> 3.0608291197237958 | CK100: =1-(LN(1-CK$1))/$A100 -> 3.1416803395960549 | CL100: =1-(LN(1-CL$1))/$A100 -> 3.2295706193835603 | CM100: =1-(LN(1-CM$1))/$A100 -> 3.3258435282768182 | CN100: =1-(LN(1-CN$1))/$A100 -> 3.4322682915675524 | CO100: =1-(LN(1-CO$1))/$A100 -> 3.5512410548568294 | CP100: =1-(LN(1-CP$1))/$A100 -> 3.6861212494270554 | CQ100: =1-(LN(1-CQ$1))/$A100 -> 3.8418290068283278 | CR100: =1-(LN(1-CR$1))/$A100 -> 4.025992195509092 | CS100: =1-(LN(1-CS$1))/$A100 -> 4.2513897220891055 | CT100: =1-(LN(1-CT$1))/$A100 -> 4.5419776740606075 | CU100: =1-(LN(1-CU$1))/$A100 -> 4.9515383893213896 | CV100: =1-(LN(1-CV$1))/$A100 -> 5.6516870565536914