A1: Buridan's Principal, Applied to Vehicle Accidents
A3: At .75 second reaction time …
A4: One accident in … | B4: Given this much time to respond …
B5: 10 | C5: 9 | D5: 8 | E5: 7 | F5: 6 | G5: 5 | H5: 4 | I5: 3 | J5: 2 | K5: 1
A6: 10000000 | B6: =-B$5/LN(1-(1-1/$A6)) -> 0.62042068841295628 | C6: =-C$5/LN(1-(1-1/$A6)) -> 0.55837861957166068 | D6: =-D$5/LN(1-(1-1/$A6)) -> 0.49633655073036503 | E6: =-E$5/LN(1-(1-1/$A6)) -> 0.43429448188906938 | F6: =-F$5/LN(1-(1-1/$A6)) -> 0.37225241304777379 | G6: =-G$5/LN(1-(1-1/$A6)) -> 0.31021034420647814 | H6: =-H$5/LN(1-(1-1/$A6)) -> 0.24816827536518252 | I6: =-I$5/LN(1-(1-1/$A6)) -> 0.18612620652388689 | J6: =-J$5/LN(1-(1-1/$A6)) -> 0.12408413768259126 | K6: =-K$5/LN(1-(1-1/$A6)) -> 6.2042068841295629E-2
A7: =A6/10 -> 1000000 | B7: =-B$5/LN(1-(1-1/$A7)) -> 0.72382413650692634 | C7: =-C$5/LN(1-(1-1/$A7)) -> 0.6514417228562337 | D7: =-D$5/LN(1-(1-1/$A7)) -> 0.57905930920554105 | E7: =-E$5/LN(1-(1-1/$A7)) -> 0.50667689555484841 | F7: =-F$5/LN(1-(1-1/$A7)) -> 0.43429448190415576 | G7: =-G$5/LN(1-(1-1/$A7)) -> 0.36191206825346317 | H7: =-H$5/LN(1-(1-1/$A7)) -> 0.28952965460277053 | I7: =-I$5/LN(1-(1-1/$A7)) -> 0.21714724095207788 | J7: =-J$5/LN(1-(1-1/$A7)) -> 0.14476482730138526 | K7: =-K$5/LN(1-(1-1/$A7)) -> 7.2382413650692631E-2
A8: =A7/10 -> 100000 | B8: =-B$5/LN(1-(1-1/$A8)) -> 0.86858896380616024 | C8: =-C$5/LN(1-(1-1/$A8)) -> 0.78173006742554429 | D8: =-D$5/LN(1-(1-1/$A8)) -> 0.69487117104492824 | E8: =-E$5/LN(1-(1-1/$A8)) -> 0.60801227466431218 | F8: =-F$5/LN(1-(1-1/$A8)) -> 0.52115337828369612 | G8: =-G$5/LN(1-(1-1/$A8)) -> 0.43429448190308012 | H8: =-H$5/LN(1-(1-1/$A8)) -> 0.34743558552246412 | I8: =-I$5/LN(1-(1-1/$A8)) -> 0.26057668914184806 | J8: =-J$5/LN(1-(1-1/$A8)) -> 0.17371779276123206 | K8: =-K$5/LN(1-(1-1/$A8)) -> 8.685889638061603E-2
A9: =A8/10 -> 10000 | B9: =-B$5/LN(1-(1-1/$A9)) -> 1.0857362047581165 | C9: =-C$5/LN(1-(1-1/$A9)) -> 0.97716258428230485 | D9: =-D$5/LN(1-(1-1/$A9)) -> 0.8685889638064932 | E9: =-E$5/LN(1-(1-1/$A9)) -> 0.76001534333068155 | F9: =-F$5/LN(1-(1-1/$A9)) -> 0.6514417228548699 | G9: =-G$5/LN(1-(1-1/$A9)) -> 0.54286810237905825 | H9: =-H$5/LN(1-(1-1/$A9)) -> 0.4342944819032466 | I9: =-I$5/LN(1-(1-1/$A9)) -> 0.32572086142743495 | J9: =-J$5/LN(1-(1-1/$A9)) -> 0.2171472409516233 | K9: =-K$5/LN(1-(1-1/$A9)) -> 0.10857362047581165
A10: =A9/10 -> 1000 | B10: =-B$5/LN(1-(1-1/$A10)) -> 1.4476482730108398 | C10: =-C$5/LN(1-(1-1/$A10)) -> 1.3028834457097558 | D10: =-D$5/LN(1-(1-1/$A10)) -> 1.1581186184086718 | E10: =-E$5/LN(1-(1-1/$A10)) -> 1.0133537911075878 | F10: =-F$5/LN(1-(1-1/$A10)) -> 0.86858896380650374 | G10: =-G$5/LN(1-(1-1/$A10)) -> 0.72382413650541988 | H10: =-H$5/LN(1-(1-1/$A10)) -> 0.5790593092043359 | I10: =-I$5/LN(1-(1-1/$A10)) -> 0.43429448190325187 | J10: =-J$5/LN(1-(1-1/$A10)) -> 0.28952965460216795 | K10: =-K$5/LN(1-(1-1/$A10)) -> 0.14476482730108398
A11: =A10/10 -> 100 | B11: =-B$5/LN(1-(1-1/$A11)) -> 2.1714724095162592 | C11: =-C$5/LN(1-(1-1/$A11)) -> 1.9543251685646335 | D11: =-D$5/LN(1-(1-1/$A11)) -> 1.7371779276130075 | E11: =-E$5/LN(1-(1-1/$A11)) -> 1.5200306866613815 | F11: =-F$5/LN(1-(1-1/$A11)) -> 1.3028834457097556 | G11: =-G$5/LN(1-(1-1/$A11)) -> 1.0857362047581296 | H11: =-H$5/LN(1-(1-1/$A11)) -> 0.86858896380650374 | I11: =-I$5/LN(1-(1-1/$A11)) -> 0.65144172285487778 | J11: =-J$5/LN(1-(1-1/$A11)) -> 0.43429448190325187 | K11: =-K$5/LN(1-(1-1/$A11)) -> 0.21714724095162594
A12: =A11/10 -> 10 | B12: =-B$5/LN(1-(1-1/$A12)) -> 4.3429448190325175 | C12: =-C$5/LN(1-(1-1/$A12)) -> 3.908650337129266 | D12: =-D$5/LN(1-(1-1/$A12)) -> 3.4743558552260141 | E12: =-E$5/LN(1-(1-1/$A12)) -> 3.0400613733227626 | F12: =-F$5/LN(1-(1-1/$A12)) -> 2.6057668914195107 | G12: =-G$5/LN(1-(1-1/$A12)) -> 2.1714724095162588 | H12: =-H$5/LN(1-(1-1/$A12)) -> 1.737177927613007 | I12: =-I$5/LN(1-(1-1/$A12)) -> 1.3028834457097553 | J12: =-J$5/LN(1-(1-1/$A12)) -> 0.86858896380650352 | K12: =-K$5/LN(1-(1-1/$A12)) -> 0.43429448190325176
A14: At 1 second reaction time …
A15: One accident in … | B15: Given this much time to respond …
B16: 10 | C16: 9 | D16: 8 | E16: 7 | F16: 6 | G16: 5 | H16: 4 | I16: 3 | J16: 2 | K16: 1
A17: 10000000 | B17: =-B$5/LN(1-(1-1/$A17)) -> 0.62042068841295628 | C17: =-C$5/LN(1-(1-1/$A17)) -> 0.55837861957166068 | D17: =-D$5/LN(1-(1-1/$A17)) -> 0.49633655073036503 | E17: =-E$5/LN(1-(1-1/$A17)) -> 0.43429448188906938 | F17: =-F$5/LN(1-(1-1/$A17)) -> 0.37225241304777379 | G17: =-G$5/LN(1-(1-1/$A17)) -> 0.31021034420647814 | H17: =-H$5/LN(1-(1-1/$A17)) -> 0.24816827536518252 | I17: =-I$5/LN(1-(1-1/$A17)) -> 0.18612620652388689 | J17: =-J$5/LN(1-(1-1/$A17)) -> 0.12408413768259126 | K17: =-K$5/LN(1-(1-1/$A17)) -> 6.2042068841295629E-2
A18: =A17/10 -> 1000000 | B18: =-B$5/LN(1-(1-1/$A18)) -> 0.72382413650692634 | C18: =-C$5/LN(1-(1-1/$A18)) -> 0.6514417228562337 | D18: =-D$5/LN(1-(1-1/$A18)) -> 0.57905930920554105 | E18: =-E$5/LN(1-(1-1/$A18)) -> 0.50667689555484841 | F18: =-F$5/LN(1-(1-1/$A18)) -> 0.43429448190415576 | G18: =-G$5/LN(1-(1-1/$A18)) -> 0.36191206825346317 | H18: =-H$5/LN(1-(1-1/$A18)) -> 0.28952965460277053 | I18: =-I$5/LN(1-(1-1/$A18)) -> 0.21714724095207788 | J18: =-J$5/LN(1-(1-1/$A18)) -> 0.14476482730138526 | K18: =-K$5/LN(1-(1-1/$A18)) -> 7.2382413650692631E-2
A19: =A18/10 -> 100000 | B19: =-B$5/LN(1-(1-1/$A19)) -> 0.86858896380616024 | C19: =-C$5/LN(1-(1-1/$A19)) -> 0.78173006742554429 | D19: =-D$5/LN(1-(1-1/$A19)) -> 0.69487117104492824 | E19: =-E$5/LN(1-(1-1/$A19)) -> 0.60801227466431218 | F19: =-F$5/LN(1-(1-1/$A19)) -> 0.52115337828369612 | G19: =-G$5/LN(1-(1-1/$A19)) -> 0.43429448190308012 | H19: =-H$5/LN(1-(1-1/$A19)) -> 0.34743558552246412 | I19: =-I$5/LN(1-(1-1/$A19)) -> 0.26057668914184806 | J19: =-J$5/LN(1-(1-1/$A19)) -> 0.17371779276123206 | K19: =-K$5/LN(1-(1-1/$A19)) -> 8.685889638061603E-2
A20: =A19/10 -> 10000 | B20: =-B$5/LN(1-(1-1/$A20)) -> 1.0857362047581165 | C20: =-C$5/LN(1-(1-1/$A20)) -> 0.97716258428230485 | D20: =-D$5/LN(1-(1-1/$A20)) -> 0.8685889638064932 | E20: =-E$5/LN(1-(1-1/$A20)) -> 0.76001534333068155 | F20: =-F$5/LN(1-(1-1/$A20)) -> 0.6514417228548699 | G20: =-G$5/LN(1-(1-1/$A20)) -> 0.54286810237905825 | H20: =-H$5/LN(1-(1-1/$A20)) -> 0.4342944819032466 | I20: =-I$5/LN(1-(1-1/$A20)) -> 0.32572086142743495 | J20: =-J$5/LN(1-(1-1/$A20)) -> 0.2171472409516233 | K20: =-K$5/LN(1-(1-1/$A20)) -> 0.10857362047581165
A21: =A20/10 -> 1000 | B21: =-B$5/LN(1-(1-1/$A21)) -> 1.4476482730108398 | C21: =-C$5/LN(1-(1-1/$A21)) -> 1.3028834457097558 | D21: =-D$5/LN(1-(1-1/$A21)) -> 1.1581186184086718 | E21: =-E$5/LN(1-(1-1/$A21)) -> 1.0133537911075878 | F21: =-F$5/LN(1-(1-1/$A21)) -> 0.86858896380650374 | G21: =-G$5/LN(1-(1-1/$A21)) -> 0.72382413650541988 | H21: =-H$5/LN(1-(1-1/$A21)) -> 0.5790593092043359 | I21: =-I$5/LN(1-(1-1/$A21)) -> 0.43429448190325187 | J21: =-J$5/LN(1-(1-1/$A21)) -> 0.28952965460216795 | K21: =-K$5/LN(1-(1-1/$A21)) -> 0.14476482730108398
A22: =A21/10 -> 100 | B22: =-B$5/LN(1-(1-1/$A22)) -> 2.1714724095162592 | C22: =-C$5/LN(1-(1-1/$A22)) -> 1.9543251685646335 | D22: =-D$5/LN(1-(1-1/$A22)) -> 1.7371779276130075 | E22: =-E$5/LN(1-(1-1/$A22)) -> 1.5200306866613815 | F22: =-F$5/LN(1-(1-1/$A22)) -> 1.3028834457097556 | G22: =-G$5/LN(1-(1-1/$A22)) -> 1.0857362047581296 | H22: =-H$5/LN(1-(1-1/$A22)) -> 0.86858896380650374 | I22: =-I$5/LN(1-(1-1/$A22)) -> 0.65144172285487778 | J22: =-J$5/LN(1-(1-1/$A22)) -> 0.43429448190325187 | K22: =-K$5/LN(1-(1-1/$A22)) -> 0.21714724095162594
A23: =A22/10 -> 10 | B23: =-B$5/LN(1-(1-1/$A23)) -> 4.3429448190325175 | C23: =-C$5/LN(1-(1-1/$A23)) -> 3.908650337129266 | D23: =-D$5/LN(1-(1-1/$A23)) -> 3.4743558552260141 | E23: =-E$5/LN(1-(1-1/$A23)) -> 3.0400613733227626 | F23: =-F$5/LN(1-(1-1/$A23)) -> 2.6057668914195107 | G23: =-G$5/LN(1-(1-1/$A23)) -> 2.1714724095162588 | H23: =-H$5/LN(1-(1-1/$A23)) -> 1.737177927613007 | I23: =-I$5/LN(1-(1-1/$A23)) -> 1.3028834457097553 | J23: =-J$5/LN(1-(1-1/$A23)) -> 0.86858896380650352 | K23: =-K$5/LN(1-(1-1/$A23)) -> 0.43429448190325176
A26: These table show the same data. The cells of the data indicate the minimum reaction time necessary to reach the
A27: safety level given. Average human reaction time for braking is .75. In the first table, the reaction times in green are
A28: above this number; in other words, one would only need (on average) this number to 'be safe.' Others are in red.
A29: The second table shows the same numbers, but with a reaction time of 1 second.